cluster,size,id,text,from_input,book
137439001369,4,Shamela0023588-ara1.ms1189,ولقد اخذناهم بالعذاب يعني القتل يوم بدر فما استكانوا لربهم بل اقاموا علي عتوهم واستكبارهم واستكان استفعل من الكون لان المفتقر انتقل من كون الي كون او افتعل من السكون اشبعت فتحته وما يتضرعون وليس من عادتهم التضرع وهو استشهاد علي ما قبله حتي اذا فتحنا عليهم بابا ذا عذاب شديد يعني الجوع فانه اشد من القتل والاسر اذا هم فيه مبلسون متحيرون ايسون من كل خير ,False,0685NasirDinBaydawi.AnwarTanzil
137439001369,4,Shia001432Vols-ara1.msC29087,فما استكانوا لربهم قيل استكان استفعل من الكون لان المفتقر انتقل من كون الي كون او افتعل من السكون اشبعت فتحته اي ما تذللوا ولا تضرعوا بل اقاموا علي عتوهم واستكبارهم وهو استشهاد علي ما قبله من قوله تعالي ولقد اخذناهم بالعذاب وانا اعلم الظاهر انه ,False,1111Majlisi.BiharAnwar
137439001369,4,Tafsir03037-ara1.ms1820,استفعل من الكون اي انتقل من كون الي كون كاستحال اذا انتقل من حال الي حال لان الخاضع ينتقل من كون الي كون وما يتضرعون اي وليس من حالهم التضرع اليه تعالي وعبر بالمضارع ليدل علي الاستمرار اي ليس شانهم التضرع في هذه الحالة وغيرها او فما استكانوا فيما مضي وما يتضرعون فيما ينزل بهم في المستقبل والمعني تالله لقد اخذناهم بالعذاب وقتلناهم بالسيوف وما جري عليهم يوم بدر من قتل صناديدهم فما وجدت بعد ذلك منهم استكانة ولا تضرع حتي اذا فتحنا عليهم بابا ذا عذاب شديد وهو عذاب الاخرة اذا هم فيه مبلسون متحيرون ايسون من كل خير ,False,1124IbnMuhammadIbnCajibaFasiSufi.BahrMadid
137439001369,4,Shamela0010273-ara1.ms2034,ولقد اخذناهم بالعذاب وهو ما اصابهم يوم بدر من القتل والاسر وهو قوله تعالي في الدخان يوم نبطش البطشة الكبري فما استكانوا لربهم بذلك اي لم يخضعوا ولم يتذللوا و استكانوا افتعل من السكون والالف زاءدة او استفعل من الكون اي انتقل من كون الي كون كاستحال اذا انتقل من حال الي حال لان الخاضع ينتقل من كون الي كون وما يتضرعون اي وليس من حالهم التضرع اليه تعالي وعبر بالمضارع ليدل علي الاستمرار اي ليس شانهم التضرع في هذه الحالة وغيرها او فما استكانوا فيما مضي وما يتضرعون فيما ينزل بهم في المستقبل والمعني تالله لقد اخذناهم بالعذاب وقتلناهم بالسيوف وما جري عليهم يوم بدر من قتل صناديدهم فما وجدت بعد ذلك منهم استكانة ولا تضرع حتي اذا فتحنا عليهم بابا ذا عذاب شديد وهو عذاب الاخرة اذا هم فيه مبلسون متحيرون ايسون من كل خير ,False,1224IbnCajiba.BahrMadid
137439001371,4,Tafsir03037-ara1.ms1820,استفعل من الكون اي انتقل من كون الي كون كاستحال اذا انتقل من حال الي حال لان الخاضع ينتقل من كون الي كون وما يتضرعون اي وليس من حالهم التضرع اليه تعالي وعبر بالمضارع ليدل علي الاستمرار اي ليس شانهم التضرع في هذه الحالة وغيرها او فما استكانوا فيما مضي وما يتضرعون فيما ينزل بهم في المستقبل والمعني تالله لقد اخذناهم بالعذاب وقتلناهم بالسيوف وما جري عليهم يوم بدر من قتل صناديدهم فما وجدت بعد ذلك منهم استكانة ولا تضرع حتي اذا فتحنا عليهم بابا ذا عذاب شديد وهو عذاب الاخرة اذا هم فيه مبلسون متحيرون ايسون من كل خير ,False,1124IbnMuhammadIbnCajibaFasiSufi.BahrMadid
137439001371,4,ShamIbadiyya0000075-ara1.ms0611,استفعل من الكون لان المفتقر انتقل من كون الي كون حتي اذا فتحنا عليهم بابا ذا عذاب شديد قيل هو عذاب الموت اذا هم فيه مبلسون متحيرون ايسون من كل خير مبشرون بكل شر وهو الذي انشا لكم السمع والابصار ,False,1207SacidKindi.TafsirMuyassar
137439001371,4,Shamela0010273-ara1.ms2034,استفعل من الكون اي انتقل من كون الي كون كاستحال اذا انتقل من حال الي حال لان الخاضع ينتقل من كون الي كون وما يتضرعون اي وليس من حالهم التضرع اليه تعالي وعبر بالمضارع ليدل علي الاستمرار اي ليس شانهم التضرع في هذه الحالة وغيرها او فما استكانوا فيما مضي وما يتضرعون فيما ينزل بهم في المستقبل والمعني تالله لقد اخذناهم بالعذاب وقتلناهم بالسيوف وما جري عليهم يوم بدر من قتل صناديدهم فما وجدت بعد ذلك منهم استكانة ولا تضرع حتي اذا فتحنا عليهم بابا ذا عذاب شديد وهو عذاب الاخرة اذا هم فيه مبلسون متحيرون ايسون من كل خير ,False,1224IbnCajiba.BahrMadid
137439001371,4,ShamAY0034054-ara1.ms2680,حتي اذا فتحنا عليهم بابا ذا عذاب شديد قيل هو عذاب الاخرة وقيل قتلهم يوم بدر بالسيف وقيل القحط الذي اصابهم وقيل فتح مكة اذا هم فيه مبلسون اي متحيرون لا يدرون ما يصنعون والابلاس التحير والاياس من كل خير وقرا السلمي مبلسون بفتح اللام من ابلسه اي ادخله في الابلاس وقد تقدم في الانعام المءمنون وهو الذي انشا وهو الذي انشا لكم السمع والابصار ,False,1281IbnMuhammadShawkani.TafsirFathQadir
137439027394,2,Tafsir06048-ara1.ms0762,بل قالوا مثل ما قال الاولون ثم اخبر بذلك القول فقال قالوا اءذا متنا وكنا ترابا وعظاما اءنا لمبعوثون لقد وعدنا نحن وءاباءنا هذا من قبل اي وعدنا ان نبعث نحن واباءنا فلم نبعث كقوله فاتوا بءاباءنا ان كنتم صادقين الدخان قوله ان هذا الا اساطير الاولين اي كذب الاولين ,False,0250HudHawari.Tafsir
137439027394,2,ShamAY0034054-ara1.ms2681,بل قالوا مثل ما قال الاولون اي اباءهم والموافقون لهم في دينهم المءمنون قالوا اءذا متنا ثم بين ما قاله الاولون فقال قالوا اءذا متنا وكنا ترابا وعظاما اءنا لمبعوثون فهذا مجرد استبعاد لم يتعلقوا له بشء من الشبه المءمنون لقد وعدنا نحن ثم كملوا ذلك القول بقولهم لقد وعدنا نحن واباءنا هذا من قبل اي وعدنا هذا البعث ووعده اباءنا الكاءنون من قبلنا فلم نصدقه كما لم يصدقه من قبلنا ثم صرحوا بالتكذيب وفروا الي مجرد الزعم الباطل فقالوا ان هذا الا اساطير الاولين اي ما هذا الا اكاذيب الاولين ,False,1281IbnMuhammadShawkani.TafsirFathQadir
137439054889,2,Shamela0011385-ara1.ms2119,الحميد و عن سليمان بن حرب عن جرير بن حازم و عن يحيي عن ابي معاوية و عن يحيي عن وكيع اربعتهم عن الاعمش وفي الاستسقاء ايضا الصلاة عن عثمان عن جرير عن منصور وفيهما التفسير والصلاة عن محمد بن كثير عن سفيان عن منصور والاعمش قال الصلاة وزاد اسباط عن منصور وفي التفسير ايضا عن بشر بن خالد عن غندر عن شعبة عن الاعمش ص ومنصور كلاهما عنه به م في التوبة عن اسحاق عن جرير عن منصور به و عن ابي بكر بن ابي شيبة عن ابي معاوية ووكيع و عن ابي سعيد الاشج عن وكيع و عن عثمان عن جرير و عن يحيي بن يحيي وابي كريب كلاهما عن ابي معاوية ثلاثتهم عن الاعمش به ت في التفسير الدخان عن محمود بن غيلان عن عبد الملك بن ابراهيم الجدي عن شعبة نحوه وقال حسن صحيح س فيه التفسير في الكبري عن بشر بن خالد به وعن ابي كريب به وعن ,False,0742Mizzi.TuhfatAshraf
137439054889,2,Shamela0005756-ara1.completed.ms04139,الحميدي وعن سليمان بن حرب وعن يحيي عن ابي معاوية وعن يحيي عن وكيع وعن محمد بن كثير عن سفيان وفي التفسير ايضا عن بشر بن خالد واخرجه مسلم في التوبة عن اسحاق عن جرير وعن ابي بكر بن ابي شيبة وعن ابي سعيد الاشج وعن عثمان عن جرير وعن يحيي ابن يحيي وابي كريب واخرجه الترمذي في التفسير عن محمود بن غيلان واخرجه النساءي عن بشر بن خالد به وعن ابي كريب به وعن ,False,0855BadrDinCayni.CumdatQari
137439071558,2,Shamela0010523-ara1.ms008,انه حين دعا النبي فقال اللهم سنين كسني يوسف فجاعوا حتي اكلوا العلهز وهو الوبر بالدم عن مجاهد وقيل انه القتل يوم بدر عن ابن عباس وقيل فتحنا عليهم بابا من عذاب جهنم في الاخرة ,False,0406IbnFurakIsbahani.Tafsir
137439071558,2,Shia002359Vols-ara1.ms3036,وذاك حين دعا النبي صلي الله عليه واله وسلم عليهم فقال اللهم سنين كسني يوسف فجاعوا حتي اكلوا العلهر وهو الوبر بالدم عن مجاهد وقيل هو القتل يوم بدر عن ابن عباس وقيل فتحنا عليهم بابا من عذاب جهنم في الاخرة ,False,0548IbnHasanTabarsi.TafsirMajmacBayan
137439071559,2,Shia002359Vols-ara1.ms3036,وهو خير الرازقين اي افضل من اعطي واجر وفي هذا دلالة علي ان في العباد من يرزق غيره باذن الله وانك لتدعوهم الي صراط مستقيم من التوحيد واخلاص العبادة والعمل بالشريعة وان الذين لا يءمنون بالاخرة اي لا يصدقون بالنشاة الاخرة عن الصراط لناكبون اي عن الدين الحق عادلون وماءلون وقيل معناه انهم في الاخرة ناكبون عن طريق الجنة يءخذ بهم يمنة ويسرة الي النار عن الجباءي ولو رحمناهم في الاخرة وكشفنا ما بهم من ضر ورددناهم الي دار التكليف للجوا في طغيانهم يعمهون مثل قوله ولو ردوا لعادوا عن الجباءي وابي مسلم وقيل انه في الدنيا اي ولو انا رحمناهم وكشفنا ما بهم من جوع ونحوه لتمادوا في ضلالتهم وغوايتهم يترددون عن ابن جريج ولقد اخذناهم بالعذاب معناه انا قد اخذنا هءلاء الكفار بالجدب وضيق الرزق والقتل بالسيف فما استكانوا لربهم اي ما تواضعوا ولا انقادوا وما يتضرعون اي وما يرغبون الي الله في الدعاء وقال ابو عبد الله عليه السلام الاستكانة الدعاء والتضرع رفع اليد في الصلاة حتي اذا فتحنا عليهم بابا ذا عذاب شديد اي هذا دابهم حتي اذا فتحنا عليهم نوعا اخر من العذاب وذاك حين دعا النبي صلي الله عليه واله وسلم عليهم فقال اللهم سنين كسني يوسف فجاعوا حتي اكلوا العلهر وهو الوبر بالدم عن مجاهد وقيل هو القتل يوم بدر عن ابن عباس وقيل فتحنا عليهم بابا من عذاب جهنم في الاخرة ,False,0548IbnHasanTabarsi.TafsirMajmacBayan
137439071559,2,Tafsir05047-ara1.ms0580,وهو خير الرازقين لانه يخلق الرزق ويعطي متفضلا وانك يا محمد لتدعوهم الي صراط مستقيم وان الذين لا يءمنون بالاخرة عن الصراط لناكبون النكب الميل وقيل ان الذين لا يءمنون بالنشاة الاخرة عن الصراط لناكبون لعادلون ولو رحمناهم ورددناهم الي دار التكليف للجوا في طغيانهم يعمهون نظيره لو ردوا لعادوا لما نهوا عنه وقيل هو في الدنيا والمعني لو كشف الله عنهم هذا الضر وهو الجوع والقحط الذي اصابهم برحمته عليهم ووجدوا الخصب لارتدوا الي ما كانوا عليه من الاستكبار وعداوة رسول الله صلي الله عليه واله وسلم والمءمنين يعمهون يترددون ولقد اخذناهم بالعذاب بالحدث وضيق الرزق والقتل بالسيف فما استكانوا لربهم اي ما خضعوا وما يتضرعون لكشف البلاء يعني مصاءب الدنيا حتي اذا فتحنا عليهم بابا ذا عذاب شديد بسنين كسني يوسف فجاعوا حتي اكلوا العلهن وقيل القتل يوم بدر وقيل بابا من عذاب جهنم في الاخرة ,False,0850Acqam.Tafsir
137439094364,2,Sham19Y0018106-ara1.ms0863,النبي صلي الله عليه وسلم اجعلها عليهم سنين كسني يوسف باب دعاء النبي صلي الله عليه وسلم اللهم اجعلها عليهم سنين كسني يوسف لفظ عليهم ساقط من نسخة وهو مع سنين ساقط من اخري و سنين جمع سنة شذوذا بتغيير مفرده من الفتح الي الكسر وكونه غير علم عاقل ومخالفته مجموع السلامة في جواز اعرابه بثلاثة اوجه بالحروف وبالحركات علي النون منونا وغير منون منصرفا وغير منصرف وسني يوسف هي السبع المجدبة واضيفت اليه لانه الذي قام بامور الناس فيها حدثنا قتيبة حدثنا مغيرة بن عبد الرحمن عن ابي الزناد عن الاعرج عن ابي هريرة ان النبي صلي الله عليه وسلم ,False,0926ZakariyyaAnsari.MinhatBari
137439094364,2,Sham19Y0023625-ara1.ms2299,النبي صلي الله عليه وسلم فانه لم يغز بعدها الا غزوة تبوك ولم يكن فيها قتال اه قوله علي مضر اي علي كفار قريش اولاد مضر قوله اجعلها اي الوطاة او السنين او الايام قوله سنين كسنين يوسف قال الشيخ زكريا في تحفة القارء سنين جمع سنة شذوذا بتغير مفرده من الفتح الي الكسر وكونه غير علم لعاقل ومخالفته لجموع السلامة في جواز اعرابه بثلاثة اوجه بالحروف وبالحركات علي النون منونا وغير منون منصرفا وغير منصرف اه وهو في الاصول التي وقفت عليها من الاذكار باثبات النون في قوله كسنين يوسف وبحذف الالف من قوله سنين الاول وهو محتمل لان يكون من لغة من اعربه بالحركات ومنع صرفه او اعربه بها وصرفه وحذف الالف علي لغة ربيعة وفي البخاري كسني يوسف بحذف نون الجمع للاضافة قال العراقي وهي لغة شاذة والصحيح اثباتها اه وسنين يوسف هي السبع المجدبة واضيفت اليه لانه هو الذي قام بامور الناس فيها ووقع للقرطبي في المفهم انه اول هذا الدعاء بحديث ابن مسعود فقال واستجيب له صلي الله عليه وسلم ,False,1057IbnCallan.FutuhatRabbaniyya
137439094365,2,Shamela0008176-ara1.ms1770,اشدد وطاتك بفتح الواو وسكون الطاء اي شدتك وعقوبتك علي مضر اي كفارهم قال الطيبي الوطء في الاصل الدوس بالقدم فسمي به الغزو والقتل ,False,1014MullaCaliQari.MirqatMafatih
137439094365,2,Sham19Y0023625-ara1.ms2299,اشدد وطاتك بفتح الواو وسكون المهملة وبالهمز اي خذهم اخذا شديدا قاله صاحب النهاية قال ومنه حديث خولة بنت حكم في مسند احمد اخر وطاة يطءها الله بوج قال والوطء في الاصل الدوس بالقدم فسمي به الغزو والقتل ,False,1057IbnCallan.FutuhatRabbaniyya
137439157473,2,Shia003700-ara1.ms102,السجن يوسف فقال له ايها الملك ارسلني الي السجن فان فيه رجلا لم ير مثله حلما وعلما وتفسيرا وقد كنت انا وفلان غضبت علينا وامرت بحبسنا راينا رءيا فعبرها لنا وكان كما قال ففلان صلب واما انا فنجوت فقال له الملك انطلق اليه فدخل وقال يا يوسف عربي القران الكريم سورة يوسف افتنا في سبع بقرات فلما بلغ رسالة يوسف الملك قال عربي القران الكريم سورة يوسف اءتوني به استخلصه لنفسي فلما بلغ يوسف رسالة الملك قال كيف ارجو كرامته وقد عرف براءتي وحبسني سنين فلما سمع الملك ارسل الي النسوة فقال ما خطبكن عربي القران الكريم سورة يوسف قلن حاش لله ما علمنا عليه من سوء فارسل اليه واخرجه من السجن فلما كلمه اعجبه كماله وعقله فقال له اقصص رءياي فاني اريد ان اسمعها منك فذكره يوسف كما راي وفسرها قال الملك صدقت فمن لي بجمع ذلك وحفظه فقال يوسف ان الله تعالي اوحي الي اني مدبره والقيم به في تلك السنين فقال له الملك صدقت دونك خاتمي وسريري وتاجي فاقبل يوسف علي جمع الطعام في السنين السبع الخصيبة يكبسه في الخزاءن في سنبله ثم اقبلت السنون الجدبة اقبل يوسف عليه السلام علي بيع الطعام فباعهم في السنة الاولي بالدراهم و الدينار حتي لم يبق بمصر وما حولها دينار ولا درهم الا صار في مملكة يوسف وباعهم في السنة الثانية بالحلي والجواهر حتي لم يبق بمصر حلي ولا جوهر الا صار في مملكته وباعهم في السنة الثالثة بالدواب والمواشي حتي لم يبق بمصر وما حولها دابة ولا ماشية الا صارت في مملكة يوسف وباعهم في السنة الرابعة بالعبيد والاماء حتي لم يبق بمصر وما حولها عبد ولا امة الا وصار في مملكة يوسف ,False,0573IbnHibatAllahQutbDinRawandi.QisasAnbiya
137439157473,2,Shia003749-ara1.ms211,السجن يوسف فقال ايها الملك ارسلني الي السجن فان فيه رجلا حليما عليما وقد كنت انا وفلان اغتضبت علينا وامرت بحبسنا راينا رءيا فعبرها لنا وكان كما قال ففلان صلب واما انا فنجيت فقال له الملك انطلق اليه فدخل وقال يوسف افتنا في سبع بقرات فلما بلغ رسالة يوسف الملك قال اءتوني به استخلصه لنفسي فلما بلغ يوسف رسالة الملك قال كيف ارجو كرامته وقد عرف براءتي وحبسني سنين فلما سمع الملك ارسل الي النسوة فقال ما خطبكن قلن حاش لله ما علمنا عليه من سوء فارسل اليه واخرجه من السجن فلما كلمه اعجبه كلامه وعقله فقال اقصص رءياي فاني اريد ان اسمعها منك فذكره يوسف كما راي وفسره قال الملك صدقت فمن لي بجمع ذلك وحفظه فقال يوسف ان الله اوحي الي اني مدبره والقيم في تلك السنين السبع الخصيبة يكبسه في الخزاءن في سنبله ثم اقبلت السنون الجدبة اقبل يوسف علي جميع الطعام فباعهم بالسنة الاولي بالدراهم والدنانير حتي لم يبق بمصر وما حولها درهم ولا دينار الا صار في مملكة يوسف وباعهم في السنة الثانية بالحلي والجواهر وباعهم في السنة الثالثة بالدواب والمواشي وباعهم في السنة الرابعة بالعبيد والاماء وباعهم في السنة الخامسة بالدور والعقار وباعهم في السنة السادسة بالمزارع والانهار وباعهم في السنة السابعة برقابهم حتي لم يبق بمصر وما حولها عبد ولا حر الا صار في مملكة يوسف ,False,1112NicmatAllahJazairi.QisasAnbiya
137439157474,2,Shia001432Vols-ara1.msA05635,فدخل وقال يوسف افتنا في سبع بقرات فلما بلغ رسالة يوسف الملك قال اءتوني به استخلصه لنفسي فلما بلغ يوسف رسالة الملك قال كيف ارجو كرامته وقد عرف براءتي وحبسني سنين فلما سمع الملك ارسل الي النسوة فقال ما خطبكن فقلن حاش لله ما علمنا عليه من سوء فارسل اليه واخرجه من السجن فلما كلمه اعجبه كما له وعقله فقال له اقصص رءياي فاني اريد ان اسمعها منك فذكره يوسف كما راي وفسره قال الملك صدقت فمن لي بجمع ذلك وحفظه فقال يوسف ان الله تعالي اوحي الي اني مدبره والقيم به في تلك السنين فقال له الملك صدقت دونك خاتمي وسريري وتاجي فاقبل يوسف علي جمع الطعام في السنين السبع الخصيبة يكبسه في الخزاءن في سنبله ثم اقبلت السنون الجدبة اقبل يوسف عليه السلام علي بيع الطعام فباعهم في السنة الاولي بالدراهم والدنانير حتي لم يبق بمصر وما حولها دينار ولا درهم الا صار في مملكة يوسف عليه السلام وباعهم في السنة الثانية بالحلي والجواهر حتي لم يبق بمصر وما حولها حلي ولا جواهر الا صار في مملكته وباعهم في السنة الثالثة بالدواب والمواشي حتي لم يبق بمصر وما حولها دابة ولا ماشية الا صارت في مملكة يوسف وباعهم في السنة الرابعة بالعبيد والاماء حتي لم يبق بمصر وما حولها عبد ولا امة الا صارت في مملكة يوسف وباعهم في السنة الخامسة بالدور والعقار حتي لم يبق بمصر وما حولها دار ولا عقار الا صار في مملكة يوسف وباعهم في السنة السادسة بالمزارع والانهار حتي لم يبق بمصر وما حولها نهر ولا مزرعة الا صار في مملكة يوسف عليه السلام وباعهم في السنة السابعة برقابهم حتي لم يبق بمصر وما حولها عبد ولا حر الا صار في مملكة يوسف وصاروا عبيدا له فقال يوسف للملك ما تري فيما خولني ربي قال الراي رايك قال اني اشهد الله واشهد ايها الملك اني اعتقت اهل مصر كلهم ورددت عليهم اموالهم وعبيدهم ,False,1111Majlisi.BiharAnwar
