cluster,size,id,text,from_input,book
146028936348,2,Tafsir03037-ara1.ms1816,معرضون اي فهم بما فعلوا من النكوص عن فخرهم وشرفهم معرضون وهذا مما جبلت عليه النفوس الامارة الاعراض عما فيه خيرها والرغبة فيما فيه هلاكها الا من عصم الله وفي اسناد الاتيان الي نون العظمة بعد اسناده الي ضميره عليه الصلاة والسلام ومن التنويه بشان النبي صلي الله عليه وسلم ما لا يخفي انظر ابا السعود ام تسالهم خرجا هذا انتقال من توبيخهم بما ذكر من قولهم ام يقولون به جنة الي التوبيخ بوجه اخر كانه قال ام يزعمون انك تسالهم عن اداء الرسالة خرجا اي جعلا فيتهمونك او يثقل عليهم فلذلك لا يءمنون فخراج ربك خير اي رزقه في الدنيا وثوابه في الاخرة خير لك من ذلك لدوامه وكثرته اي لا تسالهم ذلك فان ما رزقك الله في الدنيا والعقبي خير لك من ذلك وفي التعرض لعنوان الربوبية مع الاضافة الي ضميره عليه الصلاة والسلام من تعليل الحكم وتشريفه صلي الله عليه وسلم ما لا يخفي والخرج والخراج واحد وهو الاجر الماخوذ علي العمل ويطلق علي الغلة والضريبة كخراج العبد والارض وقال النضر بن شميل سالت ابا عمرو بن العلاء عن الفرق بين الخراج والخرج فقال الخراج ما لزمك والخرج ما تبرعت به وقيل الخرج اخص من الخراج لان الخراج يطلق علي كل ,False,1124IbnMuhammadIbnCajibaFasiSufi.BahrMadid
146028936348,2,Shamela0010273-ara1.ms2030,معرضون اي فهم بما فعلوا من النكوص عن فخرهم وشرفهم معرضون وهذا مما جبلت عليه النفوس الامارة الاعراض عما فيه خيرها والرغبة فيما فيه هلاكها الا من عصم الله وفي اسناد الاتيان الي نون العظمة بعد اسناده الي ضميره عليه الصلاة والسلام من التنويه بشان النبي صلي الله عليه وسلم ما لا يخفي انظر ابا السعود ام تسالهم خرجا هذا انتقال من توبيخهم بما ذكر من قولهم ام يقولون به جنة الي التوبيخ بوجه اخر كانه قال ام يزعمون انك تسالهم عن اداء الرسالة خرجا اي جعلا فيتهمونك او يثقل عليهم فلذلك لا يءمنون فخراج ربك خير اي رزقه في الدنيا وثوابه في الاخرة خير لك من ذلك لدوامه وكثرته اي لا تسالهم ذلك فان ما رزقك الله في الدنيا والعقبي خير لك من ذلك وفي التعرض لعنوان الربوبية مع الاضافة الي ضميره عليه الصلاة والسلام من تعليل الحكم وتشريفه صلي الله عليه وسلم ما لا يخفي والخرج والخراج واحد وهو الاجر الماخوذ علي العمل ويطلق علي الغلة والضربية كخراج العبد والارض وقال النضر بن شميل سالت ابا عمرو بن العلاء عن الفرق بين الخراج والخرج فقال الخراج مالزمك والخرج ما تبرعت به وقيل الخرج اخص من الخراج لان الخراج يطلق علي كل ,False,1224IbnCajiba.BahrMadid
146028936352,7,ShamAY0034052-ara1.ms1458,اي بالكتاب الذي هو ذكرهم اي وعظهم او وصيتهم وفخرهم او بالذكر الذي كانوا يتمنونه ويقولون لو ان عندنا ذكرا من الاولين لكنا عباد الله المخلصين وقرء بذكراهم ام تسالهم خرجا فخراج ربك خير وهو خير الرازقين المءمنون ام تسالهم ,False,0538JarAllahZamakhshari.Kashshaf
146028936352,7,Shamela0023588-ara1.ms1188,بل اتيناهم بذكرهم بالكتاب الذي هو ذكرهم اي وعظهم او صيتهم او الذكر الذي تمنوه بقولهم لو ان عندنا ذكرا من الاولين وقرء بذكراهم فهم عن ذكرهم معرضون لا يلتفتون اليه سورة المءمنون الايات الي ام تسالهم خرجا فخراج ربك خير وهو خير الرازقين وانك لتدعوهم الي صراط مستقيم ام تسالهم قيل انه قسيم قوله ام به جنة خرجا اجرا علي اداء الرسالة فخراج ربك ,False,0685NasirDinBaydawi.AnwarTanzil
146028936352,7,Shamela0001394-ara1.ms1056,السماوات المءمنون والارض كما قال لو كان فيهما الهة الا الله لفسدتا ومن فيهن خص العقلاء بالذكر لان غيرهم تبع بل اتيناهم بذكرهم بالكتاب الذي هو ذكرهم اي وعظهم او شرفهم لان الرسول منهم والقران بلغتهم او بالذكر الذي كانوا يتمنونه ويقولون لو ان عندنا ذكرا من الاولين الاية فهم عن ذكرهم معرضون بسوء اختيارهم ام تسالهم خرجا فخراج ربك خير وهو خير الرازقين ام تسالهم ,False,0710IbnAhmadHafizDinNasafi.Tafsir
146028936352,7,Tafsir03037-ara1.ms1815,العقلاء بالذكر حيث عبر بمن لان غيرهم تبع بل اتيناهم بذكرهم بشرفهم وهو القران الذي فيه فخرهم وشرفهم كما قال تعالي وانه لذكر لك ولقومك الزخرف لان الرسول منهم والقران لغتهم او بتذكيرهم ووعظهم او بالذكر الذي كانوا يتمنونه ويقولون لو ان عندنا ذكرا من الاولين الصافات فهم عن ذكرهم ,False,1124IbnMuhammadIbnCajibaFasiSufi.BahrMadid
146028936352,7,Shamela0010273-ara1.ms2030,العقلاء بالذكر حيث عبر بمن لان غيرهم تبع بل اتيناهم بذكرهم بشرفهم وهو القران الذي فيه فخرهم وشرفهم كما قال تعالي وانه لذكر لك ولقومك لان الرسول منهم والقران لغتهم او بتذكيرهم ووعظهم او بالذكر الذي كانوا يتمنونه ويقولون لو ان عندنا ذكرا من الاولين فهم عن ذكرهم معرضون ,False,1224IbnCajiba.BahrMadid
146028936352,7,Shamela0037458-ara1.ms2810,السماوات والارض ما فيهما من المخلوقات وخص العقلاء بالذكر لان غيرهم تبع وقرا ابن مسعود وما بينهما وسبب فساد المكلفين من بني ادم ظاهر وهو ذنوبهم التي من جملتها الهوي المخالف للحق واما فساد ما عداهم فعلي وجه التبع لانهم مدبرون في الغالب بذوي العقول فلما فسدوا فسدوا ثم ذكر سبحانه ان نزول القران عليهم من جملة الحق فقال بل اتيناهم بذكرهم اضراب وانتقال عن قوله واكثرهم للحق كارهون اي كيف يكرهون الحق مع ان القران اتاهم بتشريفهم وتعظيمهم فاللاءق بهم الانقياد فالمراد بالذكر هنا القران اي اتيناهم بالكتاب الذي هو فخرهم وشرفهم لان الرسول منهم والقران بلغتهم ومثله قوله وانه لذكر لك ولقومك وحاصل المعني بل اتيناهم بفخرهم وشرفهم الذي كان يجب عليهم ان يقبلوه ويقبلوا عليه وقال قتادة المعني بذكرهم الذي ذكر فيه ثوابهم وعقابهم وقيل المعني بذكر ما لهم به حاجة من امر الدين وقرء اتيتهم بتاء التكلم واتيتهم بتاء الخطاب اي اتيتهم يا محمد وقرء بذكراهم ونذكرهم بصيغة التكلم من التذكير وقيل الذكر هو الوعظ وقيل الذي كانوا يتمنونه ويقولون لو ان عندنا ذكرا من الاولين وقال ابن عباس اتيناهم بينا لهم فهم بما فعلوا من الاستكبار والنكوص عن ذكرهم المختص بهم معرضون بسوء اختيارهم ,False,1307Qannawji.FathBayan
146028936352,7,Tafsir06049-ara1.ms4693,بل اتيناهم بذكرهم اي بالكتاب الذي هو ذكرهم يوعظون به او بشرفهم وفخرهم لو عملوا به او مطلقا من حيث انه علي لغتهم وعلي نبي منهم او بالذكر الذي يتمنونه لو ان عندنا ذكرا من الاولين لكنا عباد الله المخلصين والاولان روايتان عن ابن عباس رضي الله عنهما والاول ايضا قول الحسن وقرء بذكراهم فهم عن ذكرهم معرضون ام تسالهم خرجا اجرا علي ما جءتهم به من الايات والايمان وام هذه بمعني بل وهمزة الانكار وذكر بعضهم ان هذا قسيم قوله ام به جنة فخراج ربك ,False,1332QutbAtfayyish.HamayanZad
146028936991,3,Shia002508Vols-ara1.ms553,غطاه ونهر غمر يغطي من دخله ورجل غمر تغمره اراء الناس وقيل غمرة لانها تغطي الوجه ومنه دخل في غمار الناس في قول من قاله معناه فيما يغطيه من الجمع وقوله من هذا فيه قولان احدهما ان مجاهد قال بل قلوبهم في عماية من القران فعلي قول مجاهد هذا اشارة الي القران وقال قتادة وصف اهل البر فقال والذين هم من خشية ربهم مشفقون والذين والذين ثم وصف اهل الكفر فقال بل قلوبهم في غمرة من هذا فالمعني علي قول قتادة من هذا البر ثم قال تعالي ولهم اعمال من دون ذلك هم لها عاملون اية فيه قولان احدهما ان الحسن قال ولهم اعمال ردية لم يعملوها وسيعملونها قال مجاهد اي لهم خطايا لا بد ان يعملوها ب وقال قتادة رجع الي اهل البر فقال ولهم اعمال من دون ,False,0338AbuJacfarNahhas.MacaniQuran
146028936991,3,Shia002616Vols-ara1.ms4314,غمره الماء اذا غطاه ونهر غمر يغطي من دخله ورجل غمر يغمره اراء الناس وقيل غمرة لانها تغطي الوجه ومنه دخل في غمار الناس وخمارهم اي فيما يغطيه من الجمع وقيل بل قلوبهم في غمرة اي في حيرة وعمي اي مما وصف من اعمال البر في الايات المتقدمة قال قتادة او من الكتاب الذي ينطق بالحق ولهم اعمال من دون ذلك هم لها عاملون قال قتادة ومجاهد اي لهم خطايا لا بد ان يعملوها من دون الحق وقال الحسن وابن زيد المعني ولهم اعمال رديءة لم يعملوها من دون ما هم عليه لا بد ,False,0671AbuCabdAllahQurtubi.JamicLiAhkamQuran
146028936991,3,Shamela0037458-ara1.ms2805,غمره الماء اذا غطاه ونهر غمر يغطي من دخله والمراد بها هنا الغطاء والغفلة او الحيرة والعمي والجهالة قال ابن عباس يعني بالغمرة الكفر والشك ولهم اي للكفار اعمال من دون ذلك قال ابن عباس يقول اعمال سيءة دون الشرك منها اقامة اماءهم في الزنا وقال قتادة ومجاهد اي لهم خطايا لا بد ان يعملوها من دون الحق وقال الحسن وابن زيد لهم اعمال سيءة لم يعملوها من دون ما هم عليه لا بد ,False,1307Qannawji.FathBayan
146028936992,2,Shamela0023632-ara1.completed.ms2543,يراوح من صلوات المليك فطورا سجودا وطورا جءارا وذهب مجاهد وغيره الي ان هذا العذاب المذكور هو الوعيد بيوم بدر وفيه نفذ علي مترفيهم والضمير في قوله اذا هم يحتمل ان يعود علي المترفين فقط لانهم صاحوا حين نزل بهم الهزم والقتل يوم بدر ويحتمل ان يعود علي الباقين بعد المعذبين وقد حكي ذلك الطبري عن ابن جريج قال المعذبون قتلي بدر والذين يجارون قتلي مكة لانهم ناحوا واستغاثوا قوله عز وجل سورة المءمنون الايات الي لا تجاروا اليوم انكم منا لا تنصرون ,False,0541IbnCatiyyaAndalusi.MuharrarWajiz
146028936992,2,Shia002616Vols-ara1.ms4314,يراوج من صلوات المليك فطورا سجودا وطورا جءارا وقال ابن جريج حتي اذا اخذنا مترفيهم بالعذاب هم الذين قتلوا ببدر اذا هم يجارون هم الذين بمكة فجمع بين القولين المتقدمين وهو حسن لا تجاروا اليوم انكم منا اي من عذابنا لا تنصرون ,False,0671AbuCabdAllahQurtubi.JamicLiAhkamQuran
146028936996,4,Shamela0007370-ara1.ms2466,ولهم اعمال من دون ذلك قال قتادة وابو العالية خطايا من دون الحق وعن الحسن ومجاهد اعمال لهم من دون ما هم عليه لا بد من ان يعملوها ,False,0370IbnCaliJassas.AhkamQuran
146028936996,4,Shia002616Vols-ara1.ms4314,غمره الماء اذا غطاه ونهر غمر يغطي من دخله ورجل غمر يغمره اراء الناس وقيل غمرة لانها تغطي الوجه ومنه دخل في غمار الناس وخمارهم اي فيما يغطيه من الجمع وقيل بل قلوبهم في غمرة اي في حيرة وعمي اي مما وصف من اعمال البر في الايات المتقدمة قال قتادة او من الكتاب الذي ينطق بالحق ولهم اعمال من دون ذلك هم لها عاملون قال قتادة ومجاهد اي لهم خطايا لا بد ان يعملوها من دون الحق وقال الحسن وابن زيد المعني ولهم اعمال رديءة لم يعملوها من دون ما هم عليه لا بد ان يعملوها دون اعمال المءمنين فيدخلون بها النار ,False,0671AbuCabdAllahQurtubi.JamicLiAhkamQuran
146028936996,4,Shamela0023623-ara1.ms2769,غمره الماء اذا غطاه ونهر غمر يغطي من دخله والمراد بها هنا الغطاء والغفلة او الحيرة والعمي وقد تقدم الكلام علي الغمرة قريبا ولهم اعمال من دون ذلك قال قتادة ومجاهد اي لهم خطايا لا بد ان يعملوها من دون الحق وقال الحسن وابن زيد المعني ولهم اعمال رديءة لم يعملوها من دون ما هم عليه لا بد ان يعملوها فيدخلون بها النار ,False,1250Shawkani.FathQadir
146028936996,4,ShamAY0034054-ara1.ms2672,غمره الماء اذا غطاه ونهر غمر يغطي من دخله والمراد بها هنا الغطاء او الحيرة والعمي وقد تقدم الكلام علي الغمرة قريبا ولهم اعمال من دون ذلك قال قتادة ومجاهد اي لهم خطايا لا بد ان يعملوها من دون الحق وقال الحسن وابن زيد المعني ولهم اعمال رديءة لم يعملوها من دون ما هم عليه لا بد ان يعملوها فيدخلون بها النار ,False,1281IbnMuhammadShawkani.TafsirFathQadir
146028941412,8,JK000110-ara1.completed.ms1292,وقال قتادة في ام الكتاب جملة الكتاب اصل الكتاب افنضرب عنكم الذكر صفحا ان كنتم قوما مسرفين مشركين والله لو ان هذا القران رفع حيث رده اواءل هذه الامة لهلكوا فاهلكنا اشد منهم بطشا ومضي مثل الاولين عقوبة الاولين جزءا عدلا ,False,0256Bukhari.Sahih
146028941412,8,Sham19Y0013605-ara1.ms3605,الكتاب جملة الكتاب اصل الكتاب افنضرب عنكم الذكر صفحا ان كنتم قوما مسرفين مشركين والله لو ان هذا القران رفع حيث رده اواءل هذه الامة لهلكوا فاهلكنا اشد منهم بطشا ومضي مثل الاولين عقوبة الاولين جزءا عدلا ,False,0786ShamsDinKirmani.Kawakib
146028941412,8,Sham19Y0018103-ara1.ms3007,اي ما كان فانا اول الانفين وهما لغتان رجل عابد وعبد وقرا عبد الله وقال الرسول يارب ويقال اول العابدين الجاحدين من عبد يعبد وقال قتادة في ام الكتاب جملة الكتاب اصل الكتاب افنضرب عنكم الذكر صفحا ان كنتم قوما مسرفين مشركين والله لو ان هذا القران رفع حيث رده اواءل هذه الامة لهلكوا فاهلكنا اشد منهم بطشا ومضي مثل الاولين عقوبة الاولين جزءا عدلا ,False,0831ShamsDinBirmawi.Lamic
146028941412,8,Shamela0001673-ara1.ms07057,وقرا عبد الله وقال الرسول يا رب تقدمت الاشارة الي اسناد قراءة عبد الله وهو بن مسعود واخرج الطبري من وجهين عن قتادة في قوله وقيله يا رب قال هو قول الرسول صلي الله عليه وسلم قوله ويقال اول العابدين اول الجاحدين من عبد يعبد وقال بن التين كذا ضبطوه ولم ار في اللغة عبد بمعني جحد انتهي وقد ذكرها الفربري تنبيه ضبطت عبد يعبد هنا بكسر الموحدة في الماضي وفتحها في المستقبل قوله افنضرب عنكم الذكر صفحا ان كنتم قوما مسرفين مشركين والله لو ان هذا القران رفع حيث رده اواءل هذه الامة لهلكوا وصله بن ابي حاتم من طريق سعيد بن ابي عروبة عن قتادة بلفظه وزاد ولكن الله عاد عليهم بعاءدته ورحمته فكرره عليهم ودعاهم اليه قوله فاهلكنا اشد منهم بطشا ومضي مثل الاولين عقوبة الاولين وصله عبد الرزاق عن معمر عن قتادة بهذا قوله جزءا عدلا وصله عبد الرزاق عن معمر عن قتادة بهذا وهو بكسر العين وكذا اخرجه البخاري في كتاب خلق افعال العباد من طريق سعيد بن ابي عروبة عن قتادة مثله واما ابو عبيدة فقال جزءا اي نصيبا وقيل جزءا اناثا تقول جزات المراة اذا اتت بانثي قوله سورة حم الدخان بسم الله الرحمن الرحيم سقطت سورة والبسملة لغير ابي ذر قوله وقال مجاهد رهوا طريقا يابسا ,False,0852IbnHajarCasqalani.FathBari
146028941412,8,Shamela0000347-ara1.mARkdown.ms0808,وقال قتادة في ام الكتاب جملة الكتاب اصل الكتاب افنضرب عنكم الذكر صفحا ان كنتم قوما مسرفين مشركين والله لو ان هذا القران رفع حيث رده اواءل هذه الامة لهلكوا فاهلكنا اشد منهم بطشا ومضي مثل الاولين عقوبة الاولين جزءا عدلا ,False,0852IbnHajarCasqalani.TaghliqTacliq
146028941412,8,Shamela0005756-ara1.completed.ms11925,اي ما كان للرحمن ولد وانا اول العابدين قوله وقرا عبد الله يعني ابن مسعود وقال الرسول يا رب موضع وقيله يا رب الزخرف وكان ينبغي ان يذكر هذا عند قوله وقيله يا رب علي ما لا يخفي وقال قتادة في ام الكتاب جملة الكتاب اصل الكتاب اشار به الي قوله تعالي وانه في ام الكتاب لدينا لعلي حكيم الزخرف وفسر قتادة بقوله جملة الكتاب واصله وقال المفسرون ام الكتاب اللوح المحفوظ الذي عند الله تعالي منه نسخ باب افنضرب عنكم الذكر صفحا ان كنتم قوما مسرفين الزخرف مشركين والله لو ان هذا القران رفع حيث رده اواءل هذه الامة لهلكوا ,False,0855BadrDinCayni.CumdatQari
146028941412,8,Sham19Y0016584-ara1.ms3361,والله لو ان هذا القران رفع حيث رده اواءل هذه الامة لهلكوا فاهلكنا اشد منهم بطشا ومضي مثل الاولين عقوبة الاولين جزءا عدلا سورة حم الدخان وقال مجاهد رهوا طريقا يابسا ,False,0893IbnIsmacilShihabDinKurani.KawtharJari
146028941412,8,Sham19Y0018106-ara1.ms3133,وقال قتادة في ام الكتاب جملة الكتاب اصل الكتاب فسر ام الكتاب بما بعده فقوله اصل الكتاب تفسير ب جملة الكتاب وقال غيره من المفسرين ام الكتاب اللوح المحفوظ والذي عند الله منه نسخ باب افنضرب عنكم الذكر صفحا ان كنتم قوما مسرفين الزخرف مشركين والله لو ان هذا القران رفع حيث رده اواءل هذه الامة لهلكوا فاهلكنا اشد منهم بطشا ومضي مثل الاولين الزخرف عقوبة الاولين جزءا البقرة عدلا ,False,0926ZakariyyaAnsari.MinhatBari
146028958025,4,Shamela0023588-ara1.ms1189,ولقد اخذناهم بالعذاب فما استكانوا لربهم وما يتضرعون حتي اذا فتحنا عليهم بابا ذا عذاب شديد اذا هم فيه مبلسون ولقد اخذناهم بالعذاب يعني القتل يوم بدر فما استكانوا لربهم بل اقاموا علي عتوهم واستكبارهم واستكان استفعل من الكون لان المفتقر انتقل من كون الي كون او افتعل من السكون اشبعت فتحته وما يتضرعون وليس من عادتهم التضرع وهو استشهاد علي ما قبله حتي اذا فتحنا عليهم بابا ذا عذاب شديد يعني الجوع فانه اشد من القتل والاسر اذا هم فيه مبلسون متحيرون ايسون من كل خير حتي جاءك اعتاهم يستعطفك سورة المءمنون الايات الي وهو الذي انشا لكم السمع والابصار والافءدة قليلا ما تشكرون وهو الذي ذراكم في الارض واليه تحشرون وهو الذي يحيي ويميت وله اختلاف الليل والنهار افلا تعقلون وهو الذي انشا لكم السمع والابصار لتحسوا بها ما نصب من الايات والافءدة لتتفكروا فيها وتستدلوا بها الي غير ذلك من المنافع الدينية والدنيوية قليلا ما تشكرون تشكرونها شكرا قليلا لان العمدة في شكرها استعمالها فيما خلقت لاجله والاذعان لمانحها من غير اشراك وما صلة للتاكيد وهو الذي ذراكم في الارض خلقكم وبثكم فيها بالتناسل واليه تحشرون تجمعون يوم القيامة بعد تفرقكم وهو الذي يحيي ويميت وله اختلاف الليل والنهار ويختص به تعاقبهما لا يقدر عليه غيره فيكون ردا لنسبته الي الشمس حقيقة او لامره وقضاءه تعاقبهما او انتقاص احدهما وازدياد الاخر افلا تعقلون بالنظر والتامل ان الكل منا وان قدرتنا تعم الممكنات كلها وان البعث من جملتها وقرء بالياء علي ان الخطاب السابق لتغليب المءمنين سورة المءمنون الايات الي بل قالوا مثل ما قال ,False,0685NasirDinBaydawi.AnwarTanzil
