cluster,size,id,text,from_input,book
8590012533,10,Shamela0009783BK1-ara1.mARkdown.ms3567,ولقد قحط اهل المدينة فلم يتوسل عمر الي ربه ولم يتقرب اليه الا بابينا حتي نعشهم الله وسقاهم الغيث وابوك حاضر لم يتوسل به ولقد علمت انه لم يبق احد من بني عبد المطلب بعد النبي صلي الله عليه وسلم غيره فكان وراثه من عمومته ثم طلب هذا الامر غير واحد من بني هاشم فلم ينله الا ولده فالسقاية سقايته وميراث النبي له والخلافة في ولده فلم يبق شرف ولا فضل في جاهلية ولا اسلام في دنيا ولا اخرة الا والعباس وارثه ومورثه واما ما ذكرت من بدر فان الاسلام جاء والعباس يمون ابا طالب وعياله وينفق عليهم للازمة التي اصابته ولولا ان العباس اخرج الي بدر كارها لمات طالب وعقيل جوعا وللحساجفان عتبة وشيبة ولكنه كان من المطعمين فاذهب عنكم العار والسبة وكفاكم النفقة والمءونة ثم فدي عقيلا يوم بدر فكيف تفخر علينا وقد علناكم في الكفر وفديناكم من الاسر وحزنا عليكم مكارم الاباء وورثنا دونكم خاتم الانبياء وطلبنا بثاركم فادركنا منه ما عجزتم عنه ولم تدركوا لانفسكم والسلام عليك ورحمة الله قال عمر بن شبة حدثني محمد بن يحيي قال حدثني الحارث بن اسحاق قال اجمع ابن القسري علي الغدر بمحمد فقال له يا امير المءمنين ابعث موسي بن عبد الله ومعه رزاما مولاي الي الشام ,True,0310Tabari.Tarikh
8590012533,10,Shamela0012320-ara1.completed.ms2066,صلي الله عليه وسلم وليس من عمومته احد حيا الا العباس وكان وارثه دون عبد المطلب وطلب الخلافة غير واحد من بني هاشم فلم ينلها الا ولده فاجتمع للعباس انه ابو رسول الله صلي الله عليه وسلم خاتم الانبياء وبنوه القادة الخلفاء فقد ذهب يفضل القديم والحديث ولولا ان العباس اخرج الي بدر كرها لمات عماك طالب وعقيل جوعا او يلحسان جفان عتبة وشيبة فاذهب عنهما العار والشنار ولقد جاء الاسلام والعباس يمون به طالب للازمة التي اصابتهم ثم فدي عقيلا يوم بدر فعززناكم في الكفر وفديناكم من الاسر وورثناه دونكم خاتم الانبياء وادركنا بثاركم اذ عجزتم عنه ووضعناكم بحيث لم تضعوا انفسكم والسلام ,True,0808IbnKhaldun.Tarikh
8590012533,10,JK000911-ara1.mARkdown.ms1947,الي ربه ولم يتقرب اليه بابينا حتي يغيثهم الله فسقاهم الغيث وابوك حاضر لم يتوسل له ولقد علمت انه لم يبق احد من بني عبد المطلب بعد النبي غيره فكانت وراثة من عمومته ثم طلب هذا الامر غير واحد من بني هاشم فلم ينله الا ولده فالسقاية سقايته وميراث النبي له والخلافة في ولده فلم يبق شرف ولا فضل في جاهلية ولا اسلام في الدنيا والاخرة الا والعباس وارثه ومورثه واما ما ذكرت من بدر فان الاسلام جاء والعباس يمون ابا طالب وعياله وينفق عليهم للازمة التي اصابته ولولا ان العباس اخرج الي بدر كارها لمات طالب وعقيل جوعا وللحسا اجفانه عتبة وشيبة ولكنه كان من المطعمين فاذهب عنكم العار والسبة وكفاكم النفقة والمءونة ثم فدي عقيلا يود بدر فكيف تفخر علينا وقد علناكم في الكفر وفديناكم وجزنا عليكم مكارم الاباء ورثنا دونكم خاتم الانبياء وطلبنا بثاركم فادركنا منه ما عجزتم عنه ولم تدركوا لانفسكم والسلام عليكم ورحمة الله وكان محمد قد استعمل محمد ,True,0630IbnAthirCizzDin.Kamil
8590012533,10,Shamela0010283-ara1.mARkdown.ms5653,اخرة الا والعباس وارثه ومورثه اما ما ذكرت من بدر فان الاسلام جاء والعباس يمون ابا طالب وعياله وينفق عليهم للازمة التي اصابته ولولا ان العباس اخرج الي بدر كارها لمات طالب وعقيل جوعا وللحسا جفان عتبة وشيبة ولكنه كان من المطعمين فاذهب عنكم العار والسبة وكفاكم النفقة والمءونة ثم فدا عقيلا يوم بدر فكيف تفخر علينا وقد علناكم في الكفر وفديناكم وحزنا عليكم مكارم الاباء وورثنا دونكم خاتم الانبياء وطلبنا بثاركم فادركنا منه ما عجزتم عنه ولم تدركوا لانفسكم والسلام عليكم ورحمة الله وكان محمد قد استعمل الحسن بن معاوية بن عبد الله بن جعفر بن ابي طالب علي مكة والقاسم بن اسحاق علي اليمن وموسي ابن عبد الله علي الشام ,True,0733Nuwayri.NihayatArab
8590012533,10,Shamela0006617-ara1.completed.ms1577,فكان وارثه دون بني عبد المطلب وطلب الخلافة غير واحد من بني هاشم فلم ينلها الا ولده فاجتمع للعباس انه ابو رسول الله خاتم النبيين وبنوه القادة الخلفاء فقد ذهب بفضل القديم والحديث ولولا ان العباس اخرج الي بدر كرها لمات عماك طالب وعقيل جوعا او يلحسا جفان عتبة وشيبة ابني ربيعة فاذهب عنهما العار والشنار ولقد جاء الاسلام والعباس يمون ابا طالب للازمة التي اصابتهم ثم فدي عقيلا يوم بدر فقدمناكم في الكفر وفديناكم من الاسر وورثنا دونكم خاتم الانبياء وحزنا شرف الاباء وادركنا من ثاركم اذ عجزتم عنه ومنعناكم حيث لم تمنعوا انفسكم والسلام ثم عقد ابو جعفر المنصور علي حربه لعيسي ابن عمه موسي بن علي بن عبد الله بن العباس ,True,1269CabdMalikCasimi.SamtNujum
8590012533,10,Shamela0010646-ara1.ms0793,الخلافة غير واحد من بني هاشم فلم ينلها الا ولده فاجتمع للعباس انه ابو رسول الله صلي الله عليه وسلم خاتم الانبياء وبنوه القادة الخلفاء فقد ذهب بفضل القديم والحديث ولولا ان العباس اخرج الي بدر كرها لمات عماك طالب وعقيل جوعا او يلحسان جفان عتبة وشيبة فاذهب عنهما العار والشنار ولقد جاء الاسلام والعباس يمون ابا طالب للازمة التي اصابتهم ثم فدي عقيلا يوم بدر فقد مناكم في الكفر وفديناكم في الاسلام من الاسر وورثنا دونكم خاتم الانبياء وحزنا شرف الاباء وادركنا من ثاركم ما عجزتم عنه ووضعناكم حيث لم تضعوا انفسكم والسلام قالوا قدم الزبير بن عبد ,True,0562IbnHamdun.TadhkiraHamduniyya
8590012533,10,Shamela0008505-ara1.mARkdown.ms622,خاتم الانبياء وبنوه القادة الخلفاء فقد ذهب بفضل القديم والحديث ولولا ان العباس اخرج الي بدر كرها لمات عماك طالب وعقيل جوعا او يلحسا جفان عتبة وشيبة فاذهب عنهما العار والشنار ولقد جاء الاسلام والعباس يمون ابا طالب للازمة التي اصابتهم ثم فدي عقيلا يوم بدر فقد مناكم في الكفر وفديناكم من الاسر وورثنا دونكم خاتم الانبياء وحزنا شرف الاباء وادركنا من ثاركم ما عجزتم عنه ووضعناكم بحيث لم تضعوا انفسكم والسلام رسالة هشام الي خالد بن عبد الله القسري قال ابو العباس ,True,0285IbnYazidMubarrad.KamilFiLugha
8590012533,10,ShamAY0033599-ara1.ms133,ولقد قحط اهل المدينة فلم يتوسل عمر الا بابينا ولم يتقرب الي الله الا به وابوكم حاضر فلم يتوسل به ولم يكن بعد رسول الله شرف ولا فضل الا والعباس احق به وقد علمت ان الاسلام جاء والعباس يمون ابا طالب وعياله للازمة التي اصابته ولولا ان العباس اخرج الي بدر مكرها لمات طالب وعقيل جوعا وللحسا جفان عتبة وشيبة ولكنه كان من المطمعين فاذهب عنكم العار والسبة وكفاكم النفقة والمءنة ثم فدي عقيلا يوم بدر فكيف تفخرون علينا وقد علناكم في الكفر وفديناكم في الاسلام من الاسر وحزنا عليكم مكارم الاباء وورثنا دونكم خاتم الانبياء وطلبنا بثاركم فادركنا ما عجزتم عنه والسلام ولما يءس ابو جعفر منه بعث اليه عيسي بن موسي عمه وقال ما ابالي ايهما قتل صاحبه لان ,True,0654SibtIbnJawzi.TadhkiratKhawass
8590012533,10,Shamela0012396-ara1.completed.ms0844,ولده فلم يبق شرف ولا فضل في جاهلية ولا اسلام في دنيا ولا اخرة الا والعباس وارثه ومورثه واما ما ذكرت من بدر فان الاسلام جاء والعباس يمون ال ابي طالب وعياله وينفق عليهم للازمة التي اصابته ولولا ان العباس اخرج الي بدر كارها لمات طالب وعقيل جوعا وللحسا جفان عتبة وشيبة ولكنه كان من المطعمين فاذهب الله عنهم العار والسبة وكفاكم المءونة والنفقة ثم فدي عقيلا يوم بدر فكيف تفخر علينا وقد علناكم في الكفر وفديناكم من الاسر وحزنا عليكم مكارم الاباء وورثنا دونكم خاتم الانبياء وطلبنا بثاركم وادركنا منه ما عجزتم عنه ولم تدركوه لانفسكم والسلام عليك ورحمة الله عيس بن موسي يندب لقتال محمد وندب ابو جعفر عيسي بن موسي لقتال محمد وقال لا ابالي ايهما قتل صاحبه وضم ,True,0421Miskawayh.Tajarib
8590012533,10,Shamela0009429-ara1.mARkdown.ms0178,جفان عتبة وشيبة فاذهب عنهما العار والشنار ولقد جاء الاسلام والعباس يمون ابا طالب للازمة التي اصابتهم ثم فدي عقيلا يوم بدر فقد مناكم في الكفر وفديناكم من الاسر وورثنا دونكم خاتم الانبياء وحزنا شرف الاباء وادركنا بثاركم اذ عجزتم عنه ووضعناكم حيث لم تضعوا انفسكم والسلام ,True,0821Qalqashandi.SubhAcsha
146028903346,10,Shamela0022769-ara1.ms1032,ينطق بالحق اي يظهر المطابق للواقع فاعمال العباد كلها مثبتة في صحاءفهم فلا يضيع لعامل جزاء عمله ان خيرا فخير وان شرا فشر وهم لا يظلمون في الجزاء بنقص ثواب او بزيادة عقاب بل قلوبهم اي الكفرة في غمرة اي غفلة من هذا الذي بيناه في القران من ان لدينا ديوان الحفظة الذي يظهر لهم اعمالهم السيءة علي رءوس الاشهاد فيجزون بها ولهم اي الكفار اعمال من دون ذلك اي اعمال سيءة غير كون قلوبهم في غفلة عظيمة مما ذكر وهي فنون معاصيهم كطعنهم في القران واقامة اماءهم في الزنا هم لها عاملون هم مستمرون علي اعمال سيءة حتي اذا اخذنا مترفيهم اي اكابرهم الذين امدهم الله تعالي بالمال والبنين بالعذاب اي الاخروي اذا هم يجارون اي يرتفع صوتهم بالاستغاثة في كشف العذاب عنهم لشدة ما هم عليه ويقال لهم علي وجه التبكيت لا تجاروا اليوم اي لا تلتجءوا اليوم الينا انكم منا لا تنصرون اي لانه لا يلحقكم من جهتنا نصرة تنجيكم مما نزل بكم قد كانت اياتي تتلي عليكم فكنتم علي اعقابكم تنكصون اي فكنتم تعرضون عن تلك الايات ,True,1316IbnCumarBantaniJawi.MarahLabid
146028903346,10,JK009266-ara1.ms6656,بل قلوبهم في غمرة اي في غفلة وجهالة يعني الكفار في غفلة من هذا اي القران اي من هذا الذي بيناه في القران او من الكتاب الذي ينطق بالحق او من هذا الذي هو وصف المشفقين ولهم اي ولهءلاء الكفار اعمال من دون ذ لك اي اعمال خبيثة من المعاصي دون ذلك اي سوي جهلهم وكفرهم وقيل دون ذلك يعني من دون اعمال المءمنين التي ذكرها الله عز وجل قال بعضهم اراد اعمالهم في الحال وقيل بل اراد المستقبل لقوله هم لها عاملون وانما قال هم لها عاملون لانها مثبتة في علم الله تعالي وفي اللوح المحفوظ فوجب ان يعملوها ليدخلوا بها النار لما سبق لهم من الشقاوة ,True,0800IbnCadilHanbali.LubabFiCulumKitab
146028903346,10,Shia002341Vols-ara1.ms2837,تعالي فقال بل قلوبهم في غمرة من هذا اي في غفلة من هذا اليوم وهذه المجازاة وقال الحسن معناه في حيرة وهذا اخبار منه تعالي بما يكون منهم في المستقبل من الاعمال القبيحة زاءدة علي ما ذكره وحكاه انه فعلهم ولهم اعمال من دون ذلك هم لها عاملون قيل في معناه قولان احدهما قال قتادة وابو العالية وفي رواية عن مجاهد ان لهم خطايا من دون الحق والثاني قال الحسن وابن زيد وفي رواية عن مجاهد ايضا اعمالا من دون ما هم عليه لابد من ان يعملوها وقوله حتي اذا اخذنا مترفيهم بالعذاب اذا هم يجارون ,True,0460ShaykhTusi.Tibyan
146028903346,10,JK006476-ara1.ms1098,يظلمون اي لا ينقص حقهم المءمنون بل قلوبهم في قوله تعالي بل قلوبهم في غمرة من هذا اي في غطاء يقال فلان غمره الماء اي غطاه وقوله ولهم اعمال من دون ذلك هم لها عاملون فيه قولان ان للكفار اعمالا خبيثة محكومة عليهم سوي ما عملوا هم لها عاملون هذا قول مجاهد وجماعة وقال قتادة الاية تنصرف الي اصحاب الطاعات ومعناه ان المءمنين لهم اعمال سوي ما عملوا من الخير هم لها عاملون والقول الاول اظهر حتي اذا اخذنا مترفيهم بالعذاب اذا هم يجارون ,True,0489IbnMuhammadSamcani.TafsirQuran
146028903346,10,Shamela0000041-ara1.completed.ms1759,وهم لا يظلمون ولا ينقص من حسناتهم ولا يزاد علي سيءاتهم ثم ذكر الكفار فقال بل قلوبهم في غمرة اي في غفلة وجهالة من هذا اي من القران ولهم اعمال من دون ذلك اي للكفار اعمال خبيثة من المعاصي والخطايا محكومة عليهم من دون ذلك يعني من دون اعمال المءمنين التي ذكرها الله تعالي في قوله ان الذين هم من خشية ربهم مشفقون هم لها عاملون لا بد لهم من ان يعملوها فيدخلوا بها النار لما سبق لهم من الشقاوة هذا قول اكثر المفسرين وقال قتادة هذا ينصرف الي المسلمين وان لهم اعمالا سوي ما عملوا من الخيرات هم لها عاملون والاول اظهر حتي اذا اخذنا مترفيهم اي اخذنا اغنياءهم ورءساءهم بالعذاب قال ابن عباس هو السيف يوم بدر وقال الضحاك يعني الجوع حين دعا عليهم رسول الله صلي الله عليه وسلم فقال اللهم اشدد وطاتك علي مضر واجعلها عليهم سنين كسني يوسف فابتلاهم الله عز وجل بالقحط حتي اكلوا الكلاب والجيف اذا هم يجارون يضجون ويجزعون ويستغيثون واصل الجار رفع الصوت بالتضرع لا تجاروا اليوم انكم منا لا تنصرون قد كانت اياتي تتلي عليكم فكنتم علي اعقابكم تنكصون ,True,0510IbnMascudBaghawi.Tafsir
146028903346,10,ShamAY0034068-ara2.ms2084,لا يظلمون اي لا ينقص من حسناتهم ولا يزاد في سيءاتهم ثم ذكر حال الكفار فقال تعالي بل قلوبهم اي الكفرة من الخلق في غمرة اي جهالة قد اغرقتها من هذا اي القران او الذي وصف به حال هءلاء او من كتاب الحفظة ولهم اعمال من دون ذلك المذكور للمءمنين هم اي الكفار لها اي لتلك الاعمال الخبيثة عاملون اي لا بد ان يعملوها فيعذبون عليها لما سبق من الشقاوة جزء رقم الصفحة حتي اذا اخذنا مترفيهم اي رءساءهم واغنياءهم بالعذاب قال ابن عباس هو السيف يوم بدر وقيل هو الجوع دعا عليهم رسول الله صلي الله عليه وسلم وقال اللهم اشدد وطاتك علي مضر واجعلها عليهم سنين كسني يوسف فابتلاهم الله تعالي بالقحط حتي اكلوا الكلاب والجيف والعظام المحرقة والقذر والاولاد اذا هم يجارون اي يصيحون ويستغيثون ويجزعون واصل الجار رفع الصوت بالتضرع ,True,0977KhatibShirbini.SirajMunir
146028903346,10,Shia002616Vols-ara1.ms4314,وقيل بل قلوبهم في غمرة اي في حيرة وعمي اي مما وصف من اعمال البر في الايات المتقدمة قال قتادة او من الكتاب الذي ينطق بالحق ولهم اعمال من دون ذلك هم لها عاملون قال قتادة ومجاهد اي لهم خطايا لا بد ان يعملوها من دون الحق وقال الحسن وابن زيد المعني ولهم اعمال رديءة لم يعملوها من دون ما هم عليه لا بد ان يعملوها دون اعمال المءمنين فيدخلون بها النار لما سبق لهم من الشقوة ويحتمل ثالثا انه ظلم الخلق مع الكفر بالخالق ذكره الماوردي والمعني متقارب حتي اذا اخذنا مترفيهم بالعذاب يعني بالسيف يوم بدر قاله ابن عباس وقال الضحاك يعني بالجوع حين قال النبي صلي الله عليه وسلم اللهم اشدد وطاتك علي مضر الله اجعلها عليهم سنين كسني يوسف فابتلاهم الله بالقحط والجوع حتي اكلوا العظام والميتة والكلاب والجيف وهلك الاموال والاولاد اذا هم يجارون اي يضجون ويستغيثون واصل الجءار رفع الصوت بالتضرع ,True,0671AbuCabdAllahQurtubi.JamicLiAhkamQuran
146028903346,10,Tafsir09083-ara1.ms0950,ينطق بالحق اي وعندنا صحاءف اعمال العباد التي سطر فيها ما عملوا من خير او شر نجازيهم في الاخرة عليها ولهذا قال وهم لا يظلمون اي لا يظلمون من اعمالهم شيءا بنقص الثواب او زيادة العقاب قال القرطبي والاية تهديد وتامين من الحيف والظلم بل قلوبهم في غمرة من هذا اي بل قلوب الكفرة المجرمين في غطاء وغفلة وعماية عن هذا القران ولهم اعمال من دون ذلك اي ولهم اعمال سيءة كثيرة غير الكفر والاشراك هم لها عاملون اي سيعملونها في المستقبل لتحق عليهم الشقاوة فقد جمعوا بين الكفر وسوء الاعمال فحقت عليهم كلمة العذاب حتي اذا اخذنا مترفيهم بالعذاب اي حتي اذا اخذنا اغنياءهم وكبراءهم المتنعمين في هذه الحياة بالعذاب العاجل كالجوع والقتل والاسر اذا هم يجارون اي اذا هم يصيحون ويرفعون اصواتهم بالاستغاثة قال ابن عباس هو الجوع الذي عذبوا به سبع سنين لا تجاروا اليوم اي لا تستغيثوا اليوم من العذاب انكم منا لا تنصرون اي لا تمنعون من عذابنا فلا ينفعكم صراخ ولا استغاثة قد كانت اياتي تتلي عليكم اي لقد كنتم تسمعون ايات القران تقرا عليكم فكنتم علي اعقابكم تنكصون اي كنتم تنفرون عن تلك الايات ,True,1450MuhammadCaliSabuni.SafwatTafasir
146028903346,10,Tafsir02091-ara1.ms1420,يظلمون لا ينقصون من ثواب اعمالهم ولا يزاد علي سيءاتهم قوله تعالي بل قلوبهم في غمرة اي قلوب اهل مكة في غفلة وجهالة من هذا الذي تقدم ذكره من اعمال البر وقيل في غفلة من القران ولهم اعمال خبيثة لا يرضاها الله من المعاصي والخطايا من دون ذلك اي من دون اعمال المءمنين هم لها عاملون ويجوز ان يكون قوله من هذا اشارة الي الكتاب الذي ينطق بالحق اي قلوبهم في غفلة من ذلك الكتاب واعمالهم التي عملوها محصاة فيه ولهم اعمال من دون ما هم عليه لا بد ان يعملوها وهو ما سبق في علم الله انهم يعملونه والغمرة الغفلة التي تغطي القلب وتغلب عليه قوله تعالي حتي اذا اخذنا مترفيهم بالعذاب اذا هم يجارون اي حتي اذا اخذنا اعيانهم ورءساءهم بالقتل يوم بدر وبما يرون من العذاب وقت المعاينة وقال الضحاك بالجوع حين دعا عليهم النبي صلي الله عليه وسلم ,True,0360Tabarani.TafsirKabir
146028903346,10,ShamAY0033108-ara1.ms1203,يظلمون لا ينقصون من ثواب اعمالهم ولا يزاد علي سيءاتهم قوله تعالي بل قلوبهم في غمرة اي قلوب اهل مكة في غفلة وجهالة من هاذا الذي تقدم ذكره من اعمال البر وقيل في غفلة من القران ولهم اعمال خبيثة لا يرضاها الله من المعاصي والخطايا من دون ذلك اي من دون اعمال المءمنين هم لها عاملون ويجوز ان يكون قوله من هاذا اشارة الي الكتاب الذي ينطق بالحق اي قلوبهم في غفلة من ذلك الكتاب واعمالهم التي عملوها محصاة فيه ولهم اعمال من دون ما هم عليه لا بد ان يعملوها وهو ما سبق في علم الله انهم يعملونه والغمرة الغفلة التي تغطي القلب وتغلب عليه قوله تعالي حتي اذا اخذنا مترفيهم بالعذاب اذا هم يجارون اي حتي اذا اخذنا اعيانهم ورءساءهم بالقتل يوم بدر وبما يرون من العذاب وقت المعاينة وقال الضحاك بالجوع حين دعا عليهم النبي ,True,0360Tabarani.Tafsir
