cluster,size,id,text,from_input,book
154618975743,3,JK000462-ara1.ms541,كيدا ام يريدون كيدا مكرا بك في دار الندوة فالذين كفروا هم المكيدون المجزيون بكيدهم لان الله تعالي حفظ نبيه عليه السلام من مكرهم وقتلوا هم ببدر الطور وان يروا كسفا وان يروا كسفا قطعا من السماء ساقطا يقولوا لعنادهم وفرط شقاوتهم سحاب مركوم بعضه علي بعض وهذا جواب لقولهم فاسقط علينا كسفا من السماء اخبر الله تعالي انه لو فعل ذلك لم يءمنوا الطور فذرهم حتي يلاقوا فذرهم حتي يلاقوا يومهم الذي فيه يصعقون يموتون ثم اخبر انه يعجل لهم العذاب في الدنيا فقال الطور وان للذين ظلموا وان للذين ظلموا كفروا عذابا دون ذلك قبل موتهم وهوالجوع والقحط سبع سنين ثم امره بالصبر فقال الطور واصبر لحكم ربك واصبر لحكم ربك فانك باعيننا بحيث نراك ونحفظك ونرعاك وسبح بحمد ربك حين تقوم من مجلسك قل سبحانك اللهم وبحمدك الطور ومن الليل فسبحه ومن الليل فسبحه اي صل له صلاتي العشاء وادبار النجوم اي ركعتي الفجر ,True,0468IbnAhmadWahidiNaysaburi.WajizFiTafsir
154618975743,3,Sham19Y0014404-ara1.ms1447,ام يريدون كيدا مكرا بك ليهلكوك فالذين كفروا هم المكيدون المهلكون جزاء كيدهم ام لهم اله غير الله سبحان الله عما يشركون ام لهم اله غير الله يستحق العبادة سبحان الله عما يشركون من الالهة وجميع ما في هذه السورة من ذكر ام استفهام غير عاطفة واستفهم تعالي مع علمه بهم تقبيحا عليهم وتوبيخا لهم كقول الشخص لغيره اجاهل انت مع علمه بجهله وان يروا كسفا من السماء ساقطا يقولوا سحاب مركوم وان يروا كسفا قطعا من السماء ساقطا عليهم ليعذبوا به يقولوا عنادا وجهلا سحاب مركوم بعضه فوق بعض يسقينا فذرهم حتي يلاقوا يومهم الذي فيه يصعقون فذرهم حتي يلاقوا يعاينوا قرا ابو جعفر يلقوا بفتح الياء واسكان اللام وفتح القاف من غير الف قبلها وقرا الباقون بضم الياء وفتح اللام والف بعدها وضم القاف يومهم الذي فيه يصعقون وذلك عند النفخة الاولي قرا ابن عامر وعاصم يصعقون بضم الياء اي يهلكون وقرا الباقون بفتحها اي يموتون يوم لا يغني عنهم كيدهم شيءا ولا هم ينصرون وتبدل من يومهم يوم لا يغني عنهم كيدهم شيءا من الاغناء في رد العذاب ولا هم ينصرون يمنعون من عذاب الله وان للذين ظلموا عذابا دون ذلك ولكن اكثرهم لا يعلمون وان للذين ظلموا كفروا عذابا دون ذلك اي قبل المعد لهم يوم القيامة وهو القتل ببدر ولكن اكثرهم لا يعلمون بذلك واصبر لحكم ربك فانك باعيننا وسبح بحمد ربك حين تقوم واصبر لحكم ربك فيهم بالامهال ولا يضيق صدرك قرا ابو عمرو واصبر لحكم بادغام الراء في اللام وروي عنه الاظهار والوجهان صحيحان عنه فانك باعيننا بحيث نراك ونلحظك وسبح بحمد ربك اي قل سبحان الله وبحمده حين تقوم من منامك ومن الليل فسبحه وادبار النجوم ومن الليل فسبحه اي صل له يعني المغرب والعشاء وادبار النجوم يعني الركعتين قبل صلاة الفجر ,True,0928MujirDinCulaymi.FathRahman
163208817532,3,Shamela0035100-ara1.mARkdown.ms09130,شعبان اخذت الفرنج دمياط وكان المعظم قد جهز اليها ناهض الدين ابن الجرخي في خمسماءة راجل فهجموا علي الخندق فقتل الناهض ومن كان معه وضعف اهل دمياط المساكين ووقع فيهم الوباء والغلاء وعجز الملك الكامل عن نصرتهم فسلموها بالامان وفتحوا للفرنج فغدروا لعنهم ,True,0748Dhahabi.TarikhIslam
163208817532,3,SHAM19Y23644-ara1.ms7859,في شعبان اخذ الفرنج دمياط وكان المعظم قد جهز اليها الناهض بن الجرخي في خمس مءة راجل فهجموا علي الخنادق فقتل ابن الجرخي ومن كان معه وصفوا رءوس القتلي علي الخنادق وكان قد طموها وضعف اهل دمياط واكلوا الميتات وعجز الكامل عن نصرتهم ووقع فيهم الوباء والفناء فراسلوا الفرنج علي ان يسلموا اليهم البلد ويخرجوا منه باهليهم واموالهم واجتمع الاقساء وحلفوهم علي ذلك فركبوا في المراكب وزحفوا في البحر ,True,0654SibtIbnJawzi.MiratZaman
163208817532,3,JK001330-ara1.mARkdown.ms1319,في شعبان اخذ الفرنج دمياط وكان المعظم قد جهز اليها الناهض بن الجرخي في خمسماءة راجل فهجموا علي الخنادق فقتل ابن الجرخي ومن كان معه وصفوا رءوس القتلي علي الخنادق وكان الفرنج قد طموها يعني الخنادق وضعف اهل دمياط واكلوا الميتات وعجز الملك الكامل عن نصرتهم ووقع فيهم الوباء والفناء فراسلوا الفرنج علي ان يسلموا اليهم البلد ويخرجوا منه باموالهم واهلهم واجتمعوا وحلفوهم علي ذلك فركبوا في المراكب وزحفوا في البر ,True,0874IbnTaghribirdi.NujumZahira
188978780258,3,JK006476-ara1.ms1100,بل اتيناهم بذكرهم اي بما يذكرهم ويقال بشرفهم وهو معني قوله تعالي وانه لذكر لك ولقومك اي شرف لك ولقومك وقوله فهم عن ذكرهم معرضون اي عن شرفهم وعما يذكرهم معرضون المءمنون ام تسالهم خرجا قوله تعالي ام تسالهم خرجا وقرء خراجا وكلاهما بمعني الجعل والاجر وعن ابي عمرو بن العلاء قال الخراج في الارض والخرج في الرقاب وقوله فخراج ربك اي ثوابه خير اي اجر ربك خير وقوله وهو خير الرازقين اي المعطين المءمنون وانك لتدعوهم الي قوله تعالي وانك لتدعوهم الي صراط مستقيم اي الي دين الحق المءمنون وان الذين لا قوله تعالي وان الذين لا يءمنون بالاخرة عن الصراط لناكبون اي عن طريق الحق لعادلون المءمنون ولو رحمناهم وكشفنا قوله تعالي ولو رحمناهم وكشفنا ما بهم من ضر روي ان النبي دعا علي قريش فقال اللهم اجعل عليهم سنين كسني يوسف فاصابهم الجدب والقحط حتي اكلوا العلهز وهو الدم بالوبر فانزل الله تعالي هذه الاية ولو ولو رحمناهم وكشفنا ما بهم من ضر للجوا في طغيانهم يعمهون ولقد اخذناهم بالعذاب فما استكانوا لربهم وما يتضرعون ,True,0489IbnMuhammadSamcani.TafsirQuran
188978780258,3,JK001480-ara1.ms0596,المءمنون ام تسالهم خرجا ام تسالهم خرجا الخرج هو الاجرة ويقال فيه خراج والمعني واحد وقرء بالوجهين في الموضعين فهو كقوله ام تسالهم اي لست تسالهم اجرا فيثقل عليهم اتباعك فخراج ربك خير اي رزق ربك خير من اموالهم فهو يرزقك ويغنيك عنهم المءمنون وان الذين لا عن الصراط لناكبون اي عادلون ومعرضون عن الصراط المستقيم المءمنون ولو رحمناهم وكشفنا ولو رحمناهم الاية قال الاكثرون نزلت هذه الاية حين دعا رسول الله صلي الله عليه وسلم علي قريش بالقحط فنالهم الجوع حتي اكلوا الجلود وغيرها فالمعني رحمناهم بالخصب وكشفنا ما بهم من ضر الجوع والقحط لتمادوا علي طغيانهم وفي هذا عندي نظر فان الاية مكية باتفاق وانما دعا النبي صلي الله عليه وسلم علي قريش بعد الهجرة حسبما ورد في الحديث وقيل المعني لو رحمناهم بالرد الي الدنيا لعادوا لما نهوا عنه وهذا القول لا يلزم عليه ما يلزم علي الاخر ولكنه خرج عن معني الاية المءمنون ولقد اخذناهم بالعذاب ولقد اخذناهم بالعذاب ,True,0741IbnAhmadGharnatiKalbi.TashilLiCulumTanzil
188978780258,3,JK007095-ara1.ms416,بل اتيناهم بذكرهم اي بشرفهم هو شرف لمن امن به فهم عن ذكرهم عن شرفهم معرضون المءمنون ام تسالهم خرجا ام تسالهم خرجا اي اجرا علي ما جءتهم به لانك لا تسالهم اجرا فخراج ربك ل يعني ثوابهم في الاخرة خير من اجرهم او اعطوك في الدنيا اجرا وهو خير الرازقين وقد يجعل الله رزق العباد بعضهم من بعض يرزق هذا علي يدي هذا يرزق الله اياهم وهو خير الرازقين يعني افضلهم المءمنون وان الذين لا وان الذين لا يءمنون بالاخرة عن الصراط لناكبون اي تاركون له سورة المءمنون من اية اية المءمنون ولو رحمناهم وكشفنا ولو رحمناهم وكشفنا ما بهم من ضر نزلت في اهل مكة وذلك حين اخذوا بالجوع سبع سنين حتي اكلوا الميتة والعظام واجهدوا حتي جعل احدهم يري ما بينه وبين السماء دخانا وهو قوله فارتقب يوم تاتي السماء بدخان مبين نزلت هذه الاية قبل ان يءخذوا بالجوع ثم اخذوا به فقال الله وهم في ذلك الجوع ولو رحمناهم وكشفنا ما بهم من ضر للجوا في طغيانهم يعمهون يترددون المءمنون ولقد اخذناهم بالعذاب ولقد اخذناهم بالعذاب يعني ذلك الجوع في السبع السنين فما استكانوا لربهم وما يتضرعون ,True,0399IbnAbiZamanaynIlbiri.Tafsir
223338318713,3,Shamela0009091-ara1.mARkdown.ms0621,المتقي لله وتوفي الراضي بالله ابو اسحاق محمد وقيل احمد المقتدر بالله جعفر بن المعتضد بالله العباسي وكانت امه جارية رومية وهو اخر خليفة له شعر مدون واخر خليفة انفرد بتدبير الجيوش واخر خليفة خطب يوم الجمعة الي خلافة الحاكم العباسي فانه خطب ايضا مرتين واخر خليفة جالس الندماء ولكنه كان مقهورا مع امرته وكان سمحا كريما محبا للعلماء والادباء سمع الحديث من البغوي وعمره احدي وثلاثون سنة وفيها توفي يوسف بن يعقوب بن اسحاق التنوخي الانباري الازرق الكاتب وله نيف وتسعون سنة وابو نصر محمد بن حمدويه المروزي ثلاثين وثلاث ماءة فيها حدث الغلاء المفرط والوباء ببغداد وبلغ الكر ماءتين وعشرة دنانير اكلوا الجيف ,True,0768Yafici.MiratJinan
223338318713,3,Shamela0025841-ara1.mARkdown.ms261,الراضي بالله ابو اسحاق محمد وقيل احمد بن المقتدر بالله جعفر بن المعتضد بالله احمد بن ابي احمد بن المتوكل علي الله العباس ولد سنة سبع وتسعين وماءتين من جارية رومية اسمها ظلوم كان قصيرا اسمر نحيفا في وجهه طول واستخلف سنة اثنتين وعشرين وثلاثمءة وهو اخر خليفة له شعر مدون واخر خليفة انفرد بتدبير الجيوش والي خلافة المقتفي واخر خليفة خطب يوم الجمعة الي خلافة الحاكم العباسي فانه خطب ايضا مرتين واخر خليفة جالس الندماء ولكنه كان مقهورا مع امراءه مرض في ربيع الاول بمرض دموي ومات وكان سمحا كريما محبا للعلماء والادباء سمع الحديث من البغوي وتوفي في نصف ربيع الاخر وله احدي وثلاثون سنة ونصف وفيها يوسف بن يعقوب بن اسحاق بن بهلول ابو بكر التنوخي الانباري الازرق الكاتب في اخر السنة ببغداد وله نيف وتسعون سنة روي عن جده والحسن بن عرفة وطاءفة سنة ثلاثين وثلاثمءة فيها الغلاء المفرط والوباء ببغداد وبلغ الكر مءتين وعشرة دنانير واكلوا الجيف ,True,0748Dhahabi.CibarFiKhabar
223338318713,3,Shamela0012398-ara1.completed.ms0662,المقالات وفيها الراضي بالله الخليفة ابو اسحاق محمد وقيل احمد بن ابي احمد بن المتوكل العباسي ولد سنة سبع وتسعين وماءتين من جارية رومية اسمها ظلوم وكان قصيرا اسمر نحيفا في وجهه طول استخلف سنة اثنتين وعشرين وثلاثماءة وهو اخر خليفة له شعر مدون واخر خليفة انفرد بتدبير الجيوش الي خلافة المتقي واخر خليفة خطب يوم الجمعة الي خلافة الحاكم العباسي فانه خطب ايضا مرتين واخر خليفة جالس الندماء ولكنه كان مقهورا مع امراءه مرض في ربيع الاول بمرض دموي ومات وكان سمحا كريما محبا للعلماء والادباء سمع الحديث من البغوي توفي في نصف ربيع الاول وله احدي وثلاثون سنة ونصف وفيها ابو بكر يوسف بن يعقوب بن اسحاق بن بهلول ابو بكر التنوخي الانباري الازرق الكاتب في اخر السنة ببغداد وله نيف وتسعون سنة ,True,1089IbnCimad.Shadharat
231928283139,3,Shamela0001394-ara1.ms1726,الخرطوم سنسمه سنكويه علي الخرطوم علي انفه مهانة له وعلما يعرف به وتخصيص الانف بالذكر لان الوسم عليه ابشع وقيل خطم بالسيف يوم بدر فبقيت سمة علي خرطومه انا بلوناهم كما بلونا اصحاب الجنة اذ اقسموا ليصرمنها مصبحين انا بلوناهم امتحنا اهل مكة بالقحط والجوع حتي اكلوا الجيف والرمم بدعاء النبي صلي الله عليه وسلم حيث قال اللهم اشدد وطاتك علي مضر واجعلها سنين كسني يوسف كما بلونا اصحاب الجنة هم قوم من اهل الصلات كانت لابيهم هذه الجنة بقربة يقال لها ضرو ان وكانت علي فرسخين من صنعاء وكان ياخذ منها قوت سلته ويتصدق بالباقي علي الفقراء فلما مات قال بنوه ان فعلنا ما كان يفعل ابونا ضاق ,True,0710IbnAhmadHafizDinNasafi.Tafsir
231928283139,3,JK000462-ara1.ms582,الخرطوم سنسمه علي الخرطوم سنجعل علي انفه علامة باقية ما عاش نخطم انفه بالسيف يوم بدر القلم انا بلوناهم كما انا بلوناهم امتحنا اهل مكة بالقحط والجوع كما بلونا اصحاب الجنة كما امتحنا اصحاب البستان باحراقها وذهاب قوتهم منها وكانوا قوما بناحية اليمن وكان لهم اب وله جنة كان يتصدق فيها علي المساكين فلما مات قال بنوه نحن جماعة وان فعلنا ما كان يفعل ابونا ضاق علينا الامر فحلفوا ليقطعن ثمرهابسدفة من الليل كيلا يشعر المساكين فياتوهم وهو قوله اذ اقسموا ليصرمنها مصبحين القلم ولا يستثنون ولا يستثنون ولا يقولون ان شاء الله القلم فطاف عليها طاءف فطاف ,True,0468IbnAhmadWahidiNaysaburi.WajizFiTafsir
231928283139,3,Shamela0029743-ara1.ms1137,المعايب سنسمه علي الخرطوم سنجعل علي انفه علامة ووقعت يوم بدر وفي لفظ الخرطوم استخفاف فانه لا يكاد يستعمل الا في انف الخنزير والفيل او سنلحق به شيءا ظاهرا لا يفارقه ونذله غاية الاذلال فان صاحب المال والبنين متكبر غالبا او نسود وجهه يوم القيامة او سنبين امره بيانا ظاهرا كما يظهر السمة علي الخراطيم انا بلوناهم اهل مكة بالقحط كما بلونا اصحاب الجنة كما امتحنا اصحاب بستان باليمن كان لرجل يتصدق منها علي الفقراء فلما مات قال ابناءه كان ابونا احمق اذ كان يصرف منها شيءا كثيرا علي الفقراء اذ اقسموا فحلفوا ليصرمنها ليقطعن ثمرها مصبحين داخلين في الصبح خفية عن المساكين ولا يستثنون لا يقولون ان شاء الله قيل لا يستثنون حصة المساكين كما كان يخرج ابوهم فطاف عليها علي الجنة طاءف بلاء ,True,0905IbnCabdRahmanIjiShafici.Tafsir
231928417570,3,Shamela0001000-ara1.completed.ms1331,الجيزة في خلق عظيم ووردت الاخبار بذلك الي بغداد فجهز المقتدر مءنسا الخادم الي محاربته بالرجال والاموال فجد في السير فلما وصل الي مصر كان القاءم قد ملك الجيزة والاشمونين واكثر بلاد الصعيد فتلاقيا وجرت بين العسكرين حروب لا توصف ووقع عسكر القاءم الوباء والغلاء فمات الناس والخيل فرجع الي افريقية وتبعه عسكر مصر الي ان تباعد عنهم وكان وصوله الي المهدية يوم الثلاثاء الثالث من رجب من السنة المذكورة وفي ايامه خرج ابو يزيد مخلد بن كيداد الخارجي وقد تقدم ذكره وما جري له وكيف مات في ,True,0681IbnKhallikan.WafayatAcyan
231928417570,3,Shamela0009091-ara1.mARkdown.ms0638,الجيزة فوردت الاخبار بذلك الي بغداد فجهز المقتدر مءنسا الخادم الي محاربته بالرجال والاموال فجد في السير فلما وصل الي مصر التقيا وجرت بين العسكرين حروب لا توصف ووقع في عسكر القاءم الوباء والغلاء والاهوال فمات الناس والخيل فرجع الي افريقية ومعه عسكر مصر وكان وصوله الي المهدية في رجب سنة سبع وثلاثماءة وفي ايامه خرج ابو يزيد مخلد بن كندار الخارجي وجرت له امور يطول شرحها ومات في ,True,0768Yafici.MiratJinan
231928417570,3,Sham19Y0029560-ara1.ms0863,الجيزة فوردت الاخبار بذلك الي بغداد فجهز المقتدر مءنسا الخادم لمحاربته بالرجال والاموال فجد في السير والتقيا بمصر وجرت بينهما حروب لا توصف ووقع في عسكر القاءم الوباء والغلاء فمات الناس والخيل فرجع الي افريقية ومعه عسكر مصر وكان وصوله الي المهدية في رجب سنة سبع وثلاث ماءة وفي ايامه خرج ابو يزيد مخلد بن كيداد الخارجي ,True,0947BamakhramaHimyari.QiladatNahr
300647743010,3,Shamela0023587-ara1.ms0787,اما الذين امنوا وعملوا الصالحات فلهم جنات الماوي نزلا بما كانوا يعملون واما الذين فسقوا فماواهم النار كلما ارادوا ان يخرجوا منها اعيدوا فيها وقيل لهم ذوقوا عذاب النار الذي كنتم به تكذبون اما الذين امنوا وعملوا الصالحات في موضع رفع بالابتداء فوصفه الله جل وعز بالايمان وخبر الابتداء فلهم جنات الماوي والمعني فله ولنظراءه فعلي هذا جاء الجمع وكذا واما الذين فسقوا فماواهم النار كلما ظرف سورة السجده اية ولنذيقنهم من العذاب الادني دون العذاب الاكبر لعلهم يرجعون ولنذيقنهم لام قسم من العذاب الادني اي الاقرب واكثر اهل التفسير علي انها المصيبات في الدنيا سورة السجده اية ومن اظلم ممن ذكر بايات ربه ثم اعرض عنها انا من المجرمين منتقمون ومن اظلم اي لنفسه ممن ذكر بايات ربه اي بحججه وعلاماته ثم اعرض عنها بترك القبول فاعلم انه ينتقم منه فقال جل وعز انا من المجرمين منتقمون سورة السجده اية ولقد اتينا موسي الكتاب فلا تكن في مرية من لقاءه وجعلناه هدي لبني اسراءيل ولقد اتينا موسي الكتاب مفعولان فلا تكن في مرية من لقاءه قد ذكرناه وقد قيل ان معناه فلا تكن في شك من تلقي موسي صلي الله عليه وسلم ,True,0338AbuJacfarNahhas.IcrabQuran
300647743010,3,Shamela0023628-ara1.completed.ms2805,ولنذيقنهم من العذاب الادني دون العذاب الاكبر اي سوي العذاب الاكبر قال ابن عباس العذاب الادني مصاءب الدنيا واسقامها وعنه انه الحدود وقيل هو الجوع بمكة حتي اكلوا الجيف والعظام والكلاب سبع سنين وقال ابن مسعود هو القتل بالسيف يوم بدر والاكبر هو عذاب جهنم لعلهم يرجعون اي الي الايمان يعني من بقي منهم بعد القحط وبعد بدر ومن اظلم اي لا احد اظلم ممن ذكر بايات ربه اي بدلاءل وحدانيته وانعامه عليه ثم اعرض عنها اي ترك الايمان بها انا من المجرمين يعني المشركين منتقمون معناه انهم لما لم يرجعوا بالعذاب الادني فانا منهم منتقمون بالعذاب الاكبر قوله تعالي ولقد اتينا موسي الكتاب اي التوراة فلا تكن في مرية اي في شك من لقاءه اي من لقاء موسي ليلة المعراج قاله ابن عباس ق عن ابن عباس عن النبي صلي الله عليه وسلم قال رايت ليلة اسري بي موسي ,True,0741KhazinBaghdadi.LubabTawil
