cluster,size,id,text,from_input,book
257698075552,2,JK001412-ara1.ms451,من العدوان في الجبايات والاموال والفتن الحادثة من انتفاض الرعايا او كثرة الخوارج لهرم الدولة فيقل في كثرة احتكار الزرع غالبا وصلاحه لا يتسم علي وتيرة واحدة اذ طبيعة العالم في كثرة الامطار وقلتها مختلفة والزرع والثمار والضرع علي نسبة ذلك وثقة الناس في الاقوات انما هي بالاحتكار فاذا فقد عظم توقعهم للمجاعات فغلا الزرع وعجز عنه اولو الخصاصة فهلكوا او كان القحط والاحتكار مفقودا فشمل الناس الجوع بيان الثالث ان كثرة حدوث الموتان اما من شدة المجاعات او كثرة الفتن لاختلال الدول ووقوع الوباء وسببه في الغالب فساد الهواء بكثرة العمران لكثرة ما يخالطه من العفن والرطوبات الفاسدة واذا فسد الهواء وهو غذاء الروح الحيواني وملابسه داءما فيسري الفساد الي مزاجه فان قوي وقع المرض في الرءة وهذه هي الطواعين والاكثر العفن به وتضاعف الحميات المهلكة وكثرة العمران هي سبب التعفن والرطوبة الفاسدة رعاية حكمة قال ولهذا تبين في الحكمة ان تخلل الخلاء والفقر بين العمران ضروري ليكون تموج الهواء يذهب بما يحصل في الهواء من الفساد والعفن بمخالطة الحيوانات وياتي ,True,0896IbnCaliIbnAzraqGharnati.BadaicSilk
257698114187,2,JK001480-ara1.ms0596,المءمنون ام تسالهم خرجا ام تسالهم خرجا الخرج هو الاجرة ويقال فيه خراج والمعني واحد وقرء بالوجهين في الموضعين فهو كقوله ام تسالهم اي لست تسالهم اجرا فيثقل عليهم اتباعك فخراج ربك خير اي رزق ربك خير من اموالهم فهو يرزقك ويغنيك عنهم المءمنون وان الذين لا عن الصراط لناكبون اي عادلون ومعرضون عن الصراط المستقيم المءمنون ولو رحمناهم وكشفنا ولو رحمناهم الاية قال الاكثرون نزلت هذه الاية حين دعا رسول الله صلي الله عليه وسلم علي قريش بالقحط فنالهم الجوع حتي اكلوا الجلود وغيرها فالمعني رحمناهم بالخصب وكشفنا ما بهم من ضر الجوع والقحط لتمادوا علي طغيانهم وفي هذا عندي نظر فان الاية مكية باتفاق وانما دعا النبي صلي الله عليه وسلم علي قريش بعد الهجرة حسبما ورد في الحديث وقيل المعني لو رحمناهم بالرد الي الدنيا لعادوا لما نهوا عنه وهذا القول لا يلزم عليه ما يلزم علي الاخر ولكنه خرج عن معني الاية المءمنون ولقد اخذناهم بالعذاب ولقد اخذناهم بالعذاب قيل ان هذا ,True,0741IbnAhmadGharnatiKalbi.TashilLiCulumTanzil
257698114187,2,JK000462-ara1.ms398,المءمنون ام تسالهم خرجا ام تسالهم انت يا محمد علي ما جءت به خرجا جعلا واجرا فخراج ربك فعطاء ربك وثوابه خير وقوله المءمنون وان الذين لا لناكبون اي عادلون ماءلون المءمنون ولو رحمناهم وكشفنا ولو رحمناهم وكشفنا ما بهم من ضر جدب وقحط للجوا لتمادوا في طغيانهم يعمهون نزلت هذه الاية حين شكوا الي النبي صلي الله عليه وسلم وقالوا قتلت الاباء بالسيف والابناء بالجوع المءمنون ولقد اخذناهم بالعذاب ولقد اخذناهم بالعذاب بالجوع فما ,True,0468IbnAhmadWahidiNaysaburi.WajizFiTafsir
266288155730,2,Shamela0025841-ara1.mARkdown.ms803,ظل زالا عن امليه واي طود مالا انعي الي الناس المكارم والندا والجود والاحسان والافضالا ومات المفتي شرف الدين حسين بن الكمال علي بن سلام الدمشقي مدرس العذراوية وغيرها وكان من الاذكياء ومات بمصر رفيقنا المحدث الرءيس فخر الدين عثمان بن بلبان المقاتلي معيد المنصورية عن اثنتين وخمسين سنة حدث عن ابي حفص بن القواس وطبقته وارتحل وحصل وكتب وخرج وكان يحفظ احزابا من القران ولكنه نديم اخباري ومات المقرء زين الدين محمد بن سليمان بن احمد بن يوسف الصنهاجي المراكشي ثم الاسكندراني امام مسجد قداح سمع من ابن رواج ومظفر بن الفوي توفي في ذي الحجة سنة ثمان عشرة وسبعماءة كان القحط المفرط بالجزيرة وديار بكر واكلت الميتة وبيعت الاولاد وجلا الناس ومات بعض الناس من الجوع وجري ما لا يعبر عنه وكان اهل بغداد في قحط ايضا دون ذلك وجاءت بارض طرابلس زوبعة اهلكت جماعة وحملت الجمال في الجو وابعد السلطان اكبر امراءه طغية الي نيابة صفد ثم انه امسكه وامسك جماعة امراء ومات في صفر بزاويته الامام القدوة بركة الوقت الشيخ محمد بن عمر ابن الشيخ الكبير ابي بكر بن قوام البالسي عن سبع وستين سنة روي لنا عن اصحاب ابن طبرزد وكان محمود الطريقة متين الديانة ومات بمصر قاضي المالكية زين الدين علي بن مخلوف بن ناهض النويري عن ثلاث وثمانين سنة وكانت ولايته ثلاثا وثلاثين سنة من بعد ابن شاس حدث عن المرسي وغيره وكان مشكور السيرة وولي بعده تقي الدين بن الاخناءي ومات بالقاهرة الجلال محمد بن محمد بن عيسي بن الحسن القاهري طباخ الصوفية حدث عن ابن قميرة وابن الجميزي والساوي وطاءفة ومات بدمشق الامام ,True,0748Dhahabi.CibarFiKhabar
266288155730,2,JK001291BK1-ara1.mARkdown.ms28,ظل زالا عن امليه واي طود مالا انعي الي الناس المكارم والندا والجود والاحسان والافضالا ومات المفتي شرف الدين حسين بن الكمال علي بن سلام الدمشقي مدرس العذراوية وغيرها وكان من الاذكياء ومات بمصر رفيقنا المحدث الرءيس فخر الدين عثمان بن بلبان المقاتلي معيد المنصورية عن اثنتين وخمسين سنة حدث عن ابي حفص بن القواس وطبقته وارتحل وحصل وكتب وخرج وكان يحفظ احزابا من القران ولكنه نديم اخباري ومات المقرء زين الدين محمد ابن سليمان بن احمد بن يوسف الصنهاجي المراكشي ثم الاسكندراني امام مسجد قداح سمع من ابن رواج ومظفر بن الفوي توفي في ذي الحجة سنة ثمان عشرة وسبعماءة كان القحط المفرط بالجزيرة وديار بكر واكلت الميتة وبيعت الاولاد وجلا الناس ومات بعض الناس من الجوع وجري مالا يعبر عنه وكان اهل بغداد في قحط ايضا دون ذلك وجاءت بارض طرابلس زوبعة اهلكت جماعة وحملت الجمال في الجو وابعد السلطان اكبر امراءه طغية الي نيابة صفد ثم انه امسكه وامسك جماعة امراء ومات في صفر بزاويته الامام القدوة بركة الوقت الشيخ محمد بن عمر ابن الشيخ الكبير ابي بكر ابن قوام البالسي عن سبع وستين سنة روي لنا عن اصحاب ابن طبرزد وكان محمود الطريقة متين الديانة ومات بمصر قاضي المالكية زين الدين علي ابن مخلوف بن ناهض النويري عن ثلاث وثمانين سنة وكانت ولايته ثلاثا وثلاثين سنة من بعد ابن و شاس حدث عن المرسي وغيره وكان مشكور السيرة وولي بعده تقي الدين بن الاخناءي ومات بالقاهرة الجلال محمد بن محمد بن عيسي بن الحسن القاهري طباخ الصوفية حدث عن ابن قميرة وابن الجميزي والساوي وطاءفة ومات بدمشق الامام ,True,0748Dhahabi.DhaylCibar
274877935709,2,Shamela0006624-ara1.ms835,تهينوا اهل علم فاذا هم سم ساعة وفيه في العشر الاوسط من اذار وقع بحلب وبلادها ثلج عظيم وتكرر اغاث الله به البلاد واطمانت به قلوب العباد وجاء عقيب غلاء اسعار وقلة امطار قلت ثلج باذار ام الكافور في مزاجه ولونه والمطعم لولاه سالت بالغلا دماءنا من عادة الكافور امساك الدم وفيها جاءت ريح عظيمة قلعت اشجارا كثيرة وكانت مراكب للفرنج قد لججت للوثوب علي سواحل المسلمين فغرقت بهذه الريح وكفي الله المءمنين القتال قلت قل للفرنج تادبوا وتجنبوا فالريح جند نبينا اجماعا ان قلعت في البر اشجارا فكم في البحر يوما شجرت اقلاعا وفيها توفي الشيخ الحاج اسماعيل بن عبد الرحمن العزازي بعزاز كان له منزلة عند ,True,0749ZaynDinIbnWardi.Tarikh
274877935709,2,Shamela0012715-ara1.mARkdown.ms1055,تهينوا اهل علم فاذا هم سم ساعه وفيه في العشر الاوسط من اذار وقع بحلب وبلادها ثلج عظيم وتكرر اغاث الله به البلاد واطمانت به قلوب العباد وجاء عقيب غلاء اسعار وقلة امطار قلت ثلج باذار ام الكافور في مزاجه ولونه والمطعم لولاه سالت بالغلاء دماءنا من عادة الكافور امساك الدم وفيها جاءت ريح عظيمة قلعت اشجارا كثيرة وكانت مراكب للفرنج قد لججت للوثوب علي سواحل المسلمين فغرقت بهذه الريح وكفي الله المءمنين القتال قلت قل للفرنج تادبوا وتجنبوا فالريح جند نبينا اجماعا ان قلعت في البر اشجارا فكم في البحر يوما شجرت اقلاعا وفيها توفي الحاج اسماعيل بن عبد الرحمن العزازي بعزاز كان له منزلة عند ,True,0732AbuFida.MukhtasarFiAkhbar
274877938546,2,Shamela0009429-ara1.mARkdown.ms1373,نهر جيحون من لدن بذخشان الي ان يتصل بحدود خوارزم فان جيحون في الجملة يجري من الشرق الي الغرب وان كان يعرض فيه عطفات تجري جنوبا مرة وشمالا اخري ثم قال اما حدوده من الشرق والشمال فلم تتضح لي قال صاحب كتاب اشكال الارض وما وراء النهر من اخصب الاقاليم منزلة وانزهها واكثرها خيرا واهلها يرجعون الي رغبة في الخير واستجابة لمن دعاهم مع قلة غاءلة وسلامة ناحية وسماحة بما ملكت ايديهم مع شدة شوكة ومنعة وباس ونجدة وعدة وعدة والة وكراع وبسالة وعلم وصلاح وليس من اقليم الا ويقحط اهله مرارا قبل ان يقحط ما وراء النهر مرة واحدة ثم ان احسوا ببرد او بجراد او بافة تاتي علي زروعهم وغلاتهم ففي فضل ما يسلم في عروض بلادهم ما يقوم باودهم حتي يستغنوا به عن شء ينقل اليهم من غير بلدهم قال وليس بما وراء النهر مكان يخلو من مدن او قري او مراع لسواءمهم وليس من شء لا بد للناس منه الا وعندهم منه ما يقيم اودهم ويفضل عنهم لغيرهم ومياههم اعذب المياه وابردها واخفها وقد عمت جبالها وضواحيها ومدنها الي التمكن من ,True,0821Qalqashandi.SubhAcsha
274877938546,2,Shamela0011680-ara1.mARkdown.ms160,نهر جيحون من لدن بذخشان الي بحيرة خوارزم علي خط مستقيم وجعلنا خوارزم والختل في ما وراء النهر لان الختل بين نهر جرياب ووخشاب وعمود جيحون جرياب وما دونه من وراء النهر وخوارزم مدينتها وراء النهر وهي الي مدن ما وراء النهر اقرب منها الي مدن خراسان ما وراء النهر من اخصب اقاليم الاسلام وانزهها واكثرها خيرا واهلها يرجعون الي رغبة في الخير واستجابة لمن دعاهم اليه مع قلة غاءلة وسلامة ناحية وسماحة بما ملكت ايديهم مع شدة شوكة ومنعة وباس وعدة والة وكراع وسلاح فاما الخصب بها فانه ليس من اقليم ذكرناه الا يقحط اهله مرارا قبل ان يقحط ما وراء النهر ثم ان اصيبوا ببرد او جراد او افة تاني علي زروعهم ففي فضل ما يسلم في عرض بلادهم ما يقوم باودهم حتي يستغنوا عن نقل شء اليهم من غير بلادهم وليس بما وراء النهر مكان يخلو من مدن او قري او مباخس او مراع لساءمة وليس شء لا بد للناس منه الا وعندهم منه ما يقيم اودهم ويفضل عنهم لغيرهم فاما اطعمتهم فمن السعة والكثرة علي ما ذكرناه واما مياههم فانها اعذب المياه واخفها وقد عمت المياه العذبة جبالها وضواحيها ومدنها واما الدواب ففيها من ,True,0346Istakhri.MasalikWaMamalik
283467858761,2,ShamAY0032665-ara1.ms0054,من قضاء رسول الله صلي الله عليه وسلم ان المعدن جبار والبءر جبار والعجماء جرحها جبار في سنده انقطاع ح حديث جابر رضي الله عنه قال قال النبي صلي الله عليه وسلم الساءمة جبار والجب جبار والمعدن جبار وفي الركاز الخمس في اسناده راو ضعيف ولم يتابع القسم الثاني زواءد المتون وهي علي نوعين ا زيادات تقع اثناء المتون في الاحاديث التي اخرج اصولها الامام مسلم في صحيحه وهي كثيرة والغالب عليها الصحة ومنها المعلة والضعيفة وهي قليلة ب متون مستقلة لم يخرج اصولها الامام مسلم رحمه الله في صحيحه وهي علي قسمين احدهما احاديث زادها في اثناء متون الاحاديث واثناء الابواب من غير تنبيه علي زيادتها والثاني احاديث زادها مع التنبيه علي عدم اخراج صاحب الاصل لها وربما كان فيها ما هو مخرج اصله بالاصل كنحو قوله في اخر كتاب الاستسقاء زيادات في الاستسقاء ما لم يخرجه مسلم رحمه الله في كتابه حيث اورد سبعة عشر حديثا منها خمسة عشر حديثا زاءدا وحديثين التقي فيهما مع مسلم فيمن هو فوق شيخه احدهما ما اسنده عن الحسن البصري عن انس رضي الله عنه قال اصاب اهل المدينة قحط ومجاعة شديدة فقام رسول الله صلي الله عليه وسلم يخطب يوم الجمعة فقام ناس فقالوا يا رسول الله هلكت الاموال وخشينا الهلاك علي انفسنا وهذ كله منه ما هو صحيح او حسن مثل ح الي ح حديث ابن عمر رضي الله عنهما قال قال رسول الله صلي الله عليه وسلم من حلف بغير الله كفر او اشرك ح حديث جابر بن عبد الله رضي الله عنه ان النبي صلي الله عليه وسلم قال من حلف علي منبري هذا بيمين فاجرة فليتبوا مقعده من النار ح حديث ابي هريرة رضي الله عنه عن النبي صلي الله عليه وسلم قال اذا اكره الاثنان علي اليمين فاستحباها فاسهم بينهما ح حديث عجلان مولي المشمعل عن ابي هريرة عن النبي صلي الله عليه وسلم ,True,0316IbnIshaqIsfaraini.Mustrakhraj
283467858761,2,Sham19Y0018144-ara1.ms0054,من قضاء رسول الله صلي الله عليه وسلم ان المعدن جبار والبءر جبار والعجماء جرحها جبار في سنده انقطاع ح حديث جابر رضي الله عنه قال قال النبي صلي الله عليه وسلم الساءمة جبار والجب جبار والمعدن جبار وفي الركاز الخمس في اسناده راو ضعيف ولم يتابع القسم الثاني زواءد المتون وهي علي نوعين ا زيادات تقع اثناء المتون في الاحاديث التي اخرج اصولها الامام مسلم في صحيحه وهي كثيرة والغالب عليها الصحة ومنها المعلة والضعيفة وهي قليلة ب متون مستقلة لم يخرج اصولها الامام مسلم رحمه الله في صحيحه وهي علي قسمين احدهما احاديث زادها في اثناء متون الاحاديث واثناء الابواب من غير تنبيه علي زيادتها والثاني احاديث زادها مع التنبيه علي عدم اخراج صاحب الاصل لها وربما كان فيها ما هو مخرج اصله بالاصل كنحو قوله في اخر كتاب الاستسقاء زيادات في الاستسقاء ما لم يخرجه مسلم رحمه الله في كتابه حيث اورد سبعة عشر حديثا منها خمسة عشر حديثا زاءدا وحديثين التقي فيهما مع مسلم فيمن هو فوق شيخه احدهما ما اسنده عن الحسن البصري عن انس رضي الله عنه قال اصاب اهل المدينة قحط ومجاعة شديدة فقام رسول الله صلي الله عليه وسلم يخطب يوم الجمعة فقام ناس فقالوا يا رسول الله هلكت الاموال وخشينا الهلاك علي انفسنا وهذ كله منه ما هو صحيح او حسن مثل ح الي ح حديث ابن عمر رضي الله عنهما قال قال رسول الله صلي الله عليه وسلم من حلف بغير الله كفر او اشرك ح حديث جابر بن عبد الله رضي الله عنه ان النبي صلي الله عليه وسلم قال من حلف علي منبري هذا بيمين فاجرة فليتبوا مقعده من النار ح حديث ابي هريرة رضي الله عنه عن النبي صلي الله عليه وسلم قال اذا اكره الاثنان علي اليمين فاستحباها فاسهم بينهما ح حديث عجلان مولي المشمعل عن ابي هريرة عن النبي صلي الله عليه وسلم ,True,0316IbnIshaqIsfaraini.Musnad
309237730470,2,Shamela0035100-ara1.mARkdown.ms06707,وسبب ذلك ذلة المصريين بالقحط المفرط واشتغالهم بانفسهم حتي اكل بعضهم بعضا وتشتتوا في البلاد وكاد الخراب يستولي علي ساءر الاقليم حتي ابيع الكلب بخمسة دنانير والهر بثلاثة دنانير وبلغ الاردب ماءة دينار وورد ,True,0748Dhahabi.TarikhIslam
309237730470,2,Sham19Y0020989-ara1.ms0465,وسبب ذلك ذلة المصريين بالقحط المفرط واشتغالهم بانفسهم حتي اكل بعضهم بعضا وتشتتوا في البلاد وكاد الخراب ان يستولي علي ساءر الاقاليم حتي بيع الكلب بخمسة دنانير والهر بثلاثة دنانير وبلغ الاردب ماءة دينار واعاد ,True,0832AbuTayyibFasi.CiqdThamin
317827608489,2,Shamela0035100-ara1.mARkdown.ms05340,القاءم بامر الله ابو القاسم ابن الملقب بالمهدي عبيد الله الوفاة ه الذي توثب علي الامر وادعي انه علوي فاطمي بايع ابا القاسم ولده بولاية العهد من بعده بافريقية وجهزه في جيش عظيم الي مصر مرتين لياخذها المرة الاولي في سنة احدي وثلاثماءة فوصل الي الاسكندرية فملكها وملك الفيوم وصار في يده اكثر خراج مصر وضيق علي اهلها ثم رجع ثم قدمها في سنة سبع وثلاثماءة فازاح عامل المقتدر عن مصر ودخلها ثم خرج الي الجيزة في جحفل عظيم فبلغ المقتدر بالله فجهز مءنسا الخادم الي حربه فجد في السير وقدم مصر والقاءم مالك الجيزة والاشمونين واكثر بلاد الصعيد فالتقي الجمعان وجرت بينهما حروب لا توصف ووقع في جيش القاءم الوباء والغلاء فمات الناس وخيلهم فتقهقر الي افريقية وتبعه عسكر المسلمين الي ,True,0748Dhahabi.TarikhIslam
317827608489,2,JK003609-ara1.mARkdown.ms0794,القاءم بامر الله الفاطمي محمد بن عبيد الله ويدعي محمد نزارا ابن المهدي القاءم بالمغرب بايع لمحمد والده المذكور بولاية العهد بافريقية وما معها وكانت الكتب تكتب باسمه والمظلة تحمل علي راسه وجهزه ابوه الي مصر مرتين لياخذها الاولي في ذي الحجة سنة احدي وثلاث ماءة فوصل الي الاسكندرية وملكها وملك الفيوم وصار في يده اكثر خراج مصر وضيق علي اهلها والمرة الثانية وصل الي الاسكندرية في سنة سبع وثلاث ماءة في عسكر عظيم فخرج عامل الامام المقتدر عنها فدخلها ثم خرج الي الجيزة في خلق عظيم ووردت الاخبار الي بغداد فجهز مءنس الخادم بالرجال والاموال فلما وصل الي مصر كان القاءم قد ملك الجيزة والاشمونين واكثر بلاد الصعيد فتلاقيا وجري بينهما حروب عظيمة ووقع في عسكر القاءم الوباء والغلاء فمات الناس والخيل فرجع الي افريقية وتبعه عسكر مصر الي ,True,0764Safadi.WafiBiWafayat
