cluster,size,id,text,from_input,book
92279,11,Shamela0011079-ara1.ms081,يبتغون الي ربهم الوسيلة الاسراء قال البغوي الوسيلة القربة وقيل الوسيلة كل ما يتقرب به الي الله وقال البيضاوي يبتغون الي ربهم الوسيلة بالطاعة اي هءلاء الالهة يبتغون الي الله القربة بالطاعة ايهم اقرب بدل من واو يبتغون اي يبتعي من هو اقرب منهم الي الله الوسيلة فكيف بغير الاقرب ,False,1282Ababutayn.TasisTaqdis
92279,11,Shamela0007664-ara1.ms228,علي اية الاسراء اولءك الذين يدعون يبتغون الي ربهم الوسيلة الاسراء هءلاء الالهة يبتغون الي الله القربة بالطاعة ايهم اقرب بدل من واو يبتغون اي يبتغي من هو اقرب منهم الي الله الوسيلة فكيف بغير الاقرب ,False,1349IbnSahmanKhathcami.DiyaShariq
92279,11,Shamela0006947-ara1.ms01312,الي غيركم اولءك الذين يدعون يبتغون الي ربهم الوسيلة الاسراء هءلاء الالهة يبتغون الي الله القربة بالطاعة ايهم اقرب الاسراء بدل من واو يبتغون اي يبتغي من هو اقرب منهم الي الله الوسيلة فكيف بغير الاقرب ويرجون رحمته ويخافون عذابه الاسراء كساءر العباد فكيف تزعمون انهم الهة ان عذاب ربك كان محذورا الاسراء حقيقا بان يحذره كل احد حتي الرسل والملاءكة ,False,1354RashidRida.Manar
104607,34,ShamAY0033108-ara1.ms0103,فاذكروني اذكركم فاذا ذكرت الله ذكرني قوله تعالي واشكروا لي ولا تكفرون اي اشكروا لي نعم الدنيا والدين ولا تكفروا نعمتي واحساني اليكم قوله تعالي ياايها الذين امنوا استعينوا بالصبر والصلاة ان الله مع الصابرين اي استعينوا علي ما اكرمتكم من عبادة وشكر بالصبر علي اداء الفراءض واجتناب المحارم وبالمواظبة علي الصلوات والاستكثار منها ان الله مع الصابرين علي اداء الفراءض قوله تعالي ولا تقولوا لمن يقتل في سبيل الله اموات بل احياء نزلت في قتلي بدر من المسلمين وكانوا اربعة عشر رجلا ثمانية من الانصار وستة من المهاجرين كان الناس يقولون للرجل يقتل في سبيل الله مات فلان وكان الكفار يقولون للشهداء علي طريق الطعن ان اصحاب رسول الله صلي الله عليه وسلم يقتلون انفسهم في الحرب من غير سبب ثم يموتون فيذهبون فنهي الله المسلمين ان يقولوا مثل هذا ونبه علي ان ذلك كذب بقوله بل احياء واختلفوا في حياتهم والصحيح انهم اليوم احياء علي الحقيقة قال رسول الله صلي الله عليه وسلم ان ارواح الشهداء في اجواف طير خضر تسرح في رياض الجنة وتاكل وتشرب من انهارها وتاوي الليل الي قناديل من نور معلقة بالعرش وقال الحسن ان الشهداء احياء عند ربهم يصل اليهم الروح والفرح ,False,0360Tabarani.Tafsir
104607,34,Tafsir02091-ara1.ms0122,ان الله مع الصابرين علي اداء الفراءض قوله تعالي ولا تقولوا لمن يقتل في سبيل الله اموات بل احياء نزلت في قتلي بدر من المسلمين وكانوا اربعة عشر رجلا ثمانية من الانصار وستة من المهاجرين كان الناس يقولون للرجل يقتل في سبيل الله مات فلان وكان الكفار يقولون للشهداء علي طريق الطعن ان اصحاب رسول الله صلي الله عليه وسلم يقتلون انفسهم في الحرب من غير سبب ثم يموتون فيذهبون فنهي الله المسلمين ان يقولوا مثل هذا ونبه علي ان ذلك كذب بقوله بل احياء واختلفوا في حياتهم والصحيح انهم اليوم احياء علي الحقيقة قال رسول الله صلي الله عليه وسلم ان ارواح الشهداء في اجواف طير خضر تسرح في رياض الجنة وتاكل وتشرب من انهارها وتاوي الليل الي قناديل من نور معلقة بالعرش وقال الحسن ان الشهداء احياء عند ربهم يصل اليهم الروح والفرح ,False,0360Tabarani.TafsirKabir
104607,34,Shamela0023578-ara1.completed.ms0223,فاذكروني اذكركم واذا ذكرت الله تعالي ذكرني واشكروا لي نعمتي ولا تكفرون سورة البقرة الايات الي يا ايها الذين امنوا استعينوا بالصبر والصلاة ان الله مع الصابرين ولا تقولوا لمن يقتل في سبيل الله اموات بل احياء ولكن لا تشعرون ولنبلونكم بشء من الخوف والجوع ونقص من الاموال والانفس والثمرات وبشر الصابرين الذين اذا اصابتهم مصيبة قالوا انا لله وانا اليه راجعون اولءك عليهم صلوات من ربهم ورحمة واولءك هم المهتدون يا ايها الذين امنوا استعينوا بالصبر والصلاة ان الله مع الصابرين بالعون والنصرة ولا تقولوا لمن يقتل في سبيل الله اموات نزلت في قتلي بدر مع المسلمين وكانوا اربعة عشر رجلا منهم ثمانية من الانصار وستة من المهاجرين وذلك ان الناس كانوا يقولون الرجل يقتل في سبيل الله مات فلان وذهب منه نعيم الدنيا ولذتها فانزل الله تعالي ولا تقولوا لمن يقتل في سبيل الله اموات اي هم اموات بل انهم احياء بل احياء ولكن لا تشعرون انهم كذلك قال رسول الله صلي الله عليه وسلم ان ارواح الشهداء في اجواف طير خضر تسرح في ثمار الجنة وتشرب من انهارها وتاوي بالليل الي قناديل من نور معلقة تحت العرش وقال الحسن ان الشهداء احياء عند الله تعرض ارزاقهم علي ارواحهم فيصل اليهم الروح والفرح كما تعرض النار علي ارواح ال فرعون غداة وعشيا فيصل اليهم الوجع وقال ابو سنان السلمي ارواح الشهداء ,False,0427AbuIshaqThaclabi.KashfWaBayan
104607,34,Sham19Y0013231-ara1.ms0588,استعينوا علي طلب الاخرة بالصبر علي الفراءض وبالصلوات الخمس في مواقيتها علي تمحيص الذنوب وذكرنا ان معني الصبر في اللغة الحبس فالاستعانة بالصبر هو ان يستعين علي دينه بحبس النفس عن الشهوات والمحارم وحبسها علي الطاعات ومعني الاستعانة بالصلاة قال الزجاج اي انكم اذا صليتم تلوتم في صلاتكم ما تعرفون به فضل ما انتم عليه وكان ذلك لكم عونا وقوله تعالي ان الله مع الصابرين قال عطاء عن ابن عباس يقول اني معكم انصركم ولا اخذلكم وقال ابو اسحاق تاويله انه يظهر دينهم علي ساءر الاديان لان من كان الله معه فهو الغالب كما قال عز وجل فان حزب الله هم الغالبون الماءدة قوله تعالي ولا تقولوا لمن يقتل في سبيل الله اموات يرتفع باضمار المكني تقريره لا تقولوا هم اموات ولا يجوز ايقاع القول علي الاسماء لا يجوز ان تقول قلت عبد الله قاءما وانما يجوز ايقاع القول علي اسم في معني قول من ذلك قولك قلت خيرا وقلت شرا نصبتهما لانهما قول كانك قلت كلاما حسنا او قبيحا نزلت الاية في قتلي بدر من المسلمين وذلك ان الناس كانوا يقولون لمن يقتل في سبيل الله مات فلان وذهب عنه نعيم الدنيا ولذتها فانزل الله هذه الاية وقوله تعالي بل احياء اي بل هم احياء والاحسن في حياة الشهداء وكيفية وصفهم بها ما قال رسول الله صلي الله عليه وسلم ان ارواح الشهداء في اجواف طير خضر تسرح في ثمار الجنة وتشرب من انهارها وتاوي بالليل الي قناديل من نور معلقة بالعرش وقوله تعالي ولكن لا تشعرون اي ما هم فيه من النعيم والكرامة وقيل ولكن لا تشعرون انهم احياء فان قيل كيف لا يشعرون وقد اخبر الله بذلك قلنا اراد لا يحسون ذلك لانهم لا يشاهدون وهذا النوع من العلم مقتضي الشعر وذكرنا هذا في اول السورة وبينا انه لهذا المعني لا يقال الله يشعر قوله تعالي ولنبلونكم النون فيه للتاكيد واللام جواب قسم محذوف ,False,0468IbnAhmadWahidiNaysaburi.TafsirBasit
104607,34,Shamela0021821-ara1.ms0128,الذين امنوا استعينوا بالصبر والصلاة ان الله مع الصابرين ولا تقولوا لمن يقتل في سبيل الله اموات بل احياء ولكن لا تشعرون ولنبلونكم بشء من الخوف والجوع ونقص من الاموال والانفس والثمرات وبشر الصابرين الذين اذا اصابتهم مصيبة قالوا انا لله وانا اليه راجعون اولءك عليهم صلوات من ربهم ورحمة واولءك هم المهتدون البقرة قوله يايها الذين امنوا استعينوا بالصبر والصلاة البقرة قال مقاتل استعينوا علي طلب الاخرة بالصبر علي الفراءض وبالصلوات الخمس في مواقيتها علي تمحيص الذنوب ان الله مع الصابرين البقرة قال عطاء عن ابن عباس يقول اني معكم انصركم ولا اخذلكم وقال الزجاج تاويله ان يظهر دينهم علي ساءر الاديان لان من كان الله معه فهو الغالب قوله ولا تقولوا لمن يقتل في سبيل الله اموات البقرة كان الناس يقولون لمن يقتل في سبيل الله مات فلان وذهب عنه نعيم الدنيا ولذتها فانزل الله تعالي هذه الاية وقوله بل احياء ذكر المفسرون في حياة الشهداء في سبيل الله ما روي ان رسول الله صلي الله عليه وسلم قال ان ارواح الشهداء في اجواف طير خضر تسرح في ثمار الجنة وتشرب من انهارها وتاوي بالليل الي قناديل من نور معلقة بالعرش وقوله ولكن لا تشعرون اي ما هم فيه من الكرامة والنعيم قوله ولنبلونكم النون فيه للتاكيد واللام جواب قسم محذوف ,False,0468IbnAhmadWahidiNaysaburi.WasitFiTafsir
104607,34,Shamela0000041-ara1.completed.ms0161,ذكر الله تعالي قوله تعالي واشكروا لي ولا تكفرون يعني واشكروا لي بالطاعة ولا تكفروني بالمعصية فان من اطاع الله فقد شكره ومن عصاه ب فقد كفره يا ايها الذين امنوا استعينوا بالصبر والصلاة ان الله مع الصابرين ولا تقولوا لمن يقتل في سبيل الله اموات بل احياء ولكن لا تشعرون قوله تعالي يا ايها الذين امنوا استعينوا بالصبر والصلاة ان الله مع الصابرين بالعون والنصرة ولا تقولوا لمن يقتل في سبيل الله اموات نزلت في قتلي بدر من المسلمين وكانوا اربعة عشر رجلا ستة من المهاجرين وثمانية من الانصار كان الناس يقولون لمن يقتل في سبيل الله مات فلان وذهب عنه نعيم الدنيا ولذتها فانزل الله تعالي ولا تقولوا لمن يقتل في سبيل الله اموات بل احياء ولكن لا تشعرون كما قال في شهداء احد ولا تحسبن الذين قتلوا في سبيل الله امواتا بل احياء عند ربهم يرزقون ال عمران قال الحسن ان الشهداء احياء عند الله تعالي تعرض ارزاقهم علي ارواحهم فيصل اليهم الروح والفرح كما تعرض النار علي ارواح ال فرعون غدوة وعشية فيصل اليهم الوجع ولنبلونكم بشء من الخوف والجوع ونقص من الاموال والانفس والثمرات وبشر الصابرين ,False,0510IbnMascudBaghawi.Tafsir
104607,34,ShamAY0034052-ara1.ms0174,ولا تكفرون ولا تجحدوا نعماءي اموات بل احياء هم اموات بل هم احياء ولكن لا تشعرون كيف حالهم في حياتهم وعن الحسن ان الشهداء احياء عند الله تعرض ارزاقهم علي ارواحهم فيصل اليهم الروح والفرح كما تعرض النار علي ارواح ال فرعون غدوة وعشيا فيصل اليهم الوجع وعن مجاهد يرزقون ثمر الجنة ويجدون ريحها وليسوا فيها وقالوا يجوز ان يجمع الله من اجزاء الشهيد جملة فيحييها ويوصل اليها النعيم وان كانت في حجم الذرة وقيل نزلت في شهداء بدر وكانوا اربعة عشر ,False,0538JarAllahZamakhshari.Kashshaf
104607,34,Shia002356Vols-ara1.ms0100,قال الحسن ان الشهداء احياء عند الله تعرض ارزاقهم علي ارواحهم فيصل اليهم الروح والفرح كما تعرض النار علي ارواح ال فرعون غدوة وعشيا فيصل اليهم الالم والوجع قالوا ويجوز ان يجمع الله من اجزاء الشهيد جملة فيحييها ويوصل اليها النعيم وان كانت في حجم الذرة وقيل نزلت في شهداء بدر وكانوا اربعة عشر ,False,0548IbnHasanTabarsi.TafsirJawamicJamic
104607,34,Sham19Y0013223-ara2.ms2045,قال تعالي ولا تقولوا لمن يقتل في سبيل الله اموات بل احياء ولكن لا تشعرون من سورة البقرة هم اموات بل هم احياء ولكن لا تشعرون ما حالهم وهو تنبيه علي ان حياتهم ليست بالجسد ولا من جنس ما يحس به من الحيوانات وانما هي امر لا يدرك بالعقل بل بالوحي وعن الحسن ان الشهداء احياء عند ربهم تعرض ارزاقهم علي ارواحهم فيصل اليهم الروح والفرح كما تعرض النار علي ارواح ال فرعون غدوا وعشيا فيصل اليهم الالم والوجع والاية نزلت في شهداء بدر وكانوا اربعة عشر وفيه دلال علي ان الارواح جواهر قاءمة بانفسها مغايرة لما يحس به من البدن تتبقي بعد الموت داركة وعليه جمهور الصحابة والتابعين وبه نطقت الايات والسنن وعلي هذا فتخصيص الشهداء لاختصاصهم بالقرب عن الله تعالي ومزيد البهجة والكرامة ,False,0656IbnCabdQawiMundhiri.TarghibWaTarhib
104607,34,Shamela0023588-ara1.ms0167,يا ايها الذين امنوا استعينوا بالصبر والصلاة ان الله مع الصابرين ولا تقولوا لمن يقتل في سبيل الله اموات بل احياء ولكن لا تشعرون يا ايها الذين امنوا استعينوا بالصبر عن المعاصي وحظوظ النفس والصلاة التي هي ام العبادات ومعراج المءمنين ومناجاة رب العالمين ان الله مع الصابرين بالنصر واجابة الدعوة ولا تقولوا لمن يقتل في سبيل الله اموات اي هم اموات بل احياء اي بل هم احياء ولكن لا تشعرون ما حالهم وهو تنبيه علي ان حياتهم ليست بالجسد ولا من جنس ما يحس به من الحيوانات وانما هي امر لا يدرك بالعقل بل بالوحي وعن الحسن ان الشهداء احياء عند ربهم تعرض ارزاقهم علي ارواحهم فيصل اليهم الروح والفرح كما تعرض النار علي ارواح ال فرعون غدوا وعشيا فيصل اليهم الالم والوجع والاية نزلت في شهداء بدر وكانوا اربعة عشر وفيها دلالة علي ان الارواح جواهر قاءمة بانفسها مغايرة لما يحس به من البدن تبقي بعد ,False,0685NasirDinBaydawi.AnwarTanzil
104607,34,Shamela0001394-ara1.ms0109,يا ايها الذين امنوا استعينوا بالصبر والصلاة ان الله مع الصابرين يا ايها الذين امنوا استعينوا بالصبر فيه تنال كل فضيلة والصلاة فانها تنهي عن كل رذيلة ان الله مع الصابرين بالنصر والمعونة ولا تقولوا لمن يقتل في سبيل الله اموات بل احياء ولكن لا تشعرون ولا تقولوا لمن يقتل في سبيل الله نزلت في شهداء البقرة بدر وكانوا اربعة عشر رجلا اموات اي هم اموات بل احياء اي هم احياء ولكن لا تشعرون لا تعلمون ذلك لان حياة الشهيد لا تعلم حسا عن الحسن رضي الله عنه ان الشهداء احياء عند الله تعرض ارزاقهم علي ارواحهم فيصل اليهم الروح والفرح كما تعرض النار علي ارواح ال فرعون غدوا وعشيا فيصل اليهم الوجع ,False,0710IbnAhmadHafizDinNasafi.Tafsir
104607,34,Shamela0023613-ara1.ms0538,اموات بل احياء اي هم اموات بل هم احياء وعلي الوجه الاول كانه قيل استعينوا بالصبر والصلاة في اقامة ديني وسلوك سبيلي فان احتجتم في ذلك الي مجاهدة عدوي باموالكم وانفسكم فتلفت فان قتلاكم احياء عندي من قتله محبته فديته رءيته ثم ان اكثر المفسرين علي انهم احياء في الحال فمن الجاءز ان يجمع الله تعالي من اجزاء الشهيد جملة فيحييها ويوصل اليها النعيم وان كانت في حجم الذرة ,False,0730NizamDinNaysaburi.GharaibQuran
104607,34,Shamela0023628-ara1.completed.ms0181,ان من قتل في سبيل الله فانه حي بقوله تعالي بل احياء وانما احياهم الله عز وجل في الوقت لايصال الثواب اليهم وعن الحسن ان الشهداء احياء عند الله تعالي تعرض ارزاقهم علي ارواحهم ويصل اليهم الروح والريحان والفرح كما تعرض النار علي ارواح ال فرعون غدوة وعشيا فيصل اليهم الالم والوجع ففيه دليل علي ان المطيعين لله يصل اليهم ثوابهم وهم في قبورهم في البرزخ وكذا العصاة يعذبون في قبورهم فان قلت نحن نراهم موتي فما معني قوله بل احياء وما وجه النهي في قوله ولا تقولوا لمن يقتل في سبيل الله اموات قلت معناه لا تقولوا اموات بمنزلة غيرهم من الاموات بل هم احياء تصل ارواحهم الي الجنان كما ورد ان ارواح الشهداء في حواصل طير خضر تسرح في الجنة ,False,0741KhazinBaghdadi.LubabTawil
104607,34,Sham19Y0020891-ara1.ms0651,النار علي ارواح ال فرعون غدوة وعشيا فيصل اليهم الوجع وعن مجاهد يرزقون ثمر الجنة ويجدون ريحها وليسوا فيها وقالوا يجوز ان يجمع الله من اجزاء الشهيد جملة فيحييها ويوصل اليها النعيم وان كانت في حجم الذرة وقيل نزلت في شهداء بدر وكانوا اربعة عشر ولنبلونكم بشء من الخوف والجوع ونقص من الاموال والانفس والثمرات وبشر الصابرين الذين اذا اصابتهم مصيبة قالوا انا لله وانا اليه راجعون اولءك عليهم صلوات من ربهم ورحمة واولءك هم المهتدون الموت دراكة وعليه جمهور الصحابة والتابعين وبه نطقت الايات والسنن وعلي هذا فتخصيص الشهداء لاختصاصهم بالقرب من الله تعالي ومزيد البهجة والكرامة ,False,0743SharafDinTibi.FutuhGhayb
104607,34,Sham19Y0020891-ara1.ms0650,ولا تكفرون ولا تجحدوا نعماءي اموات بل احياء هم اموات بل هم احياء ولكن لا تشعرون كيف حالهم في حياتهم وعن الحسن ان الشهداء احياء عند الله تعرض ارزاقهم علي ارواحهم فيصل اليهم الروح والفرح ثم ان النعمة في ,False,0743SharafDinTibi.FutuhGhayb
104607,34,Shamela0023591-ara1.completed.ms0810,صلي الله عليه وسلم ان ارواح الشهداء في طير خضر تعلق من ثمر الجنة وانهم في قناديل من ذهب وانهم في قبة خضراء واذا صح ذلك فهي احوال لطواءف من الشهداء او في اوقات مختلفة والجمهور علي انهم في الجنة ويءيده قوله صلي الله عليه وسلم لام حارثة انهم في الفردوس ومذهب اهل السنة ان الارواح لا تفني وانها باقية بعد خروجها من البدن فارواح اهل السعادة منعمة الي يوم الدين وارواح اهل الشقاوة معذبة الي يوم الدين والفرق بين الشهيد وغيره من المءمنين انما هو الرزق فضلهم الله بذلك وقال تعالي في حق الكفار النار يعرضون عليها غدوا وعشيا وقال الحسن الشهداء احياء عند الله تعرض ارزاقهم علي ارواحهم فيصل اليهم الروح والفرح كما تعرض النار علي ال فرعون غدوة وعشيا فيصل اليهم الوجع وقالوا يجوز ان يجمع الله من اجزاء الشهيد جملة فيحييها ويوصل اليها النعيم وان كانت في حجم الذرة ,False,0745AbuHayyanGharnati.TafsirBahrMuhit
104607,34,JK009266-ara1.ms0886,المكان قال الحسن ان الشهداء هم احياء عند الله تعالي تعرض ارزاقهم علي ارواحهم فيصل اليهم الروح والفرج كما تعرض النار علي ارواح ال فرعون غدوة وعشية فيصل اليهم الوجع ,False,0800IbnCadilHanbali.LubabFiCulumKitab
