cluster,size,id,text,from_input,book
51539796648,9,Shamela0001438-ara1.completed.ms5153,عن نافع قال كان عمر بن الخطاب يقول لا تطيلوا الجلوس في الشمس فانه يغير اللون ويقبض الجلد ويبلي الثوب ويحث الداء الدفين ابن السني وابو نعيم كنز العمال عن ابراهيم التيمي قال كان عمر بن الخطاب يقول ينبغي للرجل ان يكون في اهله مثل الصبي فاذا التمس ما عنده وجد رجلا ابن ابي الدنيا والدينوري كنز العمال عن عبيدة السلماني قال كان عمر بن الخطاب يكره ان يقرا الرجل القران وهو جنب عبد الرزاق كنز العمال اخرجه عبد الرزاق رقم عن فراس الديلي قال كان عمر بن الخطاب ينحر كل يوم علي ماءدته عشرين جزورا من جزر بعث بها عمرو بن العاصي من مصر ابن سعد ,False,1450DarIftaMisriyya.JamicAhadith
51539796648,9,JK000916-ara1.mARkdown.ms17454,زمان الرمادة الا ما يتعشي مع الناس حتي احيا الله الناس اول ما احيا قال وانا محمد بن عمر حدثني اسامة بن زيد بن اسلم عن ابيه عن جده قال كنا نقول لو لم يرفع الله المحل عام الرمادة لظننا ان عمر يموت هما بامر المسلمين قال وانا محمد بن عمر حدثني عبدالله بن نافع عن ابيه عن صفية بنت ابي عبيد قالت حدثني بعض نساء عمر قالت ما قرب عمر امراة زمن الرمادة حتي احيا الناس حدثنا ابو القاسم اسماعيل بن محمد بن ,False,0571IbnCasakir.TarikhDimashq
51539796648,9,Shamela0009773-ara1.mARkdown.ms2861,الله صلي الله عليه وسلم وحدثني محمد بن سعد ثنا الواقدي عن اسامة بن زيد عن ابيه عن جده قال كنا نقول لو لم يرفع الله المحل عام الرمادة لظننا ان عمر يموت هما بامر المسلمين وحدثني محمد عن الواقدي عن عبد الله بن نافع عن ابيه عن صفية بنت ابي عبيد اخت المختار امراة عبد الله بن عمر قالت حدثني بعض نساء عمر قالت ما قرب عمر امراة زمن الرمادة حتي احيا الناس هما محمد عن الواقدي عن يزيد بن فراس الديلمي عن ابيه قال كان عمر بن الخطاب ,False,0279Baladhuri.AnsabAshraf
94489412327,9,Sham19Y0020891-ara1.ms6474,قال جماعة من المفسرين هو ان شاء الله تعالي يقال حلف فلان يمينا ليس فيها ثنيا ولا ثنوي ولا ثنية ولا استثناء كله واحد واصلها من الثني وهو الكف والرد وذلك ان الحالف اذا قال والله لافعلن كذا الا ان يشاء الله غيره فقد رد انعقاد ذلك اليمين ,False,0743SharafDinTibi.FutuhGhayb
94489412327,9,Shamela0023635-ara1.ms9083,ثنوي ولا ثنية ولا مثنوية ولا استثناء وكله واحد واصل هذا كله من الثني وهو الكف والرد وذلك ان الحالف اذا قال والله لافعلن كذا الا ان يشاء الله غيره فقد رد انعقاد ذلك اليمين ,False,0606FakhrDinRazi.MafatihGhayb
94489412327,9,Sham19Y0013231-ara1.ms0406,حلف فلان يمينا ليس فيها ثنيا ولا ثنوي ولا ثنية ولا مثنوية ولا استثناء كله واحد لان الحالف اذا قال والله لافعلن كذا الا ان يشاء الله غيره فقد رد ما قاله بمشيءة الله غيره ,False,0468IbnAhmadWahidiNaysaburi.TafsirBasit
94489412327,9,Sham19Y0013231-ara1.ms4256,قوله تعالي ولا يستثنون يقولون ان شاء الله هذا قول جماعة المفسرين ويقال حلف فلان يمينا ليس فيها ثنيا ولا ثنوي ولا ثنية ولا مثنوية ولا استثناء كله واحد واصل هذا كله من الثني وهو الكف والرد وذلك ان الحالف اذا قال والله لافعلن كذا الا ان يشاء الله غيره فقد رد ما قاله بمشيءة الله غيره ,False,0468IbnAhmadWahidiNaysaburi.TafsirBasit
94489412327,9,JK007040-ara1.ms4142,حلف فلان يمينا ليس فيها ثنيا ولا ثنوي ولا ثنية ولا مثنوية ولا استثناء كله واحد واصل هذا كله من الثني وهو الكف والرد لان الحالف اذا قال والله لا افعل كذا وكذا الا ان يشاء الله غيره فقد رد ما قاله بمشيءة الله غيره ,False,0370AbuMansurAzhari.TahdhibLugha
94489412327,9,JK000201-ara1.ms4050,يقول عقيبه ان شاء الله تعالي قال الطيبي هو قول الرجل ان شاء الله يقال حلف فلان يمينا ليس فيها ثني ولا ثنو ولا ثنية ولا استثناء كلها واحد واصلها من الثني وهو الكف والرد وذلك ان الحالف اذا قال والله لافعلن كذا الا ان يشاء الله غيره فقد رد انعقاد ذلك اليمين ,False,1353IbnCabdRahimMubarakfuri.TuhfatAhwadhi
94489412327,9,Sham19Y0122257-ara1.ms1216,قوله ثم حلف لا يستثني قيل هو قول الرجل ان شاء الله يقال حلف فلان يمينا ليس فيها ثنا ولاثني ولا ثنية ولا استثناء كلها واحد واصلها من الثني وهو الكف والرد وذلك ان الحالف اذا قال والله لافعلن كذا الا ان يشاء الله غيره فقد رد انعقاد ذلك اليمين ,False,0743SharafDinTibi.SharhMishkat
94489412327,9,Shamela0008176-ara1.ms2768,ان شاء الله يقال حلف فلان يمينا ليس فيها ثني ولا ثنو ولا ثنية ولا استثناء كلها واحد واصلها من الثني وهو الكف والرد وذلك ان الحالف اذا قال والله لافعلن كذا الا ان يشاء الله غيره فقد رد انعقاد ذلك اليمين ,False,1014MullaCaliQari.MirqatMafatih
94489412327,9,Shamela0001687-ara1.completed.ms08929,يقال حلف فلان يمينا ليس فيها ثنيا ولا ثنوي ولا ثنية ولا مثنوية ولا استثناء كله واحد واصل هذا كله من الثني والكف والرد لان الحالف اذا قال والله لا افعل كذا وكذا الا ان يشاء الله غيره فقد رد ما قاله بمشيءة الله غيره ,False,0711IbnManzurIfriqi.LisanCarab
128849135071,9,Sham19Y0020891-ara1.ms6914,وهي الجهة التي يرحل اليها وفي الكواشي اصل الرحلة السير علي الراحلة ثم استعمل لكل سير وقيل ذلك كله بدعاء ابراهيم صلوات الله عليه ومن بدع التفاسير وامنهم من خوف من ان تكون الخلافة في غيرهم وقرء من خوف باخفاء النون عن رسول الله صلي الله عليه وسلم من قرا سورة لايلاف قريش اعطاه الله عشر حسنات بعدد من طاف بالكعبة واعتكف بها تمت السورة سورة الماعون مكية وقيل مدنية وهي سبع ايات بسم الله الرحمن الرحيم ارايت الذي يكذب بالدين فذلك الذي يدع اليتيم ولا يحض علي طعام المسكين فويل للمصلين الذين هم عن صلاتهم ساهون الذين هم يراءن ويمنعون الماعون قرء اريت بحذف الهمزة وليس بالاختيار لان حذفها مختص بالمضارع ولم يصح عن العرب ريت سورة الماعون مدنية وهي ست ايات بسم الله الرحمن الرحيم قوله قرء اريت قراءة الكساءي قال انما سهل من امرها وقوع حرف الاستفهام اي اذا وقع في اوله حرف الاستفهام ثقل همزة اخري بعدها فحذف ولكن الذي سهل من امرها ,False,0743SharafDinTibi.FutuhGhayb
128849135071,9,JK009266-ara1.ms9613,وامنهم من ان تكون الخلافة الا فيهم وقيل كفاهم اخذ الايلاف من المملوك روي الثعلبي عن ابي رضي الله عنه قال قال رسول الله صلي الله عليه وسلم من قرا سورة لايلاف قريش اعطي من الاجر حسنات بعدد من طاف بالكعبة واعتك بها والله اعلم سورة الدين وتسمي الماعون مكية في قول عطاء وجابر واحد قولي ابن عباس ومدنية في قول له اخر وهو قول قتادة وغيره وهي سبع ايات وخمس وعشرون كلمة وماءة وثلاثة وعشرون حرفا بسم الله الرحمن الرحيم س ش ش ارايت الذي يكذب بالدين فذلك الذي يدع اليتيم ولا يحض علي طعام المسكين قوله تعالي ارايت لذي يكذب ب لدين اي بالجزاء والحساب وقرا اكساءي اريت بسقوط الهمزة وتقدم تحقيقه في الانعام وقال الزمخشري وليس بالاختبار لان حذفها مختص بالمضارع ولم يصح عن العرب ريت ولكن الذي سهل من امرها ,False,0800IbnCadilHanbali.LubabFiCulumKitab
128849135071,9,JK000458-ara1.ms3510,وقرء ليالف قريش الفهم رحلة الشتاء والصيف وقرء رحلة بالضم وهي الجهة التي يرحل اليها قريش فليعبدوا رب هذا فليعبدوا رب هذا البيت الذي اطعمهم بسبب تينك الرحلتين اللتين تمكنوا فيهما بواسطة كونهم من جيرانه سورة قريش اية من جوع شديد كانوا فيه قبلهما وقيل اريد به القحط الذي اكلوا الجيف والعظام وامنهم من خوف عظيم لا يقادر قدره وهو خوف اصحاب الفيل او خوف التخطف في بلدهم ومسايرهم وقيل خوف الجذام فلا يصيبهم في بلدهم عن النبي صلي الله عليه وسلم من قرا سورة قريش اعطاه الله تعالي عشر حسنات بعدد من طاف بالكعبة واعتكف بها سورة الماعون مكية مختلف فيها وايها سبع بسم الله الرحمن الرحيم الماعون ارايت الذي يكذب ارايت الذي يكذب بالدين ,False,0982IbnMuhammadAbuSucud.IrshadCaqlSalim
128849135071,9,Shamela0023591-ara1.completed.ms6927,الله فلا يتعرض اليهم احد وغيرهم خاءفون وقال ابن عباس والضحاك وامنهم من خوف معناه من الجذام فلا تري بمكة مجذوما قال الزمخشري والتنكير في جوع وخوف لشدتهما يعني اطعمهم بالرحلتين من جوع شديد كانوا فيه قبلهما وامنهم من خوف عظيم وهو خوف اصحاب الفيل او خوف التخطف في بلدهم ومسايرهم وقرا الجمهور من خوف باظهار النون عند الخاء والمسيبي عن نافع باخفاءها وكذلك مع العين نحو من علي وهي لغة حكاها سيبويه وقال ابن الاسلت يخاطب قريشا فقوموا فصلوا ربكم وتمسحوا باركان هذا البيت بين الاخاشب فعندكم منه بلاء ومصدق غداة ابي مكسوم هادي الكتاءب كثيبة بالسهل تمشي ورحلة علي العادقات في رءوس المناقب فلما اتاكم نصر ذي العرش ردهم جنود المليك بين ساق وحاجب فولوا سراعا هاربين ولم يءب الي اهله ملجيش غير عصاءب سورة الماعون سورة الماعون الايات الي بسم الله الرحمن الرحيم ارايت الذي يكذب بالدين فذلك الذي ,False,0745AbuHayyanGharnati.TafsirBahrMuhit
128849135071,9,ShamAY0034052-ara1.ms2576,وامنهم من خوف من ان تكون الخلافة في غيرهم وقرء من خوف باخفاء النون عن رسول الله صلي الله عليه وسلم من قرا سورة لايلاف قريش اعطاه الله عشر حسنات بعدد من طاف بالكعبة واعتكف بها سورة الماعون مكية ثلاث ايات الاول مدنية البقية واياتها نزلت بعد التكاثر بسم الله الرحمن الرحيم ارءيت الذي يكذب بالدين فذلك الذي يدع اليتيم ولا يحض علي طعام المسكين فويل للمصلين الذين هم عن صلاتهم ساهون الذين هم يراءون ويمنعون الماعون الماعون ارايت الذي يكذب قرء رايت بحذف الهمزة وليس بالاختيار لان حذفها مختص بالمضارع ولم يصح عن العرب ريت ولكن الذي سهل من امرها ,False,0538JarAllahZamakhshari.Kashshaf
128849135071,9,Shamela0001394-ara1.ms1845,الله فلا يتعرض لهم وغيرهم يغار عليهم فليعبدوا رب هذا البيت الذي اطعمهم من جوع وامنهم من خوف فليعبدوا رب هذا البيت الذي اطعمهم من جوع وامنهم من خوف والتنكير في جوع وخوف لشدتهما يعني اطعمهم بالرحلتين من جوع شديد كانوا فيه قبلهما وامنهم من خوف عظيم وهو خوف اصحاب الفيل او خوف التخطف في بلدهم ومسايرهم وقيل كانوا قد اصابتهم شدة حتي اكلوا الجيف والعظام المحرقة امنهم من خوف الجذام فلا يصيبهم ببلدهم وقيل ذلك كله بدعاء ابراهيم عليه السلام سورة الماعون بسم الله الرحمن الرحيم ارايت الذي يكذب بالدين ارايت الذي يكذب بالدين ,False,0710IbnAhmadHafizDinNasafi.Tafsir
128849135071,9,Shamela0023588-ara1.ms1897,وقرء ليالف قريش الفهم رحلة الشتاء وقريش ولد النضر بن كنانة منقول من تصغير قرش وهو دابة عظيمة في البحر تعبث بالسفن فلا تطاق الا بالنار فشبهوا بها لانها تاكل ولا تءكل وتعلو ولا تعلي وصغر الاسم للتعظيم واطلاق الايلاف ثم ابدال المقيد عنه للتفخيم وقرا ابن عامر لءلاف بغير ياء بعد الهمزة سورة قريش الايات الي فليعبدوا رب هذا البيت الذي اطعمهم من جوع وامنهم من خوف يعبدوا رب هذا البيت الذي اطعمهم من جوع اي بالرحلتين والتنكير للتعظيم وقيل المراد به شدة اكلوا فيها الجيف والعظام وامنهم من خوف اصحاب الفيل او التخطف في بلدهم ومسايرهم او الجذام فلا يصيبهم ببلدهم عن رسول الله صلي الله عليه وسلم من قرا سورة لايلاف قريش اعطاه الله عشر حسنات بعدد من طاف بالكعبة واعتكف بها سورة الماعون مختلف فيها وايها سبع ايات سورة الماعون الايات الي بسم الله الرحمن الرحيم ارايت الذي يكذب بالدين فذلك الذي يدع اليتيم ولا يحض علي طعام المسكين ارايت ,False,0685NasirDinBaydawi.AnwarTanzil
128849135071,9,Zaydiyya0000274-ara1.ms792,وقيل ذلك بدعا ابراهيم صلي الله عليه واله وسلم قال جار الله ومن بدع التفاسير امنهم ان تكون الخلافة في غيرهم ثمرة ذلك ان ينوي بالعبادة الشكر فاذا صلي نافلة نوي الشكر لله علي نعمه قال في التهذيب وعن ام هانء عن النبي قال ان الله تعالي فضل قريشا لاني منهم والنبوة فيهم والحجابة فيهم والسقاية فيهم ونصرهم علي الفيل وعبدوا الله عشر سنين لا يعبده غيرهم فانزل الله فيهم سورة لم يشرك فيها احدا غيرهم فيكون لهذا ثمرة وهي ان لقريش مزية علي غيرهم وقد ورد الحديث عنه قدموا قريشا ولا تقدموها سورة ارايت الماعون بسم الله الرحمن الرحيم قوله تعالي ارايت الذي يكذب بالدين فذلك الذي يدع اليتيم ولا يحض علي طعام المسكين ,False,0836FaqihYusuf.ThamaratYanica
128849135071,9,Tafsir06049-ara1.ms6815,وقيل ذلك بدعاء ابراهيم عليه الصلاة والسلام وزعم بعض ان المعني امنهم من خوف من ان يكون الخلافة في غيرهم وقرء من خوف باخفاء النون اللهم يا رب ببركة سيدنا محمد صلي الله عليه وسلم وبركة السورة اخز النصاري واهنهم واكسر شوكتهم وغلب المسلمين والموحدين عليهم صلي الله علي سيدنا محمد واله وصحبه وسلم عدد كل رومي استهزا به سورة الماعون بسم الله الرحمن الرحيم ارايت ,False,1332QutbAtfayyish.HamayanZad
137439035495,9,JK009266-ara1.ms8970,يتخافتون بهذا الكلام اي يقوله بعضهم لبعض ان لا يدخلنها ليوم عليكم مسكين قال ابن الخطيب والنهي للمسكين عن الدخول نهي لهم عن تمكينه منه اي لا تمكنوه من الدخول وقرا عبد الله وابن ابي عبلة لا يدخلنها باسقاط ان اما علي اضمار القول كمذهب البصريين واما علي اجراء يتخافتون مجراه كقول الكوفيين قوله وغدوا علي حرد قادرين يجوز ان يكون قادرين حالا من فاعل غدوا و علي حرد متعلق به وان يكون علي حرد هو الحال و قادرين اما حال ثانية واما حال من ضمير الحال الاول والحرد قيل الغضب والحنق قاله السدي وسفيان وانشد للاشهب بن رميلة الطويل اسود شري لاقت اسود خفية تساقوا علي حرد دماء الاساود ,False,0800IbnCadilHanbali.LubabFiCulumKitab
137439035495,9,Sham19Y0013231-ara1.ms4258,وغدوا علي حرد واختلفوا في تفسير الحرد والحرد في اللغة يكون علي معان الحرد المنع من قولهم حاردت السنة اذا قل مطرها ومنعت ريعها وحاردت الناقة اذا منعت لبنها وقيل اللبن ومنه قول الاعشي فاذا ما بكءت او حاردت فك عن حاجب اخري طينها والحرد القصد ومنه قول الهذلي اقبل سيل كان من امر الله يحرد حرد الجنة المغله وانشد ابو عبيدة اما اذا احردت حردي فمجرية ضبطاء تمنع غيلا غير مقروب والحرد الغضب وهما لغتان الحرد والحرد والتحريك اكثر وانشد ابو عبيدة اسود شري لاقت اسود خفية تساقوا علي حرد وماء الاساود ,False,0468IbnAhmadWahidiNaysaburi.TafsirBasit
137439035495,9,Shia002341Vols-ara1.ms3831,وغدوا علي حرد فالحرد القصد حرد يحرد حردا فهو حارد قال الشاعر اقبل سيل جاء من امر الله يحرد حرد الجنة المغلة اي يقصد وقال الحسن معناه علي جهة من الفاقة وقال مجاهد معناه علي جد من امرهم وهو قول قتادة وابن زيد وقال سفيان معناه علي حنق وذلك من قول الاشهب بن رميلة اسود شري لاقت اسود خفية فساقوا علي حرد دماء الاساود اي علي غضب وقيل معناه علي منع من قولهم حاردت ,False,0460ShaykhTusi.Tibyan
137439035495,9,Shia002359Vols-ara1.ms4271,حاردت السنة اذا منعت قطرها وحاردت الناقة اذا منعت لبنها قال الكميت وحاردت المكد الجلاد ولم يكن بعقبة قدر المستعيرين معقب ويروي النكد وهي النوق الغزيرات الالبان وقيل ان اصل الحرد القصد قال اقبل سيل جاء من عند الله يحرد حرد الجنة المغلة اي يقصد وحرد يحرد حردا وقيل الحرد الغضب والحنق قال الاشهب بن رميلة اسود شري لاقت اسود خفية تساقوا علي حرد دماء الاساود المعني ,False,0548IbnHasanTabarsi.TafsirMajmacBayan
137439035495,9,Shamela0023632-ara1.completed.ms3586,يتخافتون به ان لا يدخلنها اليوم عليكم مسكين وقرا ابن مسعود وابن ابي عبلة لا يدخلنها بسقوط ان وقوله تعالي علي حرد يحتمل ان يريد علي منع من قولهم حاردت الابل اذا قلت البانها فمنعتها وحاردت السنة اذا كانت شهباء لا غلة لها ومنه قول الشاعر الكميت الطويل وحاردت النكد الجلاد فلم يكن لعقبة قدر المستعيرين معقب ويحتمل ان يريد بالحرد القصد وبذلك فسر بعض اللغويين وانشد عليه القرطبي الرجز اقبل سيل جاء من امر الله يحرد حرد الحبة المغلة اي يقصد قصدها ويحتمل ان يريد بالحرد الغضب يقال حرد الرجل حردا اذا غضب ومنه قول الاشهب بن رميلة الطويل اسود شري لاقت اسودا خفية تساقوا علي حرد دماء الاساود ,False,0541IbnCatiyyaAndalusi.MuharrarWajiz
137439035495,9,Shia002616Vols-ara1.ms6323,والحرد القصد حرد يحرد بالكسر حردا قصد تقول حردت حردك اي قصدت قصدك ومنه قول الراجز اقبل سيل جاء من عند الله يحرد حرد الجنة المغلة انشده النحاس قد جاء سيل جاء من امر الله يحرد حرد الجنة المغله قال المبرد المغلة ذات الغلة وقال غيره المغلة التي يجري الماء في غللها اي في اصولها ومنه تغللت بالغالية ومنه تغليت ابدل من اللام ياء ومن قال تغلفت فمعناه عنده جعلتها غلافا وقال قتادة ومجاهد علي حرد اي علي جد الحسن علي حاجة وفاقة وقال ابو عبيدة والقتيبي علي حرد علي منع من قولهم حاردت ,False,0671AbuCabdAllahQurtubi.JamicLiAhkamQuran
137439035495,9,Shamela0036506-ara1.ms248,علي حرد اي علي منع من قولهم حاردت السنة اذا منعت قطرها وقال الفراء علي قصد وقال ايضا علي قدرة وجد في انفسهم وانشد في الحرد بمعني القصد اقبل سيل جاء من عند الله يحرد حرد الجنة المغله في كل شهر داءم الاهلة وقيل علي حرد علي جد من امرهم وهو قول مجاهد وقتادة وعبد الرحمن بن زيد وقال الحسن علي جهد من الفاقة وقال سفيان علي حنق قال الاشهب بن رميلة اسود شري لاقت اسود خفية تساقوا علي لوح دماء الاساود وقيل علي حرد علي غضب ,False,0535QawwamSunna.IcrabQuran
137439035495,9,JK000919-ara1.ms007,وغدوا علي حرد قادرين اي علي قصد قال الجميج اما اذا حردت حردي فجرية ضبطاء تسكن غيلا غير مقروب اي قصدت قصدي وقال الاخر اقبل سيل جاء من امر الله يحرد حرد الجنة المغله اي يقصد قصدها وقال ابو عبيدة معني قوله علي حرد اي علي غضب وحقد واجاز ما ذكرناه قال ويجوز ان يكون علي حرد معناه علي منع واحتج بقول العباس بن مرداس السلمي وحارب فان مولاك حارد نصره ففي السيف مولي نصره لا يحارد وحارد عندي في هذا البيت بمعني قل يقال حاردت الابل اذا قلت البانها قال الكميت وحاردت النكد الجلاد ولم يكن لعقبة قدر المستعيرين معقب ويقال حرد الرجل حردا بفتح الراء ومن العرب من يقول حرد الرجل حردا بتسكين الراء اذا غضب وانشد ابو عبيدة للاشهب بن رميلة اسود شري لاقت اسود خفية تساقوا علي حرد دماء الاساود ,False,0356AbuCaliQali.AmaliFiLugha
