cluster,size,id,text,from_input,book
151969,8,Shamela0006633-ara1.completed.ms302,من لم اخلق وقوله يا صاحبي وما البخيل بصاحب هذي الديار فاين تلك الادمع اتمر بالعرصات لا تبكي بها وهي المعاهد منهم والاربع هيهات لا ريح اللواعج بعدهم رهو ولا طير الصبابة وقع يا سعد ما هذا المقام وقد مضوا اتقيم من بعد القلوب الاضلع جاروا علي قلبي بسحر جفونهم لا زال يشعبه الاسي ويصدع وابي الهوي الا الحلول بلعلع ويح المطايا ابن منها لعلع لم يدر اين ثووا فلم يسال بهم ريحا تهب ولا بريقا يلمع وكانهم في كل مدرج ناسم فعليه منهم رقت تتضوع فاذا منحتهم السلام تبادرت تبليغه عني الرياح الربع ,False,0685IbnSacidMaghribi.Mughrib
151969,8,Shamela0035100-ara1.mARkdown.ms09442,فمن ذلك يا صاحبي وما البخيل بصاحبي هذي الخيام فاين تلك الادمع اتمر بالعرصات لا تبكي بها وهي المعاهد منهم والاربع يا سعد ما هذا المقام وقد ناوا اتقيم من بعد القلوب الاضلع وابي الهوي الا الحلول بلعلع ويح المطايا اين منها لعلع لم ادر اين ثووا فلم اسال بهم ريحا تهب ولا بريقا يلمع ,False,0748Dhahabi.TarikhIslam
151969,8,Shamela0001003-ara1.completed.ms518,من الف شهر وقال يا صاحبي وما البخيل بصاحبي هذي الخيام فاين تلك الادمع انمر بالعرصات لا نبكي بها وهي المعاهد منهم وهي الاربع يا سعد ما هذا القيام وفد ناوا اتقيم من بعد القلوب الاضلع هيهات لا ريح اللواعج بعدهم رهو ولا طير الصبابة وقع وابي الهوي الا الحلول بلعلع ويح المطايا اين منها لعلع لم ادر اين ثووا فلم اسال بهم ريحا تهب ولا بريقا يلمع وكانهم في كل مدرج ناسم فعليه مني رقة وتضرع فاذا منحتهم السلام تبادرت تبليغه عني الرياح الاربع ابن نبيه الشاعر علي بن محمد بن الحسن بن ,False,0764IbnShakirKutubi.FawatWafayat
151969,8,JK003609-ara1.mARkdown.ms5495,الكامل يا صاحبي وما البخيل بصاحبي هذي الخيام فاين تلك الادمع انمر بالعرصات لا نبكي بها وهي المعاهد منهم والاربع يا سعد ما هذا القيام وقد ناوا اتقيم من بعد القلوب الاضلع هيهات لا ريح اللواعج بعدهم رهو ولا طير الصبابة وقع جاروا علي قلبي بسحر جفونهم لا زال يشعبه الاسي ويصدع وابي الهوي الا الحلول بلعلع ويح المطايا اين منها لعلع لم ادر اين ثوروا فلم اسال بهم ريحا تهب ولا بريقا يلمع وكانهم في كل مدرج ناسم فعليه مني رقة وتضوع فاذا منحتهم السلام تبادرت تبليغه عني الرياح الاربع شرف الدين اليونيني الحنبلي علي بن محمد بن احمد بن عبد ,False,0764Safadi.WafiBiWafayat
151969,8,Shamela0009984-ara1.completed.ms071,حروف المعجم وله ارجوزة بديعة عارضة بها ابن سيده ومقصورة عارض بها ابن دريدس ورسالة ضمنها ابيات الجمل سماها الرسالة الفريدة والاملوحة المفيدة لم يسبق الي مثلها مات سنة اثنتين وعشرين وستماءة ومن شعره يا صاحبي وما البخيل بصاحبي هذي الخيام فاين تلك الادمع اتمر بالعرصات لا تبكي بها وهي المعاهد منهم والاربع يا سعد ما هذا المقام وقد ناوا اتقيم من بعد القلوب الاضلع هيهات لا ريح الطواعج بعدهم رهوا ولا طير الصبابة دمع وابي الهوي الا الحلول بلعلع ويح المطايا اين منها لعلع لم ادر اين ثووا فلم اسال بهم ريحا تهب ولا بريقا يلمع وكانهم في كل مدرج ناسم فعليه منها رنة وتضوع فاذا منحتهم السلام تبادرت تبليغه عني الرياح الاربع علي بن محمد بن عبد الصمد بن عبد ,False,0817MajdDinFiruzabadi.BulghaFiTarajim
151969,8,Sham30K0033307-ara1.ms526,حروف المعجم وله ارجوزة بديعة عارضة بها ابن سيده ومقصورة عارض بها ابن دريدس ورسالة ضمنها ابيات الجمل سماها الرسالة الفريدة والاملوحة المفيدة لم يسبق الي مثلها مات سنة اثنتين وعشرين وستماءة ومن شعره يا صاحبي وما البخيل بصاحبي هذي الخيام فاين تلك الادمع اتمر بالعرصات لا تبكي بها وهي المعاهد منهم والاربع يا سعد ما هذا المقام وقد ناوا اتقيم من بعد القلوب الاضلع هيهات لا ريح الطواعج بعدهم رهوا ولا طير الصبابة دمع اورد ,False,1450QasimCaliSacd.JamharatMalikiyya
151969,8,Sham30K0033307-ara1.ms331,يسبق الي مثلها مات سنة اثنتين وعشرين وستماءة ومن شعره يا صاحبي وما البخيل بصاحبي هذي الخيام فاين تلك الادمع اتمر بالعرصات لا تبكي بها وهي المعاهد منهم والاربع يا سعد ما هذا المقام وقد ناوا اتقيم من بعد القلوب الاضلع هيهات لا ريح الطواعج بعدهم رهوا ولا طير الصبابة دمع اورد ,False,1450QasimCaliSacd.JamharatMalikiyya
151971,8,Sham19Y0020990-ara1.ms0715,وابي الهوي الا الحلول بلعلع ويح المطايا اين منها لعلع لم ادر اين ثووا فلم اسال بهم ريحا تهب ولا بريقا يلمع وكانهم في كل مدرج ناسم فعليه منهم رقة وتضوع واذا منحتهم السلام تبادرت تبليغه عني الرياح الاربع علي بن عبد الله بن ورياش بن المبارك بن يوسف بن موسي بن يزكوك ابو الحسن الوهراني الانصاري نزيل دمشق ,False,0654IbnShaccarMawsili.Qalaid
151971,8,Shamela0006633-ara1.completed.ms302,وابي الهوي الا الحلول بلعلع ويح المطايا ابن منها لعلع لم يدر اين ثووا فلم يسال بهم ريحا تهب ولا بريقا يلمع وكانهم في كل مدرج ناسم فعليه منهم رقت تتضوع فاذا منحتهم السلام تبادرت تبليغه عني الرياح الربع ,False,0685IbnSacidMaghribi.Mughrib
151971,8,Shamela0001003-ara1.completed.ms518,وابي الهوي الا الحلول بلعلع ويح المطايا اين منها لعلع لم ادر اين ثووا فلم اسال بهم ريحا تهب ولا بريقا يلمع وكانهم في كل مدرج ناسم فعليه مني رقة وتضرع فاذا منحتهم السلام تبادرت تبليغه عني الرياح الاربع ابن نبيه الشاعر علي بن محمد بن الحسن بن ,False,0764IbnShakirKutubi.FawatWafayat
151971,8,JK003609-ara1.mARkdown.ms5495,وابي الهوي الا الحلول بلعلع ويح المطايا اين منها لعلع لم ادر اين ثوروا فلم اسال بهم ريحا تهب ولا بريقا يلمع وكانهم في كل مدرج ناسم فعليه مني رقة وتضوع فاذا منحتهم السلام تبادرت تبليغه عني الرياح الاربع شرف الدين اليونيني الحنبلي علي بن محمد بن احمد بن عبد ,False,0764Safadi.WafiBiWafayat
151971,8,Shamela0009984-ara1.completed.ms071,وابي الهوي الا الحلول بلعلع ويح المطايا اين منها لعلع لم ادر اين ثووا فلم اسال بهم ريحا تهب ولا بريقا يلمع وكانهم في كل مدرج ناسم فعليه منها رنة وتضوع فاذا منحتهم السلام تبادرت تبليغه عني الرياح الاربع علي بن محمد بن عبد الصمد بن عبد الواحد الهمداني المصري السخاوي ,False,0817MajdDinFiruzabadi.BulghaFiTarajim
151971,8,Sham30K0033307-ara1.ms136,وابي الهوي الا الحلول بلعلع ويح المطايا اين منها لعلع لم ادر اين ثووا فلم اسال بهم ريحا تهب ولا بريقا يلمع وكانهم في كل مدرج ناسم فعليه منها رنة وتضوع فاذا منحتهم السلام تبادرت تبليغه عني الرياح الاربع علي بن محمد بن عبد الصمد بن عبد الواحد الهمداني المصري السخاوي نزيل دمشق ,False,1450QasimCaliSacd.JamharatMalikiyya
151971,8,Sham30K0033307-ara1.ms526,وابي الهوي الا الحلول بلعلع ويح المطايا اين منها لعلع لم ادر اين ثووا فلم اسال بهم ريحا تهب ولا بريقا يلمع وكانهم في كل مدرج ناسم فعليه منها رنة وتضوع فاذا منحتهم السلام تبادرت تبليغه عني الرياح الاربع علي بن محمد بن عبد الصمد بن عبد الواحد الهمداني المصري السخاوي نزيل دمشق ,False,1450QasimCaliSacd.JamharatMalikiyya
151971,8,Sham30K0033307-ara1.ms331,وابي الهوي الا الحلول بلعلع ويح المطايا اين منها لعلع لم ادر اين ثووا فلم اسال بهم ريحا تهب ولا بريقا يلمع وكانهم في كل مدرج ناسم فعليه منها رنة وتضوع فاذا منحتهم السلام تبادرت تبليغه عني الرياح الاربع علي بن محمد بن عبد الصمد بن عبد الواحد الهمداني المصري السخاوي نزيل دمشق ,False,1450QasimCaliSacd.JamharatMalikiyya
151972,6,Shamela0010798-ara1.completed.ms2589,منه كثيرا من شعره يا ليلة جادت الاماني بها علي رغم انف دهري اسبل فيها علي نعمي يقصر عنها طويل شكري اذ بات في منزلي حبيبي وقام في اهله بعذر فبت لا حالة كحالي ضجيع بدر صريع خمر و يا ليلة القدر في الليالي لانت خير من الف شهر ونقلت ,False,0660IbnCadim.BughyatTalab
151972,6,Shamela0006633-ara1.completed.ms302,يا ليلة جادت الليالي بها علي رغم انف دهري للسيل فيها علي نعمي يقصر عنها لسان شكري ابات في منزلي حبيبي وقال في اهله بعذر فبت لا حاله كحالي ضجيع بدر صريع سكر يا ليلة القدر في الليالي لانت خير من الف شهر وقوله ,False,0685IbnSacidMaghribi.Mughrib
151972,6,Shamela0001003-ara1.completed.ms518,منه من العود يا ليلة جادت الاماني فيها علي رغم انف دهري للقطر فيها علي نعمي يقصر عنها طويل شكري اذ بات في منزلي حبيبي وقام في اهله بعذر يا ليلة السيل في الليالي لانت خير من الف شهر وقال ,False,0764IbnShakirKutubi.FawatWafayat
151972,6,JK003609-ara1.mARkdown.ms5495,يا ليلة جادت الاماني فيها علي رغم انف دهري للقطر فيها علي نعمي يقصر عنها طويل شكري اذا بات في منزلي حبيبي وقام في اهله بعذري فبت لا حالة كحالي ضجيع بدر صريع سكر يا ليلة السيل في الليالي لانت خير من الف شهر ومن ,False,0764Safadi.WafiBiWafayat
151972,6,Shamela0001002-ara1.completed.ms1230,يا ليلة جادت الاماني بها علي رغم انف دهري تسيل فيها علي نعمي يقصر عنها لسان شكري ابات في منزلي حبيبي وقام في اهله بعذر وبت لا حالة كحالي صريع سكر ضجيع بدر يا ليلة القدر في الليالي لانت خير من الف شهر وقال ,False,1041Maqqari.NafhTib
151972,6,Shamela0001002-ara1.completed.ms1202,يا ليلة جادت الليالي بها علي رغم انف دهري للسيل فيها علي نعمي يقصر عنها لسان شكري ابات في منزلي حبيبي وقام في اهله بعذر فبت لا حالة كحالي ضجيع بدر صريع سكر يا ليلة القدر في الليالي لانت خير من الف شهر ومن ,False,1041Maqqari.NafhTib
152667,12,ShamAY0033108-ara1.ms0103,الله تعالي قال فاذكروني اذكركم فاذا ذكرت الله ذكرني قوله تعالي واشكروا لي ولا تكفرون اي اشكروا لي نعم الدنيا والدين ولا تكفروا نعمتي واحساني اليكم قوله تعالي ياايها الذين امنوا استعينوا بالصبر والصلاة ان الله مع الصابرين اي استعينوا علي ما اكرمتكم من عبادة وشكر بالصبر علي اداء الفراءض واجتناب المحارم وبالمواظبة علي الصلوات والاستكثار منها ان الله مع الصابرين علي اداء الفراءض قوله تعالي ولا تقولوا لمن يقتل في سبيل الله اموات بل احياء نزلت في قتلي بدر من المسلمين وكانوا اربعة عشر رجلا ثمانية من الانصار وستة من المهاجرين كان الناس يقولون للرجل يقتل في سبيل الله مات فلان وكان الكفار يقولون للشهداء علي طريق الطعن ان اصحاب رسول الله صلي الله عليه وسلم يقتلون انفسهم في الحرب من غير سبب ثم يموتون فيذهبون فنهي الله المسلمين ان يقولوا مثل هذا ونبه علي ان ذلك كذب بقوله بل احياء واختلفوا في حياتهم والصحيح انهم اليوم احياء علي الحقيقة قال رسول الله صلي الله عليه وسلم ان ارواح الشهداء في اجواف طير خضر تسرح في رياض الجنة ,False,0360Tabarani.Tafsir
152667,12,Shamela0023578-ara1.completed.ms0223,الله عز وجل قال فاذكروني اذكركم واذا ذكرت الله تعالي ذكرني واشكروا لي نعمتي ولا تكفرون سورة البقرة الايات الي يا ايها الذين امنوا استعينوا بالصبر والصلاة ان الله مع الصابرين ولا تقولوا لمن يقتل في سبيل الله اموات بل احياء ولكن لا تشعرون ولنبلونكم بشء من الخوف والجوع ونقص من الاموال والانفس والثمرات وبشر الصابرين الذين اذا اصابتهم مصيبة قالوا انا لله وانا اليه راجعون اولءك عليهم صلوات من ربهم ورحمة واولءك هم المهتدون يا ايها الذين امنوا استعينوا بالصبر والصلاة ان الله مع الصابرين بالعون والنصرة ولا تقولوا لمن يقتل في سبيل الله اموات نزلت في قتلي بدر مع المسلمين وكانوا اربعة عشر رجلا منهم ثمانية من الانصار وستة من المهاجرين وذلك ان الناس كانوا يقولون الرجل يقتل في سبيل الله مات فلان وذهب منه نعيم الدنيا ولذتها فانزل الله تعالي ولا تقولوا لمن يقتل في سبيل الله اموات اي هم اموات بل انهم احياء بل احياء ولكن لا تشعرون انهم كذلك قال رسول الله صلي الله عليه وسلم ان ارواح الشهداء في اجواف طير خضر تسرح في ثمار الجنة ,False,0427AbuIshaqThaclabi.KashfWaBayan
152667,12,JK009396-ara1.ms0112,ويعلمكم ما لم تكونوا تعلمون يعني من احكام الدين وامور الدنيا فاذكروني اذكركم فيه تاويلان احدهما اذكروني بالشكر اذكركم بالنعمة والثاني اذكروني بالقبول اذكركم بالجزاء البقرة يا ايها الذين يا ايها الذين امنوا استعينوا بالصبر والصلاة ان الله مع الصابرين ولا تقولوا لمن يقتل في سبيل الله اموات بل احياء ولكن لا تشعرون قوله تعالي يايها الذين ءامنوا استعينوا بالصبر والصلاة اما الصبر ها هنا ففيه قولان احدهما الثبات علي اوامر الله تعالي والثاني الصيام المقصود به وجه الله تعالي واما الاستعانة بالصلاة فتحتمل وجهين احدهما الاستعانة بثوابها والثاني الاستعانة بما يتلي في الصلاة ليعرف به فضل الطاعة فيكون عونا علي امتثال الاوامر قوله تعالي ولا تقولوا لمن يقتل في سبيل الله اموت بل احياء ولكن لا تشعرون ,False,0450AbuHasanMawardi.NukatWaCuyun
152667,12,Sham19Y0013231-ara1.ms0588,الله هم الغالبون الماءدة قوله تعالي ولا تقولوا لمن يقتل في سبيل الله اموات يرتفع باضمار المكني تقريره لا تقولوا هم اموات ولا يجوز ايقاع القول علي الاسماء لا يجوز ان تقول قلت عبد الله قاءما وانما يجوز ايقاع القول علي اسم في معني قول من ذلك قولك قلت خيرا وقلت شرا نصبتهما لانهما قول كانك قلت كلاما حسنا او قبيحا نزلت الاية في قتلي بدر من المسلمين وذلك ان الناس كانوا يقولون لمن يقتل في سبيل الله مات فلان وذهب عنه نعيم الدنيا ولذتها فانزل الله هذه الاية وقوله تعالي بل احياء ,False,0468IbnAhmadWahidiNaysaburi.TafsirBasit
152667,12,JK000462-ara1.ms032,لما تكونوا به ازكياء من الامر بطاعة الله تعالي البقرة فاذكروني اذكركم واشكروا فاذكروني با لطا عة اذكركم با لمغفرة واشكروا لي نعمتي ولا تكفرون اي لا تكفروا نعمتي البقرة يا ايها الذين يا ايها الذين امنوا استعينوا علي طلب الاخرة بالصبر علي الفراءض والصلاة وبالصلوات الخمس علي تمحيص الذنوب ان الله مع الصابرين اي اني معكم انصركم ولا اخذلكم البقرة ولا تقولوا لمن ولا تقولوا لمن يقتل في سبيل الله اموات نزلت في قتلي بدر من المسلمين وذلك انهم كانوا يقولون لمن يقتل في سبيل الله مات فلان وذهب عنه نعيم الدنيا فقال الله تعالي ولا تقولوا للمقتولين في سبيلي هم اموات بل هم احياء لان ارواح الشهداء في اجواف طير خضر تسرح في الجنة ولكن لا تشعرون بما ,False,0468IbnAhmadWahidiNaysaburi.WajizFiTafsir
152667,12,JK006476-ara1.ms0088,فيكم رسولا منكم يتلو عليكم اياتنا ويزكيكم ويعلمكم الكتاب والحكمة ويعلمكم ما لم تكونوا تعلمون فاذكرني اذكركم واشكروا لي ولا تكفرون يا ايها الذين امنوا استعينوا بالصبر والصلاة ان الله مع الصابرين وحكي ان موسي صلوات الله عليه سال ربه فقال ما الشكر الذي ينبغي لك فقال ان لا يزال لسانك رطبا بذكري البقرة يا ايها الذين قوله تعالي يا ايها الذين امنوا استعينوا بالصبر والصلاة فالاستعانة طلب المعونة وفي الصبر قولان احدهما الثبات علي الدين والاخر الصوم ووجه الاستعانة بهما ما سبق ان لله مع الصابرين قال عطاء عن ابن عباس بالحفظ والنصر البقرة ولا تقولوا لمن قوله تعالي ولا تقولوا لمن يقتل في سبيل الله اموات ,False,0489IbnMuhammadSamcani.TafsirQuran
152667,12,Shamela0000041-ara1.completed.ms0161,يا ايها الذين امنوا استعينوا بالصبر والصلاة ان الله مع الصابرين ولا تقولوا لمن يقتل في سبيل الله اموات بل احياء ولكن لا تشعرون قوله تعالي يا ايها الذين امنوا استعينوا بالصبر والصلاة ان الله مع الصابرين بالعون والنصرة ولا تقولوا لمن يقتل في سبيل الله اموات نزلت في قتلي بدر من المسلمين وكانوا اربعة عشر رجلا ستة من المهاجرين وثمانية من الانصار كان الناس يقولون لمن يقتل في سبيل الله مات فلان وذهب عنه نعيم الدنيا ولذتها فانزل الله تعالي ولا تقولوا لمن يقتل في سبيل الله اموات بل احياء ولكن لا تشعرون كما قال في شهداء احد ولا تحسبن الذين قتلوا في سبيل الله امواتا ,False,0510IbnMascudBaghawi.Tafsir
152667,12,Kraken210622021806-ara1.ms0674,الكمالات قوله جل وعزح ولا تقولوا لمن يقتل في سبيل الله اموات بل اخياء ولكن لا تشعرون النظم لما امرنا الرب تعالي بالصبر علي المصاءب والصلاة التي هي مجمع الحقاءق حقق ان ا ا ل ا ا الا بذلك ولايستبدع ليتهنل مفاتيح الاسرار ومصابيح الايرار التفسير و المعاني قال المفسرون نزلت الاية في قتلي بدر وهم اربعة عشر رجلا ستة من المهاجرين وثمانية من الانصار وذلك ان الناس كانوا يقولون لمن يقتل في سبيلالله مات فلان وذهب عنه نعيم الدنيا ولذتها فنهاهم الله عن مثل هذا القول وقال بعض اهل المعاني معني قوله ولا تقولوا اي تظنوا والقول قد يذكر بمعنيا اظن ودليل صحة هذا التاويل قوله ولا تخسبن الذين قتلوا في سبيل الله امواتا ,False,0548IbnCabdKarimShahrastani.MafatihAsrar
152667,12,Shamela0022928-ara1.ms087,فيكم رسولا منكم يتلو عليكم اياتنا ويزكيكم ويعلمكم الكتاب والحكمة ويعلمكم ما لم تكونوا تعلمون قوله تعالي كما الكاف في موضع نصب صفة لمصدر محذوف تقديره تهتدون هداية كارسالنا او اتماما كارسالنا او نعمة كارسالنا وقال جماعة من المحققين التقدير فاذكروني كما ارسلنا فعلي هذا يكون منصوبا صفة للذكر اي ذكرا مثل ارسالي ولم تمنع الفاء من ذلك كما لم تمنع في باب الشرط وما مصدرية قال تعالي ولا تقولوا لمن يقتل في سبيل الله اموات ,False,0616MuhibbDinCukbari.TibyanFiIcrabQuran
