cluster,size,id,text,from_input,book
60129641774,11,Shamela0012884-ara1.completed.ms4622,احمد عن عبد الله بن عمرو قال دخلت علي النبي صلي الله عليه وسلم وهو يتوضا فرفع راسه فنظر الي فقال ست فيكم ايتها الامة موت نبيكم فكانما انتزع قلبي من مكانه قال رسول الله صلي الله عليه وسلم واحدة قال ويفيض المال فيكم حتي ان الرجل ليعطي عشرة الاف فيظل يسخطها قال رسول الله صلي الله عليه وسلم اثنتين قال وفتنة تدخل بيت كل رجل منكم قال رسول صلي الله عليه وسلم ثلاث قال وموت كقعاص الغنم قال رسول الله صلي الله عليه وسلم اربع وهدنة تكون بينكم وبين بني الاصفر فيجمعون لكم تسعة اشهر بقدر حمل المراة ثم يكونون اولي بالغدر منكم قال رسول الله صلي الله عليه وسلم خمس وفتح مدينة قلت يا رسول الله اي مدينة قال قسطنطينية واخرج ابن ابي شيبة واحمد والبخاري وابو داود وابن ماجة عن عوف بن مالك الاشجعي قال اتيت رسول الله صلي الله عليه وسلم في غزوة تبوك وهو في قبة ادم فقال اعدد ستا بين يدي الساعة موتي ثم فتح بيت المقدس ثم موتان ياخذكم كقعاص الغنم ثم استفاضة المال حتي يعطي الرجل ماءة دينار ,False,0911Suyuti.DurrManthur
60129641774,11,Sham19Y0127677-ara1.ms07722,باب ثان في امارات الساعة عن معاذ بن جبل وعزاه الي احمد والطبراني وفيه النهاس بن فهم وهو ضعيف و النهاس بن فهم ترجمته في الميزان رقم وقال هو ابو الخطاب القيسي البصري القاص عن انس وقال تركه يحيي القطان وضعفه ابن معين وقال ابو احمد الحاكم لين والقعاص بالضم داء ياخذ الغنم لا يلبثها ان تموت و البند العلم الكبير وجمعه بنود ومنه حديث اشراط الساعة ان تغزو الروم فتسير بثمانين بندا اه نهاية الحديث في مسند احمد تحقيق الشيخ شاكر ج ص رقم بلفظ حدثنا حسن حدثنا خلف يعني ابن خليفة عن ابي جناب عن ابيه عن عبد الله بن عمرو قال دخلت علي النبي صلي الله عليه وسلم وهو يتوضا وضوءا مكيثا فرفع راسه فنظر الي فقال ست فيكم ايتها الامة موت نبيكم صلي الله عليه وسلم فكانما انتزع قلبي من مكانه قال رسول الله صلي الله عليه وسلم واحدة قال ويفيض المال فيكم حتي ان الرجل ليعطي عشرة الاف فيظل يستخطها ,False,0911Suyuti.JamicKabir
60129641774,11,Sham19Y0127677-ara1.ms14887,عبد الله حدثني ابي ثنا حسن ثنا خلف يعني ابن خليفة عن ابي جناب عن ابيه عن عبد الله بن عمرو قال دخلت علي النبي صلي الله عليه وسلم وهو يتوضا وضوءا مكينا فرفع راسه فنظر الي فقال ست فيكم ايتها الامة موت نبيكم صلي الله عليه وسلم فكانما انتزع قلبي من مكانه قال رسول الله صلي الله عليه وسلم واحدة قال ويفيض المال فيكم حتي ان الرجل ليعطي عشرة الاف فيظل يتسخطها قال رسول الله صلي الله عليه وسلم ثنتين قال وفتنة تدخل بيت كل رجل منكم قال رسول الله صلي الله عليه وسلم ثلاث قال وموت كقعاس الغنم قال رسول الله صلي الله عليه وسلم اربع وهدنة تكون بينكم وبين بني الاصفر فيجمعون لكم تسعة اشهر كقدر حمل المراة ثم يكونون اولي بالعذر منكم قال رسول الله صلي الله عليه وسلم خمس قال وفتح مدينة قال رسول الله صلي الله عليه وسلم ست قلت يا رسول الله اي مدينة قال قسطنطينية ,False,0911Suyuti.JamicKabir
60129641774,11,Shamela0001438-ara1.completed.ms2285,واحدة ويفيض المال فيكم حتي ان الرجل ليعطي عشرة الاف فيظل يتسخطها ثنتان وفتنة تدخل بيت كل رجل منكم ثلاث وموت كعقاص الغنم اربع وهدنة تكون بينكم وبين بني الاصفر يجمعون لكم تسعة اشهر كقدر حمل المراة ثم يكونون اولي بالغدر منكم خمس وفتح مدينة ست قيل اي مدينة قال قسطنطينية احمد عن ابن عمرو اخرجه احمد رقم قال الهيثمي فيه ابو جناب الكلبي وهو مدلس ست مجالس المءمن ضامن علي الله ما كان في شء منها مسجد جماعة وعند مريض او في جنازة او في بيته او عند امام مقسط يعزره ويوقره الطبراني عن ابن عمرو اخرجه الطبراني كما في مجمع الزواءد قال الهيثمي رجاله موثقون واخرجه ايضا الديلمي رقم ست من اشراط الساعة موتي وفتح بيت المقدس وان يعطي الرجل الف دينار فيسخطها وفتنة يدخل حرها بيت كل مسلم وموت ياخذ في الناس كعقاص الغنم وان تغدر الروم فيسيرون بثمانين بندا تحت كل بند اثنا عشر الفا ,False,1450DarIftaMisriyya.JamicAhadith
60129641775,5,ShamAY0034438-ara1.ms057,قلبي من مكانه قال قال رسول الله صلي الله عليه وسلم واحدة قال ويفيض فيكم المال حتي ان الرجل ليعطي عشرة الاف فيظل يتسخطها قال رسول الله عليه السلام ثنتين وفتنة تدخل بيت كل احد منكم قال ثلاث وموت كقعاص الغنم قال اربع قال وهدنة بينكم وبين بني الاصفر فيجمعون لكم تسعة اشهر كقدر حمل امراة ثم يكونون هم اولي بالغدر منكم قال خمس قال وفتح مدينة قال رسول الله عليه السلام ست قال قلت اي مدينة يا رسول الله قال قسطنطينية اخبرنا محمد بن بكر بن المستغفر بكس حدثنا محمد ,False,0432Mustaghfiri.DalailNubuwwa
60129641775,5,Shamela0004445-ara1.completed.ms6814,قلبي من مكانه قال رسول الله صلي الله عليه وسلم واحدة قال ويفيض المال فيكم حتي ان الرجل ليعطي عشرة الاف فيظل يسخطها قال رسول الله صلي الله عليه وسلم ثنتين قال وفتنة تدخل بيت كل رجل منكم قال رسول الله صلي الله عليه وسلم ثلاث قال وموت كقعاص الغنم قال رسول الله صلي الله عليه وسلم اربع وهدنة تكون بينكم وبين بني الاصفر يجمعون لكم تسعة اشهر كقدر حمل المراة ثم يكونون اولي بالغدر منكم قال رسول الله صلي الله عليه وسلم خمس قال وفتح مدينة قال رسول الله صلي الله عليه وسلم ست قلت يا رسول الله اي مدينة قال قسطنطينية ,False,0774IbnKathir.Bidaya
60129641775,5,Shamela0011818-ara1.ms048,قلبي من مكانه قال رسول الله صلي الله عليه وسلم واحدة قال ويفيض المال فيكم حتي ان الرجل ليعطي عشرة الاف يظل يسخطها قال رسول الله صلي الله عليه وسلم اثنتين قال وفتنة تدخل بيت كل رجل منكم قال رسول الله صلي الله عليه وسلم ثلاث قال وموت كقصاص الغنم قال رسول الله صلي الله عليه وسلم اربع وهدنة تكون بينكم وبين بني الاصفر فيجمعون لكم تسعة اشهر كقدر حمل المراة ثم يكونون اولي بالعدل منكم ,False,0774IbnKathir.NihayaFiFitan
60129641775,5,Shamela0009567-ara1.ms0922,قلبي من مكانه قال رسول الله صلي الله عليه وسلم واحدة قال ويفيض المال فيكم حتي ان الرجل يعطي عشرة الاف فيظل يتسخطها قال رسول الله صلي الله عليه وسلم ثنتين قال وفتنة تدخل بيت كل رجل منكم قال رسول الله صلي الله عليه وسلم ثلاث قال وموت كعقاص الغنم قال رسول الله صلي الله عليه وسلم اربع وهدنة تكون بينكم وبين بني الاصفر ص فيجمعون لكم تسعة اشهر كقدر حمل المراة ثم يكونون اولي بالغدر منكم قال رسول الله صلي الله عليه وسلم خمس قال وفتح مدينة قال رسول الله صلي الله عليه وسلم ست قلت يا رسول الله اي مدينة قال قسطنطينية حدثنا وكيع عن النهاس بن قهم حدثني شداد ,False,0807NurDinHaythami.GhayatMaqsad
60129641775,5,Sham19Y0127677-ara1.ms14887,قلبي من مكانه قال رسول الله صلي الله عليه وسلم واحدة قال ويفيض المال فيكم حتي ان الرجل ليعطي عشرة الاف فيظل يتسخطها قال رسول الله صلي الله عليه وسلم ثنتين قال وفتنة تدخل بيت كل رجل منكم قال رسول الله صلي الله عليه وسلم ثلاث قال وموت كقعاس الغنم قال رسول الله صلي الله عليه وسلم اربع وهدنة تكون بينكم وبين بني الاصفر فيجمعون لكم تسعة اشهر كقدر حمل المراة ثم يكونون اولي بالعذر منكم قال رسول الله صلي الله عليه وسلم خمس قال وفتح مدينة قال رسول الله صلي الله عليه وسلم ست قلت يا رسول الله اي مدينة قال قسطنطينية ,False,0911Suyuti.JamicKabir
60129641777,5,Shamela0025794-ara1.mARkdown.ms1235,الله صلي الله عليه وسلم ثلاث قال وموت كقعاص الغنم قال رسول الله صلي الله عليه وسلم اربع قال وهدنة تكون بينكم وبين بني الاصفر يجمعون لكم تسعة اشهر كقدر حمل المراة ثم يكونون اولي بالغدر منكم قال رسول الله صلي الله عليه وسلم خمس قال وفتح مدينة قال رسول الله صلي الله عليه وسلم ست قلت يا رسول الله اي مدينة قال قسطنطينية حدثنا اسحاق بن عيسي حدثنا ليث حدثني حيوة يعني ابن شريح عن ابن شفي الاصبحي عن ابيه عن عبد الله بن عمرو قال قال رسول الله صلي الله عليه وسلم ,False,0241IbnHanbal.Musnad
60129641777,5,ShamAY0034438-ara1.ms057,ثلاث وموت كقعاص الغنم قال اربع قال وهدنة بينكم وبين بني الاصفر فيجمعون لكم تسعة اشهر كقدر حمل امراة ثم يكونون هم اولي بالغدر منكم قال خمس قال وفتح مدينة قال رسول الله عليه السلام ست قال قلت اي مدينة يا رسول الله قال قسطنطينية اخبرنا محمد ,False,0432Mustaghfiri.DalailNubuwwa
60129641777,5,Shamela0004445-ara1.completed.ms6814,الله صلي الله عليه وسلم ثلاث قال وموت كقعاص الغنم قال رسول الله صلي الله عليه وسلم اربع وهدنة تكون بينكم وبين بني الاصفر يجمعون لكم تسعة اشهر كقدر حمل المراة ثم يكونون اولي بالغدر منكم قال رسول الله صلي الله عليه وسلم خمس قال وفتح مدينة قال رسول الله صلي الله عليه وسلم ست قلت يا رسول الله اي مدينة قال قسطنطينية ,False,0774IbnKathir.Bidaya
60129641777,5,Shia001782Vols-ara1.ms2542,الله صلي الله عليه وسلم ثلاث قال وموت كقعاص الغنم قال رسول الله صلي الله عليه وسلم اربع وهدنة تكون بينكم وبين بني الاصفر فيجمعون لكم تسعة اشهر كقدر حمل المراة ثم يكونون اولي بالغدر منكم قال رسول الله صلي الله عليه وسلم خمس قال وفتح مدينة قال رسول الله صلي الله عليه وسلم ست قلت يا رسول الله اي مدينة قال قسطنطينية رواه احمد والطبراني وفيه ابو جناب الكلبي وهو مدلس وعن معاذ بن جبل قال قال رسول الله صلي الله عليه وسلم ,False,0807NurDinHaythami.MajmacZawaid
60129641777,5,Sham19Y0127677-ara1.ms14887,الله صلي الله عليه وسلم ثلاث قال وموت كقعاس الغنم قال رسول الله صلي الله عليه وسلم اربع وهدنة تكون بينكم وبين بني الاصفر فيجمعون لكم تسعة اشهر كقدر حمل المراة ثم يكونون اولي بالعذر منكم قال رسول الله صلي الله عليه وسلم خمس قال وفتح مدينة قال رسول الله صلي الله عليه وسلم ست قلت يا رسول الله اي مدينة قال قسطنطينية ,False,0911Suyuti.JamicKabir
60129641780,5,ShamAY0034438-ara1.ms057,الي فقال ست فيكم ايها الامة موت نبيكم صلي الله عليه وسلم قال وكانما انتزع قلبي من مكانه قال قال رسول الله صلي الله عليه وسلم واحدة قال ويفيض فيكم المال حتي ان الرجل ليعطي عشرة الاف فيظل يتسخطها قال رسول الله عليه السلام ثنتين وفتنة تدخل بيت كل احد منكم قال ثلاث وموت كقعاص الغنم قال اربع قال وهدنة بينكم وبين بني الاصفر فيجمعون لكم تسعة اشهر كقدر حمل امراة ثم يكونون هم اولي بالغدر منكم قال خمس قال وفتح مدينة قال رسول الله عليه السلام ست قال قلت اي مدينة يا رسول الله قال قسطنطينية ,False,0432Mustaghfiri.DalailNubuwwa
60129641780,5,Shamela0004445-ara1.completed.ms6814,الي فقال ست فيكم ايتها الامة موت نبيكم صلي الله عليه وسلم فكانما انتزع قلبي من مكانه قال رسول الله صلي الله عليه وسلم واحدة قال ويفيض المال فيكم حتي ان الرجل ليعطي عشرة الاف فيظل يسخطها قال رسول الله صلي الله عليه وسلم ثنتين قال وفتنة تدخل بيت كل رجل منكم قال رسول الله صلي الله عليه وسلم ثلاث قال وموت كقعاص الغنم قال رسول الله صلي الله عليه وسلم اربع وهدنة تكون بينكم وبين بني الاصفر يجمعون لكم تسعة اشهر كقدر حمل المراة ثم يكونون اولي بالغدر منكم قال رسول الله صلي الله عليه وسلم خمس قال وفتح مدينة قال رسول الله صلي الله عليه وسلم ست قلت يا رسول الله اي مدينة قال قسطنطينية ,False,0774IbnKathir.Bidaya
60129641780,5,Shamela0011818-ara1.ms048,الي فقال ست فيكم ايتها الامة موت نبيكم قال فكانما انتزع قلبي من مكانه قال رسول الله صلي الله عليه وسلم واحدة قال ويفيض المال فيكم حتي ان الرجل ليعطي عشرة الاف يظل يسخطها قال رسول الله صلي الله عليه وسلم اثنتين قال وفتنة تدخل بيت كل رجل منكم قال رسول الله صلي الله عليه وسلم ثلاث قال وموت كقصاص الغنم قال رسول الله صلي الله عليه وسلم اربع وهدنة تكون بينكم وبين بني الاصفر فيجمعون لكم تسعة اشهر كقدر حمل المراة ثم يكونون اولي بالعدل منكم ,False,0774IbnKathir.NihayaFiFitan
60129641780,5,Sham19Y0127677-ara1.ms14887,الي فقال ست فيكم ايتها الامة موت نبيكم صلي الله عليه وسلم فكانما انتزع قلبي من مكانه قال رسول الله صلي الله عليه وسلم واحدة قال ويفيض المال فيكم حتي ان الرجل ليعطي عشرة الاف فيظل يتسخطها قال رسول الله صلي الله عليه وسلم ثنتين قال وفتنة تدخل بيت كل رجل منكم قال رسول الله صلي الله عليه وسلم ثلاث قال وموت كقعاس الغنم قال رسول الله صلي الله عليه وسلم اربع وهدنة تكون بينكم وبين بني الاصفر فيجمعون لكم تسعة اشهر كقدر حمل المراة ثم يكونون اولي بالعذر منكم قال رسول الله صلي الله عليه وسلم خمس قال وفتح مدينة قال رسول الله صلي الله عليه وسلم ست قلت يا رسول الله اي مدينة قال قسطنطينية ,False,0911Suyuti.JamicKabir
60129641780,5,Shia002265Vols-ara1.ms4666,ابي سعيد ست فيكم ايتها الامة موت نبيكم واحدة ويفيض المال فيكم حتي ان الرجل ليعطي عشرة الاف فيظل يتسخطها ثنتان وفتنة تدخل بيت كل رجل منكم ثلاث وموت كقعاص الغنم اربع وهدنة تكون بينكم وبين بني الاصفر ليجمعون لكم تسعة اشهر كقدر حمل المراة ثم يكونون اولي بالغدر منكم خمس وفتح مدنية ست قيل اي مدينة قال قسطنطينية ,False,0975MuttaqiHindi.KanzCummal
60129641781,12,Shamela0025794-ara1.mARkdown.ms1235,الي فقال ست فيكم ايتها الامة موت نبيكم صلي الله عليه وسلم فكانما انتزع قلبي من مكانه قال رسول الله صلي الله عليه وسلم واحدة قال ويفيض المال فيكم حتي ان الرجل ليعطي عشرة الاف فيظل يتسخطها قال رسول الله صلي الله عليه وسلم ثنتين قال وفتنة تدخل بيت كل رجل منكم قال رسول الله صلي الله عليه وسلم ثلاث قال وموت كقعاص الغنم قال رسول الله صلي الله عليه وسلم اربع قال وهدنة تكون بينكم وبين بني الاصفر يجمعون لكم تسعة اشهر كقدر حمل المراة ثم يكونون اولي بالغدر منكم قال رسول الله صلي الله عليه وسلم خمس قال وفتح مدينة قال رسول الله صلي الله عليه وسلم ست قلت يا رسول الله اي مدينة قال قسطنطينية حدثنا اسحاق بن ,False,0241IbnHanbal.Musnad
60129641781,12,ShamAY0034438-ara1.ms057,ست فيكم ايها الامة موت نبيكم صلي الله عليه وسلم قال وكانما انتزع قلبي من مكانه قال قال رسول الله صلي الله عليه وسلم واحدة قال ويفيض فيكم المال حتي ان الرجل ليعطي عشرة الاف فيظل يتسخطها قال رسول الله عليه السلام ثنتين وفتنة تدخل بيت كل احد منكم قال ثلاث وموت كقعاص الغنم قال اربع قال وهدنة بينكم وبين بني الاصفر فيجمعون لكم تسعة اشهر كقدر حمل امراة ثم يكونون هم اولي بالغدر منكم قال خمس قال وفتح مدينة قال رسول الله عليه السلام ست قال قلت اي مدينة يا رسول الله قال قسطنطينية اخبرنا محمد بن ,False,0432Mustaghfiri.DalailNubuwwa
60129641781,12,Shamela0004445-ara1.completed.ms6814,ست فيكم ايتها الامة موت نبيكم صلي الله عليه وسلم فكانما انتزع قلبي من مكانه قال رسول الله صلي الله عليه وسلم واحدة قال ويفيض المال فيكم حتي ان الرجل ليعطي عشرة الاف فيظل يسخطها قال رسول الله صلي الله عليه وسلم ثنتين قال وفتنة تدخل بيت كل رجل منكم قال رسول الله صلي الله عليه وسلم ثلاث قال وموت كقعاص الغنم قال رسول الله صلي الله عليه وسلم اربع وهدنة تكون بينكم وبين بني الاصفر يجمعون لكم تسعة اشهر كقدر حمل المراة ثم يكونون اولي بالغدر منكم قال رسول الله صلي الله عليه وسلم خمس قال وفتح مدينة قال رسول الله صلي الله عليه وسلم ست قلت يا رسول الله اي مدينة قال قسطنطينية ,False,0774IbnKathir.Bidaya
60129641781,12,Shamela0011818-ara1.ms048,ست فيكم ايتها الامة موت نبيكم قال فكانما انتزع قلبي من مكانه قال رسول الله صلي الله عليه وسلم واحدة قال ويفيض المال فيكم حتي ان الرجل ليعطي عشرة الاف يظل يسخطها قال رسول الله صلي الله عليه وسلم اثنتين قال وفتنة تدخل بيت كل رجل منكم قال رسول الله صلي الله عليه وسلم ثلاث قال وموت كقصاص الغنم قال رسول الله صلي الله عليه وسلم اربع وهدنة تكون بينكم وبين بني الاصفر فيجمعون لكم تسعة اشهر كقدر حمل المراة ثم يكونون اولي بالعدل منكم ,False,0774IbnKathir.NihayaFiFitan
60129641781,12,Shamela0009567-ara1.ms0922,واحدة قال ويفيض المال فيكم حتي ان الرجل يعطي عشرة الاف فيظل يتسخطها قال رسول الله صلي الله عليه وسلم ثنتين قال وفتنة تدخل بيت كل رجل منكم قال رسول الله صلي الله عليه وسلم ثلاث قال وموت كعقاص الغنم قال رسول الله صلي الله عليه وسلم اربع وهدنة تكون بينكم وبين بني الاصفر ص فيجمعون لكم تسعة اشهر كقدر حمل المراة ثم يكونون اولي بالغدر منكم قال رسول الله صلي الله عليه وسلم خمس قال وفتح مدينة قال رسول الله صلي الله عليه وسلم ست قلت يا رسول الله اي مدينة قال قسطنطينية حدثنا وكيع عن النهاس بن قهم حدثني شداد ابو عمار عن معاذ بن جبل قال قال رسول الله صلي الله عليه وسلم ست من اشراط الساعة موتي وفتح بيت المقدس ,False,0807NurDinHaythami.GhayatMaqsad
60129641781,12,Shamela0012884-ara1.completed.ms4622,الي فقال ست فيكم ايتها الامة موت نبيكم فكانما انتزع قلبي من مكانه قال رسول الله صلي الله عليه وسلم واحدة قال ويفيض المال فيكم حتي ان الرجل ليعطي عشرة الاف فيظل يسخطها قال رسول الله صلي الله عليه وسلم اثنتين قال وفتنة تدخل بيت كل رجل منكم قال رسول صلي الله عليه وسلم ثلاث قال وموت كقعاص الغنم قال رسول الله صلي الله عليه وسلم اربع وهدنة تكون بينكم وبين بني الاصفر فيجمعون لكم تسعة اشهر بقدر حمل المراة ثم يكونون اولي بالغدر منكم قال رسول الله صلي الله عليه وسلم خمس وفتح مدينة قلت يا رسول الله اي مدينة قال قسطنطينية واخرج ابن ابي شيبة واحمد والبخاري وابو داود وابن ماجة عن عوف بن مالك الاشجعي قال اتيت رسول الله صلي الله عليه وسلم في غزوة تبوك وهو في قبة ادم فقال اعدد ستا بين يدي الساعة موتي ثم فتح بيت المقدس ثم موتان ياخذكم كقعاص الغنم ثم استفاضة المال حتي يعطي الرجل ماءة دينار فيظل ساخطا ,False,0911Suyuti.DurrManthur
