cluster,size,id,text,from_input,book
111669174678,2,Shamela0023614-ara2.ms0787,لقد وعدنا نحن واباءنا هذا من قبل يعني البعث ان هذا الذي يقول محمد صلي الله عليه وسلم الا اساطير الاولين يعني احاديث الاولين وكذبهم قل لكفار مكة لمن الارض ومن فيها من الخلق حين كفروا بتوحيد الله عز وجل ان كنتم تعلمون خلقهما سيقولون لله قل افلا تذكرون في توحيد الله عز وجل فتوحدونه قل لهم من رب السماوات السبع ورب ,False,0150MuqatilIbnSulayman.TafsirMuqatil
111669174678,2,Sham19Y0014404-ara1.ms0987,لقد وعدنا نحن واباءنا هذا من قبل ان هذا الا اساطير الاولين لقد وعدنا نحن هذا الوعد واباءنا هذا من قبل اي وعده اباءنا قوم ذكروا انهم رسل الله فلم نر له حقيقة ان هذا الا اساطير الاولين اكاذيبهم التي كتبوها جمع اسطورة قل لمن الارض ومن فيها ان كنتم تعلمون قل يا محمد مجيبا لاهل مكة لمن الارض ومن فيها من الخلق ان كنتم تعلمون خالقها سيقولون لله قل افلا تذكرون فانهم سيقولون لله فثم قل افلا تذكرون الادلة الدالة علي الصانع فتءمنون قل من رب السماوات السبع ورب ,False,0928MujirDinCulaymi.FathRahman
111669187487,2,Shamela0009784-ara1.ms1741,ربيع الاخر وقيل لثمان بقين منه سنة ثمان وثمانين وماءتين وقيل تسع ودفن في الحجرة الرخام وكان المعتضد يسمي السفاح الثاني لانه جدد ملك بني العباس ومن عجيب ما ذكر عنه المسعودي ان صح قال شكوا في موت المعتضد فتقدم الطبيب فجس نبضه ففتح عينيه ورفس الطبيب برجله فدحاه اذرعا ومات الطبيب ثم مات المعتضد من ساعته وكانت خلافته تسع سنين وتسعة اشهر ونصف وفي سيرة مغلطاي وكانت مدة خلافته عشر سنين وتسعة اشهر وثلاثة ايام وقيل ,False,0966HusaynDiyarbakri.TarikhKhamis
111669187487,2,Sham19Y0122236-ara1.ms093,ربيع الاخر وقيل لثمان بقين منه سنة ثمان وثمانين وماءتين وقيل تسع فكانت مدة خلافته عشر سنين وتسعة اشهر وثلاثة ايام وقيل ,False,0762MughultayIbnQilij.IsharaIlaSira
111669204890,2,JK009266-ara1.ms9613,فخرجوا اليهم متحرزين فاذا هم قد جلبوا لهم الطعام واعانوهم بالاقوات فكان اهل مكة يخرجون الي جدة بالابل والحمر فيشترون الطعام علي مسيرة ليلتين وقيل ان قريشا لما كذبوا النبي صلي الله عليه وسلم دعا عليهم فقال اللهم اجعلها عليهم سنين كسني يوسف فاشتد القحط فقالوا يا محمد ادع الله لنا فانا مءمنون فدعا لهم رسول الله صلي الله عليه وسلم فاخصبت تبالة و جرش من بلاد اليمن فحملوا الطعام الي مكة واخصب اهلها وقال الضحاك وربيع وشريك وسفيان وامنهم من خوف الحبشة مع الفيل وقال علي رضي الله عنه وامنهم من ان تكون الخلافة الا فيهم وقيل كفاهم اخذ الايلاف من المملوك روي الثعلبي عن ابي رضي الله عنه قال قال رسول الله صلي الله عليه وسلم من قرا سورة لايلاف قريش اعطي من الاجر حسنات بعدد من طاف بالكعبة واعتك بها والله اعلم سورة الدين وتسمي الماعون مكية في قول عطاء وجابر واحد قولي ابن عباس ومدنية في قول له اخر وهو قول قتادة وغيره وهي سبع ايات وخمس وعشرون كلمة وماءة وثلاثة وعشرون حرفا بسم الله الرحمن الرحيم س ش ش ارايت الذي يكذب بالدين فذلك الذي يدع اليتيم ولا يحض علي طعام المسكين ,False,0800IbnCadilHanbali.LubabFiCulumKitab
111669204890,2,JK007018-ara1.ms873,فخرجوا اليهم متحرزين فاذا بهم قد جلبوا لهم الطعام واعانوهم بالاقوات من خوف العرب ان تقتلهم او تسبيهم تعظيما للبيت ولما سبق من دعوة ابراهيم اجعل هذا البلد امنا ابراهيم او من خوف الحبشة مع الفيل او من خوف الجذام او امنهم ان تكون الخلافة الا فيهم قاله علي سورة ارايت سورة الماعون مكية او مدنية بسم الله الرحمن الرحيم ارءيت الذي يكذب بالدين فذلك الذين يدع اليتيم ولا يحض علي طعام المسكين ,False,0660SultanCulamaCizzDinDimashqi.TafsirQuran
111669209237,2,SHAM19Y23644-ara1.ms5567,عثمان بن سعيد بن خالد ابو سعيد الدارمي السجزي نزيل هراة رحل الي الامصار ولقي الشيوخ وجالس الامام احمد بن حنبل رحمة الله عليه وابن معين والحفاظ حتي قالوا ما راينا مثله ولا راي عثمان مثل نفسه وكان لا يحدث من يقول بخلق القران ودخل عليه ابو الحسن الطراءفي بهراة فقال له عثمان متي قدمت فاراد ان يقول امس فقال غدا فقال له عثمان فانت في الطريق بعد وكانت وفاته بهراة وقيل في سنة اثنتين وثمانين ومءتين سمع حيوة بن شريح وغيره وروي عنه احمد بن محمد بن الازهر وغيره وكان حافظا ثقة السنة الحادية والثمانون بعد المءتين فيها دخل طغج بن جف صاحب خمارويه من ناحية طرسوس لغزو الروم فبلغ طرابلون وفتح ملورية في جمادي الاخرة وفيها غارت المياه بالري وطبرستان فكان يباع الماء ثلاثة ارطال بدرهم فغلت الاسعار وقحط الناس واكل بعضهم بعضا واكل انسان ابنته ,True,0654SibtIbnJawzi.MiratZaman
111669209237,2,JK001330-ara1.mARkdown.ms0577,عثمان بن سعيد بن خالد الحافظ ابو سعيد الدارمي نزيل هراة رحل الي الامصار ولقي الشيوخ وجالس الامام احمد بن حنبل وابن معين والحفاظ حتي قالوا ما راينا مثله ولا راي هو مثل نفسه وكان لا يحدث من يقول بخلق القران امر النيل في هذه السنة الماء القديم خمس اذرع وثماني اصابع مبلغ الزيادة سبع عشرة ذراعا وعشر اصابع السنة الحادية عشرة من ولاية خمارويه علي مصر وهي سنة احدي وثمانين وماءتين فيها ارسل خمارويه طغج بن جف الي غزو الروم فتوجه من طرسوس حتي بلغ طرابزون وفتح ملورية في جمادي الاخرة وفيها غارت المياه بالري وطبرستان فصار الماء يباع ثلاثة ارطال بدرهم وغلت الاسعار وقحط الناس واكل بعضهم بعضا حتي اكل رجل ابنته ,True,0874IbnTaghribirdi.NujumZahira
111669209238,2,SHAM19Y23644-ara1.ms5567,دخل طغج بن جف صاحب خمارويه من ناحية طرسوس لغزو الروم فبلغ طرابلون وفتح ملورية في جمادي الاخرة وفيها غارت المياه بالري وطبرستان فكان يباع الماء ثلاثة ارطال بدرهم فغلت الاسعار وقحط الناس واكل بعضهم بعضا واكل انسان ابنته ولليلتين خلتا من رجب شخص المعتضد الي الجبل ناحية الدينور وقلد ابنه ابا محمد عليا الري وقزوين وزنجان وابهر والدينور وقلد كتبته احمد بن ابي الاصبغ ونفقات عسكره والضياع بالري الحسين بن عمرو الصزاني وقلد عمر بن عبد العزيز بن ابي دلف اصبهان ونهاوند والكرخ وتعجل الانصراف من غلاء الاسعار وقلة الميرة فوافي بغداد يوم الاربعاء لثلاث خلون من رمضان ,False,0654SibtIbnJawzi.MiratZaman
111669209238,2,Sham19Y0145435-ara1.ms4780,دخل طغج بن جف طرسوس لغزاة الصاءفة من قبل خمارويه يوم الخميس للنصف من جمادي الاخرة فيما قيل وغزا فبلغ طرايون وفتح ملورية ولخمس ليال بقين من جمادي الاخرة مات احمد بن محمد الطاءي بالكوفة ودفن بها في موضع يقال له مسجد السهلة وفيها غارت المياه بالري وطبرستان ولليلتين خلتا من رجب منها شخص المعتضد الي الجبل فقصد ناحية الدينور وقلد ابا محمد علي بن المعتضد الري وقزوين وزنجان وابهر وقم وهمذان والدينور وقلد كتبته احمد بن ابي الاصبغ ونفقات عسكره والضياع بالري الحسين بن عمرو الضراني وقفد عمر بن عبد العزيز بن ابي دلف اصبهان ونهاوند والكرج وتعجل للانصراف من اجل غلاء السعر وقلة الميرة فوافي بغداد يوم الاربعاء لثلاث خلون من شهر رمضان ,False,1411MuhammadTahirBarnaji.SahihWaDacifTarikhTabari
111669259963,2,JK009266-ara1.ms8063,واني عذت بربي وربكم ان ترجمون وان لم تءمنوا لي فاعتزلون فدعا ربه ان هءلاء قوم مجرمون فاسر بعبادي ليلا انكم متبعون واترك البحر رهوا انهم جند مغرقون كم تركوا من جنات وعيون وزروع ومقام كريم ونعمة كانوا فيها فاكهين كذلك واورثناها قوما اخرين ,False,0800IbnCadilHanbali.LubabFiCulumKitab
111669259963,2,Shamela0000922-ara1.ms1124,واني عذت بربي وربكم ان ترجمون اي ان تقتلون وقوله وان لم تءمنوا لي فاعتزلون اي ان لم تءمنوا لي فلا تكونوا علي ولا معي فدعا ربه ان هءلاء قوم مجرمون من كسر ان فالمعني قال ان هءلاء و ان بعد القول مكسورة ويجوز الفتح علي معني فدعا ربه بان هءلاء وقوله واترك البحر رهوا انهم جند مغرقون جاء في التفسير يبسا كما قال فاضرب لهم طريقا في البحر يبسا وقال اهل اللغة رهوا ساكنا وقوله كم تركوا من جنات وعيون وزروع ومقام كريم جاء في التفسير ان المقام الكريم يعني به المنابر ههنا وجاء في مقام كريم اي في منازل حسنة قوله كذلك واورثناها قوما اخرين ,False,0311IbnSariZajjaj.MacaniQuran
111669286524,2,Shia001432Vols-ara1.msB24806,فلما مات قال بنوه ان فعلنا ما كان يفعل ابونا ضاق علينا الامر ونحن اولوا عيال فحلفوا ليصرمنها مصبحين داخلين في وقت الصباح خفية عن المساكين ولا يستثنون اي لم يقولوا انشاء الله في يمينهم فاحرق الله جنتهم وقال البيضاوي ولا يستثنون ولا يقولون انشاء الله وانما سماه استثناء لما فيه من الاخراج غير ان المخرج به خلاف المذكور والمخرج بالاستثناء عينه او لان معني لاخرج انشاء الله ولا اخرج الا ان يشاء الله واحد او لا يستثنون حصة المساكين كما كان يخرج ابوهم فطاف عليها علي الجنة طاءف بلاء طاءف من ربك ,False,1111Majlisi.BiharAnwar
111669286524,2,Shamela0029743-ara1.ms1137,فلما مات قال ابناءه كان ابونا احمق اذ كان يصرف منها شيءا كثيرا علي الفقراء اذ اقسموا فحلفوا ليصرمنها ليقطعن ثمرها مصبحين داخلين في الصبح خفية عن المساكين ولا يستثنون لا يقولون ان شاء الله قيل لا يستثنون حصة المساكين كما كان يخرج ابوهم فطاف عليها علي الجنة طاءف بلاء طاءف من ربك ,False,0905IbnCabdRahmanIjiShafici.Tafsir
111669297497,2,Shamela0000176-ara1.completed.ms290,القصر واستغاثوا وقالوا يا قوم قد جءناكم وفارقنا اهلينا وقد هلكنا من الجوع فان لم يكن لكم حاجة باقامة الدعوة بمكة والمدينة فاصرفونا فانا قد بذل لنا الرغاءب في اقامة الدعوة لغير امامكم فلم ناخذها ونريد انسانا يكلمنا فلم يجابوا بشء وكانوا قد مضوا قبل ذلك الي رجال الدولة كمعضاد وغيره فصار يدفعهم هذا الي هذا فلما انصرفوا عن باب القصر خاءبين بعث اليهم جمال الدولة مظفر الصقلبي صاحب المظلة الف دينار من ماله فقالوا لا ناخذ الا ما يصلنا به امير المءمنين وهذه الصلة قد قبلناها والله مجازيك عليها ونحن نفرقها علي ضعفاءنا وعبيدنا ففرقوها علي خمسماءة نفس لكل واحد ديناران واشتد الغلاء والقحط بمصر فبيع الخبز السميد رطلين بدرهم والحملة الدقيق باربعة دنانير وثلثين والتليس القمح بثلاثة دنانير واللحم اربع اواق بدرهم وعظم الموت سيما في الفقراء وبلغ الناس الجهد حتي ان جزارا طرح عظما لكلب فطرد رجل الكلب واخذ العظم منه وابتلعه نيءا واكل المساكين الصماليخ من القنبيط واقتاتوا باليسير من كسب الوز وكسب السمسم وغلت عامة الحبوب وغلا الماء لتعذر علف الدواب وعدم من يستقي عليها ,True,0845Maqrizi.ItticazHunafa
111669297497,2,Kraken210223142004-ara1.ms144,القصر وقالوا يا قوم جتناكم و فارقنا اولادنا واهالينا وقد هلكنا من الجوع فان يكن ليس لكم باقامة الدعوة ه و ليتة حاجة فاصرفونا فانا قد يذل لنا الرغاتب في القاعة الدعرة لفر امامكم بالحجاز فلم ناخذها ولم نجب اليها ونريد انسانا يكلمنا ونكليه فلم يجابوا بشء ثم انفذ االيهم بهاء الدولة مظفر الصقلبي صاحب المظلة من ماله الف دينار فقالوا نحن لا ناخذ الا ما يصلنا به امير المءمنين وهذه الصلة التي وصلتنا بها فقد قبلناها والله مجازيك عليها ونحن نفرقها علي ضعفاءنا وعبيدنا ففرقوها علي خمس ماءة نسمة فصار لكل واحد منهم من جملتها ديناران و في يوم الجمعة لثلاث عشرة ليلة خلت منه اشتد امر الغلاء والقحط بمصر و بيع الخبز السميد رطلين بدرهم وربع والخبز الخشكار رطلين بدرهم والحملة الدقيق باربعة دنانير ونصف وقيراطين والتليس القمح بثلاثة دنانير وبيع اللحم اربع اواق بدرهم وتواثر الموت في اكثر الناس ولاسبا الفقراء والمساكين وبلغ من امر الناس ان جزارا طرح عظما لكلب فراه رجل شاب مستور متعفف فطرد الكلمب واخذ العظم منه ولم يزل يمتصه نيا الي ان نال من مصه بلغة فطرحه من يده وذهب وكان اكثر اكل الضعفاء وما يطعمونه اولادهم العساليج ب الخاشنة من القنبيط التي ينزعها البقالون عن رءوس الكرنب ويرمونها فيقتاتها الضفاء وباليسير من كسب اللوز وكسب السمسم وغلت ساءر القطاني كلها والحبوب باجمعها وحل بالناس ضر ومصعبة عظيمة وغلا الماء ايضا لتعذر في المخطوط حيوا في امخطوط مطار قارن الاتعاظ في المخطوط اواقي في المخطوط اهل ما يعتلفه الدواب وعدم من يستقي عليها ,True,0420Musabbihi.AkhbarMisr
111669297498,2,Shamela0000176-ara1.completed.ms290,الشرطة السفلي بين يديه ونودي في الناس الا يختلط المسلمون مع النصاري عند نزولهم في البحر بالليل وامر الظاهر القاءد نافذا ان يزيد في وقيد النار والمشاعل في الليل ففعل وكان وقيدا طويي وحضر القسيسون والشماسة بالصلبان والنيران فقسسوا طويلا وانصرفوا الي حيث يغطسون فمات في هذه الليلة للظاهر طفلة سنها ثلاث سنين وشهور وهي اخر ولد بقي له ,False,0845Maqrizi.ItticazHunafa
111669297498,2,Kraken210223142004-ara1.ms143,الشرة السفلي المعروف بابن كافي قاءم بين يديه ونودي في الناس ان لايختلط المسلمون مع النصاري عند نزولهم في البحر في اللميل وامرامير المءمتين صلوات الله عليه ثافدا بان يتقد وقيد النار والمشاعل في الليل الي تحت الساباط ففعل ذلك وكان وقيدا حسنا طويلا واقام زمانا هناك ثم انصرف وحضر جماعة من القسيسين تبتدء من هنا القطعة الثانية المنقولة في ص وما بعدها لذبان يجدون المال الكلمات الاربع الاخيرة مكررة في المخطوط في المخطوط غيرهما في المخطوط نافد والشمامسة بالصلبان والنيران فقسسوا هناك طويلا وانصرقوا الي حيث يخطسون وفي ليلة الغطاس المذكور توفيت ابنة مولانا صلوات الله عليه وهي اخر ولد بقي له ,False,0420Musabbihi.AkhbarMisr
120259121899,2,Shamela0035100-ara1.mARkdown.ms05392,دخل نجا غلام سيف الدولة بن حمدان الي بلاد الروم فسبي الف نفس وغنم اموالا واسر خمسماءة وفيها مات عبد الملك بن نوح صاحب بلاد خراسان تنقطر به فرسه ونصبوا مكانه منصور بن نوح وارسل اليه الخليفة التقليد وفيها اخذ ملك الروم ارمانوس بن قسطنطين من المسلمين جزيرة اقريطش فلا حول ولا قوة الا بالله وكان الذي افتتح اقريطش عمر بن شعيب الغليظ البلوطي غزاها فافتتحها في حدود الثلاثين وماءتين وصارت في يد اولاده الي هذا الوقت وفيها ,False,0748Dhahabi.TarikhIslam
120259121899,2,JK001330-ara1.mARkdown.ms0741,دخل غلام سيف الدولة بن حمدان الي بلاد الروم وسبي الف نفس وغنم اموالا كثيرة وفيها اخذ ملك الروم ارمانوس بن قسطنطين من المسلمين جزيرة اقريطش من بلاد المغرب وكان الذي افتتح اقريطش عمر بن شعيب غزاها وافتتحها في حدود سنة ثلاثين وماءتين وصارت في يد اولاده الي هذا الوقت وفيها ,False,0874IbnTaghribirdi.NujumZahira
120259121900,2,Shamela0035100-ara1.mARkdown.ms05391,شرع معز الدولة لما تعافي في بناء دار هاءلة عظيمة ببغداد اخرب لاجلها دورا وقصورا وقلع ابواب الحديد التي علي باب مدينة المنصور والزم الناس ببيع املاكهم ليدخلها في البناء ونزل في الاساسات ,False,0748Dhahabi.TarikhIslam
120259121900,2,JK001330-ara1.mARkdown.ms0741,شرع معز الدولة بن بويه في بناء دار هاءلة عظيمة ببغداد واخرب لاجلها دورا وقصورا وقلع ابواب الحديد التي كانت علي ابواب مدينة المنصور والزم الناس ببيع املاكهم ليدخلها في البناء ونزل في الاساسات ,False,0874IbnTaghribirdi.NujumZahira
120259121901,2,JK001330-ara1.mARkdown.ms0741,وتزايد الغلاء وعز وجود القمح ثم قدم القرمطي الي الشام في سنة اثنتين وخمسين وثلثماءة ووقع له بها امور وعجز المصريون عن دفعه عنها لشغلهم بالغلاء والمغاربة الفاطميين ومع هذا قل ماء النيل في هذه السنين فارتفعت الاسعار اكثر مما كانت عليه ووهنت ضياع مصر وقراها من عدم زيادة النيل وعظم الغلاء وكثرت الفتن وسار ملك النوبة الي اسوان ووصل الي اخميم وقتل ونهب وسبي واحرق وعظم اضطراب اعمال الديار المصرية قبليها وبحريها ثم فسد ما بين علي بن الاخشيذ صاحب مصر وبين مدبر مملكته كافور الاخشيذي ومنع كافور الناس من الاجتماع به حتي اعتل علي المذكور بعلة اخيه انوجور ومات لاحدي عشرة خلت من المحرم سنة خمس وخمسين وثلثماءة وحمل الي المقدس ودفن عند ابيه الاخشيذ واخيه انوجور وبقيت مصر من بعده اياما بغير امير وكافور يدبر امرها علي عادته في ايام اولاد الاخشيذ ومعه ابو الفضل جعفر بن الفرات ثم ولي كافور ,True,0874IbnTaghribirdi.NujumZahira
120259121901,2,Shamela0011566-ara1.completed.ms0753,وتزايد الغلاء وعز وجود القمح وقدم القرمطي الي الشام في سنة ثلاث وخمسين وقل ماء النيل ونهبت ضياع مصر وتزايد الغلاء وسار ملك النوبة الي اسوان ووصل الي اخميم فقتل ونهب واحرق واشتد اضطراب الاعمال وفسد ما بين كافور وبين علي بن الاخشيد فمنع كافور من الاجتماع به واعتل علي بعد ذلك علة اخيه ومات لاحدي عشرة خلت من المحرم سنة خمس وخمسين وثلثماءة فحمل الي القدس وبقيت مصر بغير امير اياما ولم يدع بها الا للمطيع لله وحده وكافور يدبر امورها ومعه ابو الفضل جعفر بن الفرات ثم ولي كافور ,True,0845Maqrizi.Mawaciz
120259126288,2,Shamela0023631-ara1.ms4515,اذ اقسموا ليصرمنها مصبحين اي ليقطعن ثمارها مبكرين بحيث لا يعلم مسكين بذلك ولا يستثنون قال المهايمي اي ولا يخرجون شيءا من حق المساكين واقتصر عليه وحكاه الرازي والقاضي قولا ثانيا والاول ان معناه ولا يقولون ان شاء الله واقتصر عليه ابن جرير والاول اظهر والاستثناء بمعني الاخراج الحسي والجملة معطوفة علي ليصرمنها ومقسم عليها القول في تاويل قوله تعالي سورة القلم الايات الي فطاف عليها طاءف من ربك وهم ناءمون فاصبحت كالصريم فطاف عليها طاءف من ربك اي فطرق جنة هءلاء القوم طارق من امر الله لتدميرها قال ابن جرير ولا يكون الطاءف في كلام العرب الا ليلا ولا يكون نهارا وقد يقولون اطفت بها نهارا وذكر الفراء ان ابا الجراح انشده اطفت بها نهارا غير ليل والهي ربها طلب الرخال و الرخال اولاد الضان الاناث فقوله وهم ناءمون اي مستغرقون في سباتهم غافلون عما يمكر بهم تاكيد علي الاول وتاسيس علي الثاني فاصبحت كالصريم اي كالبستان الذي صرم ثمره بحيث لم يبق فيه شء ,False,1332IbnMuhammadJamalDinQasimi.MahasinTawil
