cluster,size,id,text,from_input,book
283468036680,2,Shamela0000041-ara1.completed.ms1203,اسرع مكرا ان رسلنا يكتبون ما تمكرون هو الذي يسيركم في البر والبحر حتي اذا كنتم في الفلك وجرين بهم بريح طيبة وفرحوا بها جاءتها ريح عاصف وجاءهم الموج من كل مكان وظنوا انهم احيط بهم دعوا الله مخلصين له الدين لءن انجيتنا من هذه لنكونن من الشاكرين ويقولون يعني اهل مكة لولا انزل عليه اي علي محمد صلي الله عليه وسلم اية من ربه علي ما نقترحه فقل انما الغيب لله يعني قل انما سالتموني الغيب وانما الغيب لله لا يعلم احد لم لم يفعل ذلك ولا يعلمه الا هو وقيل الغيب نزول الاية الا يعلم متي ينزل احد غيره فانتظروا نزولها اني معكم من المنتظرين وقيل فانتظروا قضاء الله بيننا بالحق باظهار المحق علي المبطل قوله عز وجل واذا اذقنا الناس يعني الكفار رحمة من بعد ضراء اي راحة ورخاء من بعد شدة وبلاء وقيل القطر بعد القحط مستهم اي اصابتهم اذا لهم مكر في اياتنا قال مجاهد تكذيب واستهزاء وقال مقاتل بن حيان لا يقولون هذا من رزق الله انما يقولون سقينا بنوء كذا وهو قوله وتجعلون رزقكم انكم تكذبون الواقعة قل الله اسرع مكرا اعجل عقوبة واشد اخذا واقدر علي الجزاء يريد عذابه في اهلاككم اسرع اليكم مما ياتي منكم في دفع الحق ان رسلنا حفظتنا يكتبون ما تمكرون وقرا يعقوب يمكرون بالياء قوله تعالي هو الذي يسيركم ,False,0510IbnMascudBaghawi.Tafsir
283468036680,2,Shamela0023594-ara1.ms0835,اسرع مكرا ان رسلنا يكتبون ما تمكرون قوله تعالي ويقولون لولا انزل عليه اية من ربه وذلك حين قال عبد الله بن امية لن نءمن لك حتي تفجر لنا من الارض ينبوعا الاسراء وسالته قريش ان ياتيهم باية فقال الله تعالي لمحمد صلي الله عليه وسلم فقل انما الغيب لله اي نزول الاية من عند الله تعالي فانتظروا نزولها اني معكم من المنتظرين لنزولها ويقال فانتظروا بي الموت اني معكم من المنتظرين لهلاككم قوله تعالي واذا اذقنا الناس يعني اصبنا الناس رحمة يعني المطر ويقال العافية من بعد ضراء مستهم من بعد القحط ويقال من بعد الشدة والبلاء اصابتهم اذا لهم مكر في اياتنا يعني تكذيبا بالقران ويقال تكذيبا بنعمة الله تعالي ويقولون سقينا بنوء كذا ولا يقولون هذا من رزق الله تعالي وقال القتبي اذا لهم مكر في اياتنا يعني قولهم بالطعن والحيلة ليجعلوا لتلك الرحمة سببا اخر قل الله اسرع مكرا يعني اشد عذابا واشد اخذا ان رسلنا الحفظة يكتبون ما تمكرون يعني ما تقولون من التكذب سورة يونس الايات الي هو الذي يسيركم ,False,0367AbuLaythSamarqandi.BahrCulum
283468036689,2,JK009266-ara1.ms4746,بريح طيبة لينة وفرحوا بها اي بالريح جاءتها اي جاءت الفلك او جاءت الريح اللينة كما تقدم ريح عاصف شديدة ولم يقل عاصفة لاختصاص الريح بالعصوف وقيل الريح يذكر ويءنث ,False,0800IbnCadilHanbali.LubabFiCulumKitab
283468036689,2,Shamela0000041-ara1.completed.ms1203,بريح طيبة لينة وفرحوا بها اي بالريح جاءتها ريح اي جاءت الفلك ريح عاصف شديدة الهبوب ولم يقل ريح عاصفة لاختصاص الريح بالعصوف وقيل الريح تذكر وتءنث ,False,0510IbnMascudBaghawi.Tafsir
283468036691,2,JK009266-ara1.ms4738,اسرع مكرا ان رسلنا يكتبون ما تمكرون قوله ويقولون اي كفار مكة لولا انزل عليه اي علي محمد اية من ربه علي ما نقترحه وذلك ,False,0800IbnCadilHanbali.LubabFiCulumKitab
283468036691,2,Shamela0000041-ara1.completed.ms1203,اسرع مكرا ان رسلنا يكتبون ما تمكرون هو الذي يسيركم في البر والبحر حتي اذا كنتم في الفلك وجرين بهم بريح طيبة وفرحوا بها جاءتها ريح عاصف وجاءهم الموج من كل مكان وظنوا انهم احيط بهم دعوا الله مخلصين له الدين لءن انجيتنا من هذه لنكونن من الشاكرين ويقولون يعني اهل مكة لولا انزل عليه اي علي محمد صلي الله عليه وسلم اية من ربه علي ما نقترحه فقل ,False,0510IbnMascudBaghawi.Tafsir
292057781258,2,JK000911-ara1.mARkdown.ms3666,واقام الي ان رحل السلطان عن بغداد في شوال فاحضره عنده بالنهروان قد تقدم الي الامير حسين بن اتابك قتلغتكين ليسير معه العساكر التي سيرها الي الموصل مع الامير مودود لقتال جاولي سقاوو ليمضوا معه الي الشام وخلع عليه السلطان خلعا نفيسة واعطاه شيءا كثيرا وودعه وسار ومعه الامير حسين فلم يجد ذلك نفعا وكان ما نذكره بعد ان شاء الله ,False,0630IbnAthirCizzDin.Kamil
292057781258,2,Shamela0010283-ara1.mARkdown.ms5287,واقام ببغداد الي ان رحل السلطان محمد عن بغداد في شوال فتقدم الي الامير حسين بن اتابك قتلغتكين ان يسير معه العساكر التي سيرها الي الموصل مع اولاد مودود وخلع عليه السلطان خلعا سنية واعطاه شيءا كثيرا وودعه وسار مع الامير حسين فلم يجد ذلك نفعا وفيها عزل الخليفة وزيره مجد الدين هبة الله ,False,0733Nuwayri.NihayatArab
292057800326,2,Shamela0010273-ara1.ms3447,ولم يعرف حتي فضحته الاية والنطفة اذا خبثت خبث الناشء عنها روي انه دخل علي امه وقال لها ان محمدا وصفني بشعرة اوصاف وجدت تسعة في فاما الزنيم فلا علم لي به فان اخبرتني بحقيقته والا ضربت عنقك فقالت ان اباك عنين وخفت ان يموت فيصل المال الي غير ولده فدعوت راعيا فانت من ذلك الراعي ه وقيل هو الاخنس بن شريق اصله من ثقيف وعداده في بني زهرة ان كان ذا مال وبنين متعلق بقوله لا تطع اي لاتطع من هذه مثالبه لان كان صاحب مال وبنين مستظهرا بهم فانه حظه من الدنيا وقيل متعلق بما بعده اي لان كان ذا مال وبنين كذب باياتنا يدل عليه قوله تعالي اذا تتلي عليه اياتنا اي القران قال اساطير الاولين اي اكاذيب المتقدمين ولا يعمل فيه قال لان ما بعد الشرط لا يعمل فيما قبله ومن قرا بكسر ان فشرط حذف جوابه اي ان كان ذا مال فلا تطعه والمعني لا تطع كل حلاف شارطا يساره قيل لما عاب الوليد النبي صلي الله عليه وسلم كاذبا بامر واحد وهو الجنون سماه الله تعالي صادقا بعشرة اسماء فاذا كان من عدله ان يجزي المسء الي رسول الله صلي الله عليه وسلم بعشر كان من فضله ان يجزي المصلي عليه او المادح له بعشر فاكثر سنسمه علي الخرطوم سنعلمه علي انفه بالكي بالنار اهانة له وتخصيص الانف بالذكر لان الوسم عليه ابشع وقيل خطم بالسيف يوم بدر فبقيت سمة علي خرطومه ,False,1224IbnCajiba.BahrMadid
292057800326,2,Shamela0001394-ara1.ms1726,ولم يعرف حتي نزلت هذه الاية والنطفة اذا خبثت خبث الناشء منها روي انه دخل علي امه وقال ان محمدا وصفني بعشر صفات وجدت تسعا في فاما الزنيم فلا علم لي به فان اخبرتني بحقيقته والا ضربت عنقك فقالت ان اباك عنين وخفت ان يموت فيصل ماله الي غير ولده فدعوت راعيا الي نفسي فانت من ذلك الراعي ان كان ذا مال وبنين ان كان ذا مال متعلق بقوله ولا تطع اي ولا تطعه مع هذه المثالب لان كان ذا مال اي ليساره وحظه من الدنيا ويجوز ان يتعلق بما بعده اي لان كان ذا مال وبنين كذب باياتنا يدل عليه اذا تتلي عليه اياتنا قال اساطير الاولين اذا تتلي عليه اياتنا اي القران قال اساطير الاولين ولا يعمل فيه قال لان ما بعد الشرط لا يعمل فيما قبله اان حمزة وابو بكر اي الان كان ذا مال كذب اان شامي ويزيد ويعقوب وسهل قالوا لما عاب الوليد النبي صلي الله عليه وسلم كاذبا باسم واحد وهو المجنون سماه الله تعالي بعشرة اسماء صادقا فان كان من عدله ان يجزي المسء الي رسول الله صلي الله عليه وسلم بعشرة كان من فضله ان من صلي عليه وسلم بها عشرا سنسمه علي الخرطوم سنسمه سنكويه علي الخرطوم علي انفه مهانة له وعلما يعرف به وتخصيص الانف بالذكر لان الوسم عليه ابشع وقيل خطم بالسيف يوم بدر فبقيت سمة علي خرطومه ,False,0710IbnAhmadHafizDinNasafi.Tafsir
292057813453,2,Sham19Y0013231-ara1.ms2684,يبتغي ايهم هو اقرب الوسيلة الي الله اي يتقرب اليه بالعمل الصالح ونحو هذا قال ابن عباس في قوله ايهم اقرب قال يتقربون الي الله بصالح الاعمال فيرجون رحمته ويريدون جنته ويخافون عذابه ,False,0468IbnAhmadWahidiNaysaburi.TafsirBasit
292057813453,2,Shamela0021821-ara1.ms1030,يبتغي ايهم اقرب الوسيلة الي الله اي يتقرب اليه بالعمل الصالح قال ابن عباس يتقربون الي الله بصالح الاعمال فيرجون رحمته ويريدون جنته ويخافون عذابه ,False,0468IbnAhmadWahidiNaysaburi.WasitFiTafsir
292057813459,2,Sham19Y0013231-ara1.ms2684,ابن مسعود اذا ظهر الزنا والربا في اهل قرية اذن الله في هلاكها وقال مقاتل اما الصالحة فبالموت واما الطالحة فبالعذاب وقال ابن عباس في هذه الاية فهلك اهلها قبل يوم القيامة او يعذبهم مثل ما فعل باهل مكة عذبهم بالجوع حتي اكلوا العلهز كان ذلك في الكتاب مسطورا قال يريد مكتوبا في اللوح المحفوظ وقال ابو اسحاق اي ما من اهل قرية الا سيهلك اما بموت واما بعذاب يستاصلهم ,False,0468IbnAhmadWahidiNaysaburi.TafsirBasit
292057813459,2,Shamela0021821-ara1.ms1030,ابن مسعود اذا ظهر الزنا والربا في اهل قرية اذن الله في اهلاكها وقال مقاتل اما الصالحة فبالموت واما الطالحة فبالعذاب وقال الزجاج اي ما من اهل قرية الا وسيهلك اما بموت او بعذاب يستاصلهم ,False,0468IbnAhmadWahidiNaysaburi.WasitFiTafsir
292057849977,2,JK009266-ara1.ms8386,و صبر لحكم اي الي ان يقع بهم العذاب الذي حكمت عليهم فانك باعيننا قراءة العامة بالفك وابو السمال بادغام النون فيما بعدها وناسب جمع الضمير هنا جمع العين الا تراه افرد حيث افردها في قوله ولتصنع علي عيني طه قاله الزمخشري والمعني فانك بمراي منا قال ابن عباس نري ما يعمل بك وقال الزجاج انك بحيث نراك ونحفظك فلا يصلون الي مكروهك ,False,0800IbnCadilHanbali.LubabFiCulumKitab
292057849977,2,Shamela0021821-ara1.ms1768,واصبر لحكم ربك الطور اي الي ان يقع بهم العذاب الذي حكمنا عليهم فانك باعيننا قال ابن عباس اري ما يفعل بك وقال الزجاج انك بحيث نراك ونحفظك ونرعاك فلا يصلون الي مكروهك ,False,0468IbnAhmadWahidiNaysaburi.WasitFiTafsir
292057867989,2,Shamela0006624-ara1.ms173,ثماني عشرة فيها امحل الحجاز فاستعان عمر الامصار فكان ممن قدم عليه ابو عبيدة باربعة الاف راحلة زادا فقسم عمر حتي ارخصت المدينة ولما اشتد القحط استقسي بالعباس فسقوا واقبل الناس يتمسحون باذيال العباس وفيها كان طاعون عمواس بالشام مات به ابو عبيدة رضي الله عنه واستخلف ابو عبيدة معاذ بن جبل فمات بالطاعون فاستخلف عمرو بن العاص ومات في هذا الطاعون خمسة وعشرون الفا ومكث شهرا وطمع العدو وكان بالبصرة مثله وفيها سار عمر الي الشام فقسم مواريث الموتي به ثم رجع الي المدينة في ذي القعدة ثم دخلت سنة تسع عشرة وسنة عشرين فيها فتحت مصر والاسكندرية علي يد عمرو بن العاص والزبير فنزلا عين شمس بقرب المطرية ففتحاها وبعث عمرو بن العاص ابرهة بن الصباح الي الفرما وضرب عمرو فسطاطه موضع جامعه بمصر الان واختطت مصر وبني الجامع ثم فتح الاسكندرية عنوة بعد قتال شديد وفيها توفي بلال بن رباح مءذن النبي صلي الله عليه وسلم وهو مولي ابي بكر الصديق واسم امه حمامة وهو من مولدي الحبشة اسلم بعد اسلام ابي بكر ولم يءذن بعد النبي صلي الله عليه وسلم طلب من ابي بكر ان يرسله في الجهاد فساله ابو بكر ان يقيم معه فاقام ثم ولي عمر فساله ذلك فابي وسار الي دمشق وبها مات ودفن بباب الصغير ثم دخلت سنة احدي وعشرين فيها وقعة ,False,0749ZaynDinIbnWardi.Tarikh
292057867989,2,Shamela0012715-ara1.mARkdown.ms0220,ثماني عشرة فيها حصل في المدينة والحجاز قحط عظيم فكتب عمر الي ساءر الامصار يستعينهم فكان ممن قدم عليه ابو عبيدة من الشام باربعة الاف راحلة من الزاد وقسم عمر ذلك علي المسلمين حتي رخص الطعام بالمدينة ولما اشتد القحط خرج عمر ومعه العباس وجمع الناس واستسقي مستشفعا بالعباس فما رجع الناس حتي تداركت السحب وامطروا واقبل الناس يتمسحون باذيال العباس رضي الله عنه وفي هذه السنة اعني سنة ثمان عشرة كان طاعون عم الناس بالشام مات به ابو عبيدة بن الجراح واسمه عامر بن عبد الله بن الجراح الفهري احد العشرة المشهود لهم بالجنة واستخلف ابو عبيدة علي الناس معاذ بن جبل الانصاري فمات ايضا بالطاعون واستخلف عمرو بن العاص ومات من الناس في هذا الطاعون خمسة وعشرون الف نفس فطال مكثه شهرا وطمع العدو في المسلمين واصاب بالبصرة مثله وفي هذه السنة سار عمر الي الشام فقسم مواريث الذين ماتوا ثم رجع الي المدينة في ذي القعدة ثم دخلت سنة تسع عشرة وسنة عشرين فيها فتحت مصر والاسكندرية علي يد عمرو بن العاص والزبير بن العوام فنازلا عين شمس وهي بقرب المطرية وكان لها جمعهم ففتحاها وبعث عمرو بن العاص ابرهة بن الصباح الي الفرماء وضرب عمرو فسطاطه موضع جامع عمرو بمصر الان واختطت مصر وبني موضع الفسطاط الجامع المعروف بجامع عمرو بن العاص ثم توجه الي الاسكندرية ففتحها عنوة بعد قتال كثير وفيها اعني سنة عشرين توفي بلال بن رباح مءذن رسول الله صلي الله عليه وسلم وهو مولي ابي بكر الصديق واسم امه حمامة وهو من مولدي الحبشة اسلم بعد اسلام ابي بكر الصديق ولم يءذن بعد رسول الله صلي الله عليه وسلم فطلب من ابي بكر ان يرسله الي الجهاد فساله ابو بكر ان يقيم معه فاقام معه حتي تولي عمر فساله عمر ذلك فابي بلال وسار الي دمشق واقام بها حتي مات ودفن عند الباب الصغير ثم دخلت سنة احدي وعشرين فيها كانت وقعة ,False,0732AbuFida.MukhtasarFiAkhbar
292057867990,2,Kraken210630005153-ara1.ms8351,هذا الطاعون خمسة وعشرون الفا وطال مكثه شهرا وطمع العدو في المسلمين واصاب الناس في البصرة مثله و في هذه السنة سار عمر الي الشام ليقسم مواريث الذين ماتوا ورجع الي المدينة في ذي القعدة سنة تسع عشرة وعشرين فيها فتحت مصر والاسكندرية علي يد عمرو بن العاص والزبير بن العوام فنازلا عين شمس وهي بقرب المطرية وكان بها جمعهم ففتحاها وبعث عمرو بن العاص ابرهة بن الصباح الي الفرما وضرب عمرو فسطاطه موضع جامعه بمصر الان وبني الجامع المعروف ثم توجه الي الاسكندرية ففتحها عنوة بعد قتال كبير و فيها اعني سنة عشرين توفي بلال ابن حمامة واسم ابيه رباح مءذن ر سول الله وطلب من ابي بكر ان يرسله في الجهاد فساله ابو بكر ان يقيم معه فاقام حتي تولي عمر فساله ذلك فابي بلال وسار الي دمشق واقام بها حتي مات ودفن عند الباب الصغير سنة احدي وعشرين فيها كانت وقعة نهاوند مع الاعاجم ,False,0749IbnFadlAllahCumari.MasalikAbsar
292057867990,2,Shamela0006624-ara1.ms173,هذا الطاعون خمسة وعشرون الفا ومكث شهرا وطمع العدو وكان بالبصرة مثله وفيها سار عمر الي الشام فقسم مواريث الموتي به ثم رجع الي المدينة في ذي القعدة ثم دخلت سنة تسع عشرة وسنة عشرين فيها فتحت مصر والاسكندرية علي يد عمرو بن العاص والزبير فنزلا عين شمس بقرب المطرية ففتحاها وبعث عمرو بن العاص ابرهة بن الصباح الي الفرما وضرب عمرو فسطاطه موضع جامعه بمصر الان واختطت مصر وبني الجامع ثم فتح الاسكندرية عنوة بعد قتال شديد وفيها توفي بلال بن رباح مءذن النبي صلي الله عليه وسلم وهو مولي ابي بكر الصديق واسم امه حمامة وهو من مولدي الحبشة اسلم بعد اسلام ابي بكر ولم يءذن بعد النبي صلي الله عليه وسلم طلب من ابي بكر ان يرسله في الجهاد فساله ابو بكر ان يقيم معه فاقام ثم ولي عمر فساله ذلك فابي وسار الي دمشق وبها مات ودفن بباب الصغير ثم دخلت سنة احدي وعشرين فيها وقعة نهاوند مع الاعاجم ,False,0749ZaynDinIbnWardi.Tarikh
292057889651,2,SHAM19Y23644-ara1.ms5568,محمد بن عبد الله بن ترنجة وفيها توفي ابن ابي الدنيا واسمه عبد الله بن محمد بن عبيد بن سفيان بن قيس ابو بكر القرشي البغدادي مولي بني امية ولد في سنة ثمان ومءتين وكان مءدبا لجماعة من اولاد الخلفاء منهم المعتضد وابنه علي المكتفي وكان اماما عالما فاضلا زاهدا عابدا ورعا ثقة ذا مروءة تامة ونية صادقة وله التصانيف الحسان وبورك له فيها والناس بعده عيال عليه في الفنون التي جمعها ,False,0654SibtIbnJawzi.MiratZaman
292057889651,2,JK001330-ara1.mARkdown.ms0577,واكل بعضهم بعضا حتي اكل رجل ابنته وفيها توفي ابن ابي الدنيا واسمه عبد الله بن محمد ابو بكر القرشي البغدادي مولي بني امية ولد سنة ثمان وماءتين وكان مءدبا الجماعة من اولاد الخلفاء منهم المعتضد وابنه المكتفي وكان عالما زاهدا ورعا عابدا وله التصانيف الحسان والناس بعده عيال عليه في الفنون التي جمعها ,False,0874IbnTaghribirdi.NujumZahira
292057923458,2,JK000916-ara1.mARkdown.ms20725,انبانا ابو عبد الله الحافظ اخبرني ابو بكر محمد بن داود بن سليمان شيخ عصره في التصوف حدثني علي بن محمد بن خالد المطرز حدثني علي بن الموفق حدثنا داود بن رشيد قال قام اخ لك في ليلة ظلماء يصلي مع نفسه فضر به البرد وكان رث الثياب وشدة البرد ثم سجد فذهب به النوم في سجوده فهتف به هاتف انمناهم واقمناك وتبكي علينا قرات علي ابي القاسم زاهر بن طاهر بن ابي بكر البيهقي انبانا ابو عبد الله الحافظ قال ,False,0571IbnCasakir.TarikhDimashq
292057923458,2,JK000021-ara1.completed.ms0985,اخبرنا ابو عبد الله الحافظ اخبرني ابو بكر محمد بن داود بن سليمان شيخ عصره في التصوف حدثني علي بن محمد بن خالد المطرز حدثني علي بن الموفق ثنا داود بن رشيد قال قام اخ لك في ليلة ظلماء يصلي مع نفسه فضربه البرد وكان رث الثياب وشدة البرد ثم سجد فذهب به النوم في سجوده فهتف به هاتف انمناهم واقمناك وتبكي علينا اخبرنا ابو عبد الرحمن السلمي قال ,False,0458Bayhaqi.ShucabIman
292057923459,2,JK000916-ara1.mARkdown.ms20725,الزاهد ابو بكر شيخ التصوف في عصره بخراسان والعراق فانه خرج من نيسابور سنة اربع وسبعين وماءتين وانصرف اليها سنة سبع وثلاثين وثلاثماءة وكان من المقبولين بالحجاز ومصر والشام والعراقين وبلاد خراسان ثم ذكر بعض شيوخه وقال وكان كتب عن كل شيخ كتب عنه اكثر حديثه صنف اكثر الشيوخ والابواب وجمع اخبار المتصوفة والزهاد وعقد له الاملاء عند منصرفه الي نيسابور ,False,0571IbnCasakir.TarikhDimashq
292057923459,2,Shamela19Y0145334-ara1.ms2484,الحاكم ابو عبد الله شيخ عصره في التصوف بخراسان والعراق خرج من نيسابور سنة اربع وتسعين وماءتين وانصرف اليها سنة تسع وثلاثين وثلاثماءة وكان من المقبولين بالحجاز ومصر والشام والعراقين وبلاد خراسان وكان كتب عن كل شيخ كتب عنه اكثر حديثه وصنف اكثر الشيوخ والابواب وجمع اخبار المتصوفة والزهاد وعقد له الاملاء عند منصرفه الي نيسابور ,False,0845Maqrizi.Muqaffa
