cluster,size,id,text,from_input,book
8589940157,3,Shamela0000736-ara2.mARkdown.ms0705,اخبرني محمد بن احمد بن يعقوب عن محمد بن عبد الله بن محمد الحافظ النيسابوري قال توفي ابو بكر محمد بن داود بن سليمان الزاهد يوم الجمعة لعشر بقين من شهر ربيع الاول سنة اثنتين واربعين وثلاث ماءة وكان من المقبولين بالحجاز ومصر والشام والعراقين وبلاد خراسان محمد بن داود ,False,0463KhatibBaghdadi.TarikhBaghdad
8589940157,3,JK000916-ara1.mARkdown.ms20727,اخبرني محمد بن احمد بن يعقوب عن محمد ابن عبد الله بن محمد الحافظ النيسابوري قال توفي ابو بكر محمد بن داود بن سليمان الزاهد يوم الجمعة لعشر بقين من ربيع الاول سنة اثنتين واربعين وثلاثماءة وكان من المقبولين بالحجاز ومصر والشام والعراقين وبلاد خراسان محمد بن داود ,False,0571IbnCasakir.TarikhDimashq
8589940158,3,Shamela0003118-ara1.completed.ms5976,قال ابو بكر الخطيب محمد بن داود بن سليمان بن جعفر ابو بكر الزاهد النيسابوري قدم بغداد قبل سنة ثلاث مءة واقام بها وكان ثقة فهما صنف ابوابا وشيوخا ورجع اخر عمره الي نيسابور فتوفي بها ,False,0711IbnManzurIfriqi.MukhtasarTarikhDimashq
8589940158,3,Shamela0000736-ara2.mARkdown.ms0704,محمد بن داود بن سليمان بن جعفر ابو بكر الزاهد النيسابوري قدم بغداد قبل سنة ثلاث ماءة واقام بها وحدث عن محمد بن عمرو الحرشي ومحمد بن ابراهيم البوسنجي ومحمد بن النضر الجارودي ومحمد بن ايوب الرازي وجعفر بن محمد الترك وابراهيم بن علي ويحيي بن داود الخفاف وابراهيم بن ابي طالب ومحمد بن عبد الرحمن السامي والحسين بن ادريس الانصاري والحسن بن سفيان النسوي وعمران ابن موسي السختياني وابي خليفة البصري وعبدان الاهوازي وجعفر الفريابي ومحمد بن جعفر القتات والمفضل بن محمد الجندي وابي عبد الرحمن النساءي واحمد بن زيد القزاز المكي وابي يعلي الموصلي وكان ثقة فهما صنف ابوابا وشيوخا وسمع منه يحيي بن محمد بن صاعد وابو بكر بن داود السجستاني وروي عنه محمد بن مخلد الدوري وابو العباس بن عقدة وابو الحسن الدارقطني ويوسف القواس وعبيد الله بن عثمان بن يحيي وابو عبد الله بن دوست ورجع في اخر عمره الي نيسابور فتوفي بها ,False,0463KhatibBaghdadi.TarikhBaghdad
8589940158,3,JK000916-ara1.mARkdown.ms20726,قال لنا ابو بكر الخطيب محمد بن داود بن سليمان بن جعفر ابو بكر الزاهد النيسابوري قدم بغداد قبل سنة ثلاثماءة واقام بها وحدث عن محمد بن عمرو الحرشي ومحمد بن ابراهيم البوسنجي ومحمد بن النضر الجارودي ومحمد بن ايوب الرازي وجعفر بن محمد الترك وابراهيم بن علي الذهلي ويحيي بن داود الخفاف وابراهيم بن ابي طالب ومحمد بن عبد الرحمن النساءي والحسين بن ادريس الانصاري والحسن بن سفيان النسوي وعمران بن موسي السختياني وابي خليفة البصري وعبدان الاهوازي وجعفر الفريابي محمد بن جعفر القتات والمفضل بن محمد الجندي وابي عبد الرحمن النساءي واحمد بن زيد القزاز المكي وابي يعلي الموصلي وكان ثقة فهما صنف ابوابا وشيوخا وسمع منه يحيي بن محمد بن صاعد وابو بكر بن ابي داود السجستاني وروي عنه محمد بن مخلد الدوري وابو العباس بن عقدة وابو الحسن الدارقطني ويوسف القواس وعبد الله بن عثمان بن يحيي وابو عبد الله بن دوست ورجع في اخر عمره الي نيسابور فتوفي بها ,False,0571IbnCasakir.TarikhDimashq
8589944199,3,Sham19Y0013769-ara1.ms0009,اليوم نحو خمسماءة جنازة حتي سجل في ديوان الهالكين نحو ماءة واحد عشر الف في نحو سنتين وقوع زلزلة بالشام كان من هولها ما لا يوصف كادت لها الارض تسير سيرا والجبال تمور مورا وما ظن الناس الا انها القيامة جاءت دفعتين دامت الواحدة مقدار ساعة او ازيد وقيل ان صفد لم يبق بها سوي رجل واحد ونابلس لم يبق بها حاءط ومات بمصر خلق كثير تحت الردم ماجت النجوم في بغداد في اول سنة تسع وتسعين وخمسماءة وتطايرت شبه الجراد ودام ذلك الي الفجر وضج الخلق بالابتهال الي الله تعالي حالة المجتمع في عصره كما تقدم لنا ذكر شء من الحالة السياسية في وقته والحالة السياسية في كل زمان ومكان تنعكس اثارها علي الحالة الاجتماعية سلبا وايجابا ,False,0804IbnMulaqqin.IclamBiFawaid
8589944199,3,Shamela0004473-ara1.ms12080,اليوم نحو خمسماءة جنازة حتي سجل في ديوان الهالكين نحو ماءة واحد عشر الف في نحو سنتين وقوع زلزلة بالشام كان من هولها ما لا يوصف كادت لها الارض تسير سيرا والجبال تمور مورا وما ظن الناس الا انها القيامة جاءت دفعتين دامت الواحدة مقدار ساعة او ازيد وقيل ان صفد لم يبق بها سوي رجل واحد ونابلس لم يبق بها حاءط ومات بمصر خلق كثير تحت الردم وسبق ان حدث لدمشق زلزلة عظمي في سنه ثلاث وثلاثين وماءتين دامت ثلاث ساعات سقطت الجدران وهرب الناس الي المصلي يجارون الي الله ومات خلق تحت الهدم وامتدت الزلزلة الي انطاكية فقيل هلك بها عشرون الفا تحت الهدم ماجت النجوم في بغداد في اول سنة تسع وتسعين وخمسماءة وتطايرت شبه الجراد ودام ذلك الي الفجر وضج الخلق بالابتهال الي الله تعالي الحالة الاجتماعية في عصره ان سرد ما تقدم من الاحداث السياسية بمختلف صورها وغيرها من عجاءب ذلك العصر يغني اللبيب عن القول في هذا الجانب فان السياسة تنعكس اثارها علي المجتمع سلبا وايجابا ,False,1450JamicaIslamiyya.MajallaJIMN
8589944199,3,ShamAY0037374-ara1.ms17,اليوم نحو خمسماءة جنازة حتي سجل في ديوان الهالكين نحو ماءة واحد عشر الف في نحو سنتين وقوع زلزلة بالشام كان من هولها ما لا يوصف كادت لها الارض تسير سيرا والجبال تمور مورا وما ظن الناس الا انها القيامة جاءت دفعتين دامت الواحدة مقدار ساعة او ازيد وقيل ان صفد لم يبق بها سوي رجل واحد ونابلس لم يبق بها حاءط ومات بمصر خلق كثير تحت الردم وسبق ان حدث لدمشق زلزلة عظمي في سنه ثلاث وثلاثين وماءتين دامت ثلاث ساعات سقطت الجدران وهرب الناس الي المصلي يجارون الي الله ومات خلق تحت الهدم وامتدت الزلزلة الي انطاكية فقيل هلك بها عشرون الفا تحت الهدم ماجت النجوم في بغداد في اول سنة تسع وتسعين وخمسماءة وتطايرت شبه الجراد ودام ذلك الي الفجر وضج الخلق بالابتهال الي الله تعالي الحالة الاجتماعية في عصره ان سرد ما تقدم من الاحداث السياسية بمختلف صورها وغيرها من عجاءب ذلك العصر يغني اللبيب عن القول في هذا الجانب فان السياسة تنعكس اثارها علي المجتمع سلبا وايجابا ,False,0794BadrDinZarkashi.TashihCumda
8589944200,3,Sham19Y0013769-ara1.ms0008,المسلمين فيها يقدر بماءتي الف ما بين فارس وراجل واجه جيش الفرنج المقدر بماءتين واربعين الفا وكانت الداءرة في هذه الموقعة علي الاعداء ونصر الله جيش المسلمين فقتلوا ماءة واربعين الفا من الفرنج واسروا منهم ثلاثين الفا وغنموا ثمانين الف فرس وماءة الف من البغال حتي بخست اثمانها عند بيعها ما حل ببلاد مصر من القحط والوباء المفرط فخربت الديار وجلي عنها اهلها كان ذلك في سنة ست وتسعين وخمسماءة وفي التي تليها اشتد البلاء حتي اكلوا لحوم الادميين واكثر القري لم يبق بها ادمي وكان يخرج من القاهرة في ,True,0804IbnMulaqqin.IclamBiFawaid
8589944200,3,Shamela0004473-ara1.ms12080,واربعين الفا وكانت الداءرة في هذه الموقعة علي الاعداء ونصر الله جيش المسلمين فقتلوا ماءة واربعين الفا من الفرنج واسروا منهم ثلاثين الفا وغنموا ثمانين الف فرس وماءة الف من البغال حتي بخست اثمانها عند بيعها ما حل ببلاد مصر من القحط والوباء المءلم المفرط فخربت الديار وجلي عنها اهلها كان ذلك في سنة ست وتسعين وخمسماءة وفي التي تليها اشتد البلاء حتي اكلوا لحوم الادميين واكثر قري الاقليم لم يبق بها ادمي وكان يخرج من القاهرة في ,True,1450JamicaIslamiyya.MajallaJIMN
8589944200,3,ShamAY0037374-ara1.ms17,المسلمين فيها يقدر بماءتي الف ما بين فارس وراجل واجه جيش الفرنج المقدر بماءتين واربعين الفا وكانت الداءرة في هذه الموقعة علي الاعداء ونصر الله جيش المسلمين فقتلوا ماءة واربعين الفا من الفرنج واسروا منهم ثلاثين الفا وغنموا ثمانين الف فرس وماءة الف من البغال حتي بخست اثمانها عند بيعها ما حل ببلاد مصر من القحط والوباء المءلم المفرط فخربت الديار وجلي عنها اهلها كان ذلك في سنة ست وتسعين وخمسماءة وفي التي تليها اشتد البلاء حتي اكلوا لحوم الادميين واكثر قري الاقليم لم يبق بها ادمي وكان يخرج من القاهرة في ,True,0794BadrDinZarkashi.TashihCumda
8589961195,3,Sham19Y0023625-ara1.ms1341,فالنصب علي انه مفعول يرحم والرفع علي انه خبر ان وتكون ما بمعني الذي وروينا في صحيح البخاري عن انس رضي الله عنه ان رسول الله صلي الله عليه وسلم دخل علي ابنه ابراهيم رضي الله عنه وهو يجود بنفسه فجعلت عينا رسول الله صلي الله عليه وسلم ,False,1057IbnCallan.FutuhatRabbaniyya
8589961195,3,Shamela0010639-ara1.ms158,فالنصب علي انه مفعول يرحم والرفع علي انه خبر ان وتكون ما بمعني الذي وروينا في صحيح البخاري رقم عن انس رضي الله عنه ان رسول الله صلي الله عليه وسلم دخل علي ابنه ابراهيم رضي الله عنه وهو يجود بنفسه فجعلت عينا رسول الله صلي الله عليه وسلم ,False,0676Nawawi.Adhkar
8589961195,3,Shamela0006848-ara1.ms136,وروينا في صحيح البخاري عن انس رضي الله عنه ان رسول الله صلي الله عليه وسلم دخل علي ابنه ابراهيم وهو يجود بنفسه فجعلت عينا رسول الله صلي الله عليه وسلم ,False,0748Dhahabi.Kabair
8590014406,3,Shamela0000041-ara1.completed.ms1759,من دون اعمال المءمنين التي ذكرها الله تعالي في قوله ان الذين هم من خشية ربهم مشفقون هم لها عاملون لا بد لهم من ان يعملوها فيدخلوا بها النار لما سبق لهم من الشقاوة ,False,0510IbnMascudBaghawi.Tafsir
8590014406,3,Shamela0037458-ara1.ms2806,من دون اعمال المءمنين التي ذكرها الله او من دون اعمال الكفار التي تقدم ذكرها من كون قلوبهم في غفلة عظيمة مما ذكر وهي فنون كفرهم ومعاصيهم التي من جملتها ما سياتي من طعنهم في القران قال الواحدي اجماع المفسرين واصحاب المعاني علي ان هذا اخبار عما سيعملونها من اعمالهم الخبيثة التي كتبت عليهم لا بد لهم ان يعملوها وجملة هم لها عاملون مقررة لما قبلها اي واجب عليهم ان يعملوها فيدخلوا بها النار لما سبق لهم في الازل من الشقاوة ,False,1307Qannawji.FathBayan
8590014406,3,Shamela0023623-ara1.ms2770,من دون اعمال المءمنين التي ذكرها الله او من دون اعمال الكفار التي تقدم ذكرها من كون قلوبهم في غفلة عظيمة مما ذكر وهي فنون كفرهم ومعاصيهم التي من جملتها ما سياتي من طعنهم في القران قال الواحدي اجماع المفسرين واصحاب المعاني علي ان هذا اخبار عما سيعملونه من اعمالهم الخبيثة التي كتبت عليهم لا بد لهم ان يعملوها وجملة هم لها عاملون مقررة لما قبلها اي واجب عليهم ان يعملوها فيدخلوا بها النار لما سبق لهم من الشقاوة ,False,1250Shawkani.FathQadir
8590050416,3,Shamela0023623-ara1.ms4631,عن اسماء بنت يزيد قالت سمعت رسول الله صلي الله عليه وسلم يقول لايلاف قريش ايلافهم رحلة الشتاء والصيف ويحكم يا قريش اعبدوا رب هذا البيت الذي اطعمكم من جوع وامنكم من خوف واخرج ابن جرير وابن ابي حاتم وابن مردويه عن ابن عباس في قوله لايلاف قريش قال نعمتي علي قريش ايلافهم رحلة الشتاء والصيف كانوا يشتون بمكة ويصيفون بالطاءف ليعبدوا رب هذا البيت قال الكعبة الذي اطعمهم من جوع وامنهم من خوف قال الجذام واخرج ابن جرير وابن المنذر وابن ابي حاتم وابن مردويه عنه لايلاف قريش ايلافهم قال لزومهم الذي اطعمهم من جوع يعني قريشا اهل مكة بدعوة ابراهيم حيث قال وارزق اهله من الثمرات وامنهم من خوف حيث قال ابراهيم رب اجعل هذا البلد امنا واخرج ابن جرير وابن مردويه عنه ايضا في قوله لايلاف قريش الاية قال نهاهم عن الرحلة وامرهم ان يعبدوا رب هذا البيت وكفاهم المءنة وكانت رحلتهم في الشتاء والصيف ولم يكن لهم راحة في شتاء ولا صيف فاطعمهم الله بعد ذلك من جوع وامنهم من خوف فالفوا الرحلة وكان ذلك من نعمة الله ,False,1250Shawkani.FathQadir
8590050416,3,ShamAY0034054-ara1.ms4478,عن اسماء بنت يزيد قالت سمعت رسول الله صلي الله عليه واله وسلم يقول لايلاف قريش ايلافهم رحلة الشتاء والصيف ويحكم يا قريش اعبدوا رب هذا البيت الذي اطعمكم من صفحة رقم جوع وامنهم من خوف واخرج ابن جرير وابن ابي حاتم وابن مردويه عن ابن عباس في قوله لايلاف قريش قال نعمتي علي قريش ايلافهم رحلة الشتاء والصيف كانوا يشتون بمكة ويصيفون بالطاءف فليعبدوا رب هذا البيت قال الكعبة الذي اطعمهم من جوع وامنهم من خوف قال الجذام واخرج ابن جرير وابن المنذر وابن ابي حاتم وابن مردويه عنه لايلاف قريش ايلافهم قال لزومهم الذي اطعمهم من جوع يعني قريشا اهل مكة بدعوة ابراهيم حيث قال وارزق اهله من الثمرات وامنهم من خوف حيث قال ابراهيم رب اجعل هذا البلد امنا واخرج ابن جرير وابن مردويه عنه ايضا في قوله لايلاف قريش الاية قال نهاهم عن الرحلة ,False,1281IbnMuhammadShawkani.TafsirFathQadir
8590050416,3,Shamela0008658-ara1.ms2900,عن اسماء بنت يزيد قالت سمعت رسول الله صلي الله عليه وسلم يقول لايلاف قريش ايلافهم رحلة الشتاء والصيف ويحكم يا قريش اعبدوا رب هذا البيت الذي اطعمهم من جوع وامنهم من خوف قوله تعالي لايلاف قريش عن ابن عباس في قوله لايلاف قريش قال نعمته علي قريش ايلافهم رحلة الشتاء والصيف قال كانوا يشتون بمكة ويصيفون بالطاءف ليعبدوا رب هذا البيت قال الكعبة الذي اطعمهم من جوع وامنهم من خوف قال الجزام عن مجاهد قوله لايلاف قريش قال نعمتي علي قريش ايلافهم رحلة الشتاء والصيف قال ايلافهم ذلك فلا يشق عليهم رحلة الشتاء ولا صيف وامنهم من خوف قال من كل غزو في حرمهم قوله تعالي الذي اطعمهم من جوع عن ابن عباس في قوله الذي اطعمهم من جوع يعني قريشا اهل مكة بدعوة ابراهيم حيث قال وارزقهم من الثمرات وامنهم من خوف حيث قال ابراهيم رب اجعل هذا البلد امنا عن قتادة في قوله لايلاف قريش قال عادة قريش رحلة في الشتاء ورحلة في الصيف وفي قوله وامنهم من خوف قال كانوا يقولون نحن من حرم الله ,False,0327IbnAbiHatimRazi.Tafsir
8590050417,3,Shamela0037458-ara1.ms4961,فليعبدوا رب هذا البيت امرهم سبحانه بعبادته بعد ان ذكر لهم ما انعم به عليهم اي ان لم يعبدوه لساءر نعمه فليعبدوه لهذه النعمة الخاصة المذكورة والبيت الكعبة وعرفهم سبحانه بانه رب هذا البيت لانها كانت لهم اوثان يعبدونها فميز نفسه عنها وقيل لانهم شرفوا بالبيت علي ساءر العرب فذكر لهم ذلك تذكيرا لنعمته الذي اطعمهم من جوع اي اطعمهم بسبب تينك الرحلتين من جوع شديد كانوا فيه قبلهما وقيل ان هذا الاطعام هو انهم لما كذبوا النبي صلي الله عليه وسلم دعا عليهم فقال اللهم اجعلها عليهم سنين كسني يوسف فاشتد القحط فقالوا يا محمد ادع الله لنا فانا مءمنون فدعا فاخصبوا وزال عنهم الجوع وارتفع القحط قال ابن عباس يعني قريشا اهل مكة بدعوة ابراهيم حيث قال وارزق اهله من الثمرات وامنهم من خوف اي من خوف شديد كانوا فيه قال ابن زيد كانت العرب يغير بعضها علي بعض ويسبي بعضها بعضا فامنت قريش من ذلك لمكان الحرم وقال الضحاك والربيع وشريك وسفيان امنهم من خوف الحبشة مع الفيل ,False,1307Qannawji.FathBayan
8590050417,3,ShamAY0034054-ara1.ms4478,والبيت الكعبة وعرفهم سبحانه بانه رب هذا البيت لانها كانت لهم اوثان يعبدونها فميز نفسه عنها وقيل لانهم بالبيت تشرفوا علي ساءر العرب فذكر لهم ذلك تذكيرا لنعمته قريش الذي اطعمهم من الذي اطعمهم من جوع اي اطعمهم بسبب تينك الرحلتين من جوع شديد كانوا فيه قبلهما وقيل ان هذا الاطعام هو انهم لما كذبوا النبي صلي الله عليه واله وسلم دعا عليهم فقال اللهم اجعلها عليهم سنين كسني يوسف فاشتد القحط فقالوا يا محمد ادع الله لنا فانا مءمنون فدعا فاخصبوا وزال عنهم الجوع وارتفع القحط وامنهم من خوف اي من خوف شديد كانوا فيه قال ابن زيد كانت العرب يغير بعضها علي بعض ويسبي بعضها بعضا فامنت قريش من ذلك لمكان الحرم وقال الضحاك والربيع وشريك وسفيان امنهم من خوف الحبشة مع الفيل ,False,1281IbnMuhammadShawkani.TafsirFathQadir
8590050417,3,Shia002616Vols-ara1.ms6824,فليعبدوا رب هذا البيت امرهم الله تعالي بعبادته وتوحيده لاجل ايلافهم رحلتين ودخلت الفاء لاجل ما في الكلام من معني الشرط لان المعني اما لا فليعبدوه لايلافهم علي معني ان نعم الله تعالي عليهم لا تحصي فان لم يعبدوه لساءر نعمه فليعبدوه لشان هذه الواحدة التي هي نعمة ظاهرة والبيت الكعبة وفي تعريف نفسه لهم بانه رب هذا البيت وجهان احدهما لانه كانت لهم اوثان فميز نفسه عنها الثاني لانهم بالبيت شرفوا علي ساءر العرب فذكر لهم ذلك تذكيرا لنعمته وقيل فليعبدوا رب هذا البيت اي ليالفوا عبادة رب الكعبة كما كانوا يالفون الرحلتين قال عكرمة كانت قريش قد الفوا رحلة الي بصري ورحلة الي اليمن فقيل لهم فليعبدوا رب هذا البيت اي يقيموا بمكة رحلة الشتاء الي اليمن والصيف الي الشام قوله تعالي الذي اطعمهم من جوع وامنهم من خوف قوله تعالي الذي اطعمهم من جوع اي بعد جوع وامنهم من خوف قال ابن عباس وذلك بدعوة ابراهيم عليه السلام حيث قال رب اجعل هذا بلدا امنا وارزق اهله من الثمرات البقرة وقال ابن زيد كانت العرب يغير بعضها علي بعض ويسبي بعضها من بعض فامنت قريش من ذلك المكان الحرم وقرا ,False,0671AbuCabdAllahQurtubi.JamicLiAhkamQuran
8590050418,3,Tafsir03092-ara1.ms2870,ابن عباس لايلاف قريش اي نعمتي علي قريش وقيل معناه ان الله عجب نبيه من ذلك فالمعني اعجب يا محمد لنعم الله علي قريش في ايلافهم رحلة الشتاء والصيف ثم يتشاغلون بذلك عن الايمان بالله واتباعك ودل علي هذا المعني قوله فليعبدوا رب هذا البيت قال ابن زيد معناه صنعت باصحاب الفيل ما صنعت لالفة قريش اي لءلا افرقها وهذا هو قول الاخفش المتقدم وقال ابن عباس ايلافهم رحلة الشتاء والصيف اي لزومهم وعنه ايضا انه قال نهاهم الله عن الرحلة وامرهم ان يعبدوا رب هذا البيت وكفاهم المءنة وكانت رحلتهم في الشتاء والصيف فلم تكن لهم رحلة في شتاء ولا صيف فاطعمهم الله جل وعز بعد ذلك من ,False,0437IbnHammushQayruwani.Hidaya
