cluster,size,id,text,from_input,book
8590118922,48,ShamAY0033108-ara1.ms1708,وما مسنا من لغوب واللغوب هو التعب وسبحان الله ان يوصف بتعب او نصب قوله تعالي فاصبر علي ما يقولون اي اصبر يا محمد علي ما يقولون من الاذي والتكذيب وهذا قبل ان يءمر بالقتال قوله تعالي وسبح بحمد ربك اي صل بامر ربك واحمده قبل طلوع الشمس وقبل الغروب اراد بذلك صلاة الفجر وصلاة العصر وقيل معناه قبل الغروب الظهر والعصر ومن الليل فسبحه يعني صلاة المغرب والعشاء وسميت الصلاة تسبيحا لما فيها من التسبيح سبحان ربي العظيم وسبحان ربي الاعلي وقوله تعالي وادبار السجود يعني الركعتين بعد المغرب وقبل الوتر وقيل التسبيح في اواخر الصلاة يسبحون الله ثلاثا وثلاثين ويحمدون ثلاثا وثلاثين ويكبرون ثلاثا وثلاثين وعن رسول الله صلي الله عليه وسلم انه كان يقول في اخر صلاته عند انصرافه سبحان ربك رب العزة عما يصفون الي اخر السورة وعن الشعبي والاوزاعي انهما قالا ادبار السجود الركعتان بعد المغرب وادبار النجوم الركعتان قبل الفجر وقال ابن زيد معني قوله وادبار السجود وهو النوافل وادبار المكتوبات قرا الحسن وابو عمرو ويعقوب وعاصم والكساءي وابن عامر وادبار بفتح الالف ,False,0360Tabarani.Tafsir
8590118922,48,ShamAY0033108-ara1.ms1707,القلب حاضره غير غافل ولا ساه قوله تعالي ولقد خلقنا السماوات والارض وما بينهما في ستة ايام وما مسنا من لغوب واللغوب هو التعب وذلك ان اليهود لعنهم الله قالوا خلق الله السموات والارض في ستة ايام اولها يوم الاحد واخرها يوم الجمعة فاعيا واستراح يوم السبت فذلك لا يعمل فيه شيءا فاكذبهم الله بقوله ,False,0360Tabarani.Tafsir
8590118922,48,Tafsir02091-ara1.ms1975,القلب حاضره غير غافل ولا ساه قوله تعالي ولقد خلقنا السموت والارض وما بينهما في ستة ايام وما مسنا من لغوب واللغوب هو التعب وذلك ان اليهود لعنهم الله قالوا خلق الله السماوات والارض في ستة ايام اولها يوم الاحد واخرها يوم الجمعة فاعيا واستراح يوم السبت فذلك لا يعمل فيه شيءا فاكذبهم الله بقوله وما مسنا من لغوب واللغوب هو التعب وسبحان الله ان يوصف بتعب او نصب قوله تعالي فاصبر علي ما يقولون اي اصبر يا محمد علي ما يقولون من الاذي والتكذيب وهذا قبل ان يءمر بالقتال قوله تعالي وسبح بحمد ربك اي صل بامر ربك واحمده قبل طلوع الشمس وقبل الغروب اراد بذلك صلاة الفجر وصلاة العصر وقيل معناه قبل الغروب الظهر والعصر ومن الليل فسبحه يعني صلاة المغرب والعشاء وسميت الصلاة تسبيحا لما فيها من التسبيح سبحان ربي العظيم وسبحان ربي الاعلي وقوله تعالي وادبار السجود يعني الركعتين بعد المغرب وقبل الوتر وقيل التسبيح في اواخر الصلاة يسبحون الله ثلاثا وثلاثين ويحمدون ثلاثا وثلاثين ويكبرون ثلاثا وثلاثين وعن رسول الله صلي الله عليه وسلم انه كان يقول في اخر صلاته عند انصرافه سبحان ربك رب العزة عما يصفون الي اخر السورة وعن الشعبي والاوزاعي انهما قالا ادبار السجود الركعتان بعد المغرب وادبار النجوم الركعتان قبل الفجر وقال ابن زيد معني قوله وادبار السجود وهو النوافل وادبار المكتوبات قرا الحسن وابو عمرو ويعقوب وعاصم والكساءي وابن عامر وادبار بفتح الالف ,False,0360Tabarani.TafsirKabir
8590118922,48,Tafsir02091-ara1.ms1334,تعالي فاصبر علي ما يقولون اي فاصبر يا محمد علي ما يقولون من الشتم والتكذيب فسيعود عليهم وبال ذلك قوله تعالي وسبح بحمد ربك قبل طلوع الشمس اي صل صلاة الفجر وقبل غروبها يعني صلاة العصر ومن اناء الليل فسبح يعني المغرب والعشاء واناء ,False,0360Tabarani.TafsirKabir
8590118922,48,Shamela0023594-ara1.ms1908,بامر ربك قبل طلوع الشمس يعني صلاة الفجر وقبل الغروب يعني صلاة العصر ومن الليل فسبحه يعني صل صلاة المغرب والعشاء ويقال حين تقوم صلاة الفجر والظهر والعصر ومعناه صل صلاة النهار وصلاة الليل ويقال سبح بحمد ربك حين تقوم يعني قل سبحانك اللهم وبحمدك اذا قمت الي الصلاة وهذا قول ربيع بن انس وادبار النجوم يعني ركعتي الفجر وروي سعيد بن جبير عن زاذان عن عمر رضي الله عنه لا صلاة بعد طلوع الفجر الا ركعتي الفجر وهما ادبار النجوم وروي ابو اسحاق عن الحارث عن علي رضي الله عنه قال ادبار السجود الركعتان بعد المغرب وادبار النجوم الركعتان قبل الفجر وروي وكيع عن ابن عباس ,False,0367AbuLaythSamarqandi.BahrCulum
8590118922,48,JK007095-ara1.ms633,ق ولقد خلقنا السماوات ولقد خلقنا السماوات والارض وما بينهما في ستة ايام واليوم منها الف سنة وما مسنا من لغوب من اعياء وذلك ان اليهود اعداء الله قالت لما فرغ الله من خلق السماوات والارض اعيي فاستلقي ووضع احدي رجليه علي الاخري استراح فانزل الله ولقد خلقنا السماوات والارض الاية ليس كما قالت اليهود قال محمد الاجود في القراءة لغوب بضم اللام يقال منه لغب بفتح الغين لغبا ولغوبا وفيه لغة اخري لغب بكسر الغين واللغوب الاعياء تفسير الايات من وحتي من سورة ق ق فاصبر علي ما فاصبر علي ما يقولون ما يقول لك قومك انك ساحر وانك شاعر وانك كاهن وانك مجنون وانك كاذب وسبح بحمد ربك قبل طلوع الشمس وقبل الغروب تفسير الحسن يعني صلاة الصبح والظهر والعصر ق ومن الليل فسبحه ومن الليل فسبحه يعني صلاة المغرب وصلاة العشاء ل وادبار ,False,0399IbnAbiZamanaynIlbiri.Tafsir
8590118922,48,JK007095-ara1.ms644,وسبح بحمد ربك حين تقوم من مقامك يعني صلاة الصبح في تفسير الحسن الطور ومن الليل فسبحه ومن الليل فسبحه يعني صلاة المغرب وصلاة العشاء وادبار النجوم يحيي عن عثمان عن ابي اسحاق الهمداني عن الحارث عن علي قال سءل رسول الله صلي الله عليه وسلم عن قوله وادبار النجوم فقال هما الركعتان قبل صلاة الصبح ,False,0399IbnAbiZamanaynIlbiri.Tafsir
8590118922,48,Shamela0023578-ara1.completed.ms2936,الاية فاصبر علي ما يقولون فان الله سبحانه لهم بالمرصاد وسبح بحمد ربك يعني قل سبحان الله والحمد لله عن عطاء الخراساني وقال الاخرون وصل بامر ربك وتوفيقه قبل طلوع الشمس يعني صلاة الصبح وقبل الغروب صلاة العصر وروي عن ابن عباس وقبل الغروب يعني الظهر والعصر ومن الليل فسبحه يعني صلاة العشاءين وقال مجاهد من الليل كله يعني صلاة الليل في اي وقت صلي وادبار السجود قال عمر بن الخطاب وعلي بن ابي طالب وابو هريرة والحسن بن علي والحسن البصري والنخعي والشعبي والاوزاعي ادبار السجود الركعتان بعد المغرب وادبار النجوم الركعتان قبل الفجر وهي رواية العوفي عن ابن عباس وقد روي عنه مرفوعا ,False,0427AbuIshaqThaclabi.KashfWaBayan
8590118922,48,Tafsir03092-ara1.ms2459,فانزل الله وما مسنا من لغوب فاصبر علي ما يقولون قال قتادة اكذب الله جل وعز اليهود والنصاري واهل الفراء علي الله جل ذكره وذلك انهم قالوا خلق الله جل وعز السماوات والارض وما بينهما في ستة ايام ثم استراح يوم السابع وذلك عندهم يوم السبت وهم يسمونه الراحة قال الضحاك كان مقدار كل يوم الف سنة مما تعدون قال مجاهد من لغوب من نصب وقال قتادة من اعياء واللغوب في اللغة التعب يقال لغب يلغب لغوبا اذا تعب ثم قال فاصبر علي ما يقولون اي اصبر يا محمد علي قولهم لك ثم استراح وهذه الاية عند جماعة منسوخة بقوله قاتلوا الذين لا يءمنون بالله التوبة وقوله وسبح بحمد ربك قبل طلوع الشمس وقبل الغروب قال قتادة قبل طلوع الشمس صلاة الفجر وقبل الغروب صلاة العصر وهو قول ابن زيد قال ابن زيد ومن الليل فسبحه يعني صلاة العتمة وقال مجاهد هي الصلاة بالليل في اي وقت صلي وقوله وادبار السجود قال علي ابي طالب رضي الله عنه الركعتان بعد المغرب وكذلك عن عمر رضي الله ,False,0437IbnHammushQayruwani.Hidaya
8590118922,48,Shamela0022593-ara1.completed.ms2496,السماوات والارض وما بينهما في ستة ايام ثم استراح يوم السابع وذلك عندهم يوم السبت وهم يسمونه الراحة قال الضحاك كان مقدار كل يوم الف سنة مما تعدون قال مجاهد من لغوب من نصب وقال قتادة من اعياء واللغوب في اللغة التعب يقال لغب يلغب لغوبا اذا تعب قال فاصبر علي ما يقولون اي اصبر يا محمد علي قولهم لك ثم استراح وهذه الاية عند جماعة منسوخة بقوله قاتلوا الذين لا يءمنون بالله التوبة وقوله وسبح بحمد ربك قبل طلوع الشمس وقبل الغروب قال قتادة قبل طلوع الشمس صلاة الفجر وقبل الغروب صلاة العصر وهو قول ابن زيد قال ابن زيد ومن الليل فسبحه يعني صلاة العتمة وقال مجاهد هي الصلاة بالليل في اي وقت صلي وقوله وادبار السجود قال علي بن ابي طالب رضي الله عنه الركعتان بعد المغرب وكذلك عن ,False,0437MakkiIbnHammushQaysi.Hidaya
8590118922,48,Sham19Y0013231-ara1.ms3977,القلب اي وقلبه حاضر فيما يسمع قوله تعالي ولقد خلقنا السماوات والارض وما بينهما في ستة ايام وما مسنا من لغوب قال جماعة المفسرين ان اليهود قالت خلق الله السموات والارض وما بينهما في ستة ايام اولها يوم الاحد واخرها يوم الجمعة واستراح يوم السبت فذلك لا يعمل فيه شيءا فاكذبهم الله تعالي بقوله وما مسنا من لغوب قال الكساءي يقال لغب بالفتح يلغب بالضم لغوبا ,False,0468IbnAhmadWahidiNaysaburi.TafsirBasit
8590118922,48,Sham19Y0013231-ara1.ms4015,حين تقوم من منامك يعني صلاة الصبح وقال الكلبي سبح الله حين تقوم من فراشك الي ان تدخل في الصلاة وقال الضحاك امران يقول حين يقوم للصلاة الله اكبر كبيرا والحمد لله كثيرا وسبحان الله بكرة واصيلا قوله تعالي ومن الليل فسبحه وادبار النجوم قال ابن عباس يريد فصل له كقوله ومن الليل فتهجد به الاسراء وقال مقاتل يقول فصل المغرب والعشاء وقوله وادبار النجوم يعني الركعتين قبل صلاة ,False,0468IbnAhmadWahidiNaysaburi.TafsirBasit
8590118922,48,Shamela0021821-ara1.ms1750,ولقد خلقنا السموات والارض ق الاية قال جماعة المفسرين ان اليهود قالت خلق الله السموات والارض وما بينهما في ستة ايام اولها يوم الاحد واخرها يوم الجمعة واستراح يوم السبت فلذلك لا يعمل فيه شيءا فاكذبهم الله تعالي بقوله وما مسنا من لغوب ق يقال لغب يلغب لغوبا اذا اعيا من التعب فاصبر علي ما يقولون ق في بهتهم وكذبهم وهذا من قبل ان امر بالقتال وسبح بحمد ربك ق صل حمدا لله تعالي قبل طلوع الشمس ق يعني الفجر وقبل الغروب يعني الظهر والعصر ,False,0468IbnAhmadWahidiNaysaburi.WasitFiTafsir
8590118922,48,Shamela0000041-ara1.completed.ms2435,تعالي هذه الاية ردا عليهم فاصبر علي ما يقولون من كذبهم فان الله لهم بالمرصاد وهذا قبل الامر بقتالهم وسبح بحمد ربك اي صل حمدا لله قبل طلوع الشمس يعني صلاة الصبح وقبل الغروب يعني صلاة العصر وروي عن ابن عباس قال قبل الغروب الظهر والعصر ومن الليل فسبحه يعني صلاة المغرب والعشاء وقال مجاهد ومن الليل اي صلاة الليل اي وقت صلي وادبار السجود قرا اهل الحجاز وحمزة وادبار السجود بكسر الهمزة مصدر ادبر ادبارا وقرا الاخرون بفتحها علي جمع الدبر قال عمر بن الخطاب وعلي بن ابي طالب والحسن والشعبي والنخعي والاوزاعي ادبار السجود الركعتان بعد صلاة المغرب وادبار النجوم الركعتان قبل صلاة الفجر وهي رواية العوفي عن ابن عباس وروي عنه مرفوعا هذا قول اكثر المفسرين ,False,0510IbnMascudBaghawi.Tafsir
8590118922,48,ShamAY0034052-ara1.ms2225,وما مسنا من لغوب فاصبر علي ما يقولون وسبح بحمد ربك قبل طلوع الشمس وقبل الغروب ومن اليل فسبحه وادبار السجود واستمع يوم يناد المناد من مكان قريب يوم يسمعون الصيحة بالحق ذلك يوم الخروج انا نحن نحي ونميت والينا المصير ق ولقد خلقنا السماوات اللغوب الاعياء وقرء بالفتح بزنة القبول والولوع قيل نزلت في اليهود لعنت تكذيبا لقولهم خلق الله السماوات والارض في ستة ايام اولها الاحد واخرها الجمعة واستراح يوم السبت واستلق علي عرشه وقالوا ان الذي وقع من التشبيه في هذه الامة انما وقع من اليهود ومنهم اخذ فاصبر علي ما يقولون اي اليهود وياتون به من الكفر والتشبيه وقيل فاصبر علي ما يقول المشركون من انكارهم البعث فان من قدر علي خلق العالم قدر علي بعثهم والانتقام منهم وقيل هي منسوخة باية السيف وقيل الصبر مامور به في كل حال بحمد ربك حامدا ربك والتسبيح محمول علي ظاهره او علي الصلاة فالصلاة قبل طلوع الشمس الفجر وقبل الغروب الظهر والعصر ومن اليل العشاان وقيل التهجد وادبار السجود التسبيح في اثار الصلوات والسجود والركوع يعبر بهما عن الصلاة وقيل النوافل بعد المكتوبات وعن علي رضي الله عنه الركعتان بعد المغرب وروي عن النبي صلي الله عليه وسلم من صلي بعد المغرب قبل ان يتكلم كتبت صلاته في عليين وعن ,False,0538JarAllahZamakhshari.Kashshaf
8590118922,48,Shia002356Vols-ara1.ms1202,فاصبر علي ما يقوله المشركون من انكار البعث وتكذيبك واحتمل ذلك حتي ياتي الله بالفرج وسبح بحمد ربك التسبيح محمول علي ظاهره وعلي الصلاة فالصلاة قبل طلوع الشمس صلاة الصبح وقبل الغروب الظهر والعصر ومن الليل العشاءين وقيل صلاة الليل فيدخل فيها المغرب والعشاء وادبر السجود التسبيح في اعقاب الصلوات والسجود والركوع قد يعبر بهما عن الصلاة وقيل النوافل بعد المغرب وادبر النجوم الركعتان قبل صلاة الفجر وروي ان من صلاها بعد المغرب قبل ان يتكلم كتبت صلاته في عليين والادبار جمع دبر وقرء بكسر الهمزة من ادبرت الصلاة اذا انقضت وتمت والمعني وقت انقضاء السجود كما يقال اتيك خفوق النجم واستمع لما اخبرك به من حال يوم القيامة وفيه تهويل لشان المخبر به وانتصب يوم يناد بما دل عليه ذلك يوم الخروج اي يوم ينادي المنادي يخرجون من قبورهم و يوم ,False,0548IbnHasanTabarsi.TafsirJawamicJamic
8590118922,48,JK000791-ara1.ms2170,قوله تعالي ولقد خلقنا السموات والارض ذكر المفسرون ان اليهود قالت خلق الله السموات والارض وما بينهما في ستة ايام اخرها يوم الجمعة واستراح يوم السبت فلذلك لا نعمل فيه شيءا فنزلت هذه الايات فاكذبهم الله عز وجل بقوله وما مسنا من لغوب قال ,False,0597IbnJawzi.ZadMasir
8590118922,48,Shia002616Vols-ara1.ms5850,سبحان الله والحمد لله ولا اله الا الله والله اكبر ولا حول ولا قوة الا بالله العلي العظيم واما من قال انها الصلاة بالليل فان الصلاة تسمي تسبيحا لما فيها من تسبيح الله ومنه سبحة الضحي واما من قال انها صلاة الفجر او العشاء فلانهما من صلاة الليل والعشاء اوضحه الرابعة قوله تعالي وادبار السجود قال عمر وعلي وابو هريرة والحسن بن علي والحسن البصري والنخعي والشعبي والاوزاعي والزهري ادبار السجود الركعتان بعد المغرب وادبار النجوم الركعتان قبل الفجر ورواه العوفي عن ابن عباس وقد ,False,0671AbuCabdAllahQurtubi.JamicLiAhkamQuran
8590118922,48,Shamela0023588-ara1.ms1672,فاصبر علي ما يقولون وسبح بحمد ربك قبل طلوع الشمس وقبل الغروب ومن الليل فسبحه وادبار السجود فاصبر علي ما يقولون ما يقول المشركون من انكارهم البعث فان من قدر علي خلق العالم بلا اعياء قدر علي بعثهم والانتقام منهم او ما يقول اليهود من الكفر والتشبيه وسبح بحمد ربك ونزهه عن العجز عما يمكن والوصف بما يوجب التشبيه حامدا له علي ما انعم عليك من اصابة الحق وغيرها قبل طلوع الشمس وقبل الغروب يعني الفجر والعصر وقد عرفت فضيلة الوقتين ومن الليل فسبحه اي وسبحه بعض الليل وادبار السجود واعقاب الصلوات جمع دبر من ادبر وقرا الحجازيان وحمزة وخلف بالكسر من ادبرت الصلاة اذا انقضت وقيل المراد بالتسبيح الصلاة فالصلاة قبل الطلوع الصبح وقبل الغروب الظهر والعصر ومن الليل العشاءان والتهجد وادبار السجود النوافل بعد المكتوبات ,False,0685NasirDinBaydawi.AnwarTanzil
8590118922,48,Shamela0001394-ara1.ms1598,فاصبر علي ما يقولون اي علي ما يقول اليهود وياتون به من الكفر والتشبيه او علي ما يقول المشركون في امر البعث فان من قدر علي خلق العالم قدر علي بعثهم والانتقام منهم وسبح بحمد ربك حامدا ربك والتسبيح محمول علي طاهرة او علي الصلاة فالصلاة قبل طلوع الشمس القمر وقبل الغروب الظهر والعصر ومن الليل فسبحه وادبار السجود ومن الليل فسبحه العشا ان او التهجد وادبار السجود التسبيح في اثار الصلوات والسجود والركوع يعبر بهما عن الصلاة وقيل النوافل بعد المكتوبات او الوتر بعد العشاء والادبار جمع دبر وادبار حجازي وحمزة وخلف من ادبرت الصلاة اذا انقضت وتمت ومعناه وقت انقضاء السجود كقولهم اتيك خفوق النجم ,False,0710IbnAhmadHafizDinNasafi.Tafsir
8590118922,48,Shamela0006547-ara1.ms022,قوله تعالي ولقد خلقنا السماوات والارض وما بينهما في ستة ايام وما مسنا من لغوب ق ما نصه قال قتادة والكلبي هذه الاية نزلت في يهود المدينة زعموا ان الله تعالي خلق السموات والارض في ستة ايام اولها الاحد واخرها يوم الجمعة واستراح يوم السبت فجعلوه يوم راحة فاكذبهم الله تعالي ,False,0733IbnJamacaBadrDinHamawi.IdahDalil
8590118922,48,Shamela0023628-ara1.completed.ms3259,قوله عز وجل فاصبر علي ما يقولون الخطاب للنبي صلي الله عليه وسلم اي اصبر يا محمد علي ما يقولون اي من كذبهم فان الله لهم بالمرصاد وهذا قبل الامر بقتالهم وسبح بحمد ربك اي صل حامدا لله قبل طلوع الشمس اي صلاة الصبح وقبل الغروب يعني صلاة المغرب قال ابن عباس صلاة الظهر والعصر سورة ق الايات الي ومن الليل فسبحه وادبار السجود واستمع يوم يناد المناد من مكان قريب ومن الليل فسبحه يعني صلاة المغرب والعشاء وقيل يعني صلاة الليل اي وقت صلي وادبار السجود قال عمر بن الخطاب وعلي بن ابي طالب وغيرهما ادبار السجود الركعتان بعد المغرب وادبار النجوم الركعتان قبل صلاة الفجر وهي رواية عن ابن عباس ويروي مرفوعا عن عاءشة رضي الله تعالي عنها قالت لم يكن النبي صلي الله عليه وسلم علي شء من النوافل اشد تعاهدا منه علي ركعتي الفجر م عنها ان النبي صلي الله عليه وسلم قال ركعتا الفجر خير من الدنيا وما فيها يعني بذلك سنة الفجر عن ابن مسعود قال ما احصي ما سمعت رسول الله صلي الله عليه وسلم يقرا في الركعتين بعد المغرب والركعتين قبل صلاة الفجر يقل يا ايها الكافرون وقل هو الله احد اخرجه الترمذي وقال حديث غريب وقيل في قوله وادبار السجود التسبيح باللسان في ادبار الصلوات المكتوبات خ عن ابن عباس قال امر رسول الله صلي الله عليه وسلم ان يسبح في ادبار الصلوات كلها ,False,0741KhazinBaghdadi.LubabTawil
