cluster,size,id,text,from_input,book
42949734509,4,Shamela0023635-ara1.ms4873,قال الا الذين صبروا وعملوا الصالحات والمراد منه ضد ما تقدم فقوله الا الذين صبروا المراد منه ان يكون عند البلاء من الصابرين وقوله وعملوا الصالحات المراد منه ان يكون عند الراحة والخير من الشاكرين ثم بين حالهم فقال اولءك لهم مغفرة واجر كبير فجمع لهم بين هذين المطلوبين احدهما زوال العقاب والخلاص منه وهو المراد من قوله لهم مغفرة والثاني الفوز بالثواب وهو المراد من قوله واجر كبير ومن وقف علي هذا التفصيل الذي ذكرناه علم ان هذا الكتاب الكريم كما انه معجز بحسب الفاظه فهو ايضا معجز بحسب معانيه سورة هود اية فلعلك تارك بعض ما يوحي اليك وضاءق به صدرك ان يقولوا لولا انزل عليه كنز او جاء معه ملك انما انت نذير والله علي كل شء وكيل ,False,0606FakhrDinRazi.MafatihGhayb
42949734509,4,Shia001432Vols-ara1.msA02459,قوله فلعلك تارك بعض ما يوحي اليك وضاءق به صدرك ان يقولوا لولا انزل عليه كنز او جاء معه ملك انما انت نذير والله علي كل شء وكيل ,False,1111Majlisi.BiharAnwar
42949734509,4,Shia002337Vols-ara1.ms314,قال الا الذين صبروا وعملوا الصالحات قال صبروا في الشدة وعملوا الصالحات في الرخاء قوله فلعلك تارك بعض ما يوحي اليك وضاءق به صدرك ان يقولوا لولا انزل عليه كنز او جاء معه ملك انما انت نذير والله علي كل شء وكيل ,False,0329IbnIbrahimQummi.Tafsir
42949770545,4,Sham19Y0132962-ara1.ms0257,ولا يستخلف للجمعة الا مقتديا به قبل حدثه لانه لا تبتدا جمعة بعد انعقاد جمعة ويخالف الماموم فانه تابع اما في غير الجمعة فيجوز علي الاصح بشرط الا يخالف امامه في ترتيب الصلاة بان يكون في الاولي مطلقا او في الثالثة من الرباعية فان استخلفه في الثانية او في الرابعة من الرباعية او في الثالثة من المغرب لم يجز لانه يحتاج الي القيام وعليهم القعود فيختلف الترتيب بينهم ولا يشترط كونه حضر الخطبة ولا الركعة الاولي في الاصح فيهما ,False,0874BadrDinIbnQadiShuhba.BidayatMuhtaj
42949770545,4,Sham19Y0020561-ara1.ms0181,ولا يستخلف للجمعة الا مقتديا به قبل حدثه لانه لا يجوز افتتاح جمعة بعد جمعة ولا يشترط كونه حضر الخطبة ولا الركعة الاولي في الاصح فيهما ,False,0804IbnMulaqqin.CujalatMuhtaj
42949770545,4,JK001244-ara1.ms094,الاستخلاف واذا فعل المامومون ركنا علي الانفراد امتنع الاستخلاف في غير الجمعة بلا تجديد نية وفيها مطلقا وتبطل ولا يستخلف الامام ولا غيره للجمعة الا مقتديا به قبل حدثه بخلاف غير الجمعة فيجوز استخلاف غير المقتدي في الاولي والثالثة ليتوافق نظم صلاتهم معه ولا يحتاجون الي نية ولا يشترط كونه اي المقتدي حضر الخطبة ولا الركعة الاولي في الاصح فيهما وقيل يشترط حضوره الخطبة ,False,1337MuhammadZahriGhamrawi.SirajWahhaj
42949770545,4,Shamela0021843-ara1.ms0771,الاستخلاف علي قرب فلو فعلوا علي الانفراد ركنا امتنع الاستخلاف بعده ولا يستخلف للجمعة الا مقتديا به قبل حدثه لان في استخلاف غير المقتدي ابتداء جمعة بعد انعقاد جمعة وذلك لا يجوز ولا يشترط في جواز الاستخلاف كونه اي المقتدي حضر الخطبة ولا الركعة الاولي في الاصح فيهما وقيل يشترط حضوره الخطبة ,False,1069ShihabDinQalyubi.HashiyataQalyubiWaCumayra
42949770546,4,Sham19Y0132962-ara1.ms0256,ويكره قبل الاذان بعد الزوال والله اعلم لدخول وقت الصلاة فالتشاغل عنه كالاعراض فصل من ادرك ركوع الثانية المحسوب للامام لا كالمحدث كما سلف ادرك الجمعه فيصلي بعد سلام الامام ركعة يجهر فيها لحديث من ادرك ركعة من الصلاة فقد ادرك الصلاة متفق عليه وفي رواية من ادرك ركعة وان ادركه بعده فاتته فيتم بعد سلامه ظهرا اربعا والاصح انه ينوي في اقتداءه الجمعة واذا خرج الامام من الجمعة او غيرها بحدث او غيره جاز الاستخلاف في الاظهر ولا يستخلف للجمعة الا مقتديا به قبل حدثه ,False,0874BadrDinIbnQadiShuhba.BidayatMuhtaj
42949770546,4,Sham19Y0020561-ara1.ms0181,فصل من ادرك ركوع الثانية اي المحسوب للامام لا كالمحدث كما سلف ادرك الجمعة فيصلي بعد سلام الامام ركعة لقوله صلي الله عليه وسلم من ادرك ركعة من الجمعة فليصل اليها اخري رواه الحاكم وقال اسناده صحيح علي شرط الشيخين وان ادركه بعده فاتته لمفهوم الحديث المذكور فيتم بعد سلامه ظهرا اربعا والاصح انه اي هذا المدرك بعد ركوع الثانية ينوي في اقتداءه الجمعة موافقة للامام والثاني الظهر لانها التي تحصل له واذا خرج الامام من الجمعة او غيرها اي من الصلوات بحدث اي تعمده او سبقه او غيره اي كرعاف وبلا سبب ايضا جاز الاستخلاف في الاظهر لان عمر رضي الله عنه استخلف في صلاته كما رواه البيهقي والثاني المنع لانها صلاة واحدة فلا تجوز بامامين كما لا يجوز الاقتداء بهما معا فرع لو لم يستخلف في الجمعة وجب علي القوم في الاولي دون الثانية ولا يستخلف للجمعة الا مقتديا به قبل حدثه لانه لا يجوز افتتاح جمعة بعد جمعة ولا يشترط كونه حضر الخطبة ولا الركعة الاولي في الاصح فيهما اما الاولي ,False,0804IbnMulaqqin.CujalatMuhtaj
42949770546,4,Shamela0011444BK1-ara1.ms032,ويكره قبل الاذان بعد الزوال والله اعلم فصل من ادرك ركوع الثانية ادرك الجمعة فيصلي بعد سلام الامام ركعة وان ادركه بعده فاتته فيتم بعد سلامه ظهرا اربعا والاصح انه ينوي في اقتداءه الجمعة واذا خرج الامام من الجمعة او غيرها بحدث او غيره جاز الاستخلاف في الاظهر ولا يستخلف للجمعة الا مقتديا به قبل حدثه ولا يشترط كونه حضر الخطبة ولا الركعة الاولي في الاصح فيهما ثم ان كان ادرك الاولي تمت جمعتهم ,False,0676Nawawi.MinhajTalibin
42949770546,4,JK001244-ara1.ms094,ركوع الثانية فاتته الجمعة فيتم بعد سلامه اي الامام ظهرا اربعا والاصح انه اي المدرك للامام بعد ركوع الثانية ينوي في اقتداءه بالامام الجمعة وجوبا ومقابل الاصح ينوي الظهر واذا خرج الامام من الجمعة او غيرها من الصلوات بحدث او غيره كرعاف جاز له وللمامومين قبل اتيانهم بركن منفردين الاستخلاف اي اقامة امام خليفة عنه في الاظهر الجديد وفي القديم لا يجوز الاستخلاف وعلي الجديد لو تقدم واحد بنفسه جاز واذا كانوا في الجمعة وكانوا في الركعة الاولي وجب عليهم ان يستخلفوا واحدا منهم حتي تتم جمعتهم بخلاف الركعة الثانية وباقي الصلوات فلا يجب فيها الاستخلاف واذا فعل المامومون ركنا علي الانفراد امتنع الاستخلاف في غير الجمعة بلا تجديد نية وفيها مطلقا وتبطل ولا يستخلف الامام ولا غيره للجمعة الا مقتديا به قبل حدثه بخلاف غير الجمعة فيجوز استخلاف غير المقتدي في الاولي والثالثة ليتوافق نظم صلاتهم معه ولا يحتاجون الي نية ولا يشترط كونه اي المقتدي حضر الخطبة ولا الركعة الاولي في الاصح فيهما وقيل يشترط حضوره الخطبة وقيل يشترط ادراكه الركعة وان لم يحضر الخطبة ثم ان كان الخليفة ادرك مع الامام الركعة الاولي تمت جمعتهم ,False,1337MuhammadZahriGhamrawi.SirajWahhaj
42949814691,4,JK006476-ara1.ms0925,وما منعنا ان نرسل بالايات الا ان كذب بها الاولون واتينا ثمود الناقة مبصرة فظلموا بها وما نرسل بالايات الا تخويفا واذ قلنا لك ان ربك احاط بالناس وما جعلنا الاسراء وما منعنا ان قوله تعالي وما منعنا ان نرسل بالايات الا ان كذب بها الاولون الاية فان قال قاءل كيف يجوز الا يرسل الله الايات لان الاولين كذبوا بها وما وجه الامتناع عن ارسال الايات بتكذيب الاولين والسءال معروف وهو مشكل والجواب من وجهين احدهما ان الا محذوف ومثله قول الشاعر وكل اخ مفارقه اخوه لعمرو ابيك الا الفرقدان ومعناه وما منعنا من ارسال الايات وان كذب بها الاولون يعني ان تكذيب الاولين لا يمنعنا من ارسال الايات والجواب الثاني وهو المعروف وما منعنا ان نرسل بالايات التي اقترحها الكفار فانه قالوا للنبي اجعل لنا الصفا ذهبا او بعد عنا هذه الجبال لنزرع الاراضي وقوله الا ان كذب بها الاولون معني الاستثناء في اهلاك الاولين حين كذبوا بالايات المقترحة وقد حكمنا ان هذه الامة ممهلة في العذاب قال الله تعالي بل الساعة موعدهم والساعة ادهي وامر وتلخيص الجواب ان الاولين اقترحوا الايات فلما اعطوا كذبوها فاهلكوا فلو اعطينا هءلاء الايات المقترحة وكذبوا بها عاجلناهم بالعذاب وقد حكمنا بامهالهم والدليل علي صحة هذا الجواب انه قال واتينا ثمود الناقة مبصرة اي اية نيرة مضيءة او اية يبصر بها الحق وقوله فظلموا بها اي كذبوا بها ,False,0489IbnMuhammadSamcani.TafsirQuran
42949814691,4,Shamela0000041-ara1.completed.ms1491,وما منعنا ان نرسل بالايات الا ان كذب بها الاولون واتينا ثمود الناقة مبصرة فظلموا بها وما نرسل بالايات الا تخويفا واذ قلنا لك ان ربك احاط بالناس وما جعلنا الرءيا التي اريناك الا فتنة للناس والشجرة الملعونة في القران ونخوفهم فما يزيدهم الا طغيانا كبيرا وما منعنا ان نرسل بالايات التي سالها كفار قريش الا ان كذب بها الاولون فاهلكناهم فان لم يءمن قومك بعد ارسال الايات اهلكتهم لان من سنتنا في الامم اذا سالوا الايات ثم لم يءمنوا بعد اتيانها ان نهلكهم ولا نمهلهم وقد حكمنا باهلاك هذه الامة بالعذاب فقال جل ذكره بل الساعة موعدهم والساعة ادهي وامر القمر ثم قال واتينا ثمود الناقة مبصرة مضيءة بينة فظلموا بها اي جحدوا بها ,False,0510IbnMascudBaghawi.Tafsir
42949814691,4,Sham19Y0014404-ara1.ms0815,وما منعنا ان نرسل بالايات الا ان كذب بها الاولون واتينا ثمود الناقة مبصرة فظلموا بها وما نرسل بالايات الا تخويفا وما منعنا اي وما صرفنا ان نرسل بالايات التي اقترحتها قريش الا ان كذب بها الاولون الذين امثالهم في الطبع كعاد وثمود لان سنة الله فيمن تقدم انه كان اذا اتي باية فلم يءمن ان يهلكه وكان تعالي قد حكم بامهالهم لاتمام امر محمد صلي الله عليه وسلم فقال تعالي بل الساعة موعدهم والساعة ادهي وامر القمر واتينا ثمود الناقة مبصرة بينة واضحة فظلموا بها ,False,0928MujirDinCulaymi.FathRahman
42949814691,4,Shamela0006947-ara1.ms18972,وما منعنا ان نرسل بالايات الا ان كذب بها الاولون الاسراء اي نبعث بالايات وناتي بها علي ما سال قومك منك فانه سهل علينا يسير لدينا الا انه كذب بها الاولون بعدما سالوها وقد جرت سنتنا فيهم وفي امثالهم انهم لا يءخرون ان كذبوا بها بعد نزولها الخ وقال البغوي في هذه الاية وما منعنا ان نرسل بالايات الاسراء التي سالها كفار قريش الا ان كذب بها الاولون الاسراء فاهلكناهم فان لم يءمن قومك بعد ارسال الايات اهلكناهم لان من شاننا في الامم اذا سالوا الايات ثم لم يءمنوا بعد اتيانها ان نهلكهم ولا نمهلهم وقد حكمنا بامهال هذه الامة في العذاب فقال تعالي بل الساعة موعدهم والساعة ادهي وامر القمر ,False,1354RashidRida.Manar
42949884236,4,Sham19Y0127677-ara1.ms11808,احياء ليلتي العيد ج ص قال عن عبادة بن الصامت ان رسول الله صلي الله عليه وسلم قال من احيا ليلة الفطر الحديث وقال رواه الطبراني في الكبير والاوسط وفيه عمر بن هارون البلخي والغالب عليه الضعف واثني عليه ابن مهدي وغيره ولكن ضعفه جماعة كثيرة والله اعلم وفي الصغير برقم بلفظه في مجمع الزواءد من رواية الطبراني في الكبير عن عبادة ورمز له بالضعف قال المناوي قال الهيثمي فيه عمر بن هارون البلخي الي اخره وقال ابن حجر حديث مضطرب الاسناد وفيه عمر بن هارون ضعيف وقد خولف في صحابيه وفي رفعه ورواه الحسن بن سفيان عن عبادة ايضا وفيه بشر بن رافع متهم بالوضع واخرجه ابن ماجه من حديث بقية عن ابي امامة ,False,0911Suyuti.JamicKabir
42949884236,4,ShamAY0034134-ara1.ms1249,قال الحافظ بعد تخريجه عن عبادة بن الصامت ان رسول الله صلي الله عليه وسلم قال من احيا ليلة الفطر وليلة الاضحي لم يمت قلبه يوم تموت القلوب هذا حديث غريب ,False,0852IbnHajarCasqalani.NataijAfkar
42949884236,4,Sham19Y0023625-ara1.ms1455,احيا ليلتي العيد الخ قال الحافظ بعد تخريجه عن عبادة بن الصامت ان رسول الله صلي الله عليه وسلم قال من احيا ليلة الفطر وليلة الاضحي لم يمت قلبه يوم تموت القلوب هذا حديث غريب مضطرب الاسناد وعمرو بن هارون ضعيف وقد خولف في صحابيه وفي رفعه اما الاول فاخرجه ابن ماجة من طريق اخري وقال عن ابي امامة ,False,1057IbnCallan.FutuhatRabbaniyya
42949884236,4,Sham19Y0038171-ara1.ms0896,عبادة بن الصامت بلفظ من احيا ليلة الفطر وليلة الاضحي لم يمت قلبه يوم تموت القلوب فسياق المصنف اشبه بهذا السياق من سياق ابن ماجه وفي السند عمر بن هارون البلخي ضعيف وقال الحافظ حديث مضطرب الاسناد وقد خولف في صحابيه وفي رفعه ,False,1205MurtadaZabidi.TakhrijAhadithIhyaCulumDin
42949890198,4,JK000911-ara1.mARkdown.ms4097,وقول علي بن محمد الساعاتي الدمشقي اتسكن اوطان النبيين عصبة تمين لدي ايمانها وهي تحلف نصحتكم والنصح للدين واجب ذروا بيت يعقوب جاء يوسف ذكر الحرب بين عسكر صلاح الدين وعسكر قلج ارسلان في هذه السنة كان الحرب بين عسكر صلاح الدين يوسف بن ايوب ومقدمهم ابن اخيه تقي الدين عمر بن شاهنشاه بن ايوب وبين عسكر الملك قلج ارسلان بن مسعود بن قلج ارسلان صاحب بلاد قونية واقصرا وسببها ان نور الدين محمود بن زنكي بن اقسنقر رحمه الله كان قد اخذ قديما من قلج ارسلان حصن رعبان وكان بيد شمس الدين بن المقدم الي الان فطمع فيه قلج ارسلان بسبب ان الملك الصالح بحلب بينه وبين صلاح الدين فارسل اليه من يحضره فاجتمع عليه جمع كثير يقال كانوا عشرين الف فارسل اليهم صلاح الدين تقي الدين في الف فارس ,False,0630IbnAthirCizzDin.Kamil
42949890198,4,Kraken210630005153-ara1.ms8886,حرب بين عسكر السلطان صلاح الدين ومقدمهم ابن اخيه تقي الدين عمر وبيت عسكر قيلج ارسلان بن مسعود صاحب بلاد الروم وسببها ان حصن رعبان كان بيد شمس الدين بن المقدم فطمع فيه قيلج ارسلان وارسل اليه عسكرا ليحصروه وكانوا قرب عشرين الفا فسار اليهم تقي الدين في الف فارس هزهم وكان تقي الدين يقول هزمت بالف عشرين الفا وفيها في ثاني ذي الحجة توفي ,False,0749IbnFadlAllahCumari.MasalikAbsar
42949890198,4,Shamela0037063-ara1.completed.ms0306,الحرب بين عسكر صلاح الدين ومقدمهم ابن اخيه تقي الدين عمر وبين عساكر قليج ارسلان يبن مسعود صاحب الروم وسببها ان حصن رعبان كان بيد شمس الدين بن المقدم فطمع فيه قليج ارسلان وارسل اليه عسكرا كثيرا ليحصروه وكانوا قريب عشرين الفا فسار اليهم تقي الدين في الف فارس فهزمهم وكان تقي الدين يفتخر ويقول هزمت بالف عشرين الفا وفي هذه السنة احرق ,False,1372KurdCali.KhitatSham
42949890198,4,Shamela0012715-ara1.mARkdown.ms0669,يقول علي بن محمد الساعاتي الدمشقي اتسكن اوطان النبيين عصبة تمين لدي ايمانها وهي تحلف نصحتكم والنصح للدين واجب ذروا بيت يعقوب فقد جاء يوسف وفيها كان حرب بين عسكر السلطان صلاح الدين ومقدمهم ابن اخيه تقي الدين عمر بن شاهنشاه بن ايوب وبين عسكر قليج ارسلان بن مسعود بن قليج ارسلان صاحب بلاد الروم وسببها ان حصن رعبان كان بيد شمس الدين بن المقدم فطمع فيه قليج ارسلان وارسل اليه عسكرا كثيرا ليحصروه وكانوا قريب عشرين الفا فسار اليهم تقي الدين في الف فارس فهزمهم وكان تقي الدين يفتخر ويقول هزمت بالف عشرين الفا ,False,0732AbuFida.MukhtasarFiAkhbar
42949894549,4,JK000911-ara1.mARkdown.ms2953,الاخشيدية بمصر هربوا عنها جميعهم قبل وصوله ثم انه قدمها سابع عشر شعبان واقيمت الدعوة للمعز بمصر في الجامع العتيق في شوال وكان الخطيب ابا محمد عبد الله بن الحسين الشمشاطي وفي جمادي الاولي من سنة تسع وخمسين سار جوهر الي جامع ابن طولون وامر المءدن فاذن بحي علي خير العمل وهو اول ما اذن بمصر ثم اذن بعده في الجامع العتيق وجهر في الصلاة ببسم الله الرحمن الرحيم ولما استقر جوهر بمصر شرع في بناء القاهرة ذكر ملك عسكر المعز دمشق وغيرها ,False,0630IbnAthirCizzDin.Kamil
42949894549,4,Shamela0001000-ara1.completed.ms0246,من افريقية يوم السبت رابع عشر شهر ربيع الاول سنة ثمان وخمسين وثلثماءة وتسلم مصر يوم يوم الثلاثاء لاثنتي عشرة ليلة بقيت من شعبان من السنة المذكورة وصعد المنبر خطيبا بها يوم الجمعة لعشر بقين من شعبان ودعا لمولاه المعز فاقيمت الدعوة للمعز في الجامع العتيق وسار جوهر الي جامع ابن طولون وامر بان يءذن فيه بحي علي خير العمل وهو اول ما اذن ثم اذن بعده بالجامع العتيق وجهر في الصلاة ببسم الله الرحمن الرحيم ولما استقر جوهر بمصر شرع في بناء القاهرة وسير عسكرا الي دمشق وغزاها فملكها ووصلت البشارة ,False,0681IbnKhallikan.WafayatAcyan
42949894549,4,Zaydiyya0000037Vols-ara1.ms1173,الاخشيد من مصر الي الشام قبل وصول جوهر واقيمت الدعوة للمعز في يوم الجمعة لعشرين من شعبان من هذه السنة في الجامع العتيق وكان الخطيب ابا محمد عبد الله بن احمد السمسطاني خليفة للمطيع ودعا ب مكة في موسم هذه السنة للمطيع القرامطة ودعا ابو مسلم العلوي ب المدينة للمعز في يوم الجمعة الثامن من جمادي الاولي سنة تسع وخمسين راح القاءد جوهر الي جامع ابن طولون واذن المءذنون بحي علي خير العمل ثم اذن بحي علي خير العمل في الجامع العتيق لاربع بقين من جمادي الاولي من هذه السنة وجهر في الصلاة ببسم الله الرحمن الرحيم ,False,1055AhmadSharafi.AliMudia
42949894549,4,Sham19Y0017048-ara1.ms0258,من افريقية يوم السبت رابع عشر ربيع الاول من السنة المذكورة ومعه اصناف القباءل فانفق المعز علي هذا العسكر المسير صحبته اموالا كثيرة فاعطي من الف دينار الي عشرين دينار وغمر الناس بالعطاء وتصرفوا في القيروان في شراء جميع حواءجهم ورحلوا ومعه الف حمل من المال والسلاح ومن الخيل والعدد ما لا يوصف وكان بمصر في تلك السنة غلاء عظيم ووباء حتي مات من مصر واعمالها في تلك المدة ستماءة الف انسان علي ما قيل فانتهي جوهر بمن معه الي مصر فتسلمها يوم الثلاثاء لاثنتي عشرة ليلة بقيت من شعبان السنة المذكورة فصعد المنبر يوم الجمعة ودعا لمولاه المعز وهو بافريقية ولما كان منتصف رمضان من السنة المذكورة وصلت البشاءر الي المعز بفتح الديار المصرية ودخول عساكره اليها ثم وصلته النجب بعد ذلك تخبره بصورة الفتح فاقام جوهر بمصر نافذ الامر وسير عسكرا الي دمشق وغزاها فملكها وبني القاهرة ,False,1228MahmudMaqdishSafaqsi.NuzhatAnzar
