cluster,size,id,text,from_input,book
257698114187,2,JK001480-ara1.ms0596,المءمنون ام تسالهم خرجا ام تسالهم خرجا الخرج هو الاجرة ويقال فيه خراج والمعني واحد وقرء بالوجهين في الموضعين فهو كقوله ام تسالهم اي لست تسالهم اجرا فيثقل عليهم اتباعك فخراج ربك خير اي رزق ربك خير من اموالهم فهو يرزقك ويغنيك عنهم المءمنون وان الذين لا عن الصراط لناكبون اي عادلون ومعرضون عن الصراط المستقيم المءمنون ولو رحمناهم وكشفنا ولو رحمناهم الاية قال الاكثرون نزلت هذه الاية حين دعا رسول الله صلي الله عليه وسلم علي قريش بالقحط فنالهم الجوع حتي اكلوا الجلود وغيرها فالمعني رحمناهم بالخصب وكشفنا ما بهم من ضر الجوع والقحط لتمادوا علي طغيانهم وفي هذا عندي نظر فان الاية مكية باتفاق وانما دعا النبي صلي الله عليه وسلم علي قريش بعد الهجرة حسبما ورد في الحديث وقيل المعني لو رحمناهم بالرد الي الدنيا لعادوا لما نهوا عنه وهذا القول لا يلزم عليه ما يلزم علي الاخر ولكنه خرج عن معني الاية المءمنون ولقد اخذناهم بالعذاب ولقد اخذناهم بالعذاب قيل ان هذا ,True,0741IbnAhmadGharnatiKalbi.TashilLiCulumTanzil
257698115431,2,Sham19Y0020561-ara1.ms0181,وان ادركه بعده فاتته لمفهوم الحديث المذكور فيتم بعد سلامه ظهرا اربعا والاصح انه اي هذا المدرك بعد ركوع الثانية ينوي في اقتداءه الجمعة موافقة للامام والثاني الظهر لانها التي تحصل له واذا خرج الامام من الجمعة او غيرها اي من الصلوات بحدث اي تعمده او سبقه او غيره اي كرعاف وبلا سبب ايضا جاز الاستخلاف في الاظهر ,False,0804IbnMulaqqin.CujalatMuhtaj
257698115431,2,Shamela0011444BK2-ara1.ms0628,وان ادركه اي الامام بعده اي بعد ركوع امامه فاتته اي الجمعة لمفهوم الحديث المتقدم فيتم بعد سلامه اي الامام ظهرا اربعا من غير استءناف نية لفوات الجمعة والاصح انه اي المدرك للامام بعد ركوع الثانية ينوي في اقتداءه بالامام الجمعة وجوبا كما هو مقتضي عبارة الروضة وهو المعتمد وعبارة الانوار ينوي الجمعة جوازا وقال ابن المقري ندبا والجواز لا ينافي الوجوب والندب يحمل علي من تلزمه الجمعة هكذا حمله شيخي وهو حسن والثاني ينوي الظهر لانها التي يفعلها ومحل الخلاف فيمن علم حال الامام والا بان راه قاءما ولم يعلم امعتدل هو او في القيام فينوي الجمعة جزما ثم شرع في القسم الثاني وهو حكم الاستخلاف وشروطه فقال واذا خرج الامام من الجمعة او غيرها من الصلوات بحدث عمدا او سهوا او غيره كرعاف وتعاطي فعل مبطل او بلا سبب ايضا جاز له وللمامومين قبل اتيانهم بركن الاستخلاف في الاظهر ,False,0977KhatibShirbini.MughniMuhtaj
257698115432,2,Sham19Y0020561-ara1.ms0181,فصل من ادرك ركوع الثانية اي المحسوب للامام لا كالمحدث كما سلف ادرك الجمعة فيصلي بعد سلام الامام ركعة لقوله صلي الله عليه وسلم من ادرك ركعة من الجمعة فليصل اليها اخري رواه الحاكم وقال اسناده صحيح علي شرط الشيخين وان ادركه بعده فاتته لمفهوم الحديث المذكور فيتم بعد سلامه ظهرا اربعا والاصح انه ,False,0804IbnMulaqqin.CujalatMuhtaj
257698115432,2,Sham19Y0132962-ara1.ms0256,فصل من ادرك ركوع الثانية المحسوب للامام لا كالمحدث كما سلف ادرك الجمعه فيصلي بعد سلام الامام ركعة يجهر فيها لحديث من ادرك ركعة من الصلاة فقد ادرك الصلاة متفق عليه وفي رواية من ادرك ركعة وان ادركه بعده فاتته فيتم بعد سلامه ظهرا اربعا والاصح انه ينوي في اقتداءه الجمعة واذا خرج الامام من الجمعة او غيرها بحدث او غيره جاز الاستخلاف في الاظهر ولا يستخلف للجمعة الا مقتديا به قبل حدثه من الجمعة فليصل اليها اخري رواه الحاكم وقال اسناده علي شرطهما وان ادركه بعده فاتته لمفهوم الحديث المذكور فيتم بعد سلامه ظهرا اربعا لفوات الجمعة والاصح انه ,False,0874BadrDinIbnQadiShuhba.BidayatMuhtaj
257698115433,2,JK000021-ara1.completed.ms0938,ان افضل الصلوات عند الله صلاة الصبح يوم الجمعة في جماعة اخبرنا ابو منصور احمد بن علي الدامغاني ثنا ابو احمد عبد الله بن عدي الحافظ ثنا القاسم بن عبد الله بن مهدي وانا سالته علي شط النيل باخميم فاملي علي من حفظه ثنا ابو مصعب احمد بن ابي بكر الزهري ثنا عبد العزيز بن ابي حازم عن ابيه عن سهل بن سعد الساعدي قال قال رسول الله صلي الله عليه وسلم ان لكم في كل جمعة حجة وعمرة فالحجة الهجيرة للجمعة والعمرة انتظار العصر بعد الجمعة ,False,0458Bayhaqi.ShucabIman
257698115433,2,Sham19Y0020561-ara1.ms0181,ان افضل الصلاة عند الله صلاة الصبح يوم الجمعة في جماعة وفيه عن سهل بن سعد رفعه ان لكم في كل جمعة حجة وعمرة فالحجة الهجير للجمعة والعمرة انتظار العصر بعد الجمعة ,False,0804IbnMulaqqin.CujalatMuhtaj
257698115436,2,Sham19Y0020561-ara1.ms0181,حضر الخطبة ولا الركعة الاولي في الاصح فيهما اما الاولي فوجه الاشتراط فيها القياس علي ما اذا استخلف بعد الخطبة من لم يحضرها ليصلي بهم فانه ,False,0804IbnMulaqqin.CujalatMuhtaj
257698115436,2,Shamela0003565-ara1.ms1793,حضر الخطبة ولا ادراك الركعة الاولي في الاصح فيهما لانه في الاول بالاقتداء صار في حكم من حضرها وسمعها فلذا صحت جمعته كما تصح جمعة الحاضرين السامعين ووجه مقابله القياس علي ما لو استخلف بعد الخطبة من لم يحضرها ليصلي بهم فانه ,False,1004ShamsDinRamli.NihayatMuhtaj
257698126601,5,ShamAY0034052-ara1.ms2120,كيف يستقيم علي قول من جعل الدخان قبل يوم القيامة قوله انا كاشفوا العذاب قليلا قلت اذا اتت السماء بالدخان تضور المعذبين به من الكفار والمنافقين وقالوا ربنا اكشف عنا العذاب انا مءمنون منيبون فيكشفه الله عنهم بعد اربعين يوما فريثما يكشفه عنهم يرتدون لا يتمهلون ,False,0538JarAllahZamakhshari.Kashshaf
257698126601,5,Sham19Y0020891-ara1.ms5794,تضور المعذبون به من الكفار والمنافقين وقالوا ربنا اكشف عنا العذاب انا مءمنون منيبون فيكشفه الله عنهم بعد اربعين يوما فريثما يكشفه عنهم يرتدون لا يتمهلون ,False,0743SharafDinTibi.FutuhGhayb
257698126601,5,Zaydiyya0000062-ara1.ms1823,قول من جعل الدخان قبل يوم القيامة معناه انهم اذا اتت السماء بدخان مبين استغاثوا وقالوا ربنا اكشف عنا العذاب انا مءمنون اي تاءبون فكشفه الله عنهم بعد اربعين يوما فوقت ما يكشفه عنهم يرتدون لايتمهلون بعد ,False,0810IbnHadi.JawharShaffaf
257698126601,5,ShamAY0034059-ara1.ms6164,انا كاشفو العذاب الخ انه اذا جاء الدخان تضور المعذبون به من الكفار والمنافقين وغوثوا وقالوا ربنا اكشف عنا العذاب انا مءمنون فيكشف الله عنهم بعد اربعين يوما فريثما يكشف عنهم يرتدون ولا يتمهلون ,False,1127IsmacilHaqqiBurusawi.RuhBayan
257698126601,5,ShamAY0035955-ara1.ms337,كيف يستقيم علي قول من جعل الدخان قبل يوم القيامة قوله انا كاشفو العذاب قليلا قلت اذا اتت السماء بالدخان تضور المعذبون به من الكفار والمنافقين وغوثوا وقالوا ربنا اكشف عنا العذاب انا مومنون منيبون فيكشفه الله عنهم بعد اربعين يوما فريثما يكشفه عنهم يرتدون لايتمهلون بسم ,False,1317KhayrDinAlusi.FajrSatic
257698146390,2,Shamela0023578-ara1.completed.ms0223,يا ايها الذين امنوا استعينوا بالصبر والصلاة ان الله مع الصابرين ولا تقولوا لمن يقتل في سبيل الله اموات بل احياء ولكن لا تشعرون ولنبلونكم بشء من الخوف والجوع ونقص من الاموال والانفس والثمرات وبشر الصابرين الذين اذا اصابتهم مصيبة قالوا انا لله وانا اليه راجعون اولءك عليهم صلوات من ربهم ورحمة واولءك هم المهتدون يا ايها الذين امنوا استعينوا بالصبر والصلاة ان الله مع الصابرين بالعون والنصرة ولا تقولوا لمن يقتل في سبيل الله اموات نزلت في قتلي بدر مع المسلمين وكانوا اربعة عشر رجلا منهم ثمانية من الانصار وستة من المهاجرين وذلك ان الناس كانوا يقولون الرجل يقتل في سبيل الله مات فلان وذهب منه نعيم الدنيا ولذتها فانزل الله تعالي ولا تقولوا لمن يقتل في سبيل الله اموات اي هم اموات بل انهم احياء بل احياء ولكن لا تشعرون انهم كذلك قال رسول الله صلي الله عليه وسلم ان ارواح الشهداء في اجواف طير خضر تسرح في ثمار الجنة وتشرب من انهارها وتاوي بالليل الي قناديل من نور معلقة تحت العرش ,False,0427AbuIshaqThaclabi.KashfWaBayan
257698146390,2,Shamela0021821-ara1.ms0128,يايها الذين امنوا استعينوا بالصبر والصلاة ان الله مع الصابرين ولا تقولوا لمن يقتل في سبيل الله اموات بل احياء ولكن لا تشعرون ولنبلونكم بشء من الخوف والجوع ونقص من الاموال والانفس والثمرات وبشر الصابرين الذين اذا اصابتهم مصيبة قالوا انا لله وانا اليه راجعون اولءك عليهم صلوات من ربهم ورحمة واولءك هم المهتدون البقرة قوله يايها الذين امنوا استعينوا بالصبر والصلاة البقرة قال مقاتل استعينوا علي طلب الاخرة بالصبر علي الفراءض وبالصلوات الخمس في مواقيتها علي تمحيص الذنوب ان الله مع الصابرين البقرة قال عطاء عن ابن عباس يقول اني معكم انصركم ولا اخذلكم وقال الزجاج تاويله ان يظهر دينهم علي ساءر الاديان لان من كان الله معه فهو الغالب قوله ولا تقولوا لمن يقتل في سبيل الله اموات البقرة كان الناس يقولون لمن يقتل في سبيل الله مات فلان وذهب عنه نعيم الدنيا ولذتها فانزل الله تعالي هذه الاية وقوله بل احياء ذكر المفسرون في حياة الشهداء في سبيل الله ما روي ان رسول الله صلي الله عليه وسلم قال ان ارواح الشهداء في اجواف طير خضر تسرح في ثمار الجنة وتشرب من انهارها وتاوي بالليل الي قناديل من نور معلقة بالعرش ,False,0468IbnAhmadWahidiNaysaburi.WasitFiTafsir
257698146394,2,Tafsir02091-ara1.ms0122,الله مع الصابرين علي اداء الفراءض قوله تعالي ولا تقولوا لمن يقتل في سبيل الله اموات بل احياء نزلت في قتلي بدر من المسلمين وكانوا اربعة عشر رجلا ثمانية من الانصار وستة من المهاجرين كان الناس يقولون للرجل يقتل في سبيل الله مات فلان وكان الكفار يقولون للشهداء علي طريق الطعن ان اصحاب رسول الله صلي الله عليه وسلم يقتلون انفسهم في الحرب من غير سبب ثم يموتون فيذهبون فنهي الله المسلمين ان يقولوا مثل هذا ونبه علي ان ذلك كذب بقوله بل احياء واختلفوا في حياتهم والصحيح انهم اليوم احياء علي الحقيقة قال رسول الله صلي الله عليه وسلم ان ارواح الشهداء في اجواف طير خضر تسرح في رياض الجنة وتاكل وتشرب من انهارها وتاوي الليل الي قناديل من نور معلقة بالعرش ,False,0360Tabarani.TafsirKabir
257698146394,2,Shamela0021821-ara1.ms0128,الله معه فهو الغالب قوله ولا تقولوا لمن يقتل في سبيل الله اموات البقرة كان الناس يقولون لمن يقتل في سبيل الله مات فلان وذهب عنه نعيم الدنيا ولذتها فانزل الله تعالي هذه الاية وقوله بل احياء ذكر المفسرون في حياة الشهداء في سبيل الله ما روي ان رسول الله صلي الله عليه وسلم قال ان ارواح الشهداء في اجواف طير خضر تسرح في ثمار الجنة وتشرب من انهارها وتاوي بالليل الي قناديل من نور معلقة بالعرش ,False,0468IbnAhmadWahidiNaysaburi.WasitFiTafsir
257698146398,3,Tafsir02091-ara1.ms0122,ان الله مع الصابرين علي اداء الفراءض قوله تعالي ولا تقولوا لمن يقتل في سبيل الله اموات بل احياء نزلت في قتلي بدر من المسلمين وكانوا اربعة عشر رجلا ثمانية من الانصار وستة من المهاجرين كان الناس يقولون للرجل يقتل في سبيل الله مات فلان وكان الكفار يقولون للشهداء علي طريق الطعن ان اصحاب رسول الله صلي الله عليه وسلم يقتلون انفسهم في الحرب من غير سبب ثم يموتون فيذهبون فنهي الله المسلمين ان يقولوا مثل هذا ونبه علي ان ذلك كذب بقوله بل احياء واختلفوا في حياتهم والصحيح انهم اليوم احياء علي الحقيقة قال رسول الله صلي الله عليه وسلم ان ارواح الشهداء في اجواف طير خضر تسرح في رياض الجنة وتاكل وتشرب من انهارها وتاوي الليل الي قناديل من نور معلقة بالعرش وقال الحسن ان الشهداء احياء عند ربهم يصل اليهم الروح والفرح وقيل ان مساكن الشهداء سدرة المنتهي وقال صلي الله عليه وسلم يعطي الشهيد ست خصال عند اول قطرة من دمه يكفر عنه كل خطيءة ويري مقعده من الجنة ويزوج من الحور العين ويءمن من الفزع الاكبر ومن عذاب القبر ويحلي حلية الايمان قوله تعالي ولكن لا تشعرون اي لا يشعرون انهم كذلك قوله تعالي ولنبلونكم بشء من الخوف والجوع اي ولنختبرنكم يا امة محمد بشء من الخوف يعني خوف العدو والفزع في القتال وقحط السنين وقلة ذات اليد ونقص من الاموال اي هلاك المواشي وذهاب الاموال وقوله تعالي والانفس اراد به الموت والقتل والامراض وقوله تعالي والثمرات ,False,0360Tabarani.TafsirKabir
257698146398,3,JK000462-ara1.ms032,البقرة يا ايها الذين يا ايها الذين امنوا استعينوا علي طلب الاخرة بالصبر علي الفراءض والصلاة وبالصلوات الخمس علي تمحيص الذنوب ان الله مع الصابرين اي اني معكم انصركم ولا اخذلكم البقرة ولا تقولوا لمن ولا تقولوا لمن يقتل في سبيل الله اموات نزلت في قتلي بدر من المسلمين وذلك انهم كانوا يقولون لمن يقتل في سبيل الله مات فلان وذهب عنه نعيم الدنيا فقال الله تعالي ولا تقولوا للمقتولين في سبيلي هم اموات بل هم احياء لان ارواح الشهداء في اجواف طير خضر تسرح في الجنة ولكن لا تشعرون بما هم فيه من النعيم والكرامة البقرة ولنبلونكم بشء من ولنبلونكم ولنعاملنكم معاملة المبتلي بشء من الخوف يعني خوف العدو والجوع يعني القحط ونقص من الاموال يعني الخسران والنقصان في المال وهلاك المواشي والانفس يعني الموت والقتل في الجهاد والمرض والشيب والثمرات يعني الجواءح ,False,0468IbnAhmadWahidiNaysaburi.WajizFiTafsir
257698146398,3,Shamela0021821-ara1.ms0128,البقرة قوله يايها الذين امنوا استعينوا بالصبر والصلاة البقرة قال مقاتل استعينوا علي طلب الاخرة بالصبر علي الفراءض وبالصلوات الخمس في مواقيتها علي تمحيص الذنوب ان الله مع الصابرين البقرة قال عطاء عن ابن عباس يقول اني معكم انصركم ولا اخذلكم وقال الزجاج تاويله ان يظهر دينهم علي ساءر الاديان لان من كان الله معه فهو الغالب قوله ولا تقولوا لمن يقتل في سبيل الله اموات البقرة كان الناس يقولون لمن يقتل في سبيل الله مات فلان وذهب عنه نعيم الدنيا ولذتها فانزل الله تعالي هذه الاية وقوله بل احياء ذكر المفسرون في حياة الشهداء في سبيل الله ما روي ان رسول الله صلي الله عليه وسلم قال ان ارواح الشهداء في اجواف طير خضر تسرح في ثمار الجنة وتشرب من انهارها وتاوي بالليل الي قناديل من نور معلقة بالعرش وقوله ولكن لا تشعرون اي ما هم فيه من الكرامة والنعيم قوله ولنبلونكم النون فيه للتاكيد واللام جواب قسم محذوف علي تقدير والله لنبلونكم والمعني لنعاملنكم معاملة المبتلي لان الله تعالي يعلم عواقب الامور فلا يحتاج الي الابتلاء ليعلم العاقبة ولكنه يعاملهم معاملة من يبتلي فمن صبر اثابه علي صبره ومن لم يصبر لم يستحق الثواب وقوله بشء من الخوف البقرة قال ابن عباس يعني خوف العدو والجوع البقرة يعني المجاعة والقحط ونقص من الاموال البقرة يعني الخسران والنقصان في المال وهلاك المواشي والانفس البقرة يعني بالموت والقتل والمرض والشيب والثمرات البقرة يعني الجواءح ,False,0468IbnAhmadWahidiNaysaburi.WasitFiTafsir
257698151173,2,ShamAY0034073-ara1.ms5001,بالنصرة فيها فما اغني احد منهم عن احد منهم عن احد شيءا كما قال ابو سفيان بن الحارث ما هو الا ان لقيناهم فمنحناهم اكتافنا يقتلوننا كيف شاءوا وياسروننا كيف شاءوا يوم لا يغني اي بوجه من الوجوه عنهم كيدهم الذي يرمونه بهذه الاقوال المتناقضة شيءا اي من الاغناء في دفع شء يكرهونه من الموت ولا غيره كما يظنون انه يغني عنهم في غير ذلك من احوال هذه الدار بتثبيط الناس عن اتباع القرانبما يصفونه به من البهتان ولا هم ينصرون اي لا يتجدد لهم نصر من احد ما في ساعة ما ولما افهم هذا الكلام السابق ان التقدير فان لكل ظالم في ذلك اليوم عذابا لا يحيط به الوصف فان الاصعاق من اشد ما يكون من العذاب عطف عليه قوله مءكدا لما لهم من الانكار اي ينصر عليهم المءمنون وهم من الكثرة والقوة بحيث لا مطمع صفحة رقم فيهم لاحد لا سيما لمن هم مثل في الضعف والقلة وان وكان الاصل لهم ولكنه اظهر تعميما وتعليقا للحكم بالوصف فقال للذين ظلموا اي اوقعوا الاشياء في غير مواقعها كما يقولون في القرن ويفعلونه من العصيان ويعتقدون من الشرك والبهتان عذابا دون ذلك اي غير عذاب ذلك اليوم ,False,0885BurhanDinBiqaci.NazmDurar
257698151173,2,ShamAY0034068-ara2.ms3445,بالنصر فيه فما اغني احد منهم عن احد شيءا كما قال ابو سفيان بن الحارث ما هو الا انا القيناهم فمنحناهم اكتافنا يقتلوننا كيف شاءوا وياسروننا كيف شاءوا وقوله تعالي يوم لا يغني اي بوجه من الوجوه بدل من يومهم عنهم كيدهم اي الذي يرمونه بهذه الاقوال المتناقضة شيءا من الاغناء في دفع شء يكرهونه من الموت ولا غيره كما يظنون انه يغني عنهم في غير ذلك من احوال هذه الدار ولا هم ينصرون اي يتجدد لهم نصر ما في ساعة ما يمنعهم من العذاب وقوله تعالي وان للذين ظلموا يجوز ان يكون من ايقاع الظاهر موضع المضمر وان لا يكون والمعني وان للذين اوقعوا الاشياء في غير مواقعها كما يقولونه في القران ويفعلونه من العصيان ويعتقدونه من الشرك والبهتان عذابا دون ذلك اي غير عذاب ذلك اليوم ,False,0977KhatibShirbini.SirajMunir
257698151178,2,Shamela0023628-ara1.completed.ms3279,عذابا دون ذلك اي عذابا في الدنيا قبل عذاب الاخرة قال ابن عباس يعني القتل يوم بدر وقيل هو الجوع والقحط سبع سنين وقيل هو عذاب القبر ولكن اكثرهم لا يعلمون اي ان العذاب نازل بهم قوله عز وجل واصبر لحكم ربك اي الي ان يقع بهم العذاب الذي حكمنا عليهم به فانك باعيننا اي بمراي منا ,False,0741KhazinBaghdadi.LubabTawil
