cluster,size,id,text,from_input,book
618475378450,2,JK009266-ara1.ms8966,قالوا سبحان ربنا انا كنا ظالمين فاقبل بعضهم علي بعض يتلاومون قالوا يويلنا انا كنا طاغين عسي ربنا ان يبدلنا خيرا منها انا الي ربنا راغبون ,False,0800IbnCadilHanbali.LubabFiCulumKitab
618475378450,2,Tafsir10066-ara1.ms1972,قالوا سبحان ربنا انا كنا ظالمين فنابوا بهذا الاعتراف قال تعالي فاقبل بعضهم علي بعض يتلاومون اي يلوم بعضهم بعضا علي خطاهم في عزمهم علي حرمان المساكين وعلي عدم الاستثناء في اليمين قالوا من جملة ما قالوا يويلنا اي يا هلاكنا احضر انا كنا طاغين اي متجاوزين حدود الله التي حد لنا غفلة منا وجهلا بانفسنا وبما يعاقب به امثالنا وهنا بعد ان رجعوا علي انفسهم باللوم والي الله بالتوبة رجوا ربهم ولم يياسوا من رحمته فقالوا عسي ربنا ان يبدلنا خيرا منها انا الي ربنا راغبون ,False,1450AbuBakrJazairi.AysarTafasir
627065348891,2,Sham19Y0145435-ara1.ms3310,فكان وراثه من عمومته ثم طلب هذا الامر غير واحد من بني هاشم فلم ينله الا ولده فالسقاية سقايته وميراث النبي له والخلافة في ولده فلم يبق شرف ولا فضل في جاهلية ولا اسلام في دنيا ولا اخرة الا والعباس وارثه ومورثه واما ما ذكرت من بدر فان الاسلام جاء والعباس يمون ابا طالب وعياله وينفق عليهم للازمة التي اصابته ولولا ان العباس اخرج الي بدر كارها لمات طالب وعقيل جوعا وللحسا جفان عتبة وشيبة ,False,1411MuhammadTahirBarnaji.SahihWaDacifTarikhTabari
627065348891,2,Shamela0006617-ara1.completed.ms1577,فكان وارثه دون بني عبد المطلب وطلب الخلافة غير واحد من بني هاشم فلم ينلها الا ولده فاجتمع للعباس انه ابو رسول الله خاتم النبيين وبنوه القادة الخلفاء فقد ذهب بفضل القديم والحديث ولولا ان العباس اخرج الي بدر كرها لمات عماك طالب وعقيل جوعا او يلحسا جفان عتبة وشيبة ,False,1269CabdMalikCasimi.SamtNujum
627065365961,2,Shamela0009783BK1-ara1.mARkdown.ms4768,فوافاه احمد بن ابي الاصبغ بما فارق عليه احمد ابن عيسي بن الشيخ من المال الذي اخذه من مال اسحاق بن كنداج وبهدايا ودواب وبغال في يوم الاربعاء لسبع خلون من شهر ربيع الاول اخبار متفرقة وفي شهر ربيع الاول ورد الخبر بان محمد بن ابي الساج افتتح المراغه بعد حصار شديد وحرب غليظه كانت بينهم وانه اخذ عبد الله بن الحسين بعد ان امنه واصحابه فقيده وحبسه وقرره بجميع امواله ثم قتله بعد وفي شهر ربيع الاخر ورد الخبر بوفاه احمد بن عبد العزيز بن ابي دلف وكانت وفاته في اخر شهر ربيع الاول فطلب الجند ارزاقهم وانتهبوا منزل اسماعيل بن محمد المنشء وتنازع الرءاسة عمر وبكر ابنا عبد العزيز ثم قام بالامر عمر ولم يكتب اليه المعتضد بالولاية وفيها ,False,0310Tabari.Tarikh
627065365961,2,Shamela0012396-ara1.completed.ms1237,ووافاه احمد بن ابي الاصبغ بما فارق عليه احمد بن عيسي بن شيخ من المال الذي اخذه من مال اسحاق بن كنداجيق وبهدايا وبغال ودواب وفيها ورد الخبر بان محمد بن ابي الساج افتتح المراغة بعد حصار شديد وحرب عظيمة وانه اخذ عبد الله بن الحسين بعد ان امنه واصحابه فقيده وحبسه وقرره بجميع امواله ثم قتله وفيها ورد الخبر بوفاة احمد بن عبد العزيز بن ابي دلف وتنازع الرءاسة عمر وبكر ابنا عبد العزيز ثم قام بالامر عمر وفيها توفي جعفر بن المعتمد وفيها ,False,0421Miskawayh.Tajarib
627065401981,2,Tafsir03037-ara1.ms3159,ان كان ذا مال وبنين متعلق بقوله لا تطع اي لاتطع من هذه مثالبه لان كان صاحب مال وبنين مستظهرا بهم فانه حظه من الدنيا وقيل متعلق بما بعده اي لان كان ذا مال وبنين كذب باياتنا يدل عليه قوله تعالي اذا تتلي عليه اياتنا اي القران قال اساطير الاولين اي اكاذيب المتقدمين ولا يعمل فيه قال لان ما بعد الشرط لا يعمل فيما قبله ومن قرا بكسر ان فشرط حذف جوابه اي ان كان ذا مال فلا تطعه والمعني لا تطع كل حلاف شارطا يساره قيل لما عاب الوليد النبي صلي الله عليه وسلم كاذبا بامر واحد وهو الجنون سماه الله تعالي صادقا بعشرة اسماء فاذا كان من عدله ان يجزي المسء الي رسول الله صلي الله عليه وسلم بعشر كان من فضله ان يجزي المصلي عليه او المادح له بعشر فاكثر سنسمه علي الخرطوم سنعلمه علي انفه بالكي بالنار اهانة له وتخصيص الانف بالذكر لان الوسم عليه ابشع وقيل خطم بالسيف يوم بدر فبقيت سمة علي خرطومه ,False,1124IbnMuhammadIbnCajibaFasiSufi.BahrMadid
627065401981,2,Shamela0001394-ara1.ms1726,ان كان ذا مال وبنين ان كان ذا مال متعلق بقوله ولا تطع اي ولا تطعه مع هذه المثالب لان كان ذا مال اي ليساره وحظه من الدنيا ويجوز ان يتعلق بما بعده اي لان كان ذا مال وبنين كذب باياتنا يدل عليه اذا تتلي عليه اياتنا قال اساطير الاولين اذا تتلي عليه اياتنا اي القران قال اساطير الاولين ولا يعمل فيه قال لان ما بعد الشرط لا يعمل فيما قبله اان حمزة وابو بكر اي الان كان ذا مال كذب اان شامي ويزيد ويعقوب وسهل قالوا لما عاب الوليد النبي صلي الله عليه وسلم كاذبا باسم واحد وهو المجنون سماه الله تعالي بعشرة اسماء صادقا فان كان من عدله ان يجزي المسء الي رسول الله صلي الله عليه وسلم بعشرة كان من فضله ان من صلي عليه وسلم بها عشرا سنسمه علي الخرطوم سنسمه سنكويه علي الخرطوم علي انفه مهانة له وعلما يعرف به وتخصيص الانف بالذكر لان الوسم عليه ابشع وقيل خطم بالسيف يوم بدر فبقيت سمة علي خرطومه ,False,0710IbnAhmadHafizDinNasafi.Tafsir
627065401982,2,Shamela0001394-ara1.ms1726,بعده اي لان كان ذا مال وبنين كذب باياتنا يدل عليه اذا تتلي عليه اياتنا قال اساطير الاولين اذا تتلي عليه اياتنا اي القران قال اساطير الاولين ولا يعمل فيه قال لان ما بعد الشرط لا يعمل فيما قبله اان حمزة وابو بكر اي الان كان ذا مال كذب اان شامي ويزيد ويعقوب وسهل قالوا لما عاب الوليد النبي صلي الله عليه وسلم كاذبا باسم واحد وهو المجنون سماه الله تعالي بعشرة اسماء صادقا فان كان من عدله ان يجزي المسء الي رسول الله صلي الله عليه وسلم بعشرة كان من فضله ان من صلي عليه وسلم بها عشرا سنسمه علي الخرطوم سنسمه سنكويه علي الخرطوم علي انفه مهانة له وعلما يعرف به وتخصيص الانف بالذكر لان الوسم عليه ابشع وقيل خطم بالسيف يوم بدر فبقيت سمة علي خرطومه انا بلوناهم كما بلونا اصحاب الجنة اذ اقسموا ليصرمنها مصبحين انا بلوناهم امتحنا اهل مكة بالقحط والجوع حتي اكلوا ,False,0710IbnAhmadHafizDinNasafi.Tafsir
627065401982,2,Sham19Y0014404-ara1.ms1561,معناه لان كان ذا مال وبنين تطيعه يدل علي المحذوف ولا تطع قبل والوجه الاخر الان كان ذا مال وبنين اذا تتلي عليه اياتنا قال اساطير الاولين اذا تتلي عليه اياتنا كذب بالقران و قال اساطير الاولين اكاذيبهم ورفعها باضمار هي اي جعل مجازاة النعم التي خولها من البنين والمال الكفر باياتنا سنسمه علي الخرطوم ثم ختم ذلك بالوعيد الصادق بتمام شقاءه بقوله سنسمه علي الخرطوم سنسود وجهه او نكويه والخرطوم هو الانف ليكون له علما يعرف به لان الكافر يسود وجهه يوم القيامة وخص الانف بالذكر لان الوسم عليه ابشع وقيل ابو جهل خطم انفه بالسيف يوم بدر انا بلوناهم كما بلونا اصحاب الجنة اذ اقسموا ليصرمنها مصبحين انا بلوناهم اختبرنا اهل مكة بالقحط والجوع كما بلونا ,False,0928MujirDinCulaymi.FathRahman
635655192702,2,Shamela0009091-ara1.mARkdown.ms0639,علي شيخه الجنيد فوقف بين يديه وصفق بيديه وانشد عودوني الوصال والوصل عذب ورموني بالضد والضد اصعب زعموا حين عاتبوا ان ذنبي قر طبعي لهم وما ذاك اذنب الا وحق الخضوع عند التلاقي ما جزاء من يحب الا يجب فقال الجنيد نعم يا ابا بكر وكانت امراة الجنيد عنده حاضرة فارادت ان تشتري منه فقال لها الجنيد لا عليك وهو غاءب لا يراك ثم بكي بعد انشاده فقال الجنيد اشتري منه الان فقد حضر وقال بعضهم دخلت علي الشبلي يوما في داره وهو يصيح ويقول علي بعدك لا يصبر من عادته القرب ولا يقوي علي هجرك من يتمه الحب فان لم ترك العين فقد ابصرك القلب وقال الشبلي رايت معتوها عند جامع الرصافة يقول انا مجنون انا ,False,0768Yafici.MiratJinan
635655192702,2,Sham19Y0029560-ara1.ms0863,علي شيخه الجنيد وامراته عنده فوقف بين يديه وصفق بيديه وانشد من الخفيف عودوني الوصال والوصل عذب ورموني بالصد والصد صعب زعموا حين عاتبوا ان ذنبي فرط حبي لهم وما ذاك ذنب لا وحق الخضوع عند التلاقي ما جزاء من يحب الا يحب فقال الجنيد نعم يا ابا بكر فارادت امراة الجنيد ان تستتر منه فقال لها الجنيد لا عليك هو غاءب لا يراك ثم بكي بعد انشاده فقال الجنيد لامراته استتري عنه الان فقد حضر وقال بعضهم دخلت علي الشبلي يوما في داره وهو يصيح ويقول من الهزج علي بعدك لا يصب ر من عادته القرب ولا يقوي علي هجر ك من تيمه الحب فان لم ترك العين فقد يبصرك القلب وقال الشبلي رايت معتوها عند جامع الرصافة يقول انا مجنون انا ,False,0947BamakhramaHimyari.QiladatNahr
644245249505,2,Shamela0023635-ara1.ms8088,وما ذكرتموه من الظلمة الحاصلة في العين بسبب شدة الجوع فذاك ليس بدخان اتت به السماء فكان حمل لفظ الاية علي هذا الوجه عدولا عن الظاهر ,False,0606FakhrDinRazi.MafatihGhayb
644245249505,2,Shamela0023631-ara1.ms4086,وما ذكرتموه من الظلمة الحاصلة في العين بسبب شدة الجوع فذاك ليس بدخان اتت به السماء فكان حمل لفظ الاية علي هذا الوجه عدولا عن الظاهر ,False,1332IbnMuhammadJamalDinQasimi.MahasinTawil
644245267488,2,JK000911-ara1.mARkdown.ms2935,فيها ثم ان الروم تجمع من سلم منهم واخذوا معهم من في صقلية وجزيرة ريو منهم وركبوا مراكبهم يحفظون نفوسهم فركب الامير احمد في عساكره واصحابه في المراكب ايضا وزحف اليهم في الماء وقاتلهم واشتد القتال بينهم والقي جماعة من المسلمين نفوسهم في الماء وخرقوا كثيرا من المراكب التي للروم فغرقت وكثر القتل في الروم فانهزموا لا يلوي احد علي احد وسارت سرايا المسلمين في مداءن الروم فغنموا منها فبذل اهلها لهم من الاموال وهادنوهم وكان ذلك سنة اربع وخمسين وثلاثماءة وهذه الوقعة الاخيرة هي المعروفة بوقعة المجاز ,False,0630IbnAthirCizzDin.Kamil
644245267488,2,Sham19Y0014512-ara1.ms432,في اخره ثم ان الروم تجمع من سلم منهم واخذوا معهم من صقلية وجزيرة ريو منهم وركبوا مراكبهم يحفظون نفوسهم فركب الامير احمد في عساكره واصحابه في المراكب ايضا وزحف اليهم في الماء وقاتلهم واشتد القتال بينهم والقي جماعة من المسلمين نفوسهم في الماء وخرقوا كثيرا من المراكب التي للروم فغرقت وكثر القتل في الروم فانهزموا لا يلوي احد علي احد وسارت سرايا المسلمين في مداءن الروم فغنموا منها فبذل اهلها لهم من الاموال وهادنوهم وكان ذلك سنة اربع وخمسين وثلاثماءة وهذه الوقعة الاخيرة هي المعروفة بوقعة المجاز ,False,0458YahyaIbnSacidAntaki.Tarikh
661425129341,2,Shia002389Vols-ara1.ms2963,واذا راوا تجارة او لهوا انفضوا اليها قال كان رسول الله صلي الله عليه واله يصلي بالناس يوم الجمعة و دخلت ميرة وبين يديها قوم يضربون بالدفوف والملاهي فترك الناس الصلاة ومروا ينظرون اليهم فانزل الله واذا راوا تجارة او لهوا انفضوا اليها الي قوله والله خير الرازقين اخبرنا احمد بن ادريس قال حدثنا احمد بن محمد عن الحسين بن سعيد عن صفوان عن ابن مسكان عن ابي بصير انه سءل عن الجمعة كيف يخطب الامام قال يخطب قاءما فان الله يقول وتركوك قاءما وعنه عن احمد بن محمد عن علي بن الحكم عن ابي ايوب عن ابي يعفور عن ابي عبد الله عليه السلام قال نزلت واذا راوا تجارة او لهوا انصرفوا اليها وتركوك قاءما قل ما عند الله خير من اللهو ومن التجارة يعني للذين اتقوا والله خير الرازقين ,False,1112IbnJumcaHuwayzi.TafsirNurThaqalayn
661425129341,2,Shia002337Vols-ara1.ms715,واذا راوا تجارة او لهوا انفضوا اليها قال كان رسول الله صلي الله عليه واله يصلي بالناس يوم الجمعة ودخلت ميرة وبين يديها قوم يضربون بالدفوف والملاهي فترك الناس الصلاة ومروا ينظرون اليهم فانزل الله واذا راوا تجارة او لهوا انفضوا اليها وتركوك قاءما قل ما عند الله خير من اللهو ومن التجارة والله خير الرازقين اخبرنا احمد بن ادريس قال حدثنا محمد بن احمد احمد بن محمد ط عن الحسين بن سعيد عن صفوان عن ابن مسكان عن ابي بصير انه سءل عن الجمعة كيف يخطب الامام قال يخطب قاءما فان الله يقول وتركوك قاءما وعنه عن احمد بن محمد عن علي بن الحكم عن ابي ايوب عن ابن ابي يعفور عن ابي عبد الله عليه السلام قال نزلت واذا راوا تجارة او لهوا انصرفوا اليها وتركوك قاءما قل ما عند الله خير من اللهو ومن التجارة يعني للذين اتقوا والله خير الرازقين ,False,0329IbnIbrahimQummi.Tafsir
678604922964,2,Tafsir03037-ara1.ms3159,الله هم دنياكم او هم الذين تفرقت قلوبهم وتشعبت همومهم حتي ماتوا في اودية الفتن فلم يبال الله بهم في اي اودية الدنيا هلكوا كما في الاثر ان ربك هو اعلم بمن ضل عن طريقه الموصلة اليه وهو اعلم بالمهتدين اليها الساءرين فيها حتي وصلوا الي حضرة قدسه فلا تطع ايها المتوجه المكذبين لهذه الطريق ودوا لو تلينون اليهم وتشاركونهم فيما هم فيه من الحظوظ فيميلون اليكم طمعا فيكم ,False,1124IbnMuhammadIbnCajibaFasiSufi.BahrMadid
678604922964,2,Shamela0010273-ara1.ms3448,الله هم دنياكم او هم الذين تفرقت قلوبهم وتشعبت همومهم حتي ماتوا في اودية الفتن فلم يبال الله بهم في اي اودية الدنيا هلكوا كما في الاثر ان ربك هو اعلم بمن ضل عن طريقه الموصلة اليه وهو اعلم بالمهتدين اليها الساءرين فيها حتي وصلوا الي حضرة قدسه فلا تطع ايها المتوجه المكذبين لهذه الطريق ودوا لو تلينون اليهم وتشاركونهم فيما هم فيه من الحظوظ فيميلون اليكم طمعا فيكم ,False,1224IbnCajiba.BahrMadid
3224,3,Shamela0021766-ara1.ms2119,نذير بالعقاب علي الشرك وبشير بالثواب علي التوحيد وان استغفروا عطف علي ان لا تعبدوا يعني استغفروا ربكم علي ما سلف منكم من المعاصي ثم توبوا ثم ارجعوا بالطاعة اليه وقال الفراء ثم هاهنا بمعني الواو والاستغفار هو التوبة يعني يلزم احدهما الاخر يمتعكم متاعا حسنا اي يعيشكم عيشا حسنا في امن وسعة فان المعاصي جالبة للمصاءب والبليات قال الله تعالي ما اصابكم من مصيبة فبما كسبت ايديكم ويعفوا عن كثير وقيل العيش الحسن الرضاء بالمقسوم والصبر علي المقدور الي اجل مسمي اي حين موت كل واحد منكم فانها مدة معلومة عند الله تعالي بحيث لا يتغير ويءت كل ذي فضل في دينه وعمله فضله اي جزاء فضله في الدنيا ,False,1225ThanaAllahPanipati.TafsirMazhari
3224,3,Shamela0023588-ara1.ms0785,الامرين يمتعكم متاعا حسنا يعيشكم في امن ودعة الي اجل مسمي هو اخر اعماركم المقدرة او لا يهلككم بعذاب الاستءصال والارزاق والاجال وان كانت متعلقة بالاعمار لكنها مسماة بالاضافة الي كل احد فلا تتغير ويءت كل ذي فضل فضله ويعط كل ذي فضل في دينه جزاء فضله في الدنيا والاخرة وهو وعد للموحد التاءب بخير الدارين وان ,False,0685NasirDinBaydawi.AnwarTanzil
3224,3,Sham19Y0013223-ara2.ms2702,نذير بالعقاب علي الشرك وبشير بالثواب علي التوحيد يمتعكم يعيشكم في امن ودعة ولا يهلككم بعذاب الاستءصال والارزاق والاجال ويعط كل ذي فضل في دينه جزاء فضله في الدنيا والاخرة وهو وعد للموحد التاءب بخير الدارين ان ,False,0656IbnCabdQawiMundhiri.TarghibWaTarhib
7725,3,Shamela0010283-ara1.mARkdown.ms7200,علي خوشداشه الامير عز الدين ايبك الخزندار المنصوري ناءب السلطنة بالفتوحات الطرابلسية وندب لذلك امير بن فتوجها الي دمشق علي خيل البريد فوصلا اليها في تاسع عشرين شوال وجرد من دمشق الامير عز الدين ايبك كرجي والامير سيف الدين استدمر كرجي بسبب ذلك فلما توجهوا اليه لم يمتنع عليهم وقال قد كنت عزمت علي مفارقة هذه المملكة والتوجه الي باب ,False,0733Nuwayri.NihayatArab
7725,3,Kraken210719221518-ara1.ms1277,علي خوشداشه الامير عز الدين ايبك الخازندار المنصوري نايب السلطنة بالفتوحات يكفيه فاقترض اموال التجار واموال الايتام التي بمودع الحكم وتوجه من ق الطرابلسية وندب لذلك اميرين فتوجها الي دمشق علي خيل البريد فوصلا اليها في تاسع قغر عدن نحو تعز خجرد الملك الاشرف ممهد الدين عمر لقتاله الشريف علي بن عبد لله شري شوال من هذه السنة وجرد من دمشق الامير عز الدين ايبك كرجي والامير يجماعة من الحيش وجلال الدين بن الملك الاشرف فتوجهوا والتقوا في ما بين تعز وعدن سيف الدين اسندمر كرجي بسبب ذلك فلما توجهوا اليه لم يمتنع عليهم وقال قد كنت يمكان يسمي الدعيس واقتتلوا غفذل الجحافل الملك المءيد وتفرقوا عنه وبقي في عزمت علي ق مفارقة هذه المملكة والتوجه الي باب ,False,0807IbnFurat.TarikhDuwal
7725,3,Kraken210719221518-ara1.ms1280,وجرد من دمشق الامير عز الدين ايبك كرجي والامير يجماعة من الحيش وجلال الدين بن الملك الاشرف فتوجهوا والتقوا في ما بين تعز وعدن سيف الدين اسندمر كرجي بسبب ذلك فلما توجهوا اليه لم يمتنع عليهم وقال قد كنت يمكان يسمي الدعيس واقتتلوا غفذل الجحافل الملك المءيد وتفرقوا عنه وبقي في عزمت علي ق مفارقة هذه المملكة والتوجه الي باب ,False,0807IbnFurat.TarikhDuwal
7726,3,Shamela0010283-ara1.mARkdown.ms7203,منها بالاطلاقات للامراء وغيرهم حتي نفد ما في الاهراء وقصر النيل بعد ذلك فاحتاج وزير الدولة الي مشتري الغلال للمءونة والعليق فتزايدت الاسعار بسبب ذلك ,False,0733Nuwayri.NihayatArab
7726,3,Kraken210719221518-ara1.ms1277,منها ق بالاطلاقات للامراء وغيرهم حتي نفد ما في الاهراء قبل وفاته وقصر النيل في سنة ثلاث وتسعين السنة الخالية كما قدمنا شرحه فاحتاج وزير الدولة الي مشتري وفاة مكررة في الاصل الغلال للمونة والعليق فتزايدت الاسعار بسبب ذلك ,False,0807IbnFurat.TarikhDuwal
7726,3,Kraken210719221518-ara1.ms1274,منها ق بالاطلاقات للامراء وغيرهم حتي نفد ما في الاهراء قبل وفاته وقصر النيل في سنة ثلاث وتسعين السنة الخالية كما قدمنا شرحه فاحتاج وزير الدولة الي مشتري وفاة مكررة في الاصل الغلال للمونة والعليق فتزايدت الاسعار بسبب ذلك ,False,0807IbnFurat.TarikhDuwal
