cluster,size,id,text,from_input,book
174107,8,Shia002382Vols-ara1.ms1256,ولو رحمناهم وكشفنا ما بهم من ضر يعني القحط للجوا لتمادوا في طغيانهم افراطهم في الكفر والاستكبار عن الحق وعداوة الرسول والمءمنين يعمهون عن الهدي روي انهم قحطوا حتي اكلوا العلهز فجاء ابو سفيان الي رسول الله صلي الله عليه واله فقال انشدك الله والرحم الست تزعم انك بعثت رحمة للعالمين قتلت الاباء بالسيف والابناء بالجوع فنزلت كذا في الجوامع ولقد اخذناهم بالعذاب قيل يعني القتل يوم بدر والقمي هو الجوع والخوف والقتل فما استكانوا لربهم وما يتضرعون بل اقاموا علي عتوهم واستكبارهم في الكافي عن الباقر عليه السلام انه سءل عن هذه الاية قال الاستكانة هي الخضوع والتضرع رفع اليدين والتضرع بهما وفي المجمع عن الصادق عليه السلام الاستكانة الدعاء والتضرع رفع اليدين في الصلاة حتي اذا فتحنا عليهم بابا ذا عذاب شديد في المجمع عنه عليه السلام وذلك حين دعا النبي صلي الله عليه واله عليهم فقال اللهم اجعلها عليهم سنين كسني يوسف عليه السلام فجاعوا حتي اكلوا العلهز وهو الوبر بالدم وعن الباقر عليه السلام هو في الرجعة ,False,1091MuhammadMuhsinFaydKashani.TafsirSafi
174107,8,Shia002389Vols-ara1.ms1917,ولو رحمناهم وكشفنا ما بهم من ضر للجوا في طغيانهم يعمهون ولما اسلم ثمامة بن اثال الحنفي ولحق باليمامة ومنع الميرة من اهل مكة واخذهم الله بالسنين حتي اكلوا العلهز وهو دم القراد مع الصوف جاء ابو سفيان بن حرب الي رسول الله صلي الله عليه واله فقال له انشدك الله والرحم الست تزعم انك بعثت رحمة للعالمين فقال بلي فقال له قتلت الاباء بالسيف والابناء بالجوع في اصول الكافي علي بن ابراهيم عن ابن ابي عمير عن ابي ايوب عن محمد بن مسلم قال سالت ابا جعفر عليه السلام عن قول الله عز وجل فما استكانوا لربهم و ما يتضرعون فقال الاستكانة هو الخضوع والتضرع هو رفع اليدين والتضرع بهما محمد بن يحيي عن احمد بن محمد عن ابن محبوب عن ابي ايوب عن محمد بن مسلم قال سالت ابا جعفر عليه السلام عن قول الله عز وجل فما استكانوا لربهم وما يتضرعون قال الاستكانة هي الخضوع والتضرع رفع اليدين والتضرع بهما في مجمع البيان وروي عن مقاتل بن حيان عن الاصبغ بن نباتة عن امير المءمنين عليه السلام قال قال النبي صلي الله عليه واله رفع الايدي من الاستكانة قلت وما الاستكانة قال الا تقرء هذه الاية فما استكانوا لربهم وما يتضرعون اورده الثعلبي والواحدي في تفسيريهما وقال ابو عبد الله عليه السلام الاستكانة الدعاء والتضرع رفع اليدين في الصلاة حتي اذا فتحنا عليهم بابا ذا عذاب شديد وذلك حين دعا النبي صلي الله عليه واله عليهم فقال اللهم اجعلها عليهم سنين كسني يوسف فجاعوا حتي اكلوا العلهز وهو الوبر بالدم وقال ابو جعفر عليه السلام هو في الرجعة قال عز من قاءل وهو الذي انشا لكم السمع والابصار الاية في ,False,1112IbnJumcaHuwayzi.TafsirNurThaqalayn
188526,2,JK000462-ara1.ms541,الطور وان يروا كسفا وان يروا كسفا قطعا من السماء ساقطا يقولوا لعنادهم وفرط شقاوتهم سحاب مركوم بعضه علي بعض وهذا جواب لقولهم فاسقط علينا كسفا من السماء اخبر الله تعالي انه لو فعل ذلك لم يءمنوا الطور فذرهم حتي يلاقوا فذرهم حتي يلاقوا يومهم الذي فيه يصعقون ,False,0468IbnAhmadWahidiNaysaburi.WajizFiTafsir
188526,2,JK000458-ara1.ms3153,الطور وان يروا كسفا وان يروا كسفا قطعة من السماء ساقطا لتعذيبهم يقولوا من فرط طغيانهم وعنادهم سحاب مركوم اي هم في الطغيان بحيث لو اسقطناه عليهم حسبما قالوا او تسقط السماء كما زعمت علينا كسفا لقالوا هذا سحاب تراكم بعضه علي بعض يمطرنا ولم يصدقوا انه كسف ساقطا للعذاب الطور فذرهم حتي يلاقوا فذرهم حتي يلاقوا وقرء حتي يلقوا يومهم الذي فيه يصعقون ,False,0982IbnMuhammadAbuSucud.IrshadCaqlSalim
188529,2,JK000865-ara1.ms685,الطور ام لهم اله ام لهم اله غير الله يمنعهم من عذاب الله سبحان الله نزه نفسه عما يشركون به من الاوثان الطور وان يروا كسفا وان يروا كفار مكة كسفا قطعا من السماء ساقطا نازلا يقولوا سحاب مركوم هذا سحاب مركوم بعضه علي بعض من تكذيبهم الطور فذرهم حتي يلاقوا فذرهم اتركهم يا محمد حتي يلاقوا يعاينوا يومهم الذي فيه يصعقون يموتون الطور يوم لا يغني يوم وهو يوم القيامة لا يغني عنهم عن ابي جهل واصحابه كيدهم لا ينفعهم صنيعهم من عذاب الله شيءا ولا هم ينصرون يمنعون عما يراد بهم الطور وان للذين ظلموا وان للذين ظلموا ,False,0817MajdDinFiruzabadi.TanwirMiqbas
188529,2,JK000458-ara1.ms3153,الطور ام لهم اله ام لهم اله غير الله يعينهم ويحرسهم من عذابه سبحان الله عما يشركون اي عن اشراكهم او عن شركة ما يشركونه الطور وان يروا كسفا وان يروا كسفا قطعة من السماء ساقطا لتعذيبهم يقولوا من فرط طغيانهم وعنادهم سحاب مركوم اي هم في الطغيان بحيث لو اسقطناه عليهم حسبما قالوا او تسقط السماء كما زعمت علينا كسفا لقالوا هذا سحاب تراكم بعضه علي بعض يمطرنا ولم يصدقوا انه كسف ساقطا للعذاب الطور فذرهم حتي يلاقوا فذرهم حتي يلاقوا وقرء حتي يلقوا يومهم الذي فيه يصعقون علي البناء للمفعول من صعقته الصاعقة او من اصعقته وقرء يصعقون بفتح الياء والعين وهو يوم يصيبهم الصعقة بالقتل يوم بدر لا النفخة الاولي كما قيل اذ لا يصعق بها الا من كان حيا حينءذ ولان قوله تعالي الطور يوم لا يغني يوم لا يغني عنهم كيدهم شيءا اي شيءا من الاغناء بدل من يومهم ولا يخفي ان التعرض لبيان عدم نفع كيدهم يستدعي استعمالهم له طمعا في الانتفاع به وليسي ذلك الا ما دبروه في امره صلي الله عليه وسلم من الكيد الذي من جملته مناصبتهم يوم بدر واما النفخة الاولي فليست مما يجري في مدافعته الكيد والحيل وقيل هو يوم موتهم وفيه ما فيه مع ما تاباه الاضافة المنبءة عن اختصاصه بهم ولا هم ينصرون من جهة الغير في دفع العذاب عنهم الطور وان للذين ظلموا وان للذين ظلموا ,False,0982IbnMuhammadAbuSucud.IrshadCaqlSalim
188533,3,JK000458-ara1.ms3153,لهم اله ام لهم اله غير الله يعينهم ويحرسهم من عذابه سبحان الله عما يشركون اي عن اشراكهم او عن شركة ما يشركونه الطور وان يروا كسفا وان يروا كسفا قطعة من السماء ساقطا لتعذيبهم يقولوا من فرط طغيانهم وعنادهم سحاب مركوم اي هم في الطغيان بحيث لو اسقطناه عليهم حسبما قالوا او تسقط السماء كما زعمت علينا كسفا لقالوا هذا سحاب تراكم بعضه علي بعض يمطرنا ولم يصدقوا انه كسف ساقطا للعذاب الطور فذرهم حتي يلاقوا فذرهم حتي يلاقوا وقرء حتي يلقوا يومهم الذي فيه يصعقون علي البناء للمفعول من صعقته الصاعقة او من اصعقته وقرء يصعقون بفتح الياء والعين وهو يوم يصيبهم الصعقة بالقتل يوم بدر لا النفخة الاولي كما قيل اذ لا يصعق بها الا من كان حيا حينءذ ولان قوله تعالي الطور يوم لا يغني يوم لا يغني عنهم كيدهم شيءا اي ,False,0982IbnMuhammadAbuSucud.IrshadCaqlSalim
188533,3,Shia002382Vols-ara1.ms1728,يوم بدر ام لهم اله غير الله يعينهم ويحرسهم من عذابه سبحان الله عما يشركون عن اشراكهم او شركة ما يشركونه به وان يروا كسفا قطعة من السماء ساقطا يقولوا من فرط طغيانهم وعنادهم سحاب مركوم هذا سحاب تراكم بعضها علي بعض وهو جواب قولهم فاسقط علينا كسفا من السماء فذرهم حتي يلاقوا يومهم الذي فيه يصعقون قيل هو عند النفخة الاولي يوم لا يغني عنهم كيدهم شيءا في ,False,1091MuhammadMuhsinFaydKashani.TafsirSafi
188533,3,Tafsir03037-ara1.ms2908,وان يروا كسفا قطعة من السماء ساقطا عليهم لتعذيبهم يقولوا من فرط طغيانهم وعنادهم هذا سحاب مركوم اي تراكم بعضها علي بعض لمطرنا ولم يصدقوا انه ساقط عليهم لعذابهم يعني انهم بلغوا في الطغيان بحث لو اسقطناه عليهم حسبنا قالوا او تسقط السماء كما زعمت علينا كسفا الاسراء لعاندوا وقالوا سحاب مركوم فذرهم حتي يلاقوا يومهم الذي فيه يصعقون وهو اليوم الذي صعقوا فيه بالتقل يوم بدر لا عند النفخة الاولي كما قيل اذ لا يصعق بها الا من كان حيا حينءذ وقرا عاصم والشامي بضم الياء يقال صعقه فصعق او من اصعقه يوم لا يغني عنهم كيدهم شيءا ,False,1124IbnMuhammadIbnCajibaFasiSufi.BahrMadid
188535,2,JK000458-ara1.ms3153,لهم اله ام لهم اله غير الله يعينهم ويحرسهم من عذابه سبحان الله عما يشركون اي عن اشراكهم او عن شركة ما يشركونه الطور وان يروا كسفا وان يروا كسفا قطعة من السماء ساقطا لتعذيبهم يقولوا من فرط طغيانهم وعنادهم سحاب مركوم اي هم في الطغيان بحيث لو اسقطناه عليهم حسبما قالوا او تسقط السماء كما زعمت علينا كسفا لقالوا هذا سحاب تراكم بعضه علي بعض يمطرنا ولم يصدقوا انه كسف ساقطا للعذاب الطور فذرهم حتي يلاقوا فذرهم حتي يلاقوا وقرء حتي يلقوا يومهم الذي فيه يصعقون ,False,0982IbnMuhammadAbuSucud.IrshadCaqlSalim
188535,2,Shia002382Vols-ara1.ms2301,يوم بدر ام لهم اله غير الله يعينهم ويحرسهم من عذابه سبحن الله عما يشركون عن اشراكهم او شركة ما يشركونه به وان يروا كسفا قطعة من السماء ساقطا يقولوا من فرط طغيانهم وعنادهم سحاب مركوم هذا سحاب تراكم بعضها علي بعض وهو جواب قولهم فاسقط علينا كسفا من السماء فذرهم حتي يلقوا يومهم الذي فيه يصعقون ,False,1091MuhammadMuhsinFaydKashani.TafsirSafi
196849,2,Shamela0035100-ara1.mARkdown.ms06748,سمع من ابي طاهر بن محمش الزيادي وابي القاسم بن حبيب وابي الحسن السقاء وجماعة روي عنه محيي السنة البغوي وابو المظفر عبد المنعم القشيري ووجيه الشحامي وعبد الوهاب بن شاه وذكره عبد الغافر الفارسي ,False,0748Dhahabi.TarikhIslam
196849,2,JK000914-ara1.mARkdown.ms0952,سمع من ابي طاهر الزيادي وابي القاسم بن حبيب وابي الحسن السقا وجماعة روي عنه محيي السنة البغوي وابو المظفر عبد المنعم القشيري ووجيه الشحامي وغيرهم قال عبد الغافر الفارسي ,False,0771Subki.TabaqatShaficiyyaKubra
199272,17,Shamela0009783BK1-ara1.mARkdown.ms1597,سنه ثمان عشره قال وكان في ذلك العام طاعون عمواس كتب الي السري يقول حدثنا شعيب عن سيف عن الربيع وابي المجالد وابي عثمان وابي حارثة قالوا وكتب ابو عبيدة الي عمر ان نفرا من المسلمين اصابوا الشراب منهم ضرار وابو جندل فسالناهم فتاولوا وقالوا خيرنا فاخترنا قال فهل انتم منتهون ولم يعزم علينا فكتب اليه عمر فذلك بيننا وبينهم فهل انتم منتهون يعني فانتهوا وجمع الناس فاجتمعوا علي ان يضربوا فيها ثمانين جلده ويضمنوا الفسق من تاول عليها بمثل هذا فان ابي قتل فكتب عمر الي ابي عبيدة ان ادعهم فان زعموا انها حلال فاقتلهم وان زعموا انها حرام فاجلدهم ثمانين فبعث اليهم فسالهم علي رءوس الناس فقالوا حرام فجلدهم ثمانين ثمانين وحد القوم وندموا علي لجاجتهم وقال ليحدثن فيكم يا اهل الشام حادث فحدثت الرمادة كتب الي السري عن شعيب عن سيف عن عبد الله بن شبرمة عن الشعبي بمثله كتب الي ,False,0310Tabari.Tarikh
199272,17,JK000916-ara1.mARkdown.ms09339,كتاب عمر بن الخطاب وقد توفي ضرار بن الازور فقال يعني خالد بن الوليد ما كان الله ليخزي ضرار بن الازور اخبرنا ابو القاسم بن السمرقندي انا ابو الحسين بن النقور انا ابو طاهر المخلص انا احمد بن عبد الله بن سيف نا السري بن يحيي نا شعيب بن ابراهيم نا سيف بن عمر عن الربيع وابي المجالد وابي عثمان وابي حارثة قالوا كتب ابو عبيدة الي عمر ان نفرا من المسلمين اصابوا الشراب منهم ضرار وابو جندل فسالناهم فتاولوا وقالوا خيرنا فاخترنا قال فهل انتم منتهون ولم يعزم فكتب اليه عمر فذلك بيننا وبينهم فهل انتم منتهون يعني فانتهوا وجمع الناس فاجتمعوا علي ان يضربوا فيها ثمانين جلدة وتضمنوا النفس ومن تاول عليها مثل هذا فان ابي قتل وقالوا من تاول علي ما فسر رسول الله صلي الله عليه وسلم منه بالفعل والقتل فكتب عمرالي ابي عبيدة ان ادعهم فان زعموا انها حلال فاقتلهم وان زعموا انها حرام فاجلدهم ثمانين فبعث اليهم فسالهم علي رءوس الاشهاد فقالوا حرام فجلدهم ثمانين ثمانين وحد القوم وندموا علي لجاجتهم وقال ليحدثن فيكم يا اهل الشام حادث فحدثت الرمادة قال ونا سيف عن محمد بن عبيد الله عن الحكم بن عتيبة قال فلما كتب ابو عبيدة في ابي جندل وضرار بن الازور جمع عمر الناس فاستشارهم في ذلك الحدث فاجمعوا ا يحدوا في شرب الخمر والسكر من الاشربة حد القاذف وان مات في حد من هذا الحد فعلي بيت المال ديته لانه شء راوه هم قال ونا سيف عن عبد الله بن شبرمة عن الشعبي بمثله اخبرنا ابو علي ,False,0571IbnCasakir.TarikhDimashq
199272,17,Shamela0012406-ara1.mARkdown.ms1001,الرمادة ان نفرا من المسلمين اصابوا الشراب فكتب ابو عبيدة الي عمر كتابا وذكر فيه انا سالناهم فتاولوا وقالوا خيرنا فاخترنا قال فهل انتم منتهون فكتب اليه عمر رضي الله عنه ان المراد فانتهوا فادعهم فان زعموا انها حلال فاقتلهم وان زعموا انها حرام فاجلدهم ثمانين جلدة فسالهم فقالوا حرام فجلدهم ثمانين ثمانين فندموا علي لجاجتهم وقال ليحدثن فيكم يا اهل الشام حادث فحدثت الرمادة في هذه ,False,0597IbnJawzi.Muntazam
199272,17,JK000911-ara1.mARkdown.ms0803,كتاب ابي عبيدة علي عمر يذكر فيه ان نفرا من المسلمين اصابوا الشراب منهم ضرار وابو جندل فسالناهم فتاولوا وقالوا خيرنا فاخترنا قال فهل انتم منتهون ولم يعزم علينا فكتب اليه عمر انما معناه فانتهوا وقال له ادعهم علي رءوس الناس وسلهم احلال الخمر ام حرام فان قالوا حرام فاجلدهم ثمانين ثمانين وان قالوا حلال فاضرب اعناقهم فسالهم فقالوا بل حرام فجلدهم وندموا علي لجاجتهم وقال ليحدثن فيكم يا ,False,0630IbnAthirCizzDin.Kamil
199272,17,Shamela0003118-ara1.completed.ms3031,كتاب عمر بن الخطاب وقد توفي فقال ما كان الله ليخزي ضرار بن الازور كتب ابو عبيدة الي عمر ان نفرا من المسلمين اصابوا الشراب منهم ضرار وابو جندل فسالناهم فتاولوا وقالوا خيرنا فاخترنا قال فهل انتم منتهون ولم يعزم فكتب اليه عمر فذلك بيننا وبينهم فهل انتم منتهون يعني فانتهوا وجمع الناس فاجتمعوا علي ان يضربوا فيها ثمانين جلدة ويضمنوا النفس ومن تاول عليها بمثل هذا فان ابي قتل وقالوا من تاول علي ما فسر رسول الله صلي الله عليه وسلم منه بالفعل والقتل فكتب عمر الي ابي عبيدة ان ادعهم فان زعموا انها حلال فاقتلهم وان زعموا انها حرام فاجلدهم ثمانين فبعث اليهم فسالهم علي رءوس الاشهاد فقالو حرام فجلدهم ثمانين ثمانين وحد القوم وندموا علي لجاجتهم وقال ليحدثن فيكم يا اهل الشام حادث فحدثت الرمادة قال الحكم بن عتيبة لما كتب ابو عبيدة في ابي جندل وضرار بن الازور جمع عمر الناس فاستشارهم في ذلك الحدث فاجمعوا ان يحدوا في شرب الخمر والسكر من الاشربة حد القاذف وان مات في حد من هذا الحد فعلي بيت المال ديته لانه شء راوه هم ,False,0711IbnManzurIfriqi.MukhtasarTarikhDimashq
199272,17,Sham19Y0020587-ara1.ms533,ابو عبيدة الي عمر رضي الله عنهما فامره ان يقيم الحد عليهم فحدهم الا عبد بن الازور فانه استشهد في قتال الروم وقد اشار الحافظ في الاصابة في ترجمة ضرار وقال ويقال انه ممن شرب الخمر مع ابي جندب كذا في المطبوع والمعروف انه ابو جندل ولعلها تصحفت في المطبوع فكتب فيهم ابو عبيدة بن الجراح الي عمر فكتب اليه ادعهم فساءلهم فان قالوا انها حلال فاقتلهم وان زعموا انها حرام فاجلدهم ففعل فقالوا انها حرام فجلدهم ,False,0728IbnTaymiyya.Iman
199272,17,Shamela0004445-ara1.completed.ms3266,سيف بن عمر عن ابي المجالد والربيع وابي عثمان وابي حارثة وعن عبد الله بن شبرمة عن الشعبي قالوا كتب ابو عبيدة الي عمر بن الخطاب ان نفرا من المسلمين اصابوا الشراب منهم ضرار وابو جندل بن سهيل فسالناهم فقالوا خيرنا فاخترنا قال فهل انتم منتهون الماءدة ولم يعزم علينا فجمع عمر الناس فاجمعوا علي خلافهم وان المعني في قوله فهل انتم منتهون الماءدة اي انتهوا واجمعوا علي جلدهم ثمانين ثمانين وان من تاول هذا التاويل واصر عليه يقتل فكتب عمر الي ابي عبيدة ان ادعهم فسلهم عن الخمر فان قالوا هي حلال فاقتلهم وان قالوا هي حرام فاجلدهم ,False,0774IbnKathir.Bidaya
199272,17,JK000533-ara1.mARkdown.ms1227,ويقال انه ممن شرب الخمر مع ابي جندب فكتب فيهم ابو عبيدة بن الجراح الي عمر فكتب اليه ادعهم فساءلهم فان قالوا انها حلال فاقتلهم وان زعموا انها حرام فاجلدهم ففعل فقالوا انها حرام ,False,0852IbnHajarCasqalani.IsabaFiTamyiz
199272,17,Sham19Y0127677-ara1.ms03397,الله عليه وسلم يزجر بالفعل والقتل فكتب عمر الي ابي عبيدة ان ادعهم فان زعموا انها حلال فاقتلهم فان زعموا انها حرام فاجلدوهم ثمانين فبعث اليهم فسالهم علي رءوس الاشهاد فقالوا حرام فجلدهم ثمانين حد القوم وندموا علي لجاجتهم وقال ليحدثن فيكم يا اهل الشام حادث فحدثت الرمادة كر عن الحكم بن عيينة والشعبي قالا لما كتب ابو عبيدة في ابي جندل وضرار بن ,False,0911Suyuti.JamicKabir
199272,17,Sham19Y0127677-ara1.ms03396,عن سيف بن عمر عن الربيع وابي المجالد وابي عثمان وابي حارثة قالوا كتب ابو عبيدة الي عمر ان نفرا من المسلمين اصابوا الشراب منهم ضرار وابو جندل فسالناهم فتاولوا وقالوا خيرنا فاخترنا قال فهل انتم منتهون ولم يعزم فكتب اليه عمر فذلك بيننا وبينهم فهل انتم منتهون يعني فانتهوا وجمع الناس فاجتمعوا علي ان يضربوا فيها ثمانين جلدة ويضمنوا النفس ومن تاول عليها بمثل هذا فان ابي قتل وقالوا من تاول علي ما فسر رسول الله صلي ,False,0911Suyuti.JamicKabir
