cluster,size,id,text,from_input,book
455266536066,2,Shamela0010906-ara1.mARkdown.ms7028,الخلفاء ثم ناءب الوزارة مءيد الدين القمي وعضد الدولة ابن الضحاك استاذ الدار وقاضي القضاة محيي الدين ابن فضلان ونقيب الاشراف القوام الموسوي وجلس يوم الفطر للبيعة بثياب بيض بطرحة وعلي كتفه البرد النبوي ولفظ البيعة ابايع مولانا الامام المفترض الطاعة ابا نصر محمدا الظاهر بامر الله علي كتاب الله وسنة نبيه واجتهاد امير المءمنين ,False,0748Dhahabi.SiyarAclamNubala
455266536066,2,Shamela0035100-ara1.mARkdown.ms09384,الخلفاء ثم مءيد الدين محمد بن محمد القمي ناءب الوزارة وعضد الدولة ابو نصر ابن الضحاك استاذ الدار وقاضي القضاة محيي الدين بن فضلان الشافعي والنقيب الطاهر قوام الدين الحسن بن معد الموسوي ثم بويع يوم عيد الفطر البيعة العامة وجلس بثياب بيض وعليه الطرحة وعلي كتفه بردة النبي صلي الله عليه وسلم في شباك القبة التي بالتاج فكان الوزير قاءما بين يدي الشباك علي منبر واستاذ الدار دونه بمرقاة وهو الذي ياخذ البيعة علي الناس ولفظ المبايعة ابايع سيدنا ومولانا الامام المفترض الطاعة علي جميع الانام ابا نصر محمدا الظاهر بامر الله علي كتاب الله وسنة نبيه واجتهاد امير المءمنين ,False,0748Dhahabi.TarikhIslam
455266579291,2,Shamela0006667-ara1.mARkdown.ms2147,هذا مع تواتر الفتن واستمرارها بالشام ومصر وتكرار سمره الي البلاد الشامية مما من سفرة اليها الا وينفق فيها خارجا عما عنده من الخيول والسلاح وغير ذلك زيادة علي الف الف دينار يجبيها من دماء اهل مصر ومهجهم ثم يقدم الي الشام فيخرب الديار ويستاصل فخربت الاسكندرية وبلاد البحيرة واكثر الشرقية ومعظم الغربية والجيزية وتدمرت بلاد الفيوم وعم الخراب بلاد الصعيد بحيث بطل منها زيادة علي اربعين خطة كانت تقام في يوم الجمعة ودثر ثغر اسوان وكان من اعظم ثغور المسلمين فلم يبق به امير ولا كبير لا سوق ولا بيت وتلاشت مداءن الصعيد كلها وخرب من القاهرة وظواهرها زيادة علي نصف املاكها ومات من اهل اقليم مصر بالجوع والوباء نحو ثلثي الناس وقتل في الفتن بمصر مدة ايامه خلاءق لا تدخل تحت حصر مع تجاهره بالفسوق من شرب الخمر واتيان الفواحش والتجرء العظيم علي الله جلت قدرته والتلفظ من الاستخفاف بالله تعالي ورسله ما لا تكاد الالسنة تنطق بحكايته لقبيح شناعته ومن العجيب انه لما ولد كان قد اقبل الامير يلبغا الناصري بعساكر الشام لينزع اباه الملك الظاهر من الملك وهو في غاية الاضطراب من ذلك فعندما بشر به قيل له ما نسميه فقال بلغاق يعني فتنة وهي كلمة تركية فقبض علي ابيه وسجن بالكرك كما تقدم ذكره وهو لم يسم فلما عاد برقوق الي الملك عرض عليه فسماه فرج فما كان في الحقيقة الا فتنة اقامه الله سبحانه نقمة علي الناس لذيقهم بعض الذي عملوا ومن عجيب الاتفاق ان حرف اسمه فرج وعددها ثلاثة وثلاثون وماءتان وهي ,True,0845Maqrizi.Suluk
455266579291,2,JK001330-ara1.mARkdown.ms2751,هذه مع تواتر الفتن واستمرارها بالشام ومصر وتكرار سفره الي البلاد الشامية فما من سفرة سافر اليها الا وينفق فيها اموالا عظيمة زيادة علي الف الف دينار يجبيها من دماء اهل مصر ومهجهم ثم يتقدم الي الشام فيخرب الديار ويستاصل الاموال ويدمر القري ثم يعود وقد تاكدت اسباب الفتنة وعادت اعظم ما كانت فخربت الاسكندرية وبلاد البحيرة واكثر الشرقية ومعظم الغربية وتدمرت بلاد الفيوم وعم الخراب بلاد الصعيد بحيث بطل منها زيادة علي اربعين خطبة ودثر ثغر اسوان وكان من اعظم ثغور المسلمين وخرب من القاهرة واملاكها وظواهرها زيادة عن نصفها ومات من اهل مصر في الغلاء والوباء نحو ثلثي الناس وقتل في الفتن بمصر مدة ايامه خلاءق لا تدخل تحت حصر مع مجاهرته بالفسوق من شرب الخمر واتيان الفواحش والتجرء العظيم علي الله جلت قدرته ومن العجيب انه لما ولد كان قد اقبل يلبغا الناصري بعساكر الشام لينزع اباه الملك الظاهر برقوق من الملك وهو في غاية الاضطراب من ذلك فعند ما بشر به قيل له ما تسميه قال بلغاق يعني فتنة وهي كلمة تركية فقبض علي ابيه الملك الظاهر وسجن بالكرك كما تقدم ذكره فلما عاد الي الملك عرض عليه فسماه فرجا ولم يسمه احد لذلك اليوم الا بلغاق وهو في الحقيقة ما كان الا فتنة اقامه الله سبحانه وتعالي نقمة علي الناس ليذيقهم بعض الذي عملوا ومن عجيب الاتفاق ان حروف اسمه ف ر ج عددها ثلاثة وثمانون وماءتين وهي ,True,0874IbnTaghribirdi.NujumZahira
455266600360,2,Shamela0012406-ara1.mARkdown.ms3336,عاشوراء مثل ما عمل في السنة الماضية من تعطيل الاسواق واقامة النوح فلما اضحي النهار يومءذ وقعت فتنة عظيمة في قطيعة ام جعفر وطريق مقابر قريش بين السنة والشيعة ونهب الناس بعضهم بعضا ووقعت بينهم جراحات وورد الخبر بنزول جيش ضخم من الروم علي المصيصة وفيه الدمستق واقام عليها سبعة ايام ونقب في سورها نيفا وستين نقبا ولم يصل ودافعه اهلها وانصرف اذ قصرت به الميرة بعد ان اقام ببلاد الاسلام خمسة عشر يوما واحرق الدمستق المصيصة واذنة وطرطوس وذلك لمعاونتهم اهل مصيصة علي الروم فظفر بهم الروم فقتلوا منهم نحو خمسة الاف رجل وقتل اهل اذنة واهل طرسوس من الروم عددا كثيرا وقال الدمستق قبل انصرافه عن المصيصة يا اهل المصيصة اني منصرف عنكم لا لعجز عن فتح مدينتكم ولكن لضيق العلوفة وانا عاءد اليكم بعد هذا الوقت فمن اراد منكم الهرب فليهرب قبل رجوعي فمن وجدته قتلته وورد الخبر في ربيع الاول ان الغلاء بانطاكية وساءر الثغور اشتد حتي لم يقدر علي الخبز وانتقل من الثغور الي دمشق وغيرها خمسون الفا هربا من الغلاء وفي جمادي الاولي ورد الخبر بان الهجريين انفذوا سرية الي طبرية واستمدوا من سيف الدولة حديدا فقلع ابواب الرقة وكانت من حديد واخذ كل حديد وجد حتي اخذ صنجات الباعة والبقالين ,True,0597IbnJawzi.Muntazam
455266600360,2,SHAM19Y23644-ara1.ms6091,عاشوراء فعل ببغداد ما فعل عام اول من تعطيل الاسواق والنوح وغيره فلما كان وقت الضحي وقعت فتنة عظيمة في قطيعة ام جعفر قريبا من مقابر قريش بين السنة والشيعة وجرت بينهم جراحات ونهب الناس بعضهم بعضا وفيها قدم رجل علوي من خراسان ثم الي ارمينية ثم الي ميافارقين واجتمع بنجا غلام سيف الدولة فاوقعا بابي الورد وهو من العرب وكان بيده بعض بلدان ارمينية فقتل في الوقعة وقيل قتله نجا ولم يحضر العلوي واخذ نجا خلاط وقلاعها من يد ابي الورد وسار العلوي الي حران ثم الي حلب فلما اجتمع بسيف الدولة خرج معه الي المصيصة وفيها نزل الدمستق علي المصيصة مع جيش ضخم واقام عليها سبعة ايام ونقب سورها نيفا وستين نقبا وقاتله اهلها ودفعوه عنها وضاق به الامر وعدم الميرة وغلا السعر فرحل عنها بعد ان اقام في بلاد المسلمين خمسة عشرة يوما واحرق رستاق المصيصة واذنة وطرسوس وخرج سيف الدولة والخراساني الي المصيصة فوجد الدمستق قد انصرف وتفرقت جموع الخراساني من شدة الغلاء في السواحل وحلب والشام ورجعوا الي بغداد ثم مضوا الي خراسان وقيل لما انصرف الدمستق عن المصيصة بعث الي اهلها وقال اني منصرف عنكم لا لعجز عن فتح بلدكم ولكن لضيق العلوفة وانا عاءد اليكم بعد هذا الوقت فمن اراد منكم الانتقال الي بلد اخر قبل رجوعي فلينتقل فمن وجدته بعد عودي قتلته وتفاقم الغلاء بالشام والثغور حتي فقد الناس القوت وفيها كتب القرامطة الي سيف الدولة يستهدونه حديدا فقلع ابواب الرقة وهي من حديد وسدها واخذ كل حديد وجد بديار مضر حتي انتهي الي اخذ موازين الباعة والبقالين ,True,0654SibtIbnJawzi.MiratZaman
455266608862,2,Shamela0009783BK1-ara1.mARkdown.ms0556,ملك يزدجرد ثماني عشرة سنة واربعة اشهر في قول بعضهم وفي قول اخرين سبع عشره سنه ذكر ملك فيروز بن يزدجرد ثم ملك فيروز بن يزدجرد بن بهرام جور ,False,0310Tabari.Tarikh
455266608862,2,Shamela0006624-ara1.ms048,ملك ابنه يزدجرد بن بهرام جور ثماني عشرة سنة واربعة اشهر وقمع الاعداء وعمر البلاد ثم هلك لمضي سبعة اشهر من سنة تسع وخمسين وسبعماءة وخلف ابنين هرمز وفيروز فتملك هرمز سبع سنين وظلم واحتجب وهرب اخوه فيروز منه الي الهياطلة وراء خراسان وهي طخارستان واستعان بملكهم علي اخيه هرمز فانجده واقتتلا في الري فظفر فيروز باخيه هرمز فسجنه وامهما واحدة فانقضاء ملك هرمز في سنة ست وستين وسبعماءة للاسكندر ثم ملك فيروز بن يزدجرد بن بهرام جور ,False,0749ZaynDinIbnWardi.Tarikh
455266638019,3,Shamela0009783BK1-ara1.mARkdown.ms1596,ابي العاص الثقفي ولواء فسا ودارابجرد الي سارية بن زنيم الكناني ولواء كرمان مع سهيل بن عدي ولواء سجستان الي عاصم ابن عمرو وكان عاصم من الصحابة ولواء مكران الي الحكم بن عمير التغلبي فخرجوا في سنه سبع عشره فعسكروا ليخرجوا الي هذه الكور فلم يستتب مسيرهم حتي دخلت سنه ثمان عشره وامدهم عمر باهل الكوفة فامد سهيل بن عدي بعبد الله بن عبد الله بن عتبان وامد الاحنف بعلقمه ابن النضر وبعبد الله بن ابي عقيل وبربعي بن عامر وبابن ام غزال وامد عاصم بن عمرو بعبد الله بن عمير الاشجعي وامد الحكم بن عمير بشهاب بن المخارق المازني قال بعضهم كان فتح السوس ورامهرمز وتوجيه الهرمزان الي عمر من تستر في سنه عشرين اخبار متفرقة وحج بالناس في هذه السنة اعني سنة سبع عشرة عمر بن الخطاب وكان عامله علي مكة عتاب بن اسيد وعلي اليمن يعلي بن امية وعلي اليمامة والبحرين عثمان بن ابي العاص وعلي عمان حذيفة بن محصن وعلي الشام من قد ذكرت اسماءهم قبل وعلي الكوفة وارضها سعد بن ابي وقاص وعلي قضاءها ابو قرة وعلي البصرة وارضها ابو موسي ,False,0310Tabari.Tarikh
455266638019,3,Kraken210528100217-ara1.ms044,ابي العاص الثقفي ولواء فسا ودارا بجرد الي سارية بن زنيم الكناني ولواء كرمان الي سهيل بن عدي ولواء سجستان الي عاصم بن عمرو وكان من الصحابة ولواء مكران الي الحكم بن عمير التغلبي فخرجوا ولم يتهيا مسيرهم الي سنة ثماني عشرة وامدهم عسر بنفر من اهل الكرفة فامد سهيل بن عدي بعبد الله بن عتبان وامد الاحنف بعلقمة بن النضر وبعبد الله بن ابي عقيل وبربعي بن عامر وامد عاصم بن عمرو بعبد الله بن عسير الاشجمي وامد الحكم بن عمير بشهاب بن المخارق في خمو وفيها حمي عمر الربدة لخيل المسلمين وفيها اتخذ عمر دار الدقيق فجعل فيها الدفيق والسويق والتمر والزيت وما يحتاج اليه المنقطع والضيف الذين ينزلون بعمر ووضع عمر في طريق السبيل ما بين مكة والمدينة ما يصلح لمن ينقطع به ويحمل من ماء الي ماء وكان علي مكة هذه السنة عناب بن اسيد في قول وعلي اليمن يعلي بن منية وعلي اليمامة والبحرين عثسان بن ابي العاص وعلي عمان حذيفة بن محصن وعلي الشام من ينظر الكامل ينظر الكامل ينظر المنتظم سته عشرين ذكر قبل وعلي الكوفة وارضها سعد بن ابي وقاص وعلي قضاءها ابو ,False,0334Azdi.TarikhMawsil
455266638019,3,JK000911-ara1.mARkdown.ms0803,ابي العاص الثقفي ولواء فسا ودارا بجرد الي سارية بن زنيم الكناني ولواء كرمان الي سهيل بن عدي ولواء سجستان الي عاصم بن عمرو وكان من الصحابة ولواء مكران الي الحكم بن عمير التغلبي فخرجوا ولم يتهيا مسيرهم الا سنة ثمانية عشرة وامدهم عمر بنفر من اهل الكوفة فامد سهيل بن عدي بعبد الله بن عتبان وامد الاحنف بعلقمة بن النضر وبعبد الله بن ابي عقيل وبربعي بن عامر وبابن ام غزال وامد عاصم بن عمرو بعبد الله بن عمير الاشجعي وامد الحكم بن عمير بشهاب بن المخارق في جموع وقيل كان ذلك سنة احدي وعشرين وقيل سنة اثنتين وعشرين وسنذكر كيفية فتحها هناك وذكر اسبابها ان شاء الله تعالي وكان علي مكة هذه السنة عتاب بن اسيد في قول وعلي اليمن يعلي بن منية وعلي اليمامة والبحرين عثمان بن ابي العاص وعلي عمان حذيفة بن محصن وعلي الشام من ذكر قبل وعلي الكوفة وارضها سعد بن ابي وقاص وعلي قضاءها ابو قرة وعلي البصرة وارضها ابو موسي ,False,0630IbnAthirCizzDin.Kamil
455266647540,2,Sham19Y0014512-ara1.ms426,وفيها كان بالبلاد غلاء شديد واستسقي الناس فلم يسقوا وتبعه وباء عظيم وكان عاما في جميع البلاد بالعراق والموصل والشام وبلد الجبل وخراسان وغزنة والهند وغير ذلك وكثر الموت فدفن في اصبهان في عدة ايام اربعون الف ميت وكثر الجدري في الناس فاحصي بالموصل انه مات به اربعة الاف صبي ولم تخل دار من مصيبة لعموم المصاءب وكثرة الموت ,True,0458YahyaIbnSacidAntaki.Tarikh
455266647540,2,JK000911-ara1.mARkdown.ms3271,وفيها كان بالبلاد غلاء شديد واستسقي الناس فلم يسقوا وتبعه وباء عظيم وكان عاما في جميع البلاد بالعراق والموصل والشام وبلد الجبل وخراسان وغزنة والهند وغير ذلك وكثر الموت فدفن في اصبهان في عدة ايام اربعون الف ميت وكثر الجدري في الناس فاحصي بالموصل انه مات اربعة الاف صبي ولم تخل دار من مصيبة لعموم المصاءب وكثرة الموت ,True,0630IbnAthirCizzDin.Kamil
455266650863,4,Shia002088-ara1.ms010,محمد بن الحسين بن حميد بن الربيع الكوفي اللخمي روي عن جده وابي سعيد الاشج وهارون بن اسحاق والخضر بن ابنان وجماعة وعنه ابن المظفر وابن شاذان وابن شاهين واخرون قال ابو احمد الحاكم كان ابن عقدة سء الراي فيه وقال ابن عدي عن ابن عقدة كنت عند المطين فمر عليه الحسين بن حميد فقال هذا كذاب ابن كذاب وقال ابو يعلي الطوسي كان ثقة صاحب مذهب حسن وجماعة وامر بالمعروف ونهي عن المنكر وكان ممن يطلب للشهادة فيابي وسمعته يقول ولدت سنة اربعين وماءتين وقال ابن شاهين مات سنة ثمان عشرة وثلاث ماءة في غرة ذي القعدة وقال ابن حجر الظاهر ان جرح ابن عقدة لا يءثر فيه لما بينهما من المباينة في الاعتقاد محمد بن ابي داود بن سليمان ,False,0385IbnShahin.NasikhHadithWaMansukhuh
455266650863,4,Shamela0012317-ara1.completed.ms2240,الزيات وابو حفص بن شاهين وابو بكر بن شاذان البزاز وابو حفص عمر بن ابراهيم الكتاني وكان ابو العباس بن عقدة سء الراي فيه قال ابن عقدة كنت عند الحضرمي يعني مطينا فمر عليه ابن للحسين بن حميد الخزاز فقال هذا كذاب ابن كذاب قال ابن عدي الحافظ رايت انا ابن الحسين بن حميد هذا كان شيخا وراقا علي باب جامع الكوفة وقال ابو يعلي الطوسي بخلاف هذا فقال محمد بن الحسين بن حميد ابن الربيع كان ثقة يفهم قال ابو الحسن بن سفيان الحافظ سنة ثماني عشرة وثلاثماءة فيها مات ابو الطيب محمد بن الحسين بن حميد ابن الربيع اللخمي من انفسهم ببغداد وجء به فدفن بالكوفة وكان قد خرج في وقت دخول القرمطي الكوفة سنة خمس عشرة وثلاثماءة ولم يعد الي ان مات وكان ثقة صاحب مذهب حسن وجماعة وامر بمعروف ونهي عن منكر وكان ممن يطلب للشهادة فيابي ذلك وسمعته يقول ولدت سنة اربعين وماءتين ومات غرة ذي القعدة سنة ثماني عشرة وثلاثماءة ,False,0562Samcani.Ansab
455266650863,4,Shamela0012406-ara1.mARkdown.ms3179,محمد بن الحسين بن حميد بن الربيع بن مالك ابو الطيب اللخمي الكوفي ولد سنة اربعين وماءتين وسكن بغداد وحدث بها عن ابي سعيد الاشج وغيره روي عنه ابن المظفر وابن شاذان وابن شاهين والكتاني وكان ثقة يفهم وقد روي ابن عقدة عن الحضرمي انه قال هو كذاب وهذا ليس بصحيح اخبرنا عبد الرحمن بن محمد قال اخبرنا احمد بن علي بن ثابت قال حدثني الصوري قال اخبرنا ابو طاهر بن محمد بن الحسين المعدل حدثنا ابو الحسن بن سفيان الحافظ قال كان محمد بن الحسين اللخمي ثقة صاحب مذهب حسن وجماعة وامر بالمعروف ونهي عن المنكر وكان ممن يطلب للشهادة فيابي ذلك وتوفي في هذه السنة و قد قيل توفي سنة عشر وثلاثماءة محمد بن الحسين بن سعيد بن ابان ابو جعفر الهمذاني ويعرف بالطنان قدم بغداد وحدث بها عن احمد بن محمد بن رشدين المصري ,False,0597IbnJawzi.Muntazam
455266650863,4,Shamela0036357-ara1.mARkdown.ms1785,محمد بن الحسين بن حميد بن الربيع الكوفي اللخمي عن جده وابي سعيد الاشج وهارون بن اسحاق والخضر بن ابان وجماعة وعنه ابن المظفر وابن شاذان وابن شاهين والكتاني واخرون قال ابو احمد الحاكم كان ابن عقدة سء الراي فيه وقال ابن عدي عن ابن عقدة كنت عند المطين فمر عليه ابن للحسين بن حميد فقال هذا كذاب ابن كذاب وقال ابن عدي وقد رايت انا ابن الحسين كان شيخا وراقا علي باب الكوفة وقال ابو يعلي الطوسي كان ثقة يفهم وقال ابو الحسين بن سفيان الحافظ مات سنة ثمان عشرة وثلاث مءة وكان ثقة صاحب مذهب حسن وجماعة وامر بمعروف ونهي عن منكر وكان ممن يطلب للشهادة فيابي وسمعته يقول ولدت سنة اربعين ومءتين وقال ابن شاهين مات سنة ثمان عشرة في غرة ذي القعدة قلت الظاهر ان جرح ابن عقدة لا يءثر فيه لما بينهما من المباينة في الاعتقاد والله اعلم محمد بن الحسين بن سعيد بن ابان الهمذاني ابو جعفر الجهني المعروف بالصياد عن محمد بن الجهم السمري ,False,0852IbnHajarCasqalani.LisanMizan
455266699167,2,Shamela0000041-ara1.completed.ms2598,النبي صلي الله عليه وسلم فكانت صلاته قصدا وخطبته قصدا والخطبة فريضة في صلاة الجمعة ويجب ان يخطب قاءما خطبتين واقل ما يقع عليه اسم الخطبة ان يحمد الله ويصلي علي النبي صلي الله عليه وسلم ويوصي بتقوي الله هذه الثلاثة فرض في الخطبتين جميعا ويجب ان يقرا في الاولي اية من القران ويدعو للمءمنين في الثانية فلو ترك واحدة من هذه الخمس لا تصح جمعته عند الشافعي وذهب ابو حنيفة رضي الله عنه الي انه لو اتي بتسبيحة او تحميدة او تكبيرة اجزاه وهذا القدر لا يقع عليه اسم الخطبة وهو ,False,0510IbnMascudBaghawi.Tafsir
