cluster,size,id,text,from_input,book
34359777156,4,Shamela0010639-ara1.ms158,ويجوز البكاء قبل الموت وبعده ولكن قبله اولي للحديث الصحيح فاذا وجبت فلا تبكين باكية مالك رقم ابو داود رقم النساءي رقم ابن ماجه رقم وقد نص الشافعي رحمه الله والاصحاب علي انه يكره البكاء بعد الموت كراهة تنزيه ولا يحزم وتاولوا حديث فلا تبكين ,False,0676Nawawi.Adhkar
34359777156,4,Shamela0006848-ara1.ms136,ويجوز قبل الموت وبعده ولكن قبله اولي للحديث الصحيح فاذا وجبت فلا تبكين باكية وقد نص الشافعي والاصحاب انه يكره البكاء بعد الموت كراهة تنزيه ولا يحرم وتاولوا حديث فلا تبكين باكية ,False,0748Dhahabi.Kabair
34359801959,4,Shamela0012884-ara1.completed.ms5007,يوم الجمعة فاسعوا الي ذكر الي وذروا البيع واخرج عبد بن حميد عن محمد بن كعب ان رجلين من اصحاب النبي صلي الله عليه وسلم كانا يختلفان في تجارتهما الي الشام فربما قدما يوم الجمعة ورسول الله صلي الله عليه وسلم يخطب فيدعونه ويقومون ,False,0911Suyuti.DurrManthur
34359801959,4,Shamela0037458-ara1.ms4442,يوم الجمعة لم يحل الشراء والبيع عن محمد بن كعب ان رجلين من اصحاب النبي صلي الله عليه وسلم كانا يختلفان في تجارتهما الي الشام فربما قدما يوم الجمعة ورسول الله صلي الله عليه وسلم يخطب فيدعونه ويقومون فنزلت الاية وذروا البيع فحرم عليهم ما كان قبل ذلك ,False,1307Qannawji.FathBayan
34359801959,4,Shamela0023623-ara1.ms4180,فاسعوا الي ذكر الله قال فامضوا واخرج عبد ابن حميد عنه ان السعي العمل واخرج عبد بن حميد عن محمد بن كعب ان رجلين من اصحاب النبي صلي الله عليه وسلم كانا يختلفان في تجارتهما الي الشام فربما قدما يوم الجمعة ورسول الله صلي الله عليه وسلم يخطب فيدعونه ويقومون فنزلت الاية وذروا البيع فحرم عليهم ما كان قبل ذلك ,False,1250Shawkani.FathQadir
34359801959,4,ShamAY0034054-ara1.ms4030,فاسعوا الي ذكر الله قال فامضوا واخرج عبد بن حميد عنه ان السعي العمل واخرج عبد بن حميد عن محمد بن كعب ان رجلين من اصحاب النبي صلي الله عليه واله وسلم كانا يختلفان في تجارتهما الي الشام فربما قدما يوم الجمعة ورسول الله صلي الله عليه واله وسلم يخطب فيدعونه ويقومون فنزلت الاية وذروا البيع فحرم عليهم ما كان قبل ذلك ,False,1281IbnMuhammadShawkani.TafsirFathQadir
34359813419,4,Shamela0035100-ara1.mARkdown.ms06622,من الجنة وكتم امره فاخصب جسمه وسمن فقال له ابن العلاف ما لك قد سمنت واضاءت حالتك فتمثل من اطلعوه علي سر فباح به لم يامنوه علي الاسرار ما عاشا ثم اخذ يوري ولا يصرح فما زال به حتي اخبره بالكرامة فقال ينبغي ان تدعو للوزير ففهم القضية وانكسر قلبه ولم تطل مدته بعد ذلك الحسن بن محمد بن ذكوان ابو علي ,False,0748Dhahabi.TarikhIslam
34359813419,4,SHAM19Y23644-ara1.ms6750,من اطلعوه علي سر فباح به لم يامنوه علي الاسرار ما عاشا واخذ يوري ولم يصرح ويكني ولا يفصح فلم يزل به حتي اخبره وقال هذه كرامة لي يبعثها الله لي كل يوم من الجنة كذا وكذا قال من اين لك ذلك قال لان الباب مغلق والمفتاح معي فقال ينبغي ان تدعو للوزير ابن المسلمة ففهم وانكسر قلبه ,False,0654SibtIbnJawzi.MiratZaman
34359813419,4,JK001330-ara1.mARkdown.ms0965,من الجنة وسكت ولم يخبر احدا خوفا من ان ينقطع فاخصب جسمه وسمن فقال له ابن العلاف قد سمنت فايش تاكل فانشد الشرمقاني يقول من اطلعوه علي سر فباح به لم يامنوه علي الاسرار ما عاشا البسيط واخذ يوري ولم يصرح بما يقع له فقال هذا كرامة فقال له بعضهم ينبغي ان تدعو للوزير ففهم وانكسر قلبه وامتنع من اكل ذلك وتوفي بعد ذلك بمدة يسيرة وفيها توفي سعيد بن محمد بن ,False,0874IbnTaghribirdi.NujumZahira
34359813419,4,JK000443-ara1.mARkdown.ms175,من الجنة وكتم امره فاخصب جسمه وسمن فقال له ابن العلاف ما لك قد سمنت فتمثل بهذا الشعر من اطلعوه علي سر فباح به لم يامنوه علي الاسرار ما عاشا ثم اخذ يوري ولا يصرح فما زال به العلاف حتي اخبره بالكرامة فقال له ينبغي ان تدعو للوزير ابن المسلمة ففهم القضية وانكسر قلبه ولم تطل بعدها مدته توفي سنة احدي وخمسين واربع مءة الحسن بن علي بن عبد الله ابو علي ,False,0748Dhahabi.MacrifaQurraKibar
34359838026,4,Shamela0023578-ara1.completed.ms2113,لا تجاروا اليوم انكم منا لا تنصرون لا تمنعون ولا ينفعكم جزعكم وتضرعكم قد كانت اياتي تتلي عليكم يعني القران فكنتم علي اعقابكم ادباركم تنكصون تدبرون وتستاخرون وترجعون القهقري مكذبين بها كارهين لها مستكبرين به اي بالحرم تقولون لا يظهر علينا احد لانا اهل الحرم وهو كناية عن غير مذكور سامرا نصب علي الحال ,False,0427AbuIshaqThaclabi.KashfWaBayan
34359838026,4,Shamela0001394-ara1.ms1055,لا تجاروا اليوم انكم منا لا تنصرون لا تجاروا اليوم فان الجءار غير نافع لكم انكم منا لا تنصرون اي من جهتنا لا يلحقكم نصرا ومعونة قد كانت اياتي تتلي عليكم فكنتم علي اعقابكم تنكصون قد كانت اياتي تتلي عليكم اي القران فكنتم علي اعقابكم تنكصون ترجعون القهقري والنكوص ان يرجع القهقري وهو اقبح مشية لانه لا يري ما وراءه مستكبرين به سامرا تهجرون مستكبرين متكبرين علي المسلمين حال من تنكصون به بالبيت اوبالحرم لانهم يقولون لا يظهر علينا احد لانا اهل الحرم ,False,0710IbnAhmadHafizDinNasafi.Tafsir
34359838026,4,JK000462-ara1.ms398,عليكم يعني القران فكنتم علي اعقابكم علي ادباركم تنكصون ترجعون القهقري مكذبين به المءمنون مستكبرين به سامرا مستكبرين به اي بالحرم تقولون لا يظهر علينا احد لانا اهل الحرم ,False,0468IbnAhmadWahidiNaysaburi.WajizFiTafsir
34359838026,4,Sham19Y0014404-ara1.ms0984,لا تجاروا اليوم انكم منا لا تنصرون لا تجاروا اليوم لا تضجوا انكم منا لا تنصرون لا تمنعون المعني استغاثتكم لا تمنعكم من عذابنا قد كانت اياتي تتلي عليكم فكنتم علي اعقابكم تنكصون قد كانت اياتي تتلي عليكم فكنتم علي اعقابكم تنكصون ترجعون القهقري عن الايمان مستكبرين به سامرا تهجرون مستكبرين به متعظمين بالبيت الحرام كانوا يقولون لا يظهر علينا احد لانا اهل الحرم سامرا اي سمارا اي متحدثين ونصبه علي الحال ,False,0928MujirDinCulaymi.FathRahman
34359840969,4,JK000791-ara1.ms2346,اساطير الاولين ذكر القولين الفراء وقرا ابن مسعود ان كان بهمزة واحدة مقصورة ثم اوعده فقال تعالي القلم سنسمه علي الخرطوم سنسمه علي الخرطوم الخرطوم الانف وفي هذه السمة ثلاثة اقوال احدها سنسمه بالسيف فنجعل ذلك علامة علي انفه ما عاش فقاتل يوم بدر فخطم بالسيف قاله ابن عباس والثاني سنلحق به شيءا لا يفارقه قاله قتادة واختاره ابن قتيبة والثالث ان المعني سنسود وجهه قال الفراء والخرطوم وان كان قد خص بالسمة فانه في مذهب الوجه لان بعض الوجه يءدي عن البعض وقال الزجاج سنجعل له في الاخرة العلم الذي يعرف به اهل النار من اسوداد وجوههم وجاءز والله اعلم ان يفرد بسمة لمبالغته في عداوته لرسول الله صلي الله عليه وسلم يتبين بها عن غيره انا بلوناهم كما بلونا اصحاب الجنة اذ اقسموا ليصرمنها مصبحين ولا يستثنون فطاف عليها طاءف من ربك وهم ناءمون فاصبحت كالصريم فتنادوا مصبحين ان اغدوا علي ,False,0597IbnJawzi.ZadMasir
34359840969,4,Shamela0023623-ara1.ms4247,اذا تتلي عليه اياتنا قال اساطير الاولين مستانفة جارية مجري التعليل للنهي وقد تقدم معني اساطير الاولين في غير موضع سنسمه علي الخرطوم اي سنسمه بالكي علي خرطومه قال ابو عبيدة وابو زيد والمبرد الخرطوم الانف قال مقاتل سنسمه بالسواد علي الانف وذلك انه يسود وجهه قبل دخول النار قال الفراء والخرطوم وان كان قد خص بالسمة فانه في مذهب الوجه لان بعض الوجه يءدي عن بعض قال الزجاج سيجعل له في الاخرة العلم الذي يعرف به اهل النار من اسوداد وجوههم وقال قتادة سنلحق به شيءا لا يفارقه واختار هذا ابن قتيبة قال والعرب تقول قد وسمه ميسم سوء يريدون الصق به عارا لا يفارقه فالمعني ان الله الحق به عارا لا يفارقه كالوسم علي الخرطوم ,False,1250Shawkani.FathQadir
34359840969,4,ShamAY0034054-ara1.ms4094,اذا تتلي عليه اياتنا قال اساطير الاولين مستانفة جارية مجري التعليل للنهي وقد تقدم معني اساطير الاولين في غير موضع القلم سنسمه علي الخرطوم سنسمه علي الخرطوم اي سنسمه بالكي علي خرطومه قال ابو عبيدة وابو زيد والمبرد الخرطوم الانف قال مقاتل سنسمه بالسواد علي الانف وذلك انه يسود وجهه قبل دخول النار قال الفراء والخرطوم وان كان قد خص بالسمة فانه في مذهب الوجه لان بعض الوجه يءدي عن بعض قال الزجاج سيجعل له في الاخرة العلم الذي يعرف به اهل النار من اسوداد وجوههم وقال قتادة سنلحق به شيءا لا يفارقه واختار هذا ابن قتيبة قال والعرب تقول قد وسمه ميسم سوء يريدون الصق به عارا لا يفارقه فالمعني ان الله الحق به عارا لا يفارقه كالوسم علي الخرطوم ,False,1281IbnMuhammadShawkani.TafsirFathQadir
34359840969,4,Shamela0021821-ara1.ms1893,اذا تتلي عليه اياتنا قال اساطير الاولين القلم ثم اوعده فقال سنسمه علي الخرطوم القلم قال ابو عبيدة وابو زيد والمبرد الخرطوم الانف قال مقاتل سنسمه بالسواد علي الانف وذلك انه يسود وجهه قبل دخول النار وهو قول الاكثرين قال الفراء والخرطوم وان كان قد خص بالسمة فانه في مذهب الوجه لان بعض الوجه يءدي عن بعض وقال الزجاج سنجعل له في الاخرة العلم الذي يعرف به اهل النار من اسوداد وجوههم وقال قتادة سنلحق به شيءا لا يفارقه واختاره ابن قتيبة وقال العرب تقول قد وسمه ميسم سوء يريدون الصق به عارا لا يفارقه لان السمة لا ينمحي ولا يعفو اثرها وقد الحق الله بما ذكر من عيوبه عارا لا يفارقه كالوسم علي الخرطوم وابين ما يكون الوسم علي الوجه انا بلوناهم كما بلونا اصحاب الجنة اذ اقسموا ليصرمنها مصبحين ولا يستثنون فطاف عليها طاءف من ربك وهم ناءمون فاصبحت كالصريم فتنادوا مصبحين ان اغدوا علي ,False,0468IbnAhmadWahidiNaysaburi.WasitFiTafsir
34359856325,4,Shia001432Vols-ara1.msB26411,اذا اقبلت الدنيا علي المرء اعطته محاسن غيره و اذا اعرضت عنه سلبته محاسن نفسه ومر به عليه السلام رجل وهو يتغدي فلم يسلم فدعاه الي الطعام فقيل له السنة ان يسلم ثم يدعي وقد ترك السلام علي عمد فقال هذا فقه عراقي فيه بخل وقال عليه السلام القران ظاهره انيق وباطنه عميق وقال عليه السلام ,False,1111Majlisi.BiharAnwar
34359856325,4,Shia003707Vols-ara1.completed.ms0707,به رجل وهو يتغدي فلم يسلم فدعاه الي الطعام فقيل له السنة ان يسلم ثم يدعي وقد ترك السلام علي عمد فقال هذا فقه عراقي فيه بخل وقال ,False,0693IbnAbiFathIrbili.KashfGhumma
34359856325,4,Shamela0007853-ara1.completed.ms0144,اذا اقبلت الدنيا علي المرء اعطته محاسن غيره واذا ادبرت عنه سلبته محاسن نفسه ومر به رجل وهو يتغذي فلم يسلم فدعاه الي الطعام فقيل له السنة ان يسلم ثم يدعي وقد ترك السلام علي عمد فقال هذا فقه عراقي فيه بخل وقال القران ظاهره انيق وباطنه ,False,0421AbuSacdAbi.NathrDurr
34359856325,4,Shia001615Vols-ara1.ms1982,عليه السلام انه مر به رجل وهو يتغذي فلم يسلم فدعاه الي الطعام فقيل له السنة ان يسلم ثم يدعي وقد ترك السلام علي عمد فقال هذا فقه عراقي فيه بخل باب النهي عن تعجيل الرجل عن طعامه او حاجته الاربعماءة قال امير المءمنين عليه السلام ,False,1405CaliShahrudi.MustadrakSafinatBihar
34359871719,4,Shamela0009783BK1-ara1.mARkdown.ms3136,بن محمد ثم دخلت سنة خمس عشرة وماءة ذكر الاخبار عما كان فيها من الاحداث فمما كان فيها من ذلك غزوة معاوية بن هشام ارض الروم وفيها وقع الطاعون بالشام وحج بالناس في هذه السنة محمد بن هشام بن اسماعيل وهو امير مكة والطاءف كذلك قال ابو معشر فيما حدثني احمد بن ثابت عمن ذكره عن اسحاق بن عيسي عنه وكان عمال الامصار في هذه السنة عمالها في سنة اربع عشرة وماءة غير انه اختلف في عامل خراسان في هذه السنة فقال المداءني كان عاملها الجنيد بن عبد الرحمن وقال بعضهم كان عاملها عمارة بن حريم المري وزعم الذي قال ذلك ان الجنيد مات في هذه السنة واستخلف عمارة بن حريم واما المداءني فانه ذكر ان وفاه الجنيد كانت في سنه ست عشرة وماءة وفي هذه السنة اصاب الناس بخراسان قحط شديد ومجاعة فكتب الجنيد الي الكور ان مرو كانت امنة مطمءنة ياتيها رزقها رغدا من كل مكان فكفرت بانعم الله فاحملوا اليها الطعام قال علي بن محمد اعطي الجنيد في هذه السنة رجلا درهما فاشتري به رغيفا فقال لهم تشكون الجوع ورغيف بدرهم لقد رايتني بالهند وان الحبة من الحبوب لتباع عددا بالدرهم وقال ان مرو كما قال الله عز وجل وضرب الله مثلا قرية كانت امنة مطمءنة ثم دخلت سنة ست عشرة وماءة ذكر ما كان فيها من الاحداث فمن ذلك ما كان من غزوة معاوية بن هشام ارض الروم الصاءفة وفيها كان طاعون شديد بالعراق والشام وكان اشد ذلك فيما ذكر بواسط وفاة الجنيد بن عبد الرحمن وولاية عاصم بن عبد الله خراسان وفيها كانت وفاة الجنيد بن عبد الرحمن وولاية عاصم بن عبد الله بن يزيد الهلالي خراسان ذكر الخبر عن امرهما ذكر علي بن محمد عن اشياخه ان الجنيد بن عبد الرحمن تزوج الفاضلة بنت يزيد بن المهلب فغضب هشام علي الجنيد وولي عاصم بن عبد الله خراسان وكان الجنيد سقي بطنه فقال ,True,0310Tabari.Tarikh
34359871719,4,JK000911-ara1.mARkdown.ms1699,ثم دخلت سنة خمس عشرة وماءة في هذه السنة غزا معاوية بن هشام ارض الروم وفيها وقع الطاعون بالشام وفيها وقع بخراسان قحط شديد فكتب الجنيد الي الكور بحمل الطعام الي مرو فاعطي الجنيد رجلا درهما فاشتري به رغيفا فقال لهم اتشكون الجوع ورغيف بدرهم لقد رايتني بالهند وان الحفنة من الحبوب تباع عددا بدراهم قال وحج بالناس هذه السنة محمد بن هشام المخزومي وكان الامير بخراسان الجنيد وقيل بل كان قد مات الجنيد واستخلف عمارة بن حريم المري وقيل بل كان موت الجنيد سنة ست عشرة وماءة وفيها غزا عبد الملك بن قطن عامل الاندلس ارض البشكنس وعاد سالما ثم دخلت سنة ست عشرة وماءة في هذه السنة غزا معاوية بن عبد الملك ارض الروم الصاءفة وفيها كان طاعون شديد بالعراق والشام وكان اشد ذلك بواسط ذكر عزل الجنيد ووفاته وولاية عاصم خراسان وفيها عزل هشام بن عبد الملك الجنيد بن عبد الرحمن المري عن خراسان واستعمل عليها عاصم بن عبد الله بن يزيد الهلالي وسبب ذلك ان الجنيد تزوج الفاضلة بنت يزيد بن المهلب فغضب هشام فولي عاصما خراسان وكان الجنيد قد سقي بطنه فقال ,True,0630IbnAthirCizzDin.Kamil
34359871719,4,Sham19Y0145435-ara1.ms0731,بن محمد ثم دخلت سنة خمس عشرة ومءة ذكر الاخبار عما كان فيها من الاحداث فمما كان فيها من ذلك غزوة معاوية بن هشام ارض الروم وفيها وقع الطاعون بالشام وحج بالناس في هذه السنة محمد بن هشام بن اسماعيل وهو امير مكة والطاءف كذلك قال ابو معشر فيما حدثني احمد بن ثابت عمن ذكره عن اسحاق بن عيسي عنه وكان عمال الامصار في هذه السنة عمالها في سنة اربع عشرة ومءة غير انه اختلف في عامل خراسان في هذه السنة فقال المداءني كان عاملها الجنيد بن عبد الرحمن وقال بعضهم كان عاملها عمارة بن حريم المري وزعم الذي قال ذلك ان الجنيد مات في هذه السنة واستخلف عمارة بن حريم واما المداءني فانه ذكر ان وفاة الجنيد كانت في سنة ست عشرة ومءة ثم دخلت سنة ست عشرة ومءة ذكر ما كان فيها من الاحداث فمن ذلك ما كان من غزوة معاوية بن هشام ارض الروم الصاءفة وفيها كان طاعون شديد بالعراق والشام وكان اشد ذلك فيما ذكر بواسط وفاة الجنيد بن عبد الرحمن وولاية عاصم بن عبد الله خراسان وفيها كانت وفاة الجنيد بن عبد الرحمن وولاية عاصم بن عبد الله بن يزيد الهلالي خراسان ذكر ,True,1411MuhammadTahirBarnaji.SahihWaDacifTarikhTabari
34359871719,4,Sham19Y0145435-ara1.ms2976,ثم دخلت سنة خمس عشرة ومءة ذكر الاخبار عما كان فيها من الاحداث وفي هذه السنة اصاب الناس بخراسان قحط شديد ومجاعة فكتب الجنيد الي الكور ان مرو كانت امنة مطمءنة ياتيها رزقها رغدا من كل مكان فكفرت بانعم الله فاحملوا اليها الطعام قال علي بن محمد اعطي الجنيد في هذه السنة رجلا درهما فاشتري به رغيفا فقال لهم تشكون الجوع ورغيف بدرهم لقد رايتني بالهند وان الحبة من الحبوب لتباع عددا بالدرهم وقال ان مرو كما قال الله عز وجل وضرب الله مثلا قرية كانت امنة مطمءنة ثم دخلت سنة ست عشرة ومءة ذكر ما كان فيها من الاحداث ذكر علي بن محمد عن اشياخه ان الجنيد بن عبد الرحمن تزوج الفاضلة بنت يزيد بن المهلب فغضب هشام علي الجنيد وولي عاصم بن عبد الله خراسان وكان الجنيد سقي بطنه فقال ,True,1411MuhammadTahirBarnaji.SahihWaDacifTarikhTabari
34359871723,4,Shamela0009783BK1-ara1.mARkdown.ms3134,معاوية بن هشام ارض الروم فرابط من ناحية مرعش ثم رجع وفي هذه السنة صار من دعاة بني العباس جماعة الي خراسان فاخذ الجنيد بن عبد الرحمن رجلا منهم فقتله وقال من اصيب منهم فدمه هدر وحج بالناس في هذه السنة في قول ابي معشر سليمان بن هشام بن عبد الملك ,False,0310Tabari.Tarikh
34359871723,4,Shamela0012406-ara1.mARkdown.ms1747,معاوية بن هشام ارض الروم فرابط ثم رجع وفي هذه السنة صار جماعة من دعاة بني العباس الي خراسان فاخذ الجنيد رجلا منهم فقتله وقال من اصيب منهم فدمه هدر وفي هذه السنة حج بالناس سليمان بن هشام بن عبد الملك وقيل بل ابراهيم بن هشام المخزومي واما عمال البلاد فالذين كانوا في السنة التي قبل هذه ذكر من توفي في هذه السنة من الاكابر عبد الله بن عبيد بن عمير كان عالما فصيحا صالحا توفي بمكة في هذه السنة اخبرنا محمد بن ابي القاسم قال حدثنا حمد بن احمد قال حدثنا ابو نعيم قال حدثنا احمد بن جعفر الغساني قال حدثنا محمد بن جرير قال حدثنا محمد بن حميد قال حدثنا زافر بن سليمان عن الوصافي عن عبد الله بن عبيد بن عمير قال لا ينبغي لمن اخذ بالتقوي وزن الورع ان يذل لصاحب الدنيا ثم دخلت سنة اربع عشرة وماءة ,False,0597IbnJawzi.Muntazam
34359871723,4,JK000911-ara1.mARkdown.ms1696,معاوية بن هشام ارض الروم فرابط من ناحية مرعش ثم رجع وفي هذه السنة سار جماعة من دعاة بني العباس الي خراسان فاخذ الجنيد رجلا منهم فقتله وقال من اصبت منهم فدمه هدر وحج بالناس هذه السنة سليمان ين هشام بن عبد الملك وقيل ابراهيم بن هشام بن اسماعيل الخزومي وكان العمال من تقدم ذكرهم ثم دخلت سنة اربع عشرة وماءة ,False,0630IbnAthirCizzDin.Kamil
