cluster,size,id,text,from_input,book
17179916155,4,Shamela0012398-ara1.completed.ms1236,قال كنت اقتات الخرنوب والشوك وقامة البقل وورق الخس من جانب النهر والشط وبلغت بي الضاءقة في غلاء نزل ببغداد الي ان بقيت اياما لم اكل فيها طعاما بل كنت اتتبع المنبوذات اطعمها فخرجت يوما من شدة الجوع الي الشط لعلي اجد ورق الخس او البقل او غير ذلك فاتقوت به فما ذهبت الي موضع الا وغيري قد سبقني اليه واذا وجدت الفقراء يتزاحمون عليه فاتركه حياء فرجعت امشي وسط البلد فلا ادرك منبوذا الا وقد سبقت اليه حتي وصلت الي مسجد بسوق الريحانيين ببغداد وقد اجهدني الضعف وعجزت عن التماسك فدخلت اليه وقعدت في جانب منه وقد كدت اصافح الموت اذ دخل شاب اعجمي ومعه خبز رصافي وشواء وجلس ياكل فكنت اكاد كلما رفع يده باللقمة ان افتح في من شدة الجوع حتي انكرت ذلك علي نفسي وقلت ما هذا اذ التفت الي العجمي فراني فقال باسم الله يا اخي فابيت فاقسم علي ,True,1089IbnCimad.Shadharat
17179916155,4,Shamela0031366-ara1.mARkdown.ms235,قال وكنت اقتات بخرنوب الشوك وقمامة البقل وورق الخس من جانب النهر والشط وبلغت الضاءقة في غلاء نزل ببغداد الي ان بقيت اياما لم اكل فيها طعاما بل كنت اتتبع المنبوذات اطعمها فخرجت يوما من شدة الجوع الي الشط لعلي اجد ورق الخس او البقل او غير ذلك فاتقوت به فما ذهبت الي موضع الا وغيري قد سبقني اليه وان وجدت اجد الفقراء يتزاحمون عليه فاتركه حبا فرجعت امشي وسط البلد ادرك منبوذا الا وقد سبقت اليه حتي وصلت الي مسجد ياسين بسوق الريحانيين ببغداد وقد اجهدني الضعف وعجزت عن التماسك فدخلت اليه وقعدت في جانب منه وقد كدت اصافح الموت اذ دخل شاب اعجمي ومعه خبز صافي وشواء وجلس ياكل فكنت اكاد كلما رفع يده باللقحة ان افتح فمي من شدة الجوع حتي انكرت ذلك علي نفسي فقلت ما هذا وقلت ما ههنا الا الله او ما قضاه من الموت اذ التفت الي ,True,0795IbnRajabHanbali.DhaylTabaqatHanabila
17179916157,4,Shamela0035100-ara1.mARkdown.ms08198,الي ان بقيت اياما لا اكل فيها طعاما بل اتبع المنبوذات فخرجت يوما الي الشط لعلي اجد ورق الخس والبقل فما ذهبت الي موضع الا وجدت غيري قد سبقني اليه فرجعت امشي في البلد فلا ادرك موضعا قد كان فيه شء منبوذ الا وقد سبقت اليه فاجهدني الضعف وعجزت عن التماسك فدخلت مسجدا وقعدت وكدت اصافح الموت اذ دخل شاب اعجمي ومعه خبز وشواء وجلس ياكل فكنت اكاد كلما رفع يده باللقمة ان افتح فمي من شدة الجوع حتي انكرت ذلك علي نفسي اذ التفت فراني فقال بسم الله فابيت فاقسم علي فبادرت نفسي الي اجابته فابيت مخالفا لها ولهواها فاقسم علي فاجبته فاكلت مقصرا واخذ يسالني ما شغلك ومن اين انت فقلت اما شغلي فمتفقه واما من اين فمن جيلان فقال وانا والله من جيلان فهل تعرف لي شابا جيلانيا اسمه عبد القادر يعرف بسبط ابي عبد الله الصومعي الزاهد ,False,0748Dhahabi.TarikhIslam
17179916157,4,Shamela0010906-ara1.mARkdown.ms6594,الي ان بقيت اياما لا اكل طعاما بل اتبع المنبوذات فخرجت يوما الي الشط فوجدت قد سبقني الفقراء فضعفت وعجزت عن التماسك فدخلت مسجدا وقعدت وكدت اصافح الموت ودخل شاب اعجمي ومعه خبز وشواء وجلس ياكل فكنت اكاد كلما رفع لقمة ان افتح فمي فالتفت فراني فقال باسم الله فابيت فاقسم علي فاكلت مقصرا واخذ يسالني ما شغلك ومن اين انت فقلت متفقه من جيلان قال وانا من جيلان فهل تعرف لي شابا جيلانيا اسمه عبد القادر يعرف بسبط ابي عبد الله الصومعي الزاهد فقلت انا هو فاضطرب لذلك وتغير وجهه وقال والله يا اخي لقد وصلت الي بغداد ,False,0748Dhahabi.SiyarAclamNubala
17179916157,4,SHAM19Y23644-ara1.ms7425,وعجزت عن التماسك فدخلت اليه وقعدت في جانب منه وقد كدت اصافح الموت اذ دخل شاب عجمي ومعه خبز رصافي وشواء وجلس ياكل فكنت اكاد كلما رفع يده باللقمة افتح فمي من شدة الجوع حتي انكرت علي نفسي وقلت ما هذا ما ها هنا الا الله او ما قضاه من الموت اذ التفت العجمي الي فراني فقال بسم الله يا اخي فابيت عليه فاقسم علي فبادرت نفسي الي اجابته فاكلت مقصرا واخذ يسالني ما شغلك ومن اين انت ومن تعرف فقلت اما شغلي فمتفقه واما من اين انا فمن جيلان فقال لي فانا ايضا جيلاني فهل تعرف لي شابا جيلانيا يسمي عبد القادر ويعرف بسبط ابي عبد الله الصومعي الزاهد فقلت انا هو فاضطرب لذلك وتغير وجهه وقال والله يا اخي لقد وصلت بغداد ,False,0654SibtIbnJawzi.MiratZaman
17179916157,4,Kraken210630005153-ara1.ms3709,الي ان بقيت اياما لا اكل طعاما بل اتبع المنبوذات فخرجت يوما الي الشط فوجدت قد سبقني الفقراء فضقفت وعجزت عن التماسك فدخلت مسجدا وقعدث وكدت اصافح الموت ودخل شاب اعجمي ومعه خبز وشواء وجلس ياكل فكنت اكاد كلما رفع لقمة الي فمه ان افتح فمي فالتفت فراني فقال بسم الله فابيت فاقسم علي فاكلت مقصرا واخذ يسالني ما شغلك ومن اين انت فقلت متفقه ,False,0749IbnFadlAllahCumari.MasalikAbsar
17179990662,4,Shamela0001043-ara1.mARkdown.ms0203,اخت المدينة في اسم لا يشاركها فيه سواها من البلدان والتمس وعظم الله معني ذكرها قسما قلد اذا شءت اهل العلم او فقس ,False,0900AbuCabdAllahHimyari.RawdMictar
17179990662,4,Sham19Y0016421-ara1.ms018,المدينة في اسم لا يشاركها فيه سواها من البلدان والتمس وعظم الله معني لقطها قسما قلد اذا شءت اهل العلم او فقس ,False,0501IbnMakkiSiqilli.TathqifLisan
17179990662,4,Shamela0006744-ara1.mARkdown.ms108,اخت المدينة في اسم لا يشاركها فيه سواها من البلدان والنمس وعظم الله معني لفظها قسما قلد اذا شءت اهل العلم او فقس ,False,0911Suyuti.BughyatWucat
17179990662,4,Shamela0000093-ara1.ms024,اخت المدينة في اسم لا يشاركها فيه سواها من البلدان فالتمس وعظم الله معني لفظها قسما قلد اذا شءت اهل العلم او فقس ,False,0633IbnHasanIbnDihyaKalbi.MutribMinAshcar
17179991388,4,Shamela0035100-ara1.mARkdown.ms00839,الديوان وفرض للمهاجرين الاولين خمسة الاف خمسة الاف وللانصار اربعة الاف اربعة الاف ولامهات المءمنين اثني عشر الفا اثني عشر الفا ,False,0748Dhahabi.TarikhIslam
17179991388,4,Shamela0010906-ara1.mARkdown.ms0778,الديوان وفرض للمهاجرين الاولين خمسة الاف خمسة الاف وللانصار اربعة الاف اربعة الاف وامهات المءمنين اثني عشر الفا اثني عشر الفا ,False,0748Dhahabi.SiyarAclamNubala
17179991388,4,Shamela0003118-ara1.completed.ms5083,الديوان وفرض للمهاجرين الاولين خمسة الاف خمسة الاف وللانصار اربعة الاف اربعة الاف ولامهات المءمنين اثني عشر الفا اثني عشر الفا ,False,0711IbnManzurIfriqi.MukhtasarTarikhDimashq
17179991388,4,JK000916-ara1.mARkdown.ms17447,الديوان وفرض للمهاجرين الاولين خمسة الاف خمسة الاف والانصار اربعة الاف اربعة الاف ولامهات المءمنين اثني عشر الفا اثني عشر الفا ,False,0571IbnCasakir.TarikhDimashq
17180048799,4,Tafsir03037-ara1.ms2910,وبالله التوفيق وصلي الله علي سيدنا محمد واله وصحبه وسلم سورة النجم يقول الحق جل جلاله والنجم اي الثريا او جنس النجم اذا هوي اذا غرب او انتثر يوم القيامة او طلع يقال هوي هويا بوزن قيول اذا غرب وهوي هويا بوزن دخول اذا طلع والعامل في اذا فعل القسم اي اقسم بالنجم وقت غروبه او طلوعه وجواب القسم ما ضل عن قصد الحق صاحبكم اي محمد صلي الله عليه وسلم والخطاب لقريش وما غوي في اتباع الباطل او ما اعتقد باطلا قط اي هو في غاية الهدي والرشد وليس مما تتوهموه من الضلالة والغواية في شء فالضلال نقيض الهدي والغي نقيض الرشد ,False,1124IbnMuhammadIbnCajibaFasiSufi.BahrMadid
17180048799,4,Shamela0023631-ara1.ms4274,سورة النجم الايات الي بسم الله الرحمن الرحيم والنجم اذا هوي ما ضل صاحبكم وما غوي والنجم اذا هوي اي اذا غرب وغاب عن الابصار او انتثر يوم القيامة او انقض ما ضل صاحبكم يعني محمدا صلي الله عليه وسلم والخطاب لقريش اي ما حاد عن الحق ولا زال عنه وما غوي اي ما صار غويا ولكنه علي استقامة وسداد ورشد وهدي وفيه تعريض بانهم اهل الضلال والغي وذكره صلي الله عليه وسلم بعنوان صاحبهم للاعلام بوقوفهم علي تفاصيل احواله الشريفة واحاطتهم بمحاسن شءونه المنيفة فهو تبكيت لهم علي وجه ابلغ من ان يصرح باسمه القول في تاويل قوله تعالي سورة النجم الايات الي وما ينطق عن الهوي ان هو الا وحي يوحي وما ينطق عن الهوي اي وما ينطق بهذا القران عن ,False,1332IbnMuhammadJamalDinQasimi.MahasinTawil
17180048799,4,Shamela0001394-ara1.ms1614,وبالله التوفيق سورة النجم اثنتان وستون اية مكية بسم الله الرحمن الرحيم والنجم اذا هوي و النجم اقسم بالثريا او بجنس النجوم اذا هوي اذا غربت او انتثر يوم القيامة وجواب القسم ما ضل صاحبكم وما غوي ما ضل عن قصد الحق صاحبكم اي محمد صلي الله عليه وسلم والخطاب لقريش وما غوي في اتباع الباطل وقيل لاضلال نقيض الهدي والغي نقيض الرشد اي هو مهتد راشد وليس كما تزعمون من نسبتكم اياه الي الضلال والغي وما ينطق عن الهوي ان هو الا وحي يوحي وما ينطق عن ,False,0710IbnAhmadHafizDinNasafi.Tafsir
17180048799,4,Sham19Y0014404-ara1.ms1448,بسم الله الرحمن الرحيم والنجم اذا هوي والنجم يعني الثريا والعرب لا تقول النجم مطلقا الا للثريا اذا هوي سقط عند غروبه وقيل المراد الجملة من القران اذا تنزلت وذلك انه روي ان القران نزل علي رسول الله صلي الله عليه وسلم نجوما اي اقدارا مقدرة في اوقات ما ويجء هوي علي هذا التاويل بمعني نزل قال ابن عطية وفي هذا المعني بعد وتحامل علي اللغة ونظير هذه الاية قوله تعالي فلا اقسم بمواقع النجوم الواقعة والخلاف في هذه كالخلاف في تلك وهو قسم بالنجم وقت هويه او بالقران وقت نزوله ما ضل صاحبكم وما غوي وجواب القسم ما ضل صاحبكم يعني محمدا صلي الله عليه وسلم عن طريق الهدي وما غوي ما لابس الغي وهو نقيض الرشد قرا ابو عمرو وورش عن نافع بامالة رءوس اي هذه السورة بخلاف عنهما وافقهما علي الاماله حمزة والكساءي وخلف وما ينطق عن الهوي وما ينطق عن الهوي اي لا يتكلم بالباطل عن ,False,0928MujirDinCulaymi.FathRahman
17180067927,4,ShamAY0036736-ara1.ms359,ابن عباس قال جاء ابو سفيان الي رسول الله صلي الله عليه وسلم فقال يا محمد انشدك الله والرحم لقد اكلنا العلهز يعني الوبر بالدم فانزل الله تعالي ولقد اخذناهم بالعذاب فما ب استكانوا لربهم وما يتضرعون المءمنون قال ابن عباس لما اتي ثمامة بن اثال الحنفي الي رسول الله صلي الله عليه وسلم فاسلم وهو اسير فخلي سبيله فلحق باليمامة فحال بين اهل مكة وبين الميرة من اليمامة واخذ الله تعالي قريشا بسني الجدب حتي اكلوا العلهز فجاء ابو سفيان الي النبي صلي الله عليه وسلم فقال انشدك الله والرحم اليس تزعم انك بعثت رحمة للعالمين قال بلي فقال قد قتلت الاباء بالسيف والابناء بالجوع فانزل الله تعالي ,False,0468IbnAhmadWahidiNaysaburi.AsbabNuzul
17180067927,4,Tafsir03092-ara1.ms1689,ابن عباس جاء ابو سفيان الي النبي صلي الله عليه وسلم فقال يا محمد نشدتك الله والرحمن لقد اكلنا العلهز يعني الوبر بالدم فانزل الله ولقد اخذناهم بالعذاب الاية وروي في هذا الحديث ان ابا سفيان قال للنبي عليه السلام اليس قد بعثت رحمة للعالمين قال نعم قال فقد قتلت الاباء بالسيف والابناء بالجوع فانزل الله تعالي ولقد اخذناهم بالعذاب الاية قال ,False,0437IbnHammushQayruwani.Hidaya
17180067927,4,Shamela0023623-ara1.ms2779,ابن عباس قال جاء ابو سفيان الي النبي صلي الله عليه وسلم فقال يا محمد انشدك الله والرحم فقد اكلنا العلهز يعني الوبر بالدم فانزل الله ولقد اخذناهم بالعذاب فما استكانوا لربهم وما يتضرعون واصل الحديث في الصحيحين ان رسول الله صلي الله عليه وسلم دعا علي قريش حين استعصوا فقال اللهم اعني عليهم بسبع كسبع يوسف الحديث واخرج ابن جرير وابو نعيم في المعرفة والبيهقي في الدلاءل عن ابن عباس ان ابن اثال الحنفي لما اتي رسول الله صلي الله عليه وسلم فاسلم وهو اسير فخلي سبيله لحق باليمامة فحال بين اهل مكة وبين الميرة من اليمامة حتي اكلت قريش العلهز فجاء ابو سفيان الي رسول الله صلي الله عليه وسلم فقال اليس تزعم انك بعثت رحمة للعالمين قال بلي قال فقد قتلت الاباء بالسيف والابناء بالجوع فانزل الله ولقد اخذناهم بالعذاب الاية واخرج ,False,1250Shawkani.FathQadir
17180067927,4,Shamela0002247-ara1.ms128,ابن عباس قال جاء ابو سفيان الي النبي صلي الله عليه وسلم فقال يا محمد انشدك بالله والرحم قد اكلنا العلهز يعني الوبر والدم فانزل الله ولقد اخذناهم بالعذاب فما استكانوا لربهم وما يتضرعون واخرج البيهقي في الدلاءل بلفظ ان ابن اياز الحنفي لما اتي به النبي صلي الله عليه وسلم وهو اسير خلي سبيله واسلم فلحق بمكة ثم رجع فحال بين اهل مكة وبين الميرة من اليمامة حتي اكلت قريش العلهز فجاء ابو سفيان الي النبي صلي الله عليه وسلم فقال الست تزعم انك بعثت رحمة للعالمين قال بلي قال فقد قتلت الاباء بالسيف والابناء بالجوع فنزلت سورة النور قوله تعالي ,False,0911Suyuti.LubabNuqul
17180071745,4,Shamela0035100-ara1.mARkdown.ms08721,النسر وتهدمت بانياس وهونين وتبنين وخرج قوم من بعلبك يجمعون الريباس من جبل لبنان فالتقي عليهم الجبلان فماتوا وتهدمت قلعة بعلبك مع عظم حجارتها وانفرق البحر فصار اطوادا وقذف بالمراكب الي الساحل فتكسرت واحصي من هلك في هذه السنة فكان الف الف وماءة الف انسان ثم قال نقلت ذلك من تاريخ ابي المظفر سبط ابن الجوزي ,False,0748Dhahabi.TarikhIslam
17180071745,4,SHAM19Y23644-ara1.ms7749,وتهدمت بانياس وهونين وتبنين وخرج قوم من بعلبك يجنون الريباس من جبل لبنان فالتقي عليهم الجبلان فماتوا باسرهم وتهدمت قلعة بعلبك مع عظم حجارتها ووثيق عمارتها وامتدت الي حمص وحماة وحلب والعواصم وقطعت البحر الي قبرس وانفرق البحر فصار اطوادا وقذف بالمراكب الي الساحل فتكسرت ,False,0654SibtIbnJawzi.MiratZaman
17180071745,4,Shamela0010283-ara1.mARkdown.ms6601,النسر وتهدمت بانياس وهونين وتبنين وخرج قوم من بعلبك يجمعون الريباس من جبل لبنان فالتقي عليهم الجبلان فماتوا باسرهم وتهدمت قلعة بعلبك مع عظم حجارتها وامتدت الي حمص وحماه وحلب والعواصم وقطعت البحر الي قبرص وانفرق البحر فصار اطوادا وقذف بالمراكب الي الساحل فتكسرت ثم امتدت الي خلاط وارمينية واذربيجان والجزيرة واحصي من هلك في هذه السنة بسبب هذه الزلزلة فكانوا الف الف انسان وماءة الف وكانت قوة الزلزلة في مبدا الامر بمقدار ما يقرا الانسان سورة الكهف ثم دامت بعد ذلك اياما حكي ذلك ابو المظفر يوسف سبط بن الجوزي ,False,0733Nuwayri.NihayatArab
17180071745,4,Sham19Y0120145-ara1.ms47,النسر وتهدمت بانياس وهو بين وبين وخرج قوم من بعلبك يجنون الريباس من جبل لبنان فالتقي عليهم الجبلان فماتوا باسرهم وتهدمت قلعة بعلبك مع عظم حجارتها وامتدت الي حمص وحماه وحلب والعواصم وقطعت البحر الي قبرس وانفرق البحر فصار اطوادا وقذف بالمراكب الي الساحل فتكسرت ثم امتدت الي خلاط وارمينية واذربيجان والجزيرة واحصي من هلك في هذه السنة تقريبا فكان الف الف انسان وماءة الف انسان ,False,0953IbnTulun.InbaUmara
25769811089,4,Kraken210630005153-ara1.ms8886,علي بن محمد الساعاتي الدمشقي الطويل اسكن اوطان النبيين عصبة تمين لدي ايمانها وهي تحلف صتكم والنصح للدين واجن ذروا بيت يعقوب فقد جاء يوسف ,False,0749IbnFadlAllahCumari.MasalikAbsar
25769811089,4,Shamela0012715-ara1.mARkdown.ms0669,علي بن محمد الساعاتي الدمشقي اتسكن اوطان النبيين عصبة تمين لدي ايمانها وهي تحلف نصحتكم والنصح للدين واجب ذروا بيت يعقوب فقد جاء يوسف ,False,0732AbuFida.MukhtasarFiAkhbar
25769811089,4,Shamela0023735-ara1.mARkdown.ms0677,ابو الحسن علي بن محمد الساعاتي الدمشقي ايسكن اوطان النبيين عصبة تمين لدي ايمانها حين تحلف نصحتكم والنصح في الدين واجب ذروا بيت يعقوب فقد جاء يوسف ,False,0626YaqutHamawi.MucjamBuldan
25769811089,4,Shamela0006708-ara1.mARkdown.ms014,ابو الحسن علي بن محمد الساعاتي الخراساني من اهل دمشق امتدحه بهذه القصيدة بحدك اعطاف القنا تتعطف وطرف الاعادي دون مجدك يطرف شهاب هدي في ظلمة الشك ثاقب وسيف اذا ما هزك الله مرهف وقفت علي حصن المخاض وانه لموقف حق لا يوازيه موقف فلم يبد وجه الارض بل حال دونه رجال كاساد الشري وهي تزحف وجرداء سلهوب وردع مضاعف وابيض هندي ولدن مثقف وما رجعت اعلامك الصفر ساعة الي ان غدت اكبادها السود ترجف كبا من اعاليه صليب وبيعة وشاد به دين حنيف ومصحف ومنها ايسكن اوطان النبيين عصبة تمين لدي ايمانها وهي تحلف نصحتكموا والنصح في الدين واجب ذروا بيت يعقوب فقد جاء يوسف ,False,0617MansurIbnShahanshah.MidmarHaqaiq
25769866429,4,Shamela0000736-ara2.mARkdown.ms5480,معاوية بن عمرو بن المهلب بن عمرو بن شبيب ابو عمر الازدي المعني كوفي الاصل وهو اخو كرماني بن عمرو سمع زاءدة بن قدامة وعبد الرحمن المسعودي وجرير بن حازم وزهير بن معاوية وابا اسحاق الفزاري روي عنه يحيي بن معين ,False,0463KhatibBaghdadi.TarikhBaghdad
25769866429,4,JK000134-ara1.mARkdown.ms3415,في الثقات قلل ع الستة معاوية بن عمرو بن المهلب بن عمرو بن شبيب الازدي المعني الكوفي ابو عمرو البغدادي روي عن زاءدة بن قدامة والمسعودي وجرير بن حازم وزهير بن معاوية وابي اسحاق الفزاري ,False,0852IbnHajarCasqalani.TahdhibTahdhib
25769866429,4,ShamAY0034122-ara1.ms961,معاوية بن عمرو بن المهلب بن عمرو بن شبيب ابو عمرو كوفي الاصل سمع زاءدة بن قدامة وعبد الرحمن المسعودي وجرير بن حازم وابا اسحاق الفزاري روي عنه يحيي بن معين ,False,0665AbuMuayyadKhwarazmi.JamicMasanid
25769866429,4,Shamela0096228-ara1.mARkdown.ms016,في الثقات ع معاوية بن عمرو بن المهلب بن عمرو بن شبيب الازدي ابو عمرو البغدادي كوفي الاصل وهو اخو الكرماني بن عمرو شيخ روي عن اسراءيل وجرير بن حازم وزاءدة وزهير بن معاوية وابي اسحاق الفزاري ,False,0774IbnKathir.Takmil
25769925537,4,Shamela0023635-ara1.ms8090,قال ابن مسعود البطشة الكبري يوم بدر وانا اقول هي يوم القيامة وهذا القول اصح لان يوم بدر لا يبلغ هذا المبلغ الذي يوصف بهذا الوصف العظيم ولان الانتقام التام انما يحصل يوم القيامة لقوله تعالي اليوم تجزي كل نفس بما كسبت غافر ولان هذه البطشة لما وصفت بكونها كبري علي الاطلاق وجب ان تكون اعظم انواع البطش وذلك ليس الا في القيامة ,False,0606FakhrDinRazi.MafatihGhayb
25769925537,4,Shamela0037458-ara1.ms3960,قال ابن مسعود البطشة الكبري يوم بدر وانا اقول هي يوم القيامة قال ابن كثير وهذا اسناد صحيح وقال ابن الخطيب هذا القول اصح لان يوم بدر لا يبلغ هذا المبلغ الذي يوصف بهذا الوصف العظيم وان الانتقام التام انما يحصل يوم القيامة ,False,1307Qannawji.FathBayan
