cluster,size,id,text,from_input,book
42949884237,8,Sham19Y0023625-ara1.ms1455,مضطرب الاسناد وعمرو بن هارون ضعيف وقد خولف في صحابيه وفي رفعه اما الاول فاخرجه ابن ماجة من طريق اخري وقال عن ابي امامة ,False,1057IbnCallan.FutuhatRabbaniyya
42949884237,8,Shamela0021660-ara1.ms4754,عمر بن هارون البجلي والغالب عليه الضعف واثني عليه ابن مهدي لكن ضعفه جمع كثيرون وقال ابن حجر حديث مضطرب الاسناد وفيه عمر بن هارون ضعيف وقد خولف في صحابيه وفي رفعه ورواه الحسن بن سفيان عن عبادة ايضا وفيه بشر بن رافع متهم بالوضع واخرجه ابن ماجه من حديث بقية عن ابي امامة بلفظ من قام ليلتي العيد لله محتسبا لم يمت قلبه حين تموت القلوب وبقية صدوق لكن كثير التدليس وقد رواه بالعنعنة ورواه ابن شاهين بسند فيه ضعيف ومجهول ,False,1031CabdRaufMunawi.FaydQadir
42949884237,8,Sham19Y0038171-ara1.ms0896,من طريق بقية عن ابي امامة بلفظ من قام ليلتي العيد لله محتسبا لم يمت قلبه حين تموت القلوب وبقية صدوق لكنه كثير التدليس وقد رواه بالعنعنة ورواه ابن شاهين بسند فيه ضعيف ومجهول ,False,1205MurtadaZabidi.TakhrijAhadithIhyaCulumDin
60129745933,8,Shamela0022769-ara1.ms1032,ولا نكلف نفسا الا وسعها اي عادتنا جارية علي ان لا نكلف نفسا من النفوس الا ما في طاقتها اي فان الله تعالي لا يكلف عباده الا ما في وسعهم فان لم يبلغوا في فعل الطاعات مراتب السابقين فلا عليهم بعد ان يبذلوا طاقتهم ولدينا كتاب اي صحاءف الاعمال التي يقرءونها عند الحساب ينطق بالحق ,False,1316IbnCumarBantaniJawi.MarahLabid
60129745933,8,ShamAY0034055-ara1.ms07102,ولا نكلف نفسا الا وسعها جملة مستانفة سبقت للتحريض علي ما وصف به اولءك المشار اليهم من فعل الطاعات ببيان سهولته وكونه غير خارج عن حد الوسع والطاعة الي عادتنا جارية علي ان لا نكلف نفسا من النفوس الا ما في وسعها وقدر طاقتها علي ان المراد استمرار النفي بمعونة المقام لا نفي الاستمرار او للترخيص فيما هو قاصر عن درجة اعمال اولءك ببيان انه تعالي لا يكلف عباده الا ما في وسعهم فان لم يبلغوا في فعل الطاعات مراتب السابقين فلا عليهم بعد ان يبذلوا طاقتهم ويستفرغوا ,False,1342MahmudShukriAlusi.RawhMacani
60129745933,8,Tafsir03037-ara1.ms1811,لا يشعرون قال تعالي ولا نكلف نفسا الا وسعها اي طاقتها فهو تحريض علي تحصيل ما وصف به السابقون من فعل الطاعات المءدي الي نيل الخيرات ببيان سهولته وانه غير خارج عن حد الوسع والطاقة اي عادتنا جارية بان لا نكلف نفسا من النفوس الا ما في طاقتها فان لم يبلغوا في فعل الطاعة مراتب السابقين فلا عليهم بعد ان يبذلوا طاقتهم ويستفرغوا وسعهم ولدينا كتاب اي صحاءف الاعمال التي يرونها عند الحساب حسبما يعرب عنه قوله ينطق بالحق كقوله هذا كتابنا ينطق عليكم بالحق ان كنا نستنسخ ما كنتم تعملون ,False,1124IbnMuhammadIbnCajibaFasiSufi.BahrMadid
60129745933,8,Tafsir07057-ara1.ms3691,تعالي ولا نكلف نفسا الا وسعها اي وقد جرت سنتنا فيما شرعناه لعبادنا من تشريعات اننا لا نكلف نفسا من النفوس الا في حدود طاقتها وقدرتها كما قال تعالي لا يكلف الله نفسا الا وسعها والمراد بالكتاب في قوله تعالي ولدينا كتاب ينطق بالحق كتاب الاعمال الذي يحصيها الله تعالي فيه ويشهد لذلك قوله سبحانه هذا كتابنا ينطق عليكم بالحق انا كنا نستنسخ ما كنتم تعملون وقوله تعالي ووضع الكتاب فتري المجرمين مشفقين مما فيه ,False,1431MuhammadSayyidTantawi.TafsirWasit
60129745933,8,Shamela0023631-ara1.ms3412,اي سنتنا جارية علي الا نكلف نفسا من النفوس الا ما في وسعها او للترخيص فيما هو قاصر عن درجة اعمال اولءك الصالحين ببيان انه تعالي لا يكلف عباده الا ما في وسعهم فان لم يبلغوا في فعل الطاعات ,False,1332IbnMuhammadJamalDinQasimi.MahasinTawil
60129745933,8,Shamela0010273-ara1.ms2025,لا يشعرون قال تعالي ولا نكلف نفسا الا وسعها اي طاقتها فهو تحريض علي تحصيل ما وصف به السابقون من فعل الطاعات المءدي الي نيل الخيرات ببيان سهولته وانه غير خارج عن حد الوسع والطاقة اي عادتنا جارية بان لا نكلف نفسا من النفوس الا ما في طاقتها فان لم يبلغوا في فعل الطاعة مراتب السابقين فلا عليهم بعد ان يبذلوا طاقتهم ويستفرغوا وسعهم ولدينا كتاب اي صحاءف الاعمال التي يرونها عند الحساب حسبما يعرب عنه قوله ينطق بالحق كقوله هذا كتابنا ينطق عليكم بالحق انا كنا نستنسخ ما كنتم تعملون ,False,1224IbnCajiba.BahrMadid
60129745933,8,Shia002702Vols-ara1.ms07292,لا يظلمون ولا نكلف نفسا الا وسعها جملة مستانفة سيقت للتحريض علي ما وصف به اولءك المشار اليهم من فعل الطاعات ببيان سهولته وكونه غير خارج عن حد الوسع والطاعة اي عادتنا جارية علي ان لا نكلف نفسا من النفوس الا ما في وسعها وقدر طاقتها علي ان المراد استمرار النفي بمعونة المقام لا نفي الاستمرار او للترخيص فيما هو قاصر عن درجة اعمال اولءك ببيان انه تعالي لا يكلف عباده الا ما في وسعهم فان لم يبلغوا في فعل الطاعات مراتب السابقين فلا عليهم بعد ان يبذلوا طاقتهم ويستفرغوا وسعهم قال مقاتل من لم يستطع القيام فليصل قاعدا ومن لم يستطع القعود فليوم ايماء وقوله سبحانه ولدينا كت ابينطق بالحق تتمة لما قبله ببيان احوال ما كلفوه من الاعمال واحكامها المترتبة عليها من الحساب والثواب والعقاب والمراد بالكتاب صحاءف الاعمال التي يقرءونها عند الحساب ,False,1270ShihabDinAlusi.RuhMacani
60129745933,8,Tafsir07055-ara1.ms2531,تعالي ولا نكلف نفسا الا وسعها ما تضمنته هذه الاية من التخفيف في هذه الحنيفية السمحة التي جاء بها نبينا صلي الله عليه وسلم قد ذكرنا طرفا من الايات الدالة عليه في سورة الحج في الكلام علي قوله تعالي وما جعل عليكم في الدين من حرج الحج فاغني ذلك عن اعادته هنا قوله تعالي ولدينا كتاب ينطق بالحق وهم لا يظلمون الحق ان المراد بهذا الكتاب كتاب الاعمال الذي يحصيها الله فيه كما يدل عليه قوله تعالي هذا كتابنا ينطق عليكم بالحق انا كنا نستنسخ ما كنتم تعملون الجاثية وقد قدمنا الايات الموضحة لهذا المعني في الكهف في الكلام علي قوله ووضع الكتاب فتري المجرمين مشفقين مما فيه ,False,1393MuhammadAminShanqiti.AdwaBayan
68719660945,8,Shamela0009783BK1-ara1.mARkdown.ms1695,اليهم والي غيرهم حتي رفع الله ذلك حدثني الحارث قال حدثنا ابن سعد قال اخبرنا محمد بن عمر قال اخبرني موسي بن يعقوب عن عمه عن هشام بن خالد قال سمعت عمر بن الخطاب رضي الله تعالي عنه يقول لا تذرن احداكن الدقيق حتي يسخن الماء ثم تذره قليلا قليلا وتسوطه بمسوطها فانه اريع له واحري الا يتقرد حدثني الحارث قال حدثنا ابن سعد قال اخبرنا محمد بن مصعب القرقساني قال حدثنا ابو بكر بن عبد الله بن ابي مريم عن راشد بن سعد ان عمر بن الخطاب ,False,0310Tabari.Tarikh
68719660945,8,Sham19Y0145435-ara1.ms2028,اليهم والي غيرهم حتي رفع الله ذلك حدثني الحارث قال حدثنا ابن سعد قال اخبرنا محمد بن عمر قال اخبرني موسي بن يعقوب عن عمه عن هشام بن خالد قال سمعت عمر بن الخطاب رضي الله تعالي عنه يقول لا تذرن احداكن الدقيق حتي يسخن الماء ثم تذره قليلا قليلا وتسوطه بمسوطها فانه اريع له واحري الا يتقرد حدثني الحارث قال حدثنا ابن سعد قال اخبرنا محمد بن مصعب القرقساني قال حدثنا ابو بكر بن عبد الله بن ابي مريم عن راشد بن سعد ان عمر بن الخطاب ,False,1411MuhammadTahirBarnaji.SahihWaDacifTarikhTabari
68719660945,8,Shia002265Vols-ara1.ms4121,ابن سعد عن حزام بن هشام عن ابيه قال رايت عمر بن الخطاب عام الرمادة مر علي امراة وهي تعصد عصيدة لها فقال ليس هكذا تعصدين ثم اخذ المسوط فقال هكذا فاراها ابن سعد عن هشام بن خالد قال سمعت عمر بن الخطاب يقول لا تذرن احداكن الدقيق حتي يسخن الماء ثم تذره قليلا قليلا وتسوطها بمسوطها فانه اريع لها واحري ان لا يتقرد ابن سعد مسند عمر عن الحسن قال خرج عمر بن الخطاب ,False,0975MuttaqiHindi.KanzCummal
68719660945,8,JK009390-ara1.completed.ms4021,عن هشام بن خالد قال سمعت عمر بن الخطاب رضي الله عنه يقول لا تذرن احداكن الدقيق حتي يسخن الماء ثم تذره قليلا قليلا ,False,1423CabbasAhmadSaqr.JamicAhadith
68719660945,8,Shamela0001686-ara1.completed.ms0991,اليهم والي غيرهم حتي رفع الله ذلك قال اخبرنا محمد بن عمر قال حدثني حزام بن هشام عن ابيه قال رايت عمر بن الخطاب عام الرمادة مر علي امراة وهي تعصد عصيدة لها فقال ليس هكذا تعصدين ثم اخذ المسوط فقال هكذا فاراها قال اخبرنا محمد بن عمر قال حدثني موسي بن يعقوب عن عمته عن هشام ابن خالد قال سمعت عمر بن الخطاب يقول لا تذرن احداكن الدقيق حتي يسخن الماء ثم تذره قليلا قليلا وتسوطه بمسوطها فانه اريع له واحري ان لا يتقرد قال اخبرنا محمد بن عمر قال حدثني عبد الله بن يزيد عن عياض بن خليفة قال رايت عمر عام الرمادة وهو اسود اللون ولقد كان ابيض فنقول مم ذا فيقول كان رجلا عربيا وكان ياكل السمن واللبن فلما امحل الناس حرمها حتي يحيوا فاكل بالزيت فغير لونه وجاع اكثر قال ,False,0230IbnSacd.TabaqatKubra
68719660945,8,Sham19Y0127677-ara1.ms03181,الناس ابن سعد عن حزام بن هشام بن خالد قال سمعت عمر بن الخطاب يقول لا تذرن احداكن الدقيق حتي يسخن الماء ثم تذره قليلا قليلا وتسوطه بمسوطها فانه اريع له واحري ان لا يتقرد ابن سعد عن اسلم قال كنا نقول لو لم يرفع الله المحل عام الرمادة لظننا ان عمر يموت هما بامر المسلمين ابن سعد عن فراس الديلي قال كان عمر بن الخطاب ,False,0911Suyuti.JamicKabir
68719660945,8,Shamela0001438-ara1.completed.ms5039,الماء ابن عبد الحكم كنز العمال عن حزام بن هشام بن خالد قال سمعت عمر بن الخطاب يقول لا تذرن احداكن الدقيق حتي يسخن الماء ثم تذره قليلا قليلا وتسوطها بمسوطها فانه اريع لها واحري ان لا يتقرد ابن سعد كنز العمال اخرجه ابن سعد عن عباية بن الرداد قال سمعت عمر بن الخطاب ,False,1450DarIftaMisriyya.JamicAhadith
68719660945,8,Shamela0009773-ara1.mARkdown.ms2860,اليهم والي غيرهم حتي رفع الله ذلك حدثني محمد بن سعد ثنا الواقدي عن حزام بن هشام عن ابيه قال رايت عمر بن الخطاب عام الرمادة مر علي امراة وهي تعصد عصيدة لها فقال ليس هكذا واخذ المسوط فقال هكذا واراها حدثني محمد بن سعد عن الواقدي وحدثني موسي بن يعقوب عن عمه عن هشام بن خالد قال سمعت عمر بن الخطاب رضي الله تعالي عنه عام الرمادة يقول لا تذرن احداكن الدقيق حتي يسخن الماء ثم تذروه قليلا قليلا وتسوطه بمسوطها فانه اريع له واحري ان لا يتقرد حدثني محمد بن سعد عن الواقدي عن عبد الله بن يزيد عن عياض بن خليفة قال رايت عمر رضي الله تعالي عنه عام الرمادة وهو اسود اللون وعهدته قبل ذلك ابيض فقلت لم اسود فقيل انه كان ياكل السمن واللبن فلما امحل الناس حرمهما حتي يحيوا فاكل الزيت فغير لونه وجاع فاكثر وقال ,False,0279Baladhuri.AnsabAshraf
77309463147,8,Shamela0012062-ara1.ms146,حتي اكل الناس وعن يحيي بن سعيد قال اشترت امراة عمر بن الخطاب لعمر فرقا من سمن بستين درهما فقال عمر ما هذا فقالت امراة هو من مالي ليس من نفقتك فقال عمر ما انا بذاءقه حتي يحيي الناس وعن ابن ابي مليكة قال قال ابو محذورة كنت جالسا عند عمر اذ جاء صفوان بن امية بجفنة يحملها نفر في عباءة فوضعها ب بين يدي عمر ,False,0909IbnCabdHadi.MahdSawab
77309463147,8,Shamela0003118-ara1.completed.ms5085,الساءب بن يزيد قال ركب عمر بن الخطاب عام الرمادة دابة فراثت شعيرا فراها عمر فقال المسلمون يموتون هزلا وهذه الدابة تاكل الشعير لا والله لا اركبها حتي يحيا الناس وعن يحيي بن سعيد قال اشترت امراة عمر بن الخطاب لعمر فرق سمن بستين درهما فقال عمر ما هذا فقالت امراته هو من مالي ليس من نفقتك فقال عمر ماانا بذاءقه حتي يحيا الناس وعن ابن عمر ان عمر لما كان عام الرمادة ,False,0711IbnManzurIfriqi.MukhtasarTarikhDimashq
77309463147,8,Shia002265Vols-ara1.ms4098,الساءب بن يزيد قال ركب عمر بن الخطاب عام الرمادة دابة فراثت شعيرا فراها عمر فقال المسلمون يموتون هزلا وهذه الدابة تاكل الشعير لا والله لا اركبها حتي يحيي الناس ابن سعد ق كر عن انس بن مالك قال تقرقر بطن عمر بن الخطاب وكان ياكل الزيت عام الرمادة وكان حرم عليه السمن فنقر بطنه باصبعه وقال تقرقر تقرقرك انه ليس لك عندنا غيره حتي يحيي الناس ابن سعد حل كر عن اسلم ان عمر حرم علي نفسه اللحم عام الرمادة حتي ياكله الناس ,False,0975MuttaqiHindi.KanzCummal
77309463147,8,Sham19Y0127677-ara1.ms16864,الساءب بن يزيد يقول ركب عمر بن الخطاب الاثر الاثر في كنز العمال وقاءع عام الرمادة ج ص رقم بلفظ المصنف وفي الطبقات الكبري لابن سعد استخلاف عمر بن الخطاب ج ص بلفظ اخبرنا عبد الله بن نمير عن عبيد الله عن ثابت البناني عن انس بن مالك قال تقرقر بطن عمر الاثر وفي حلية الاولياء ترجمة عمر بن الخطاب ج ص بلفظ حدثنا احمد بن جعفر بن حمدان ثنا عبد الله بن احمد بن حنبل حدثني ابو الهيثم محمد بن يعقوب الربالي ثنا عبيد الله بن نمير عن ثابت عن انس قال تقرقر بطن عمر بن الخطاب الاثر هذا الاثر في كنز العمال كتاب فضاءل الصحابة باب فضاءل الفاروق رضي الله عنه ج ص رقم بلفظ المصنف وعزوه وفي الطبقات الكبري لابن سعد ترجمة عمر بن الخطاب القسم الاول في البدريين من المهاجرين ج ص بلفظ اخبرنا الفضل بن دكين قال حدثنا عمر بن الخطاب عن زيد بن اسلم عن ابيه ان عمر ابن الخطاب حرم علي نفسه اللحم عام الرمادة حتي ياكله الناس ,False,0911Suyuti.JamicKabir
77309463147,8,Sham19Y0127677-ara1.ms03181,الساءب بن يزيد قال ركب عمر بن الخطاب عام الرمادة دابة فراثث شعيرا فراها عمر فقال المسلمون يموتون هزلا وهذه الدابة تاكل الشعير لا والله لا اركبها حتي يحيا الناس ابن سعد ق كر عن انس بن مالك قال تقرقر بطن عمر بن الخطاب وكان ياكل الزيت عام الرمادة وكان حرم عليه السمن فنقر بطنه باصبعه وقال تقرقر تقرقرك انه ليس لك عندنا غيره حتي يحيا الناس ابن سعد حل كر عن اسلم ان عمر حرم علي نفسه اللحم عام الرمادة ,False,0911Suyuti.JamicKabir
77309463147,8,JK000916-ara1.mARkdown.ms17451,ابو بكر العبدي نا اسماعيل بن اسحاق نا ابو ثابت نا عبدالله بن وهب قال سمعت مالكا يحدث عن يحيي بن سعيد قال اشترت امراة عمر بن الخطاب لعمر فرق سمن بستين درهما فقال عمر ما هذا فقالت امراته هو من مالي ليس من نفقتك فقال عمر ما انا بذاءقه حتي يحيا الناس اخبرنا ابو منصور محمود بن احمد بن عبدالمنعم انا ابو علي الحسن بن عمر بن يونس انا ابو عمر الهاشمي انا ابو ,False,0571IbnCasakir.TarikhDimashq
77309463147,8,Sham19Y0017533-ara1.ms082,ابو ثابت حدثني عبد الله بن وهب قال سمعت مالكا يحدث عن يحيي بن سعيد قال اشترت امراة عمر بن الخطاب لعمر فرق سمن بستين درهما فقال عمر ما هذا فقالت امراته هو من مالي ليس من نفقتك فقال عمر ما انا بذاءقه حتي يحيا الناس وبه الي ابن الجوزي انا محمد بن ناصر وعمر بن ظفر قالا انا محمد بن الحسن ثنا القاضي ابو العلاء الواسطي ثنا ابو نصر النيازكي ثنا ابو الخير البزاز ثنا البخاري ثنا بشر بن محمد انا عبيد الله انا ابو يونس البصري عن ابن ابي مليكة قال قال ابو محذورة كنت جالسا عند عمر اذ جاء صفوان بن امية بجفنة يحملها نفر في عباءة فوضعوها بين يدي عمر ,False,0909IbnCabdHadi.IdahTuruqIstiqama
77309463147,8,Shamela0021476-ara1.ms46,ابو بكر العبدي حدثنا اسماعيل بن اسحاق حدثنا ابو ثابت حدثني عبد الله بن وهب قال وسمعت مالكا يحدث عن يحيي بن سعيد قال اشترت امراة عمر بن الخطاب لعمر رضي الله عنه فرق سمن بستين درهما فقال عمر ما هذا فقالت هو من مالي ليس من نفقتك فقال عمر ما انا بذاءقه حتي يحيا الناس حدثنا ابو محمد بن نصير حدثنا احمد بن ,False,0387IbnSamcunBaghdadi.Amali
77309463151,8,Shamela0003118-ara1.completed.ms5085,الساءب بن يزيد قال ركب عمر بن الخطاب عام الرمادة دابة فراثت شعيرا فراها عمر فقال المسلمون يموتون هزلا وهذه الدابة تاكل الشعير لا والله لا اركبها حتي يحيا الناس وعن يحيي بن سعيد ,False,0711IbnManzurIfriqi.MukhtasarTarikhDimashq
77309463151,8,Shia002265Vols-ara1.ms4098,اللهم لا تجعل هلاك امة محمد علي يدي ابن سعد عن اسلم قال قال عمر بءس الوالي انا ان اكلت طيبها واطعمت الناس كراديسها ابن سعد عن الساءب بن يزيد قال ركب عمر بن الخطاب عام الرمادة دابة فراثت شعيرا فراها عمر فقال المسلمون يموتون هزلا وهذه الدابة تاكل الشعير لا والله لا اركبها حتي يحيي الناس ابن سعد ,False,0975MuttaqiHindi.KanzCummal
77309463151,8,JK009390-ara1.completed.ms3997,سمعت عمر رضي الله عنه يقول عام الرمادة اللهم لا تجعل هلاك امة محمد علاي يدي ابن سعد عن اسلم قال قال عمر رضي الله عنهما بءس الوالي انا ان اكلت طيبها واطعمت الناس كراديسها ابن سعد عن الساءب بن يزيد قال ركب عمر بن الخطاب رضي الله عنه عام الرمادة دابة فراثت شعيرا فراها عمر فقال المسلمون يموتون هزلا وهاذه الدابة تاكل الشعير لا والله لا اركبها حتي يحيي الناس ابن سعد ق كر عن انس بن مالك ,False,1423CabbasAhmadSaqr.JamicAhadith
77309463151,8,Shamela0001686-ara1.completed.ms0989,ليلة في السحر وهو يقول اللهم لا تجعل هلاك امة محمد علي يدي قال اخبرنا محمد بن عمر قال حدثني عبد الله بن يزيد الهذلي قال سمعت الساءب بن يزيد يقول ركب عمر بن الخطاب عام الرمادة دابة فراثت شعيرا فراها عمر فقال المسلمون يموتون هزلا وهذه الدابة تاكل الشعير لا والله لا اركبها حتي يحيا الناس ,False,0230IbnSacd.TabaqatKubra
77309463151,8,Sham19Y0127677-ara1.ms03181,طيبها واطعمت الناس كراديسها ابن سعد عن الساءب بن يزيد قال ركب عمر بن الخطاب عام الرمادة دابة فراثث شعيرا فراها عمر فقال المسلمون يموتون هزلا وهذه الدابة تاكل الشعير لا والله لا اركبها حتي يحيا الناس ابن سعد ق كر عن انس بن مالك ,False,0911Suyuti.JamicKabir
77309463151,8,Shamela0001438-ara1.completed.ms5016,عن الساءب بن يزيد قال ركب عمر بن الخطاب عام الرمادة دابة فراثت شعيرا فراها عمر فقال المسلمون يموتون هزلا وهذه الدابة تاكل الشعير لا والله لا اركبها حتي يحيي الناس ابن سعد ,False,1450DarIftaMisriyya.JamicAhadith
77309463151,8,JK000916-ara1.mARkdown.ms17451,سمعت الساءب بن يزيد يقول ركب عمر بن الخطاب عام الرمادة دابة فراثت شعيرا فراها عمر فقال المسلمون يموتون هزلا وهذه الدابة تاكل الشعير لا والله لا اركبها حتي يحيي الناس ,False,0571IbnCasakir.TarikhDimashq
