cluster,size,id,text,from_input,book
111669271679,8,Shamela0023628-ara1.completed.ms2286,وان من قرية الا نحن مهلكوها قبل يوم القيامة اي بالموت والخراب او معذبوها عذابا شديدا اي بالقتل وانواع العذاب اذا كفروا وعصوا وقيل الاهلاك في حق المءمنين الاماته وفي حق الكفار العذاب قال عبد الله بن مسعود اذا ظهر الزنا والربا في قرية اذن الله في هلاكها كان ذلك في الكتاب اي في اللوح المحفوظ مسطورا اي ,False,0741KhazinBaghdadi.LubabTawil
111669271679,8,Shamela0021821-ara1.ms1030,وان من قرية الا نحن مهلكوها قبل يوم القيامة او معذبوها عذابا شديدا كان ذلك في الكتاب مسطورا وما منعنا ان نرسل بالايات الا ان كذب بها الاولون واتينا ثمود الناقة مبصرة فظلموا بها وما نرسل بالايات الا تخويفا واذ قلنا لك ان ربك احاط بالناس وما جعلنا الرءيا التي اريناك الا فتنة للناس والشجرة الملعونة في القرءان ونخوفهم فما يزيدهم الا طغيانا كبيرا الاسراء قوله وان من قرية الا نحن مهلكوها الاسراء قال ابن مسعود اذا ظهر الزنا والربا في اهل قرية اذن الله في اهلاكها وقال مقاتل اما الصالحة فبالموت واما الطالحة فبالعذاب وقال الزجاج اي ما من اهل قرية ,False,0468IbnAhmadWahidiNaysaburi.WasitFiTafsir
154618854687,8,Shamela0023578-ara1.completed.ms3148,من خلق الاشياء فاجتمعت فيه المخلوقات وقيل يجمع الجماعات فيها وقيل لاجتماع الناس فيه للصلاة وقيل اول من سماها جمعة كعب بن لءي اخبرنا ابن فنجويه قال حدثنا ابن حفصويه قال حدثنا الحسن بن احمد بن حفص الحلواني قال حدثنا ابراهيم بن اسحاق قال حدثنا ابراهيم بن المنذر قال حدثنا عبد العزيز عن محمد بن عبد العزيز عن ابيه عن ابي سلمة قال اول من قال اما بعد كعب بن لءي وكان اول من سمي الجمعة الجمعة وكان يقال للجمعة العروبة وقيل اول من سماها جمعة الانصار ,False,0427AbuIshaqThaclabi.KashfWaBayan
154618854687,8,Shamela0023578-ara1.completed.ms3147,الفراء وفيها لغة اخري ثالثة جمعة بالفتح كقولك رجل ضحكة وهمزة ولمزة وهي لغة بني عقيل وقيل هي لغة النبي صلي الله عليه وسلم وانما سمي هذا اليوم جمعة لما اخبرنا الحسن قال حدثنا الكندي قال حدثنا محمد بن مخلد العطار قال حدثنا محمد بن عيسي بن ابي موسي قال حدثنا عبد الله بن عمرو بن ابي امية قال حدثنا قيس الاعمش عن ابراهيم عن علقمة عن قرثع الضبي عن سليمان قال قال رسول الله صلي الله عليه وسلم انما سميت الجمعة لان ادم جمع فيها خلقه وقيل لان الله سبحانه فرغ فيه ,False,0427AbuIshaqThaclabi.KashfWaBayan
154618854687,8,Shia001432Vols-ara1.msB20190,البيان انما سميت جمعة لان الله تعالي فرغ فيه من خلق الاشياء فاجتمعت فيه المخلوقات وقيل لانه تجتمع فيه الجماعات وقيل ان اول من سماها جمعة كعب بن لوي وهو اول من قال اما بعد وقيل ان اول من سماها جمعة الانصار ,False,1111Majlisi.BiharAnwar
154618854687,8,Shamela0000041-ara1.completed.ms2589,لان الله تعالي فرغ من خلق الاشياء فاجتمعت فيه المخلوقات وقيل لاجتماع الجماعات فيه وقيل لاجتماع الناس فيها للصلاة وقيل اول من سماها جمعة كعب بن لءي قال ابو سلمة اول من قال اما بعد كعب بن لءي وكان اول من سمي الجمعة ,False,0510IbnMascudBaghawi.Tafsir
154618854687,8,Shia002359Vols-ara1.ms4190,قال الفراء وفيها لغة ثالثة جمعة بفتح الميم كضحكة وهمزة وانما سمي جمعة لانه تعالي فرغ فيه من خلق الاشياء فاجتمعت فيه المخلوقات وقيل لانه تجتمع فيه الجماعات وقيل ان اول من سماها جمعة كعب بن لءي وهو اول من قال اما بعد وكان يقال للجمعة العروبة عن ابي سلمة وقيل ان اول من سماها جمعة الانصار قال ابن سيرين جمع اهل المدينة قبل ان يقدم النبي صلي الله عليه واله وسلم المدينة ,False,0548IbnHasanTabarsi.TafsirMajmacBayan
154618854687,8,Shia002616Vols-ara1.ms6190,لغة بني عقيل وقيل انها لغة النبي صلي الله عليه وسلم وعن سلمان ان النبي صلي الله عليه وسلم قال انما سميت جمعة لان الله جمع فيها خلق ادم وقيل لان الله تعالي فرغ فيها من خلق كل شء فاجتمعت فيها المخلوقات وقيل لتجتمع الجماعات فيها وقيل لاجتماع الناس فيها للصلاة و من بمعني في اي في يوم كقوله تعالي اروني ماذا خلقوا من الارض فاطر اي في الارض الثانية قال ابو سلمة اول من قال اما بعد كعب بن لوي وكان اول من سمي الجمعة جمعة وكان يقال ليوم الجمعة العروبة وقيل اول من سماها جمعة الانصار قال ابن سيرين جمع اهل المدينة من قبل ان يقدم النبي صلي الله عليه وسلم المدينة ,False,0671AbuCabdAllahQurtubi.JamicLiAhkamQuran
154618854687,8,Tafsir02091-ara1.ms2101,قال الفراء وفيها لغة ثالثة جمعة بفتح الميم كما يقال رجل ضحكة وهمزة ولمزة وهي لغة بني عقيل وانما سمي هذا اليوم جمعة لما روي عن سلمان قال قال رسول الله صلي الله عليه وسلم سميت الجمعة جمعة لان ادم جمع فيها خلقه وقيل ان الله تعالي فرغ فيه من خلق المخلوقات وقيل تجتمع الجماعات فيها وقيل لاجتماع الناس فيها للصلاة وقيل اول من سماها جمعة كعب بن لءي وكان يقال ليوم الجمعة العروبة وقيل اول من سماها جمعة الانصار ,False,0360Tabarani.TafsirKabir
154618854687,8,Tafsir04040-ara1.ms1866,الصلاة وانما سميت جمعة لان الله تعالي فرغ فيه من خلق الاشياء فاجتمعت فيه المخلوقات وفيه سر سنشير اليه وقيل لانه تجتمع فيه الجماعات وقيل ان اول من سماها جمعة كعب بن لءي وهو اول من قال اما بعد وكان يقال لها العروبة عن ابي سلمة وقيل اول من سماها جمعة الانصار ,False,1050SadrDinShirazi.Tafsir
180388748762,8,Shamela0012884-ara1.completed.ms5089,واخرج عبد بن حميد وابن جرير وابن المنذر وابن ابي حاتم عن ابن عباس قال العتل هو الدعي والزنيم هو المريب الذي يعرف بالشر واخرج الفريابي وعبد بن حميد وابن المنذر والخراءطي في مساوء الاخلاق والحاكم وصححه عن ابن عباس في قوله عتل بعد ذلك زنيم قال هو الرجل يعرف بالشر كما تعرف الشاة بزنمتها واخرج ابن ابي حاتم عن ابن عباس قال الزنيم هو الرجل يمر علي القوم فيقولون رجل سوء واخرج البخاري والنساءي وابن ابي حاتم وابن مردويه وابو نعيم عن ابن عباس في قوله عتل بعد ذلك زنيم قال رجل من قريش كانت له زنمة زاءدة مثل زنمة الشاة يعرف بها واخرج ابن جرير وابن المنذر عن ابن عباس في الاية قال نعت فلم يعرف حتي قيل زنيم وكانت له زنمة في عنقه يعرف بها واخرج ابن جرير عن ابن عباس قال الزنيم الملحق النسب واخرج ابن جرير عن ابن عباس في قوله زنيم قال ظلوم ,False,0911Suyuti.DurrManthur
180388748762,8,Shamela0012884-ara1.completed.ms5088,صلي الله عليه وسلم تبكي السماء من عبد اصح الله جسمه وارحب جوفه واعطاه من الدنيا فكان للناس ظلوما فذلك العتل الزنيم واخرج ابن ابي حاتم عن القاسم مولي معاوية وموسي بن عقبة قالا سءل رسول الله صلي الله عليه وسلم عن العتل الزنيم قال هو الفاحش اللءيم واخرج ابو الشيخ وابن مردويه والديلمي عن ابي الدرداء عن رسول الله صلي الله عليه وسلم في قوله بعد ذلك زنيم قال ,False,0911Suyuti.DurrManthur
180388748762,8,Shamela0023578-ara1.completed.ms3214,الجواظ قال كل جماع مناع قلت فما الجعظري قال الفظ الغليظ قلت فما العتل الزنيم قال كل رحب الجوف بءر الحلق اكول شروب غشوم ظلوم اخبرنا ابن فنجويه حدثنا ابن حبش المقري حدثنا ابن زنجويه حدثنا سلمة حدثنا عبد الرزاق اخبرنا معمر عن زيد بن اسلم في قوله زنيم قال قال رسول الله صلي الله عليه وسلم تبكي السماء من رجل اصح الله جسمه وارحب جوفه واعطاه من الدنيا مقضما في المصدر بعضا فكان للناس ظلوما فذلك العتل الزنيم قال وتبكي السماء من الشيخ الزاني ما تكاد الارض تقله وروي الثمالي عن مجاهد في الزنيم قال كانت له ست اصابع في يده في كل ابهام له اصبع زاءدة واكثر العلماء علي ان الزنيم الدعي الشرير وقد ورد في هذا الباب اخبار غراءب نذكر من بعضها وبالله التوفيق اخبرنا الحسن بن محمد بن الحسين بن عبد الله المقري حدثنا محمد بن الحسن بن بشير حدثنا ابن خوصا اخبرنا ابن خنيق حدثنا يوسف بن اسباط عن ابي اسراءيل الملاءي عن فضيل ابن عمر والفقمي عن مجاهد عن ابن عمر عن ابي هريرة عن النبي صلي الله عليه وسلم قال لا يدخل الجنة ولد زني ولا ولده ولا ولد ولده اخبرنا الحسين بن محمد حدثنا محمد بن الحسن بن بشر اخبرنا ابو الحسن احمد بن محمد الطواسعي حدثنا ابو بدر عباد بن الوليد حدثنا حيان بن هلاك حدثنا حماد بن سلمة عن علي بن زيد بن عياض عن عيسي بن حطان عن عبد الله بن عمر ان النبي صلي الله عليه وسلم قال ان اولاد الزني يحشرون يوم القيامة في صورة القردة والخنازير ,False,0427AbuIshaqThaclabi.KashfWaBayan
180388748762,8,Shamela0037458-ara1.ms4532,له زنمة كزنمة الشاة وقيل هو الظلوم وقال ابن عباس له زنمة كزنمة الشاة والعتل هو الدعي والزنيم هو المريب الذي يعرف بالشر وعنه قال الزنيم الدعي وعنه الزنيم الذي يعرف بالشر كما تعرف الشاة بزنمتها وعنه قال هو الرجل يمر علي القوم فيقولون رجل سوء وقال ايضا الزنيم الظلوم وهذه البعدية في الرتبة لا في الخارج قال الشهاب فبعد هنا كثم للتراخي في الرتبة قال ابو السعود وفيه دلالة علي ان دعوته اشد معايبه واقبح قباءحه وقد قيل ان هذه الايات نزلت في الاخنس بن شريق ,False,1307Qannawji.FathBayan
180388748762,8,Shamela0023623-ara1.ms4250,عليه وسلم ولا تطع كل حلاف مهين هماز مشاء بنميم فلم نعرفه حتي نزل عليه بعد ذلك زنيم فعرفناه له زنمة كزنمة الشاة واخرج عبد بن حميد وابن جرير وابن المنذر وابن ابي حاتم عنه قال العتل هو الدعي والزنيم هو المريب الذي يعرف بالشر واخرج عبد بن حميد وابن عساكر عنه قال الزنيم هو الدعي واخرج الفريابي وعبد بن حميد وابن المنذر والحاكم وصححه عنه ايضا قال الزنيم الذي يعرف بالشر كما تعرف الشاة بزنمتها واخرج ابن ابي حاتم عنه قال هو الرجل يمر علي القوم فيقولون رجل سوء واخرج ابن المنذر وابن ابي حاتم عنه ايضا في قوله زنيم قال ظلوم وقد قيل ان هذه الايات نزلت في الاخنس بن شريق وقيل في الوليد بن المغيرة سورة القلم الايات الي انا بلوناهم كما ,False,1250Shawkani.FathQadir
180388748762,8,ShamAY0034054-ara1.ms4097,قال نزل علي النبي صلي الله عليه وسلم ولا تطع كل حلاف مهين هماز مشاء بنميم فلم نعرف حتي نزل عليه بعد ذلك زنيم فعرفناه له زنمة كزغمة الشاة واخرج عبد بن حميد وابن جرير وابن المنذر وابن ابي حاتم عنه قال العتل هو الدعي والزنيم هو المريب الذي يعرف بالشر واخرج عبد بن حميد وابن عساكر عنه قال الزنيم هو الدعي واخرج الفريابي وعبد بن حميد وابن المنذر والحاكم وصححه عنه ايضا قال الزنيم الذي يعرف بالشر كما تعرف الشاة بزنمتها واخرج ابن ابي حاتم عنه قال هو الرجل يمر علي القوم فيقولون رجل سوء واخرج ابن المنذر وابن ابي حاتم عنه ايضا في قوله زنيم قال ظلوم وقد قيل ان هذه الايات نزلت في الاخنس بن شريق وقيل في الوليد بن المغيرة صفحة رقم سورة ن القلم انا بلوناهم كما قوله انا ,False,1281IbnMuhammadShawkani.TafsirFathQadir
180388748762,8,Shamela0008658-ara1.ms2830,قال نزلت في الاخنس بن شريق عن مجاهد في قوله ولا تطع كل حلاف مهين قال هو الاسود بن عبد يغوث قوله تعالي عتل بعد ذلك زنيم عن القاسم مولي معاوية وموسي بن عقبة قالا سءل رسول الله صلي الله عليه وسلم عن العتل الزنيم قال هو الفاحش اللءيم عن ابن عباس قال العتل هو الدعي والزنيم هو المريب الذي يعرف بالشر عن ابن عباس قال الزنيم هو الرجل يمر علي القوم فيقولون رجل سوء عن ابن عباس في قوله عتل بعد ذلك زنيم قال ,False,0327IbnAbiHatimRazi.Tafsir
180388748762,8,Tafsir02091-ara1.ms2136,الجواظ قال الذي جمع ومنع تدعوه لظي نزاعة للشوي قيل وما الجعظري قال الفظ الغليظ قيل وما العتل الزنيم قال الشديد الخلق الرحيب البطن ظلوم للناس قال صلي الله عليه وسلم تبكي السماء من رجل اصح الله جسمه وارحب جوفه واعطاه الدنيا فكان للناس ظلوما فذلك العتل الزنيم قال وتبكي السماء من الشيخ الزاني ما تكاد الارض تقله وعن ابي هريرة رضي الله عنه قال قال رسول الله صلي الله عليه وسلم لا يدخل الجنة ولد الزنا ولا ولده ولا ولد ولده وان اولاد الزناة يحشرون في يوم القيامة في صورة القردة والخنازير وقال صلي الله عليه وسلم ,False,0360Tabarani.TafsirKabir
257698247613,8,Shamela0008362-ara1.ms0018,الباب الثالث والثلاثون في ذكر شء من خبر بني قصي بن كلاب وتوليتهم لما كان بيده من الحجابة والسقاية والرفادة والندوة واللواء والقيادة وتفسير ذلك الباب الرابع والثلاثون في ذكر شء من خبر الفجار والاحابيش الباب الخامس والثلاثون في حلف الفصول وخبر ابن جدعان الذي كان هذا الحلف في داره وذكر اجواد قريش وحكامهم في الجاهلية وتملك عثمان بن الحويرث بن اسد بن عبد العزي بن قصي عليهم وشء من خبره الباب السادس والثلاثون في ذكر فتح مكة المشرفة وفواءد تتعلق بخبر فتحها الباب السابع والثلاثون في ذكر ولاة مكة المشرفة في الاسلام الباب الثامن والثلاثون في ذكر حوادث تتعلق بمكة في الاسلام الباب التاسع والثلاثون في ذكر شء من امطار مكة وسيولها في الجاهلية والاسلام وشء من اخبار الصواعق بمكة وذكر شء من اخبار الغلاء والرخص والوباء الباب الاربعون في ذكر ,False,0832AbuTayyibFasi.ShifaGharam
257698247613,8,Shamela0008362-ara1.ms1010,الباب الحادي والثلاثون في ذكر شء من خبر خزاعة ولاة مكة في الجاهلية الخ ذكر نسبهم ذكر سبب ولاية خزاعة لمكة في الجاهلية ذكر مدة ولاية خزاعة لمكة في الجاهلية ذكر اول من ولي البيت من خزاعة وغير ذلك من خبر جرهم ذكر شء من خبر عمرو بن عامر الذي ينسب اليه خزاعة وشء من خبر بنيه الباب الثاني والثلاثون في ذكر شء من اخبار قريش بمكة في الجاهلية وشء من فضلهم وما وصفوا به وبيان نسبهم وسبب تسميتهم بقريش وابتداء ولايتهم للكعبة وامر مكة ذكر شء من فضلهم وما جاء في انهم خير العرب ما جاء في ان الخلافة لا تزال في قريش ما جاء في عقوبة من عادة قريشا ذكر ما وصفت به بطون قريش ذكر اهل البطاح والظواهر والعارية والعاءدة من قريش قريش العاءدة ذكر بيان نسب قريش ذكر سبب تسمية قريش بقريش وما قيل في ذلك ذكر ابتداء ولاية قريش الكعبة المعظمة ومكة الباب الثالث والثلاثون في ذكر شء من خبر بني قصي بن كلاب توليتهم لما كان بيده من الحجابة والسقاية والرفادة والندوة واللواء والقيادة وتفسير ذلك الباب الرابع والثلاثون في ذكر شء من خبر الفجار والاحابيش ذكر يوم العبلاء ذكر يوم شرب ذكر يوم الحريرة ذكر الفجار الاول وما كان فيه بين قريش عيلان وسبب ذلك ذكر شء من خبر الاحابيش ومحالفتهم لقريش الباب الخامس والثلاثون في حلب الفضول ذكر شء من خبر حلف الفضول ذكر شء من خبر ابن جدعان الذي كان في دار حلف الفضول ذكر شء من خبر اجواد قريش في الجاهلية ذكر الحكام من قريش بمكة في الجاهلية ذكر تملك عثمان بن الحويرث بن اسد بن عبد العزي بن قصي بن كلاب القرشي الاسدي علي قريش بمكة وشء من خبره الباب السادس والثلاثون في ذكر شء من خبر فتح مكة وفواءد تتعلق به ذكر شء من خبر فتح مكة ذكر فواءد تتعلق بفتح مكة الباب السابع والثلاثون في ,False,0832AbuTayyibFasi.ShifaGharam
257698247613,8,Shamela0012062-ara1.ms041,الباب الثامن والعشرون في عهد ابي بكر اليه ووصيته الباب التاسع والعشرون في ذكر خلافته وقول الرسول فيها الباب الثلاثون في ذكر اجتماعهم علي تسميته بامير المءمنين الباب الحادي والثلاثون في ذكر ما خص به في ولايته مما لم يسبق اليه الباب الثاني والثلاثون في اسمه وكنيته ولقبه الباب الثالث والثلاثون في خضابه رضي الله عنه الباب الرابع والثلاثون في خاتمه رضي الله عنه الباب الخامس والثلاثون دعاء الرسول له ان يخرج من صدره الغل الباب السادس والثلاثون في ما ذكر ان الرسول بشره بالجنة الباب السابع والثلاثون في ذكر جمعه الناس في التراويح علي امام الباب الثامن والثلاثون في ذكر فطنته وذكاءه وفراسته الباب التاسع والثلاثون في ذكر اهتمامه برعيته وملاحظته لهم الباب الاربعون ذكر عسسه وما وقع له من ذلك الباب الحادي والاربعون في ذكر ,False,0909IbnCabdHadi.MahdSawab
257698247613,8,JK000083-ara1.ms009,الباب الحادي والثلاثون في ان النساء في الجنة والنار اكثر من الرجال الباب الثاني والثلاثون فيمن يدخل الجنة من هذه الامة بغير حساب وذكر اوصافهم الباب الثالث والثلاثون في ذكر حثيات الرب عز وجل الذين يدخلهم الجنة الباب الرابع والثلاثون في ذكر تربة الجبنة وطينها وحصباءها ونباتها الباب الخامس والثلاثون في ذكر نورها وبياضها الباب السادس والثلاثون في ذكر غرفها وقصورها ومقاصيرها وخيامها الباب السابع والثلاثون في ذكر معرفتهم بمنازلهم ومساكنهم اذا دخلوا الجنة وان لم يروها قبل ذلك الباب الثامن والثلاثون في كيفية دخولهم الجنة وما يستقبلون به عند دخولها الباب التاسع والثلاثون في ذكر صفة اهل الجنة في خلقهم وخلقهم وطولهم ومقادير اسنانهم الباب الاربعون في ,False,0751IbnQayyimJawziyya.HadiArwah
257698247613,8,ShamAY0036795-ara1.ms016,الباب الثامن والعشرون في ذكر مخارج الحروف وهي المواضع التي تنشا منها حروف العربية الباب التاسع والعشرون في ذكر اجناس الحروف واصنافها وصفاتها والقابها الباب الثلاثون في ذكر ما ينبغي للقارء والمقرء الباب الحادي والثلاثون في ذكر سبب اجتماع الناس علي قراءات القراء المعروفين واقتداءهم بهم في امصار المسلمين دون غيرهم الباب الثاني والثلاثون في ذكر الاسانيد التي نقلت لنا قراءات القراء المعروفين بروايات الرواة المشهورين الباب الثالث والثلاثون في ذكر ترجمة اسامي ذوي الاختيار علي سبيل الاختصار الباب الرابع والثلاثون في ذكر كيفية الاستعاذة ومعرفة معانيها زيادة مذكورة في الباب نفسه الباب الخامس والثلاثون في ذكر التسمية الباب السادس والثلاثون في ذكر تغليظ اللام من اسم الله عز وعلا والترقيق الباب السابع والثلاثون في ذكر التامين الباب الثامن والثلاثون في ذكر التكبير الباب التاسع والثلاثون في ذكر سجدات التلاوة الباب الاربعون في ذكر الحاق هاء الاستراحة عند الوقف علي المبينات الباب الحادي والاربعون في ذكر ,False,0500AhmadAndarabi.IdahFiQiraat
