cluster,size,id,text,from_input,book
541166070464,2,Shamela0000041-ara1.completed.ms1443,ولقد جاءهم رسول منهم فكذبوه فاخذهم العذاب وهم ظالمون فكلوا مما رزقكم الله حلالا طيبا واشكروا نعمة الله ان كنتم اياه تعبدون انما حرم عليكم الميتة والدم ولحم الخنزير وما اهل لغير الله به فمن اضطر غير باغ ولا عاد فان الله غفور رحيم ولا تقولوا لما تصف السنتكم الكذب هذا حلال وهذا حرام لتفتروا علي الله الكذب ان الذين يفترون علي الله الكذب لا يفلحون ولقد جاءهم رسول منهم محمد صلي الله عليه وسلم فكذبوه فاخذهم العذاب ,False,0510IbnMascudBaghawi.Tafsir
541166070464,2,Shamela0001394-ara1.ms0847,ولقد جاءهم رسول منهم فكذبوه فاخذهم العذاب وهم ظالمون ولقد جاءهم رسول منهم اي محمد صلي الله عليه وسلم فكذبوه فاخذهم العذاب ,False,0710IbnAhmadHafizDinNasafi.Tafsir
549755839884,2,ShamAY0034055-ara1.ms10747,تعالي بمعني واحد وقال الامام اصل الاستثناء من الثني وهو الكف والرد في التقييد بالشرط رد لانعقاد ذلك اليمين فاطلاقه عليه حقيقة وقيل اي ولا يثنون عما هموا به من منع المساكين والظاهر علي القولين عطفه علي اقسموا فمقتضي الظاهر وما استثنوا وكانه انما عدل عنه اليه استحضار للصورة لما فيها من نوع غرابة لان اللاءق في الحلف علي ما يلزم منه ترك طاعة الاستثناء وفي الكشف هو حال اي غير مستثنين وفي العدول الي المضارع نوع تعبير وتنبيه علي مكان خطءهم وفيه رمز الي ما ذكرنا وقيل المعني ولا يستثنون حصة المساكين كما كان يخرج ابوهم وعليه هو معطوف علي قوله تعالي ليصر منها ومقسم عليه او علي قوله سبحانه مصبحين الحال وهو معني لا غبار عليه فطاف عليها اي احاط نازلا علي الجنة طاءف اي بلاء محيط فهو صفة لمحذوف وقول قتادة طاءف اي عذاب بيان لحاصل المعني ونحوه قول ابن عباس اي امر وعن الفراء تخصيص الطاءف بالامر الذي ياتي بالليل وكان ذلك علي ما قال ابن جريج عنقا من نار خرج من وادي جنتهم وقيل الطاءف هو جبريل عليه السلام اقتلعها وطاف بها حول البلد ثم وضعها قرب مكة حيث مدينة الطاءف اليوم ولذلك سميت بالطاءف وليس في ارض الحجاز بلدة فيها الماء والشجر والاعناب غيرها ولا يصح هذا عندي ,False,1342MahmudShukriAlusi.RawhMacani
549755839884,2,Shia002702Vols-ara1.ms11081,تعالي بمعني واحد وقال الامام اصل الاستثناء من الثني وهو الكف والرد وفي التقييد بالشرط رد لانعقاد ذلك اليمين فاطلاقه عليه حقيقة وقيل اي ولا يتثنون عما هموا به من منع المساكين والظاهر علي القولين عطفه علي اقسموا فمقتضي الظاهر وما استثنوا وكانه انما عدل عنه اليه استحضارا للصورة لما فيها من نوع غرابة لان اللاءق في الحلف علي ما يلزم منه ترك طاعة الاستثناء وفي الكشف هو حال اي غير مستثنين وفي العدول الي المضارع نوع تعبير وتنبيه علي مكان خطءهم وفيه رمز الي ما ذكرنا وقيل المعني ولا يستثنون حصة المساكين كما كان يخرج ابوهم وعليه هو معطوف علي قوله تعالي ليصرمنها ومقسم عليه او علي قوله سبحانه مصبحين الحال وهو معني لا غبار عليه فطاف عليها طاءف من ربك وهم ناءمون فطاف عليها اي احاط نازلا علي الجنة طاءف اي بلاء محيط فهو صفة لمحذوف وقول قتادة طاءف اي عذاب بيان لحاصل المعني ونحوه قول ابن عباس اي امر وعن الفراء تخصيص الطاءف بالامر الذي ياتي بالليل وكان ذلك علي ما قال ابن جريج عنقا من نار خرج من وادي جنتهم وقيل الطاءف هو جبريل عليه السلام اقتلعها وطاف بها حول البلد ثم وضعها قرب مكة حيث مدينة الطاءف اليوم ولذلك سميت بالطاءف وليس في ارض الحجاز بلدة فيها الماء والشجر والاعناب غيرها ولا يصح هذا عندي ,False,1270ShihabDinAlusi.RuhMacani
549755842515,2,SHAM19Y23644-ara1.ms6014,نسيج وحده حالا وظرفا وعلما ومجاهداته فوق الحد وقال سمعت الاستاذ ابا علي الدقاق يقول بلغني انه اكتحل بالملح ليعتاد السهر وكان اذا دخل رمضان جد في الطاعات ويقول هذا شهر ,False,0654SibtIbnJawzi.MiratZaman
549755842515,2,Sham19Y0029560-ara1.ms0863,نسيج وحده حالا وظرفا وعلما ساله بعض الفقهاء عن مسالة في الحيض امتحانا فذكر له فيها ثمانية عشر قولا للعلماء ولم يكن عند ذلك الفقيه من الاقوال سوي ثلاثة قيل تاب في ابتداء امره في مجلس خير النساج ومجاهداته في اول امره فوق الحد وكان يبالغ في تعظيم الشرع واذا دخل رمضان جد في الطاعات ويقول هذا شهر ,False,0947BamakhramaHimyari.QiladatNahr
549755942672,2,Shamela0037458-ara1.ms4962,من خوف حيث قال ابراهيم رب اجعل هذا بلدا امنا قال ابن عباس نهاهم عن الرحلة وامرهم ان يعبدوا رب هذا البيت وكفاهم المءنة وكانت رحلتهم في الشتاء والصيف ولم تكن لهم راحة في شتاء ولا صيف فاطعمهم الله بعد ذلك من جوع وامنهم من خوف وكان ذلك من نعمة الله عليهم وعنه قال امروا ان يالفوا عبادة رب هذا البيت كالفهم رحلة الشتاء والصيف وقد وردت احاديث في فضل قريش وان الناس تبع لهم في الخير والشر وان هذا الامر يعني الخلافة لا يزال فيهم ما بقي منهم اثنان وهي في دواوين الاسلام سورة ارايت ويقال لها سورة الدين وسورة الماعون ,False,1307Qannawji.FathBayan
549755942672,2,Shamela0023623-ara1.ms4631,من خوف حيث قال ابراهيم رب اجعل هذا البلد امنا واخرج ابن جرير وابن مردويه عنه ايضا في قوله لايلاف قريش الاية قال نهاهم عن الرحلة وامرهم ان يعبدوا رب هذا البيت وكفاهم المءنة وكانت رحلتهم في الشتاء والصيف ولم يكن لهم راحة في شتاء ولا صيف فاطعمهم الله بعد ذلك من جوع وامنهم من خوف فالفوا الرحلة وكان ذلك من نعمة الله عليهم واخرج ابن جرير عنه ايضا في الاية قال امروا ان يالفوا عبادة رب هذا البيت كالفهم رحلة الشتاء والصيف وقد وردت احاديث في فضل قريش وان الناس تبع لهم في الخير والشر وان هذا الامر يعني الخلافة لا تزال فيهم ما بقي اثنان وهي في دواوين الاسلام سورة الماعون ويقال سورة الدين ويقال سورة الماعون ,False,1250Shawkani.FathQadir
549755967370,2,Shamela0006624-ara1.ms542,الملك الصالح عسكرا حصروها وتسلموها فاستناب بقلعتها سرخك مملوك ابيه وفيها في المحرم خطب للسلطان طغرل بك بن ارسلان بن طغرل بك بن محمد بن ملك شاه المقيم ببلاد ايلدكز وكان ابوه ارسلان المقدم ذكره قد توفي وفيها في ذي الحجة عبر عضد الدين محمد بن عبد الله بن هبة الله وزير الخليفة دجلة عازما علي الحج فقتله الاسماعيلية وحمل مجروحا الي منزله فمات ومولده سنة اربع عشرة وخمسماءة وفيها توفي صدقة بن الحسين الحداد الذي ذيل تاريخ ابن الزعفراني ببغداد ثم دخلت سنة اربع وسبعين وخمسماءة فيها ارسل صلاح الدين الي شمس الدين محمد بن عبد الملك بن المقدم ليسلم بعلبك الي ,False,0749ZaynDinIbnWardi.Tarikh
549755967370,2,Shamela0012715-ara1.mARkdown.ms0668,الملك الصالح فاستناب بقلعة حارم مملوكا كان لابيه اسمه سرخك وفي هذه السنة في المحرم خطب للسلطان طغريل بن ارسلان بن طغريل ابن السلطان محمد ابن السلطان ملكشاه المقيم ببلاد الدكز وكان ابوه ارسلان الذي تقدم خبره قد توفي ولم يذكر ابن الاثير وفاة ارسلان بن طغريل الا في هذا الموضع وكان ينبغي ان يذكره قبل هذه السنة وفيها في ذي الحجة قتل عضد الدين محمد بن عبد الله بن هبة الله وزير الخليفة وكان قد عبر دجلة عازما علي الحج فقتله الاسماعيلية وحمل مجروحا الي منزله فمات به وكان مولده في جمادي الاولي سنة اربع عشرة وخمسماءة وفيها توفي صدقة بن الحسين الحداد الذي ذيل تاريخ ابن الزعفراني ببغداد ثم دخلت سنة اربع وسبعين وخمسماءة في هذه السنة طلب توران شاه من اخيه السلطان صلاح الدين بعلبك وكان السلطان اعطاها شمس الدين محمد ابن عبد الملك المقدم لما سلم دمشق الي ,False,0732AbuFida.MukhtasarFiAkhbar
549755967373,2,SHAM19Y23644-ara1.ms7568,وفيها توفي سعد بن محمد بن سعد ابو الفوارس بن الصيفي التميمي ويلقب بالحيص بيص كان شاعرا فاضلا مدح الخلفاء والوزراء والاكابر وما خرج عليه هذا الاسم الا لانه لقي الناس في شدة واختلاط فقال ما للناس في حيص بيص فلقب به ومات ببغداد في شعبان وله ديوان مشهور وهو القاءل في ابن طراد من الكامل فتصدعوا متفرقين كانهم مال تفرقه يد ابن طراد وقال من الرمل لا تلمني في شقاءي بالعلا رغد العيش لربات الحجال سيف عز زانه رونقه فهو بالطبع غني عن صقال ,False,0654SibtIbnJawzi.MiratZaman
549755967373,2,Shamela0006624-ara1.ms542,وفيها توفي سعد بن محمد بن سعد الحيص بيص الشاعر ولله قوله لا تلمني في شقاءي بالعلا وغد العيش لربات الحجال سيف عز زانه رونقه فهو بالطبع غني عن صقال ,False,0749ZaynDinIbnWardi.Tarikh
549755986982,2,Shamela0006624-ara1.ms172,وشبل عليه بالزني ولم يفصح زياد وقال عمر قبل ان يشهد اري رجلا ارجو ان لا يفضح الله به رجلا من اصحاب رسول الله صلي الله عليه وسلم فقال زياد رايته جالسا بين رجلي امراة ورايت رجلين مرفوعتين كاذني حمار ونفسا يعلو واستا ينبو عن ذكر ولا اعرف ما وراء ذلك فقال عمر هل رايت الميل في المكحلة قال لا قال فهل تعرف المراة لا ولكن اشبهها فجلد الشهود الثلاثة حد القذف وزياد اخو ابي بكرة لامه فلم يكلمه ابو بكرة بعدها وفيها فتح المسلمون الاهواز من يد الهرمزان من عظماء الفرس وفتحوا رامهرمز وتستر ثم نزل الهرمزان من القلعة علي حكم عمر فارسل مع وفد منهم انس بن مالك والاحنف بن قيس فوصلوا به المدينة وقد البسوه الديباج المذهب وعلي راسه تاجه مكللا بالياقوت فوجدوا عمر ناءما بالمسجد وليس له حرس ولا حجاب فاستيقظ للجبلة وقال له الله الذي اذل بالاسلام هذا واشباهه ونزع ما عليه والبس ثوبا صفيفا ثم قال له كيف رايت عاقبة الغدر وعاقبة امر الله فقال الهرمزان نحن واياكم ,False,0749ZaynDinIbnWardi.Tarikh
549755986982,2,Shamela0012715-ara1.mARkdown.ms0219,وشبل علي المغيرة بالزنا واما زياد بن ابيه فلم يفصح شهادة الزنا وكان عمر قد قال قبل ان يشهد اري رجلا ارجو ان لا يفضح الله به رجلا من اصحاب رسول الله صلي الله عليه وسلم فقال زياد رايته جالسا بين رجلي امراة ورايت رجلين مرفوعتين كاذني حمار ونفسا يعلو واستا تنبو عن ذكر ولا اعرف ما وراء ذلك فقال عمر هل رايت الميل في المكحلة قال لا فقال هل تعرف المراة قال لا ولكن اشبهها فامر عمر بالثلاثة الذين شهدوا بالزنا ان يحدوا حد القذف فجلدوا وكان زياد اخا ابي بكرة لامه فلم يكلمه ابو بكرة بعدها وفيها فتح المسلمون الاهواز وكان قد استولي عليها الهرمزان وكان من عظماء الفرس ثم فتحوا رام هرمز وتستر وتحصن الهرمزان في القلعة وحاصروه فطلب الصلح علي حكم عمر فانزل علي ذلك وارسلوا به الي عمر ومعه وفد منهم انس بن مالك والاحنف بن قيس فلما وصلوا به الي المدينة البسوه كسوته من الديباج المذهب ووضعوا علي راسه تاجه وهو مكلل بالياقوت ليراه عمر والمسلمون فطلبوا عمر فلم يجدوه فسالوا عنه فقيل جالس في المسجد فاتوه وهو ناءم فجلسوا دونه فقال الهرمزان اين هو عمر قالوا هوذا قال فاين حرسه وحجابه قالوا ليس له حارس ولا حاجب واستيقظ عمر علي جلبة الناس فنظر الي الهرمزان وقال الحمد لله الذي اذل بالاسلام هذا واشباهه وامر بنزع ما عليه فنزعوه والبسوه ثوبا ضيقا فقال له عمر كيف رايت عاقبة الغدر وعاقبة امر الله فقال الهرمزان نحن واياكم ,False,0732AbuFida.MukhtasarFiAkhbar
549756009230,2,Sham19Y0020891-ara1.ms5794,وهو ننتقم ولا يصح ان ينتصب ب منتقمون لان ان تحجب عن ذلك وقرء نبطش بضم الطاء وقرا الحسن نبطش بضم النون كانه يحمل الملاءكة علي ان يبطشوا بهم ,False,0743SharafDinTibi.FutuhGhayb
549756009230,2,ShamAY0034052-ara1.ms2120,وهو ننتقم ولا يصح ان ينتصب بمنتقمون لان ان تحجب عن ذلك وقرء نبطش بضم الطاء وقرا الحسن نبطش بضم النون كانه يحمل الملاءكة علي ان يبطشوا بهم ,False,0538JarAllahZamakhshari.Kashshaf
558345807032,2,Shia002185Vols-ara1.completed.ms3260,امراة ولدها النبي صلي الله عليه واله وابو بكر وعمر وعثمان وعلي وطلحة والزبير وهي عاءشة بنت محمد بن عبد الله بن عمر بن عثمان بن عفان وامها خديجة بنت عثمان بن عروة بن الزبير وام عروة اسماء ذات النطاقين بنت ابي بكر الصديق وام محمد بن عبد الله بن عمرو بن عثمان وهو المدبج فاطمة بنت الحسين بن علي عليه السلام وام الحسين بن علي عليه السلام فاطمة بنت رسول الله صلي الله عليه واله وام فاطمة بنت الحسين بن علي عليهما السلام ام اسحاق بنت طلحة بن عبد الله ,False,0656IbnAbiHadid.SharhNahjBalagha
558345807032,2,JK001210-ara1.ms036,امراة ولدها رسول الله صلي الله عليه وسلم وابو بكر وعمر وعثمان وعلي وطلحة والزبير والحسين وابن عمر سواها اما ولادة رسول الله صلي الله عليه وسلم لها فان ام ابيها فاطمة بنت الحسين بن علي وام الحسين فاطمة بنت رسول الله صلي الله عليه وسلم ومن طريق الحسين بن علي ولادته لها وولادة علي لها واما ولادة ابي بكر لها فان امها خديجة بنت عثمان بن عروة بن الزبير وام عروة اسماء بنت ابي بكر الصديق ومن طريق عروة ولدها الزبير واما ولادة عمر لها فان ام جدها عبد الله زينب بنت عبد الله بن عمر بن الخطاب فمن هذه الطريق ولادة عمر لها واما ولادة عثمان لها فمن طريق ابيها واما ولادة طلحة فان جدتها من قبل ابيها هي ام اسحاق بنت طلحة بن عبيد الله ,False,0597IbnJawzi.Mudhish
558345856790,2,Shamela0035100-ara1.mARkdown.ms04581,احمد بن ابي الاصبغ وقلد عمر بن عبد العزيز ابن ابي دلف اصبهان واسرع الانصراف من غلاء السعر فقدم بغداد في رمضان ثم خرج في ذي القعدة الي الموصل عامدا لحمدان بن حمدون بن الحارث بن منصور بن لقمان وهو جد ناصر الدولة وكان قد بلغ المعتضد انه يميل الي هارون الشاري الخارجي وكانت الاعراب والاكراد ,False,0748Dhahabi.TarikhIslam
558345856790,2,Shamela0009783BK1-ara1.mARkdown.ms4770,احمد بن ابي الاصبغ ونفقات عسكره والضياع بالري الحسين بن عمرو النصراني وقلد عمر بن عبد العزيز بن ابي دلف اصبهان ونهاوند والكرج وتعجل للانصراف من اجل غلاء السعر وقله الميرة فوافي بغداد يوم الاربعاء لثلاث خلون من شهر رمضان وفيها استامن الحسن بن علي كوره عامل رافع علي الري الي علي بن المعتضد في زهاء الف رجل فوجهه الي ابيه المعتضد وفيها دخل الاعراب سامرا فاسروا ابن سيما انف في ذي القعده منها وانتهبوا ذكر خبر الوقعه بين الاكراد والاعراب ولست ليال بقين من ذي القعده خرج المعتضد الخرجه الثانيه الي الموصل عامدا لحمدان بن حمدون وذلك انه بلغه انه مايل هارون الشاري الوازقي ودعا له فورد كتاب المعتضد من كرخ جدان علي نجاح الحرمي الخادم بالوقعه بينه وبين الاعراب والاكراد ,False,0310Tabari.Tarikh
558345856792,2,Shamela0035100-ara1.mARkdown.ms04581,وكانت الاعراب والاكراد قد تجمعوا وتحالفوا انهم يقتلون علي دم واحد فالتقوا علي الزاب فحمل عليهم المعتضد فمزق شملهم فكان من غرق اكثر ممن قتل ثم سار الي ماردين وبها حمدان فهرب منها وخلف بها ابنه فنازلها المعتضد فحاربه من كان بها فلما كان من الغد ركب المعتضد ودنا من باب القلعة ,False,0748Dhahabi.TarikhIslam
558345856792,2,Shamela0009783BK1-ara1.mARkdown.ms4770,وكانت الاعراب والاكراد لما بلغهم خروج المعتضد تحالفوا انهم يقتلون علي دم واحد واجتمعوا وعبوا عسكرهم ثلاثة كراديس كردوسا دون كردوس وجعلوا عيالاتهم واولادهم في اخر كردوس وتقدم المعتضد عسكره في خيل جريدة فاوقع بهم وقتل منهم وغرق في الزاب منهم خلق كثير ثم خرج الي الموصل عامدا لقلعه ماردين وكانت في يد حمدان ابن حمدون فلما بلغه مجء المعتضد هرب وخلف ابنه بها فنزل عسكر المعتضد علي القلعة فحاربهم من كان فيها يومهم ذلك فلما كان من الغد ركب المعتضد فصعد القلعة ,False,0310Tabari.Tarikh
558345863523,2,JK009266-ara1.ms8062,قوم اخرون الفرقان ومنهم من كان يقول انه مجنون والجن يلقون عليه هذه الكلمات حال ما يعرض له الغشي وقرا زيد بن علي معلم بكسر اللام قوله انا كاشفوا العذاب قليلا اي عذاب الجوع قليلا نعت لزمان او المصدر محذوف اي كشفوا قليلا او زمانا قليلا يعني يسيرا انكم عاءدون اي كما نكشف العذاب عنكم تعودون في الحال الي ما كنتم عليه من الشرك ,False,0800IbnCadilHanbali.LubabFiCulumKitab
558345863523,2,Shamela0023635-ara1.ms8090,قوم اخرون الفرقان ومنهم من كان يقول انه مجنون والجن يلقون عليه هذه الكلمات حال ما يعرض له الغشي ثم قال تعالي انا كاشفوا العذاب قليلا انكم عاءدون اي كما يكشف العذاب عنكم تعودون في الحال الي ما كنتم عليه من الشرك ,False,0606FakhrDinRazi.MafatihGhayb
558345874910,2,Shia002382Vols-ara1.ms2426,اصحابه مناع للخير قال الخير امير المءمنين عليه السلام معتد قال اي اعتدي عليه عتل بعد ذلك زنيم قال العتل العظيم الكفر والزنيم الدعي ان كان ذا مال وبنين لان كان متمولا مستظهرا بالبنين وهو اما متعلق ب لا تطع او بما بعده وقرء ان كان علي الاستفهام سنسمه علي الخرطوم انا بلوناهم كما بلونا اصحب الجنة اذ اقسموا ليصرمنها مصبحين ولا يستثنون فطاف عليها طاءف من ربك وهم ناءمون اذا تتلي عليه اياتنا قال اساطير الاولين اي اكاذيبهم قاله من فرط غروره سنسمه علي الخرطوم علي الانف قيل وقد اصاب انف الوليد جراحة يوم بدر فبقي علي اثره وقيل انه كناية عن ان يذله غاية الاذلال كقولهم جدع انفه ورغم انفه والقمي اذا تتلي عليه قال كني عن الثاني قال اساطير الاولين اي اكاذيب الاولين سنسمه علي الخرطوم قال في الرجعة اذا رجع امير المءمنين عليه السلام ويرجع اعداءه فيسمهم بميسم معه كما يوسم البهاءم علي الخراطيم الانف والشفتان اقول وقد مضي بيانه في تفسير دابة الارض في سورة النمل انا بلوناهم اختبرنا اهل مكة بالقحط كما بلونا اصحب الجنة اصحاب البستان الذي كان بدون صنعا القمي عن الباقر عليه السلام ان اهل مكة ابتلوا بالجوع كما ابتلي اصحاب الجنة وهي جنة كانت في الدنيا وكانت باليمن يقال لها الرضوان علي تسعة اميال من صنعاء اذ اقسموا ليصرمنها مصبحين ليقطعنها وقت الصباح ولا يستثنون ولا يقولون ان شاء الله وانما سمي استثناء لما فيه من الاخراج ,False,1091MuhammadMuhsinFaydKashani.TafsirSafi
