cluster,size,id,text,from_input,book
60129671994,2,Shamela0012396-ara1.completed.ms0843,فاتخذت ذلك علينا حجة وظننت انا انما ذكرنا اباك وفضلناه للتقدمة منا له علي حمزه والعباس وجعفر وليس ذلك كما ظننت ولكن خرج هءلاء من الدنيا سالمين متسلما منهم مجتمعا عليهم بالفضل وابتلي ابوك بالقتال والحرب فكانت بنو اميه تلعنه كما يلعن الكفرة في الصلاة المكتوبة فاحتججنا له وذكرناهم فضله وعنفناهم و ظلمناهم فيما نالوا منه ولقد علمت ان مكرمتنا في الجاهلية سقاية الحجيج الاعظم وولاية بءر زمزم فصارت للعباس من بين اخوته فنازعنا فيها ابوك فقضي لنا عليه عمر فلم نزل نليها في الجاهلية والاسلام ولقد قحط اهل المدينة فلم يتوسل عمر الي ربه ولم يتقرب اليه الا بابينا حتي نعشهم الله وسقاهم الغيث به وابوك حاضر لم يتوسل به ولقد علمت انه لم يبق احد من بني عبد المطلب بعد النبي صلي الله عليه غيره وكان وارثه من عمومته ثم طلب هذا الامر غير واحد من بني هاشم فلم ينله الا ولده فالسقاية سقايته وميراث النبي صلي الله عليه ,False,0421Miskawayh.Tajarib
60129671994,2,Shamela0012320-ara1.completed.ms2066,فاتخذت ذلك علينا حجة وظننت انا بما ذكرنا من فضل علي قدمناه علي حمزة والعباس وجعفر كل اولءك مضوا سالمين مسلما منهم وابتلي ابوك بالدماء ولقد علمت ان ماثرنا في الجاهلية سقاية الحجيج الاعظم وولاية زمزم وكانت للعباس من دون اخوته فنازعنا فيها ابوك الي عمر فقضي لنا عمر بها وتوفي رسول الله صلي الله عليه وسلم وليس من عمومته احد حيا الا العباس وكان وارثه دون عبد المطلب وطلب الخلافة غير واحد من بني هاشم فلم ينلها الا ولده فاجتمع للعباس انه ابو رسول الله صلي الله عليه ,False,0808IbnKhaldun.Tarikh
60129671995,2,Shamela0012320-ara1.completed.ms2066,في منتصف رمضان سنة خمس واربعين ولحق ابنه علي بالسند الي ان هلك هناك واختفي ابنه الاخر عبد الله الاشتر الي ان هلك في اخبار طويلة قد استوفيناها كلها في اخبار ابي جعفر المنصور ورجع عيسي الي المنصور فجهزه لحرب ابراهيم اخي محمد بالعيرة فقاتله اخر ذي القعدة من تلك السنة فهزمه ,False,0808IbnKhaldun.Tarikh
60129671995,2,JK001325-ara1.completed.ms0131,في منتصف رمضان سنة خمس واربعين وماءة وقتل معه جماعة من اهل بيته واصحابه ولحق ابنه علي بن محمد بالسند الي ان هلك هناك واختفي ابنه الاخر عبد الله الاشتر الي ان هلك ايضا في خبر طويل ثم خرج ابراهيم بن عبد الله اخو المهدي المذكور بالبصرة عقب ذلك فبعث اليه المنصور عيسي بن موسي المذكور انفا فقاتله اخر ذي القعدة من السنة فانهزم ابراهيم ,False,1315Salawi.IstiqsaLiAhkbar
60129671997,6,Shamela0008505-ara1.mARkdown.ms621,يعلنون اباك في ادبار الصلاة المكتوبة كما تلعن الكفرة فعنفناهم وكفرناهم وبينا فضله واشدنا بذكره فاتخذت ذلك علينا حجة وظننت انا لما ذكرنا من فضل علي انا قدمناه علي حمزة والعباس وجعفر كل اولءك مضوا سالمين مسلما منهم وابتلي ابوك بالدماء ,False,0285IbnYazidMubarrad.KamilFiLugha
60129671997,6,Shamela0010646-ara1.ms0792,يلعنون اباك في ادبار الصلوات المكتوبة كما تلعن الكفرة فعنفناهم وكفرناهم وبينا فضلكم واشدنا بذكركم فاتخذت ذلك حجة علينا وظننت انا لما ذكرنا من فضل علي انا قدمناه علي حمزة والعباس وجعفر كل اولءك مضوا سالمين مسلما منهم وابتلي ابوك بالدماء ,False,0562IbnHamdun.TadhkiraHamduniyya
60129671997,6,Shia002185Vols-ara1.completed.ms2299,يلعنون اباك في ادبار الصلوات المكتوبات كما تلعن الكفرة فعنفناهم وكفرناهم وبينا فضله واشدنا بذكره فاتخذت ذلك علينا حجة وظننت انه لما ذكرناه من فضله انا قدمناه علي حمزة والعباس وجعفر اولءك مضوا سالمين مسلمين منهم وابتلي ابوك بالدماء ,False,0656IbnAbiHadid.SharhNahjBalagha
60129671997,6,Shamela0012320-ara1.completed.ms2066,يلعنون اباك في ادبار كل صلاة مكتوبة كما يلعن الكفرة فسفهناهم وكفرناهم وبينا فضله واشدنا بذكره فاتخذت ذلك علينا حجة وظننت انا بما ذكرنا من فضل علي قدمناه علي حمزة والعباس وجعفر كل اولءك مضوا سالمين مسلما منهم وابتلي ابوك بالدماء ,False,0808IbnKhaldun.Tarikh
60129671997,6,Shamela0009429-ara1.mARkdown.ms0177,يلعنون اباك في اديار الصلاة المكتوبة كما تلعن الكفرة فمنعناهم وكفرناهم وبينا فضله واشدنا بذكره فاتخذت ذلك علينا حجة وظننت انا بما ذكرنا من فضل علي قدمناه علي حمزة والعباس وجعفر كل اولءك مضوا سالمين سلما منهم وابتلي ابوك بالكرماء ,False,0821Qalqashandi.SubhAcsha
60129671997,6,Shamela0006617-ara1.completed.ms1577,يلعنون اباك في ادبار كل صلاة مكتوبة كما تلعن الكفرة فعفناهم وكفرناهم وبينا فضله واشدنا بذكره فاتخذت ذلك علينا حجة وظننت انا بما ذكرنا من فضل علي انا قدمناه علي حمزة والعباس وجعفر كل اولءك مضوا سالمين مسلما منهم وابتلي ابوك بالدماء ,False,1269CabdMalikCasimi.SamtNujum
60129678549,5,Shamela0007891-ara1.ms0617,الخطبة قال الشافعي ويكون كلامه قصيرا بليغا جامعا واقل ما يقع عليه اسم الخطبة ان يحمد الله ويصلي علي النبي صلي الله عليه وسلم ويوصي بتقوي الله هذه الثلاث فرض في الخطبتين جميعا ويجب ان يقرا في الاولي اية من القران ويدعو للمءمنين في الثانية فلو ترك واحدا من هذه الخمس لا تصح جمعته عند الشافعي رحمه الله ,False,0510IbnMascudBaghawi.SharhSunna
60129678549,5,Shamela0000041-ara1.completed.ms2598,واقل ما يقع عليه اسم الخطبة ان يحمد الله ويصلي علي النبي صلي الله عليه وسلم ويوصي بتقوي الله هذه الثلاثة فرض في الخطبتين جميعا ويجب ان يقرا في الاولي اية من القران ويدعو للمءمنين في الثانية فلو ترك واحدة من هذه الخمس لا تصح جمعته عند الشافعي وذهب ابو حنيفة رضي الله عنه ,False,0510IbnMascudBaghawi.Tafsir
60129678549,5,Shamela0023628-ara1.completed.ms3449,الخطبة عند الشافعي في احد القولين واقل ما يقع عليه اسم الخطبة ان يحمد الله ويصلي علي النبي صلي الله عليه وسلم ويوصي بتقوي الله هذه الثلاث شروط في الخطبتين ,False,0741KhazinBaghdadi.LubabTawil
60129678549,5,ShamAY0034073-ara1.ms5367,ان يحمد الله تعالي ويصلي علي النبي صلي الله عليه وسلم ويوصي بتقوي الله تعالي هذه الثلاثة واجبة في الخطبتين معا ويجب ان يقرا في الاولي اية من القران وفي الثانية ان يدعو للمءمنين فلو ترك واحدة من هذه الخمس لم تصح الخطبة عند الشافعي رضي الله عنه ,False,0885BurhanDinBiqaci.NazmDurar
60129678549,5,Tafsir02096-ara1.ms2069,الخطبة عند الشافعي في احد القولين واقل ما يقع عليه اسم الخطبة ان يحمد الله تعالي ويصلي علي النبي صلي الله عليه وسلم ويوصي بتقوي الله هذه الثلاث شروط في الخطبتين جميعا ويجب ان يقرا في الاول اية من القران ويدعو المءمنين في الثانية ولو ترك واحدة من هذه الخمسة لم تصح خطبته ولا جمعته عند الشافعي ,False,1241IbnMuhammadKhalwatiSawi.HashiyaCalaTafsirJalalayn
60129682668,6,Sham19Y0013231-ara1.ms2632,فكلوا مما رزقكم الله الاية قال ابن عباس فكلوا يا معشر المءمنين مما رزقكم الله يريد من الغناءم وقال الكلبي ان رءساء اهل مكة كلموا رسول الله صلي الله عليه وسلم حين جهدوا قالوا عاديت الرجال فما بال النساء والصبيان وكانت الميرة قد قطعت عنهم بامر رسول الله صلي الله عليه وسلم فاذن في الحمل اليهم فحمل اليهم الطعام فقال الله تعالي فكلوا مما رزقكم الله الاية والقول ما قاله ابن عباس يدل عليه قوله بعد هذه الاية انما حرم عليكم الميتة ,False,0468IbnAhmadWahidiNaysaburi.TafsirBasit
60129682668,6,Shamela0023635-ara1.ms5606,مما رزقكم الله ان كنتم اياه تعبدون يعني ان ذلك الجوع انما كان بسبب كفركم فاتركوا الكفر حتي تاكلوا فلهذا السبب قال فكلوا مما رزقكم الله قال ابن عباس رضي الله عنهما فكلوا يا معشر المسلمين مما رزقكم الله يريد من الغناءم وقال الكلبي ان رءساء مكة كلموا رسول الله صلي الله عليه وسلم حين جهدوا وقالوا عاديت الرجال فما بال النسوان والصبيان وكانت الميرة قد قطعت عنهم بامر رسول الله صلي الله عليه وسلم فاذن في حمل الطعام اليهم فحمل اليهم العظام فقال الله تعالي فكلوا مما رزقكم الله حلالا طيبا والقول ما قال ابن عباس رضي الله ,False,0606FakhrDinRazi.MafatihGhayb
60129682668,6,Shamela0023613-ara1.ms2865,ذلك الجوع بسبب كفركم فاتركوا الكفر فكلوا مما رزقكم الله من الغناءم فاكل الغناءم مسبب عن ترك الكفر فلذلك وصله بالفاء وقال الكلبي ان رءساء مكة كلموا رسول الله صلي الله عليه وسلم حين جهدوا وقالوا عاديت الرجال فما بال النساء والصبيان وكانت الميرة قد قطعت عنهم باذن رسول الله صلي الله عليه وسلم فاذن في الحمل فحمل الطعام اليهم فذلك قوله فكلوا ورجح قول ابن عباس بانه تعالي قال بعد ذلك انما حرم عليكم الميتة فالمراد انكم لما امنتم وتركتم الكفر فكلوا الحلال الطيب وهو الغنيمة واتركوا الخباءث وهو الميتة والدم او ,False,0730NizamDinNaysaburi.GharaibQuran
60129682668,6,ShamAY0034068-ara2.ms1546,قال تعالي فكلوا اي ايها المءمنون مما رزقكم الله قال ابن عباس يريد من الغناءم وقال الكلبي ان رءوساء مكة كلموا رسول الله صلي الله عليه وسلم حين جهدوا وقالوا عاديت الرجال فما بال النساء والصبيان وكانت الميرة قد قطعت عنهم فاذن في الحمل اليهم فحمل الطعام اليهم فقال الله تعالي كلوا مما رزقكم الله وقال الرازي والقول ما قال ابن عباس يدل عليه قوله تعالي بعد هذه الاية انما حرم عليكم الميتة يعني انكم لما امنتم وتركتم الكفر فكلوا مما رزقكم الله حلالا طيبا وهو الغنيمة واتركوا الخباءث وهي الميتة والدم ولما امرهم تعالي باكل الحلال امرهم بشكر النعمة بقوله تعالي واشكروا نعمت الله ان كنتم اياه تعبدون ,False,0977KhatibShirbini.SirajMunir
60129682668,6,Zaydiyya0000295Vols-ara1.ms1545,مما رزقكم الله يعني ذلك الجوع كان سبب كفركم فاتركوا الكفر حتي تاكلوا فلهذا السبب قال فكلوا مما رزقكم الله لما وعظهم بما ذكر من حال القرية وصل ذلك بالفاء قال ابن عباس فكلوا يا معشر المءمنين مما رزقكم الله يريد من الغناءم وقال الكلبي ان رءوساء مكة كلموا رسول الله صلي الله عليه واله وسلم حين جهدوا وقالوا عاديت الرجال فما بال النسوان والصبيان وكانت الميرة قد قطعت عنهم بامر رسول الله صلي الله عليه واله وسلم فاذن لهم في الحمل اليهم فجمل اليهم الطعام فقال تعالي فكلوا مما رزقكم الله حلالا طيبا اي من الحلال الطيب نهي لهم عن افعال الجاهلية ومذاهبهم الرديءة في التحليل والتحريم واشكروا نعمة الله ان كنتم اياه تعبدون ,False,1062CabdAllahSharafi.MasabihSatica
60129682668,6,Shia002702Vols-ara1.ms05704,فكلوا انتم يا معشر المءمنين مما رزقكم الله تعالي من الغناءم مما لا يليق بشان التنزيل اه وتعقب بانه بعد ما فسر العذاب بالعذاب المستاصل للشافة كيف يراد به ما وقع في بدر وما بقي منهم اضعاف ما ذهب وان كان مثل ذلك كافيا في الاستءصال فليكن المحذر والمامور الباقي منهم وما ذكره عن الواحدي من توجيه خطاب الامر بالاكل للمءمنين رواه الامام عن ابن عباس رضي الله تعالي عنهما ثم نقل عن الكلبي ما يستدعي ان الخطاب لاهل مكة حيث قال ان رءساء مكة كلموا رسول الله صلي الله عليه وسلم حين جهدوا وقالوا عاديت الرجال فما بال الصبيان والنساء وكانت الميرة قد قطعت عنهم بامر رسول الله صلي الله عليه وسلم فاذن في الحمل اليهم فحمل الطعام اليهم فقال الله تعالي فكلوا مما رزقكم الله الخ ثم قال والقول ما قال ابن عباس يدل عليه قوله تعالي فيما بعد انما حرم عليكم الميتة البقرة الخ يعني انكم لما امنتم وتركتم الكفر فكلوا الحلال الطيب وهو الغنيمة وارتكوا الخباءث وهو الميتة والدم اه ,False,1270ShihabDinAlusi.RuhMacani
60129690729,2,Shamela0021821-ara1.ms1767,مثقلون الطور اثقلهم ذلك الغرم الذي تسالهم فمنعهم ذلك عن الاسلام قال قتادة يقول هل سالت هءلاء القوم اجرا فجهدهم فلا يستطيعون الاسلام ام عندهم الغيب الطور قال قتادة هذا جواب لقولهم نتربص به ريب المنون الطور يقول الله تعالي اعندهم الغيب حتي علموا ان محمدا يموت قبلهم فهم يكتبون قال ابن ,False,0468IbnAhmadWahidiNaysaburi.WasitFiTafsir
60129690729,2,Shamela0023623-ara1.ms3965,مثقلون اي مجهودون بحملهم ذلك المغرم الثقيل قال قتادة يقول هل سالت هءلاء القوم اجرا يجهدهم فلا يستطيعون الاسلام ام عندهم الغيب فهم يكتبون اي بل ايدعون ان عندهم علم الغيب وهو ما في اللوح المحفوظ فهم يكتبون للناس ما ارادوا من علم الغيب قال قتادة هذا جواب لقولهم نتربص به ريب المنون يقول الله ام عندهم الغيب حتي علموا ان محمدا يموت قبلهم فهم يكتبون قال ابن ,False,1250Shawkani.FathQadir
60129691544,2,Kraken210528115855-ara1.ms098,سنة ثلاث وتسعين واربعماءة فيها قدم الي مصر خلق كثير من البلاد الشامية فرارا من الفرنج والغلاء وعم جميع البلاد الوباء ومات بمصر خلق كثير وفيها مات قاضي القضاة ابو الطاهر محمد بن رجا وتولي مكانه ابو الفرج محمد بن ے جوهر بن ذكا النابلسي ,True,0677IbnMuyassar.AkhbarMisr
60129691544,2,Shamela0000176-ara1.completed.ms416,سنة ثلاث وتسعين واربعماءة فيها رحل عالم لا يحصي عددهم من البلاد الشامية فرارا من الفرنج والغلاء وفيها عم الغلاء اكثر البلاد ومات من اهل مصر خلق كثير وفيها مات قاضي القضاة ابو الطاهر محمد بن رجاء وتولي بعده ابو الفرج محمد ابن جوهر بن ذكا النابلسي ,True,0845Maqrizi.ItticazHunafa
60129691545,2,Kraken210528115855-ara1.ms098,سنة اربع وتسعين واربعماءة في شعبان اخرج الافضل عسكرا كثيفا للقاء الفرنج فوصل الي عسقلان في اول رمضان فاقام فيها الي ذي الحجة فنهض اليه من الفرنج الف فارس وعشرة الاف راجل ,False,0677IbnMuyassar.AkhbarMisr
60129691545,2,Shamela0000176-ara1.completed.ms417,سنة اربع وتسعين واربعماءة في شعبان جهز الافضل عسكرا كثيفا لغزو الفرنج فساروا الي عسقلان ووصلوا اليها في اول رمضان فاقاموا بها الي ذي الحجة فنهض اليهم من الفرنج الف فارس وعشرة الاف راجل ,False,0845Maqrizi.ItticazHunafa
60129693572,5,JK000462-ara1.ms324,فاذاقها الله لباس الجوع عذبهم الله بالجوع سبع سنين والخوف من سرايا النبي صلي الله عليه وسلم التي كان يبعثهم اليهم فيطوفون بهم بما كانوا يصنعون من تكذيب النبي صلي الله عليه وسلم واخراجه من مكة النحل ولقد جاءهم رسول ولقد جاءهم يعني اهل مكة رسول منهم من نسبهم يعرفونه باصله ونسبه فكذبوه فاخذهم العذاب يعني الجوع النحل فكلوا مما رزقكم فكلوا يا معشر المءمنين مما رزقكم الله من الغناءم وهذه الاية والتي بعدها سبق تفسيرهما في سورة البقرة النحل ولا تقولوا لما ولا تقولوا لما تصف السنتكم الكذب اي لوصف السنتكم الكذب والمعني لا تقولوا لاجل الكذب وسببه لا لغيره ,False,0468IbnAhmadWahidiNaysaburi.WajizFiTafsir
60129693572,5,Shamela0021821-ara1.ms1003,النحل قال المفسرون عذبهم الله بالجوع سبع سنين حتي اكلوا الجيف والعظام المحرقة قال ابن قتيبة لباس الجوع والخوف النحل ما ظهر عليهم من سوء اثارهم بالضمر والشحوب وتغير الحال ومعني فاذاقها الله لباس الجوع والخوف النحل عرفها سوء اثرهما وقد يستعمل الذوق في المعرفة يقال ذقت ما عند فلان اذا جربته وعرفته ويقال اركب هذا الفرس تذقه اي تعرف ما عنده من الجري ومنه قول الشماخ يصف قوسا فذاق فاعطته من اللين جانبا كفاف لها ان يعزق السهم حاجزا والمراد بالخوف خوفهم من النبي صلي الله عليه وسلم ومن السرايا التي كان يبعثهم اليهم فيطوفون بهم وروي عن ابي عمرو بنصب الخوف حملا علي الاذاقة والكلام في الاية خرج علي القرية والمراد اهلها يدل علي هذا قوله بما كانوا يصنعون النحل فعاد الكلام الي اهل القرية قال ابن عباس يريد بفعلهم بالنبي صلي الله عليه وسلم حيث كذبوه واخرجوه من مكة وما هموا به من قتله ولقد جاءهم يعني اهل مكة رسول منهم من نسبهم فكذبوه فاخذهم العذاب النحل يعني الجوع في قول ابن عباس وقال مجاهد يعني القتل ببدر ثم خاطب المءمنين فقال فكلوا مما رزقكم الله حلالا طيبا واشكروا نعمت الله ان كنتم اياه تعبدون انما حرم عليكم الميتة والدم ولحم الخنزير وما اهل لغير الله به فمن اضطر غير باغ ولا عاد فان الله غفور رحيم ولا تقولوا لما تصف السنتكم الكذب هذا حلال وهذا حرام لتفتروا علي الله الكذب ان الذين يفترون علي الله الكذب لا يفلحون متاع قليل ولهم عذاب اليم النحل فكلوا يا معشر المءمنين مما رزقكم الله النحل من الغناءم حلالا طيبا وهذه الاية والتي بعدها مفسرة في البقرة قوله ولا تقولوا لما تصف السنتكم الكذب سورة النحل اي لاجل وصفكم الكذب والمعني انكم تحلون وتحرمون لاجل الكذب لا لغيره ,False,0468IbnAhmadWahidiNaysaburi.WasitFiTafsir
60129693572,5,Shamela0023635-ara1.ms5606,بما كانوا يصنعون قال ابن عباس يريد بفعلهم بالنبي صلي الله عليه وسلم حين كذبوه واخرجوه من مكة وهموا بقتله قال الفراء ولم يقل بما صنعت ومثله في القران كثير ومنه قوله تعالي فجاءها باسنا بياتا او هم قاءلون الاعراف ولم يقل قاءلة وتحقيق الكلام انه تعالي وصف القرية بانها مطمءنة ياتيها رزقها رغدا فكفرت بانعم الله فكل هذه الصفات وان اجريت بحسب اللفظ علي القرية الا ان المراد في الحقيقة اهلها فلا جرم قال في اخر الاية بما كانوا يصنعون والله اعلم سورة النحل الايات الي ولقد جاءهم رسول منهم فكذبوه فاخذهم العذاب وهم ظالمون فكلوا مما رزقكم الله حلالا طيبا واشكروا نعمت الله ان كنتم اياه تعبدون ,False,0606FakhrDinRazi.MafatihGhayb
60129693572,5,Shamela0023613-ara1.ms2865,علي المماسة والتقدير فاذاقها الله مساس الجوع والخوف بما كانوا يصنعون قال ابن عباس يريد بفعلهم بالنبي صلي الله عليه وسلم من التكذيب والهم بقتله والاخراج من مكة قال الفراء كل الصفات اجريت علي القرية الا قوله يصنعون تنبيها علي ان المراد في الحقيقة اهلها ولما ذكر المثل ذكر الممثل فقال ولقد جاءهم يعني اهل مكة رسول منهم من انفسهم يعرفونه باصله ونسبه فكذبوه فاخذهم العذاب وهم متلبسون بالظلم قال ابن عباس يعني بالعذاب الجوع الذي كان بمكة وقيل القتل يوم بدر وقيل ان قول ابن عباس اولي والمراد ان ذلك الجوع بسبب كفركم فاتركوا الكفر فكلوا مما رزقكم الله من الغناءم فاكل ,False,0730NizamDinNaysaburi.GharaibQuran
