cluster,size,id,text,from_input,book
137438996360,2,Sham19Y0014404-ara1.ms0790,ولقد جاءهم رسول منهم فكذبوه فاخذهم العذاب وهم ظالمون ولقد جاءهم يعني اهل مكة رسول منهم يعني محمدا صلي الله عليه وسلم فكذبوه فاخذهم العذاب وهم ظالمون في حال ظلمهم فكلوا مما رزقكم الله حلالا طيبا واشكروا نعمت الله ان كنتم اياه تعبدون فكلوا مما رزقكم الله حلالا طيبا واشكروا نعمت الله امرهم باكل ما احل الله لهم وشكر ما انعم عليهم بعدما زجرهم علي الكفر وهددهم عليه بما ذكر من التمثيل والعذاب الذي حل بهم صدا لهم عن صنيع الجاهلية ان كنتم اياه تعبدون تطيعون انما حرم عليكم ,False,0928MujirDinCulaymi.FathRahman
137438996360,2,Shamela0023588-ara1.ms0968,ولقد جاءهم رسول منهم فكذبوه فاخذهم العذاب وهم ظالمون ولقد جاءهم رسول منهم يعني محمدا صلي الله عليه وسلم والضمير لاهل مكة عاد الي ذكرهم بعد ما ذكر مثلهم فكذبوه فاخذهم العذاب وهم ظالمون اي حال التباسهم بالظلم والعذاب ما اصابهم من الجدب الشديد او وقعة بدر سورة النحل الايات الي فكلوا مما رزقكم الله حلالا طيبا واشكروا نعمت الله ان كنتم اياه تعبدون انما حرم عليكم الميتة والدم ولحم الخنزير وما اهل لغير الله به فمن اضطر غير باغ ولا عاد فان الله غفور رحيم فكلوا مما رزقكم الله حلالا طيبا امرهم باكل ما احل الله لهم وشكر ما انعم عليهم بعد ما زجرهم عن الكفر وهددهم عليه بما ذكر من التمثيل والعذاب الذي حل بهم صدا لهم عن صنيع الجاهلية ومذاهبها الفاسدة واشكروا نعمت الله ان كنتم اياه تعبدون تطيعون او ان صح زعمكم ,False,0685NasirDinBaydawi.AnwarTanzil
137438996383,2,Shia002382Vols-ara1.ms1037,ولقد جاءهم رسول منهم فكذبوه فاخذهم العذاب وهم ظالمون فكلوا مما رزقكم الله حلالا طيبا واشكروا نعمت الله ان كنتم ,False,1091MuhammadMuhsinFaydKashani.TafsirSafi
137438996383,2,Sham19Y0014404-ara1.ms0790,ولقد جاءهم رسول منهم فكذبوه فاخذهم العذاب وهم ظالمون ولقد جاءهم يعني اهل مكة رسول منهم يعني محمدا صلي الله عليه وسلم فكذبوه فاخذهم العذاب وهم ظالمون في حال ظلمهم فكلوا مما رزقكم الله حلالا طيبا واشكروا نعمت الله ان كنتم ,False,0928MujirDinCulaymi.FathRahman
137438999288,2,Shia002616Vols-ara1.ms4314,الجوهري الجءار مثل الخوار يقال جار الثور يجار اي صاح وقرا بعضهم عجلا جسدا له جءار حكاه الاخفش وجار الرجل الي الله عز وجل تضرع بالدعاء ,False,0671AbuCabdAllahQurtubi.JamicLiAhkamQuran
137438999288,2,Shia003906Vols-ara1.ms0448,الجيم جار الجءار مثل الخوار يقال جار الثور يجار اي صاح وقرا بعضهم عجلا جسدا له جءار بالجيم حكاه الاخفش وجار الرجل الي الله عز وجل اي تضرع بالدعاء ,False,0393IbnHammadJawhari.SihahTajLugha
137439000982,2,Shamela0010906-ara1.mARkdown.ms5234,وابا العباس السراج وخلقا كثيرا وعنه محمد بن مخلد العطار احد شيوخه وابن شاهين وابن مندة وابو بكر الجوزقي والدارقطني والحاكم والقاضي عبد الجبار المعتزلي ويحيي بن ابراهيم المزكي وعدة قال الحاكم قدم نيسابور سنة ثلاث فسمع المسند من ابن شيرويه فاقام سنتين واما رحلته الي الافاق فمشهورة وكان من الصالحين المذكورين والحفاظ صنف الشيوخ والابواب توفي باسد اباذ في ذي الحجة سنة سبع واربعين وثلاث ماءة وقال الخطيب كان حافظا متقنا مكثرا اخبرنا المسلم بن محمد في كتابه اخبرنا ابو اليمن الكندي اخبرنا ابو منصور الشيباني اخبرنا ابو بكر الحافظ اخبرني الازهري اخبرنا الدارقطني حدثنا محمد بن مخلد العطار حدثنا الزبير بن عبد الواحد حدثني محمد بن بشر وعبد الملك بن محمد قالا حدثنا هاشم بن مرثد سمعت يحيي بن ,False,0748Dhahabi.SiyarAclamNubala
137439000982,2,JK000532-ara1.mARkdown.ms0634,وابا العباس السراج وابن قتيبة العسقلاني وطبقتهم وقد سمع الدارقطني من محمد بن مخلد العطار نا الزبير بن عبد الواحد قال الحاكم كان من الصالحين الثقات الحفاظ صنف الابواب والشيوخ قلت حدث عنه ابو عبد الله الحاكم وابو بكر الجوزقي وابو عبد الله بن منده ويحيي بن ابراهيم المزكي والقاضي عبد الجبار بن احمد المعتزلي واخرون توفي باسداباذ من اعمال همذان في شهر ذي الحجة سنة سبع واربعين وثلاث ماءة وقد سمع بمصر وبدمشق قال الخطيب كان حافظ متقنا مكثرا اخبرنا بن علان وغيره كتابة قالوا انا ابو اليمن الكندي انا ابو منصور القزاز انا ابو بكر الخطيب انا الازهري نا الدارقطني نا محمد بن مخلد العطار نا الزبير بن عبد الواحد حدثني محمد بن بشر وعبد الملك بن محمد الحراني قالا نا هاشم بن مرثد قال سمعت يحيي بن ,False,0748Dhahabi.TadhkiratHuffaz
137439000985,2,Shamela0010906-ara1.mARkdown.ms5164,وابن مندة وابن جميع ويحيي بن ابراهيم المزكي وغيرهم وكان صدوقا حسن المعرفة من اوعية العلم وكان في التاله صنفا اخر قال ابو الفتح القواس سمعت منه وكان يقال انه من الاولياء وسءل الدارقطني عنه فقال فاضل ثقة وقال عبد الرحمن بن ابي اسحاق المزكي سمعت ابا بكر بن داود الزاهد يقول كنت بالبصرة ايام القحط فلم اكل في اربعين يوما الا رغيفا واحدا كنت اذا جعت قرات يس علي نية الشبع فكفاني الله الجوع توفي ابن داود في شهر ربيع الاول سنة اثنتين واربعين وثلاث ماءة يوم الجمعة لعشر بقين منه ارخه الحاكم وقال هو شيخ عصره في التصوف خرج عن نيسابور سنة اربع وتسعين وماءتين واتاها سنة سبع وثلاثين وثلاث ماءة وكان من المقبولين وجمع اخبار الصوفية وقال الخطيب كان ثقة فهما وقال الخليلي معروف بالحفظ بين حفظه وعلمه في فواءد املاها اخبرنا عمر بن عبد المنعم انبانا عبد الصمد بن محمد القاضي حضورا اخبرنا علي بن المسلم اخبرنا ابن طلاب اخبرنا محمد بن احمد الغساني حدثنا محمد بن داود ببغداد حدثنا محمد بن عمرو بن ,True,0748Dhahabi.SiyarAclamNubala
137439000985,2,JK000532-ara1.mARkdown.ms0634,وابن منده وابن جميع وابو زكريا المزكي وخلق وكان يعد من الاولياء قال الدارقطني ثقة فاضل وعنه قال اكلت في ايام القحط رغيفا واحدا في اربعين يوما بالبصرة كنت اذا جعت قرات يس بنية الشبع وقال الخليلي معروف بالحفظ بين حفظه وعلمه في فواءد املاها قلت توفي سنة اثنتين واربعين وثلاث ماءة رحمه الله تعالي اخبرنا عمر بن عبد المنعم انا عبد الصمد بن محمد حضورا انا علي بن المسلم انا بن طلاب انا بن جميع الغساني نا محمد بن داود ببغداد انا محمد بن عمرو بن ,True,0748Dhahabi.TadhkiratHuffaz
137439000986,2,JK000916-ara1.mARkdown.ms20278,ابو النجم بدر بن عبد الله انا ابو بكر الخطيب اخبرني الازهري حدثنا علي ابن عمر الدارقطني حدثنا محمد بن مخلد العطار نا الزبير بن عبد الواحد حدثني محمد ابن بشر وعبد الملك بن محمد بن صالح الحراني قالا حدثنا هاشم بن مرشد ح واخبرنا ابو محمد بن الاكفاني حدثنا ابو بكر الخطيب انبانا ابو سعد الماليني ح واخبرنا ابو القاسم اسماعيل بن احمد انبانا اسماعيل بن مسعدة انبانا حمزة بن يوسف السهمي انبانا ابو احمد بن عدي قال سمعت يحيي بن ابن حيوية يقول سمعت هاشم بن مرثد الطبراني يقول سمعت يحيي بن معين يقول الشافعي صدوق لا باس به وفي حديث ليس به باس اخبرنا ابو محمد المزكي حدثنا احمد بن علي الحافظ ,False,0571IbnCasakir.TarikhDimashq
137439000986,2,JK000532-ara1.mARkdown.ms0634,ابو اليمن الكندي انا ابو منصور القزاز انا ابو بكر الخطيب انا الازهري نا الدارقطني نا محمد بن مخلد العطار نا الزبير بن عبد الواحد حدثني محمد بن بشر وعبد الملك بن محمد الحراني قالا نا هاشم بن مرثد قال سمعت يحيي بن معين يقول الشافعي صدوق وليس به باس محمد بن داود بن سليمان الحافظ ,False,0748Dhahabi.TadhkiratHuffaz
137439000987,2,JK000532-ara1.mARkdown.ms0634,الحافظ المتقن الامام ابو عبد الله الزبير بن عبد الواحد بن محمد بن زكريا احد الاءمة سمع محمد بن نصير الاصبهاني والفضل بن الحباب الجمحي والحسن بن سفيان وعبد الله بن ناجية وعبدان الجواليقي وابا يعلي الموصلي وابا العباس السراج وابن قتيبة العسقلاني وطبقتهم وقد سمع الدارقطني من محمد بن مخلد العطار نا الزبير بن عبد الواحد قال الحاكم كان من الصالحين الثقات الحفاظ صنف الابواب والشيوخ قلت حدث عنه ابو عبد الله الحاكم وابو بكر الجوزقي وابو عبد الله بن منده ويحيي بن ابراهيم المزكي والقاضي عبد الجبار بن احمد المعتزلي واخرون توفي باسداباذ من اعمال همذان في شهر ذي الحجة سنة سبع واربعين وثلاث ماءة وقد سمع بمصر وبدمشق قال الخطيب كان حافظ متقنا مكثرا اخبرنا بن علان وغيره كتابة قالوا انا ابو اليمن الكندي انا ابو منصور القزاز انا ابو بكر الخطيب انا الازهري نا الدارقطني نا محمد بن مخلد العطار نا الزبير بن عبد الواحد حدثني محمد بن بشر وعبد الملك بن محمد الحراني قالا نا هاشم بن مرثد قال سمعت يحيي بن معين يقول الشافعي صدوق وليس به باس محمد بن داود بن سليمان الحافظ الزاهد الحجة شيخ الصوفية ابو بكر النيسابوري سمع محمد بن عمرو قشمرد ,False,0748Dhahabi.TadhkiratHuffaz
137439000987,2,Sham19Y0001994-ara1.ms379,الحافظ المتقن الرحال ابو عبد الله الزبير بن عبد الواحد بن محمد بن زكريا بن صالح طوف شرقا وغربا وسمع ابا خليفة والحسن بن سفيان وابن خزيمة وابن ناجية وابا يعلي الموصلي وعبدان الجواليقي وابا العباس السراج وخلقا روي عنه محمد بن مخلد مع تقدمه والحاكم وابن منده والجوزقي ويحيي بن ابراهيم المزكي والقاضي عبد الجبار المعتزلي واخرون قال الحاكم كان من الصالحين الثقات الحفاظ صنف الابواب والشيوخ وقال الخطيب كان حافظا متقنا مكثرا مات باسداباذ من اعمال همذان في ذي الحجة سنة سبع واربعين وثلاث مءة محمد بن داود ابن سليمان بن جعفر الحافظ الزاهد شيخ الصوفية ابو بكر النيسابوري روي عن محمد بن عمرو قشمرد ,False,0744IbnCabdHadi.TabaqatCulama
137439001281,2,Shamela0010463-ara1.ms736,انه دخل المسجد وعبد الرحمن بن ام الحكم يخطب قاعدا فقال انظروا الخبيث يخطب قاعدا وقد قال الله تعالي واذا راوا تجارة او لهوا انفضوا اليها ,False,0795IbnRajabHanbali.RawaicTafsir
137439001281,2,Shamela0008176-ara1.ms1948,انه دخل المسجد وعبد الرحمن بن ام الحكم بفتحتين قال الطيبي اظنه من بني امية قلت او من اتباعهم يخطب قاعدا فقال اي كعب من غاية الغضب انظروا الي هذا الخبيث بعين العجب في ترك الادب قال ابن حجر فيه جواز التغليظ علي من ارتكب حراما عند من قال به او مكروها عند غيره لان اظهار خلاف ما داوم عليه عليه الصلاة والسلام علي رءوس الاشهاد ينبء عن خبث اي خبث يخطب قاعدا وقال الله وفي نسخة صحيحة وقد قال الله تعالي واذا راوا اي ابصروا او عرفوا تجارة اي بيعا وشراء او لهوا اي طبلا وصدا انفضوا اي تفرقوا اليها ,False,1014MullaCaliQari.MirqatMafatih
137439001368,2,JK000458-ara1.ms2365,والمعني لو كشفنا عنهم ما اصابهم من القحط والهزال برحمتنا اياهم ووجدوا الخصب لارتدوا الي ما كانوا عليه من الافراط في الكفر والاستكبار ولذهب عنهم هذا التملق والابلاس وقد كان كذلك وقوله تعالي المءمنون ولقد اخذناهم بالعذاب ولقد اخذناهم بالعذاب استءناف مسوق للاستشهاد علي مضمون الشرطية والمراد بالعذاب ما نالهم يوم بدر من القتل والاسر وما اصابهم من فنون العذاب التي من جملتها القحط المذكور واللام جواب قسم محذوف اي وبالله لقد اخذناهم بالعذاب فما استكانوا لربهم بذلك اي لم يخضعوا ولم يتذللوا علي انه اما استفعال من الكون لان الخاضع ينتقل من كون الي كون او افتعال من السكون قد اشبعت فتحته كمنتزاح في منتزح بل اقاموا علي ما كانوا عليه من العتو والاستكبار وقوله تعالي وما يتضرعون اعتراض مقرر لمضمون ما قبله اي وليس من عادتهم التضرع اليه تعالي ,False,0982IbnMuhammadAbuSucud.IrshadCaqlSalim
137439001368,2,Shamela0010273-ara1.ms2034,والمعني لو رحمناهم وكشفنا ما بهم من القحط والهزال برحمتنا اياهم ووجدوا الخصب لا رتدوا الي ما كانوا عليه من الكفر والاستكبار ولذهب عنهم هذا الخلق والتعلق بك وهذا كقوله تعالي في الدخان انكم عاءدون قيل المراد بالضر العذاب الاخروي فيكون كقوله ولو ردوا لعادوا لما نهوا عنه ولقد اخذناهم بالعذاب وهو ما اصابهم يوم بدر من القتل والاسر وهو قوله تعالي في الدخان يوم نبطش البطشة الكبري فما استكانوا لربهم بذلك اي لم يخضعوا ولم يتذللوا و استكانوا افتعل من السكون والالف زاءدة او استفعل من الكون اي انتقل من كون الي كون كاستحال اذا انتقل من حال الي حال لان الخاضع ينتقل من كون الي كون وما يتضرعون اي وليس من حالهم التضرع اليه تعالي ,False,1224IbnCajiba.BahrMadid
137439006089,2,Shamela0008362-ara1.ms1011,الباب الاول في ذكر اسماء المدينة واول من سكنها ذكر سكني اليهود الحجاز ذكر نزول احياء من العرب علي يهود ذكر نزول الاوس والخزرج المدينة ذكر قتل يهود واستيلاء الاوس والخزرج علي المدينة الباب الثاني في ذكر فتح المدينة الباب الثالث في ذكر هجرة النبي صلي الله عليه وسلم واصحابه الباب الرابع في ذكر فضاءلها ,False,0832AbuTayyibFasi.ShifaGharam
137439006089,2,Shamela0026662-ara1.completed.ms002,الباب الاول في ذكر اسماء المدينة واول ساكنيها الباب الثاني في ذكر فتح المدينة الباب الثالث في ذكره هجرة النبي صلي الله عليه وسلم واصحابه اليها الباب الرابع في ذكر فضاءلها ,False,0642IbnNajjar.DurraThamina
137439016215,2,SHAM19Y23644-ara1.ms6749,تزل الاخبار متواترة من ناحية العراق بظهور المظفر ابي الحارث ارسلان البساسيري وقوة شوكته وغلبة امره علي الامام القاءم بامر الله وقهر نوابه وامتهان خواصه واصحابه وخوفهم من شره حتي افضي امره باخذ الجاءي من حريم الخلافة لادافع عنه وهو واحد من الغلمان الاتراك عظم امره واستفحل شانه لعدم نظراءه من الغلمان الاتراك والمقدمين فاستولي علي العباد والاعمال ومد يده في جباية الاموال وشاع بالهيبة امره وانتشر ذكره وتهيبته العرب والعجم ودعي له علي كثير من منابر العراق والاهواز ,False,0654SibtIbnJawzi.MiratZaman
137439016215,2,Shamela0022799-ara1.completed.ms124,تزل الاخبار متواترة من ناحية العراق بظهور المظفر ابي الحرث ارسلان الفساسيري وقوة شوكته وكثرة عدته وغلبة امره علي الامام القاءم بامر الله امير المءمنين وقهر نوابه وامتهان خاصته واصحابه وخوفهم من شره حتي امضي امره الي ان ياخذ الجاني من حرم الخلافة ويفعل ما يشاء ولا يمانع له ولا يدافع عنه وقد شرح الخطيب ابو بكر احمد ابن علي بن ثابت البغدادي رحمه الله في اخبار اهل بغداد ما قال فيه ولم يزل امر القاءم بامر الله امير المءمنين مستقيما الي ان قبض عيه ارسلان الفساسيري في سنة وهو واحد من الغلمان الاتراك عظم امره واستفحل شانه لعدم نظراءه من الغلمان الاتراك والمقدمين والاسفهسلارية الا انه استولي علي العباد والاعمال ومد يده في جباية الاموال وشاع بالهيبة امره وانتشر بالقهر ذكره وتهيبته العرب والعجم ودعي له علي كثير من منابر الاعمال العراقية وبالاهواز ,False,0555IbnQalanisi.Tarikh
137439021721,2,ShamAY0034147-ara1.ms03,الولد سبع سنين سيد وامير وتسع سنين اخووزير فان رضيت فكافءه والا فاضرب علي جنبه فقد اعذرت فيما بينك وبينه اذا كنت علي الماء فلا تبخل بالماء ,False,1143IbnCabdKarimGhazziCamiri.JiddHathith
137439021721,2,Shamela0006056-ara1.ms026,الولد سبع سنين سيد وامير وسبع سنين عبد واسير وسبع سنين اخ ووزير فان رضيت مكانته والا فاضرب علي جنبه فقد اعذرت فيما بينك وبينه وسنده ضعيف حديث اذا كتب احدكم فلا يكتب عليه بلغ فانه اسم شيطان ولكن يكتب عليه الله موضوع كما في اللالء حديث اذا كنت علي الماء فلا تبخل بالماء ,False,1014MullaCaliQari.AsrarMarfuca
137439027419,2,Sham19Y0023618-ara1.ms1279,بل قالوا مثل ما قال الاولون قالوا ااذا متنا وكنا ترابا وعظاما اانا لمبعوثون لقد وعدنا نحن واباءنا هذا من قبل ان هذا ,False,0873AbuZaydThacalibi.JawahirHisan
137439027419,2,ShamAY0034054-ara1.ms2681,بل قالوا مثل ما قال الاولون اي اباءهم والموافقون لهم في دينهم المءمنون قالوا اءذا متنا ثم بين ما قاله الاولون فقال قالوا اءذا متنا وكنا ترابا وعظاما اءنا لمبعوثون فهذا مجرد استبعاد لم يتعلقوا له بشء من الشبه المءمنون لقد وعدنا نحن ثم كملوا ذلك القول بقولهم لقد وعدنا نحن واباءنا هذا من قبل اي وعدنا هذا ,False,1281IbnMuhammadShawkani.TafsirFathQadir
137439055953,2,Shamela0021766-ara1.ms4975,سورة الماعون مكية وهي سبع ايات بسم الله الرحمن الرحيم ارايت الذي يكذب الاستفهام للتعجب والروية بمعني الابصار والمعرفة فاقتصر علي مفعول واحد وهو الموصول مع الصلة وقال في البحر المواج الاستفهام للتقرير والروية بمعني العلم والموصول خبر محذوف يعني ذلك تقديره ارايت ذلك الذي يكذب بالدين قال مقاتل نزلت في العاص بن واءل السهمي وقال السدي ومقاتل وابن كيسان هو الوليد بن مغيرة وقال الضحاك نزلت في عمرو بن عاءذ المخزومي فصدر السورة علي هذا الاقوال مكية واخر السورة مدنية كذا قيل وقال عطاء عن ابن عباس ارايت الذي يكذب بالدين نزلت في رجل من المنافقين ,False,1225ThanaAllahPanipati.TafsirMazhari
137439055953,2,Shamela0023628-ara1.completed.ms3745,سورة الماعون اية بسم الله الرحمن الرحيم ارايت الذي يكذب بالدين قوله عز وجل ارايت الذي يكذب بالدين قيل نزل في العاص بن واءل السهمي وقيل في الوليد بن المغيرة وقيل في عمرو بن عاءذ المخزومي وفي رواية عن ابن عباس انها في رجل من المنافقين ,False,0741KhazinBaghdadi.LubabTawil
137439079208,2,Shamela0000176-ara1.completed.ms416,الي محراب داود عليه السلام فحاصرهم الفرنج نيفا واربعين يوما حتي تسلموه بالامان في يوم الجمعة ثاني عشريه واحرقوا ما كان ببيت المقدس من المصاحف والكتب واخذوا ما كان بالصخرة من قناديل الذهب والفضة والالات وكان مبلغا عظيما ويقال انه قتل في المسجد الاقصي ما يزيد علي سبعين الفا وانهم لحقوا من فر من المسلمين مسيرة اسبوع يقتلون من ادركوه منهم ووصل الافضل الي عسقلان في الرابع عشر من شهر رمضان فبعث الي الفرنج فوبخهم علي ما كان منهم فردوا اليه الجواب وركبوا في اثر الرسل فصدفوه علي غرة واوقعوا بعساكره وقتلوا منهم كثيرا وانهزم منهم بمن خف معه فتحصن بعسقلان وتعلق اكثر ,False,0845Maqrizi.ItticazHunafa
