cluster,size,id,text,from_input,book
42949688624,9,JK009390-ara1.completed.ms4573,عن ابي عقرب قال التقطت بدرة فاتيت بها عمر بن الخطاب رضي الله عنه فقال واف بها الموسم فوافيت بها الموسم فعرفتها فلم اجد احدا يعرفها فقال الا اخبرك بخير سبيلها تصدق بها فان جاء صاحبها ,False,1423CabbasAhmadSaqr.JamicAhadith
42949688624,9,Sham19Y0127677-ara1.ms16735,يصنع بها ج ص رقم قال حدثنا ابو بكر قال حدثنا وكيع قال حدثنا الاسود بن شيبان عن ابي نوفل بن ابي عقرب عن ابيه قال التقطت بدرة فاتيت بها عمر بن الخطاب فقلت يا امير المءمنين اغنها عني فقال واف بها الموسم فوافيت بها الموسم فقال عرفها حولا فعرفتها فلم اجد احدا يعرفها فاتيته فقلت فاغنها عني فقال الا اخبرك بخير سبلها تصدق بها فان جاء صاحبها فاختار المال غرمت له وكان الاجر لك وان اختار ,False,0911Suyuti.JamicKabir
42949688624,9,Sham19Y0127677-ara1.ms03127,عن ابي عقرب قال التقطت بدرة فاتيت بها عمر بن الخطاب فقال واف بها الموسم فوافيت بها الموسم فعرفتها فلم اجد احدا يعرفها فقال الا اخبرك بخير سبلها تصدق بها فان جاء صاحبها فاختار المال غرمت له وكان الاجر لك وان اختار الاجر كان الاجر له ولك ما نويت ش عن مجاهد قال ,False,0911Suyuti.JamicKabir
42949688624,9,Shia001887Vols-ara1.ms2381,عن ابراهيم بن عبد الاعلي عن سويد بن غفلة عن عمر بن الخطاب قال في اللقطة يعرفها سنة فان جاء صاحبها والا تصدق بها فان جاء صاحبها بعدما يتصدق بها خيره فان اختار الاجر كان له وان اختار المال كان له ماله عبد الرزاق عن الثوري واسراءيل عن عامر بن شقيق عن ابي واءل شقيق ابن سلمة قال اشتري عبد الله بن مسعود من رجل جارية بست مءة او بسبع مءة فنشده سنة لا يجده ثم خرج بها الي السدة فتصدق بها من درهم ودرهمين عن ربها فان جاء صاحبها خيره فان اختار الاجر كان الاجر له وان اختار ماله كان له ماله ثم قال ابن مسعود هكذا افعلوا باللقطة عبد الرزاق عن الزبير ,False,0211CabdRazzakSancani.Musannaf
42949688624,9,Shamela0001438-ara1.completed.ms4928,عن ابي عقرب قال التقطت بدرة فاتيت بها عمر بن الخطاب فقال واف بها الموسم فوافيت بها الموسم فعرفتها فلم اجد احدا يعرفها فقال الا اخبرك بخير سبيلها تصدق بها فان جاء صاحبها فاختار المال غرمت له وكان الاجر لك وان اختار الاجر كان له ولك ما نويت ابن ابي شيبة كنز العمال عن عمر قال تكفن المراة في خمسة ,False,1450DarIftaMisriyya.JamicAhadith
42949688624,9,JK000786-ara1.completed.ms2092,وكيع قال حدثنا سفيان عن ابراهيم بن عبد الاعلي عن سويد قال كان عمر بن الخطاب يامر ان تعرف اللقطة سنة فان جاء صاحبها والا تصدق بها فان جاء صاحبها خير حدثنا ابو بكر قال حدثنا وكيع قال حدثنا الاسود بن شيبان عن ابي نوفل بن ابي عقرب عن ابيه قال التقطت بدرة فاتيت بها عمر بن الخطاب فقلت يا امير المءمنين اغنها عني فقال واف بها الموسم فوافيت بها الموسم فقال عرفها حولا فعرفتها فلم اجد احدا يعرفها فاتيته فقلت فاغنها عني فقال الا اخبرك بخير سبلها تصدق بها فان جاء صاحبها فاختار المال غرمت له وكان الاجر لك وان اختار الاجر كان الاجر له ,False,0235IbnAbiShayba.Musannaf
42949688624,9,Shia001782Vols-ara1.ms1280,اللقطة من التقط شيءا فليعرفه فان جاء صاحبها فليردها اليه فان لم يات فليتصدق بها فان جاء فليخيره بين الاجر وبين الذي له رواه الطبراني في الصغير والاوسط وفيه يوسف بن خالد السمتي وهو كذاب وعن ابي واءل شقيق بن سلمة قال اشتري عبد الله بن مسعود جارية من رجل بستماءة او بسبعماءة درهم فنشده سنة لا يجده ثم خرج بها الي الشدة فتصدق بها من درهم ودرهمين عن ربها فان جاء خيره فان اختار الاجر كان له وان اختار ماله كان له ماله ثم قال ابن مسعود هكذا فافعلوا باللقطة رواه الطبراني في الكبير ,False,0807NurDinHaythami.MajmacZawaid
42949688624,9,JK011184-ara1.ms557,وكيع ثنا سفيان عن ابراهيم بن عبد الاعلي عن سويد هو ابن غفلة قال كان عمر بن الخطاب يامران تعرف اللقطة سنة فان جاء صاحبها والا تصدق بها فان جاء صاحبها خير وهذا سند جليل متفق عليه الا ابراهيم فان مسلما انفرد به وروي هذا الاثر عبد الرزاق عن الثوري بسنده ومعناه وقال ابن ابي شيبة ثنا وكيع ثنا الاسود بن شيبان عن ابي نوفل بن ابي عقرب عن ابيه قال التقطت بدرة فاتيت بها عمر بن الخطاب فقلت اغنها عني قال وافني بها الموسم فوافيته بها الموسم فقال عرفها حولا فعرفتها فلم اجد من يعرفها فاتيته فقلت اغنها عني فقال الا اخبرك بخير سبلها تصدق بها فان جاء صاحبها فاختار المال غرمت له وكان الاجر لك وان اختار الاجر كان الاجر له ولك ما نويت ,False,0750IbnTurkamani.JawharNaqi
42949736426,9,SHAM19Y23644-ara1.ms0758,وكتب الي رعيته من اردشير ملك الملوك ووارث العظماء المءيد الي العلماء الذين هم حملة الدين والاساورة الذين هم حفاظ الدولة والكتاب الذين هم زين المملكة سلام عليكم اعلموا انا قد وضعنا عن رعيتنا بفضل رافتنا الاتاوة التي كانت عليها ونحن كاتبون بوصية فاحفظوها لا تستشعروا الحقد فيدهمكم العدو ولا تحتكروا فيشملكم القحط وتزوجوا في الاقربين فانه امس للرحم واثبت للنسب ولا تعدوا هذه الدنيا شيءا فانها لا تبقي علي احد ولا تهتموا لها فالرزق بيد الباري ولا ترفضوها بمرة فان الاخرة لا تدرك الا بها ,False,0654SibtIbnJawzi.MiratZaman
42949736426,9,Shamela0023789-ara1.completed.ms0030,وكتب اردشير الي رعيته من اردشير المءيد ملك الملوك ووارث العظماء الي الفقهاء الذين هم حملة الدين والاساورة الذين هم حفظة البيضة والكتاب الذين هم زينة المملكة وذوي الحرث الذين هم عماد البلاد السلام عليكم فانا بمحمد الله اليكم سالمون فقد وضعنا عن رعيتنا بفضل رافتنا بها اتاوتها الموضوعة عليها ونحن مع ذلك كاتبون اليكم بوصية فاحفظوها لا تستشعروا الحقد فيدهمكم العدو ولا تحتكروا فيشملكم القحط وتزوجوا في الاقارب فانه امس للرحم واثبت للنسب ولا تعدوا هذه الدنيا شيءا فانها لا تبقي علي احد ,False,0328IbnCabdRabbihi.CiqdFarid
42949736426,9,JK007082-ara1.mARkdown.ms390,الذين هم حملة الدين والاساورة الذين هم حفظة البيضة والكتاب الذين هم زينة المملكة وذوي الحرث الذين بهم عمود البلاد سلام عليكم بقدر ما تستوعبون بمعرفة الحق وانكار الباطل والحذر فقد وضعنا عن رعيتنا لفضل رافتنا اتاوتها الموظفة عليهم ونحن مع ذلك كاتبون اليكم بوصية لا تستشعروا الحقد فيدهمكم العدو ولا تحتكروا فيشملكم القحط وتزوجوا في الاقربين فانه امس للرحم واثبت للنسب ولا تعدوا هذه الدنيا شيءا فانها لا تبقي علي احد ولا ترفضوها مع ذلك فان الاخرة لا تنال الا بها ,False,0333IbnMarwanDinawari.MujalasaWaJawahirCilm
42949736426,9,JK010344-ara1.completed.ms0191,من اردشير بن بهمن ملك الملوك الي الكتاب الذين بهم تدبير المملكة والفقهاء الذين هم عماد الدين والاساورة الذين هم حماة الحرب والي الحراث الذين هم عمرة البلاد سلام عليكم نحن بحمد الله صالحون وقد رفعنا اتاوتنا عن رعيتنا بفضل رافتنا ورحمتنا ونحن كاتبون اليكم بوصية فاحفظوها لا تستشعروا الحقد فيكم فيدهمكم العدو ولا تحبوا الاحتكار فيشملكم القحط وكونوا لابناء السبيل ماوي ترووا غدا في المعاد وتزوجوا في الاقارب فانه امس للرحم واقرب للنسب ولا تركنوا للدنيا فانها لا تدوم لاحد ولا تهتموا لها فلن يكون الا ما شاء الله ولا ترفضوها مع ذلك فان الاخرة لا تنال الا بها وكتب ,False,0346Mascudi.MurujDhahab
42949736426,9,Shamela0023790-ara1.completed.ms036,كتابا لاردشير بن بابك الي الرعية نسخته من اردشير الموبذ ذي البهاء ملك الملوك ووارث العظماء الي الفقهاء الذين هم حملة الدين والاساورة الذين هم حفظة البيضة والكتاب الذين هم زينة المملكة وذوي الحرث الذين هم عمرة البلاد السلام عليكم فانا بحمد الله صالحون وقد وضعنا عن رعيتنا بفضل رافتنا اتاوتها الموظفة عليها ونحن مع ذلك كاتبون اليكم بوصية لا تستشعروا الحقد فيدهمكم العدو ولا تحتكروا فيشملكم القحط وتزوجوا في القرابين فانه امس للرحم واثبت للنسب ولا تعدو هذه الدنيا شيءا فانها لا تبقي علي احد ولا ترفضوها مع ذلك فان الاخرة لا تنال الا بها ,False,0276IbnQutaybaDinawari.CuyunAkhbar
42949736426,9,Shamela0007853-ara1.completed.ms1099,كسري لا تستشعروا الحقد فيدهمكم العدو ولا تحبوا الاحتكار فيشملكم القحط وكونوا لابناء السبيل ماوي تءووا غدا في المعاد وتزوجوا في الاقارب فانه اثبت للنسب واقرب للسبب ولا تركنوا الي الدنيا فانها لا تدوم ولا ترفضوها مع ذلك فان الاخرة لا تنال الا بها وقال ,False,0421AbuSacdAbi.NathrDurr
42949736426,9,Zaydiyya0000037Vols-ara1.ms0052,من ازدشير ملك الملوك الي الكتاب الذين هم حماة الحرب والحراث الذين هم عمار الارض سلام عليكم ونحن كاتبون اليكم بوصية فاحفظوها لا تستشعرواالحقد فيدهمكم العدو ولا تحبوا الاحتكار فيشملكم القحط وكونوا لابناء السبيل ماوي تنجوا في المعاد وتزوجوا في الاقارب فانه امس للرحم واقرب للنسب ولا تركنوا الي الدنيا فانها لا تدوم لاحد ولا تهتموا بها فلن يكون الا ما شاء الله ولا ترفضوها فان الااخرة لا تنال الا بها وكان ,False,1055AhmadSharafi.AliMudia
42949736426,9,Shamela0009429-ara1.mARkdown.ms0178,كتب به اردشير الي رعيته من اردشير المءيد ملك الملوك وارث العظماء الي الفقهاء الذين هم حملة الدين والاساورة الذين هم حفظة البيضة والكتاب الذين هم زين المملكة وذوي الحروب الذين هم عمدة البلد السلام عليكم فانا نحمد اليكم الله سالمين وقد وضعنا عن رعيتنا بفضل رافتنا بها اتاوتها الموظفة عليها ونحن مع ذلك كاتبون بوصية لا تستشعروا الحقد فيدهمكم العدو ولا تحتكروا فيشملكم القحط ,False,0821Qalqashandi.SubhAcsha
42949736426,9,Shamela0010768-ara1.ms328,بن بابك اليه في سنة مجدبة لعجزهم عن الخراج وسالته ان يخففه عنهم فكتب لهم ما نسخته من اردشير المزيد بالبهاء ابن الملوك العظماء الي الفقهاء الذين هم حفظة البيضة والكتاب الذين هم ساسة المملكة وذوي الحرث الذين هم عمرة البلاد اما بعد فانا نحمد الله تعالي حمد الصالحين وقد وضعنا عن رعيتنا بفضل رافتنا اتاوتنا الموظفة عليهم سنتنا هذه ونحن كاتبون مع ذلك نميلهم بوصية تنفع الكل لا تستشعروا الحقد لءلا يغلب عليكم العدو ولا تحبوا الاحتكار لءلا يشملكم القحط وكونوا للغرباء مءوين لتءووا غدا في المعاد وتزوجوا في القرابة فانه احسن للرحم واثبت للنسب ولا تعدوا هذه الدنيا شيءا فانها لا تبقي علي احد ولا ترفضوها مع ذلك فان الاخرة لا تنال الا بها وقيل ,False,0453AbuIshaqHusri.ZuhrAdab
42949823999,9,Shamela0003118-ara1.completed.ms6190,ابي الخطاب يحيي ابن عمرو بن عمارة الليثي حدث عن محمد بن احمد بن ابراهيم بسنده الي كعب قال بطرسوس من قبور الانبياء عشرة وبالمصيصة خمسة وهي التي يغزوها الروم في اخر الزمان فيمرون بها فيقولون اذا رجعنا من بلاد الشام اخذنا هءلاء اخذا فيرجعون وقد تحلقت بين السماء والارض وبالثغور وانطاكية قبر حبيب النجار وبحمص ثلاثون قبرا وبدمشق خمس مءة قبر وببلاد الاردن مثل ذلك محمد بن ,False,0711IbnManzurIfriqi.MukhtasarTarikhDimashq
42949823999,9,Shamela0003118-ara1.completed.ms0218,كعب قال بطرسوس من قبور الانبياء عشرة وبالمصيصة خمسة وهي التي يغزوها الروم في اخر الزمان فيمرون بها فيقولون اذا رجعنا من بلاد الشام اخذنا هءلاء اخذا فيرجعون وقد تحلقت بين السماء والارض قال كعب وبالثغور وانطاكية قبر حبيب النجار وبحمص ثلاثون قبرا وبدمشق خمس مءة قبر وببلاد الاردن مثل ذلك وفي رواية اخري مثله وزاد فيه وبالثغور وبسواحل الشام من قبور الانبياء الف قبر وقال بعد وببلاد الاردن مثل ذلك وبفلسطين مثل ذلك وببيت المقدس الف قبر وبالعريش عشرة وقبر موسي بدمشق وعن عبد الله بن سلام قال بالشام من قبور الانبياء الفا قبر وسبع مءة قبر وقبر موسي بدمشق ,False,0711IbnManzurIfriqi.MukhtasarTarikhDimashq
42949823999,9,Shamela0010798-ara1.completed.ms0096,بن محمد بن الحسن قال اخبرنا عمي ابو القاسم قال اخبرنا ابو محمد عبد الكريم بن حمزة قال حدثنا عبد العزيز ابن احمد قال حدثنا تمام بن محمد قال اخبرنا ابو الحارث بن عمارة قال حدثنا ابي وهو محمد بن ابي عمارة بن ابي الخطاب الليثي قال حدثنا محمد بن احمد بن ابراهيم عن هشام بن خالد عن الوليد بن مسلم عن مكحول عن كعب قال بطرسوس من قبور الانبياء عشرة وبالمصيصة خمسة وهي التي يغزوها الروم في اخر الزمان فيمرون بها فيقولون اذا رجعنا من بلاد الشام اخذنا هءلاء ظ اخذا فيرجعون وقد تحلقت بين السماء والارض قال ,False,0660IbnCadim.BughyatTalab
42949823999,9,JK000916-ara1.mARkdown.ms00651,اخبرنا ابو محمد عبد الكريم بن حمزة نا عبد العزيز بن احمد نا تمام بن محمد انا ابو الحارث بن عمارة نا ابي وهو محمد بن عمارة بن ابي الخطاب الليثي نا محمد بن احمد بن ابراهيم عن هشام بن خالد عن الوليد بن مسلم عن رجل عن مكحول عن كعب قال بطرسوس من قبور الانبياء عشرة وبالمصيصة خمسة وهي التي تغزوها الروم في اخر الزمان فيمرون بها فيقولون اذا رجعنا من بلاد الشام اخذنا هءلاء اخذا فيرجعون وقد تخلفت بين السماء والارض قال كعب وبالثغور وانطاكية قبر حبيب النجار وبحمص ثلاثون قبرا وبدمشق خمس ماءة قبر وببلاد الاردن مثل ذلك رواه غيره عن محمد عن هشام فسمي الرجل سعيد بن عبد العزيز اخبرنا ابو الفضاءل ناصر بن محمود بن علي نا علي بن احمد بن زهير نا علي بن محمد بن شجاع نا تمام بن محمد نا ابو يعقوب اسحاق بن ابراهيم الاذرعي نا محمد عن هشام بن خالد عن الوليد يعني ابن مسلم عن سعيد بن عبد العزيز عن مكحول عن كعب فذكره وزاد فيه وبالثغور وبسواحل الشام من قبور الانبياء الف قبر وقال بعد وببلاد الاردن مثل ذلك وبفلسطين مثل ذلك وببيت المقدس الف قبر وبالعريش عشرة وقبر موسي بدمشق قال ونا علي بن محمد انا عبد الرحمن بن عمر انا ابو ,False,0571IbnCasakir.TarikhDimashq
42949823999,9,JK000916-ara1.mARkdown.ms21506,بن احمد بن ابراهيم روي عنه ابنه ابو الحارث احمد بن محمد بن عمارة اخبرنا ابو محمد عبد الكريم بن حمزة ثنا عبد العزيز بن احمد انبانا تمام بن محمد انبانا ابو الحارث بن عمارة حدثنا ابي وهو محمد بن عمارة بن ابي الخطاب الليثي ثنا محمد بن احمد بن ابراهيم عن هشام بن خالد عن الوليد بن مسلم عن رجل عن مكحول عن كعب قال بطرسوس من قبور الانبياء عشرة وبالمصيصة خمسة وهي التي يغزوها الروم في اخر الزمان فيمرون بها فيقولون اذا رجعنا من بلاد الشام اخذنا هءلاء اخذا فيرجعون وقد تخلفت بين السماء والارض قال كعب وبالثغور وانطاكية قبر حبيب النجار وبحمص ثلاثون قبرا وبدمشق خمسماءة قبر وببلاد الاردن مثل ذلك ,False,0571IbnCasakir.TarikhDimashq
42949823999,9,Sham19Y0014045-ara1.ms276,بن عبد الله الخثعمي وبسنده عن مكحول عن كعب قال بطرسوس من قبور الانبياء عشرة وبالمصيصة خمسة وبالثغور من سواحل الشام من قبور الانبياء الف قبر وبانطاكية قبر حبيب النجار وبحمص ثلاثون وبدمشق خمسماءة قبر وببلاد الاردن مثل ذلك وبفلسطين مثل ذلك وببيت المقدس الف قبر وبالعريش عشرة وقبر موسي بدمشق هذا كلام صاحب كتاب الانس ومثله في كتاب ابي الحسن بن شجاع الربعي عن سعيد عن مكحول عن عبد الله بن سلام قال بالشام من قبر الانبياء الف قبر وسبعماءة قبر وقبر موسي عليه السلام بدمشق ,False,0880IbnAhmadShamsDinAsyuti.IthafAkhissa
42949823999,9,ShamAY0033632-ara1.ms152,اخبرنا ابو الحسن علي بن موسي بقراءتي عليه قال ابنا ابو القاسم تمام ابن محمد بن عبد الله الحافظ قال ثنا ابو يعقوب اسحاق بن ابراهيم الاذرعي قال ثنا محمد بن الخضر عن هشام بن خالد عن الوليد بن مسلم عن سعيد عن مكحول عن كعب قال بطرسوس من قبور الانبياء عشرة وبالمصيصة خمسة وبسواحل الشام من قبور الانبياء الف قبر وبانطاكية قبر حبيب النجار وبحمص ثلاثون قبرا وبدمشق خمسماءة قبر وببلاد الاردن مثل ذلك وبفلسطين مثل ذلك وببيت المقدس الف قبر وبالعريش عشرة اخبرنا ابو الفرج قال ابنا عيسي قال ابنا علي قال ابنا عبد الله بن محمد بن ,False,0492IbnMurajjaMaqdisi.FadailBaytMaqdis
42949823999,9,Shamela0026527-ara1.ms21,اخبرنا تمام بن محمد حدثنا ابو يعقوب اسحاق بن ابراهيم الاذرعي حدثنا محمد بن هشام بن خالد عن الوليد يعني ابن مسلم عن سعيد بن عبد العزيز عن مكحول عن كعب قال بطرسوس من قبور الانبياء عشرة وبالمصيصة خمسة وهي التي تغزوها الروم في اخر الزمان فيمرون فيقولون اذا رجعنا من بلاد الشام اخذنا هءلاء فيرجعون وقد علقت بين السماء والارض قال كعب وبالثغور وسواحل الشام من قبور الانبياء الف قبر وبانطاكية قبر حبيب النجار وبحمص ثلاثون قبرا وبدمشق خمس ماءة قبر وببلاد الاردن مثل ذلك وبفلسطين مثل ذلك وببيت المقدس الف قبر وبالعريش عشرة وقبر موسي عليه السلام بدمشق اخبرنا عبد الرحمن بن عمر بن نصر حدثنا ابو ,False,0444IbnAbiHawl.FadailSham
42949823999,9,JK000624-ara1.ms360,بن عمارة ثنا ابي ثنا محمد بن احمد بن ابراهيم عن هشام بن خالد عن الوليد بن مسلم عن رجل عن مكحول عن كعب قال بطرسوس من قبور الانبياء عشرة وبالمصيصة خمسة وهي التي تغزوها الروم في اخر الزمان فيمرون بها فيقولون اذا رجعنا من بلاد الشام اخذنا هءلاء اخذا فيرجعون وقد تحلقت بين السماء والارض قال كعب وبالثغور وبانطاكية قبر حبيب النجار وبحمص ثلاثون قبرا وبدمشق خمس مءة قبر وببلاد الاردن مثل ذلك ,False,0414AbuQasimRazi.Fawaid
42949845968,9,Sham19Y0020891-ara1.ms6356,الظهر اذا نفروا عنه قبل الركوع وعند صاحبيه اذا كبر وهم معه مضي فيها وعند زفر اذا نفروا قبل التشهد بطلت فان قلت كيف قال اليها وقد ذكر شيءين قلت تقديره اذا راوا تجارة انفضوا اليها او لهوا انفضوا اليه فحذف احدهما لدلالة المذكور عليه وكذلك قراءة من قرا انفضوا اليه وقراءة من قرا لهوا او تجارة انفضوا اليها وقرء اليهما قوله كيف قال اليها وقد ذكر شيءين الراغب اعيد الضمير الي التجارة دون اللهو لما كانت سبب انفضاض الذين نزلت الاية فيهم ولانه قد تشغل التجارة عن العبادة من لا يشغله اللهو وعلي ذلك قوله والذين يكنزون الذهب والفضة ولا ينفقونها في سبيل الله ,False,0743SharafDinTibi.FutuhGhayb
