cluster,size,id,text,from_input,book
412316905015,2,JK000914-ara1.mARkdown.ms0930,سنة تسع وعشرين واربعماءة اسماعيل بن احمد بن عبد الله ابو عبد الرحمن الضرير الحيري النيسابوري صاحب الكفاية في التفسير وغيرها ولد سنة احدي وستين وثلاثماءة وقرا الخطيب عليه صحيح البخاري كاملا في ثلاثة مجالس حدث عن زاهر السرخسي وغيره مات بعد سنة ثلاثين واربعماءة اسماعيل بن احمد النوكاني ,False,0771Subki.TabaqatShaficiyyaKubra
412316905015,2,Sham19Y0016664-ara1.ms167,سنة اربع وثلاثين واربعماءة اسماعيل بن احمد بن عبد الله ابو عبد الرحمن الضرير الحيري صاحب الكفاية في التفسير وغيرها سمع صحيح البخاري من ابي الهيثم عن الفربري عن البخاري سمعه عليه الخطيب في ثلاث مجالس مات بعد سنة ثلاثين واربعماءة حسان بن سعيد بن حسان ابو علي ,False,0804IbnMulaqqin.CiqdMudhahhab
412316932609,2,Sham19Y0013252-ara1.ms03860,جماعة اهل العلم علي انه اباحة بعد حظر وقيل هو امر علي بابه وقال الداودي هو علي الاباحة لمن له كفاف او لا يطيق التكسب وفرض علي من لا شء له ويطيق التكسب وقال غيره من يعطف عليه بسءال او غيره ليس طلب الكفاف عليه بفريضة ,False,0804IbnMulaqqin.Tawdih
412316932609,2,Shamela0005756-ara1.completed.ms03963,جماعة اهل العلم علي ان هذا اباحة بعد الحظر وقيل هو امر علي بابه وعن الداودي هو اباحة لمن كان له كفاف ولا يطيق التكسب وفرض علي من لا شء له ويطيق التكسب وقال غيره من تعطف عليه بسءال او غيره ليس طلب التكسب عليه بفريضة ,False,0855BadrDinCayni.CumdatQari
412316954448,3,Shamela0001535-ara1.ms1288,انما يتم ان لو اريد بالاهتداء الاهتداء الي المراد بالامر وقد فسر بغيره ايضا مع ان اللازم من الغرض المذكور ان يكون المامور به وهو ذبح البقرة مرادا ولا يلزمه الاهتداء اذ يجوز ان يكون لتلك الارادة حكمة اخري وقوله للشرط اراد به التعليق وهو يطلق عليه وعلي اداته وعلي الجملة الاولي قوله والمعتزلة والكرامية الخ عطف علي فاعل احتج وتقدم ضبط الكرامية فراجعه ووجهه ان دخول كلمة ان عليها يقتضي الحدوث لانه علق حصول الاهتداء علي حصول مشيءته وهو حادث فكذلك مشيثته محدثة والا يلزم التخلف وحاصل الجواب ان اللازم حدوث التعلق ولا يلزمه حدوث نفس الصفة ,False,1069ShihabDinKhafaji.HashiyaCalaTafsirBaydawi
412316954448,3,Shia002702Vols-ara1.ms00471,انما يتم لو كان معني لمهتدون الاهتداء الي المراد بالامر اما لو كان المراد ان شاء الله اهتداءنا في امر ما لكنا مهتدين فلا الا انه خلاف الظاهر كالقول بان اللازم ان يكون المءمور به وهو الذبح مرادا ولا يلزمه الاهتداء اذ يجوز ان يكون لتلك الارادة حكمة اخري بل هذا ابعد بعيد والمعتزلة والكرامية يحتجون بالاية علي حدوث ارادته تعالي بناء علي انها والمشيءة سواء لان كلمة ان دالة علي حصول الشرط في الاستقبال وقد تعلق الاهتداء الحادث بها ويجاب بان التعليق باعتبار التعلق فاللازم حدوث التعلق ولا يلزمه حدوث نفس الصفة ,False,1270ShihabDinAlusi.RuhMacani
412316954448,3,ShamAY0034055-ara1.ms00521,انما يتم لو كان معني لمهتدون الاهتداء الي المراد بالامر اما لو كان المراد ان شاء الله اهتداءنا في امر ما لكنا مهتدين فلا الا انه خلاف الظاهر كالقول بان اللازم ان يكون المامور به وهو الذبح مرادا ولا يلزه الاهتداء ا يجوز ان يكون لتلك الارادة حكمة اخري بل هدا ابعد بعيد والمعتزلة والكرامية يحتجون بالاية علي حدوث ارادته تعالي بناء علي انها والمشيءة سواء لان كلمة ان دالة علي حصول الشرط في الاستقبال وقد تعلق الاهتداء الحادث بها ويجلب بان التعليق باعتبار التعلق فاللازم حدوث التعلق ولا يلزمه حدوث نفس الصفة ,False,1342MahmudShukriAlusi.RawhMacani
412316957486,2,Shamela0021821-ara1.ms1434,ما امر به مع التقوي واداء الفرض وهو قوله واتقوه واقيموا الصلاة الروم ثم اخبر انه لا ينفع ذلك الا بالاخلاص في التوحيد فقال ولا تكونوا من المشركين من الذين فرقوا دينهم وكانوا ,False,0468IbnAhmadWahidiNaysaburi.WasitFiTafsir
412316957486,2,Shia002359Vols-ara1.ms3351,ما امر به مع التقوي واداء الفرض وهو قوله واتقوه واقيموا الصلاة ثم اخبر سبحانه انه لا ينفع ذلك الا بالاخلاص في التوحيد فقال ولا تكونوا من المشركين من الذين فرقوا دينهم اي لا تكونوا ,False,0548IbnHasanTabarsi.TafsirMajmacBayan
412316957488,2,Shamela0021821-ara1.ms1434,ثم اذا اذاقهم منه رحمة اذا فريق منهم بربهم يشركون ليكفروا بما اتيناهم فتمتعوا فسوف تعلمون ام انزلنا عليهم سلطانا فهو يتكلم بما كانوا به يشركون واذا اذقنا الناس رحمة فرحوا بها وان تصبهم سيءة بما قدمت ايديهم اذا هم يقنطون اولم يروا ان الله يبسط الرزق لمن يشاء ويقدر ان في ذلك لايات لقوم يءمنون الروم قوله واذا مس الناس الروم يعني كفار مكة ضر وقحط وسنة دعوا ربهم منيبين اليه الروم اي لا يلتجءون في شداءدهم الي اوثانهم التي يعبدونها مع الله انما يرجعون في دعاءهم الي الله وحده ثم اذا اذاقهم منه رحمة الروم اذا اعطاهم من عنده المطر اذا فريق منهم بربهم يشركون الروم تركوا توحيد ربهم في الرخاء وقد وحدوه في الضر ليكفروا بما اتيناهم الروم ذكرنا تفسيره في اخر العنكبوت ثم خاطب هءلاء الذين فعلوا هذا خطاب تهديد بقوله فتمتعوا فسوف تعلمون سورة الروم حالكم في الاخرة ام انزلنا عليهم الروم علي هءلاء سلطانا حجة وكتابا من السماء فهو يتكلم بما كانوا به يشركون الروم يقولون من الشرك يعني يامرهم به وهذا استفهام انكار اي ليس الامر علي هذا ثم ذكر بطرهم عند النعمة وياسهم عند الشدة بقوله واذا اذقنا الناس رحمة فرحوا بها الروم يعني فرح البطر وترك الشكر وان تصبهم سيءة الروم شدة وبلاء بما قدمت ايديهم الروم بما عملوا من السيءات اذا هم يقنطون الروم قنطوا من رحمة ,False,0468IbnAhmadWahidiNaysaburi.WasitFiTafsir
412316957488,2,Tafsir03097-ara1.ms1243,ثم اذا اذاقهم منه رحمة اذا فريق منهم بربهم يشركون الروم وهم النفوس المتمردة يعودون الي عادتهم المذمومة وطبيعتهم الدنيءة في كفران النعمة ليكفروا بما اتيناهم الروم من النعمة والرحمة ثم هددهم بقوله فتمتعوا فسوف تعلمون الروم ما جزاء ما تعملون علي وفق طباعكم واتباع لهواكم وبقوله ام انزلنا عليهم سلطانا فهو يتكلم بما كانوا به يشركون الروم يشير الي ان اعمال العباد اذا كانت مقرونة بالحجة المنزلة تكون حجة لهم واذا كانت من نتاءج طباع نفوسهم الخبيثة يكون عليهم ثم اخبر عن الانسان الناسي ذكر الله الموكول الي طبعه بقوله واذا اذقنا الناس رحمة الروم في صورة نعمة الدنيا او شهوة النفس والهوي فرحوا بها الروم وغرتهم الحياة الدنيا واعرضوا عن عبودية المولي وان تصبهم سيءة الروم شدة وضيق في حظوظ النفوس وفوات ملاءم الطبع والهوي بشءم بما قدمت ايديهم من مخالفات امر المولي اذا هم يقنطون من رحمة ,False,0618NajmDinAhmadIbnCumar.Tawilat
412316963702,2,JK000195-ara1.inProgress.ms209,احمد بن محمد بن احمد بن محمد بن عبد الله بن سجمان الواءلي البكري الشريشي الاصل الدمشقي الشيخ الامام العلامة كمال الدين ابو العباس بن الشيخ العلامة جمال الدين ابي بكر المعروف بابن الشريشي مولده بسنجار في رمضان سنة ثلاث وخمسين وستماءة سمع ورحل وطلب مدة وقرا بنفسه الكتب الكبار وكان ابوه مالكيا فاشتغل هو في مذهب الشافعي وافتي واشغل ودرس وناظر وناب ,False,0851IbnQadiShuhba.TabaqatShaficiyya
412316963702,2,Shamela0012398-ara1.completed.ms1804,احمد بن الشيخ جمال الدين محمد بن احمد بن الشريشي الواءلي البكري الشافعي وكيل بيت المال وشيخ دار الحديث وشيخ الرباط الناصري مولده في رمضان سنة ثلاث وخمسين وستماءة وسمع ورحل وطلب مدة وقرا بنفسه الكتب الكبار وكان ابوه مالكيا فاشتغل هو في مذهب الشافعي وافتي ودرس وناظر وناب ,False,1089IbnCimad.Shadharat
412316989617,2,Shamela0012715-ara1.mARkdown.ms0690,يعمل فيها النار فتحايل المسلمون واحرقوا البرج الاول فاحترق بمن فيه من الرجال والسلاح ثم احرقوا الثاني والثالث وانبسطت نفوس المسلمين لذلك بعد الكابة ووصل الي السلطان العساكر من البلاد وبلغ المسلمين وصول ملك الالمان وكان قد سار من بلاد وراء القسطنطينية بماءة الف مقاتل واهتم المسلمون لذلك وايسوا من الشام بالكلية فسلط الله تعالي علي الالمان الغلاء والوباء فهلك اكثرهم في الطريق ولما وصل ملكهم الي بلاد الارمن نزل في نهر هناك يغتسل فغرق واقاموا ابنه مقامه فرجع من عسكره طاءفة الي بلادهم وطاءفة خامرت ابن الملك المذكور فرجعوا ايضا ولم يصل مع ابن ملك الالمان الي الفرنج الذين علي عكا غير تقدير الف مقاتل وكفي الله المسلمين شرهم وبقي السلطان والفرنج علي عكا يتناوشون القتال الي العشرين من جمادي الاخرة فخرجت الفرنج من خنادقهم بالفارس والراجل وازالوا الملك العادل عن موضعه وكان معه عسكر مصر فعطفت عليه المسلمون وقتلوا من الفرنج خلقا كثيرا فعادوا الي خنادقهم وحصل للسلطان مغص فانقطع في خيمة صغيرة ولولا ذلك لكانت الفيصلة ولكن اذا اراد الله امرا فلا مرد له ذكر غير ذلك من الحوادث في هذه السنة لما قوي الشتاء واشتدت الرياح ارسل الفرنج المحاصرون عكا مراكبهم الي صور خوفا عليها ان تنكسر فانفتحت الطريق الي عكا في البحر وارسل ,True,0732AbuFida.MukhtasarFiAkhbar
412316989617,2,Kraken210630005153-ara1.ms8911,تعمل فيها النار فتحيل المسلمون واحرقوا البرج الاول فاحترق بمن فيه من الرجال والسلاح ثم احرقوا الثاني والثالث وانبسطت نفوس المسلمين لذلك بعد الكابة وصلت الي السلطان عساكر البلاد وبلغ المسلمين وصول ملك الالمان وكان قد سار من بلاد وراء القسطنطينية بماءة الف مقاتل واغتم المسلمون لذلك وايسوا من الشام فسلط الله علي الالمان الغلاء والوباء فهلك اكثرهم في الطريق ولما وصل ملكهم الي بلاد الارمن نزل في نهر هناك يغتسل فهلك غرقا واقاموا ابنه مقامه فرجع من عسكره طاءفة الي بلادهم وطاءفة اختارت اخا ابن الملك المذكور فرجعوا مع ابن الملك ووصل مع ابن الملك المتولي اولا الي فرنج عكا الف مقاتل وكفي الله المسلمين شرهم وبقي السلطان وفرنج عكا يتناوشون القتال الي العشرين من جمادي الاخرة فخرجت الفرنج بالفارس والراجل من خنادقهم وازالوا الملك العادل عن موقفه وكان معه عسكر مصر فعطف عليهم المسلمون وقتلوا من الفرنج قريب عشرة الاف فارس فرجعوا الي خنادقهم وحصل للسلطان مغص فانقطع في خيمة صغيرة ولولا ذلك لكانت الفيصلة ولكن اذا اراد الله امرا فلا مرد له وفيها لما قوي الشتاء واشتدت الريح ارسل الفرنج مراكبهم الي صور خوفا ان تنكسر فانفتحت الطريق الي عكا في البحر وارسل ,True,0749IbnFadlAllahCumari.MasalikAbsar
412316989618,2,Shamela0012715-ara1.mARkdown.ms0690,من المغاصات وفيها توفي محمود بن علي بن ابي طالب بن عبد الله الاصبهاني المعروف بالقاضي صاحب الطريقة في الخلاف وصنف فيه التعليقة وهي عمدة المدرسين في القاء الدروس ومن لم يذكرها فانما هو لقصور فهمه عن ادراك دقاءقها وكان متفننا في العلوم وله في الوعظ اليد الطولي ثم دخلت سنة ست وثمانين وخمسماءة في هذه السنة بعد دخول صفر رحل السلطان صلاح الدين عن الخروبة وعاد الي قتال الفرنج علي عكا وكان الفرنج قد عملوا قرب سور عكا ثلاثة ابرجة طول البرج ستون ذراعا جاءوا بخشبها من جزاءر البحر وعملوها ,False,0732AbuFida.MukhtasarFiAkhbar
412316989618,2,Shamela0006624-ara1.ms557,من مغاص البحرين وفيها توفي محمود بن علي بن ابي طالب بن عبد الله الاصبهاني المعروف بالقاضي صاحب الطريقة في الخلاف له التعليقة في الخلاف عمدة ومن لم يدرس منها فلقصوره عنها وكان متفننا واعظا حسنا ثم دخلت سنة ست وثمانين وخمسماءة فيها في صفر عاد السلطان عن الخروبة الي قتال الفرنج علي عكا وقد عملوا قرب سورها ثلاثة ابرجة طولها ستون ذراعا خشبها من جزاءر البحر عملوها ,False,0749ZaynDinIbnWardi.Tarikh
412316989619,2,Shamela0012715-ara1.mARkdown.ms0690,سنة ست وثمانين وخمسماءة في هذه السنة بعد دخول صفر رحل السلطان صلاح الدين عن الخروبة وعاد الي قتال الفرنج علي عكا وكان الفرنج قد عملوا قرب سور عكا ثلاثة ابرجة طول البرج ستون ذراعا جاءوا بخشبها من جزاءر البحر وعملوها طبقات وشحنوها بالسلاح والمقاتلة ولبسوها جلود البقر والطين بالخل ,False,0732AbuFida.MukhtasarFiAkhbar
412316989619,2,Kraken210630005153-ara1.ms8910,سنة ست وثمانين بعد ة دخول صفر رحل السلطان من الخروبة وعاد الي قتال الفرنج بعكا وكان الفرنج قد عملوا قرب سور عكا ثلاثة ابرجة طول البرج ستون ذراعا جلبوا خشبها من جزاءر البحر وعملوها طبقات وشحنوها بالسلاح ولبسوها جلود البقر والطين بالخل ,False,0749IbnFadlAllahCumari.MasalikAbsar
412317004624,3,ShamAY0033632-ara1.ms004,ابن اسحاق فاوحي الله بعد ذلك الي داود لما كثر طغيان بني اسراءيل اني اقسمت بعزتي لابتلينهم بالقحط سنتين او اسلط عليهم العدو شهرين او اسلط عليهم الطاعون ثلاثة ايام فجمعهم داود وخيرهم احدي الثلاث فقالوا انت نبينا وانت انظر لنا من انفسنا فاختر لنا فقال اما الجوع فانه بلاء فاضح لا يصبر عليه احد واما العدو والموت فاني اخيركم فان اخترتم تسليط العدو عليكم فلا بقية لكم والموت بيد الله تعالي تموتون باجالكم وفي بيوتكم ففوضوا ذلك الي الله تعالي فهو ارحم بكم فاختار لهم الطاعون وامرهم ان يتجهزوا ويلبسوا اكفانهم ويخرجوا بنساءهم واماءهم واولادهم امامهم وهم خلفهم علي صخرة بيت المقدس والصعيد الذي بني عليه بيت المقدس وهو يومءذ صعيد فنادي يا رب انك امرتنا بالصدقة وانت تحب المتصدقين فتصدق علينا برحمتك اللهم انك امرتنا ان نعتق الرقاب وانت تحب من يعتق الرقاب فنسالك برحمتك ان تعتقنا اليوم اللهم وقد امرتنا ان لا نرد الساءل ,False,0492IbnMurajjaMaqdisi.FadailBaytMaqdis
412317004624,3,Sham19Y0014045-ara1.ms023,ابن اسحاق ان الله تعالي اوحي الي داود عليه السلام لما كثر طغيان بني اسراءيل اني اقسمت بعزتي لابتلينهم بالقحط سنين او اسلطن عليهم العدو شهرين او الطاعون ثلاثة ايام قال فجمعهم داود وخيرهم بين احدي الثلاث فقالوا له انت نبينا وانت انظر لنا من انفسنا فاختر لنا فقال اما الجوع فانه بلاء فاضح لا يصبر عليه احد واما العدو والموت فاني اخيركم ان اخذت تسليط العدو فانه لا يبقي لكم والموت بيد الله تعالي تموتون باجالكم في بيوتكم ففوضوا كل ذلك الي الله تعالي فهو ارحم بكم فاختار لهم الطاعون وامرهم ان يتجهزوا ويلبسوا اكفانهم ويخرجوا نساءهم واموالهم واولادهم وهم خلفهم علي الصخرة والصعيد الذي بني عليه بيت المقدس وهو يومءذ صعيد واحد ففعلوا ثم نادي يا رب انت امرتنا بالصدقة وانت تحب المتصدقين فتصدق علينا برحمتك اللهم انك امرتنا بعتق الرقاب فنسالك برحمتك ان تعتقنا اليوم اللهم وقد امرتنا ان لا نرد الساءل ,False,0880IbnAhmadShamsDinAsyuti.IthafAkhissa
412317004624,3,JK003501-ara1.ms114,العدو شهرين او الطاعون ثلاثة ايام فجمعهم داود وخيرهم بين احدي الثلاث فقالوا انت نبينا وانت انظر الينا من انفسنا فاختر لنا فقال اما الجوع فانه بلاء فاضح لا يصبر عليه احد واما العدو والموت فاني اخبركم ان اخترتم تسليط العدو فانه لا بقية لكم والموت بيد الله تعالي تموتون باجالكم ففوضوا ذلك الي الله تعالي فهو ارحم بكم فاختار لهم الطاعون وامرهم ان يتجهزوا له ويلبسوا اكفانهم ويخرجوا نساءهم واماءهم واولادهم امامهم وهم خلفهم عل الصخرة والصعيد الذيبني عليه مسجد بيت المقدس وهو يومءذ صعيد واحد ففعلوا ثم نادوا يا رب اللهم انك امرتنا بالصدقة وانت تحب المتصدقين فتصدق علينا برحمتك اللهم وقد امرتنا ان لا نرد الساءل ,False,0927Culaymi.UnsJalil
412317007690,2,Shamela0012715-ara1.mARkdown.ms0615,ولده سيف الدين غازي بن زنكي يعلمونه بالحال وهو بشهرزور فسار الي الموصل واستقر في ملكها واما الب ارسلان فتفرقت عنه العساكر وسار الي الموصل يريد ملكها فلما وصلها قبض عليه ,False,0732AbuFida.MukhtasarFiAkhbar
412317007690,2,Kraken210630005153-ara1.ms8828,ولده سيف الدين غازي بن زنكي يعلمونه بالحال وهو يشهرون فسار الي الموصل واستقر في ملكها واما الب ارسلان فتفرقت عنه العساكر وسار الي الموصل يريد ملكها فلما قرب منها قبض عليه ,False,0749IbnFadlAllahCumari.MasalikAbsar
412317027749,2,ShamIbadiyya0000194-ara1.ms1103,حين تقوم من منامك يعني صلاة الصبح في تفسير الحسن وقال بعضهم حين تقوم للصلاة ومن الليل فسبحه اي صلاة المغرب وصلاة العشاء وادبار النجوم يعني الركعتين قبل صلاة الصبح وذكر عن علي قال سءل رسول الله عن قوله وادبار النجوم ,False,0280HudHawari.Tafsir
412317027749,2,Sham19Y0013231-ara1.ms4015,حين تقوم من منامك يعني صلاة الصبح وقال الكلبي سبح الله حين تقوم من فراشك الي ان تدخل في الصلاة وقال الضحاك امران يقول حين يقوم للصلاة الله اكبر كبيرا والحمد لله كثيرا وسبحان الله بكرة واصيلا قوله تعالي ومن الليل فسبحه وادبار النجوم قال ابن عباس يريد فصل له كقوله ومن الليل فتهجد به الاسراء وقال مقاتل يقول فصل المغرب والعشاء وقوله وادبار النجوم يعني الركعتين قبل صلاة الفجر في قول الجميع وذلك حين تدبر النجوم ,False,0468IbnAhmadWahidiNaysaburi.TafsirBasit
412317035692,2,ShamAY0034676-ara1.ms0963,وسق ووسق من تمر ووسوق واوساق ووسق متاعه جعله وسوقا واوسقت البعير حملته الوسق والوسق ووسقه حمله وكل شء جمعته وحملته فقد وسقته قال واني واياكم وشوقا اليكم كقابض ماء لم تسقه انامله والراعي يسق الابل حتي استوسقت اجتمعت وساق العدو الوسيقة والوساءق وهي الطريدة وناقة واسق حامل وقد وسقت ونخلة موسقة وقد اوسقت قال لبيد يصف الجنة يوم ارزاق من يفضل عم موسقات وحفل ابكار ومن المجاز اتسق القمر واتسق امره ,False,0538JarAllahZamakhshari.AsasBalagha
412317035692,2,Shamela0009856-ara1.ms1019,وسق من تمر ووسوق واوساق ووسق متاعه جعله وسوقا وناقة واسق حامل ونخلة موسقة وقد اوسقت قال لبيد يوم ارزاق من يفضل عم موسقات وحفل ابكار واتسق القمر واتسق امره ,False,0817MajdDinFiruzabadi.BasairDhawiTamyiz
412317035694,2,JK000791-ara1.ms2457,شء فاذا جلل الليل الجبال والاشجار والبحار والارض فاجتمعت له فقد وسقها وقال بعضهم معني ما وسق ما جمع مما كان منتشرا بالنهار في تصرفه الي ماواه الانشقاق والقمر اذا اتسق قوله تعالي والقمر اذا اتسق قال ,False,0597IbnJawzi.ZadMasir
