cluster,size,id,text,from_input,book
8590096862,6,Shamela0002247-ara1.ms178,وتعيبه فما بال قطع النخل وتحريقها فنزلت واخرج ابن جرير عن قتادة ومجاهد مثله واخرج ابن المنذر عن يزيد الاصم ان الانصار قالوا يا رسول الله اقسم بيننا وبين اخواننا المهاجرين الارض نصفين قال لا ولكن تكفونهم به المءنة وتقاسمونهم هذا الثمرة والارض ارضكم قالوا رضينا فانزل الله والذين تبوءوا الدار الاية واخرج البخاري عن ابي هريرة ,False,0911Suyuti.LubabNuqul
8590096862,6,Shia002669-ara1.ms777,وتعيبه فما بال قطع النخل وتحريقها فنزلت واخرج ابن جرير عن قتادة ومجاهد مثله اسباب نزول الاية واخرج ابن المنذر عن يزيد الاصم ان الانصار قالوا يا رسول الله اقسم بيننا وبين اخواننا المهاجرين الارض نصفين قال لا ولكن تكفونهم المءنة وتقاسمونهم الثمرة والارض ارضكم قالوا رضينا فانزل الله والذين تبوءا الدار ان ,False,0911Suyuti.TafsirJalalayn
8590096862,6,Shamela0021766-ara1.ms4415,ابن المنذر عن يزيد بن الاصم ان الانصار قالوا يا رسول الله اقسم بيننا وبين اخواننا المهاجرين الارض يعني الارض المملوكة للانصار نصفين قال لا ولكن تكفونهم المءونة وتقاسمونهم الثمرة والارض ارضكم قالوا رضينا فانزل الله تعالي يعني انزل فيهم قوله والذين تبوءا الدار والايمان الاية وروي البخاري عن ابي هريرة ,False,1225ThanaAllahPanipati.TafsirMazhari
8590098133,12,Shamela0021495-ara1.ms106,اخبرنا ابراهيم بن محمد حدثني جعفر بن محمد عن ابيه قال كان النبي صلي الله عليه وسلم يخطب يوم الجمعة وكانت لهم سوق يقال لها البطحاء كانت بنو سليم يجلبون اليها الخيل والابل والغنم والسمن فقدموا فخرج اليهم الناس وتركوا رسول الله صلي الله عليه وسلم وكان لهم لهواذا تزوج احدهم من الانصار ضربوا بالكبر الكبر بفتحتين الطبل وقيل الطبل له وجه واحد لسان فعيرهم الله بذلك فقال واذا راوا تجارة او لهوا انفضوا اليها وتركوك قاءما اخبرنا ابراهيم بن محمد حدثني سلمة بن عبد الله الخطمي عن محمد بن كعب انه سمع رجلا من بني واءل يقول قال النبي صلي الله عليه وسلم تجب الجمعة علي كل مسلم الا امراة او صبيا او مملوكا اخبرنا ابراهيم بن محمد حدثني عبد العزيز بن عمر بن عبد العزيز ص عن ابيه عن عبيد الله بن عبد الله ,False,0204Shafici.Musnad
8590098133,12,ShamAY0034050-ara1.ms690,الخطبة قاءما قال الشافعي رحمه الله قال الله تبارك وتعالي واذا راوا تجارة او لهوا انفضوا اليها وتركوك قاءما الاية قال الشافعي رحمه الله فلم اعلم مخالفا انها نزلت في خطبة النبي صلي الله عليه وسلم يوم الجمعة قال الشافعي رحمه الله اخبرنا ابراهيم بن محمد قال حدثني جعفر بن محمد عن ابيه قال كان رسول الله صلي الله عليه وسلم يخطب يوم الجمعة وكان لهم سوق يقال لها البطحاء كانت بنو سليم يجلبون اليها الخيل والابل والغنم والسمن فقدموا فخرج اليهم الناس وتركوا رسول الله صلي الله عليه وسلم وكان لهم لهو اذا تزوج احد من الانصار ضربوا بالكبر فعيرهم الله بذلك فقال واذا راوا تجارة او لهوا انفضوا اليها وتركوك قاءما الاية ,False,0204Shafici.TafsirShafici
8590098133,12,Shia000820Vols-ara1.ms0358,الخطبة قاءما قال الشافعي رحمه الله تعالي قال الله تبارك وتعالي واذا راوا تجارة او لهوا انفضوا اليها وتركوك قاءما الاية قال الشافعي فلم اعلم مخالفا انها نزلت في خطبة النبي صلي الله عليه وسلم يوم الجمعة قال الشافعي اخبرنا ابراهيم بن محمد قال حدثني جعفر بن محمد عن ابيه قال كان رسول الله صلي الله عليه وسلم يخطب يوم الجمعة وكان لهم سوق يقال لها البطحاء كانت بنو سليم يجلبون اليها الخيل والابل والغنم والسمن فقدموا فخرج اليهم الناس وتركوا رسول الله صلي الله عليه وسلم وكان لهم لهو اذا تزوج احد من الانصار ضربوا بالكبر فعيرهم الله بذلك فقال واذا راوا تجارة او لهوا انفضوا اليها وتركوك قاءما قال الشافعي اخبرنا ابراهيم بن محمد عن جعفر بن محمد عن ابيه عن جابر بن عبد الله قال كان النبي صلي الله عليه وسلم يخطب يوم الجمعة خطبتين قاءما يفصل بينهما بجلوس اخبرنا الربيع قال اخبرنا الشافعي قال اخبرنا ابراهيم بن محمد قال حدثني صالح مولي التوامة عن عبد الله بن نافع عن ابن عمر عن النبي صلي الله عليه ,False,0204Shafici.Umm
8590098133,12,Shamela0002863-ara1.completed.ms0738,قال الله عز وجل واذا راوا تجارة او لهوا انفضوا اليها وتركوك قاءما الجمعة وهذا يءكد رواية من رواها في الخطبة اخبرنا ابو بكر وابو زكريا وابو سعيد قالوا حدثنا ابو العباس اخبرنا الربيع اخبرنا الشافعي قال اخبرنا ابراهيم بن محمد قال حدثني جعفر عن ابيه قال كان النبي صلي الله عليه وسلم يخطب يوم الجمعة وكانت لهم سوق يقال ص لها البطحاء كانت بنو سليم يجلبون اليها الخيل والابل والغنم والسمن فقدموا فخرج اليهم الناس وتركوا رسول الله صلي الله عليه وسلم وكان لهم لهو اذا تزوج احد من الانصار ضربوا بالكبر فعيرهم الله بذلك فقال واذا راوا تجارة او لهوا انفضوا اليها وتركوك قاءما الجمعة واخبرنا ابو بكر وابو زكريا وابو سعيد قالوا حدثنا ابو العباس قال اخبرنا الربيع قال اخبرنا الشافعي قال اخبرنا ابراهيم قال حدثني جعفر عن ابيه عن جابر بن عبد الله قال كان النبي ,False,0458Bayhaqi.MacrifatSunanWaAthar
8590098133,12,Sham19Y0013241-ara1.ms0518,للجمعة متفرقة اخبرنا الشافعي رضي الله عنه اخبرنا ابراهيم بن محمد قال حدثني جعفر بن محمد عن ابيه قال كان النبي صلي الله عليه وسلم يخطب يوم الجمعة فكانت لهم سوق يقال له البطحاء كانت بنو سليم يجلبون الخيل والابل والغنم والسمن فقدموا فخرج اليهم الناس فتركوا رسول الله صلي الله عليه وسلم وكان لهم اذا تزوج احد من الانصار ضربوا بالكبر فعيرهم الله بذلك فقال واذا راوا تجارة او لهوا انفضوا اليها وتركوك قاءما هذا الحديث هكذا جاء مرسلا لان جعفرا رواه عن ابيه عن محمد ومحمد هو الباقر بن علي بن الحسن بن علي بن ابي طالب هو من التابعين وقد جاء هذا المعني مسندا عن جابر بن عبد الله اخرجه البخاري ومسلم والترمذي وهذا لفظ احدي روايات البخاري اخرجه عن معاوية بن عمرو عن زاءدة عن حصين عن سالم بن ابي الجعد ,False,0606IbnAthirMajdDin.Shafi
8590098133,12,Sham19Y0123510-ara1.ms0270,الربيع ابنا الشافعي ابنا ابراهيم بن محمد حدثني جعفر بن محمد عن ابيه قال كان النبي صلي الله عليه وسلم يخطب يوم الجمعة وكانت لهم سوق يقال لها البطحاء كانت بنو سليم يجلبون اليها الخيل والابل والغنم والسمن فقدموا فخرج الناس اليهم وتركوا رسول الله صلي الله عليه وسلم وكان لهم لهو اذا تزوج احدهم من الانصار ضربوا بالكبر فعيرهم الله تعالي بذلك فقال واذا راوا تجارة او له وا انفضوا اليها وتركوك قاءما الشرح الحديث من رواية محمد الباقر مرسل في الكتاب ورايت وصله في الام فقال حدثني جعفر عن ابيه عن جابر قال كان رسول الله صلي الله عليه وسلم يخطب والله اعلم روي مسلم في صحيحه عن اسحاق بن ابراهيم عن جرير عن حصين عن سالم بن ابي الجعد عن جابر بن عبد الله ان النبي صلي الله عليه ,False,0623AbuQasimRafici.SharhMusnadShafici
8590098133,12,Sham19Y0013252-ara1.ms02012,الشافعي عن ابراهيم بن محمد حدثني جعفر بن محمد عن ابيه قال كان النبي صلي الله عليه وسلم يخطب يوم الجمعة وكانت لهم سوق يقال لها البطحاء كانت بنو سليم يجلبون اليها الخيل والابل والسمن فقدموا فخرج اليهم الناس وتركوا رسول الله صلي الله عليه وسلم وكان لهم لهو اذا تزوج احد من الانصار ضربوا بالكبر بفتح الكاف والباء وهو الطبل فعيرهم الله بذلك فقال واذا راوا تجارة الجمعة الاية وهو مرسل لان محمدا الباقر من التابعين وقال السهيلي ذكر اهل التاويل والحديث ان دحية بن خليفة الكلبي قدم من الشام بعير له تحمل طعاما وبرا وكان الناس اذ ذاك محتاجين فانفضوا اليها وتركوا رسول الله صلي الله عليه وسلم ,False,0804IbnMulaqqin.Tawdih
8590098133,12,Shamela0005756-ara1.completed.ms03954,اليها الخيل والابل والسمن وقدموا فخرج اليهم الناس وتركوا رسول الله صلي الله عليه وسلم وكان لهم لهو اذا تزوج احد من الانصار يضربونه يقال له الكبر فعيرهم الله بذلك فقال واذا راوا تجارة او لهوا الجمعة وهو مرسل لان محمد الباقر من التابعين ووصله ابو عوانة في صحيحه والطبري يذكر جابرا فيه انهم كانوا اذ نكحوا تضرب لهم الجواري بالمزامير فيشتد الناس اليهم ويدعون رسول الله صلي الله عليه ,False,0855BadrDinCayni.CumdatQari
8590098133,12,Shamela0005756-ara1.completed.ms03953,الشافعي رحمه الله عن ابراهيم بن محمد حدثني جعفر بن محمد عن ابيه كان النبي صلي الله عليه وسلم يخطب يوم الجمعة وكانت لهم سوق يقال لها البطحاء كانت بنو سليم يجلبون ,False,0855BadrDinCayni.CumdatQari
8590098133,12,Shamela0023695-ara1.completed.ms0674,جعفر بن محمد عن ابيه قال كان رسول الله صلي الله عليه وسلم يخطب يوم الجمعة وكان لهم سوق يقال لها البطحاء كانت بنو سليم يجلبون اليها الخيل والابل والغنم والسمن فقدموا فخرج اليهم الناس ,False,0911Samhudi.WafaWafa
8590098133,12,ShamAY0035950-ara1.ms113,اخبرنا ابراهيم بن محمد حدثني جعفر بن محمد عن ابيه قال كان النبي صلي الله عليه وسلم يخطب يوم الجمعة وكانت لهم سوق يقال لها البطحاء كانت بنو سليم يجلبون اليها الخيل والابل والغنم والسمن فقدموا فخرج اليهم الناس وتركوا رسول الله صلي ,False,0911Suyuti.Shafi
8590098133,12,Shia004092Vols-ara1.ms10140,عليه السلام في قوله تعالي واذا راوا تجارة او لهوا انفضوا اليها وتركوك قاءما الجمعة رواه جماعة من الاعلام في كتبهم فمنهم قاءد الشافعية ابو عبد الله محمد بن ادريس الشافعي المتوفي سنة في المسند ص ط دار الكتب العلمية في بيروت قال اخبرنا ابراهيم بن محمد حدثني جعفر بن محمد عن ابيه قال كان النبي صلي الله عليه وسلم يخطب يوم الجمعة وكانت لهم سوق يقال لها البطحاء كانت بنو سليم يجلبون اليها الخيل والابل والغنم والسمن فقدموا فخرج اليهم الناس وتركوا رسول الله صلي الله عليه وسلم وكان لهم لهو اذا تزوج احدهم من الانصار ضربوا بالكير فعيرهم الله بذلك فقال واذا راوا تجارة او لهوا انفضوا اليها وتركوك قاءما ومنهم العلامة الشيخ محمد عابد بن احمد بن علي بن القاضي محمد الواعظ الحنفي الانصاري الايوبي السندي المتولد بها والمتوفي سنة في المدينة المنورة في ترتيب مسند الشافعي ج ص ط بيروت سنة قال اخبرنا ابراهيم بن محمد حدثني جعفر بن محمد عن ابيه قال كان النبي صلي الله عليه وسلم يخطب يوم الجمعة ,False,1411SayyidMarcashi.SharhIhqaq
8590106043,2,Shamela0023613-ara1.ms4263,اسقطنا عليهم قطعة من السماء لقالوا هذا سحاب مركوم بعضه فوق بعض ومعني يصعقون يموتون وذلك عند النفخة الاولي قوله عذابا دون ذلك اي قبل يوم القيامة وهو القتل ببدر القحط سبع سنين وعذاب القبر واصبر لحكم ربك بامهالهم وتبليغ الرسالة فانك محفوظ باعيننا ,False,0730NizamDinNaysaburi.GharaibQuran
8590106043,2,Sham19Y0020891-ara1.ms6098,اسقطناه عليهم لقالوا هذا سحاب مركوم بعضه فوق بعض يمطرنا ولم يصدقوا انه كسف ساقط للعذاب وقرء حتي يلاقوا و يلقوا يصعقون يموتون وقرء يصعقون يقال صعقه فصعق وذلك عند النفخة الاولي نفخة الصعق وان للذين ظلموا وان لهءلاء الظلمة عذابا دون ذلك دون يوم القيامة وهو القتل ببدر والقحط سبع سنين وعذاب القبر وفي مصحف عبد الله دون ذلك قريبا واصبر لحكم ربك فانك باعيننا ,False,0743SharafDinTibi.FutuhGhayb
8590106046,2,Shamela0023613-ara1.ms4263,قولهم او تسقط السماء كما زعمت علينا كسفا والمراد انهم لفرط عنادهم لا يفيد معهم شء من الدلاءل فلو اسقطنا عليهم قطعة من السماء لقالوا هذا سحاب مركوم بعضه فوق بعض ,False,0730NizamDinNaysaburi.GharaibQuran
8590106046,2,Zaydiyya0000062-ara1.ms1935,قولهم او تسقط السماء كما زعمت علينا كسفا يريد انهم لشدة طغيانهم وعنادهم لو اسقطنا عليهم لقالوا هذا سحاب مركوم بعضه فوق بعض ,False,0810IbnHadi.JawharShaffaf
8590111400,6,ShamIbadiyya0000194-ara1.ms0749,المستقيم الي الجنة قوله وان الذين لا يءمنون بالاخرة عن الصراط لناكبون اي لجاءرون وقال بعضهم لتاركون اي لتاركون له وقال الكلبي معرضون عنه وهو واحد قوله ولو رحمناهم وكشفنا ما بهم من ضر يعني اهل مكة وذلك حين اخذوا بالجوع فقال الله ولو رحمناهم وكشفنا ما بهم من ضر للجوا في طغيانهم يعمهون ,False,0280HudHawari.Tafsir
8590111400,6,JK007095-ara1.ms416,وان الذين لا يءمنون بالاخرة عن الصراط لناكبون اي تاركون له سورة المءمنون من اية اية المءمنون ولو رحمناهم وكشفنا ولو رحمناهم وكشفنا ما بهم من ضر نزلت في اهل مكة وذلك حين اخذوا بالجوع سبع سنين حتي اكلوا الميتة والعظام واجهدوا حتي جعل احدهم يري ما بينه وبين السماء دخانا وهو قوله فارتقب يوم تاتي السماء بدخان مبين نزلت هذه الاية قبل ان يءخذوا بالجوع ثم اخذوا به فقال الله وهم في ذلك الجوع ولو رحمناهم وكشفنا ما بهم من ضر للجوا في طغيانهم يعمهون ,False,0399IbnAbiZamanaynIlbiri.Tafsir
8590111400,6,JK006476-ara1.ms1100,وان الذين لا يءمنون بالاخرة عن الصراط لناكبون اي عن طريق الحق لعادلون المءمنون ولو رحمناهم وكشفنا قوله تعالي ولو رحمناهم وكشفنا ما بهم من ضر روي ان النبي دعا علي قريش فقال اللهم اجعل عليهم سنين كسني يوسف فاصابهم الجدب والقحط حتي اكلوا العلهز وهو الدم بالوبر فانزل الله تعالي هذه الاية ولو ولو رحمناهم وكشفنا ما بهم من ضر للجوا في طغيانهم يعمهون ,False,0489IbnMuhammadSamcani.TafsirQuran
8590111400,6,Shamela0008473-ara1.mARkdown.ms3308,النساءي وابن حبان وقوله وان الذين لا يءمنون بالاخرة عن الصراط لناكبون اي لعادلون جاءرون منحرفون تقول العرب نكب فلان عن الطريق اذا زاغ عنها وقوله ولو رحمناهم وكشفنا ما بهم من ضر للجوا في طغيانهم يعمهون يخبر تعالي عن غلظهم في كفرهم بانه لو اراح عللهم وافهمهم القران لما انقادوا له ولاستمروا علي كفرهم وعنادهم وطغيانهم كما ,False,0774IbnKathir.TafsirQuran
8590111400,6,Shamela0023631-ara1.ms3417,ولو رحمناهم وكشفنا ما بهم من ضر للجوا في طغيانهم يعمهون قال ابن جرير اي ولو رحمنا هءلاء الذين لا يءمنون بالاخرة ورفعنا عنهم ما بهم من القحط والجدب وضر الجوع والهزال للجوا في طغيانهم يعني في عتوهم وجراتهم علي ربهم يعمهون يعني يترددون واشار ابن كثير الي معني اخر فقال يخبر تعالي عن غلظهم في كفرهم بانه لو ازاح عنهم الضر وافهمهم القران لما انقادوا له ولاستمروا علي كفرهم وعنادهم وطغيانهم كما ,False,1332IbnMuhammadJamalDinQasimi.MahasinTawil
8590111400,6,Tafsir09084-ara1.ms1658,وقوله وان الذين لا يءمنون بالاخرة عن الصراط لناكبون اي لعادلون جاءرون منحرفون تقول العرب نكب فلان عن الطريق اذا زاغ عنها وقوله ولو رحمناهم وكشفنا ما بهم من ضر للجوا في طغيانهم يعمهون يخبر تعالي عن غلظهم في كفرهم بانه لو ازاح عنهم الضر وافهمهم القران لما انقادوا له ولاستمروا علي كفرهم وعنادهم وطغيانهم كما ,False,1450MuhammadCaliSabuni.MukhtasarTafsirIbnKathir
8590118922,48,Tafsir06048-ara1.ms1121,وسبح بحمد ربك حين تقوم من منامك يعني صلاة الصبح في تفسير الحسن وقال بعضهم حين تقوم للصلاة ومن الليل فسبحه اي صلاة المغرب وصلاة العشاء وادبار النجوم يعني الركعتين قبل صلاة الصبح وذكر عن علي قال سءل رسول الله صلي الله عليه وسلم عن قوله وادبار النجوم فقال هما الركعتان قبل صلاة الصبح ,False,0250HudHawari.Tafsir
8590118922,48,Tafsir06048-ara1.ms1105,سنة مما تعدون الحج قال عز وجل وما مسنا من لغوب اي من اعياء وذلك ان اليهود اعداء الله قالت لما فرغ الله من خلق السماوات والارض اعيا فاستلقي علي ظهره ثم وضع احدي رجليه علي الاخري استراح فانزل الله وما مسنا من لغوب ذكروا عن داود بن حصين عن عكرمة عن ابن عباس انه استلقي يوما علي ظهره ثم رفع احدي رجليه علي الاخري ثم قال كذبت اليهود اعداء الله ما مس الله من لغوب ذكروا عن عبادة بن الاشيم انه راي رسول الله مسلتقيا وضع احدي رجليه علي الاخري وهو يقول ما مس الله من نصب قوله عز وجل فاصبر علي ما يقولون اي علي ما يقول لك قومك انك شاعر وانك ساحر وانك كاهن وانك كاذب وانك مجنون قال وسبح بحمد ربك قبل طلوع الشمس وقبل الغروب قال بعضهم هما صلاة الصبح وصلاة العصر وتفسير الحسن هي الصبح والظهر والعصر قوله عز وجل ومن الليل فسبحه يعني صلاة المغرب وصلاة العشاء وادبار السجود عن علي قال سءل رسول الله صلي ,False,0250HudHawari.Tafsir
8590118922,48,ShamIbadiyya0000194-ara1.ms1088,سنة مما تعدون الحج قال وما مسنا من لغوب اي من اعياء وذلك ان اليهود اعداء الله قالت لما فرغ الله من خلق السماوات والارض اعيا فاستلقي علي ظهره ثم وضع احدي رجليه علي الاخري استراح فانزل الله وما مسنا من لغوب ذكروا عن داود بن حصين عن عكرمة عن ابن عباس انه استلقي يوما علي ظهره ثم رفع احدي رجليه علي الاخري ثم قال كذبت اليهود اعداء الله ما مس الله من لغوب ذكروا عن عبادة بن الاشيم انه راي رسول الله مسلتقيا وضع احدي رجليه علي الاخري وهو يقول ما مس الله من نصب قوله فاصبر علي ما يقولون اي علي ما يقول لك قومك انك شاعر وانك ساحر وانك كاهن وانك كاذب وانك مجنون قال وسبح بحمد ربك قبل طلوع الشمس وقبل الغروب قال بعضهم هما صلاة الصبح وصلاة العصر وتفسير الحسن هي الصبح والظهر والعصر قوله ومن الليل فسبحه يعني صلاة المغرب وصلاة العشاء وادبار السجود عن علي قال سءل رسول الله عن ادبار السجود فقال هما الركعتان بعد صلاة المغرب وسءل عن ادبار النجوم فقال هما الركعتان قبل صلاة الصبح ,False,0280HudHawari.Tafsir
8590118922,48,ShamAY0033108-ara1.ms1128,تعالي فاصبر علي ما يقولون اي فاصبر يا محمد علي ما يقولون من الشتم والتكذيب فسيعود عليهم وبال ذلك قوله تعالي وسبح بحمد ربك قبل طلوع الشمس اي صل صلاة الفجر وقبل غروبها يعني صلاة العصر ومن اناء الليل فسبح يعني المغرب والعشاء واناء ,False,0360Tabarani.Tafsir
