cluster,size,id,text,from_input,book
140997,19,Shamela0037325-ara1.ms1151,احمد بن الموفق طلحة بن المتوكل العباسي ولد سنة اربع وستين وماءتين وكان يضرب المثل بحسنه في زمانه وكان رجلا ربعة ليس بالطويل ولا بالقصير معتدل الجسم حسن الخلق جميل الوجه اسود الشعر وافر اللحية عريضها بويع بالخلافة عند موت والده سنة تسع وثمانين فاستخلف ستة اعوام ونصفا قال الصولي سمعت المكتفي يقول في علته والله ما اسي الا علي سبعماءة الف دينار صرفتها من مال المسلمين في ابنية ما احتجت اليها وكنت مستغنيا عنها اخاف ان اسال عنها واني استغفر الله منها مات المكتفي شابا في ذي القعدة سنة خمس وتسعين ,False,1450Maghrawi.MawsucatMawaqifSalaf
141000,6,Shamela0035100-ara1.mARkdown.ms04606,ان صح قال شكوا في موت المعتضد فتقدم الطبيب فجس نبضه ففتح عينه ورفس الطبيب برجله فدحاه اذرعا فمات الطبيب ثم مات المعتضد من ساعته ,False,0748Dhahabi.TarikhIslam
141000,6,JK003609-ara1.mARkdown.ms1547,وكان يسمي السفاح الثاني لانه جدد ملك بني العباس وكان قد خلق وضعف وكاد يزول لانه كان في اضطراب من وقت موت المتوكل وكانت ايامه طيبة كثيرة الامن والرخاء وسقط المكوس ونشر العدل ورفع المظالم عن الرعية وانشا قصرا انفق عليه اربع ماءة الف دينار وكان مزاجه قد تغير من افراطه في الجماع وعدم الحمية بحيث انه اكل في علته زيتونا وسمكا وشكوا في موته فتقدم الطبيب فجس نبضه ففتح عينه ورفس الطبيب فدحاه اذرعا فمات الطبيب ثم مات المعتضد وقيل انه غم في بساط الي ان مات وبويع ابنه المكتفي فكانت ولاية المعتضد تسع سنين وتسعة اشهر ,False,0764Safadi.WafiBiWafayat
141000,6,Shamela0006669-ara1.completed.ms071,المسعودي ان صح قال شكوا في موت المعتضد فتقدم الطبيب فجس نبضه ففتح عينه ورفس الطبيب برجله فدحاه اذرعا ومات الطبيب ثم مات المعتضد من ساعته ,False,0874IbnTaghribirdi.MawridLatafa
141000,6,JK001330-ara1.mARkdown.ms0604,قال شكوا في موت المعتضد فتقدم الطبيب فجس نبضه ففتح عينه ورفس الطبيب برجله فدحاه اذرعا فمات الطبيب ثم مات المعتضد ايضا من ساعته هكذا ,False,0874IbnTaghribirdi.NujumZahira
141000,6,Shamela0011997-ara1.ms317,المسعودي قال شكوا في موت المعتضد فتقدم اليه الطبيب وجس نبضه ففتح عينيه ورفس الطبيب برجله فدحاه اذرعا فمات الطبيب ثم مات المعتضد من ساعته ولما ,False,0911Suyuti.TarikhKhulafa
141000,6,Shamela0009784-ara1.ms1741,وكان المعتضد يسمي السفاح الثاني لانه جدد ملك بني العباس ومن عجيب ما ذكر عنه المسعودي ان صح قال شكوا في موت المعتضد فتقدم الطبيب فجس نبضه ففتح عينيه ورفس الطبيب برجله فدحاه اذرعا ومات الطبيب ثم مات المعتضد من ساعته وكانت خلافته تسع سنين وتسعة اشهر ,False,0966HusaynDiyarbakri.TarikhKhamis
144472,9,Shamela0025841-ara1.mARkdown.ms261,وفيها توفي الراضي بالله ابو اسحاق محمد وقيل احمد بن المقتدر بالله جعفر بن المعتضد بالله احمد بن ابي احمد بن المتوكل علي الله العباس ولد سنة سبع وتسعين وماءتين من جارية رومية اسمها ظلوم كان قصيرا اسمر نحيفا في وجهه طول واستخلف سنة اثنتين وعشرين وثلاثمءة وهو اخر خليفة له شعر مدون واخر خليفة انفرد بتدبير الجيوش والي خلافة المقتفي واخر خليفة خطب يوم الجمعة الي خلافة الحاكم العباسي فانه خطب ايضا مرتين واخر خليفة جالس الندماء ولكنه كان مقهورا مع امراءه مرض في ربيع الاول بمرض دموي ومات وكان سمحا كريما محبا للعلماء ,False,0748Dhahabi.CibarFiKhabar
144472,9,Shamela0010906-ara1.mARkdown.ms5016,الراضي بالله محمد ابن المقتدر بالله جعفر الخليفة ابو اسحاق محمد وقيل احمد ابن المقتدر بالله جعفر ابن المعتضد بالله احمد بن الموفق بن المتوكل الهاشمي العباسي ولد سنة سبع وتسعين وماءتين وامه رومية كان اسمر قصيرا نحيفا في وجهه طول استخلف بعد عمه القاهر عندما سملوا القاهر سنة اثنين وعشرين وثلاث ماءة قال ابو بكر الخطيب له فضاءل منها انه اخر خليفة خطب يوم الجمعة واخر خليفة جالس الندماء واخر خليفة له شعر مدون واخر خليفة انفرد بتدبير الجيوش وكانت جواءزه واموره علي ترتيب المتقدمين منهم وكان سمحا جوادا اديبا فصيحا محبا للعلماء سمع ,False,0748Dhahabi.SiyarAclamNubala
144472,9,Shamela0035100-ara1.mARkdown.ms05266,محمد بن احمد بن خاقان العكبري محمد وقيل احمد ابو اسحاق امير المءمنين الراضي بالله ابن المقتدر بالله جعفر ابن المعتضد بالله احمد بن ابي احمد الموفق الوفاة ه ولي العهد ابن المتوكل ولد سنة سبع وتسعين وماءتين وامه امة رومية وكان قصيرا اسمر نحيفا في وجهه طول بويع بالامر بعد عمه القاهر لما سملوا القاهر سنة اثنتين وعشرين وثلاثماءة قال الخطيب ابو بكر وللراضي فضاءل منها انه اخر خليفة له شعر مدون واخر خليفة انفرد بتدبير الجيوش واخر خليفة خطب يوم ,False,0748Dhahabi.TarikhIslam
144472,9,Shamela0006669-ara1.completed.ms079,المقتدر بالله جعفر بن المعتضد احمد بن ولي العهد الموفق طلحة بن المتوكل جعفر الهاشمي العباسي امير المءمنين بويع بالخلافة بعد عمه القاهر حسبما تقدم ذكره بعدما سمل القاهر سنة اثنتين وعشرين وثلثماءة ومولد الراضي في سنة سبع وتسعين وماءتين وامه ام ولد رومية تسمي ظلوم وكان الراضي قصيرا اسمرا نحيفا في وجهه طول قلت وفي ايامه ضعف امر الخلافة وانحل امرها حتي لم يبق للخلفاء من البلاد سوي بغداد وما والاها وعظم في ايامه امر الحنابلة ببغداد حتي صاروا يكبسون دور الامراء والقواد فان وجدوا نبيذا اراقوه او قنينة كسروها ثم اعترضوا علي الناس في البيع والشراء انتهي وقال ابو بكر الخطيب وكان للراضي فضاءل منها انه اخر خليفة له شعر مدون واخر خليفة انفرد بتدبير الجيوش واخر خليفة خطب يوم الجمعة واخر خليفة جالس الندماء وكانت جواءزه واموره علي ترتيب الخلفاء المتقدمين انتهي قلت وتوفي الراضي في شهر ربيع الاول سنة ,False,0874IbnTaghribirdi.MawridLatafa
144472,9,JK001330-ara1.mARkdown.ms0704,وفيها توفي امير المءمنين الراضي بالله ابو اسحاق محمد ابن الخليفة جعفر المقتدر ابن الخليفة المعتضد احمد ابن ولي العهد الموفق طلحة ابن الخليفة المتوكل جعفر ابن الخليفة المعتصم محمد ابن الخليفة الرشيد هارون ابن الخليفة المهدي محمد ابن الخليفة ابي جعفر المنصور عبد الله بن محمد بن علي بن عبد الله ابن العباس الهاشمي البغدادي العباسي بويع بالخلافة بعد موت عمه القاهر بالله ومات في منتصف شهر ربيع الاخر وهو ابن احدي وثلاثين سنة وستة اشهر وبويع بالخلافة اخوه ابراهيم ولقب بالمتقي وام الراضي ام ولد رومية كان الراضي فاضلا سمحا جوادا شاعرا محبا للعلماء وهو اخر خليفة له شعر مدون واخر خليفة انفرد بتدبير الجند واخر خليفة خطب يوم الجمعة واخر خليفة جالس الندماء ,False,0874IbnTaghribirdi.NujumZahira
144472,9,Shamela0009784-ara1.ms1754,الراضي بالله ابو العباس محمد بن المقتدر جعفر بن المعتضد احمد بن ولي العهد الموفق طلحة بن المتوكل جعفر الهاشمي العباسي امير المءمنين امه ام ولد رومية تسمي ظلوم ومولده في سنة سبع وتسعين وماءتين صفته كان قصيرا اسمر نحيفا في وجهه طول بويع بالخلافة بعد عمه القاهر حسبما تقدم ذكره بعد ما سمل القاهر سنة اثنتين وعشرين وثلثماءة واستوزر ابا علي بن مقلة وكان بديع الخط وفي ايام الراضي ضعف امر الخلافة حتي لم يبق للخلفاء من البلاد سوي بغداد وما والاها وعظم في ايامه امر الحنابلة ببغداد حتي صاروا يكبسون دور الامراء والقواد فان وجدوا نبيذا اراقوه او قنية كسروها ثم اعترضوا علي الناس في البيع والشراء قال ابو بكر الخطيب وكان للراضي فضاءل منها انه اخر خليفة له شعر مدون واخر خليفة انفرد بتدبير الجيوش واخر خليفة خطب يوم الجمعة واخر خليفة جالس الندماء وكانت جواءزه واموره علي ترتيب المتقدمين ,False,0966HusaynDiyarbakri.TarikhKhamis
144472,9,Sham19Y0019199-ara1.ms0742,النحاة محمد بن جعفر بن احمد بن طلحة الراضي بالله الخليفة العباسي ولد سنة وامه رومية اسمها ظلوم بويع بالخلافة بعد عمه وكان قصيرا اسمر نحيفا في وجهه طول وفي ايامه ضعف امر الخلافة حتي لم يبق للخلفاء من البلاد سوي بغداد وما والاها وعظم في ايامه امر الحنابلة ببغداد حتي صاروا يكسرون دور الامراء ثم اعترضوا علي الناس في البيع والشراء قال الخطيب للراضي فضاءل منها انه اخر خليفة خطب يوم الجمعة واخر خليفة جالس الندماء وكانت جوايزه واموره علي ترتيب المتقدمين الي ان توفي في شهر ربيع الاول سنة ,False,1067HajjiKhalifa.SullamWusul
144472,9,Shamela0012398-ara1.completed.ms0662,الراضي بالله الخليفة ابو اسحاق محمد وقيل احمد بن ابي احمد بن المتوكل العباسي ولد سنة سبع وتسعين وماءتين من جارية رومية اسمها ظلوم وكان قصيرا اسمر نحيفا في وجهه طول استخلف سنة اثنتين وعشرين وثلاثماءة وهو اخر خليفة له شعر مدون واخر خليفة انفرد بتدبير الجيوش الي خلافة المتقي واخر خليفة خطب يوم الجمعة الي خلافة الحاكم العباسي فانه خطب ايضا مرتين واخر خليفة جالس الندماء ولكنه كان مقهورا مع امراءه مرض في ربيع الاول بمرض دموي ومات وكان سمحا كريما محبا للعلماء ,False,1089IbnCimad.Shadharat
144472,9,Shamela0037325-ara1.ms1276,الراضي احمد بن المقتدر ه الخليفة محمد وقيل احمد ابو اسحاق الراضي بالله بن المقتدر بالله جعفر ابن المعتضد بالله احمد بن ابي احمد بن المتوكل ولد سنة سبع وتسعين وماءتين وامه امة رومية وكان قصيرا اسمر نحيفا في وجهه طول استخلف بعد عمه القاهر عندما سملوا القاهر سنة اثنتين وعشرين وثلاثماءة قال الخطيب له فضاءل منها انه اخر خليفة له شعر مدون واخر خليفة انفرد بتدبير الجيوش واخر خليفة خطب الجمعة واخر خليفة جالس الندماء وكانت جواءزه واموره علي ترتيب المتقدمين منهم وكان سمحا جوادا اديبا فصيحا محبا للعلماء ومن ,False,1450Maghrawi.MawsucatMawaqifSalaf
146292,2,ShamAY0036795-ara1.ms432,الباب الثالث والثلاثون في ذكر ترجمة اسامي ذوي الاختيار علي سبيل الاختصار الباب الرابع والثلاثون في ذكر كيفية الاستعاذة ومعرفة معانيها الباب الخامس والثلاثون في ذكر التسمية الباب السادس والثلاثون في ذكر تغليظ اللام من اسم الله عز وعلا والترقيق الباب السابع والثلاثون في ذكر التامين الباب الثامن والثلاثون في ذكر التكبير الباب التاسع والثلاثون في ذكر ,False,0500AhmadAndarabi.IdahFiQiraat
146292,2,Shamela0008362-ara1.ms0018,الباب الثالث والثلاثون في ذكر شء من خبر بني قصي بن كلاب وتوليتهم لما كان بيده من الحجابة والسقاية والرفادة والندوة واللواء والقيادة وتفسير ذلك الباب الرابع والثلاثون في ذكر شء من خبر الفجار والاحابيش الباب الخامس والثلاثون في حلف الفصول وخبر ابن جدعان الذي كان هذا الحلف في داره وذكر اجواد قريش وحكامهم في الجاهلية وتملك عثمان بن الحويرث بن اسد بن عبد العزي بن قصي عليهم وشء من خبره الباب السادس والثلاثون في ذكر فتح مكة المشرفة وفواءد تتعلق بخبر فتحها الباب السابع والثلاثون في ذكر ولاة مكة المشرفة في الاسلام الباب الثامن والثلاثون في ذكر حوادث تتعلق بمكة في الاسلام الباب التاسع والثلاثون في ذكر ,False,0832AbuTayyibFasi.ShifaGharam
149734,8,Shamela0012031-ara1.mARkdown.ms0400,وعن الحسن بن سعيد اللخمي عن جعفر بن محمد قال من لم يغضب من الجفوة لم يشكر النعمة وعن الحرمازي قال كان رجل من اهل السواد يلزم جعفر بن محمد ففقده فسال عنه فقال له رجل انه نبطي يريد ان يضع منه فقال جعفر اصل الرجل عقله وحسبه ودينه وكرمه تقواه والناس في ادم مستوون وعن سفيان الثوري قال سمعت جعفر بن محمد الصادق يقول عزت السلامة حتي لقد خفي مطلبها فان تكن في شء فيوشك ان تكون في الخمول فان طلب في الخمول ولم توجد فيوشك ان تكون في التخلي وليس كالخمول فان طلبت في التخلي ولم توجد فيوشك ان تكون في الصمت وليس كالتخلي فان طلب في الصمت فلم توجد فيوشك ان تكون في كلام السلف الصالح والسعيد من وجد في نفسه خلوة يشتغل بها وعن عبد الله بن الفضيل بن الربيع عن ابيه ولم يحفظ علي الدعاء وبعضه عن غيره قال حج ابو جعفر سنة سبع واربعين وماءة فقدم المدينة وقال ابعث الي جعفر بن محمد من ,False,0597IbnJawzi.SifatSafwa
149734,8,SHAM19Y23644-ara1.ms4294,جعفر يقول من لم يغضب من الجفوة لم يشكر النعمة وقال اصل الرجل عقله وحسبه تقواه وكرمه دينه والناس في ادم مستوون وقال لقد عزت السلامة حتي خفي مطلبها فان تكن في شء ففي الخمول فان طلبت في الخمول ولم توجد فيوشك ان تكون في التخلي فان لم توجد ففي الصمت والسعيد من وجد في نفسه حالة يشتغل بها وقال ,False,0654SibtIbnJawzi.MiratZaman
149734,8,ShamAY0033599-ara1.ms230,قال جعفر من لم يغضب من الجفوة لم يشكر النعمة قال وكان يتردد اليه رجل من السواد فانقطع عنه فسال عنه فقال بعض القوم انه نبطي يريد ان يضع منه فقال جعفر اصل الرجل عقله وحسبه ودينه وكرمه تقواه والناس في ادم مستوون وبه قال الثوري سمعت جعفرا يقول عزت السلامة حتي لقد خفي مطلبها فان تكن في شء فيوشك ان تكون في الخمول فان لم يوجد الخمول ففي التخلي وليس كالخمول وان لم يوجد في التخلي ففي الصمت والسعيد من وجد في نفسه خلوة يشتغل بها ,False,0654SibtIbnJawzi.TadhkiratKhawass
149734,8,Shia003707Vols-ara1.completed.ms0705,وعن الحسن بن سعيد اللخمي عن جعفر بن محمد قال من لم يغضب من الجفوة لم يشكر النعمة وقال عليه السلام اصل الرجل عقله وحسبه دينه وكرمه تقواه والناس في ادم مستوون وروي حديث سفيان وقول الصادق عليه السلام له عزت السلامة حتي لقد خفي مطلبها الي اخره وما احسن قوله عليهما السلام في اخر الحديث والسعيد من وجد في نفسه خلوة يشتغل بها وروي حديث المنصور حين امر الربيع باحضاره عليه السلام متعبا وروي حديث الليث بن سعد والعنب والبردين وقد تقدم ذكره قال اسند جعفر بن محمد عن ,False,0693IbnAbiFathIrbili.KashfGhumma
149734,8,Shia003711-ara1.ms097,من لم يغضب من الجفوة لم يشكر النعمة قال وكان يتردد اليه رجل من السواد فانقطع عنه فسال عنه فقال بعض القوم انه نبطي يريد ان يضع منه اصل الرجل عقله وكرمه تقواه والناس في ادم مستوون وقال عليه السلام عزت السلامة حتي لقد خفي مطلبها فان تكن في شء فيوشك ان تكون في الخمول فان لم يوجد الخمول ففي التخلي وليس كالخمول وان لم يوجد في التخلي ففي الصمت والسعيد من وجد في نفسه خلوة يشتغل بها ,False,0705IbnYusufHilli.CudadQawiyya
149734,8,Zaydiyya0000035-ara1.ms077,اصل الرجل عقله وحسبه دينه وكرمه والناس في ادم مستوون فخجل الرجل وقال سفيان الثوري سمعت جعفر الصادق عليه السلام يقول عزت السلامة حتي لقد خفي مطلبها وان تك في شء فيوشك ان تكون في الخمول وان طلبت في الخمول فلم يوجد فيوشك ان تكون في العزلة والخلوة فان لم يوجد في العزلة والخلوة فيوشك ان تكون في كلام السلف الصالح والسعيد من وجد في نفسه خلوة يشتغل بها عن الناس ومن كلامه عليه السلام ,False,1111IbnNasirMuhalla.MatmahAmal
149734,8,Shia003636Vols-ara1.inProgress.ms02059,عزت السلامة حتي لقد خفي مطلبها فان تكن في شء فيوشك ان تكون في الخمول فان طلبت في الخمول فلم توجد فيوشك ان تكون في الصمت فان طلبت في الصمت فلم توجد فيوشك ان تكون في التخلي فان طلبت في التخلي فلم توجد فيوشك ان تكون في كلام السلف الصالح والسعيد من وجد في نفسه خلوة يشتغل بها قال ,False,1371MuhsinAminCamili.AcyanShica
149734,8,Shia004092Vols-ara1.ms04778,عزت السلامة حتي لقد خفي مطلبها فان تكن في شء فيوشك ان تكون في الخمول فان طلبت في الخمول ولم توجد فيوشك ان تكون في الصمت وان طلبت في الصمت ولم توجد فيوشك ان تكون في التخلي وان طلبت في التخلي فلم توجد فيوشك ان تكون في كلام السلف الصالح والسعيد من وجد في نفسه خلوة يشتغل بها رواه ,False,1411SayyidMarcashi.SharhIhqaq
150793,2,Tafsir02091-ara1.ms0122,صلي الله عليه وسلم يعطي الشهيد ست خصال عند اول قطرة من دمه يكفر عنه كل خطيءة ويري مقعده من الجنة ويزوج من الحور العين ويءمن من الفزع الاكبر ومن عذاب القبر ويحلي حلية الايمان قوله تعالي ولكن لا تشعرون اي لا يشعرون انهم كذلك قوله تعالي ولنبلونكم بشء من الخوف والجوع اي ولنختبرنكم يا امة محمد بشء من الخوف يعني خوف العدو والفزع في القتال وقحط السنين وقلة ذات اليد ونقص من الاموال اي هلاك المواشي وذهاب الاموال وقوله تعالي والانفس اراد به الموت والقتل والامراض وقوله تعالي والثمرات اي لا يخرج الثمار والزروع كما كانت تخرج من قبل او تصيبها افة واراد بالثمرات الاولاد لانهم ثمرة القلب وهم اذا هم شغلوا بالجهاد منعهم ذلك عن عمارة البساتين ومناكحة النساء فيقل اولادهم وثمرة بساتينهم وقال بعضهم معناه ولنبلونكم بشء من الخوف اي خوف الله تعالي والجوع يعني صوم رمضان ونقص من الاموال اداء الزكاة الصدقات والانفس الامراض والثمرات موت الاولاد لان ولد الرجل ثمرة فءاده يدل ,False,0360Tabarani.TafsirKabir
150793,2,Shamela0023578-ara1.completed.ms0224,صلي الله عليه وسلم قال يعطي الشهيد ست خصال عند اول قطرة من دمه يكفر عنه كل خطيءة ويري مقعده من الجنة ويزوج من الحور العين ويءمن من الفزع الاكبر ومن عذاب القبر ويحلي بحلية الايمان ولنبلونكم ولنختبرنكم يا امة محمد بشء من الخوف والجوع الاية قال ابن عباس الخوف يعني خوف العدو والجوع يعني المجاعة والقحط ونقص من الاموال يعني الخسران والنقصان في المال وهلاك المواشي والانفس يعني الموت والقتل وقيل المرض وقيل الشيب والثمرات يعني الحواءج وان لا تخرج الثمرة كما كانت تخرج وقال الشافعي ولنبلونكم بشء من الخوف يعني خوف الله عز وجل والجوع صيام شهر رمضان ونقص من الاموال اداء الزكاة والصدقات والانفس الامراض والثمرات موت الاولاد لان ولد الرجل ثمرة قلبه يدل ,False,0427AbuIshaqThaclabi.KashfWaBayan
150798,6,Shamela0023578-ara1.completed.ms0224,ولنبلونكم ولنختبرنكم يا امة محمد بشء من الخوف والجوع الاية قال ابن عباس الخوف يعني خوف العدو والجوع يعني المجاعة والقحط ونقص من الاموال يعني الخسران والنقصان في المال وهلاك المواشي والانفس يعني الموت والقتل وقيل المرض وقيل الشيب والثمرات يعني الحواءج وان لا تخرج الثمرة كما كانت تخرج وقال الشافعي ولنبلونكم بشء من الخوف ,True,0427AbuIshaqThaclabi.KashfWaBayan
