cluster,size,id,text,from_input,book
249108306306,3,Shamela0011997-ara1.ms305,ولما تنكر له الاتراك خاف وانحدر من سامرا الي بغداد فارسلوا اليه يعتذرون ويخضعون له ويسالونه الرجوع فامتنع فقصدوا الحبس واخرجوا المعتز بالله وبايعوه وخلعوا المستعين ثم جهز المعتز جيشا كثيفا لمحاربة المستعين واستعد اهل بغداد للقتال مع المستعين فوقعت بينهما وقعات ودام القتال اشهرا وكثر القتل وغلت الاسعار وعظم البلاء وانحل امر المستعين فسعوا في الصلح علي خلع المستعين وقام في ذلك اسماعيل القاضي وغيره بشروط مءكدة فخلع المستعين نفسه في اول سنة اثنتين وخمسين واشهد عليه القضاة وغيرهم فاحدر الي واسط فاقام بها تسعة اشهر محبوسا موكلا به امين ثم رد الي سامرا وارسل المعتزل الي احمد بن طولون ان يذهب الي المستعين فيقتله فقال والله لا اقتل اولاد الخلفاء فندب له سعيد الحاجب فذبحه في ثالث شوال من السنة وله احدي وثلاثون سنة وكان خيرا فاضلا بليغا اديبا ,False,0911Suyuti.TarikhKhulafa
249108306306,3,Sham19Y0145435-ara1.ms6299,ولما تنكر له اي للمستعين الاتراك خاف وانحدر من سامراء الي بغداد فارسلوا اليه يعتذرون ويخضعون له ويسالونه الرجوع فامتنع فقصدوا الحبس واخرجوا المعتز بالله وبايعوه وخلعوا المستعين ثم جهز المعتز جيشا كثيفا لمحاربة المستعين واستعد اهل بغداد للقتال مع المستعين فوقعت بينهما وقعات ودام القتال اشهرا وكثر القتل وغلت الاسعار وعظم البلاء وانحل امر المستعين فسعوا في الصلح علي خلع المستعين وقام في ذلك اسماعيل القاضي وغيره بشروط مءكدة تاريخ الخلفاء وقد وصف السيوطي الخليفة المستعين بقوله وكان خيرا فاضلا بليغا اديبا ,False,1411MuhammadTahirBarnaji.SahihWaDacifTarikhTabari
249108307164,2,Shia002669-ara1.ms777,الوليد بن المغيرة ادعاه ابوه بعد ثماني عشرة سنة قال ابن عباس لا نعلم ان الله وصف احدا بما وصفه به من العيوب فالحق به عارا لا يفارقه ابدا ,False,0911Suyuti.TafsirJalalayn
249108307164,2,Tafsir06049-ara1.ms6439,الوليد بن المغيرة ادعاه ابوه بعد ثماني عشرة سنة من مولده واياه عني حسان بالبيت المذكور قال ابن قتيبة لانعرف ان الله وصف احدا ولا ذكر من عيوبه مثلما ذكر من عيوب الوليد بن المغيرة فالحق به عارا لا يفارقه دنيا ,False,1332QutbAtfayyish.HamayanZad
249108307804,2,Shamela0003118-ara1.completed.ms0022,كعب انه قال مكتوب في التوراة ان الشام كنز الله جل وعز من ارضه بها كنز الله عز وجل من عباده يعني بها قبور الانبياء ابراهيم واسحاق ويعقوب وعن وهب بن منبه قال اني لاجد ترداد الشام في الكتب حتي كانه ليس لله حاجة الا بالشام وعن ثابت بن معبد قال قال الله يا شام انت خيرتي من بلادي اسكنك خيرتي من عبادي اختصاص الشام ببسط ملاءكة الرحمة اجنحتها عليها عن زيد بن ثابت قال كنا مع رسول الله صلي الله عليه وسلم نءلف القران في الرقاع فقال رسول الله صلي الله عليه وسلم طوبي للشام فقلنا لاي ذلك قال ان ملاءكة الرحمن وفي رواية ملاءكة الرحمة باسطة اجنحتها عليها وفي حديث اخر عن زيد بن ثابت قال قال رسول الله صلي الله عليه وسلم ونحن عنده طوبي للشام فقلنا ما باله يا رسول الله قال ,False,0711IbnManzurIfriqi.MukhtasarTarikhDimashq
249108307804,2,Shamela0012884-ara1.completed.ms2058,كعب قال مكتوب في التوراة ان الشام كنز الله عز وجل من ارضه بها كنز الله من عباده يعني بها قبور الانبياء ابراهيم واسحق ويعقوب واخرج ابن عساكر عن ثابت بن معبد قال قال الله تعالي ياشام انت خيرتي من بلدي اسكنك خيرتي من عبادي واخرج ابن ابي شيبة واحمد والترمذي والروياني في مسنده وابن حبان والطبراني والحاكم وصححه عن زيد بن ثابت قال كنا حول رسول الله صلي الله عليه وسلم نءلف القران من الرقاع اذ قال طوبي للشام قيل له ولم قال ان ملاءكة الرحمن باسطة اجنحتها عليهم واخرج البزار والطبراني بسند حسن عن ابي الدرداء عن النبي صلي الله عليه وسلم قال انكم ستجندون اجنادا جندا بالشام ومصر والعراق واليمن قلنا فخر لنا يا رسول الله قال ,False,0911Suyuti.DurrManthur
249108307807,3,Shamela0012884-ara1.completed.ms2058,واخرج ابن عساكر عن ثابت بن معبد قال قال الله تعالي ياشام انت خيرتي من بلدي اسكنك خيرتي من عبادي واخرج ابن ابي شيبة واحمد والترمذي والروياني في مسنده وابن حبان والطبراني والحاكم وصححه عن زيد بن ثابت قال كنا حول رسول الله صلي الله عليه وسلم نءلف القران من الرقاع اذ قال طوبي للشام قيل له ولم قال ان ملاءكة الرحمن باسطة اجنحتها عليهم ,False,0911Suyuti.DurrManthur
249108307807,3,Shia002702Vols-ara1.ms03395,به اليها واخرج احمد عن عبد الله بن خوالة الازدي انه قال يا رسول الله خر لي بلدا اكون فيه قال عليك بالشام فانه خيرة الله تعالي من ارضه يجتبي اليه خيرته من عباده واخرج ابن عساكر عن واثلة بن الاسقع قال سمعت رسول الله صلي الله عليه وسلم يقول عليكم بالشام فانها صفوة بلاد الله تعالي يسكنها خيرته من عباده واخرج الحاكم وصححه عن عبد الله بن عمر رضي الله تعالي عنهما قال ياتي علي الناس زمان لا يبقي فيه مءمن الا لحق بالشام وجاء من حديث احمد والترمذي والطبراني وابن حبان والحاكم ايضا وصححه عن زيد بن ثابت انه صلي الله عليه وسلم قال طوبي للشام فقيل له ولم قال ان ملاءكة الرحمن باسطة اجنحتها عليها والاحاديث ,False,1270ShihabDinAlusi.RuhMacani
249108307807,3,ShamAY0034055-ara1.ms03351,به اليها واخرج احمد عن عبدالله بن خوالة الازدي انه قال يارسول الله خر لي بلدا اكون فيه قال عليك بالشام فانه خيرة الله تعالي من ارضه يجتبي اليه خيرته من عباده واخرج ابن عساكر عن واثلة بن الاسقع قال سمعت رسول الله صلي الله تعالي عليه وسلم يقول عليكم بالشام فانها صفوة بلاد الله تعالي يسكنها خيرته من عباده واخرج الحاكم وصححه عن عبدالله بن عمر رضي الله تعالي عنهما قال ياتي علي الناس زمان لايبقي فيه مءمن الا لحق بالشام وجاء من حديث احمد والترمذي والطبراني وابن حبان والحاكم ايضا وصححه عن زيد بن ثابت انه صلي الله تعالي عليه وسلم قال طوبي للشام فقيل له ولم قال ان ملاءكة الرحمن باسطة اجنحتها عليها والاحاديث ,False,1342MahmudShukriAlusi.RawhMacani
249108307809,4,JK000916-ara1.mARkdown.ms00209,عن عبد الرحمن بن يزيد بن جابر قال قلت لابي سلام الحبشي ما نقلك من حمص الي دمشق قال ما سالني عنها عربي قبلك بلغني ان البركة فيها مضعفة اخبرنا ابو محمد بن الاكفاني نا عبد العزيز بن احمد الكتاني انا ابو محمد بن ابي نصر انا ابو الميمون انا ابو زرعة نا ابو مسهر نا سعيد بن عبد العزيز عن ابن جابر قال قلت لابي سلام ما حملك علي النقلة من حمص الي دمشق فقال بلغني ان البركة تضعف بها ضعفين قرات بخط ابي الحسين البجلي انا احمد بن عمير بن يوسف نا ابو عامر موسي بن عامر نا الوليد بن مسلم نا عبد الرحمن بن يزيد بن جابر عن مكحول انه سال رجلا اين يسكن قال الغوطة قال له مكحول ما يمنعك ان تسكن دمشق فان البركة فيها مضعفة قال وانا محمد بن جعفر بن محمد بن احمد بن يحيي بن حمزة نا جدي احمد بن محمد نا ابي عن ابيه يحيي بن حمزة نا عمر بن محمد بن زيد بن عبد الله بن عمر بن الخطاب حدثني يحيي بن يحيي قال قال لي عبيد بن يعلي وهو رجل من اهل بيت المقدس كان بعسقلان وكان عالما ارحل من فلسطين والحق بدمشق فان بركات الشام كلها مسوقات الي دمشق ,False,0571IbnCasakir.TarikhDimashq
249108307809,4,Shamela0003118-ara1.completed.ms0048,عبد الرحمن بن يزيد بن جابر قال قلت لابي سلام الاسود ما نقلك من حمص الي دمشق قال ما سالني عن هذا عربي قبلك قال لان البركة فيها مضاعفة وفي رواية قال بلغني ان البركة تضعف بها ضعفين وعن مكحول انه سال رجلا اين تسكن قال الغوطة قال له مكحول ما يمنعك ان تسكن دمشق فان البركة فيها مضعفة ,False,0711IbnManzurIfriqi.MukhtasarTarikhDimashq
249108307809,4,Shamela0095735-ara1.ms0713,عن عبد الرحمن بن يزيد بن جابر قال قلت لابي سلام الاسود ما تملك من حمص الي دمشق قال بلغني ان البركة تضاعف بها ضعفين وباسناده عن مكحول انه سال رجلا اين تسكن قال الغوطة فقال له مكحول ما يمنعك ان تسكن دمشق فان البركة بها مضاعفة وباسناده عن عبيد بن يعلي رجل من اهل بيت المقدس كان بعسقلان وكان عالما انه قال لرجل ارحل من فلسطين والحق بدمشق فان بركات الشام كلها مسوقات الي دمشق ,False,0795IbnRajabHanbali.MajmucRasail
249108307809,4,Shamela0012884-ara1.completed.ms2058,عن عبد الرحمن بن يزيد بن جابر قال قلت لابي سلام الاسود ما نقلك من حمص الي دمشق قال بلغني ان البركة تضعف بها ضعفين واخرج ابن عساكر عن مكحول انه سال رجلا اين تسكن قال الغوطة قال له مكحول مايمنعك ان تسكن دمشق فان البركة فيها مضعفة ,False,0911Suyuti.DurrManthur
257698041158,3,Shamela0025841-ara1.mARkdown.ms260,المتقي لله فاستوزر ابا الحسين احمد بن محمد بن ميمون فقدم ابو عبد الله البريدي من البصرة وطلب الوزارة فاجابه المتقي وولاه ومشي الي بابه ابن ميمون وكانت وزارة ابن ميمون شهرا فقامت الجند علي ابي عبد الله يطلبون ارزاقهم فخافهم وهرب بعد ايام ووزر بعده ابو اسحاق محمد احمد لقراريطي ثم عزل الكرخي بعد ثلاثة وخمسين يوما فلم ير اقرب من مدة هءلاء وهزلت الوزارة وضءلت لضعف الدولة وصغر الداءرة واما بجكم فنزل واسطا وقرر مع الخليفة انه يحمل اليه في العام ثمانمءة الف دينار وعدل وتصدق وكان ذا اموال عظيمة ,False,0748Dhahabi.CibarFiKhabar
257698041158,3,Shamela0035100-ara1.mARkdown.ms05167,المتقي لله الوزير سليمان واستوزر ابا الحسين احمد بن محمد بن ميمون الكاتب وقدم ابو عبد الله البريدي من البصرة فطلب الوزارة فاجابه المتقي وصار اليه ابن ميمون فاكرمه وكانت وزارة ابن ميمون شهرا فشغب الجند علي ابي عبد الله يطلبون ارزاقهم فهرب من بغداد بعد اربعة وعشرين يوما فاستوزر المتقي ابا اسحاق محمد بن احمد الاسكافي المعروف بالقراريطي وعزل بعد ثلاثة واربعين يوما وقلد ابن القاسم الكرخي وعزل بعد ثلاثة وخمسين يوما وفيها قلد المتقي امرة الامراء كورتكين الديلمي وقلد بدرا الخرشني الحجابة وفيها قتل بجكم التركي وكنيته ابو الخير وكان قد استوطن واسطا وقرر مع الراضي انه يحمل اليه في العام ثمانماءة الف دينار واظهر العدل وبني دار الضيافة للضعفاء بواسط وكان ذا اموال عظيمة ,False,0748Dhahabi.TarikhIslam
257698041158,3,Shamela0012398-ara1.completed.ms0657,المتقي لله فاستوزر ابا الحسن احمد بن محمد بن ميمون فقدم ابو عبد الله البريدي من البصرة وطلب الوزارة فاجابه المتقي وولاه ومشي الي بابه ابن ميمون وكانت وزارة ابن ميمون شهرا فقامت الجند علي ابي عبد الله يطلبون ارزاقهم فخافهم وهرب بعد ايام ووزر بعده ابو اسحاق محمد بن احمد القراريطي ثم عزل بعد ثلاثة واربعين يوما ووزر الكرخي فعزل بعد ثلاثة وخمسين يوما فلم ير اقرب من مدة هءلاء وهزلت الوزارة وضءلت لضعف الدولة وصغر الداءرة واما بجكم التركي فنزل واسط واستوطنها وقرر مع الراضي انه يحمل الي خزانته في كل سنة ثمانماءة الف دينار ,False,1089IbnCimad.Shadharat
257698041160,2,Shamela0025841-ara1.mARkdown.ms260,وفيها القاضي ابو محمد عبد الله بن احمد بن زبر الربعي البغدادي وله بضع وسبعون سنة سمع عباسا الدوري وطبقته وولي قضاء مصر ثلاث مرات اخرها في ,False,0748Dhahabi.CibarFiKhabar
257698041160,2,Shamela0012398-ara1.completed.ms0662,وفيها القاضي ابو محمد عبد الله بن احمد بن زبر الربعي البغدادي وله بضع وسبعون سنة سمع عباسا الدوري وطبقته وولي قضاء مصر ثلاث مرات اخرها في ,False,1089IbnCimad.Shadharat
257698054859,2,Shamela0012406-ara1.mARkdown.ms3257,يوسف بن يعقوب بن اسحاق بن البهلول ابو بكر الازرق التنوخي الكاتب ولد بالانبار سنة ثمان وثلاثين وماءتين وسمع جده اسحاق والزبير بن بكار والحسن بن عرفة وغيرهم وكتب عنه كثيرا من اللغة والنحو والاخبار وكان ازرق العين متخشنا في دينه كثير الصدقة تصدق بنحو ماءة الف دينار وكان امارا بالمعروف روي عنه ابن المظفر والدارقطني وابن شاهين واخر من روي عنه ابو الحسين بن المتيم وكان ثقة وتوفي في ذي الحجة من هذه السنة ودفن في مقابر باب الكوفة وله اثنتان وتسعون سنة ثم دخلت سنة ثلاثين وثلاثماءة فمن الحوادث فيها انه ظهر في المحرم كوكب مذنب راسه الي الغرب وذنبه الي الشرق وكان عظيما جدا منتشر الذنب وبقي ثلاثة عشر يوما الي ان اضمحل وفي نصف ربيع الاول بلغ الكر الحنطة ماءتين وعشرة دنانير والكر الشعير ماءة وعشرين دينارا ثم بلغ الكر الحنطة ثلاثماءة وستة عشر دينارا واكل الضعفاء الميتة ودام الغلاء وكثر الموت وشغل الناس بالمرض والفقر وتقطعت السبل وترك التدافن للموتي واشتغل الناس عن الملاهي واللعب ,True,0597IbnJawzi.Muntazam
257698054859,2,Shamela0004445-ara1.completed.ms5242,يوسف بن يعقوب بن اسحاق بن البهلول ابو بكر الازرق لانه كان ازرق العينين التنوخي الكاتب سمع جده والزبير بن بكار والحسن بن عرفة وغيرهم وكان خشن العيش كثير الصدقة يقال انه تصدق بماءة الف دينار وكان امارا بالمعروف نهاء عن المنكر روي عنه الدارقطني وغيره من الحفاظ وكان ثقة عدلا توفي في ذي الحجة من هذه السنة عن ثنتين وتسعين سنة رحمه الله تعالي ثم دخلت سنة ثلاثين وثلاثماءة ما وقع فيها من الاحداث قال ابن الجوزي في المحرم منها ظهر كوكب بذنب راسه الي الغرب وذنبه الي الشرق وكان عظيما جدا وذنبه منتشر وبقي ثلاثة عشر يوما الي ان اضمحل قال وفي نصف ربيع الاول بلغ الكر من الحنطة ماءتي دينار وعشرة دنانير ومن الشعير ماءة وعشرين دينارا ثم بلغ كر الحنطة ثلاثماءة وستة عشر دينارا واكل الضعفاء الميتة ودام الغلاء وكثر الموت وتقطعت السبل وشغل الناس بالمرض والفقر وترك دفن الموتي وشغل الناس عن الملاهي واللعب ,True,0774IbnKathir.Bidaya
257698054860,2,Shamela0004445-ara1.completed.ms5242,سنة ثلاثين وثلاثماءة ما وقع فيها من الاحداث قال ابن الجوزي في المحرم منها ظهر كوكب بذنب راسه الي الغرب وذنبه الي الشرق وكان عظيما جدا وذنبه منتشر وبقي ثلاثة عشر يوما الي ان اضمحل قال وفي ,False,0774IbnKathir.Bidaya
257698054860,2,Shamela0003283-ara1.completed.ms602,سنة ثلاث وثلثماءة في المحرم ظهر كوكب بذنب راسه الي المغرب وذنبه الي المشرق وكان عظيما جدا وذنبه منتشر وبقي ثلاثة عشر يوما الي ان اضمحل وفي ,False,0911Suyuti.HusnMuhadara
257698074710,2,Shia002616Vols-ara1.ms5896,يوم لا يغني عنهم كيدهم شيءا اي ما كادوا به النبي صلي الله عليه وسلم في الدنيا ولاهم ينصرون من الله و يوم منصوب علي البدل من يومهم الذي فيه يصعقون قوله تعالي وان للذين ظلموا عذابا دون ذلك ولكن اكثرهم لا يعلمون واصبر لحكم ربك فانك باعيننا وسبح بحمد ربك حين تقوم ومن الليل فسبحه وادبار النجوم قوله تعالي وان للذين ظلموا اي كفروا عذابا دون ذلك قيل قبل موتهم ابن زيد مصاءب الدنيا من الاوجاع والاسقام والبلايا وذهاب الاموال والاولاد مجاهد هو الجوع والجهد سبع سنين ابن عباس هو القتل عنه عذاب القبر وقاله البراء بن عازب وعلي رضي الله عنهم ف دون بمعني غير وقيل عذابا اخف من عذاب الاخرة ولكن اكثرهم لا يعلمون ان العذاب نازل بهم وقيل ولكن اكثرهم لا يعلمون ما يصيرون اليه قوله تعالي واصبر لحكم ربك فانك باعيننا ,False,0671AbuCabdAllahQurtubi.JamicLiAhkamQuran
257698074710,2,Tafsir09084-ara1.ms2327,يوم لا يغني عنهم كيدهم شيءا اي لا ينفعهم كيدهم ولا مكرهم الذي استعملوه في الدنيا لا يجزي عنهم يوم القيامة شيءا ولا هم ينصرون ثم قال تعالي وان للذين ظلموا عذابا دون ذلك اي قبل ذلك في الدار الدنيا كقوله تعالي ولنذيقنهم من العذاب الادني دون العذاب الاكبر لعلهم يرجعون السجدة ولهذا قال تعالي ولكن اكثرهم لا يعلمون اي نعذبهم في الدنيا ونبتليهم فيها بالمصاءب لعلهم يرجعون وينيبون فلا يفهمون ما يراد بهم بل اذا جلي عنهم مما كانوا عليه فيه عادوا الي اسوا مما كانوا كما جاء في بعض الاحاديث ان المنافق اذا مرض وعوفي مثله في ذلك كمثل البعير لا يدري فيما عقلوه ولا فيما ارسلوه وقوله تعالي واصبر لحكم ربك فانك باعيننا ,False,1450MuhammadCaliSabuni.MukhtasarTafsirIbnKathir
257698074818,4,Tafsir03037-ara1.ms1411,وما صرفنا عن ارسال الايات التي اقترحتها قريش بقولهم اجعل لنا الصفا ذهبا الا تكذيب الاولين بها فهلكوا وهم امثالهم في الطبع كعاد وثمود وانها لو ارسلت لكذبوها فيهلكوا امثالهم كما مضت به سنتنا وقد قضينا في ازلنا الا نستاصلهم لان فيهم من يءمن او يلد من يءمن ثم ذكر بعض الامم المهلكة بتكذيب الايات ,False,1124IbnMuhammadIbnCajibaFasiSufi.BahrMadid
257698074818,4,ShamAY0034059-ara1.ms3358,وثمود وانها لو ارسلت لكذبوا تكذيب اولءك واستوجبوا الاستءصال علي ما مضت به سنتنا وقد قضينا ان لا نستاصلهم لان فيهم من يءمن او يلد من يءمن ثم ذكر بعض الامم المهلكة بتكذيب الايات المقترحة فقال وءاتينا ثمود الناقة ,False,1127IsmacilHaqqiBurusawi.RuhBayan
257698074818,4,Shamela0010273-ara1.ms1597,وثمود وانها لو ارسلت لكذبوها فيهلكوا امثالهم كما مضت به سنتنا وقد قضينا في ازلنا الا نستاصلهم لان فيهم من يءمن او يلد من يءمن ثم ذكر بعض الامم المهلكة بتكذيب الايات المقترحة ,False,1224IbnCajiba.BahrMadid
257698074818,4,Shamela0023631-ara1.ms3059,وما منعنا ان نرسل بالايات اي التي يقترحها قريش الا ان كذب بها الاولون اي الا تكذيب الاولين الذين هم امثالهم كعاد وثمود وانها لو ارسلت لكذبوا بها تكذيب اولءك فاستوجبوا الاستءصال علي ما مضت به السنة الالهية وقد قضينا ان لا نستاصلهم لان منهم من يءمن او يلد من يءمن ثم ذكر بعض الامم المهلكة بتكذيب الايات المقترحة فقال واتينا ثمود الناقة ,False,1332IbnMuhammadJamalDinQasimi.MahasinTawil
