cluster,size,id,text,from_input,book
8590070744,56,Shamela0010747-ara1.ms29,الطبراني عن عبد الله بن بسر صاحب رسول الله صلي الله عليه وسلم انه كان اذا صلي الجمعة خرج فدار في السوق ساعة ثم رجع الي المسجد فقيل له لم تفعل هذا فقال رايت سيد المرسلين يفعله قلت كان حكمته امتثال قوله تعالي فاذا صليت الصلاة فانتشروا في الارض وابتغوا من فضل الله الخصوصية الرابعة والسبعون انتظار العصر بعدها يعدل عمرة اخرج البيهقي في الشعب عن سهل بن سعد الساعدي قال قال رسول الله صلي الله عليه وسلم ,True,0911Suyuti.LumcaFiKhasaisJumca
8590070744,56,Shamela0021715-ara1.completed.ms03364,قبل قوله ما فاذا قضيت الصلاة فرغتم منها فانتشروا في الارض لقضاء حواءجكم وابتغوا من فضل الله رزقه وهذا امر اباحة بعد الحظر وكان عراك بن مالك اذا صلي الجمعة انصرف فوقف علي باب المسجد فقال اللهم اجبت دعوتك وصليت فريضتك وانتشرت كما امرتني فارزقني من فضلك وانت خير الرازقين رواه ابن ابي حاتم وعن بعض السلف من باع واشتري بعد صلاة الجمعة بارك الله له سبعين مرة واذكروا الله كثيرا اذكروه في مجامع احوالكم ولا تخصوا ذكره بالصلاة لعلكم تفلحون بخير الدارين واذا راوا تجارة او لهوا انفضوا اليها قيل تقديره اليها واليه فحذفت اليه للقرينة وقيل افرد التجارة لانها المقصودة اذ المراد من اللهو طبل قدوم العير ,True,0923AhmadQastallani.IrshadSari
8590070744,56,Shia003732Vols-ara1.ms3437,ابو عبيد وابن المنذر والطبراني وابن مردويه عن طريق عبد الله الحيراني عن عبد الله بن بسر الحيراني قال رايت عبد الله بن بسر المازني صاحب رسول الله صلي الله عليه وسلم اذا صلي الجمعة خرج فدار في السوق ساعة ثم رجع الي المسجد فصلي ما شاء الله ان يصلي فقيل له لاي شء تصنع هذا فقال رايت سيد المرسلين صلي الله عليه وسلم هكذا يصنع وتلا هذه الاية فاذا قضيت الصلاة فانتشروا في الارض وابتغوا من فضل الله جماع ابواب سيرته صلي الله عليه وسلم في صلاة الفراءض في السفر الباب الاول في اباحته صلي الله عليه وسلم ,True,0942IbnYusufShami.SubulHuda
8590070744,56,ShamAY0034068-ara2.ms3725,فاذا قضيت الصلاة اي وقع الفراغ منها علي اي وجه كان فانتشروا اي فدبوا وتفرقوا مجتهدين في الارض اي جميعها للتجارة والتصرف في حواءجكم ان شءتم لا جناح عليكم ولا حرج رخصة من الله تعالي لكم وابتغوا اي اطلبوا الرزق من فضل الله اي الذي بيده كل شء ولا شء لغيره وهذا امر اباحة كقوله تعالي واذا حللتم فاصطادوا الماءدة قال ابن عباس ان شءت فاخرج وان شءت فاقعد وان شءت فصل الي العصر وقيل فانتشروا في الارض ليس لطلب دنيا ولكن لعيادة مريض وحضور جنازة وزيارة اخ في الله تعالي وقال الحسن وسعيد بن جبير ومكحول وابتغوا من فضل الله هو طلب العلم واذكروا الله اي الذي له الامر كله كثيرا اي بحيث لا تغفلون عنه بقلوبكم اصلا ولا بالسنتكم حتي عند الدخول الي الخلاء وعند اول الجماع واستثني من الثاني وقت التلبس بالقذر كوقت قضاء الحاجة ,True,0977KhatibShirbini.SirajMunir
8590070744,56,Shamela0021642-ara1.ms0632,وفي الدعوات للمستغفري عن عراك بن مالك انه كان اذا صلي الجمعة انصرف فوقف في الباب فقال اللهم اجبت دعوتك وصليت فريضتك وانتشرت لما امرتني فارزقني من فضلك وانت خير ,True,1051IbnYunusBuhutiHanbali.KashshafQinac
8590070744,56,Shamela0000140-ara1.ms1639,قال الله تعالي فاذا قضيت الصلاة اي فرغتم من الصلاة المعهودة وهي صلاة الجماعة فانتشروا في الارض لقضاء حواءجكم وابتغوا من فضل الله اي رزقه وهذا امر اباحة بعد الحظر عن بعض السلف من باع واشتري بعد الجمعة بارك الله ما سبعين مرة واذكروا الله كثيرا في حال انتشاركم وصرح به لءلا يغفل عنه بالاشتغال بطلب الرزق لعلكم تفلحون ,True,1057IbnCallan.DalilFalihin
8590070744,56,Shamela0000140-ara1.ms1047,قال الله تعالي فاذا قضيت الصلاة اي صلاة الجمعة فانتشروا في الارض اي لقضاء حواءجكم وابتغوا من فضل ا اي رزقه وهذا امر اباحة بعد الحظر عن بعض السلف من باع واشتري بعد الجمعة بارك الله له سبعين مرة ,True,1057IbnCallan.DalilFalihin
8590070744,56,Sham19Y0023625-ara1.ms1455,اختيارا والله اعلم قوله فانتشروا في الارض هذا امر اباحة بقول اذا فرغتم من الصلاة فانتشروا في الارض يعني للتجارة والتصرف في حواءجكم وابتغوا من فضل الله اي من رزقه كان عمر اذا صلي الجمعة انصرف فقال اللهم اني اجبت دعوتك وصليت فريضتك وانتشرف كما امرتني فارزقني من فضلك وانت خير الرازقين وقال جعفر بن محمد في قوله تعالي وابتغوا من فضل الله الجمعة انه العمل يوم السبت وعن الحسن وسعيد بن المسيب طلب العلم وقيل صلاة النافلة وعن ابن عباس لم يءمروا بشء من الدنيا انما هو عيادة المرضي وحضور الجناءز وزيارة اخ في الله تعالي قوله واذكروا الله كثيرا اي بالطاعة وباللسان وبالشكر علي ما انعم عليكم به من التوفيق لاداء فريضته لعلكم تفلحون اي كي تفحلون ,True,1057IbnCallan.FutuhatRabbaniyya
8590070744,56,Zaydiyya0000295Vols-ara1.ms0364,اباحة قال في البرهان وروينا ان يحي بن زيد عليهما السلام كان اذا صلي الجمع انصرف فوقف علي باب المسجد فقال اللهم قد اجبت دعوتك وصليت فريضتك وانتشرت كما امرتني فارزقني من فضلك وانت خير الرازقين وابتغوا من فضل الله اي نعمة الله في الدنيا موصولة بنعمة الاخرة اه وقيل اطلبوا من رزقه بالتجارة واذكروا الله كثيرا لعلكم تفلحون اي ,True,1062CabdAllahSharafi.MasabihSatica
8590070744,56,Shia001432Vols-ara1.msC29434,وروي عن انس عن النبي صلي الله عليه واله انه قال في قوله فانتشروا الاية ليس لطلب دنيا ولكن عيادة مريض وحضور جنازة وزيارة اخ في الله وقيل ,True,1111Majlisi.BiharAnwar
8590070744,56,Shia002389Vols-ara1.ms2961,قوله فاذا قضيت الصلاة فانتشروا في الارض يعني اذا فرغ من الصلاة فانتشروا في الارض قال يوم السبت في مجمع البيان وروي انس عن النبي صلي الله عليه واله قال في قوله فاذا قضيت الصلاة فانتشروا في الارض الاية ليست بطلب الدنيا ولكن عيادة مريض وحضور جنازة وزيارة اخ في الله وروي عمر بن يزيد عن ابي عبد الله ,True,1112IbnJumcaHuwayzi.TafsirNurThaqalayn
8590070744,56,ShamAY0034059-ara1.ms7209,وابتغوا من فضل الله اي الربح يعني اطلبوا لانفسكم واهليكم من الرزق الحلال باي وجه يتيسر لكم من التجارة وغيرها من المكاسب المشروعة دل علي هذا المعني سبب نزول قوله واذا راوا تجارة الخ كما سياتي فالامر للاطلاق بعد الحظر اي للاباحة لا للايجاب كقوله واذا حللتم فاصطادوا وذكر الامام السرخسي ان الامر للايجاب لما روي انه عليه السلام قال طلب الكسب بعد الصلاة هو الفريضة بعد الفريضة وتلا قوله تعالي فاذا قضيت الصلاة وقيل انه للندب فعن سعيد بن جبير اذا نصرفت من الجمعة فساوم بشء وان لم تشتره وعن ابن عباس رضي الله عنهما لم يءمروا بطلب شء من الدنيا انما هو عبادة المرضي وحضور الجناءز وزيادة اخ في الله وعن الحسن وسعيد بن المسيب طلب العلم ,True,1127IsmacilHaqqiBurusawi.RuhBayan
8590070744,56,Shamela0021766-ara1.ms4493,عبد الله بن عمر من لغا وتخطي رقاب الناس كانت له ظهر رواه ابو داود فاذا قضيت الصلاة اي اديت صلوة الجمعة فانتشروا في الارض وابتغوا من فضل الله اي الرزق امر اباحة بعد المنع لاجل الصلاة قال ابن عباس ان شءت فاخرج وان شءت فاقعد وان شءت فصل الي العصر وقيل فانتشروا في الارض ليس لطلب الدنيا ولكن لعيادة مريض وحضور جنازة وزيارة اخ في الله اخرجه ابن جرير من حديث انس مرفوعا وابن مردوية عن ابن عباس موقوفا وقال البغوي قال الحسن وسعيد بن جبير ومكحول وابتغوا من فضل الله هو طلب العلم فعلي هذه الاقوال الامر للاستحباب واذكروا الله كثيرا في ,True,1225ThanaAllahPanipati.TafsirMazhari
8590070744,56,Shamela0021677-ara1.ms0551,وفي الدعوات للمستغفري عن عراك بن مالك انه كان اذا صلي الجمعة انصرف فوقف في الباب فقال اللهم اجبت دعوتك وصليت فريضتك وانتشرت لما امرتني فارزقني من فضلك وانت خير الرازقين و سن اكثار صلاة عليه صلي الله عليه وسلم في يوم الجمعة لقوله صلي الله عليه وسلم اكثروا من الصلاة علي يوم الجمعة رواه ,True,1243IbnSacdRahyabaniSuyuti.MatalibUliNuha
8590070744,56,Shamela0023623-ara1.ms4180,عن انس قال قال رسول الله صلي الله عليه وسلم في قوله فاذا قضيت الصلاة فانتشروا في الارض وابتغوا من فضل الله قال ليس لطلب دنيا ولكن عيادة مريض وحضور جنازة وزيارة اخ في الله ,True,1250Shawkani.FathQadir
8590070744,56,Shia002702Vols-ara1.ms10917,اللام فاذا قضيت الصلواة فانتشروا في الارض وابتغوا من فضل الله واذكروا الله كثيرا لعلكم تفلحون فاذا قضيت الصلواة اي اديت وفرغ منها فانتشروا في الارض لاقامة مصالحكم وابتغوا من فضل الله اي الربح علي ما قيل وقال مكحول والحسن وابن المسيب المامور بابتغاءه هو العلم واخرج ابن مردويه عن ابن عباس انه قال لم يءمروا بشء من طلب الدنيا انما هو عيادة مريض وحضور جنازة وزيارة اخ في الله ,True,1270ShihabDinAlusi.RuhMacani
8590070744,56,Shia002702Vols-ara1.ms10917,واخرج ابو عبيد وابن المنذر والطبراني وابن مردويه عن عبد الله بن بسر الحراني قال رايت عبد الله بن بسر المازني صاحب النبي صلي الله عليه وسلم اذا صلي الجمعة خرج فدار في السوق ساعة ثم رجع الي المسجد فصلي ما شاء الله تعالي ان يصلي فقيل له لاي شء تصنع هذا قال اني رايت سيد المرسلين صلي الله عليه وسلم هكذا يصنع وتلا هذه الاية فاذا قضيت الصلاة الخ واخرج ابن المنذر عن سعيد بن جبير قال اذا انصرفت يوم الجمعة فاخرج الي باب المسجد فساوم بالشء وان لم تشتره ونقل عنه القول بالندبية وهو الاقرب والاوفق بقوله تعالي واذكروا الله كثيرا اي ذكرا كثيرا ولا تخصوا ذكره عز وجل ,True,1270ShihabDinAlusi.RuhMacani
8590070744,56,Shamela0037458-ara1.ms4443,في الاية ليس بطلب دنيا ولكن عيادة مريض وحضور جنازة وزيارة اخ في الله اخرجه ابن جرير وعن ابن عباس قال لم يءمروا بشء من طلب الدنيا انما هو عيادة مريض وحضور جنازة وزيارة اخ في الله وعن عراك بن مالك انه كان اذا صلي الجمعة انصرف فوقف علي باب المسجد وقال اللهم اجبت دعوتك وصليت فريضتك وانتشرت كما امرتني فارزقني من فضلك وانت خير الرازقين واذكروا الله ذكرا كثيرا بالشكر له علي ما هداكم اليه من الخير الاخروي والدنيوي وكذا اذكروه بما يقربكم اليه من الاذكار كالحمد والتسبيح والتكبير والاستغفار ونحو ذلك ولا تقصروا ذكره علي حالة الصلاة لعلكم تفلحون اي لكي تفوزوا بخيري الدارين وتظفروا بهما واذا راوا تجارة او لهوا انفضوا اليها ,True,1307Qannawji.FathBayan
8590070744,56,Shamela0022769-ara1.ms1615,الي ذكر الله وترك المعاملة خير لكم في الاخرة من التكسب في ذلك الوقت ان كنتم تعلمون اي ان كنتم اهل العلم فانتم ترون ذلك خيرا فاذا قضيت الصلاة فانتشروا في الارض وابتغوا من فضل الله اي اذا اديت الصلاة فاخرجوا من المسجد ان شءتم لاقامة مصالحكم واطلبوا الرزق ان شءتم فهذه رخصة بعد النهي بقوله تعالي وذروا البيع وعن عراك بن مالك انه كان اذا صلي الجمعة انصرف فوقف علي باب المسجد قال اللهم اجبت دعوتك وصليت فريضتك وانتشرت كما امرتني فارزقني من فضلك وانت خير الرازقين واذكروا الله كثيرا علي كل حال بالقلب واللسان قال مجاهد لا يكون من الذاكرين الله كثيرا حتي يذكره قاءما وقاعدا ومضطجعا وعن عمر رضي الله عنه عن النبي صلي الله عليه وسلم قال اذا اتيتم ,True,1316IbnCumarBantaniJawi.MarahLabid
8590070744,56,ShamIbadiyya0000193-ara1.ms4268,عبد الله بن بسر الحراني رايت عبد الله بن بسر لمازني صاحب النبي اذا صلي الجمعة خرج فدار في السوق ساعة ثم رجع الي المسجد فصلي ما شاء الله تعالي ان يصلي فقيل له لماذا تفعل ذلك فقال لاني ,True,1332QutbAtfayyish.Tafsir
8590070744,56,Tafsir09050-ara1.ms4420,عبد الله بن بسر المازني صاحب النبي صلي الله عليه وسلم اذا صلي الجمعة خرج فدار في السوق ساعة ثم رجع الي المسجد فصلي ما شاء الله تعالي ان يصلي فقيل له لماذا تفعل ذلك فقال لاني رايت رسول الله صلي الله عليه وسلم يفعل ذلك وتلا الاية قال سعيد بن جبير لابن المنذر اذا فرغت من صلاة يوم الجمعة فاخرج الي باب المسجد فساوم الشء وان كنت لا تشتريه وارجع الي المسجد فالخروج مندوب اليه كما روي ايضا عن سعيد بن جبير وهو ظاهر الاية وموافق للسنة والاثر وهو انسب بقوله تعالي واذكروا الله كثيرا اي ذكرا كثيرا ,True,1332QutbAtfayyish.TaysirTafsir
8590070744,56,ShamAY0034055-ara1.ms10589,واخرج ابو عبيد وابن المنذر والطبراني وابن مردويه عن عبد الله بن يسر الحراني قال رايت عبد الله بن بسر المازني صاحب النبي صلي الله تعالي عليه وسلم اذا صلي الجمعة خرج فدار في السوق ساعة ثم رجع الي المسجد فصلي ما شاء الله تعالي ان يصلي فقيل له لاي شء هذا قال اني رايت سيد المرسلين صلي الله تعالي عليه وسلم هكذا يصنع وتلا هذه الاية فاذا قضيت الصلاة الخ واخرج ابن المنذر عن سعيد بن جبير قال اذا انصرفت يوم الجمعة فاخرج الي باب المسجد فساوم بالشء وان لم تشتره ونقل عنه القول بالندبية وهو الاقرب والاوفق بقوله تعالي واذكروا الله كثيرا اي ذكرا كثيرا ولا تخصوا ذكره عز وجل ,True,1342MahmudShukriAlusi.RawhMacani
8590070744,56,Shamela0006947-ara1.ms05111,واخرج ابو عبيد وابن المنذر والطبراني وابن مردويه عن عبد الله بن بر الحراني قال رايت عبد الله ابن بر المازني صاحب النبي صلي الله عليه وسلم اذا صلي الجمعة خرج فدار في السوق ساعة ثم رجع الي المسجد فصلي ما شاء الله تعالي ان يصلي فقيل له لاي شء تصنع هذا قال اني رايت سيد المرسلين صلي الله عليه وسلم هكذا صنع وتلا هذه الاية فاذا قضيت الصلاة الخ ,True,1354RashidRida.Manar
8590070744,56,Tafsir09068-ara1.ms1154,للجميع وكان عراك بن مالك رضي الله عنه اذا صلي الجمعة انصرف فوقف علي باب المسجد فقال اللهم اني اجبت دعوتك وصليت فريضتك وانتشرت كما امرتني فارزقني من فضلك وانت خير الرازقين عراك هذا من ,True,1404IbrahimQattan.TaysirTafsir
8590070744,56,Shia002406Vols-ara1.ms7344,في المشي فحسب وفي المجمع وروي انس عن النبي صلي الله عليه واله وسلم قال في قوله فاذا قضيت الصلاة فانتشروا في الارض الاية ليس بطلب الدنيا ولكن عيادة مريض وحضور جنازة وزيارة اخ في الله اقول ورواه في الدر المنثور عن ابن جرير عن انس عن النبي صلي الله ,True,1412SayyidTabatabai.TafsirMizan
8590070744,56,Tafsir07057-ara1.ms5054,ان بعض السف كان اذا انتهت الصلاة خرج من المسجد ودار في السوق ساعة ثم رجع الي المسجد فصلي ما شاء ان يصلي قال الامام ابن كثير كان عراك بن مالك احد كبار التابعين اذا صلي الجمعة انصرف فوقف علي باب المسجد وقال اللهم اني اجبت دعوتك وصليت فريضتك وانتشرت كما امرتني فارزقني من فضلك وانت خير الرازقين هذا وهناك احكام اخري توسع المفسرون ,True,1431MuhammadSayyidTantawi.TafsirWasit
8590070744,56,Tafsir09084-ara1.ms2462,لكم ان كنتم تعلمون اي ترككم البيع واقبالكم الي ذكر الله والي الصلاة خير لكم اي في الدنيا والاخرة ان كنتم تعلمون وقوله تعالي فاذا قضيت الصلاة اي فرغ منها فانتشروا في الارض وابتغوا من فضل الله لما حجر عليهم في التصرف بعد النداء وامرهم بالاجتماع اذن لهم بعد الفراغ في الانتشار في الارض والابتغاء من فضل الله كما كان عراك بن مالك رضي الله عنه اذا صلي الجمعة انصرف فوقف علي باب المسجد فقال اللهم اني اجبت دعوتك وصليت فريضتك وانتشرت كما امرتني فارزقني من فضلك وانت خير الرازقين وروي عن بعض السلف انه قال من باع واشتري في يوم الجمعة بعد الصلاة بارك الله له سبعين مرة لقول الله تعالي فاذا قضيت الصلاة فانتشروا في الارض وابتغوا من فضل الله وقوله تعالي واذكروا الله كثيرا لعلكم تفلحون اي في حال بيعكم وشراءكم واخذكم واعطاءكم اذكروا الله ذكرا كثيرا ,True,1450MuhammadCaliSabuni.MukhtasarTafsirIbnKathir
8590070744,56,Tafsir09083-ara1.ms1617,في الاسلام فاءدة كان عراك بن مالك اذا صلي الجمعة انصرف فوقف علي باب المسجد فقال اللهم اني اجبت دعوتك وصليت فريضتك وانتشرت كما امرتني فارزقني من فضلك وانت خير الرازقين لطيفة التعبير بقوله تعالي فاسعوا الي ذكر الله فيه لطيفة ,True,1450MuhammadCaliSabuni.SafwatTafasir
8590070744,56,Tafsir09085-ara1.ms749,الله صلي الله عليه وسلم فقد روي عن بعضهم انه كان اذا صلي الجمعة خرج فدار في السوق ساعة ثم رجع الي المسجد فصلي ما شاء الله تعالي ان يصلي فقيل له لاي شء تصنع هذا قال اني رايت سيد المرسلين صلي الله عليه وسلم هكذا يصنع وتلا هذه الاية فاذا قضيت الصلوة اللطيفة الخامسة كان عراك بن مالك اذا صلي الجمعة انصرف فوقف علي باب المسجد فقال اللهم اني اجبت دعوتك وصليت فريضتك وانتشرت كما امرتني فارزقني من فضلك وانت خير الرازقين اللطيفة السادسة في قوله تعالي واذكروا الله كثيرا لطيفة وهي ان الله عز وجل ,True,1450MuhammadCaliSabuni.TafsirAyatAhkam
8590070745,3,Shia002359Vols-ara1.ms4195,ما امرتكم به من حضور الجمعة واستماع الذكر واداء الفريضة وترك البيع خير لكم وانفع لكم عاقبة ان كنتم تعلمون منافع الامور ومضارها ومصالح انفسكم ومفاسدها وقيل معناه اعلموا ذلك عن الجباءي وفي هذه الاية دلالة علي وجوب الجمعة وفي تحريم جميع التصرفات عند سماع اذان الجمعة لان البيع انما خص بالنهي عنه لكونه من اعم التصرفات في اسباب المعاش ,False,0548IbnHasanTabarsi.TafsirMajmacBayan
8590070745,3,Shia002369Vols-ara1.ms099,ذلكم خير لكم ذلك يعني ما امرتكم به من حضور الجمعة واستماع الذكر واداء الفريضة وترك البيع خير لكم وانفع عاقبة لكم ان كنتم تعلمون صحة ما قلناه وتعلمون منافع الامور ومضارها ومصالح انفسكم ومفاسدها اي اعلموا ذلك وفي الاية كما ذكرنا دلالة علي وجوب الجمعة وتحريم جميع التصرفات عند سماع اذان الجمعة لان البيع انما خص بالنهي عنه لكونه من اعم التصرفات في اسباب المعاش ,False,0573IbnHibatAllahQutbDinRawandi.FiqhQuran
8590070745,3,Tafsir04040-ara1.ms1883,ذلكم خير لكم ان كنتم تعلمون اي ما امرتم به من حضور الجمعة واستماع الذكر واداء الفريضة وترك البيع انفع لكم عاقبة ان كنتم عالمين بمنافع الامور ومضارها ومصالح انفسكم وارواحكم ومفاسدها وفيه دليل علي ان ملاك الامر في العبادات علي العلم الصحيح والنيات الخالصة وقيل معناه اعملوا ذلك عن الجباءي وفي هذه الاية دلالة علي وجوب الجمعة وتحريم جميع التصرفات عند سماع اذان الجمعة والبيع انما خص بالنهي عنه لكونه اعم التصرفات في اسباب المعايش وفي ,False,1050SadrDinShirazi.Tafsir
