cluster,size,id,text,from_input,book
197568573072,9,Shamela0035100-ara1.mARkdown.ms10263,الوقعة ابو بكر بن قوام بن علي بن قوام بن منصور بن معلي البالسي الزاهد الوفاة ه احد مشايخ الشام رضي الله عنه وجد شيخنا ابي عبد الله ابن قوام كان شيخا زاهدا عابدا قانتا لله عارفا بالله عديم النظير كثير المحاسن وافر النصيب من العلم والعمل صاحب احوال وكرامات وقد جمع حفيده شيخنا ابو عبد الله محمد بن عمر مناقبه في جزء ضخم وصحبه وحفظ عنه وذكر في مناقبة انه ولد بمشهد صفين في سنة اربع وثمانين وخمسماءة ونشا ببالس وقال كان اماما عالما عاملا له كرامات واحوال وكان حسن الاخلاق لطيف الصفات وافر الادب والعقل داءم البشر كثير التواضع شديد الحياء متمسكا بالاداب الشرعية كثير المتابعة للسنة مع دوام المجاهدة ولزوم المراقبة تخرج بصحبته غير واحد من العلماء والمشايخ وقصد بالزيارة وتلمذ له خلق كثير ,False,0748Dhahabi.TarikhIslam
197568573072,9,JK003609-ara1.mARkdown.ms2490,سنة تسع وعشرين وسبع ماءة ابن قوام الصالح ابو بكر بن قوام بن علي بن قوام بن منصور بن معلي البالسي احد مشايخ الشام وجد ابي عبد الله بن قوام كان شيخا زاهدا عابدا قانتا لله عديم النظير كثير المحاسن وافر النصيب من العلم والعمل صاحب احوال وكرامات وجمع حفيده ابو عبد الله محمد بن عمر مناقبه في جزء ضخم وصحبه وحفظ عنه وذكر انه ولد بمشهد صفين سنة اربع وثمانين وخمس ماءة ونشا ببالس وكان حسن الاخلاق لطيف الصفات وافر الادب والعقل داءم البشر كثير التواضع شديد الحياء متمسكا بالاداب الشرعية تخرج بصحبته غير واحد من العلماء والمشايخ وتتلمذ له خلق كثير ,False,0764Safadi.WafiBiWafayat
197568573072,9,Shamela0025841-ara1.mARkdown.ms700,الاخر وابن قوام الشيخ الزاهد الكبير ابو بكر بن قوام بن علي بن قوام البالسي جد شيخنا ابي عبد الله محمد بن عمر كات زاهدا عابدا قدوة صاحب حال وكشف وكرامات وله رواية واتباع ولد سنة اربع وثمانين وخمس ماءة وتوفي في سلخ رجب سنة ثمان ببلاد حلب ثم نقل تابوته ودفن بجبل قاسيون في اول سنة سبعين وقبره ظاهر يزار ,False,0748Dhahabi.CibarFiKhabar
197568573072,9,Shamela0012398-ara1.completed.ms1621,الشيخ الزاهد الكبير ابو بكر بن قوام بن علي بن قوام البالسي كان زاهدا عابدا قدوة صاحب حال وكشف وكرامات وله زاوية واتباع ولد سنة اربع وثمانين وخمسماءة وتوفي في سلخ رجب من هذه السنة ببلاد حلب ثم نقل تابوته ودفن بجبل قاسيون في اول سنة سبعين وستماءة وقبره ظاهر يزار قاله الذهبي وقال غيره كان شافعي المذهب اشعري العقيدة ولد بمشهد صفين ثم انتقل الي مدينة بالس وصفين وبالس غربي الفرات وببالس نشا وقد الف حفيده الشيخ محمد بن عمر بن الشيخ ابي بكر المذكور في مناقبه مءلفا حسنا ,False,1089IbnCimad.Shadharat
197568573072,9,JK000914-ara1.mARkdown.ms1797,ابو بكر بن قوام بن علي بن قوام بن منصور بن معلا بن حسن ابن عكرمة بن هارون بن قيس بن ربيعة بن عامر ابن هلال بن قصي بن كلاب البالسي الشيخ الزاهد العابد صاحب الاحوال والكرامات المجمع علي علمه ودينه كان شافعي المذهب اشعري العقيدة ولد بمشهد صفين سنة اربع وثمانين وخمسماءة ثم انتقل الي مدينة بالس وبها ربي وقد الف في مناقبه حفيده الشيخ ابو عبد الله محمد بن الشيخ عمر بن الشيخ ابي بكر مصنفا حسنا وانا اذكر بعض ما فيه قال كان اماما ورعا عالما زاهدا له كرامات واحوال حسن الاخلاق لطيف الذات والصفات وافر الادب والعقل داءم البشر مخفوض الجناح كثير التواضع شديد الحياء متمسكا بالاداب الشرعية ,False,0771Subki.TabaqatShaficiyyaKubra
197568573072,9,JK000417-ara1.mARkdown.ms597,العبر وابن قوام الشيخ الزاهد الكبير ابو بكر بن قوام بن علي بن قوام البالسي جد شيخنا ابي عبد الله محمد بن عمر كان زاهدا عابدا صاحب حال وكشف وكرامات وله زاوية واتباع ولد سنة اربع وثمانين وخمسماءة وتوفي رحمه الله تعالي في سلخ شهر رجب ببلاد حلب المحروسة ثم نقل تابوته ودفن بسفح قاسيون في اواءل سنة سبعين وقبره ظاهر يزار انتهي قال في ذيل العبر في سنة ثمان عشرة وسبعماءة ومات في صفر بزاوية الامام القدوة بركه الوقت الشيخ محمد بن عمر بن الشيخ الكبير ابي بكر ,False,0927Nucaymi.DarisFiMadaris
197568573072,9,Shamela0001003-ara1.completed.ms123,سنة تسع واربعماءة وقد زاحم الماءة رحمه الله تعالي وايانا ابن قوام ابو بكر بن قوام بن علي بن قوام بن منصور بن معلي البالسي احد مشايخ الشام كان شيخا زاهدا عابدا قانتا لله عديم النظير كثير المحاسن وافر النصيب من العلم والعمل صاحب احوال وكرامات ولد بصفين سنة اربع وثمانين وخمسماءة ونشا ببالس وكان ,False,0764IbnShakirKutubi.FawatWafayat
197568573072,9,Shamela0006710-ara1.completed.ms275,ابو بكر بن قوام البالسي كان زاهدا عابد قدوة صاحب حال وله زاوية واتباع ولد سنة اربع وثمانين وخمسماءة وتوفي او اخر رجب سنة ثمان وخمسين وستماءة ببلاد حلب ثم نقل الي دمشق فدفن بزاويته بسفح قاسيون بعد موته بسنتين وكان شافعي المذهب اشعري العقيدة ولد بمشهد صفين ثم انتقل الي بالس وهي غربي الفرات فنشا بها والف حفيده الشيخ محمد بن عمر بن ابي بكر في مناقبه مءلفا حسنا ,False,1346CabdQadirBadran.Munadama
197568573072,9,Shamela0012722-ara1.completed.ms0248,الورع القطب ابو بكر بن علي بن قوام بن منصور بن معلي بن حسن بن هارون بن قيس بن ربيعة بن عامر بن هلال بن قصي بن كلاب الراسبي الزاهد احد مشايخ الشام رضي الله عنهم اجمعين ولد بمشهد صفين سنة اربع وثمانين وخمسماءة ثم انتقل الي بالس وبها ربي وكان شيخا زاهدا عابدا قانتا لله تعالي عارفا بالله عديم النظير اماما عالما عاملا له كرامات واحوال حسن الاخلاق لطيف الصفات وافر الادب والعقل داءم البشر مخفوض الجناح كثير التواضع شديد الحياء متمسكا بالاداب الشرعية معظما لاهل العلم والدين كثير المتابعة للسنة محبا لسالكي طريق الاخرة مع دوام المجاهدة ولزوم المراقبة ,False,0726Yunini.DhaylMiratZaman
257698178408,9,Shia002341Vols-ara1.ms2836,والذين هم بايات ربهم يءمنون وبحججه من القران وغيره يصدقون والذين هم بربهم لا يشركون اي لا يشركون بعبادة الله غيره من الاصنام والاوثان لان خصال الايمان لا تتم الا بترك الاشراك دون ما يقول اهل الجاهلية انا نءمن بالله وقوله والذين يءتون ما اتوا اي يعطون ما اعطوا من الزكاة والصدقة وينفقونه في طاعة الله وقلوبهم وجلة اي خاءفة من عقاب الله لتفريط يقع منهم قال الحسن المءمن جمع احسانا وشفقة وقال ابن عمر ما اتوا من الزكاة وقلوبهم وجلة اي خاءفة انهم الي ربهم راجعون اي يخافون من رجوعهم الي الله يوم القيامة والي مجازاته اي يخافون ذلك لانهم لا يامنون التفريط ثم اخبر عمن جمع هذه الصفات وكملت فيه فقال اولءك يسارعون في الخيرات اي يبادرون الي الطاعات ويسارعون اليها من الايمان بالله ويجتهدون في السبق اليها رغبة فيها ولعلمهم بما لهم بها من حسن الجزاء وقوله وهم لها سابقون قيل في معناه ثلاثة اقوال احدها قال ابن عباس انهم سبقت لهم السعاة الثاني وهم من اجل تلك الخيرات سابقون الي الجنة الثالث وهم الي الخيرات سابقون قوله تعالي ولا نكلف نفسا الا وسعها ولدينا كتاب ينطق بالحق وهم لا يظلمون بل قلوبهم في غمرة من هذا ولهم اعمال من دون ذلك ,False,0460ShaykhTusi.Tibyan
257698178408,9,Tafsir03092-ara1.ms1684,اولءك يسارعون في الخيرات اي الذين هم هذه صفتهم يسارعون اي يسابقون في الاعمال الصالحة قال ابن زيد الخيرات المخافة والوجل والايمان والكف عن الشرك بالله ثم قال وهم لها سابقون اي قد سبقت لهم من الله السعادة فذلك سبقهم في الخيرات كل من عنده قال ابن عباس وهم لها سابقون سبقت لهم من الله تعالي السعادة وقيل معناه وهم اليها سابقون وقيل المعني وهم من اجلها سابقون اي من اجل اكتسابهم الخيرات يسبقون الي رحمة الله وقيل المعني فهم الي اوقاتها سابقون لان الصلاة في اول الوقت افضل ثم قال تعالي ذكره ولا نكلف نفسا الا وسعها اي الا ما تطيق من العبادة ولدينا كتاب ينطق بالحق اي وعندنا كتاب يبين بالصدق عما عملوا من عمل في الدنيا وهم لا يظلمون اي لا يزاد علي احد من سيءات غيره ولا ينقص من حسناته وهو الكتاب الذي كتبت فيه اعمال الخلق عند الملاءكة تحتفظ به ثم قال تعالي بل قلوبهم في غمرة من هذا اي في عماية من هذا القران وقيل ,False,0437IbnHammushQayruwani.Hidaya
257698178408,9,Tafsir05047-ara1.ms0578,والذين هم بايات ربهم يءمنون يصدقون والذين هم بربهم لا يشركون اي يوحدون الله ويعبدونه والذين يءتون ما اتوا اي يعطون ما اعطوا من الزكاة والديون والوداءع والامانات وقلوبهم وجلة اي خاءفة انهم الي ربهم راجعون الي حكمه اولءك يسارعون في الخيرات في طاعة الله وهم لها سابقون يعني لما علم منهم الاعمال الصالحة حكم لهم بالسعادة وقيل الي الخيرات سابقون ولها بمعني اليها وقيل من اجل الخيرات سابقون الي الجنة ولا نكلف نفسا الا وسعها الا وسع عليها فعله كالمصلي لا يجد الماء جاز التيمم ونحو ولدينا كتاب ينطق بالحق يعني وعيد بالكتاب ينطق بالحق وذلك كتاب الحفظة وقيل اللوح المحفوظ كتب فيه اعمال الخلق لتعرفه الملاءكة وهم لا يظلمون جزاء اعمالهم بل قلوبهم في غمرة اي حيرة وقيل في غفلة شديدة من هذا الكتاب المشتمل علي الوعد والوعيد ولهم اعمال من دون ذلك اي من دون الشرك من الفسق والظلم ونحوه هم لها عاملون اي ,False,0850Acqam.Tafsir
257698178408,9,Tafsir06048-ara1.ms0759,والذين ياتون ما اتوا خفيفة بغير مد اي يعملون ما عملوا مما نهوا عنه وقلوبهم وجلة خاءفة ان يءخذوا به قوله اولءك يسارعون في الخيرات اي في الاعمال الصالحة قال الحسن اي فيما افترض الله عليهم وهو واحد قال وهم لها سابقون اي وهم للخيرات مدركون في تفسير الحسن وقال بعضهم وهم لها سابقون اي سابقون بالخيرات قوله ولا نكلف نفسا الا وسعها اي لا يكلف الله نفسا الا طاقتها لا يكلف الله المريض القيام ولا الفقير الزكاة ولا الحج قوله ولدينا كتاب ينطق بالحق وهم لا يظلمون اي لا يظلم عندنا احد قوله بل قلوبهم في غمرة من هذا اي في غفلة من هذا اي مما ذكر من اعمال المءمنين في الاية الاولي ولهم يعني المشركين اعمال من دون ذلك اي دون اعمال المءمنين اي شر من اعمال المءمنين هم لها عاملون اي لتلك الاعمال وتفسير مجاهد في غمرة من هذا يعني القران ولهم اعمال ,False,0250HudHawari.Tafsir
257698178408,9,Shamela0022593-ara1.completed.ms1724,اولءك يسارعون في الخيرات اي الذين هم هذه صفتهم يسارعون اي يسابقون في الاعمال الصالحة قال ابن زيد الخيرات المخافة والوجل والايمان والكف عن الشرك بالله ثم قال وهم لها سابقون اي قد سبقت لهم من الله السعادة فذلك سبقهم في الخيرات كل من عنده قال ابن عباس وهم لها سابقون سبقت لهم من الله تعالي السعادة وقيل معناه وهم اليها سابقون وقيل المعني وهم من اجلها سابقون اي من اجل اكتسابهم الخيرات يسبقون الي رحمة الله وقيل المعني فهم الي اوقاتها سابقون لان الصلاة في اول الوقت افضل ثم قال تعالي ذكره ولا نكلف نفسا الا وسعها اي الا ما تطيق من العبادة ولدينا كتاب ينطق بالحق اي وعندنا كتاب يبين بالصدق عما عملوا من عمل في الدنيا وهم لا يظلمون اي لا يزاد علي احد من سيءات غيره ولا ينقص من حسناته وهو الكتاب الذي كتبت فيه اعمال الخلق عند الملاءكة تحتفظ به ثم قال تعالي بل قلوبهم في غمرة من هذا اي في عمامية من هذا القران وقيل ,False,0437MakkiIbnHammushQaysi.Hidaya
257698178408,9,Shamela0023628-ara1.completed.ms2555,اولءك يسارعون في الخيرات اي يبادرون الي الاعمال الصالحة وهم لها سابقون اي اليها وقال ابن عباس سبقت لهم من الله السعادة وقيل سبقوا الامم الي الخيرات قوله عز وجل ولا نكلف نفسا الا وسعها اي طاقتها من الاعمال فمن لم يستطع القيام فليصل قاعدا ومن لم يستطع الصوم فليفطر ولدينا كتاب هو اللوح المحفوظ ينطق بالحق اي يبين الصدق والمعني قد اثبتنا عمل كل عامل في اللوح المحفوظ فهو ينطق به ويبينه وقيل هو كتاب اعمال العباد التي تكتبها الحفظة وهم لا يظلمون اي لا ينقص من حسناتهم ولا يزاد علي سيءاتهم ثم ذكر الكفار فقال تعالي بل قلوبهم في غمرة اي غفلة وجهالة من هذا يعني القران ولهم اعمال اي للكفار اعمال خبيثة من المعاصي والخطايا محكومة عليهم من دون ذلك يعني من دون اعمال المءمنين ,False,0741KhazinBaghdadi.LubabTawil
257698178408,9,Tafsir02091-ara1.ms1420,والذين يءتون ما اتوا اي يعملون ما عملوا من البر وهم يرون ان ذلك لا ينجيهم من عذاب الله قال الزجاج وقلوبهم وجلة انهم الي ربهم راجعون اي لانهم يوقنون برجوعهم الي الله قوله تعالي اولءك يسارعون في الخيرات اي اهل هذه الصفة هم الذين يسارعون في الاعمال الصالحة وهم لها سابقون اي اليها سابقون يكون لها بمعني اليها كقوله بان ربك اوحي لها الزلزلة اي اليها وقيل معناه وهم لها سابقون في الجنة اي من اجل مسارعتهم في الخيرات سابقون في الجنة وقوله تعالي ولا نكلف نفسا الا وسعها اي الا طاقتها من العمل فمن لم يستطع ان يصلي قاءما فيصلي قاعدا وقوله تعالي ولدينا كتاب اي عند ملاءكتنا المقربين كتاب يشهد لكم وعليكم يريد به صحاءف الاعمال وقيل يعني اللوح المحفوظ فيه كل شء مكتوب سبق في علم الله ينطق بالحق اي يبين الصدق وهم لا يظلمون لا ينقصون من ثواب اعمالهم ولا يزاد علي سيءاتهم قوله تعالي بل قلوبهم في غمرة اي قلوب اهل مكة في غفلة وجهالة من هذا الذي تقدم ذكره من اعمال البر وقيل في غفلة من القران ولهم اعمال خبيثة لا يرضاها الله من المعاصي والخطايا من دون ذلك اي من دون اعمال المءمنين هم لها عاملون ,False,0360Tabarani.TafsirKabir
257698178408,9,Shamela0021821-ara1.ms1250,وقلوبهم وجلة لا يقبل منهم لعلمهم انهم الي ربهم راجعون المءمنون اي لانهم يوقنون بانهم يرجعون الي الله يخافون ان لا يقبل منهم قوله اولءك يسارعون في الخيرات المءمنون يبادرون في الاعمال الصالحة وهم لها المءمنون اي اليها سابقون المءمنون قاله الفراء والزجاج وقال ابن عباس ينافسون فيه امثالهم من اهل البر والتقوي وقال الكلبي سبقوا الامم الي الخيرات ولا نكلف نفسا الا وسعها ولدينا كتاب ينطق بالحق وهم لا يظلمون بل قلوبهم في غمرة من هذا ولهم اعمال من دون ذلك هم لها عاملون حتي اذا اخذنا مترفيهم بالعذاب اذا هم يجارون لا تجاروا اليوم انكم منا لا تنصرون قد كانت اياتي تتلي عليكم فكنتم علي اعقابكم تنكصون مستكبرين به سامرا تهجرون المءمنون قوله ولا نكلف نفسا الا وسعها المءمنون اي الا طاقتها من العمل فمن لم يستطع ان يصلي قاءما فيصلي جالسا وقد سبق هذا في اخر البقرة ولدينا كتاب يريد اللوح المحفوظ وفيه مكتوب كل شء سبق في علم الله ينطق بالحق يبين بالصدق ومعني ال لا نكلف نفسا الا ما اطاقت من العمل وتعلم اين تعمل لانا قد اثبتنا عمله في اللوح المحفوظ فهو ينطق به ويبينه وهم لا يظلمون المءمنون اي لا ينقصون من ثواب اعمالهم ثم عاد الي ذكر الكفار فقال بل قلوبهم في غمرة المءمنون في غفلة وجهالة من هذا المءمنون القران ولهم اعمال المءمنون خبيثة من دون ذلك المءمنون اعمال المءمنين التي ذكرها الله هم لها عاملون ,False,0468IbnAhmadWahidiNaysaburi.WasitFiTafsir
257698178408,9,ShamAY0033108-ara1.ms1203,والذين يءتون ما اتوا اي يعملون ما عملوا من البر وهم يرون ان ذلك لا ينجيهم من عذاب الله قال الزجاج وقلوبهم وجلة انهم الي ربهم راجعون اي لانهم يوقنون برجوعهم الي الله قوله تعالي اولءك يسارعون في الخيرات اي اهل هذه الصفة هم الذين يسارعون في الاعمال الصالحة وهم لها سابقون اي اليها سابقون يكون لها بمعني اليها كقوله بان ربك اوحي لها الزلزلة اي اليها وقيل معناه وهم لها سابقون في الجنة اي من اجل مسارعتهم في الخيرات سابقون في الجنة وقوله تعالي ولا نكلف نفسا الا وسعها اي الا طاقتها من العمل فمن لم يستطع ان يصلي قاءما فيصلي قاعدا وقوله تعالي ولدينا كتاب اي عند ملاءكتنا المقربين كتاب يشهد لكم وعليكم يريد به صحاءف الاعمال وقيل يعني اللوح المحفوظ فيه كل شء مكتوب سبق في علم الله ينطق بالحق اي يبين الصدق وهم لا يظلمون لا ينقصون من ثواب اعمالهم ولا يزاد علي سيءاتهم قوله تعالي بل قلوبهم في غمرة اي قلوب اهل مكة في غفلة وجهالة من هاذا الذي تقدم ذكره من اعمال البر وقيل في غفلة من القران ولهم اعمال خبيثة لا يرضاها الله من المعاصي والخطايا من دون ذلك اي من دون اعمال المءمنين هم لها عاملون ,False,0360Tabarani.Tafsir
48216,10,Sham19Y0020891-ara1.ms6468,فهم يدهنون حينءذ او ودوا ادهانك فهم الان يدهنون لطمعهم في ادهانك قال سيبويه وزعم هارون انها في بعض المصاحف ودوا لو تدهن فيدهنوا ولا تطع كل حلاف مهين هماز مشاء بنميم مناع للخير معتد اثيم عتل بعد ذلك زنيم ان كان ذا مال وبنين اذا تتلي عليه اياتنا قال اساطير الاولين سنسمه علي الخرطوم حلاف كثير الحلف في الحق والباطل وكفي به مزجرة لمن اعتاد الحلف ومثله قوله تعالي ولا تجعلوا الله عرضة لايمانكم البقرة مهين من المهانة وهي القلة والحقارة يريد القلة في الراي والتمييز او اراد الكذب لانه حقير عند الناس هماز عياب طعان وعن الحسن يلوي ,False,0743SharafDinTibi.FutuhGhayb
48216,10,Tafsir03037-ara1.ms3158,اي فهم مدهنون اي فهم الان يدهنون لطمعهم في ادهانك فليس داخلا في حيز تمنيهم بل هو حاصل لهم وفي بعض المصاحف فيدهنوا علي انه جواب التمني ولا تطع كل حلاف كثير الحلف في الحق والباطل وكفي به زجرا لمن يكثر الحلف مهين حقير في الراي والتدبير من المهانة وهي القلة والحقارة او كذاب لانه صغير عند الناس هماز عياب طعان مغتاب مشاء بنميم نقال للحديث من قوم الي قوم علي وجه السعاية والفساد بينهم فالنميم والنميمة السعاية في افساد ذات البين مناع للخير بخيل والخير المال ,False,1124IbnMuhammadIbnCajibaFasiSufi.BahrMadid
