cluster,size,id,text,from_input,book
8590048276,9,Shamela0000041-ara1.completed.ms1443,وابءس فاذاقها الله لباس الجوع ابتلاهم الله بالجوع سبع سنين وقطعت العرب عنهم الميرة بامر رسول الله صلي الله عليه وسلم حتي جهدوا فاكلوا العظام المحرقة والجيف والكلاب الميتة والعهن وهو الوبر يعالج بالدم حتي كان احدهم ينظر الي السماء فيري شبه الدخان من الجوع ثم ان رءساء مكة كلموا رسول الله صلي الله عليه وسلم وقالوا هذا عاديت الرجال فما بال النساء والصبيان فاذن رسول الله صلي الله عليه وسلم للناس بحمل الطعام اليهم وهم بعد مشركون وذكر اللباس لان ما اصابهم من الهزال والشحوب وتغير ظاهرهم عما كانوا عليه من قبل كاللباس لهم والخوف يعني بعوث النبي صلي الله عليه وسلم وسراياه التي كانت تطيف بهم ,False,0510IbnMascudBaghawi.Tafsir
8590048276,9,Tafsir02096-ara1.ms1065,من كل مكان اي من كل جهة من البر والبحر قوله بانعم الله جمع نعمة علي ترك الاعتداد بالتاء كدرع وادرع او جمع نعماء كابءس وباساء قوله بتكذيب النبي الباء سببية قوله فاذاقها الله لباس الجوع والخوف اي وذلك ان الله ابتلاهم بالجوع سبع سنين فقطع عنهم المطر وقطعت العرب عنهم الميرة حتي جهدوا فاكلوا العظام المحرقة والجيف والكلاب والميتة وشربوا الدماء واشتد بهم الامر حتي كان احدهم ينظر الي السماء فيري شبه ,False,1241IbnMuhammadKhalwatiSawi.HashiyaCalaTafsirJalalayn
8590048276,9,Tafsir02096-ara1.ms1066,الدخان ثم ان رءساء مكة كلموا رسول الله صلي الله عليه وسلم في ذلك فقالوا له ما هذا دابك عاديت الرجال فما بال النساء والصبيان فاذن رسول الله صلي الله عليه وسلم للناس في حمل الطعام اليهم وفي رواية انهم ارسلوا اليه ابا سفيان بن حرب في جماعة فقدموا عليه المدينة وقال له ابو سفيان يا محمد انك جءت تامر بصلة الرحم والعفو وان قومك قد هلكوا فادع الله لهم فدعا لهم رسول الله صلي الله عليه وسلم واذن للناس بحمل الطعام اليهم وهم بعد مشركون ,False,1241IbnMuhammadKhalwatiSawi.HashiyaCalaTafsirJalalayn
8590048276,9,Shamela0021766-ara1.ms2457,من كل مكان من نواحيها من البحر والبر فكفرت اهلها بانعم الله اي بنعمه جمع نعمة علي ترك الاعتداد بالتاء كدرع وادرع او جمع نعم كبءس وابءس فاذاقها اي اذاق اهلها الله لباس الجوع والخوف استعار الذوق لادراك اثر الضرر واللباس لما اشتمله من اثر الجوع والخوف وهو الهزال وتغير اللون واوقع الا ذاقة عليه بالنظر الي المستعار له بما كانوا يصنعون من الكفر والكفران قال البغوي ابتلي الله اهل مكة بالجوع سبع سنين وقطعت العرب عنهم الميرة بامر رسول الله صلي الله عليه وسلم حتي جهدوا فاكلوا العظام المحرقة والجيف والكلاب الميتة والعلهز وهو الوبر يعالج بالدم حتي كان احدهم ينظر الي السماء فيري شبه الدخان من الجوع ثم ان رءساء مكة كلموا رسول الله صلي الله عليه وسلم وقالوا هذا عاديت الرجال فما بال النساء والصبيان فاذن رسول الله صلي الله عليه وسلم للناس بحمل الطعام اليهم وهم بعد مشركون ,False,1225ThanaAllahPanipati.TafsirMazhari
8590048276,9,Shia002616Vols-ara1.ms3646,ابتلوا بالجوع سبع سنين وقطع العرب عنهم الميرة بامر النبي صلي الله عليه وسلم اكلوا العظام المحرقة والجيفة والكلاب الميتة والجلود والعلهز وهو الوبر يعالج بالدم ثم ان رءساء مكة كلموا رسول الله صلي الله عليه وسلم حين جهدوا وقالوا هذا عذاب الرجال فما بال النساء والصبيان ,False,0671AbuCabdAllahQurtubi.JamicLiAhkamQuran
8590048276,9,Shamela0023628-ara1.completed.ms2222,من الجوع ثم ان رءساء مكة كلموا رسول الله صلي الله عليه وسلم في ذلك وقالوا ما هذا هبك عاديت الرجال فما بال النساء والصبيان فاذن رسول الله صلي الله عليه وسلم في حمل الطعام اليهم وهم بعد مشركون والخوف يعني خوف بعوث النبي صلي الله عليه وسلم وسراياه التي كان يبعثها للاغارة فكانت تطيف بهم ,False,0741KhazinBaghdadi.LubabTawil
8590048276,9,Shamela0023628-ara1.completed.ms2221,فاذاقها الله لباس الجوع والخوف وذلك ان الله سبحانه وتعالي ابتلاهم بالجوع سبع سنين فقطع عنهم المطر وقطعت عنهم العرب الميرة بامر رسول الله صلي الله عليه وسلم حتي جهدوا فاكلوا العظام المحرقة والجيف والكلاب والميتة والعهن وهو الوبر يعالج بالدم ويخلط به حتي يءكل حتي كان احدهم ينظر الي السماء فيري شبه الدخان ,False,0741KhazinBaghdadi.LubabTawil
8590095726,9,Shia000841Vols-ara1.ms4617,الدارقطني في سننه من حديث ابي بكر بن عياش عن الربيع بن صبيح بفتح الصاد عن الحسن عن عبادة وانس بن مالك عن النبي صلي الله عليه وسلم قال ما وزن مثلا بمثل اذا كان نوعا واحدا وما كيل فمثل ذلك فاذا اختلف النوعان فلا باس به قال الدارقطني لم يروه غير ابي بكر عن الربيع هكذا وخالفة جماعة فرووه عن الربيع عن ابن سيرين عن ,False,0676Nawawi.Majmuc
8590095726,9,JK000477-ara1.completed.ms0593,ابو بكر بن عياش عن الربيع بن صبيح عن الحسن عن عبادة وانس بن مالك عن النبي صلي الله عليه وسلم قال ما وزن مثل بمثل اذا كان ونوعا واحدا وما كيل فمثل ذلك فاذا اختلف النوعان فلا باس به لم يروه غير ابي بكر عن الربيع هكذا وخالفه جماعة فرووه عن الربيع عن بن سيرين عن ,False,0385Daraqutni.Sunan
8590095726,9,Shamela0026324-ara1.ms0215,ابو بكر بن عياش عن الربيع بن صبيح عن الحسن عن عبادة وانس بن مالك بهذا وقال وخالفه جماعة فرووه عن الربيع عن ابن سيرين عن ,False,0852IbnHajarCasqalani.IthafMahara
8590095726,9,Shamela0011428-ara1.ms1574,الدارقطني في سننه عن ابي بكر بن عياش عن الربيع بن صبيح عن الحسن عن انس وعبادة بن الصامت عن النبي صلي الله عليه وسلم قال ما وزن فمثل بمثل اذا كان نوعا واحدا وما كيل فمثل ذلك فاذا اختلف النوعان فلا باس به انتهي وذكره عبد الحق في احكامه من جهة الدارقطني ثم قال لم يروه هكذا غير ابي بكر عن الربيع عن ابن سيرين عن ,False,0762IbnYusufZaylaci.NasbRaya
8590095726,9,Sham19Y0013922-ara1.ms613,ابو بكر ابن عياش عن الربيع بن صبيح عن الحسن عن عبادة وانس بن مالك عن النبي صلي الله عليه وسلم قال ما وزن مثلا بمثل اذا كان نوعا واحدا وما كيل مثل ذلك واذا اختلف النوعان فلا باس به وهذا نص لانه اعتبر المماثلة في الوزن والكيل وعند المخالف هي معتبرة في الماكول فان قيل فقد قال الدارقطني لم يروه عن ابي بكر غير الربيع هكذا وخالفه جماعة فرووه عن الربيع عن ابن سيرين عن ,False,0458AbuYaclaIbnFarra.Tacliqa
8590095726,9,Sham19Y0014032-ara1.ms521,بن الصامت اخرجه الدارقطني في السنن في البيوع رقم الحديث عن ابي بكر بن عياش عن الربيع بن صبيح عن الحسن عن عبادة عن انس وقال عقبه لم يروه غير ابي بكر عن الربيع هكذا وخالفه جماعة فرووه عن الربيع عن ابن سيرين عن ,False,0732IbnCumarBurhanDinJacbari.RusukhAhbar
8590095726,9,Shamela0010657-ara1.ms0923,ابو بكر بن عياش عن الربيع بن صبيح عن الحسن عن عبادة وانس بن مالك عن النبي صلي الله عليه وسلم قال ما وزن مثلا بمثل اذا كان نوعا واحدا وما كيل فمثل ذلك فاذا اختلف النوعان فلا باسا به ز هذا الحديث غير مخرج في السنن والربيع بن صبيح لا باس به رجل صالح قاله الامام احمد وضعفه يحيي بن معين والنساءي وقال ابو زرعة شيخ صالح صدوق وقال يعقوب بن شيبة رجل صالح صدوق ثقة ضعيف جدا وقال ابن عدي لم ار له حديثا منكرا جدا وقال الدارقطني في هذا الحديث لم يروه غير ابي بكر عن الربيع هكذا وخالفه جماعة فرووه عن الربيع عن ابن سيرين عن ,False,0744IbnCabdHadi.TanqihTahqiq
8590095726,9,Sham19Y0017903-ara1.ms0695,بن المسيب وذكر الدارقطني ايضا عن ابي بكر بن عياش عن الربيع بن صبيح عن الحسن عن انس بن مالك وعبادة عن النبي صلي الله عليه وسلم قال ما وزن مثلا بمثل اذا كان نوعا واحدا وما كيل فمثل ذلك فاذا اختلف النوعان فلا باس به قال لم يروه هكذا غير ابي بكر عن الربيع وخالفه جماعة فرووه عن الربيع عن ابن سيرين عن ,False,0581IbnKharratIshbili.AhkamWusta
8590095726,9,Shamela0006227-ara1.ms483,ابو بكر ابن عياش عن الربيع بن صبيح عن الحسن عن عبادة وانس رضي الله عنهما عن النبي صلي الله عليه وسلم قال ما وزن مثل بمثل اذا كان نوعا واحدا وما كيل فمثل ذلك واذا اختلف النوعان فلا باس قال علي بن عمر لم يروه غير ابي بكر عن الربيع هكذا وخالفه جماعة فرووه عن الربيع عن ابن سيرين عن ,False,0699ShihabDinIshbiliLakhmi.MukhtasarKhilafiyyat
17179903534,9,JK009266-ara1.ms4890,وقدره ابو البقاء فقال الا حين يستغشون ثيابهم يستخفون والثاني ان الناصب له يعلم اي الا يعلم سرهم وعلنهم حين يفعلون كذا وهذا معني واضح وكانهم انما جوزوا غيره لءلا يلزم تقييد علمه تعالي بسرهم وعلنهم بهذا الوقت الخاص والله تعالي عالم بذلك في كل وقت وهذا غير لازم لانه اذا علم سرهم وعلنهم في وقت التغشية الذي يخفي فيه السر فاولي في غيره وهذا بحسب العادة والا فالله تعالي لايتفاوت علمه و ما يجوز ان تكون مصدرية وان تكون بمعني الذي والعاءد محذوف اي تسرونه وتعلنونه ,False,0800IbnCadilHanbali.LubabFiCulumKitab
17179903534,9,JK009266-ara1.ms4891,لا يراه النبي صلوات الله وسلامه عليه قال قتادة كانوا يخفون صدورهم لكيلا يسمعوا كلام الله ولا ذكره وقيل كان الرجل من الكفار يدخل بيته ويرخي ستره ويحني ظهره ويتغشي بثوبه ويقول هل يعلم الله ما في قلبي وقال السدي يثنون صدورهم اي يعرضون بقلوبهم من قولهم ثنيت عناني ليستخفوا منه اي من رسول الله صلوات ا لله وسلامه عليه وقال مجاهد من الله عز وجل الا حين يستغشون ثيابهم يغطون رءوسهم بثيابهم و الا كلمة تنبيه اي الا انهم يستخفون حين يستغشون ثيابهم ثم ذكر انه لا فاءدة لهم في استخفافهم فقال سبحانه يعلم ما يسرون وما يعلنون انه عليم بذات لصدور ,False,0800IbnCadilHanbali.LubabFiCulumKitab
17179903534,9,Shamela0023578-ara1.completed.ms1510,لا يراه النبي صلي الله عليه وسلم قتادة كانوا يحنون صدورهم لكيلا يسمعوا كتاب الله ولا ذكره ابن زيد هذا حين يناجي بعضهم بعضا في امر رسول الله صلي الله عليه وسلم ليستخفوا منه اي من رسول الله صلي الله عليه وسلم وقال مجاهد ليستخفوا من الله ان استطاعوا وقال ابن عباس يثنون صدورهم علي وزن يحنون جعل الفعل للصدور اي يلقون الا حين يستغشون ثيابهم يغطون رءوسهم بثيابهم وذلك اخفي ما يكون لابن ادم اذا حني صدره وتغشي ثوبه واضمر همه في نفسه يعلم ما يسرون وما يعلنون انه عليم بذات الصدور ,False,0427AbuIshaqThaclabi.KashfWaBayan
17179903534,9,Shamela0000041-ara1.completed.ms1232,الرجل من الكفار يدخل بيته ويرخي ستره ويحني ظهره ويتغشي بثوبه ويقول هل يعلم الله ما في قلبي وقال السدي يثنون اي يعرضون بقلوبهم من قولهم ثنيت عناني وقيل يعطفون ومنه ثني الثوب وقرا ابن عباس يثنوني علي وزن يحلولي جعل الفعل للمصدر ومعناه المبالغة في الثني ليستخفوا منه اي من رسول الله صلي الله عليه وسلم وقال مجاهد ليستخفوا من الله ان استطاعوا الا حين يستغشون ثيابهم يغطون رءوسهم بثيابهم يعلم ما يسرون وما يعلنون ,False,0510IbnMascudBaghawi.Tafsir
17179903534,9,ShamAY0034068-ara2.ms1180,الرجل من الكفار يدخل بيته ويرخي ستره ويتغشي بثوبه ويقول هل يعلم الله ما في قلبي وقال السدي يثنون صدورهم اي يعرضون بقلوبهم من قولهم ثنيت عناني ليستخفوا منه اي من الله تعالي بسرهم فلا يطلع رسول الله صلي الله عليه وسلم والمءمنون عليه وقيل من رسول الله صلي الله عليه وسلم فقد قيل انها نزلت في طاءفة من المشركين قالوا ان ارخينا علينا ستورا واستغشينا ثيابا وطوينا صدورنا علي عداوة محمد كيف يعلم الا حين يستغشون ثيابهم اي ياوون الي فراشهم ويتغطون بثيابهم يعلم تعالي ما يسرون في قلوبهم وما يعلنون بافواههم اي انه لا تفاوت في علمه تعالي بين اسرارهم واعلانهم ,False,0977KhatibShirbini.SirajMunir
17179903534,9,Shamela0023588-ara1.ms0785,ليستخفوا منه من الله بسرهم فلا يطلع رسوله والمءمنين عليه قيل انها نزلت في طاءفة من المشركين قالوا اذا ارخينا ستورنا واستغشينا ثيابنا وطوينا صدورنا علي عداوة محمد كيف يعلم وقيل نزلت في المنافقين وفيه نظر اذ الاية مكية والنفاق حدث بالمدينة الا حين يستغشون ثيابهم الا حين ياوون الي فراشهم ويتغطون بثيابهم يعلم ما يسرون في قلوبهم وما يعلنون بافواههم يستوي في علمه سرهم وعلنهم ,False,0685NasirDinBaydawi.AnwarTanzil
17179903534,9,Tafsir02079-ara1.ms2213,وقدره ابو البقاء فقال الا حين يستغشون ثيابهم يستخفون والثاني ان الناصب له يعلم اي الا يعلم سرهم وعلنهم حين يفعلون كذا وهو معني واضح وكانهم انما جوزوا غيره لءلا يلزم تقييد علمه تعالي بسرهم وعلنهم بهذا الوقت الخاص وهو تعالي عالم بذلك في كل وقت وهذا غير لازم لانه اذا علم سرهم وعلنهم في وقت التغشية الذي يخفي فيه السر فاولي في غيره وهذا بحسب العادة والا فالله تعالي لا يتفاوت علمه و ما يجوز ان تكون مصدرية وان تكون بمعني الذي والعاءد محذوف اي تسرونه وتعلنونه ,False,0756IbnYusufSaminHalabi.DurrMasun
17179903534,9,ShamAY0034059-ara1.ms2457,الرجل من الكفار يدخل بيته ويرخي ستره ويحني ظهره ويتغشي ثوبه ويقول هل يعلم الله ما في قلبي قال في الكواشي حين توقيت للتغطي لا للعلم انتهي اي لءلا يلزم تقييد علمه تعالي بسرهم وعلنهم بهذا الوقت الخاص وهو تعالي عالم بذلك في كل وقت والجواب انه تعالي اذا علم سرهم وعلنهم في وقت التغشية الذي يخفي فيه السر فاولي ان يعلم ذلك في غيره وهذا بحسب العادة والا فالله تعالي لا يتفاوت علمه بتفاوت احوال الخلق يعلم ما يسرون اي يضمرون في قلوبهم وما يعلنون بافواههم وما مصدرية اي اسرارهم واعلانهم او بمعني الذي والعاءد محذوف ,False,1127IsmacilHaqqiBurusawi.RuhBayan
17179903534,9,Shamela0038091-ara1.ms263,يعلم اي الا يعلم سرهم وعلنهم حين يفعلون كذا وهذا معني واضح وقيل يجوز لءلا يلزم تقييد علمه تعالي بسرهم وعلنهم بهذا الوقت الخاص وهو تعالي عالم بذلك في كل وقت وهذا غير لازم لانه اذا علم سرهم وعلنهم في وقت التغشية التي يخفي السر فيها فاولي في غيرها وهذا بحسب العادة قاله ,False,1100IbnCabdKarimAshmuniMisri.ManarHuda
17179917101,9,Shia000841Vols-ara1.ms0314,صلي الله عليه وسلم استاكوا عرضا وادهنوا غبا واكتحلوا وترا الشرح هذا الحديث ضعيف غير معروف قال الشيخ ابو عمرو بن الصلاح رحمه الله بحثت عنه فلم اجد له اصلا ولا ذكرا في شء من كتب الحديث واعتني جماعة بتخريج احاديث المهذب فلم يذكروه اصلا وعقد البيهقي بابا في الاستياك عرضا ولم يذكر فيه حديثا يحتج به وهذا الحكم الذي ذكره وهو استحباب الاستياك عرضا يستدل له انه يخشي في الاستياك طولا ادماء اللثة وافساد عمود الاسنان واما الحديث الذي اعتمده المصنف فلا اعتماد عليه ولا يحتج به ,False,0676Nawawi.Majmuc
17179917101,9,Shamela0023177-ara1.ms070,اصله الحصن الحصين حديث استاكوا عرضا وادهنوا غبا واكتحلوا وترا قال ابن الصلاح بحثت عنه فلم اجد له اصلا ولا ذكرا في شء من كتب الحديث قال وقد عقد البيهقي بابا في الاستياك عرضا ولم يذكر فيه حديثا يحتج به ,False,0902Sakhawi.MaqasidHasana
17179917101,9,Shia002294Vols-ara1.ms119,استاكوا عرضا وادهنوا غبا واكتحلوا وترا قال النووي في شرح المهذب هذا الحديث ضعيف غير معروف انتهي ونقل في اللالء عن ابن الصلاح واقره انه قال بحثت عنه فلم اجد له اصيلا وليس له ذكر في شء من كتب الحديث وعقد البيهقي بابا في الاستياك عرضا ولم يذكر فيه حديثا يحتج به ,False,1162IbnMuammadAbuFidaCajluni.KashfKhafa
17179917101,9,Shamela0005922-ara1.ms0225,صلي الله عليه وسلم قال استاكوا عرضا هذا الحديث اورده الامام الرافعي تبعا لصاحب المهذب وغيره من الاصحاب زاد في المهذب وادهنوا غبا واكتحلوا وترا قال الشيخ تقي الدين بن الصلاح في كلامه علي المهذب هذا الحديث بحثت عنه فلم اجد له اصلا ولا ذكرا في كتب الحديث وجماعة عنوا بتخريج احاديث المهذب فلم اجدهم ذكروه اصلا وعقد الحافظ ابو بكر البيهقي في السنن الكبير بابا في الاستياك عرضا فلم يورد فيه حديثا يحتج به وقال النووي في شرح المهذب هذا الحديث ضعيف غير معروف ولا اعتماد عليه ولا يحتج به ,False,0804IbnMulaqqin.BadrMunir
17179917101,9,ShamAY0034147-ara1.ms03,استاكوا عرضا وادهنوا غبا واكتحلوا وترا قال ابن الجد الحثيث ج ص الصلاح بحثت عنه فلم اجد له اصلا ولا ذكرا في كتب الحديث انتهي ,False,1143IbnCabdKarimGhazziCamiri.JiddHathith
17179917101,9,Shamela0009329-ara1.ms352,استاكوا عرضا وادهنوا غبا واكتحلوا وترا قال ابن الصلاح بحثت عنه فلم اجد له اصلا ولا ذكرا في شء من كتب الحديث ومثال المشهور عند ,False,0911Suyuti.TadribRawi
17179917101,9,ShamAY0035999-ara1.ms08,في الضعفاء انتهي وفي المقاصد الحسنة للسخاوي حديث استاكوا عرضا وادهنوا غبا واكتحلوا وترا قال ابن الصلاح بحثت عنه فلم اجد له اصلا ولا ذكر في شء من كتب الحديث وقد عقد البيهقي بابا في الاستياك عرضا ولم يذكر فيه حديثا يحتج به ,False,1304CabdHayyLaknawi.AhkamSiwak
17179917101,9,Sham19Y0017531-ara1.ms07,في الضعفاء وابن حبان في التاريخ والديلمي حديث استاكوا عرضا وادهنوا غبا واكتحلوا وترا قال ابن الصلاح بحثت عنه فلم اجد له اصلا ولا ذكر في شء من كتب الحديث ,False,0909IbnCabdHadi.TakhrijSaghirWaTahbirKabir
17179917101,9,Shamela0006061-ara1.ms15,استاكوا عرضا وادهنوا غبا واكتحلوا وترا قال الشيخ ابو عمرو بن الصلاح بحثت عنه فلم اجد له اصلا ولا ذكرا في شء من كتب الحديث وقال وعقد البيهقي بابا في الاستياك عرضا ولم يذكر فيه حديثا يحتج به ,False,0794BadrDinZarkashi.TadhkiraFiAhadithMashhura
17180030534,9,Sham19Y0020891-ara1.ms6353,وفيها ذكر غير الله قلت ما كان من ذكر رسول الله صلي الله عليه وسلم والثناء عليه وعلي خلفاءه الراشدين واتقياء المءمنين والموعظة والتذكير فهو في حكم ذكر الله فاما ما عدا ذلك من ذكر الظلمة والقابهم والثناء عليهم والدعاء لهم وهم احقاء بعكس ذلك فمن ذكر الشيطان وهو من ذكر الله علي مراحل واذا قال المنصت للخطبة لصاحبه صه فقد لغا افلا يكون الخطيب الغالي في ذلك لا غيا نعوذ بالله من غربة الاسلام ونكد الايام اراد الامر بترك ما يذهل عن ذكر الله من شواغل الدنيا ,False,0743SharafDinTibi.FutuhGhayb
17180030534,9,JK009266-ara1.ms8810,فان قلت كيف يفسر ذكر الله بالخطبة وفيها غير ذلك قلت ما كان من ذكر رسول الله والثناء عليه وعلي خلفاءه الراشدين واتقياء المءمنين والموعظة والتذكير فهو في حكم ذكر الله فاما ما عدا ذلك من ذكر الظلمة والقابهم والثناء عليهم والدعاء لهم وهم احقاء بعكس ذلك ,False,0800IbnCadilHanbali.LubabFiCulumKitab
