cluster,size,id,text,from_input,book
240518300658,2,Shamela0012398-ara1.completed.ms1621,عبادة وورع ولم يكن في بيته من يضاهيه حاصرته التتار عشرين شهرا حتي فني اهل البلد بالوباء والقحط ثم دخلوا واسروه فضرب هولاكو عنقه بعد اخذ حلب وطيف براسه ثم علق راسه علي باب الفراديس ثم دفنه المسلمون بمسجد الراس داخل الباب قال الذهبي بلغني ان التتار دخلوا البلد اي ميافارقين فوجدوا به سبعين نفسا بعد الوف كثيرة وفيها الضياء القزويني الصوفي ابو عبد الله محمد بن ابي القاسم بن محمد ولد سنة اثنتين وسبعين وخمسماءة بحلب وروي عن يحيي الثقفي وفيها الشيخ الزاهد الكبير ابو بكر بن قوام بن علي بن قوام البالسي كان زاهدا عابدا قدوة صاحب حال وكشف وكرامات وله زاوية واتباع ولد سنة اربع وثمانين وخمسماءة ,False,1089IbnCimad.Shadharat
240518312417,2,Tafsir03095-ara1.ms1441,جمع الله فيه هذه المثالب الذميمة وبالجملة لا تعطه يا اكمل الرسل ولا تلتفت الي ثروته وسيادته فانا بمقتضي قهرنا وجلالنا سنسمه ونعلمه بالكي علي الخرطوم القلم اي انفه بحيث يعرف به في عرصات المحشر انا بمقتضي قهرنا وانتقاما من اهل مكة بلوناهم اصبناهم وابتليناهم بالقحط سبع سنين لكفرانهم بنعمنا التي من معظمها بعثة الرسول الذي هو اكمل الرسل منهم فكذبوه وانكروا دينه وكتابه واستهزءوا به كما بلونا واصبنا اصحاب الجنة التي اسمها ضروان كانت دون صنعاء بفرسخين لصالح كان ينادي الفقراء وقت الصرام فلما مات قال بنوه ان فعلنا ما كان يفعل ابونا لضاق علينا فان المال قليل والعيال كثير وكان مال ابينا كثيرا وعياله قليلا فحلفوا ليصرمنها مصبحين خيفة من المساكين كما حكي عنهم سبحانه اذ اقسموا يعني اولاد الصالح وورثته ليصرمنها وليقطعنها مصبحين القلم داخلين في الصباح ولا يستثنون القلم اي لا يتكلمون بكلمة ان شاء الله حين تقاولوا وتقاسموا وبعدما اتفقوا علي تحريم الفقراء ولم يفوضوا امرهم الي مشيءة الله فطاف عليها اي علي الجنة طاءف بلا مخصوص بها احاط جميع جوانبها لا لما في حواليها من البساتين الاخري ناشءة من ربك يا اكمل الرسل وهم حينءذ ناءمون القلم في بيوتهم فاصبحت الجنة وصارت ,False,0561CabdQadirJilani.Tafsir
240518312417,2,Shamela0023624-ara1.ms1639,جمع الله فيه هذه المثالب الذميمة والمساوي القبيحة وبالجملة لا تطعه انت يا اكمل الرسل ولا تلتفت الي ثروته وسيادته بحال من الاحوال فانا بمقتضي قهرنا وجلالنا سنسمه ونعلمه بالكي علي الخرطوم اي علي انفه بحيث يعرف ويعلم به في عرصات المحشر انا بمقتضي جلالنا وقهرنا وانتقامنا من اهل مكة قد بلوناهم اي اصبناهم وابتليناهم بالقحط سبع سنين لكفرانهم بنعمنا التي من معظمها بعثة الرسول الذي هو اكمل الرسل منهم ومن شيعتهم فكذبوه وانكروا عليه وعلي دينه وكتابه واستهزءا به كما بلونا واصبنا اصحاب الجنة التي اسمها ضروان كانت دون صنعاء بفرسخين لصالح قد كان ينادي الفقراء وقت الصرام والقطع فلما مات الصالح قال بنوه ان فعلنا مثل ما كان يفعل ابونا لضاق علينا الامر فان المال قليل والعيال كثير وكان مال ابينا كثيرا وعياله قليلا فحلفوا فيما بينهم ليصر منها مصبحين خوفا من شدة هجوم المساكين كما حكي عنهم سبحانه اذ اقسموا يعني اولاد الصالح وورثته ليصرمنها وليقطعنها مصبحين داخلين في الصباح ولا يستثنون اي لا يتكلمون بكلمة ان شاء الله حين تقاولوا وتقاسموا وهم بعد ما اتفقوا علي حرمان الفقراء ومع ذلك لم يفوضوا امورهم الي مشية الله فطاف عليها اي علي تلك الجنة طاءف اي بلاء مخصوص بها حيث احاط جميع جوانبها ولم يضر ما في حواليها من الجنان والبساتين الاخر ناش من ربك يا اكمل الرسل وهم حينءذ ناءمون في بيوتهم فاصبحت الجنة وصارت ,False,0920IbnMahmudNakhjawani.FawatihIlahiyya
240518361881,4,Sham19Y0013231-ara1.ms4255,قوم من ثقيف كانوا باليمن مسلمين ورثوا من ابيهم ضيعة فيها جنان وزروع ونخيل وكان ابوهم يجعل مما فيها للمساكين من كل شء حظا عند الصرام وعند الحصاد والدياسة والرفاع فقالت بنوه العيال كثير والمال قليل ولا يسعنا ان نعطي المساكين كما كان يفعل ابونا وعزموا علي حرمان المساكين فصارت عاقبتهم الي الهلاك والي ما قص الله في كتابه من قصتهم قال مقاتل وهذا مثل ضربه الله لكفار مكة ليعتبروا فيرجعوا وهو قوله كما بلونا اصحاب الجنة قال المفسرون وهي تسمي الضروان بقرب صنعاء قال سعيد بن جبير علي اثني عشر ميلا منها وقال الكلبي كان بينهم وبين صنعاء فرسخان ابتلاهم الله بان احرق جنتهم بالنار قوله اذ اقسموا ليصرمنها مصبحين حلفوا ,False,0468IbnAhmadWahidiNaysaburi.TafsirBasit
240518361881,4,Shamela0023623-ara1.ms4251,فيها من كل شء حظا للمساكين عند الحصاد والصرام فقالت بنوه المال قليل والعيال كثير ولا يسعنا ان نفعل كما كان يفعل ابونا وعزموا علي حرمان المساكين فصارت عاقبتهم الي ما قص الله في كتابه قال الكلبي كان بينهم وبين صنعاء فرسخان ابتلاهم الله بان حرق جنتهم وقيل هي جنة كانت بضوران وضوران علي فراسخ من صنعاء وكان اصحاب هذه الجنة بعد رفع عيسي بيسير اذ اقسموا ليصرمنها مصبحين اي حلفوا ,False,1250Shawkani.FathQadir
240518361881,4,ShamAY0034054-ara1.ms4097,قوم من ثقيف كانوا باليمن مسلمين ورثوا من ابيهم ضيعة فيها جنات وزرع ونخيل وكان ابوهم بجعل مما فيها من كل شء حظا للمساكين عند الحصاد والصرام فقالت بنوه المال قليل والعيال كثير ولا يسعنا ان نفعل كما كان يفعل ابونا وعزموا علي حرمان المساكين فصارت عاقبتهم الي ما قص الله في كتابه قال الكلبي كان بينهم وبين صنعاء فرسخان فبلاهم الله بان حرق جنتهم وقيل هي جنة كانت بصوران وصوران علي فراسخ من صنعاء وكان اصحاب هذه الجنة بعد رفع عيسي بيسير اذ اقسموا ليصرمنها مصبحين ,False,1281IbnMuhammadShawkani.TafsirFathQadir
240518361881,4,Shamela0037458-ara1.ms4534,قوم من ثقيف كانوا باليمن مسلمين ورثوا من ابيهم ضيعة فيها جنات وزرع ونخيل وكان ابوهم يجعل مما فيها من كل شء حظا للمساكين عند الحصاد والصرام فقالت بنوه المال قليل والعيال كثير ولا يسعنا ان نفعل كما كان يفعل ابونا وعزموا علي حرمان المساكين فصارت عاقبتهم الي ما قص الله في كتابه وقال الحسن كانوا كفارا قال النسفي والجمهور علي الاول وقال الكلبي كان بينهم وبين صنعاء فرسخان ابتلاهم الله بان حرق جنتهم وقيل هي جنة كانت بصروان وصروان بالصاد المهملة علي فراسخ من صنعاء وكان اصحاب هذه الجنة بعد رفع عيسي بزمن يسير ,False,1307Qannawji.FathBayan
240518361884,4,Shamela0023623-ara1.ms4250,الزنيم الذي يعرف بالشر كما تعرف الشاة بزنمتها واخرج ابن ابي حاتم عنه قال هو الرجل يمر علي القوم فيقولون رجل سوء واخرج ابن المنذر وابن ابي حاتم عنه ايضا ,False,1250Shawkani.FathQadir
240518361884,4,Shia002702Vols-ara1.ms11076,الزنيم هو الذي يعرف بالشر كما تعرف الشاة بالزنمة وفي رواية ابن ابي حاتم عنه هو الرجل يمر علي القوم فيقولون رجل سوء والمال واحد وعنه ايضا ,False,1270ShihabDinAlusi.RuhMacani
240518361884,4,ShamAY0034054-ara1.ms4097,الزنيم الذي يعرف بالشر كما تعرف الشاة بزنمتها واخرج ابن ابي حاتم عنه قال هو الرجل يمر علي القوم فيقولون رجل سوء واخرج ابن المنذر وابن ابي حاتم عنه ايضا ,False,1281IbnMuhammadShawkani.TafsirFathQadir
240518361884,4,ShamAY0034055-ara1.ms10743,الزنيم هو الذي يعرف بالشر كما تعرف الشاة الزنمة وفي رواية ابن ابي حاتم عنه هو الرجل يمر علي القوم فيقولون رجل سوء والمال واحد وعنه ايضا ,False,1342MahmudShukriAlusi.RawhMacani
240518370575,2,Shia001174Vols-ara1.ms3225,عن احمد بن محمد عن ابن فضال عن ابن بكير عن ابي بصير قال سمعت ابا عبد الله عليه السلام يقول اذا اذنب الرجل خرج في قلبه نكتة سوداء فان تاب انمحت وان زاد زادت حتي تغلب علي قلبه فلا يفلح بعدها ابدا الشرح قوله اذا اذنب الرجل خرج في قلبه نكتة سوداء فان تاب انمحت وان زاد زادت حتي تغلب علي قلبه فلا يفلح بعدها ابدا النكتة النقطة وكل نقطة في شء بخلاف لونه فهي نكتة واعلم ان الله تعالي خلق قلب المءمن نورانيا قابلا للصفات النورانية فان اذنب خرج فيه نقطة سوداء فان تاب بان ندم وعزم ان لا يعود زالت تلك النقطة وعاد محلها الي نورانيته وان زاد في الذنب سواء كان من نوع ذلك الذنب ام من غيره زادت نقطة اخري سوداء وهكذا حتي تغلب النقاط السود علي جميع قلبه فلا يفلح بعدها ابدا لان القلب حينءذ لا يقبل شيءا من الصفات النورانية والظاهر انه ان تاب من ذنب ثم عاد لم تبطل التوبة الاولي وانه ان تاب من بعض الذنوب دون بعض فهي صحيحة علي احد القولين فيها ,False,1081MuhammadSalihMazandarani.SharhUsulKafi
240518370575,2,Shia001432Vols-ara1.msB24808,عن احمد بن محمد عن ابن فضال عن ابن بكير عن ابي بصير قال سمعت ابا عبد الله عليه السلام يقول اذا اذنب الرجل خرج في قلبه نكتة سوداء فان تاب انمحت وان زاد زادت حتي تغلب علي قلبه فلا يفلح بعدها ابدا بيان خرج في قلبه نكتة النكتة النقطة وكل نقطة في شء بخلاف لونه فهو نكتة وقيل ان الله خلق قلب المءمن نورانيا قابلا للصفات النورانية فان اذنب خرج فيه نقطة سوداء فان تاب زالت تلك النقطة وعاد محلها الي نورانيته وان زاد في الذنب سواء كان من نوع ذلك الذنب ام من غيره زادت نقطة اخري سوداء وهكذا حتي تغلب النقاط السود علي جميع قلبه فلا يفلح بعدها ابدا لان القلب حينءذ لا يقبل شيءا من الصفات النورانية والظاهر انه ان تاب من ذنب ثم عاد لم تبطل التوبة الاولي وانه ان تاب من بعض الذنوب دون بعض فهي صحيحة علي احد القولين فيها ,False,1111Majlisi.BiharAnwar
240518382574,4,Shamela0009091-ara1.mARkdown.ms0688,ولما كان منتصف شهر رمضان سنة ثمان وخمسين وثلاث ماءة وصلت البشارة بفتح الديار المصرية ودخول عساكره اليها وانتظام الحال بمصر والشام والحجاز واقامة الدعوة له بهذه المواضع فسر بذلك سرورا عظيما واستخلف علي افريقية وخرج متوجها الي ديار مصر باموال جليلة المقدار ورجاء عظيمة الاخطار فدخل الاسكندرية لست بقين من شعبان من سنة اثنتين وستين وثلاثماءة وركب فيها ودخل الحمام وقدم عليه قاضي مصر ابو طاهر واعيان اهل البلاد وسلموا عليه وجلس لهم عند المنارة وخاطبهم بخطاب طويل يخبرهم انه لم يرد فيه بدخول مصر لزيادة مملكته وللمال وانما اراد اقامة الحج والجهاد وان يختم عمره بالاعمال الصالحة ويعمل بما امره به جده صلي الله عليه واله وسلم ووعظهم حتي بكي بعض الحاضرين وخلع علي القاضي وبعض الجماعة وحملهم ثم ودعوه وانصرفوا ورحل منها في اواخر شعبان ونزل يوم السبت ثاني شهر رمضان سنة اثنتين وستين وثلاثماءة علي جزيرة ساحل مصر فخرج اليه القاءد جوهر وترجل عند لقاءه وقبل الارض بين يديه واقام هناك ثلاثة ايام ثم رحل ودخل القاهرة ولم يدخل مصر وكانت قد زينت له وظنوا انه يدخلها واهل القاهرة لم يستعدوا للقاءه لظنهم انه يدخل مصر او لا يدخلها ولما دخل القاهرة دخل القصر ثم دخل مجلسا منه وخر ,False,0768Yafici.MiratJinan
240518382574,4,Sham19Y0029560-ara1.ms0929,رمضان سنة ثمان وخمسين بفتح الديار المصرية ودخول عساكره اليها وانتظام الحال بمصر والشام والحجاز واقامة الدعوة له بهذه المواضع فسر بذلك سرورا عظيما واستخلف علي افريقية وخرج متوجها الي ديار مصر باموال جمة جليلة المقدار ورجال عظيمة الاخطار فدخل الاسكندرية لست بقين من شعبان سنة اثنتين وستين وركب فيها ودخل الحمام وقدم عليه قاضي مصر ابو طاهر واعيان اهل البلاد وسلموا عليه وجلس لهم عند المنارة وخاطبهم بخطاب طويل ذكر فيه انه لم يرد دخول مصر لزيادة في ملكه ولا لمال وانما اراد اقامة الحج والجهاد وان يختم عمره بالاعمال الصالحة ويعمل بما امر به جده صلي الله عليه وسلم ووعظهم حتي بكي بعض الحاضرين وخلع علي القاضي وبعض الجماعة ثم ودعوه وانصرفوا ورحل عنها في اخر شعبان فنزل يوم السبت ثاني شهر رمضان علي جزيرة ساحل مصر بالجيزة فخرج اليه القاءد جوهر وترجل عند لقاءه وقبل الارض بين يديه واقام هنالك ثلاثة ايام ثم رحل ودخل القاهرة ولم يدخل مصر وكانت قد زينت له وظنوا انه يدخلها واهل القاهرة لم يستعدوا للقاءه لظنهم انه يدخل مصر اولا ولما دخل القاهرة ودخل القصر ثم دخل مجلسا فيه خر ,False,0947BamakhramaHimyari.QiladatNahr
240518382574,4,Shamela0012398-ara1.completed.ms0758,ولما كان منتصف رمضان سنة ثمان وخمسين وثلاثماءة وصلت البشارة الي المعز بفتح الديار المصرية ودخول عساكره اليها وكانت كتب جوهر ترد الي المعز باستدعاءه الي مصر ويحثه كل وقت علي ذلك ثم سير اليه يخبره بانتظام الحال بمصر والشام والحجاز واقامة الدعوة له بهذه المواضع فسر بذلك سرورا عظيما ثم استخلف علي افريقية بلكين بن زيري الصنهاجي وخرج متوجها اليها باموال جليلة المقدار ورجال عظيمة الاخطار وكان خروجه من المنصورية دار ملكه يوم الاثنين ثاني عشري شوال سنة اثنتين وستين وثلاثماءة ولم يزل في طريقه يقيم بعض الاوقات في بعض البلاد اياما ويجد السير في بعضها وكان اجتيازه علي برقة ودخل الاسكندرية رابع عشري شعبان من السنة المذكورة وركب فيها ودخل الحمام وقدم عليه بها قاضي مصر ابو طاهر محمد بن احمد واعيان اهل البلاد وسلموا عليه وجلس لهم عند المنارة واخبرهم انه لم يرد دخول مصر لزيادة في ملكه ولا لمال وانما اراد اقامة الحق والجهاد والحج وان يختم عمره بالاعمال الصالحة ويعمل بما امر به جده صلي الله عليه وسلم ووعظهم واطال حتي بكي بعض الحاضرين وخلع علي القاضي وجماعة وودعوه وانصرفوا ثم رحل منها في اواخر شعبان ونزل يوم السبت ثاني رمضان علي ساحل مصر بالجيزة فخرج اليه القاءد جوهر وترجل عند لقاءه وقبل الارض بين يديه واجتمع به بالجيزة ايضا الوزير ابو الفضل جعفر بن الفرات واقام المعز هناك ثلاثة ايام واخذ العسكر في التعدية باثقالهم الي ساحل مصر ولما كان يوم الثلاثاء خامس رمضان عبر المعز النيل ودخل القاهرة ولم يدخل مصر وكانت قد زينت له وظنوا انه يدخلها واهل القاهرة لم يستدعوا للقاءه لانهم بنوا الامر علي دخوله مصر اولا ولما دخل القاهرة ودخل القصر ودخل مجلسا فيه خر ,False,1089IbnCimad.Shadharat
240518382574,4,Sham19Y0017048-ara1.ms0259,عليهم ثم صارت كتبه ترد الي المعز باستدعاءه الي مصر ثم اخبره بانتظام الحال بمصر والشام والحجاز واقامة الدعوة له بهذه المواضع فسر المعز بذلك سرورا عظيما ولما تقررت قواعده بالديار المصرية استخلف علي افريقية بلكين بن زيري بن مناد الصنهاجي وخرج المعز متوجها الي مصر باموال جليلة المقدار ورجال عظيمة الاخطار وكان خروجه من المنصورية دار ملكه اذ ذاك يوم الاثنين لثمان بقين من شوال سنة احدي وستين وثلاثماءة ولم يزل في طريقه يقيم بعض الاوقات في بعض البلاد اياما ويجد السير في بعضها وكان اجتيازه علي برقة ودخل الاسكندرية لست بقين من شعبان فدخل الحمام وقدم عليه بها قاضي مصر ابو طاهر محمد بن احمد واعيان اهل البلاد وسلموا عليه وجلس لهم عند المنارة وخاطبهم بخطاب طويل يخبرهم فيه انه لم يرد دخول مصر زيادة في ملكه ولا لمال وانما اراد اقامة الحق والحج والجهاد وان يختم عمره بالاعمال الصالحة ويعمل بما امره به جده صلي الله عليه وسلم ووعظهم واطال حتي بكي بعض الحاضرين وخلع علي القاضي وبعض الجماعة وحملهم وودعوه وانصرفوا ثم رحل من الاسكندرية اواخر شعبان ونزل يوم السبت ثاني شهر رمضان بالجيزة بساحل النيل مقابل مصر فخرج اليه القاءد جوهر وترجل عند لقاءه وقبل الارض بين يديه وبالجيزة اجتمع به الوزير ابو الفضل جعفر بن الفرات واقام المعز هناك ثلاثة ايام واخذ العسكر في التعدية باثقالهم الي ساحل مصر العتيق وكانت قد زينت له وظنوا انه يدخلها واهل ,False,1228MahmudMaqdishSafaqsi.NuzhatAnzar
240518382576,2,Sham19Y0127698-ara1.ms236,رمضان سنة ثمان وخمسين وثلاث مءة وصلت البشارة الي المعز بفتح الديار المصرية ودخول عساكره اليها ثم وصلت النجب بعد ذلك بصورة الفتح وكانت كتب جوهر تتردد الي المغرب باستدعاءه الي مصر وتحث المعز علي ذلك ثم ارسل اليه يخبره بانتظام الحال بمصر والشام والحجاز واقامة الدعوي له بهذه المواضع فسر المعز بذلك سرورا عظيما ولما ثبت قواعده بالديار المصرية استخلف علي افريقية بكتكين الصماخي وخرج المعز متوجها اليها باموال جليلة المقدار ورجال عظيمة الاخطار وكان خروجه من المنصورية دار ملكه لثمان بقين من شوال سنة احدي وستين وثلاث مءة وانتقل الي سودانية واقام بها ليجمع رجاله واتباعه ومن يستصحبه معه وفي هذه المنزلة عقد العهد لبكتكين ورحل عنها يوم الخميس خامس صفر سنة اثنتين وستين وثلاث مءة ولم يزل في طريقه يقيم بعض الاوقات في بعض البلاد اياما ويجد المسير في بعضها ودخل الاسكندرية لست بقين من شعبان من السنة وركب فيها ودخل الحمام وقدم عليه قاضي مصر وهو ابو طاهر محمد بن احمد واعيان اهل البلاد وسلموا وجلس لهم وخاطبهم خطابا طويلا يخبرهم فيه انه لم يرد دخول مصر لزيادة في ملكه ولا مال وانما اراد اقامة الحق والحج والجهاد وان يختم عمره بالاعمال الصالحة ويعمل ما امره به جده رسول الله صلي الله عليه وسلم ووعظهم واطال حتي بكي بعض الحاضرين وخلع علي القاضي وبعض الجماعة وودعوه وانصرفوا ثم رحل منها ,False,0928MujirDinCulaymi.TarikhMuctabar
240518382576,2,Sham19Y0029560-ara1.ms0929,رمضان سنة ثمان وخمسين بفتح الديار المصرية ودخول عساكره اليها وانتظام الحال بمصر والشام والحجاز واقامة الدعوة له بهذه المواضع فسر بذلك سرورا عظيما واستخلف علي افريقية وخرج متوجها الي ديار مصر باموال جمة جليلة المقدار ورجال عظيمة الاخطار فدخل الاسكندرية لست بقين من شعبان سنة اثنتين وستين وركب فيها ودخل الحمام وقدم عليه قاضي مصر ابو طاهر واعيان اهل البلاد وسلموا عليه وجلس لهم عند المنارة وخاطبهم بخطاب طويل ذكر فيه انه لم يرد دخول مصر لزيادة في ملكه ولا لمال وانما اراد اقامة الحج والجهاد وان يختم عمره بالاعمال الصالحة ويعمل بما امر به جده صلي الله عليه وسلم ووعظهم حتي بكي بعض الحاضرين وخلع علي القاضي وبعض الجماعة ثم ودعوه وانصرفوا ورحل عنها ,False,0947BamakhramaHimyari.QiladatNahr
