cluster,size,id,text,from_input,book
161829,7,Tafsir02091-ara1.ms2136,وعن ابي هريرة رضي الله عنه قال قال رسول الله صلي الله عليه وسلم لا يدخل الجنة ولد الزنا ولا ولده ولا ولد ولده وان اولاد الزناة يحشرون في يوم القيامة في صورة القردة والخنازير وقال صلي الله عليه وسلم لا تزال امتي بخير ما لم يفش فيهم ولد الزني فان فشا فيهم ولد الزنا فيوشك ان يعمهم الله بعقاب وقال عكرمة اذا كثر اولاد الزنا قل المطر ,False,0360Tabarani.TafsirKabir
161829,7,Shia002616Vols-ara1.ms6316,وعن علي رضي الله تعالي عنه انه الذي لا اصل له والمعني واحد وروي ان النبي صلي الله عليه وسلم قال لا يدخل الجنة ولد زني ولا ولده ولا ولد ولده وقال عبد الله بن عمر ان النبي صلي الله عليه وسلم قال ان اولاد الزني يحشرون يوم القيامة في صورة القردة والخنازير وقالت ميمونة سمعت النبي صلي الله عليه وسلم يقول لا تزال امتي بخير ما لم يفش فيهم ولد الزني فاذا فشا فيهم ولد الزني او شك ان يعمهم الله بعقاب وقال عكرمة اذا كثر ولد الزني قحط المطر قلت اما ,False,0671AbuCabdAllahQurtubi.JamicLiAhkamQuran
161829,7,JK009266-ara1.ms8962,خبثت خبث الولد كا روي ان النبي صلي الله عليه وسلم قال لا يدخل الجنة ولد زنا ولا ولد ولده وقال عبد الله بن عمر ان النبي صلي الله عليه وسلم قال ان اولاد الزنا يحشرون يوم القيامة في صورة القردة والخنازير وقالت ميمونة سمعت النبي صلي الله عليه وسلم يقول لا تزال امتي بخير ما لم يفش فيهم ولد الزنا فاذا فشي فيهم ولد الزنا اوشك ان يعمهم الله بعذاب وقال عكرمة اذا كثر ولد الزنا قحط المطر قال ,False,0800IbnCadilHanbali.LubabFiCulumKitab
161829,7,ShamAY0034068-ara2.ms3838,خبث الولد كما روي ان النبي صلي الله عليه وسلم قال لا يدخل الجنة ولد زنا ولا ولده ولا ولد ولده وقال عبد الله بن عمر ان النبي صلي الله عليه وسلم قال ان اولاد الزنا يحشرون يوم القيامة في صور القردة والخنازير ولعل المراد به الدخول مع السابقين والا فمن مات مسلما دخل الجنة وقالت ميمونة سمعت النبي صلي الله عليه وسلم يقول لا تزال امتي بخير ما لم يفش فيهم ولد الزنا فاذا فشي فيهم ولد الزنا اوشك ان يعمهم الله بعذابه وقال عكرمة اذا كثر ولد الزنا قحط المطر قال ,False,0977KhatibShirbini.SirajMunir
161829,7,ShamAY0034059-ara1.ms7413,ان النطفة اذا خبثت خبث الولد الناشء منها ومن ثمة قال رسول الله عليه السلام لا يدخل الجنة ولد الزني ولا ولده ولا ولد ولده كما في الكشاف وفي الحديث لا تزال امتي بخير ما لم يفش فيهم ولد الزني فاذا فشا فيهم ولد الزني او السكران يعمهم الله بعذابه وفي حديث اخر ولد الزني ,False,1127IsmacilHaqqiBurusawi.RuhBayan
161829,7,Tafsir02096-ara1.ms2113,ان النطفة اذا خبثت خبث الولد لما ورد في الحديث لا يدخل الجنة ولد زنا ولا ولده ولا ولا ولده وورد ان اولاد الزنا يحشرون يوم القيامة في صورة القردة والخنازير وورد لا تزال امتي بخير ما لم يفش فيهم ولد الزنا فاذا فشا فيهم ولد الزنا اوشك ان يعمهم الله بعذابه وقال عكرمة اذا كثر ولد الزنا قحط المطر قوله من ,False,1241IbnMuhammadKhalwatiSawi.HashiyaCalaTafsirJalalayn
171240,5,Shamela0013027-ara1.ms106,الله بن زحر عن القاسم عن ابي امامة قال بينما عمر جالس في اصحابه اذ اتي بقميص له كرابيس فلبسه فما جاوز بتراقيه حتي قال الحمد لله الذي كساني ما اواري ص به عورتي واتجمل به في حياتي ثم اقبل علي القوم فقال هل تدرون لم قلت هءلاء الكلمات قالوا لا الا ان تخبرنا قال فاني شهدت رسول الله صلي الله عليه وسلم ذات يوم اتي بثياب له جدد فلبسها ثم قال كما ذكرت لكم ثم قال والذي بعثني بالحق ما من عبد مسلم كساه الله ثيابا جددا فعمد الي سمل من اخلاق ثيابه فكساها عبدا مسلما لا يكسوه الا كان في حرز الله وفي جوار الله وفي ضمان الله ما كان عليه منها سلك حيا وميتا حيا وميتا قال ثم مد عمر كم قميصه فابصر فيه فضلا عن اصابعه فقال لعبد الله بن عمر اي بني هات الشفرة او المدية فقام فجاء بها فمد كم قميصه علي يده فنظر ما فضل عن اصابعه فقده ,False,0243HannadIbnSari.Zuhd
171240,5,Shamela0012062-ara1.ms244,ابي امامة قال بينا عمر رضي الله عنه في اصحابه اذ اتي بقيمص له ا كرابيس فلبسه فما جاوز تراقيه حتي قال الحمد لله الذي كساني ما اواري به عورتي واتجمل به في حياتي ثم اقبل علي القوم فقال هل تدرون لم قلت هءلاء الكلمات قالوا لا الا ان تخبرنا قال فاني شهدت رسول الله صلي الله عليه وسلم ذات يوم وقد اتي بثياب له جدد فلبسها ثم قال الحمد لله الذي كساني ما اواري عورتي واتجمل به في حياتي ثم قال والذي بعثني بالحق ما من عبد مسلم كساه الله ثيابا جددا فعمد الي شء من اخلاق ثيابه وكساه عبدا مسلما مسكينا لا يكسوه الا لله عزوجل الا كان في جوار الله وفي ضمان الله ما كان عليه منها سلك حيا وميتا حيا وميتا قال ثم مد عمر كم قميصه فوجد فيه فضلا عن اصابعه فقال لعبد الله بن عمر اي بني هات الشفرة او المدية فقام فجاء بها فمد عمر كم قميصه فنظر ما فضل عن اصابعه فقده قال ابو امامة قلنا يا امير المءمنين الا ناتي بخياط فيكف هدبه قال لا قال ابو امامة فلقد رايت عمر بعد ذلك وان هدب ذلك القميص لمنتشر علي اصابعه ,False,0909IbnCabdHadi.MahdSawab
171240,5,Shia002265Vols-ara1.ms5078,الله عليه وسلم ش ت في الشماءل عن ابي امامة قال بينما عمر بن الخطاب في اصحابه بقميص كرابيس فلبسه فما جاوز تراقيه حتي قال الحمد لله الذي كساني ما اواري به عورتي واتجمل به في حياتي ثم اقبل علي القوم فقال هل تدرون لم قلت هءلاء الكلمات قالوا لا الا ان تخبرنا قال فاني شهدت رسول الله صلي الله عليه وسلم ذات يوم واني بثياب له جدد فلبسها ثم قال الحمد لله الذي كساني ما اواري به عورتي واتجمل به في حياتي ثم قال والذي بعثني بالحق ما من عبد مسلم كساه الله ثيابا جددا فعمد الي سمل من اخلاق ثيابه فكساه عبدا مسلما مسكينا لا يكسوه الا لله كان في حرز الله وفي جوار الله وفي ضمان الله ما كان عليه منها سلك حيا وميتا قال ثم مد قميصه فابصر فيه فضلا عن اصابعه فقال لعبد الله اي بني هات الشفرة فقام فجاء بها فمدكم قميصه علي يده فنظر ما فضل عن اصابعه فقده قلنا يا امير المءمنين الا ناتي بخياط فيكف هذه قال لا قال ابو امامة ولقد رايت عمر بعد ذلك وان هدب ذلك القميص منتشرة علي اصابعه ما يكفه هناد ,False,0975MuttaqiHindi.KanzCummal
171240,5,JK009390-ara1.completed.ms4586,عن ابي امامة قال بينما عمر بن الخطاب رضي الله عنه في اصحابه بقميص كرابيس فلبسه فما جاوز تراقيه حتي قال الحمد لله الذي كساني ما اواري به عورتي واتجمل به في حياتي ثم اقبل علاي القوم فقال هل تدرون لم قلت هاءلاء الكلمات قالوا لا الا ان تخبرنا قال فاني شهدت رسول الله ذات يوم واتي بثياب له جدد فلبسها ثم قال الحمد لله الذي كساني ما اواري به عورتي واتجمل به في حياتي ثم قال والذي بعثني بالحق ما من عبد مسلم كساه الله ثيابا جددا فعمد الاي سمل من اخلاق ثيابه فكساه عبدا مسلما مسكينا لا يكسوه الا لله كان في حرز الله وفي جوار الله وفي ضمان الله ما كان منها سلك حيا وميتا قال ثم مد قميصه فابصر فيه فضلا عن اصابعه فقال لعبد الله اي بني هات الشفرة فقام فجاء بها فمد كم قميصه علاي يده فنظر ما فضل عن اصابعه فقده قلنا يا امير المءمنين الا ناتي بخياط فيكف هاذه قال لا قال ابو ,False,1423CabbasAhmadSaqr.JamicAhadith
171240,5,Shamela0001438-ara1.completed.ms4919,عن ابي امامة قال بينما عمر بن الخطاب في اصحابه بقميص كرابيس فلبسه فما جاوز تراقيه حتي قال الحمد لله الذي كساني ما اواري به عورتي واتجمل به في حياتي ثم اقبل علي القوم فقال هل تدرون لم قلت هءلاء الكلمات قالوا لا الا ان تخبرنا قال فاني شهدت رسول الله صلي الله عليه وسلم ذات يوم واني بثياب له جدد فلبسها ثم قال الحمد لله الذي كساني ما اواري به عورتي واتجمل به في حياتي ثم قال والذي بعثني بالحق ما من عبد مسلم كساه الله ثيابا جددا فعمد الي سمل من اخلاق ثيابه فكساه عبدا مسلما مسكينا لا يكسوه الا لله كان في حرز الله وفي جوار الله وفي ضمان الله ما كان عليه منها سلك حيا وميتا قال ثم مد قميصه فابصر فيه فضلا عن اصابعه فقال لعبد الله اي بني هات الشفرة فقام فجاء بها فمد كم قميصه علي يده فنظر ما فضل عن اصابعه فقده قلنا يا امير المءمنين الا ناتي بخياط فيكف هذه قال لا قال ابو امامة ولقد رايت عمر بعد ذلك وان هدب ذلك القميص منتشرة علي اصابعه ما يكفه هناد ,False,1450DarIftaMisriyya.JamicAhadith
171245,6,Shamela0013027-ara1.ms106,اخلاق ثيابه فكساها عبدا مسلما لا يكسوه الا كان في حرز الله وفي جوار الله وفي ضمان الله ما كان عليه منها سلك حيا وميتا حيا وميتا قال ثم مد عمر كم قميصه فابصر فيه فضلا عن اصابعه فقال لعبد الله بن عمر اي بني هات الشفرة او المدية فقام فجاء بها فمد كم قميصه علي يده فنظر ما فضل عن اصابعه فقده ,False,0243HannadIbnSari.Zuhd
171245,6,Shamela0012062-ara1.ms244,اخلاق ثيابه وكساه عبدا مسلما مسكينا لا يكسوه الا لله عزوجل الا كان في جوار الله وفي ضمان الله ما كان عليه منها سلك حيا وميتا حيا وميتا قال ثم مد عمر كم قميصه فوجد فيه فضلا عن اصابعه فقال لعبد الله بن عمر اي بني هات الشفرة او المدية فقام فجاء بها فمد عمر كم قميصه فنظر ما فضل عن اصابعه فقده قال ابو امامة قلنا يا امير المءمنين الا ناتي بخياط فيكف هدبه قال لا قال ابو امامة فلقد رايت عمر بعد ذلك وان هدب ذلك القميص لمنتشر علي اصابعه ,False,0909IbnCabdHadi.MahdSawab
171245,6,Sham19Y0127677-ara1.ms03518,اخلاق ثيابه فكساه عبدا مسلما مسكينا لا يكسوه الا لله الا كان في حرز الله وفي جوار الله وفي ضمان الله ما كان عليه منها سلك حيا وميتا قال ثم مدكم قميصه فابصر فيه فضلا عن اصابعه فقال لعبد الله اي بني هات الشفرة فقام فجاء بها فمدكم قميصه علي يده فنظر ما فضل عن اصابعه فقده قلنا يا امير المءمنين الا ناتي بخياط تكف هذه قال لا قال ابو امامة ولقد رايت عمر بعد ذلك وان هدب ذلك القميص منتشرة علي اصابعه ما يكفه هناد عن ,False,0911Suyuti.JamicKabir
171245,6,Shia002265Vols-ara1.ms5078,اخلاق ثيابه فكساه عبدا مسلما مسكينا لا يكسوه الا لله كان في حرز الله وفي جوار الله وفي ضمان الله ما كان عليه منها سلك حيا وميتا قال ثم مد قميصه فابصر فيه فضلا عن اصابعه فقال لعبد الله اي بني هات الشفرة فقام فجاء بها فمدكم قميصه علي يده فنظر ما فضل عن اصابعه فقده قلنا يا امير المءمنين الا ناتي بخياط فيكف هذه قال لا قال ابو امامة ولقد رايت عمر بعد ذلك وان هدب ذلك القميص منتشرة علي اصابعه ما يكفه هناد عن ,False,0975MuttaqiHindi.KanzCummal
171245,6,JK009390-ara1.completed.ms4586,اخلاق ثيابه فكساه عبدا مسلما مسكينا لا يكسوه الا لله كان في حرز الله وفي جوار الله وفي ضمان الله ما كان منها سلك حيا وميتا قال ثم مد قميصه فابصر فيه فضلا عن اصابعه فقال لعبد الله اي بني هات الشفرة فقام فجاء بها فمد كم قميصه علاي يده فنظر ما فضل عن اصابعه فقده قلنا يا امير المءمنين الا ناتي بخياط فيكف هاذه قال لا قال ابو ,False,1423CabbasAhmadSaqr.JamicAhadith
171245,6,Shamela0001438-ara1.completed.ms4919,اخلاق ثيابه فكساه عبدا مسلما مسكينا لا يكسوه الا لله كان في حرز الله وفي جوار الله وفي ضمان الله ما كان عليه منها سلك حيا وميتا قال ثم مد قميصه فابصر فيه فضلا عن اصابعه فقال لعبد الله اي بني هات الشفرة فقام فجاء بها فمد كم قميصه علي يده فنظر ما فضل عن اصابعه فقده قلنا يا امير المءمنين الا ناتي بخياط فيكف هذه قال لا قال ابو امامة ولقد رايت عمر بعد ذلك وان هدب ذلك القميص منتشرة علي اصابعه ما يكفه هناد ,False,1450DarIftaMisriyya.JamicAhadith
171249,7,Shamela0013027-ara1.ms106,كم قميصه فابصر فيه فضلا عن اصابعه فقال لعبد الله بن عمر اي بني هات الشفرة او المدية فقام فجاء بها فمد كم قميصه علي يده فنظر ما فضل عن اصابعه ,False,0243HannadIbnSari.Zuhd
171249,7,Sham19Y0016555-ara2.ms100,مد كم قميصه فابصر فيه فضلا عن اصابعه فقال لعبد الله بن عمر اي بني هات الشفرة او المدية فقام فجاء بها فمد كم قميصه علي يده فنظر ما فضل عن اصابعه ,False,0774IbnKathir.MusnadCumarIbnKhattab
171249,7,Shamela0012062-ara1.ms244,كم قميصه فوجد فيه فضلا عن اصابعه فقال لعبد الله بن عمر اي بني هات الشفرة او المدية فقام فجاء بها فمد عمر كم قميصه فنظر ما فضل عن اصابعه ,False,0909IbnCabdHadi.MahdSawab
171249,7,Sham19Y0127677-ara1.ms03518,مدكم قميصه فابصر فيه فضلا عن اصابعه فقال لعبد الله اي بني هات الشفرة فقام فجاء بها فمدكم قميصه علي يده فنظر ما فضل عن اصابعه ,False,0911Suyuti.JamicKabir
171249,7,Shia002265Vols-ara1.ms5078,قميصه فابصر فيه فضلا عن اصابعه فقال لعبد الله اي بني هات الشفرة فقام فجاء بها فمدكم قميصه علي يده فنظر ما فضل عن اصابعه ,False,0975MuttaqiHindi.KanzCummal
171249,7,JK009390-ara1.completed.ms4586,قميصه فابصر فيه فضلا عن اصابعه فقال لعبد الله اي بني هات الشفرة فقام فجاء بها فمد كم قميصه علاي يده فنظر ما فضل عن اصابعه ,False,1423CabbasAhmadSaqr.JamicAhadith
171249,7,Shamela0001438-ara1.completed.ms4919,قميصه فابصر فيه فضلا عن اصابعه فقال لعبد الله اي بني هات الشفرة فقام فجاء بها فمد كم قميصه علي يده فنظر ما فضل عن اصابعه ,False,1450DarIftaMisriyya.JamicAhadith
174107,8,ShamAY0034066-ara1.ms0999,الست تزعم انك بعثت رحمة للعالمين قال بلي قال قد قتلت الاباء بالسيف والابناء بالجوع وقد اكلنا العلهز فنزلت الاية واستكانوا معناه تواضعوا وانخفضوا وقوله سبحانه حتي اذا فتحنا عليهم بابا ذا عذاب شديد الاية توعد بعذاب غير معين وهذا هو الصواب وهذه المجاعة انما كانت بعد وقعة بدر والملبس الذي قد نزل به شر ويءس من زواله ونسخه بخير ثم ابتدا تعالي بتعديد نعم في نفس تعديدها استدلال بها علي عظم قدرته سبحانه فقال وهو الذي انشا لكم السمع والابصار الاية انشا بمعني اخترع والافءدة ,False,0429AbuMansurThacalibi.Jawahir
174107,8,Shia002341Vols-ara1.ms2841,انا اخذنا هءلاء الكفار الذين ذكرناهم بالعذاب وقيل هو الجدب وضيق الرزق والقتل بالسيف فما استكانوا لربهم اي لم يذلوا عند هذه الشداءد ولم يتضرعوا اليه فيطلبوا كشف البلاء منه تعالي عنهم بالاستكانة له والاستكانة طلب السكون خوفا من السطوة يقال استكان الرجل استكانة اذا ذل عند الشدة وقوله حتي اذا فتحنا عليهم بابا ذا عذاب شديد اذا هم فيه مبلسون فالفتح فرج الباب بطريق يمكن السلوك فيه فكانه فتح عليهم بابا اتاهم منه العذاب وقيل ان ذلك حين دعا النبي صلي الله عليه واله فقال اللهم سنين كسني يوسف فجاعوا حتي اكلوا العلهز وهو الوبر بالدم في قول مجاهد وقال ابن عباس هو القتل يوم بدر وقال الجباءي فتحنا عليهم بابا من عذاب جهنم في الاخرة ,False,0460ShaykhTusi.Tibyan
174107,8,Shia002359Vols-ara1.ms3036,ولقد اخذناهم بالعذاب معناه انا قد اخذنا هءلاء الكفار بالجدب وضيق الرزق والقتل بالسيف فما استكانوا لربهم اي ما تواضعوا ولا انقادوا وما يتضرعون اي وما يرغبون الي الله في الدعاء وقال ابو عبد الله عليه السلام الاستكانة الدعاء والتضرع رفع اليد في الصلاة حتي اذا فتحنا عليهم بابا ذا عذاب شديد اي هذا دابهم حتي اذا فتحنا عليهم نوعا اخر من العذاب وذاك حين دعا النبي صلي الله عليه واله وسلم عليهم فقال اللهم سنين كسني يوسف فجاعوا حتي اكلوا العلهر وهو الوبر بالدم عن مجاهد وقيل هو القتل يوم بدر عن ابن عباس وقيل فتحنا عليهم بابا من عذاب جهنم في الاخرة ,False,0548IbnHasanTabarsi.TafsirMajmacBayan
174107,8,Shamela0023628-ara1.completed.ms2558,هذه الاية فما استكانوا لربهم ما خضعوا وما ذلوا لربهم وما يتضرعون اي لم يتضرعوا الي ربهم بل مضوا علي تمردهم حتي اذا فتحنا عليهم بابا ذا عذاب شديد قال ابن عباس يعني القتل يوم بدر وقيل هو الموت وقيل هو قيام الساعة اذا هم فيه مبلسون اي ايسون من كل خير قوله عز وجل وهو الذي انشا لكم السمع والابصار والافءدة اي ,False,0741KhazinBaghdadi.LubabTawil
174107,8,Zaydiyya0000274-ara1.ms308,ابو سفيان الي رسول الله صلي الله عليه واله وسلم فقال انشدك الله والرحم الست تزعم انك بعثت رحمة للعالمين فقال بلي فقال قتلت الاباء بالسيف والابناء بالجوع وثمرة ذلك جواز منع الميرة من الكفار وان كان فيهم الصغار والنساء وقد حاصر رسول الله صلي الله عليه واله وسلم اهل الطاءف ونصب عليهم المنجنيقات وهذا اجماع انه يفعل بهم ما يءدي الي استءصالهم واما البغاة فلا يمنعون الميرة لانه صلي الله عليه واله وسلم نهي ان يمنع اهل القبلة الميرة قال الناصر والاخوان هذا اذا لم يتقووا بها علي المسلمين فان حصل ذلك بالميرة منعوا منها وقد دعا صلي الله عليه واله وسلم علي قريش بالقحط فقال اللهم اجعلها عليهم سنين كسني يوسف ,False,0836FaqihYusuf.ThamaratYanica
174107,8,Shia002380Vols-ara1.ms0532,واله فقال انشدك الله والرحم الست تزعم انك بعثت رحمة للعالمين قتلت الاباء بالسيف والابناء بالجوع فنزلت ولقد اخذناهم بالعذاب القمي هو الجوع والخوف والقتل فما استكانوا لربهم وما يتضرعون بل اقاموا علي عتوهم قال الاستكانة هي الخضوع والتضرع رفع اليدين والتضرع بهما وفي رواية الاستكانة الدعاء والتضرع رفع اليدين في الصلاة حتي اذا فتحنا عليهم بابا ذا عذاب شديد قال وذلك حين دعا النبي صلي الله عليه واله عليه واله عليهم فقال اللهم اجعلها عليهم سنين كسني يوسف فجاعوا حتي اكلوا العلهز وهو الوبر بالدم وفي رواية هو في الرجعة اذا هم فيه مبلسون متحيرون ايسون من كل خير وهو الذي انشا لكم السمع والابصار لتحسوا بها ما نصب من الايات والافءدة ,False,1091MuhammadMuhsinFaydKashani.TafsirAsfa
