cluster,size,id,text,from_input,book
352187445452,3,Sham19Y0020891-ara1.ms6098,لو اسقطناه عليهم لقالوا هذا سحاب مركوم بعضه فوق بعض يمطرنا ولم يصدقوا انه كسف ساقط للعذاب وقرء حتي يلاقوا و يلقوا يصعقون يموتون وقرء يصعقون يقال صعقه فصعق وذلك عند النفخة الاولي نفخة الصعق وان للذين ظلموا وان لهءلاء الظلمة عذابا دون ,False,0743SharafDinTibi.FutuhGhayb
352187445452,3,ShamAY0034052-ara1.ms2244,لو اسقطناه عليهم لقالوا هذا سحاب مركوم بعضه فوق بعض يمطرنا ولم يصدقوا انه كسف ساقط للعذاب وقرء حتي يلقوا ويلقوا يصعقون يموتون وقرء يصعقون يقال صعقه فصعق وذلك عند النفخة الاولي نفخة الصعق وان للذين ظلموا وان لهءلاء الظلمة عذابا دون ,False,0538JarAllahZamakhshari.Kashshaf
352187445452,3,Shamela0001394-ara1.ms1614,ولم يصدقوا انه كسف ساقط للعذاب فذرهم حتي يلاقوا يومهم الذي فيه يصعقون فذرهم حتي يلاقوا يومهم الذي فيه يصعقون بضم الياء عاصم وشامي الباقون بفتح الياء يقال صقعة فصعق وذلك عند النفخة الاولي نفخة الصعق يوم لا يغني عنهم كيدهم شيءا ولا هم ينصرون يوم لا يغني عنهم كيدهم شيءا ولا هم ينصرون وان للذين ظلموا عذابا دون ذلك ولكن اكثرهم لا يعلمون وان للذين ظلموا وان لءلاء الظلمة عذابا دون ,False,0710IbnAhmadHafizDinNasafi.Tafsir
360777291241,3,Shamela0012062-ara1.ms291,الحسن قال مر عمر رضي الله عنه علي مزبلة فاحتبس عندها فكان اصحابه تاذوا بها فقال هذه دنياكم التي تحرصون عليها ,False,0909IbnCabdHadi.MahdSawab
360777291241,3,Sham19Y0127677-ara1.ms16755,الحسن قال مر عمر رضي الله عنه علي مزبلة فاحتبس عندها فكان اصحابه تاذوا بها فقال هذه دنياكم التي تحرصون عليها ,False,0911Suyuti.JamicKabir
360777291241,3,JK000022-ara1.completed.ms0047,الحسن قال مر عمر رضي الله تعالي عنه علي مزبلة فاحتبس عندها فكان اصحابه تاذوا بها فقال هذه دنياكم التي تحرصون عليها ,False,0430AbuNucaymIsbahani.HilyatAwliya
360777323919,3,Shamela0035100-ara1.mARkdown.ms02686,وماءة ابو عبيد الله وزير المهدي وكاتبه اسمه معاوية بن عبيد الله بن يسار الاشعري مولاهم الوفاة ه روي عن ابي اسحاق السبيعي ومنصور بن المعتمر وعنه منصور بن ابي مزاحم وغيره اصله من طبرية وكان ذا دين وتعبد من خيار الوزراء وكان المهدي يعظمه ولا يخالفه في راي قال حفيده عبيد الله بن سليمان بن ابي عبيد الله ابلي ابو عبيد الله سجادتين واسرع في الثالث موضع الركبتين والوجه واليدين من كثرة صلاته وكان له في كل يوم كر دقيق يتصدق به فلما اشتد الغلاء ,False,0748Dhahabi.TarikhIslam
360777323919,3,Shamela0010906-ara1.mARkdown.ms2860,وماءة ابو عبيد الله الوزير معاوية بن عبيد الله بن يسار الاشعري مولاهم الطبراني الشامي الكاتب احد رجال الكمال حزما ورايا وعبادة وخيرا روي عن ابي اسحاق ومنصور وطاءفة حدث عنه منصور بن ابي مزاحم وغيره وكان المهدي يبالغ في اجلاله واحترامه ويعتمد علي رايه وتدبيره وحسن سياسته قال حفيده عبيد الله بن سليمان ابلي جدنا سجادتين وشرع في ثالثة موضع ركبتيه ووجهه ويديه من كثرة صلاته رحمه الله وكان له كل يوم كر دقيق يتصدق به فلما وقع الغلاء ,False,0748Dhahabi.SiyarAclamNubala
360777323919,3,JK000916-ara1.mARkdown.ms23412,معاوية بن عبيد الله بن يسار ابو عبيد الله الاشعري مولاهم كان كاتب امير المءمنين المهدي ووزيره واليه تنسب مربعة ابي عبيد الله بالجانب الشرقي وكان قد كتب الحديث وطلب العلم وسمع ابا اسحاق السبيعي ومنصور بن المعتمر ونحوهما روي عنه منصور بن ابي مزاحم وكان خيرا فاضلا عابدا وهو من اهل طبرية وكان يكتب للمهدي قبل الخلافة وامره كله اليه رسمه المنصور بذلك وكان المهدي يعظمه ولا يخالفه في شء يشير به عليه ذكر الصولي عن علي بن سراج نا معاوية بن صالح قال ولد ابو عبيد الله ,False,0571IbnCasakir.TarikhDimashq
360777429784,3,JK000458-ara1.ms3264,بن عوف واقام بها يوم الاثنين والثلاثاء والاربعاء والخميس واسس مسجدهم ثم خرج يوم الجمعة عامدا المدينة فادركته صلاة الجمعة في بني سالم بن عوف في بطن وادلهم فحطب وصلي الجمعة فاسعوا الي ذكر الله اي امشوا واقصدوا الي الخطبة والصلاة وذروا البيع واتركوا المعاملة ذلكم اي السعي الي ذكر الله وترك البيع خير لكم من مباشرته فان نفع الاخرة اجل وابقي ان كنتم تعلمون اي الخبر والشر الحقيقيين او ان كنتم اهل العلم الجمعة فاذا قضيت الصلاة فاذا قضيت الصلاة اي اديت وفرغ منها فانتشروا في الارض لاقامة مصالحكم وابتغوا من فضل الله اي الربح فالامر للاطلاق بعد الحظر وعن ابن عباس رضي الله عنهما لم يءمروا بطلب شء من الدنيا انما هو عيادة المرضي وحضور الجناءز وزيارة اخ في الله وعن الحسن وسعيد بن المسيب طلب العلم وقيل صلاة التطوع واذكروا الله كثيرا ذكرا كثيرا او زمانا كثيرا ولا تخصوا ذكره تعالي بالصلاة لعلكم تفلحون كي تفوزوا بخير الدارين الجمعة واذا راوا تجارة واذا راوا تجارة او لهوا انفضوا اليها روي ان اهل المدينة اصابهم جوع وغلاء شديد فقدم دحية بن خليفة بتجارة من زيت الشام والنبي عليه الصلاة والسلام يخطب يوم الجمعة فقاموا اليه خشية ان يسبقوا اليه فما بقي معه عليه الصلاة والسلام الا ثمانية وقيل احد عشر وقيل اثنا عشر وقيل اربعون فقال عليه الصلاة ,False,0982IbnMuhammadAbuSucud.IrshadCaqlSalim
360777429784,3,Shamela0010273-ara1.ms3380,بن عوف واقام بها يوم الاثنين والثلاثاء الاربعاء والخميس واسس مسجدهم ثم خرج يوم الجمعة عامدا الي المدينة فادركته الصلاة في بني سالم بن عوف في بطن واد لهم وقد بنوا هناك مسجدا فخطب وصلي الجمعة فيه انظر الثعلبي ويم الجمعة سيد الايام وفي الحديث من مات يوم الجمعة كتب الله له اجر شهيد ووقي فتنة القبر فاذا نودي للصلاة فاسعوا الي ذكر الله اي امشوا واحضروا الخطبة والصلاة وذروا البيع اي اتركوا المعاملة كلها وانما خص البيع لان يوم الجمعة كان سوقا يتكاثر فيه البيع والشراء عند الزوال فقيل لهم بادروا الي تجارة الاخرة واتركوا تجارة الدنيا واسعوا الي ذكر الله الذي لا شء انفع منه ذلكم اي السعي الي ذكر الله خير لكم من البيع والشراء ان كنتم تعلمون الخير والشر الحقيقيين او ان كنتم من اهل العلم فاذا قضيت الصلاة اي اديت وفرغ منها فانتشروا في الارض امر اباحة اي اخرجوا لاقامة مصالحكم وابتغوا من فضل الله الرزق قال ابن عباس انما هي عيادة المريض وحضور الجناءز وزيارة اخ في الله ومثله في الحديث وعن الحسن طلب العلم وقيل صلاة التطوع واذكروا الله كثيرا اي ذكرا كثيرا او زمنا كثيرا ولا تخصوا ذكره بالصلاة لعلكم تفلحون اي كي تفوزوا بخير الدارين واذا راوا تجارة او لهوا انفضوا اليها روي ان اهل المدينة اصابهم جوع وغلاء شديد فقدم دحية بن خليفة بتجارة من زيت الشام والنبي صلي الله عليه وسلم يخطب يوم الجمعة فقاموا اليها خشية ان يسبقوا اليه فما بقي معه عليه السلام الا ثمانية او اثنا عشر العشرة المبشرون بالجنة وبلال وابن مسعود وقيل اربعون وهذا مبني الخلاف ,False,1224IbnCajiba.BahrMadid
360777429784,3,Shamela0001394-ara1.ms1695,ويوم الجمعة سيد الايام وفي الحديث من مات يوم الجمعة كتب اللهله اجر شهيد ووقي فتنة القبر فاسعوا فامضوا وقرء بها وقال الفراء السعي والمضي والذهاب واحد وليس المراد به السرعة في المشي الي ذكر الله اي الي الخطبة عند الجمهور وبه استدل ابو حنيفة رضي الله تعالي عنه علي ان الخطيب اذا اقتصر علي الحمد لله جاز وذروا البيع اراد الامر بترك ما يذهل عن ذكر الله من شواغل الدنيا وانما خص البيع من بينها لان يوم الجمعة يتكاثر فيه البيع بترك ما يذهب عن ذكر الله من شواغل الدنيا وانما خص البيع من بينها لان يوم الجمعة يتكار ذكر الله الذي لا شء انفع منه واربح ذورا البيع الذب نفعه يسير ذلكم اي السعي الي ذكر الله خير لكم من البيع والشراء ان كنتم تعلمون فاذا قضيت الصلاة فانتشروا في الارض وابتغوا من فضل الله واذكروا الله كثيرا لعلكم تفلحون فاذا قضيت الصلاة اي اديت فانتشروا في الارض امر اباحة وابتغوا من فضل الله الرزق او طلب العلم او عيادة المريض او زيارة اخ في الله واذكروا الله كثيرا واشكروا علي ما وفقكم لاداء فرضه لعلكم تفلحون واذا راوا تجارة او لهوا انفضوا اليها وتركوك قاءما قل ما عند الله خير من اللهو ومن التجارة والله خير الرازقين واذا راوا تجارة او لهوا انفضوا اليها تفرقوا عنك اليها وتقديره واذا راوا تجارة انفضوا اليها او لهوا انفضوا اليه فحذف احدها لدلالة المذكور عليه وانما خص التجارة لانها كانت اهم عندهم روي ان اهل المدينة اصابهم جوعه وغلاء فقد دحية بن خليفة بتجارة من زيت الشام والنبي صلي الله عليه وسلم يخطب يوم الجمعة فقاموا اليه فما بقي معه الا ثمانية او اثنا عشر فقال صلي ,False,0710IbnAhmadHafizDinNasafi.Tafsir
360777458793,3,Shamela0037458-ara1.ms4443,ليس بطلب دنيا ولكن عيادة مريض وحضور جنازة وزيارة اخ في الله اخرجه ابن جرير وعن ابن عباس قال لم يءمروا بشء من طلب الدنيا انما هو عيادة مريض وحضور جنازة وزيارة اخ في الله ,False,1307Qannawji.FathBayan
360777458793,3,Shamela0023623-ara1.ms4180,ليس لطلب دنيا ولكن عيادة مريض وحضور جنازة وزيارة اخ في الله واخرج ابن مردويه عن ابن عباس في الاية قال لم تءمروا بشء من طلب الدنيا انما هو عيادة مريض وحضور جنازة وزيارة اخ في الله ,False,1250Shawkani.FathQadir
360777458793,3,ShamAY0034054-ara1.ms4030,ليس الطلب دنبا ولكن عيادة مريض وحضور جنازة وزيارة اخ في الله واخرج ابن مردويه عن ابن عباس في الاية قال لم تءمروا بشء من طلب الدنيا انما هو عيادة مريض وحضور جنازة وزيارة اخ في الله ,False,1281IbnMuhammadShawkani.TafsirFathQadir
360777460871,3,JK000791-ara1.ms2311,الا اثنا عشر رجلا فنزلت هذه الاية اخرجه البخاري ومسلم في الصحيحين من حديث جابر بن عبد الله قاله الحسن وذلك انهم اصابهم جوع وغلاء سعر فلما سمعوا بها خرجوا اليها فقال النبي صلي الله عليه وسلم لو اتبع اخرهم اولهم التهب عليهم الوادي نارا قال المفسرون كان الذي قدم بالتجارة دحية بن خليفة الكلبي قال مقاتل وذلك قبل ان يسلم قالوا قدم بها من الشام وضرب لها طبل يءذن الناس بقدومها وهذه كانت عادتهم اذا قدمت عير قال جابر بن عبد الله كانت التجارة طعاما وقال ابو مالك كانت زيتا والمراد باللهو ضرب الطبل وانفضوا بمعني تفرقوا عنك فذهبوا اليها والضمير للتجارة وانما خصت برد الضمير اليها لانها كانت اهم اليهم هذا قول الفراء والمبرد وقال الزجاج المعني واذا راوا تجارة انفضوا اليها او لهوا انفضوا اليه فحذف خبر احدهما لان الخبر الثاني يدل علي الخبر المحذوف ,False,0597IbnJawzi.ZadMasir
360777460871,3,Shamela0021715-ara1.completed.ms03386,النبي صلي الله عليه وسلم الا اثنا عشر رجلا برفع اثنا بالالف ويجوز النصب لانه استثناء من الضمير في بقي العاءد علي المصلي فانه اذا كان كذلك يجوز الرفع والنصب علي ما لا يخفي وفي رواية خالد الطحان عند مسلم ان جابرا قال انا فيهم وله في رواية هشيم فيهم ابو بكر وعمر وروي السهيلي بسند منقطع ان الاثني عشر هم العشرة المبشرة وبلال وابن مسعود فنزلت اذا راوا تجارة او لهوا انفضوا اليها تقديره واذا راوا تجارة انفضوا اليها او لهوا انفضوا اليه فحذف احدهما لدلالة الاخر ,False,0923AhmadQastallani.IrshadSari
360777460871,3,JK007128-ara1.ms0589,النبي صلي الله عليه وسلم الا اثنا عشر رجلا فنزلت واذا راوا تجارة او لهوا انفضوا اليها وتركوك قاءما الجمعة قوله بينما نحن نصلي اي حضرنا للصلاة وكان النبي صلي الله عليه وسلم حينءذ يخطب قاءما وقد بين في هذا الحديث وكان القوم قد اصابهم جوع وغلاء سعر فقدم دحية بن خليفة قبل ان يسلم بتلك العير والعير الابل تحمل الميرة وضرب له طبل يءذن الناس وهو اللهو وهذه كانت عادتهم اذا قدمت عير وانفضوا تفرقوا فان قيل لماذا قال اليها ولم يقل اليهما فجوابه من وجهين احدهما ان التجارة كانت اهم اليهم فرد الضمير اليها هذا قول الفراء والمبرد والثاني ان المعني واذا راوا تجارة انفضوا اليها او لهوا انفضوا اليه فحذف خبر احدهما لان الخبر الثاني يدل علي المحذوف ,False,0597IbnJawzi.KashfMushkil
369367294164,3,Shamela0023578-ara1.completed.ms3159,عند احجار الزيت وهو مكان في سوق المدينة ثم يضرب بالطبل ليءذن الناس بقدومه فيخرج اليه الناس فقدم ذات جمعة وكان ذلك قبل ان يسلم ورسول الله عليه السلام قاءما علي المنبر يخطب فخرج الناس فلم يبق في المسجد الا اثنا عشر رجلا وامراة فقال النبي عليه السلام لولا هءلاء لسومت عليهم الحجارة من السماء وانزل الله سبحانه هذه الاية وقال ابن عباس في رواية الكلبي لم يبق في المسجد الا ثمانية رهط وقال ابن كيسان خرجوا الا احد عشر رجلا وامراة قال قتادة ومقاتل بلغنا انهم فعلوا ذلك ثلاث مرات وكل مرة بعير تقدم من الشام وكل ذلك يوافق يوم الجمعة ,False,0427AbuIshaqThaclabi.KashfWaBayan
369367294164,3,Shia001432Vols-ara1.msA08961,عند احجار الزيت وهو مكان في سوق المدينة ثم يضرب بالطبل ليءذن الناس بقدومه فيخرج اليه الناس ليتبايعوا معه فقدم ذات جمعة و كان ذلك قبل ان يسلم ورسول الله صلي الله عليه واله قاءم علي المنبر يخطب فخرج الناس فلم يبق في المسجد الا اثنا عشر رجلا وامراة فقال صلي الله عليه واله لولا هءلاء لسومت لهم الحجارة من السماء وانزل الله هذه الاية وقيل لم يبق في المسجد الا ثمانية رهط عن الكلبي عن ابن عباس وقيل الا احد عشر رجلا عن ابن كيسان وقيل انهم فعلوا ذلك ثلاث مرات في كل يوم مرة لعير تقدم من الشام وكل ذلك يوافق يوم الجمعة ,False,1111Majlisi.BiharAnwar
369367294164,3,JK000021-ara1.completed.ms1855,عند احجار الزيت وهو مكان في سوق المدينة وسمعوا اصواتا فخرج عامة الناس الي دحية ينظرون الي تجارته والي اللهو وتركوا رسول الله صلي الله عليه وسلم قاءما ليس معه كثير احد فبلغني والله اعلم انهم فعلوا ذلك ثلاث مرات في كل مرة بعير تقدم من الشام للتجارة وكان ذلك يوافق الجمعة ,False,0458Bayhaqi.ShucabIman
369367324351,3,Shia002382Vols-ara1.ms1728,ما يشركونه به وان يروا كسفا قطعة من السماء ساقطا يقولوا من فرط طغيانهم وعنادهم سحاب مركوم هذا سحاب تراكم بعضها علي بعض وهو جواب قولهم فاسقط علينا كسفا من السماء فذرهم حتي يلاقوا يومهم الذي فيه يصعقون قيل هو عند النفخة الاولي يوم لا يغني عنهم كيدهم شيءا في رد العذاب ولا هم ينصرون يمنعون من عذاب الله وان للذين ظلموا القمي ظلموا ال محمد صلوات الله عليهم حقهم عذابا دون ذلك اي دون عذاب الاخرة القمي قال عذاب الرجعة بالسيف ولكن اكثرهم لا يعلمون ذلك واصبر لحكم ربك بامهالهم وابقاءك في عناءهم فانك باعيننا في حفظنا وحرزنا بحيث نراك ونكلءك وجمع العين لجمع الضمير والمبالغة بكثرة اسباب الحفظ وسبح بحمد ربك حين تقوم القمي قال لصلاة الليل ومن الليل فسبحه قال صلاة الليل وادبار النجوم اذا ادبرت النجوم من اخر الليل وقرء بالفتح اي في اعقابها اذا غربت او خفيت في المجمع عنهما عليهما السلام في هذه الاية قالا ان رسول الله صلي الله عليه واله ,False,1091MuhammadMuhsinFaydKashani.TafsirSafi
369367324351,3,Shia002382Vols-ara1.ms2301,يروا كسفا من السماء ساقطا يقولوا سحاب مركوم فذرهم حتي يلقوا يومهم الذي فيه يصعقون يوم لا يغني عنهم كيدهم شيءا ولا هم ينصرون وان للذين ظلموا عذابا دون ذلك ولكن اكثرهم لا يعلمون فالذين كفروا هم المكيدون هم الذين يحيق بهم الكيد او يعود عليهم وبال كيدهم قيل وهو قتلهم يوم بدر ام لهم اله غير الله يعينهم ويحرسهم من عذابه سبحن الله عما يشركون عن اشراكهم او شركة ما يشركونه به وان يروا كسفا قطعة من السماء ساقطا يقولوا من فرط طغيانهم وعنادهم سحاب مركوم هذا سحاب تراكم بعضها علي بعض وهو جواب قولهم فاسقط علينا كسفا من السماء فذرهم حتي يلقوا يومهم الذي فيه يصعقون وقرء بفتح العين قيل هو عند النفخة الاولي يوم لا يغني عنهم كيدهم شيءا في رد العذاب ولا هم ينصرون يمنعون من عذاب الله وان للذين ظلموا القمي ظلموا ال محمد صلوات الله عليهم حقهم واصبر لحكم ربك فانك باعيننا وسبح بحمد ربك حين تقوم ومن الليل فسبحه وادبار النجوم عذابا دون ذلك اي دون عذاب الاخرة القمي قال عذاب الرجعة بالسيف ولكن اكثرهم لا يعلمون ذلك واصبر لحكم ربك بامهالهم وابقاءك في عناءهم فانك باعيننا في حفظنا وحرزنا بحيث نراك ونكلءك وجمع العين لجمع الضمير والمبالغة بكثرة اسباب الحفظ وسبح بحمد ربك حين تقوم القمي قال لصلاة الليل ومن الليل فسبحه قال صلاة الليل وادبار النجوم اذا ادبرت النجوم من اخر الليل وقرء بالفتح اي في اعقابها اذا غربت او خفيت في المجمع عنهما عليهما السلام في هذه الاية قالا ان رسول الله صلي الله عليه واله ,False,1091MuhammadMuhsinFaydKashani.TafsirSafi
