cluster,size,id,text,from_input,book
8590028946,10,Zaydiyya0000062-ara1.ms1019,انهم الهة فعبدتموها من دون الله وهم الملاءكة وقيل عيسي ومريم وعزير فلا يملكون كشف الضر عنك ولا تحويلا اي ادعوهم فلا يستطيعون ان يكشفوا عنك الضر من مرض او فقر او عذاب ولا يحولوه من واحد الي واحد ويبدلوه اولءك الذين يدعون يبتغون الي ربهم الوسيلة اولءك مبتدا والذين يدعون خبره ويبتغون خبره يعني ان الهتهم اولءك يبتغون الوسيلة وهي القربة الي الله عز وجل ايهم اقرب اي يبتغي من هو اقرب منهم وازلف الوسيلة الي الله فكيف بغير الاقرب او معني يبتغون يحرصون ايهم يكون اقرب الي الله بالطاعة وازدياد الخير والصلاح ويرجون رحمته ويخافون عذابه يعني الذين عبدتموهم يخافون ويرجون كغيرهم من عباد الله فكيف تزعمون انهم الهة من دون الله ان عذاب ربك كان محذورا اي حقيقا بان يحذره كل احد من ملك ونبي مرسل فضلا عن غيرهم وان من قرية اي ومامن اهل قرية الانحن مهلكوها قبل يوم القيامة بالموت والاستيصال اومعذبوها عذابا شديدا بالقتل وانواع العذاب وقيل الهلاك ,False,0810IbnHadi.JawharShaffaf
8590028946,10,Shamela0010273-ara1.ms1595,ضمن معني يبتغون يحرصون اي يحرصون ايهم يكون اليه تعالي اقرب يقول الحق جل جلاله قل لهم ادعوا الذين زعمتم انهم الهة تعبدونهم من دونه كالملاءكة والمسيح وعزير او كالاصنام والاوثان فلا يملكون لا يستطيعون كشف الضر عنكم كالمرض والفقر والقحط ولا تحويلا لذلك عنكم الي غيركم قال تعالي اولءك الذين يدعون انهم الهة هم في غاية الافتقار الي الله والتوسل اليه كلهم يبتغون الي ربهم الوسيلة اي التقرب بالطاعة ويحرصون ايهم اقرب الي الله من غيره فكيف يكونون الهة او اولءك الذين يدعونهم الهة يطلبون الي ربهم الوسيلة بالطاعة يطلبها ايهم اقرب اي الذي هو اقرب فكيف بغير الاقرب ويرجون رحمته ويخافون عذابه كساءر العباد فكيف يزعمون انهم الهة ان عذاب ربك كان محذورا مخوفا اي حقيقا بان يحذره كل احد حتي الرسل والملاءكة اعاذنا الله من جميعه امين الاشارة ,False,1224IbnCajiba.BahrMadid
8590028946,10,Shamela0001394-ara1.ms0869,اولءك مبتدا الذين يدعون صفة اي يدعونهم الهة او يعبدونهم والخير يبتغون الي ربهم الوسيلة يعني ان الهتهم اولءك يبتغون الوسيلة وهي القربة الي الله عز وجل ايهم بدل من واو يبتغون واي موصولة اي يبتغي من هو اقرب منهم الوسيلة الي الله فكيف بغير الاقرب او ضمن يبتغون الوسيلة معني يحرصون فكانه قيل يحرصون ايهم يكون اقرب الي الله وذلك بالطاعة وازدياد الخير ويرجون رحمته ويخافون عذابه كغيرهم من عباد الله فكيف يزعمون انهم الهة ان عذاب ربك كان محذورا حقيقا بان يحذره كل احد من ملك مقرب ونبي مرسل فضلا عن غيرهم وان من قرية الا نحن مهلكوها قبل يوم القيامة او معذبوها عذابا شديدا كان ذلك في الكتاب مسطورا وان من قرية الا نحن مهلكوها قبل يوم القيامة او معذبوها عذابا شديدا قبل الهلاك للصالحة والعذاب للطالحة كان ذلك في الكتاب في اللوح المحفوظ مسطورا مكتوبا ,False,0710IbnAhmadHafizDinNasafi.Tafsir
8590028946,10,Shia002380Vols-ara1.ms0452,الهة من دونه كالملاءكة والمسيح وعزيز فلا يملكون كشف الضر عنكم كالمرض والفقر والقحط ولا تحويلا ولا تحويل ذلك منكم الي غيركم اولءك الذين يدعون يبتغون الي ربهم الوسيلة هءلاء الالهة يبتغون الي الله القربة بالطاعة ايهم اقرب اي يبتغي من هو اقرب منهم الي الله الوسيلة فكيف بغير الاقرب ويرجون رحمته ويخافون عذابه كساير العباد فكيف يزعمون انهم الهة ان عذاب ربك كان محذورا حقيقا بان يحذره كل احد حتي الملاءكة ,False,1091MuhammadMuhsinFaydKashani.TafsirAsfa
8590028946,10,Shamela0023628-ara1.completed.ms2285,فقال الله عز وجل قل ادعوا الذين زعمتم انهم الهة من دونه فلا يملكون كشف الضر عنكم اي الجوع والقحط ولا تحويلا اي الي غيركم او تحويل الحال من العسر الي اليسر ومقصود الاية الرد علي المشركين حيث قالوا ليس لنا اهلية ان نشتغل بعبادة الله فنحن نعبد المقربين اليه وهم الملاءكة ثم انهم اتخذوا لذلك الملك الذي عبدوه تمثالا وصورة وقد اشتغلوا بعبادته فاحتج علي بطلان قولهم بهذه الاية وبين عجز الهتهم ثم قال تعالي اولءك الذين يدعون اي الذين يدعون المشركون الهة يبتغون الي ربهم الوسيلة اي القربة والدرجة العليا قال ابن عباس هم عيسي وامه وعزير والملاءكة والشمس والقمر والنجوم وقال عبد الله بن مسعود نزلت هذه الاية في نفر من العرب كانوا يعبدون نفرا من الجن فاسلم اولءك الجن ولم يعلم الانس بذلك فتمسكوا بعبادتهم فعيرهم الله وانزل هذه الاية قوله تعالي ايهم اقرب معناه ينظرون ايهم اقرب الي الله فيتوسلون به وقيل ايهم اقرب يبتغي الوسيلة الي الله ويتقرب اليه بالعمل الصالح وازدياد الخير والطاعة ويرجون رحمته اي جنته ويخافون عذابه وقيل معناه يرجون ويخافون كغيرهم من عباد الله فكيف يزعمون انهم الهة ان عذاب ربك كان محذورا اي حقيقا بان يحذره كل احد ,False,0741KhazinBaghdadi.LubabTawil
8590028946,10,Shamela0029743-ara1.ms0577,قل ادعوا الذين زعمتم انها الهة من دونه كالملاءكة وغيره فلا يملكون فلا يستطيعون كشف الضر عنكم بالكلية ولا تحويلا الي غيركم او تحويل حال من العسر الي حال اليسر نزلت حين شكي المشركون قحطهم الي رسول الله صلي الله عليه وسلم اولءك الذين يدعون يبتغون الي ربهم الوسيلة الذين صفة اولءك ويبتغون خبره اي هءلاء الذين تعبدونهم يطلبون القربة الي الله كالملاءكة وعيسي وامه وعزير والشمس والقمر ايهم اقرب بدل من فاعل يبتغون اي يطلب من هو اقرب منهم الوسيلة فكيف لغيره ويرجون رحمته ويخافون عذابه فكيف يستحقون الالوهية ان عذاب ربك كان محذورا حقيقا بان يحذر منه كل شء حتي الرسل من الملاءكة والبشر وعن ابن مسعود انها نزلت في نفر من العرب كانوا يعبدون نفرا من الجن فاسلم الجنيون والانس الذين يعبدونهم لا يشعرون باسلامهم وان من قرية الا نحن مهلكوها قبل يوم القيامة بالموت او معذبوها عذابا شديدا بانواع العذاب وعن مقاتل وغيره الاول في قرية المءمنين والثاني في الكفار كان ذلك في الكتاب اللوح المحفوظ مسطورا ,False,0905IbnCabdRahmanIjiShafici.Tafsir
8590028946,10,Shamela0006947-ara1.ms01312,قل ادعوا الذين زعمتم الاسراء انهم الهة من دونه الاسراء كالملاءكة والمسيح وعزير فلا يملكون الاسراء فلا يستطيعون كشف الضر عنكم الاسراء كالمرض والفقر والقحط ولا تحويلا الاسراء ولا تحويل ذلك منكم الي غيركم اولءك الذين يدعون يبتغون الي ربهم الوسيلة الاسراء هءلاء الالهة يبتغون الي الله القربة بالطاعة ايهم اقرب الاسراء بدل من واو يبتغون اي يبتغي من هو اقرب منهم الي الله الوسيلة فكيف بغير الاقرب ويرجون رحمته ويخافون عذابه الاسراء كساءر العباد فكيف تزعمون انهم الهة ان عذاب ربك كان محذورا الاسراء حقيقا بان يحذره كل احد حتي الرسل والملاءكة اه حدد الله ,False,1354RashidRida.Manar
34359801964,10,Shamela0023635-ara1.ms8986,الفقهية وقوله تعالي وذروا البيع قال الحسن اذا اذن المءذن يوم الجمعة لم يحل الشراء والبيع وقال عطاء اذا زالت الشمس حرم البيع والشراء وقال الفراء انما حرم البيع والشراء اذا نودي للصلاة لمكان الاجتماع ولندرك له كافة الحسنات وقوله تعالي ذلكم خير لكم اي في الاخرة ان كنتم تعلمون ما هو خير لكم واصلح وقوله تعالي فاذا قضيت الصلاة اي اذا صليتم الفريضة يوم الجمعة فانتشروا في الارض هذا صيغة الامر بمعني الاباحة ,False,0606FakhrDinRazi.MafatihGhayb
34359801964,10,Sham19Y0013231-ara1.ms4199,قوله تعالي وذروا البيع قال الحسن اذا اذن المءذن يوم الجمعة لم يحل البيع والشراء قال اصحابنا اذا جلس الامام علي المنبر يترك البيع لقوله وذروا البيع فمن باع في تلك الساعة فقد خالف الامر وبيعه منعقد لان النهي عن البيع تنزيه لقوله ذلكم خير لكم فدل ذلك علي الترغيب في ترك البيع في ذلك الوقت ولا يحتاج الي ذكر الشراء لانه بيع ايضا ولانه لا يوجد شراء من غير بيع فاذا منع البيع فقد منع الشراء قوله ان كنتم تعلمون اي ما هو خير لكم واصلح قوله فاذا قضيت الصلاة ,False,0468IbnAhmadWahidiNaysaburi.TafsirBasit
34359801964,10,Shamela0037458-ara1.ms4442,ذلكم اي السعي الي ذكر الله وترك البيع خير لكم من البيع والتكسب في ذلك الوقت لما في الامتثال من الاجر والجزاء وفي عدمه من عدم ذلك اذا لم يكن موجبا للعقوبة وتمسك بهذا الشافعية في ان البيع وقت اذان الخطبة الي انقضاء الصلاة صحيح مع الحرمة قال في الكشاف عامة العلماء علي ان ذلك لا يوجب الفساد لان البيع لم يحرم لعينه بل لما فيه من التشاغل عن الصلاة فهو كالصلاة في الارض المغصوبة وقال مالك ما وقع في الوقت المذكور يفسخ وكذا ساءر العقود ان كنتم تعلمون اي ان كنتم من اهل العلم فانه لا يخفي عليكم ان ذلكم خير لكم ,False,1307Qannawji.FathBayan
34359801964,10,Shamela0023623-ara1.ms4178,فاعملوا علي المضي الي ذكر الله واشتغلوا باسبابه من الغسل والوضوء والتوجه اليه ويءيد هذا القول قول الشاعر اسعي علي جل بني مالك كل امرء في شانه ساعي وذروا البيع اي اتركوا المعاملة به ويلحق به ساءر المعاملات قال الحسن اذا اذن المءذن يوم الجمعة لم يحل الشراء والبيع والاشارة بقوله ذلكم الي السعي الي ذكر الله وترك البيع وهو مبتدا وخبره خير لكم اي خير لكم من فعل البيع وترك السعي لما في الامتثال من الاجر والجزاء وفي عدمه من عدم ذلك اذا لم يكن موجبا للعقوبة ان كنتم تعلمون اي ان كنتم من اهل العلم فانه لا يخفي عليكم ان ذلكم خير لكم فاذا قضيت الصلاة اي اذا فعلتم الصلاة واديتموها وفرغتم منها فانتشروا في الارض ,False,1250Shawkani.FathQadir
34359801964,10,ShamAY0034054-ara1.ms4027,المءذن يوم الجمعة لم يحل الشراء والبيع والاشارة بقوله ذلكم الي السعي الي ذكر الله وترك البيع وهو مبتدا وخبره خير لكم اي خير لكم من فعل البيع وترك السعي لما في الامتثال من الاجر والجزاء وفي عدمه من عدم ذلك اذا لم يكن موجبا للعقوبة ان كنتم تعلمون اي ان كنتم من اهل العلم فانه لا يخفي عليكم ان ,False,1281IbnMuhammadShawkani.TafsirFathQadir
34359801964,10,Tafsir09084-ara1.ms2462,الفروع وقوله تعالي وذروا البيع اي اسعوا الي ذكر الله واتركوا البيع اذا نودي للصلاة ولهذا اتفق العلماء رضي الله عنهم علي تحريم البيع بعد النداء الثاني وقوله تعالي ذلكم خير لكم ان كنتم تعلمون اي ترككم البيع واقبالكم الي ذكر الله والي الصلاة خير لكم اي في الدنيا والاخرة ان كنتم تعلمون وقوله تعالي فاذا قضيت الصلاة اي فرغ منها فانتشروا في الارض ,False,1450MuhammadCaliSabuni.MukhtasarTafsirIbnKathir
34359801964,10,Tafsir02091-ara1.ms2101,قوله تعالي وذروا البيع قال الحسن اذا اذن المءذن يوم الجمعة لم يحل الشراء ولا البيع فمن باع تلك الساعة فقد خالف الامر وبيعه منعقد لانه نهي تنزيه لقوله تعالي ذلكم خير لكم وهذا علي الترغيب في ترك البيع ان كنتم تعلمون ما هو خير لكم واصلح ,False,0360Tabarani.TafsirKabir
34359801964,10,Shamela0021821-ara1.ms1862,فاعملوا علي المضي الي ذكر الله من التفرغ له والاشتغال بالطهارة والغسل والتوجه اليه بالقصد والنية وذروا البيع الجمعة قال الحسن اذا اذن المءذن يوم الجمعة لم يحل الشراء والبيع قال اصحابنا من باع في تلك الساعة فقد خالف الامر وبيعه منعقد لان هذا نهي تنزيه لقوله ذلكم خير لكم الجمعة فدل هذا علي الترغيب في ترك البيع وقوله ان كنتم تعلمون الجمعة اي ما هو خير لكم واصلح فاذا قضيت الصلاة الجمعة فاذا صليتم الفريضة وفرغتم من الصلاة فانتشروا في الارض الجمعة هذا امر اباحة ,False,0468IbnAhmadWahidiNaysaburi.WasitFiTafsir
34359801964,10,Shamela0009759-ara1.ms327,المءذن يوم الجمعة لم يحل الشراء والبيع والاشارة بقوله ذلكم الي السعي الي ذكر الله وترك البيع وهو مبتدا وخبره خير لكم لما في الامتثال من الاجر والجزاء وفي عدمه من عدم ذلك اذا لم يكن موجبا للعقوبة ان كنتم تعلمون اي ان كنتم من اهل العلم فانه لا يخفي عليكم ان ذلكم خير لكم ,False,1307Qannawji.NaylMaram
34359801964,10,Shamela0021819-ara1.ms87,وذروا البيع قال الحسن اذا اذن المءذن يوم الجمعة لم يحل الشراء والبيع قال اصحابنا من باع في تلك الساعة فقد خالف الامر وبيعه منعقد لان هذا نهي تنزيه فدل هذا علي ,False,0563AbuCalaKirmani.MafatihAghani
34359838024,10,Shia002406Vols-ara1.ms5656,غمرهم وقوله ولهم اعمال من دون ذلك الخ اي من غير ما وصفناه من حال المءمنين وهو كناية عن ان لهم شاغلا يشغلهم عن هذه الخيرات والاعمال الصالحة وهو الاعمال الرديءة الخبيثة التي هم لها عاملون والمعني بل الكفار في غفلة شديدة او جهل شديد عن هذا الذي وصفنا به المءمنين ولهم اعمال رديءة خبيثة من دون ذلك هم لها عاملون في شاغلتهم ومانعتهم قوله تعالي حتي اذا اخذنا مترفيهم بالعذاب اذا هم يجارون الجءار بضم الجيم صوت الوحش كالظباء ونحوها عند الفزع كني به عن رفعهم الصوت بالاستغاثة والتضرع وقيل المراد به ضجتهم وجزعهم والايات التالية تءيد المعني الاول وانما جعل مترفيهم متعلق العذاب لان الكلام فيمن ذكره قبلا بقوله ايحسبون انما نمدهم به من مال وبنين وهم الرءساء المتنعمون منهم وغيرهم تابعون لهم قوله تعالي لا تجاروا اليوم انكم منا لا تنصرون العدول عن سياق الغيبة الي الخطاب لتشديد التوبيخ والتقريع ولقطع طمعهم في النجاة بسبب الاستغاثة واي رجاء وامل لهم فيها فان اخبار الوساءط انهم لا ينصرون لدعاء او شفاعة لا يقطع طمعهم في النصر كما يقطعه اخبار من اليه النصر نفسه قوله تعالي قد كانت اياتي تتلي عليكم ,False,1412SayyidTabatabai.TafsirMizan
34359838024,10,Shamela0023578-ara1.completed.ms2113,وهم لا يظلمون يعني يوفون جزاء اعمالهم ولا ينقص من حسناتهم ولا يزاد علي سيءاتهم ثم ذكر الكفار فقال عز من قاءل بل قلوبهم في غمرة عمي وغفلة من هذا القران ولهم اعمال خبيثة لا يرضاها الله من المعاصي والخطايا من دون ذلك يعني من دون اعمال المءمنين التي ذكرها الله سبحانه قيل وهي قوله ان الذين هم من خشية ربهم مشفقون هم لها عاملون لا بد لهم من ان يعملوها فيدخلوا بها النار لما سبق لهم من الشقاوة حتي اذا اخذنا مترفيهم يعني اغنياءهم ورءساءهم بالعذاب قال ابن عباس بالسيوف يوم بدر ,False,0427AbuIshaqThaclabi.KashfWaBayan
34359838024,10,JK006476-ara1.ms1098,بل قلوبهم في قوله تعالي بل قلوبهم في غمرة من هذا اي في غطاء يقال فلان غمره الماء اي غطاه وقوله ولهم اعمال من دون ذلك هم لها عاملون فيه قولان ان للكفار اعمالا خبيثة محكومة عليهم سوي ما عملوا هم لها عاملون هذا قول مجاهد وجماعة وقال قتادة الاية تنصرف الي اصحاب الطاعات ومعناه ان المءمنين لهم اعمال سوي ما عملوا من الخير هم لها عاملون والقول الاول اظهر حتي اذا اخذنا مترفيهم بالعذاب اذا هم يجارون لا تجاروا اليوم انكم منا لا تنصرون قد كانت اياتي تتلي عليكم فكنتم علي اعقابكم تنكصون مستكبرين به سامرا تهجرون المءمنون حتي اذا اخذنا قوله تعالي حتي اذا اخذنا مترفيهم بالعذاب قد بينا معني المترف وقوله بالعذاب وهو السيف يوم بدر ويقال هو القحط الذي اصابهم بدعاء الني وقوله اذا هم يجارون اي يصيحون ويستغيثون المءمنون لا تجاروا اليوم قوله تعالي لا تجاروا اليوم لا تصيحوا اليوم والجءار هو رفع الصوت وقوله انكم منا لا تنصرون اي ليس احد يمنعنا من عذابكم وقيل لا تنصرون لا ترزقون يقال ارض منصورة اي ممطورة المءمنون قد كانت اياتي قوله تعالي قد كانت اياتي تتلي عليكم ,False,0489IbnMuhammadSamcani.TafsirQuran
34359838024,10,Sham19Y0147312-ara1.ms1449,المحل ولا نكلف نفسا الا وسعها ولدينا كتاب ينطق بالحق وهم لا يظلمون بل قلوبهم في غمرة من هذا ولهم اعمال من دون ذلك هم لها عاملون قوله عز وجل بل قلوبهم في غمرة من هذا اي بل قلوب الكفرة في غفلة وقيل في غطاء من هذا اي من القران عن مجاهد وقيل مما عليه هءلاء الموصوفون من المءمنين قال قتادة وصف اهل البر ثم وصف علي اثرهم اهل الكفر وقوله ولهم اعمال من دون ذلك ولهم اعمال خبيثة من دون اعمال المءمنين وقيل من دون الحق وقيل من دون ما هم عليه لا بد ان يعملوها وقيل الضمير في قلوبهم للمءمنين وقوله في غمرة من هذا اي هي مغمورة بالاشفاق مع هذه الافعال الحسنة ولهم وللمءمنين اعمال من دون ذلك اي اعمال صالحة وهي النوافل دون الفراءض هم لها عاملون ثابتون عليها مقيمون حتي اذا اخذنا مترفيهم بالعذاب اذا هم يجارون لا تجاروا اليوم انكم منا لا تنصرون قد كانت اياتي تتلي عليكم فكنتم علي اعقابكم تنكصون مستكبرين به سامرا تهجرون وقوله حتي اذا اخذنا مترفيهم حتي هذه هي التي يبتدا بعدها الكلام والكلام الجملة الشرطية وقوله اذا هم يجارون اذا هذه هي المكانية وقد ذكر حكمها في غير موضع والعامل في اذا الاولي معني قوله اذا هم يجارون كانه قيل جاءروا والجءار رفع الصوت ,False,0643MuntajibHamadhani.FaridFiIcrab
